      -----------------------------------------------------------      
     |                   =====================                   |     
     |                           x T B                           |     
     |                   =====================                   |     
     |                         S. Grimme                         |     
     |          Mulliken Center for Theoretical Chemistry        |     
     |                    University of Bonn                     |     
     |                Version 6.2 RC2 (SAW190805)                |     
      -----------------------------------------------------------      

   This program is distributed in the hope that it will be useful,
   but WITHOUT ANY WARRANTY; without even the implied warranty of
   MERCHANTABILITY or FITNESS FOR A PARTICULAR PURPOSE.
   
   FOR NON-COMMERCIAL, ACADEMIA USE ONLY.
   
   Cite this work as:
   * S. Grimme, C. Bannwarth, P. Shushkov, J. Chem. Theory Comput., 2017,
     13, 1989-2009. DOI: 10.1021/acs.jctc.7b00118
   * C. Bannwarth, S. Ehlert and S. Grimme., J. Chem. Theory Comput., 2019,
     15, 1652-1671. DOI: 10.1021/acs.jctc.8b01176
   * P. Pracht, E. Caldeweyher, S. Ehlert, S. Grimme, ChemRxiv, 2019, preprint.
     DOI: 10.26434/chemrxiv.8326202.v1
   
   for DFT-D4:
   * E. Caldeweyher, C. Bannwarth and S. Grimme, J. Chem. Phys., 2017,
     147, 034112. DOI: 10.1063/1.4993215
   * E. Caldeweyher, S. Ehlert, A. Hansen, H. Neugebauer, S. Spicher,
     C. Bannwarth and S. Grimme, J. Chem. Phys., 2019, 150, 154122.
     DOI: 10.1063/1.5090222
   
   for sTDA-xTB:
   * S. Grimme and C. Bannwarth, J. Chem. Phys., 2016, 145, 054103.
     DOI: 10.1063/1.4959605
   
   in the mass-spec context:
   * V. Asgeirsson, C. Bauer and S. Grimme, Chem. Sci., 2017, 8, 4879.
     DOI: 10.1039/c7sc00601b
   
   for metadynamics refer to:
   * S. Grimme, J. Chem. Theory Comput., 2019, 155, 2847-2862
     DOI: 10.1021/acs.jctc.9b00143
   
   with help from (in alphabetical order)
   C. Bannwarth, F. Bohle, G. Brandenburg, E. Caldeweyher, M. Checinski,
   S. Dohm, S. Ehlert, S. Ehrlich, F. März, H. Neugebauer, J. Pisarek,
   P. Pracht, P. Shushkov, and S. Spicher.
   
 * started run on 2021/12/02 at 16:18:42.077     

           -------------------------------------------------
          |                Calculation Setup                |
           -------------------------------------------------

          program call               : /ihome/ghutchison/geoffh/xtb/xtb 2T2Se-F.xyz --vipea
          hostname                   : smp-n128
          coordinate file            : 2T2Se-F.xyz
          omp threads                :                     1
          number of atoms            :                    82
          number of electrons        :                   290
          charge                     :                     0
          spin                       :                   0.0
          first test random number   :      0.43126125338357


########################################################################
# WARNING! Please study the warnings concerning your input carefully
#  - XTBPATH is not set, using XTBHOME instead
########################################################################

           ------------------------------------------------- 
          |                 I P E A - x T B                 |
          |  Ionisation Potentials and Electron Affinities  |
           ------------------------------------------------- 
             KAB for M(3d)-M(3d) :                1.1000
             KAB for M(4d)-M(4d) :                1.2000
             KAB for M(5d)-M(5d) :                1.2000
             k(s)                :                2.1500
             k(p)                :                2.3000
             k(d)                :                2.0000
             k(f)                :                0.0000
             kEN (H0ij)          :                0.7000
             D3 a1               :                0.6300
             D3 a2               :                5.0000
             D3 s6               :                1.0000
             D3 s8               :                2.4000
             D3 s9               :                0.0000
             alphaj              :                1.0000
             XBdamp              :                0.4400
             XBrad               :                1.3000
             kcnsh               :      1.0000   -0.3000   -0.5000    0.5000

  Z AO/shell   Hii/eV     exponent
  1     Thu Sep 22 23:34:11 CEST 2016   EN: 2.200 GAM: 0.405  GM3: 0.1500
     1s    -10.521941    1.306199
     2s     -3.560151    0.398421
  6     Thu Sep 22 23:34:11 CEST 2016   EN: 2.550 GAM: 0.640  GM3: 0.1500
     2s    -15.968100    1.979793
     2p     -9.777107    1.850537
     3S     -3.366990    0.633095
  7     Thu Sep 22 23:34:11 CEST 2016   EN: 3.040 GAM: 0.493  GM3:-0.1000
     2s    -24.040776    2.126160
     2p    -14.426520    2.068425
     3S     -5.882278    0.671040
  8     Thu Sep 22 23:34:11 CEST 2016   EN: 3.440 GAM: 0.717  GM3:-0.2000
     2s    -26.695120    2.575264
     2p    -16.014457    2.159448
     3S     -6.622058    0.958679
  9     Tue Jan 17 20:22:52 CET 2017    EN: 3.980 GAM: 0.574  GM3: 0.2000
     2s    -27.565998    2.304073
     2p    -17.439238    2.314354
     3S     -6.120500    0.570243
 16     Tue Jan 17 20:57:36 CET 2017    EN: 2.580 GAM: 0.455  GM3: 0.1020
     3s    -24.488821    2.492075
     3p    -12.136640    1.997904
     3d     -1.796070    1.747541
 34     Mon Jan 23 10:29:23 CET 2017    EN: 2.550 GAM: 0.546  GM3: 0.1799
     4s    -23.000000    2.998140
     4p    -11.353754    2.073392
     4d     -0.978922    1.745074

           ------------------------------------------------- 
          |        Self-Consistent Charge Iterations        |
           ------------------------------------------------- 

          ...................................................
          :                      SETUP                      :
          :.................................................:
          :  # basis functions                 364          :
          :  # atomic orbitals                 360          :
          :  # shells                          224          :
          :  # electrons                       290          :
          :  # halogen bonds                     0          :
          :  max. iterations                   250          :
          :  Hamiltonian                  GFN1-xTB          :
          :  restarted?                      false          :
          :  GBSA solvation                  false          :
          :  PC potential                    false          :
          :  electronic temp.          300.0000000     K    :
          :  accuracy                    1.0000000          :
          :  -> integral cutoff          0.2500000E+02      :
          :  -> integral neglect         0.1000000E-07      :
          :  -> SCF convergence          0.1000000E-05 Eh   :
          :  -> wf. convergence          0.2000000E-04 e    :
          :  Broyden damping             0.4000000          :
          ...................................................

 iter      E             dE          RMSdq      gap      omega  full diag
   1   -177.6260653 -0.177626E+03  0.105E+01    0.40       0.0  T
   2   -172.7239946  0.490207E+01  0.757E+00    0.08       1.0  T
   3   -130.5257416  0.421983E+02  0.953E+00    0.17       1.0  T
   4   -118.8337386  0.116920E+02  0.894E+00    0.08       1.0  T
   5   -176.0742126 -0.572405E+02  0.395E+00    0.12       1.0  T
   6   -181.7916124 -0.571740E+01  0.211E+00    0.52       1.0  T
   7   -181.9375610 -0.145949E+00  0.165E+00    0.73       1.0  T
   8   -181.9317860  0.577499E-02  0.141E+00    0.45       1.0  T
   9   -181.9009945  0.307916E-01  0.953E-01    0.17       1.0  T
  10   -182.0566503 -0.155656E+00  0.643E-01    0.36       1.0  T
  11   -182.0380376  0.186127E-01  0.431E-01    0.20       1.0  T
  12   -182.1084463 -0.704087E-01  0.326E-01    0.32       1.0  T
  13   -182.1272587 -0.188124E-01  0.246E-01    0.42       1.0  T
  14   -182.1424122 -0.151535E-01  0.145E-01    0.57       1.0  T
  15   -182.1476180 -0.520583E-02  0.808E-02    0.67       1.0  T
  16   -182.1488311 -0.121302E-02  0.535E-02    0.71       1.0  T
  17   -182.1491833 -0.352190E-03  0.421E-02    0.74       1.0  T
  18   -182.1493049 -0.121633E-03  0.283E-02    0.74       1.0  T
  19   -182.1493609 -0.560460E-04  0.194E-02    0.74       1.0  T
  20   -182.1493966 -0.356700E-04  0.136E-02    0.75       1.0  T
  21   -182.1494241 -0.275338E-04  0.102E-02    0.75       1.1  T
  22   -182.1494445 -0.203457E-04  0.772E-03    0.76       1.4  T
  23   -182.1494604 -0.158956E-04  0.573E-03    0.77       1.9  T
  24   -182.1494694 -0.899616E-05  0.415E-03    0.78       2.7  T
  25   -182.1494748 -0.544121E-05  0.177E-03    0.79       6.2  T
  26   -182.1494753 -0.507425E-06  0.123E-03    0.79       9.0  T
  27   -182.1494760 -0.652625E-06  0.371E-04    0.79      29.7  T
  28   -182.1494760 -0.620325E-07  0.149E-04    0.79      74.0  T
  29   -182.1494760  0.181626E-08  0.120E-04    0.79      91.8  T

   *** convergence criteria satisfied after 29 iterations ***

         #    Occupation            Energy/Eh            Energy/eV
      -------------------------------------------------------------
         1        2.0000           -1.0591274             -28.8203
       ...           ...                  ...                  ...
       139        2.0000           -0.4011391             -10.9155
       140        2.0000           -0.3925302             -10.6813
       141        2.0000           -0.3713771             -10.1057
       142        2.0000           -0.3626303              -9.8677
       143        2.0000           -0.3517305              -9.5711
       144        2.0000           -0.3432217              -9.3395
       145        2.0000           -0.3403128              -9.2604 (HOMO)
       146        0.0000           -0.3112254              -8.4689 (LUMO)
       147                         -0.3010743              -8.1926
       148                         -0.2879874              -7.8365
       149                         -0.2795496              -7.6069
       150                         -0.2787342              -7.5847
       ...                                ...                  ...
       360                        498.5344108           13565.8118
      -------------------------------------------------------------
                  HL-Gap            0.0290874 Eh            0.7915 eV
             Fermi-level           -0.3257474 Eh           -8.8640 eV

 SCC (total)                   0 d,  0 h,  0 min,  1.331 sec
 SCC setup                      ...        0 min,  0.003 sec (  0.214%)
 Dispersion                     ...        0 min,  0.000 sec (  0.016%)
 integral evaluation            ...        0 min,  0.592 sec ( 44.497%)
 zeroth order Hamiltonian       ...        0 min,  0.002 sec (  0.176%)
 iterations                     ...        0 min,  0.552 sec ( 41.489%)
 molecular gradient             ...        0 min,  0.178 sec ( 13.410%)
 printout                       ...        0 min,  0.003 sec (  0.194%)

         :::::::::::::::::::::::::::::::::::::::::::::::::::::
         ::                     SUMMARY                     ::
         :::::::::::::::::::::::::::::::::::::::::::::::::::::
         :: total energy            -178.997828508654 Eh    ::
         :: gradient norm              0.284789591606 Eh/a0 ::
         :: HOMO-LUMO gap              0.791508304167 eV    ::
         ::.................................................::
         :: SCC energy              -182.149476036751 Eh    ::
         :: -> electrostatic           0.439971690990 Eh    ::
         :: repulsion energy           3.224165094452 Eh    ::
         :: dispersion energy         -0.072517566355 Eh    ::
         :: halogen bond corr.         0.000000000000 Eh    ::
         :: add. restraining           0.000000000000 Eh    ::
         :::::::::::::::::::::::::::::::::::::::::::::::::::::

           ------------------------------------------------- 
          |        vertical delta SCC IP calculation        |
           ------------------------------------------------- 

          ...................................................
          :                      SETUP                      :
          :.................................................:
          :  # basis functions                 364          :
          :  # atomic orbitals                 360          :
          :  # shells                          224          :
          :  # electrons                       289          :
          :  # halogen bonds                     0          :
          :  max. iterations                   250          :
          :  Hamiltonian                  GFN1-xTB          :
          :  restarted?                       true          :
          :  GBSA solvation                  false          :
          :  PC potential                    false          :
          :  electronic temp.          300.0000000     K    :
          :  accuracy                    1.0000000          :
          :  -> integral cutoff          0.2500000E+02      :
          :  -> integral neglect         0.1000000E-07      :
          :  -> SCF convergence          0.1000000E-05 Eh   :
          :  -> wf. convergence          0.2000000E-04 e    :
          :  Broyden damping             0.4000000          :
          ...................................................

 iter      E             dE          RMSdq      gap      omega  full diag
   1   -181.6991011 -0.181699E+03  0.557E-01    0.79       0.0  T
   2   -181.6738072  0.252939E-01  0.589E-01    1.03       1.0  T
   3   -181.6957441 -0.219370E-01  0.444E-01    0.77       1.0  T
   4   -181.7430993 -0.473551E-01  0.269E-01    1.10       1.0  T
   5   -181.7607724 -0.176732E-01  0.138E-01    1.06       1.0  T
   6   -181.7624119 -0.163950E-02  0.100E-01    1.07       1.0  T
   7   -181.7570568  0.535509E-02  0.169E-01    1.02       1.0  T
   8   -181.7613443 -0.428747E-02  0.134E-01    1.05       1.0  T
   9   -181.7647024 -0.335809E-02  0.460E-02    1.06       1.0  T
  10   -181.7651205 -0.418069E-03  0.102E-02    1.06       1.1  T
  11   -181.7651254 -0.495583E-05  0.624E-03    1.05       1.8  T
  12   -181.7651350 -0.961634E-05  0.475E-03    1.06       2.3  T
  13   -181.7651404 -0.534709E-05  0.186E-03    1.06       6.0  T
  14   -181.7651416 -0.119827E-05  0.103E-03    1.06      10.7  T
  15   -181.7651418 -0.250622E-06  0.353E-04    1.06      31.3  T
  16   -181.7651419 -0.470879E-07  0.983E-05    1.06     112.3  T
  17   -181.7651419 -0.112925E-08  0.422E-05    1.06     261.8  T

   *** convergence criteria satisfied after 17 iterations ***

         #    Occupation            Energy/Eh            Energy/eV
      -------------------------------------------------------------
         1        2.0000           -1.1212291             -30.5102
       ...           ...                  ...                  ...
       139        2.0000           -0.4647229             -12.6458
       140        2.0000           -0.4601529             -12.5214
       141        2.0000           -0.4498673             -12.2415
       142        2.0000           -0.4467579             -12.1569
       143        1.9943           -0.4309781             -11.7275
       144        1.7148           -0.4269488             -11.6179
       145        1.2909           -0.4252296             -11.5711 (HOMO)
       146                         -0.3864094             -10.5147 (LUMO)
       147                         -0.3710473             -10.0967
       148                         -0.3617941              -9.8449
       149                         -0.3584127              -9.7529
       150                         -0.3468232              -9.4375
       ...                                ...                  ...
       360                        498.4715358           13564.1009
      -------------------------------------------------------------
                  HL-Gap            0.0388202 Eh            1.0564 eV
             Fermi-level           -0.4159113 Eh          -11.3175 eV

 SCC (total)                   0 d,  0 h,  0 min,  1.105 sec
 SCC setup                      ...        0 min,  0.003 sec (  0.245%)
 Dispersion                     ...        0 min,  0.000 sec (  0.012%)
 integral evaluation            ...        0 min,  0.595 sec ( 53.872%)
 zeroth order Hamiltonian       ...        0 min,  0.002 sec (  0.191%)
 iterations                     ...        0 min,  0.323 sec ( 29.195%)
 molecular gradient             ...        0 min,  0.179 sec ( 16.193%)
 printout                       ...        0 min,  0.003 sec (  0.287%)

         :::::::::::::::::::::::::::::::::::::::::::::::::::::
         ::                     SUMMARY                     ::
         :::::::::::::::::::::::::::::::::::::::::::::::::::::
         :: total energy            -178.613494361689 Eh    ::
         :: gradient norm              0.285898297295 Eh/a0 ::
         :: HOMO-LUMO gap              1.056350308497 eV    ::
         ::.................................................::
         :: SCC energy              -181.765141889786 Eh    ::
         :: -> electrostatic           0.481283373815 Eh    ::
         :: repulsion energy           3.224165094452 Eh    ::
         :: dispersion energy         -0.072517566355 Eh    ::
         :: halogen bond corr.         0.000000000000 Eh    ::
         :: add. restraining           0.000000000000 Eh    ::
         :::::::::::::::::::::::::::::::::::::::::::::::::::::

------------------------------------------------------------------------
empirical IP shift (eV):    4.8455
delta SCC IP (eV):    5.6128
------------------------------------------------------------------------
           ------------------------------------------------- 
          |        vertical delta SCC EA calculation        |
           ------------------------------------------------- 

          ...................................................
          :                      SETUP                      :
          :.................................................:
          :  # basis functions                 364          :
          :  # atomic orbitals                 360          :
          :  # shells                          224          :
          :  # electrons                       291          :
          :  # halogen bonds                     0          :
          :  max. iterations                   250          :
          :  Hamiltonian                  GFN1-xTB          :
          :  restarted?                       true          :
          :  GBSA solvation                  false          :
          :  PC potential                    false          :
          :  electronic temp.          300.0000000     K    :
          :  accuracy                    1.0000000          :
          :  -> integral cutoff          0.2500000E+02      :
          :  -> integral neglect         0.1000000E-07      :
          :  -> SCF convergence          0.1000000E-05 Eh   :
          :  -> wf. convergence          0.2000000E-04 e    :
          :  Broyden damping             0.4000000          :
          ...................................................

 iter      E             dE          RMSdq      gap      omega  full diag
   1   -182.3765190 -0.182377E+03  0.405E-01    0.42       0.0  T
   2   -182.3341243  0.423946E-01  0.500E-01    0.37       1.0  T
   3   -182.4076531 -0.735287E-01  0.251E-01    0.28       1.0  T
   4   -182.4099030 -0.224991E-02  0.183E-01    0.20       1.0  T
   5   -182.4075978  0.230520E-02  0.183E-01    0.26       1.0  T
   6   -182.4209276 -0.133298E-01  0.503E-02    0.19       1.0  T
   7   -182.4214887 -0.561054E-03  0.261E-02    0.18       1.0  T
   8   -182.4217211 -0.232402E-03  0.967E-03    0.18       1.1  T
   9   -182.4217430 -0.218886E-04  0.489E-03    0.18       2.3  T
  10   -182.4217474 -0.439598E-05  0.196E-03    0.18       5.6  T
  11   -182.4217470  0.340211E-06  0.152E-03    0.18       7.3  T
  12   -182.4217477 -0.717527E-06  0.434E-04    0.18      25.4  T
  13   -182.4217477 -0.124824E-07  0.226E-04    0.18      48.8  T
  14   -182.4217478 -0.131160E-07  0.666E-05    0.18     165.8  T
  15   -182.4217478 -0.745501E-09  0.312E-05    0.18     354.4  T

   *** convergence criteria satisfied after 15 iterations ***

         #    Occupation            Energy/Eh            Energy/eV
      -------------------------------------------------------------
         1        2.0000           -0.9923345             -27.0028
       ...           ...                  ...                  ...
       140        2.0000           -0.3198545              -8.7037
       141        2.0000           -0.3004200              -8.1748
       142        2.0000           -0.2967695              -8.0755
       143        2.0000           -0.2813053              -7.6547
       144        2.0000           -0.2747033              -7.4751
       145        2.0000           -0.2656715              -7.2293
       146        0.9706           -0.2344941              -6.3809 (HOMO)
       147        0.0294           -0.2278468              -6.2000 (LUMO)
       148        0.0000           -0.2184322              -5.9438
       149                         -0.2065981              -5.6218
       150                         -0.2042457              -5.5578
       151                         -0.1819840              -4.9520
       ...                                ...                  ...
       360                        498.6044609           13567.7180
      -------------------------------------------------------------
                  HL-Gap            0.0066473 Eh            0.1809 eV
             Fermi-level           -0.2406268 Eh           -6.5478 eV

 SCC (total)                   0 d,  0 h,  0 min,  1.059 sec
 SCC setup                      ...        0 min,  0.003 sec (  0.263%)
 Dispersion                     ...        0 min,  0.000 sec (  0.019%)
 integral evaluation            ...        0 min,  0.591 sec ( 55.747%)
 zeroth order Hamiltonian       ...        0 min,  0.002 sec (  0.218%)
 iterations                     ...        0 min,  0.282 sec ( 26.610%)
 molecular gradient             ...        0 min,  0.179 sec ( 16.893%)
 printout                       ...        0 min,  0.003 sec (  0.245%)

         :::::::::::::::::::::::::::::::::::::::::::::::::::::
         ::                     SUMMARY                     ::
         :::::::::::::::::::::::::::::::::::::::::::::::::::::
         :: total energy            -179.270100233056 Eh    ::
         :: gradient norm              0.296169077682 Eh/a0 ::
         :: HOMO-LUMO gap              0.180881644300 eV    ::
         ::.................................................::
         :: SCC energy              -182.421747761153 Eh    ::
         :: -> electrostatic           0.475733599513 Eh    ::
         :: repulsion energy           3.224165094452 Eh    ::
         :: dispersion energy         -0.072517566355 Eh    ::
         :: halogen bond corr.         0.000000000000 Eh    ::
         :: add. restraining           0.000000000000 Eh    ::
         :::::::::::::::::::::::::::::::::::::::::::::::::::::

------------------------------------------------------------------------
empirical EA shift (eV):    4.8455
delta SCC EA (eV):    2.5634
------------------------------------------------------------------------
           -------------------------------------------------
          |                Property Printout                |
           -------------------------------------------------

    * Orbital Energies and Occupations

         #    Occupation            Energy/Eh            Energy/eV
      -------------------------------------------------------------
         1        2.0000           -0.9923345             -27.0028
       ...           ...                  ...                  ...
       134        2.0000           -0.3511371              -9.5549
       135        2.0000           -0.3488087              -9.4916
       136        2.0000           -0.3415351              -9.2936
       137        2.0000           -0.3411766              -9.2839
       138        2.0000           -0.3340388              -9.0897
       139        2.0000           -0.3318812              -9.0309
       140        2.0000           -0.3198545              -8.7037
       141        2.0000           -0.3004200              -8.1748
       142        2.0000           -0.2967695              -8.0755
       143        2.0000           -0.2813053              -7.6547
       144        2.0000           -0.2747033              -7.4751
       145        2.0000           -0.2656715              -7.2293
       146        0.9706           -0.2344941              -6.3809 (HOMO)
       147        0.0294           -0.2278468              -6.2000 (LUMO)
       148        0.0000           -0.2184322              -5.9438
       149                         -0.2065981              -5.6218
       150                         -0.2042457              -5.5578
       151                         -0.1819840              -4.9520
       152                         -0.1680814              -4.5737
       153                         -0.1543839              -4.2010
       154                         -0.1513536              -4.1185
       155                         -0.1482114              -4.0330
       156                         -0.1424482              -3.8762
       157                         -0.1399998              -3.8096
       ...                                ...                  ...
       360                        498.6044609           13567.7180
      -------------------------------------------------------------
                  HL-Gap            0.0066473 Eh            0.1809 eV
             Fermi-level           -0.2406268 Eh           -6.5478 eV

  Mulliken/CM5 charges        n(s)   n(p)   n(d)
     1 C  -0.38659 -0.43552   1.106  2.508  0.000
     2 C  -0.27746 -0.27954   1.146  2.577  0.000
     3 C  -0.51123 -0.47683   1.164  2.325  0.000
     4 C   0.12487  0.12323   1.063  3.062  0.000
     5 C   0.01984  0.01676   1.065  2.955  0.000
     6 C   0.12982  0.12923   1.048  3.082  0.000
     7 C   0.02518 -0.02210   1.071  2.954  0.000
     8 C  -0.10341 -0.08668   1.130  2.766  0.000
     9 C  -0.11024 -0.09366   1.143  2.746  0.000
    10 C   0.01990 -0.02736   1.064  2.955  0.000
    11 O   0.46480  0.41525   1.592  4.873  0.000
    12 C   0.03336  0.03961   1.007  3.027  0.000
    13 C  -0.08895  0.02892   1.199  2.712  0.000
    14 C  -0.09241  0.02683   1.202  2.706  0.000
    15 F   0.17534  0.15204   1.699  5.476  0.000
    16 F   0.17760  0.15453   1.696  5.482  0.000
    17 N   0.31748  0.18725   1.533  3.784  0.000
    18 N   0.31716  0.18669   1.520  3.797  0.000
    19 C   0.12171  0.10925   1.107  3.015  0.000
    20 C   0.05665  0.00218   1.076  2.980  0.000
    21 C   0.05255 -0.00039   1.071  2.981  0.000
    22 C   0.01975  0.01118   1.131  2.889  0.000
    23 Se  0.01948  0.03844   1.902  4.005  0.112
    24 C  -0.00040  0.00845   1.142  2.857  0.000
    25 S   0.09208  0.05032   1.883  4.138  0.072
    26 C  -0.01139  0.00091   1.124  2.864  0.000
    27 C   0.01272  0.00240   1.072  2.940  0.000
    28 C   0.04550 -0.00366   1.065  2.981  0.000
    29 C   0.03029 -0.07519   1.076  2.954  0.000
    30 C   0.05865 -0.09249   1.074  2.984  0.000
    31 C  -0.00622  0.00606   1.119  2.875  0.000
    32 S   0.08220  0.04072   1.880  4.134  0.068
    33 C   0.00142  0.01051   1.154  2.848  0.000
    34 C   0.05526  0.00534   1.068  2.988  0.000
    35 C   0.01859  0.00820   1.088  2.930  0.000
    36 C   0.06297 -0.04261   1.092  2.971  0.000
    37 C   0.57357  0.42238   0.923  3.650  0.000
    38 C   0.01705  0.00868   1.166  2.851  0.000
    39 C   0.19043  0.13659   1.082  3.108  0.000
    40 C   0.18581  0.13169   1.103  3.083  0.000
    41 C   0.03410  0.02223   1.163  2.872  0.000
    42 Se  0.02662  0.04283   1.899  4.114  0.014
    43 C   0.13109  0.08260   1.092  3.039  0.000
    44 C   0.05048  0.04813   1.073  2.977  0.000
    45 C  -0.12366 -0.08874   1.194  2.682  0.000
    46 C   0.03297  0.03126   1.095  2.938  0.000
    47 C   0.01326  0.01016   1.077  2.936  0.000
    48 C  -0.01041 -0.01036   1.101  2.889  0.000
    49 C   0.14503  0.09774   1.056  3.089  0.000
    50 C  -0.08480 -0.06809   1.155  2.760  0.000
    51 C  -0.09143 -0.07482   1.155  2.754  0.000
    52 C   0.13250  0.08526   1.059  3.073  0.000
    53 O   0.36811  0.32216   1.642  4.726  0.000
    54 C   0.00559  0.01242   1.039  2.967  0.000
    55 C  -0.10498  0.01545   1.221  2.674  0.000
    56 C  -0.09990  0.01959   1.210  2.690  0.000
    57 F   0.19310  0.16985   1.702  5.491  0.000
    58 F   0.20145  0.17838   1.707  5.494  0.000
    59 N   0.30513  0.17608   1.525  3.780  0.000
    60 N   0.30062  0.17245   1.518  3.783  0.000
    61 H   0.14349  0.21123   1.143  0.000  0.000
    62 H  -0.04683  0.01267   0.953  0.000  0.000
    63 H  -0.03419  0.03081   0.966  0.000  0.000
    64 H  -0.01976  0.03770   0.980  0.000  0.000
    65 H  -0.01550  0.04315   0.985  0.000  0.000
    66 H  -0.02631  0.03280   0.974  0.000  0.000
    67 H  -0.02049  0.03944   0.980  0.000  0.000
    68 H  -0.01903  0.03721   0.981  0.000  0.000
    69 H  -0.01819  0.03642   0.982  0.000  0.000
    70 H  -0.01948  0.03244   0.981  0.000  0.000
    71 H  -0.01468  0.03805   0.985  0.000  0.000
    72 H   0.01022  0.06880   1.010  0.000  0.000
    73 H   0.03025  0.09016   1.030  0.000  0.000
    74 H  -0.00480  0.05140   0.995  0.000  0.000
    75 H  -0.26169 -0.20712   0.738  0.000  0.000
    76 H  -0.29284 -0.24095   0.707  0.000  0.000
    77 H  -0.25462 -0.20189   0.745  0.000  0.000
    78 H  -0.29769 -0.24003   0.702  0.000  0.000
    79 H  -0.28372 -0.22644   0.716  0.000  0.000
    80 H  -0.27886 -0.21691   0.721  0.000  0.000
    81 H  -0.31608 -0.25674   0.684  0.000  0.000
    82 H  -0.29779 -0.23439   0.702  0.000  0.000
(R)spin-density population

 Mulliken population n(s)   n(p)   n(d)
     1 C   0.0175   0.000  0.017  0.000
     2 C   0.0021   0.000  0.002  0.000
     3 C   0.0028   0.000  0.003  0.000
     4 C   0.0288   0.000  0.029  0.000
     5 C   0.0197   0.000  0.020  0.000
     6 C   0.0864   0.000  0.086  0.000
     7 C   0.0006   0.000  0.001  0.000
     8 C   0.0335  -0.000  0.033  0.000
     9 C   0.0032  -0.000  0.003  0.000
    10 C   0.0258  -0.000  0.026  0.000
    11 O   0.0021   0.000  0.002  0.000
    12 C   0.0689  -0.000  0.069  0.000
    13 C   0.0114  -0.000  0.011  0.000
    14 C   0.0093   0.000  0.009  0.000
    15 F   0.0004   0.000  0.000  0.000
    16 F   0.0040  -0.000  0.004  0.000
    17 N   0.0338   0.000  0.034  0.000
    18 N   0.0370   0.000  0.037  0.000
    19 C   0.0180   0.000  0.018  0.000
    20 C   0.0249  -0.000  0.025  0.000
    21 C   0.0084  -0.000  0.008  0.000
    22 C   0.0354  -0.000  0.035  0.000
    23 Se  0.0270  -0.000  0.022  0.005
    24 C   0.0126  -0.000  0.013  0.000
    25 S   0.0205   0.000  0.018  0.003
    26 C   0.0221  -0.000  0.022  0.000
    27 C   0.0067   0.000  0.007  0.000
    28 C   0.0185  -0.000  0.019  0.000
    29 C   0.0001  -0.000  0.000  0.000
    30 C   0.0006   0.000  0.000  0.000
    31 C   0.0136  -0.000  0.014  0.000
    32 S   0.0178   0.000  0.016  0.002
    33 C   0.0151   0.000  0.015  0.000
    34 C   0.0147  -0.000  0.015  0.000
    35 C   0.0102  -0.000  0.010  0.000
    36 C   0.0004  -0.000  0.000  0.000
    37 C   0.0027   0.000  0.002  0.000
    38 C   0.0286   0.000  0.029  0.000
    39 C   0.0103  -0.000  0.010  0.000
    40 C   0.0290   0.000  0.029  0.000
    41 C   0.0103   0.000  0.010  0.000
    42 Se  0.0190   0.000  0.015  0.004
    43 C   0.0517   0.000  0.052  0.000
    44 C   0.0140   0.000  0.014  0.000
    45 C   0.0026   0.000  0.002  0.000
    46 C   0.0106   0.000  0.011  0.000
    47 C   0.0014   0.000  0.001  0.000
    48 C   0.0520   0.000  0.052  0.000
    49 C   0.0012  -0.000  0.001  0.000
    50 C   0.0115   0.000  0.011  0.000
    51 C   0.0002  -0.000  0.000  0.000
    52 C   0.0119   0.000  0.012  0.000
    53 O   0.0020  -0.000  0.002  0.000
    54 C   0.0340  -0.000  0.034  0.000
    55 C   0.0060   0.000  0.006  0.000
    56 C   0.0060   0.000  0.006  0.000
    57 F   0.0000  -0.000  0.000  0.000
    58 F   0.0014  -0.000  0.001  0.000
    59 N   0.0180  -0.000  0.018  0.000
    60 N   0.0203   0.000  0.020  0.000
    61 H   0.0000   0.000  0.000  0.000
    62 H   0.0000   0.000  0.000  0.000
    63 H  -0.0000  -0.000  0.000  0.000
    64 H   0.0000   0.000  0.000  0.000
    65 H   0.0000   0.000  0.000  0.000
    66 H   0.0000   0.000  0.000  0.000
    67 H   0.0001   0.000  0.000  0.000
    68 H   0.0000   0.000  0.000  0.000
    69 H   0.0001   0.000  0.000  0.000
    70 H   0.0001   0.000  0.000  0.000
    71 H   0.0001   0.000  0.000  0.000
    72 H   0.0000   0.000  0.000  0.000
    73 H   0.0000   0.000  0.000  0.000
    74 H   0.0000   0.000  0.000  0.000
    75 H   0.0001   0.000  0.000  0.000
    76 H   0.0006   0.001  0.000  0.000
    77 H   0.0000   0.000  0.000  0.000
    78 H   0.0000   0.000  0.000  0.000
    79 H   0.0000   0.000  0.000  0.000
    80 H   0.0003   0.000  0.000  0.000
    81 H   0.0001   0.000  0.000  0.000
    82 H   0.0000   0.000  0.000  0.000

Wiberg/Mayer (AO) data.
largest (>0.10) Wiberg bond orders for each atom
          total WBO             WBO to atom ...
     1  C   3.817        C    2 1.467    C   19 1.286    H   61 0.898    C    3 0.124
     2  C   3.835        C    1 1.467    C    3 1.095    C    6 1.046
     3  C   4.355        O   11 1.718    C    2 1.095    C    4 1.002    C    1 0.124
     4  C   3.705        C    7 1.428    C    5 1.262    C    3 1.002
     5  C   3.840        C   10 1.407    C    4 1.262    C    6 1.071
     6  C   3.669        C   12 1.313    C    5 1.071    C    2 1.046
     7  C   3.894        C    4 1.428    C    8 1.392    H   62 0.974
     8  C   3.922        C    7 1.392    C    9 1.383    F   16 1.049
     9  C   3.978        C   10 1.412    C    8 1.383    F   15 1.057
    10  C   3.807        C    9 1.412    C    5 1.407    H   63 1.001
    11  O   2.215        C    3 1.718    Se  23 0.211
    12  C   3.661        C    6 1.313    C   13 1.163    C   14 1.163
    13  C   4.073        N   18 2.849    C   12 1.163
    14  C   4.074        N   17 2.869    C   12 1.163
    15  F   1.003        C    9 1.057
    16  F   0.978        C    8 1.049
    17  N   2.905        C   14 2.869
    18  N   2.877        C   13 2.849
    19  C   3.788        C   20 1.365    C    1 1.286    Se  23 1.046
    20  C   3.817        C   21 1.433    C   19 1.365    H   64 0.985
    21  C   3.843        C   20 1.433    C   22 1.419    H   65 0.985
    22  C   3.813        C   21 1.419    C   24 1.251    Se  23 1.099
    23  Se  2.563        C   22 1.099    C   19 1.046    O   11 0.211
    24  C   3.898        C   28 1.442    C   22 1.251    S   25 1.163
    25  S   2.483        C   26 1.166    C   24 1.163
    26  C   3.829        C   27 1.427    C   31 1.236    S   25 1.166
    27  C   3.834        C   26 1.427    C   28 1.368    C   29 1.011
    28  C   3.801        C   24 1.442    C   27 1.368    H   66 0.990
    29  C   3.907        C   27 1.011    H   68 0.992    H   67 0.988    C   30 0.974
    30  C   3.924        H   71 1.000    H   69 0.998    H   70 0.991    C   29 0.974
    31  C   3.826        C   35 1.427    C   26 1.236    S   32 1.154
    32  S   2.489        C   33 1.171    C   31 1.154
    33  C   3.915        C   34 1.450    C   38 1.241    S   32 1.171
    34  C   3.811        C   33 1.450    C   35 1.358    H   72 1.001
    35  C   3.839        C   31 1.427    C   34 1.358    C   36 1.013
    36  C   3.902        C   35 1.013    H   73 0.998    H   74 0.980    C   37 0.922
    37  C   3.483        C   36 0.922    H   77 0.879    H   75 0.877    H   76 0.828
    38  C   3.864        C   39 1.462    C   33 1.241    Se  42 1.122
    39  C   3.755        C   38 1.462    C   40 1.421    H   78 0.847
    40  C   3.770        C   41 1.429    C   39 1.421    H   79 0.866
    41  C   3.876        C   40 1.429    C   43 1.325    Se  42 1.085
    42  Se  2.392        C   38 1.122    C   41 1.085
    43  C   3.677        C   44 1.487    C   41 1.325    H   80 0.864
    44  C   3.838        C   43 1.487    C   48 1.192    C   45 1.078
    45  C   4.022        O   53 1.800    C   44 1.078    C   46 1.040
    46  C   3.893        C   49 1.450    C   47 1.317    C   45 1.040
    47  C   3.876        C   52 1.433    C   46 1.317    C   48 1.093
    48  C   3.818        C   54 1.441    C   44 1.192    C   47 1.093
    49  C   3.760        C   46 1.450    C   50 1.418    H   81 0.851
    50  C   3.977        C   49 1.418    C   51 1.398    F   58 1.025
    51  C   3.991        C   52 1.419    C   50 1.398    F   57 1.032
    52  C   3.717        C   47 1.433    C   51 1.419    H   82 0.863
    53  O   1.952        C   45 1.800
    54  C   3.791        C   48 1.441    C   56 1.163    C   55 1.155
    55  C   4.121        N   60 2.886    C   54 1.155
    56  C   4.095        N   59 2.882    C   54 1.163
    57  F   0.981        C   51 1.032
    58  F   0.978        C   50 1.025
    59  N   2.901        C   56 2.882
    60  N   2.875        C   55 2.886
    61  H   1.029        C    1 0.898
    62  H   1.041        C    7 0.974
    63  H   1.073        C   10 1.001
    64  H   1.036        C   20 0.985
    65  H   1.040        C   21 0.985
    66  H   1.025        C   28 0.990
    67  H   1.041        C   29 0.988
    68  H   1.036        C   29 0.992
    69  H   1.036        C   30 0.998
    70  H   1.030        C   30 0.991
    71  H   1.038        C   30 1.000
    72  H   1.073        C   34 1.001
    73  H   1.073        C   36 0.998
    74  H   0.985        C   36 0.980
    75  H   0.952        C   37 0.877
    76  H   0.922        C   37 0.828
    77  H   0.940        C   37 0.879
    78  H   0.943        C   39 0.847
    79  H   0.947        C   40 0.866
    80  H   0.941        C   43 0.864
    81  H   0.926        C   49 0.851
    82  H   0.941        C   52 0.863

 dipole moment from electron density (au)
     X       Y       Z   
  -4.2209  -9.9045  -1.2045  total (Debye):   27.536


           -------------------------------------------------
          | TOTAL ENERGY             -179.270100233056 Eh   |
          | GRADIENT NORM               0.296169077682 Eh/α |
          | HOMO-LUMO GAP               0.180881644300 eV   |
           -------------------------------------------------

------------------------------------------------------------------------
 * finished run on 2021/12/02 at 16:18:46.191     
------------------------------------------------------------------------
 total:
 * wall-time:     0 d,  0 h,  0 min,  4.115 sec
 *  cpu-time:     0 d,  0 h,  0 min,  4.085 sec
 * ratio c/w:     0.993 speedup
 SCF:
 * wall-time:     0 d,  0 h,  0 min,  3.498 sec
 *  cpu-time:     0 d,  0 h,  0 min,  3.478 sec
 * ratio c/w:     0.994 speedup

