      -----------------------------------------------------------      
     |                   =====================                   |     
     |                           x T B                           |     
     |                   =====================                   |     
     |                         S. Grimme                         |     
     |          Mulliken Center for Theoretical Chemistry        |     
     |                    University of Bonn                     |     
     |                Version 6.2 RC2 (SAW190805)                |     
      -----------------------------------------------------------      

   This program is distributed in the hope that it will be useful,
   but WITHOUT ANY WARRANTY; without even the implied warranty of
   MERCHANTABILITY or FITNESS FOR A PARTICULAR PURPOSE.
   
   FOR NON-COMMERCIAL, ACADEMIA USE ONLY.
   
   Cite this work as:
   * S. Grimme, C. Bannwarth, P. Shushkov, J. Chem. Theory Comput., 2017,
     13, 1989-2009. DOI: 10.1021/acs.jctc.7b00118
   * C. Bannwarth, S. Ehlert and S. Grimme., J. Chem. Theory Comput., 2019,
     15, 1652-1671. DOI: 10.1021/acs.jctc.8b01176
   * P. Pracht, E. Caldeweyher, S. Ehlert, S. Grimme, ChemRxiv, 2019, preprint.
     DOI: 10.26434/chemrxiv.8326202.v1
   
   for DFT-D4:
   * E. Caldeweyher, C. Bannwarth and S. Grimme, J. Chem. Phys., 2017,
     147, 034112. DOI: 10.1063/1.4993215
   * E. Caldeweyher, S. Ehlert, A. Hansen, H. Neugebauer, S. Spicher,
     C. Bannwarth and S. Grimme, J. Chem. Phys., 2019, 150, 154122.
     DOI: 10.1063/1.5090222
   
   for sTDA-xTB:
   * S. Grimme and C. Bannwarth, J. Chem. Phys., 2016, 145, 054103.
     DOI: 10.1063/1.4959605
   
   in the mass-spec context:
   * V. Asgeirsson, C. Bauer and S. Grimme, Chem. Sci., 2017, 8, 4879.
     DOI: 10.1039/c7sc00601b
   
   for metadynamics refer to:
   * S. Grimme, J. Chem. Theory Comput., 2019, 155, 2847-2862
     DOI: 10.1021/acs.jctc.9b00143
   
   with help from (in alphabetical order)
   C. Bannwarth, F. Bohle, G. Brandenburg, E. Caldeweyher, M. Checinski,
   S. Dohm, S. Ehlert, S. Ehrlich, F. März, H. Neugebauer, J. Pisarek,
   P. Pracht, P. Shushkov, and S. Spicher.
   
 * started run on 2021/12/02 at 16:19:01.092     

           -------------------------------------------------
          |                Calculation Setup                |
           -------------------------------------------------

          program call               : /ihome/ghutchison/geoffh/xtb/xtb 4T-1.xyz --vipea
          hostname                   : smp-n128
          coordinate file            : 4T-1.xyz
          omp threads                :                     1
          number of atoms            :                    94
          number of electrons        :                   314
          charge                     :                     0
          spin                       :                   0.0
          first test random number   :      0.74193519170605


########################################################################
# WARNING! Please study the warnings concerning your input carefully
#  - XTBPATH is not set, using XTBHOME instead
########################################################################

           ------------------------------------------------- 
          |                 I P E A - x T B                 |
          |  Ionisation Potentials and Electron Affinities  |
           ------------------------------------------------- 
             KAB for M(3d)-M(3d) :                1.1000
             KAB for M(4d)-M(4d) :                1.2000
             KAB for M(5d)-M(5d) :                1.2000
             k(s)                :                2.1500
             k(p)                :                2.3000
             k(d)                :                2.0000
             k(f)                :                0.0000
             kEN (H0ij)          :                0.7000
             D3 a1               :                0.6300
             D3 a2               :                5.0000
             D3 s6               :                1.0000
             D3 s8               :                2.4000
             D3 s9               :                0.0000
             alphaj              :                1.0000
             XBdamp              :                0.4400
             XBrad               :                1.3000
             kcnsh               :      1.0000   -0.3000   -0.5000    0.5000

  Z AO/shell   Hii/eV     exponent
  1     Thu Sep 22 23:34:11 CEST 2016   EN: 2.200 GAM: 0.405  GM3: 0.1500
     1s    -10.521941    1.306199
     2s     -3.560151    0.398421
  6     Thu Sep 22 23:34:11 CEST 2016   EN: 2.550 GAM: 0.640  GM3: 0.1500
     2s    -15.968100    1.979793
     2p     -9.777107    1.850537
     3S     -3.366990    0.633095
  7     Thu Sep 22 23:34:11 CEST 2016   EN: 3.040 GAM: 0.493  GM3:-0.1000
     2s    -24.040776    2.126160
     2p    -14.426520    2.068425
     3S     -5.882278    0.671040
  8     Thu Sep 22 23:34:11 CEST 2016   EN: 3.440 GAM: 0.717  GM3:-0.2000
     2s    -26.695120    2.575264
     2p    -16.014457    2.159448
     3S     -6.622058    0.958679
  9     Tue Jan 17 20:22:52 CET 2017    EN: 3.980 GAM: 0.574  GM3: 0.2000
     2s    -27.565998    2.304073
     2p    -17.439238    2.314354
     3S     -6.120500    0.570243
 16     Tue Jan 17 20:57:36 CET 2017    EN: 2.580 GAM: 0.455  GM3: 0.1020
     3s    -24.488821    2.492075
     3p    -12.136640    1.997904
     3d     -1.796070    1.747541

           ------------------------------------------------- 
          |        Self-Consistent Charge Iterations        |
           ------------------------------------------------- 

          ...................................................
          :                      SETUP                      :
          :.................................................:
          :  # basis functions                 400          :
          :  # atomic orbitals                 396          :
          :  # shells                          252          :
          :  # electrons                       314          :
          :  # halogen bonds                     0          :
          :  max. iterations                   250          :
          :  Hamiltonian                  GFN1-xTB          :
          :  restarted?                      false          :
          :  GBSA solvation                  false          :
          :  PC potential                    false          :
          :  electronic temp.          300.0000000     K    :
          :  accuracy                    1.0000000          :
          :  -> integral cutoff          0.2500000E+02      :
          :  -> integral neglect         0.1000000E-07      :
          :  -> SCF convergence          0.1000000E-05 Eh   :
          :  -> wf. convergence          0.2000000E-04 e    :
          :  Broyden damping             0.4000000          :
          ...................................................

 iter      E             dE          RMSdq      gap      omega  full diag
   1   -208.0143142 -0.208014E+03  0.102E+01    0.90       0.0  T
   2   -207.4218754  0.592439E+00  0.641E+00    0.12       1.0  T
   3   -202.5264914  0.489538E+01  0.599E+00    0.65       1.0  T
   4   -208.1656892 -0.563920E+01  0.211E+00    0.72       1.0  T
   5   -208.9010885 -0.735399E+00  0.856E-01    0.52       1.0  T
   6   -208.9439016 -0.428132E-01  0.640E-01    0.41       1.0  T
   7   -208.9669055 -0.230038E-01  0.411E-01    0.17       1.0  T
   8   -208.8088274  0.158078E+00  0.592E-01    0.03       1.0  T
   9   -208.9661454 -0.157318E+00  0.342E-01    0.33       1.0  T
  10   -208.9694317 -0.328624E-02  0.280E-01    0.29       1.0  T
  11   -208.9734958 -0.406416E-02  0.239E-01    0.22       1.0  T
  12   -208.9755245 -0.202869E-02  0.206E-01    0.20       1.0  T
  13   -208.9773859 -0.186138E-02  0.178E-01    0.18       1.0  T
  14   -208.9785426 -0.115673E-02  0.159E-01    0.18       1.0  T
  15   -208.9815872 -0.304458E-02  0.116E-01    0.15       1.0  T
  16   -208.9279346  0.536526E-01  0.411E-01    0.02       1.0  T
  17   -208.9853930 -0.574584E-01  0.376E-02    0.13       1.0  T
  18   -208.9852585  0.134492E-03  0.399E-02    0.10       1.0  T
  19   -208.9845735  0.685017E-03  0.601E-02    0.09       1.0  T
  20   -208.9846814 -0.107854E-03  0.600E-02    0.12       1.0  T
  21   -208.9856065 -0.925163E-03  0.250E-02    0.12       1.0  T
  22   -208.9854754  0.131111E-03  0.320E-02    0.12       1.0  T
  23   -208.9857578 -0.282434E-03  0.119E-02    0.11       1.0  T
  24   -208.9857882 -0.303137E-04  0.704E-03    0.11       1.5  T
  25   -208.9858017 -0.135824E-04  0.296E-03    0.11       3.5  T
  26   -208.9858044 -0.265142E-05  0.123E-03    0.11       8.4  T
  27   -208.9858048 -0.407826E-06  0.531E-04    0.11      19.4  T
  28   -208.9858049 -0.620033E-07  0.293E-04    0.11      35.2  T
  29   -208.9858049 -0.196563E-07  0.158E-04    0.11      65.1  T
  30   -208.9858049 -0.813128E-08  0.188E-05    0.11     547.6  T

   *** convergence criteria satisfied after 30 iterations ***

         #    Occupation            Energy/Eh            Energy/eV
      -------------------------------------------------------------
         1        2.0000           -4.5227310            -123.0698
       ...           ...                  ...                  ...
       151        2.0000           -0.3906575             -10.6303
       152        2.0000           -0.3862233             -10.5097
       153        2.0000           -0.3726218             -10.1396
       154        2.0000           -0.3695442             -10.0558
       155        2.0000           -0.3565097              -9.7011
       156        1.9101           -0.3333586              -9.0711
       157        1.8262           -0.3326898              -9.0530 (HOMO)
       158        0.2638           -0.3286652              -8.9434 (LUMO)
       159                         -0.3102459              -8.4422
       160                         -0.3021086              -8.2208
       161                         -0.2921511              -7.9498
       162                         -0.2746663              -7.4741
       ...                                ...                  ...
       396                        512.0806036           13934.4225
      -------------------------------------------------------------
                  HL-Gap            0.0040246 Eh            0.1095 eV
             Fermi-level           -0.3304555 Eh           -8.9922 eV

 SCC (total)                   0 d,  0 h,  0 min,  1.621 sec
 SCC setup                      ...        0 min,  0.004 sec (  0.218%)
 Dispersion                     ...        0 min,  0.000 sec (  0.018%)
 integral evaluation            ...        0 min,  0.703 sec ( 43.352%)
 zeroth order Hamiltonian       ...        0 min,  0.003 sec (  0.174%)
 iterations                     ...        0 min,  0.699 sec ( 43.092%)
 molecular gradient             ...        0 min,  0.210 sec ( 12.940%)
 printout                       ...        0 min,  0.003 sec (  0.204%)

         :::::::::::::::::::::::::::::::::::::::::::::::::::::
         ::                     SUMMARY                     ::
         :::::::::::::::::::::::::::::::::::::::::::::::::::::
         :: total energy            -205.555641747823 Eh    ::
         :: gradient norm              0.521578244436 Eh/a0 ::
         :: HOMO-LUMO gap              0.109513670486 eV    ::
         ::.................................................::
         :: SCC energy              -208.985804893584 Eh    ::
         :: -> electrostatic           0.334989482362 Eh    ::
         :: repulsion energy           3.510197268330 Eh    ::
         :: dispersion energy         -0.080034122569 Eh    ::
         :: halogen bond corr.         0.000000000000 Eh    ::
         :: add. restraining           0.000000000000 Eh    ::
         :::::::::::::::::::::::::::::::::::::::::::::::::::::

           ------------------------------------------------- 
          |        vertical delta SCC IP calculation        |
           ------------------------------------------------- 

          ...................................................
          :                      SETUP                      :
          :.................................................:
          :  # basis functions                 400          :
          :  # atomic orbitals                 396          :
          :  # shells                          252          :
          :  # electrons                       313          :
          :  # halogen bonds                     0          :
          :  max. iterations                   250          :
          :  Hamiltonian                  GFN1-xTB          :
          :  restarted?                       true          :
          :  GBSA solvation                  false          :
          :  PC potential                    false          :
          :  electronic temp.          300.0000000     K    :
          :  accuracy                    1.0000000          :
          :  -> integral cutoff          0.2500000E+02      :
          :  -> integral neglect         0.1000000E-07      :
          :  -> SCF convergence          0.1000000E-05 Eh   :
          :  -> wf. convergence          0.2000000E-04 e    :
          :  Broyden damping             0.4000000          :
          ...................................................

 iter      E             dE          RMSdq      gap      omega  full diag
   1   -208.5877457 -0.208588E+03  0.330E-01    0.11       0.0  T
   2   -208.5663657  0.213800E-01  0.419E-01    0.42       1.0  T
   3   -208.5493443  0.170214E-01  0.426E-01    0.53       1.0  T
   4   -208.5821031 -0.327588E-01  0.321E-01    0.36       1.0  T
   5   -208.5944818 -0.123787E-01  0.245E-01    0.43       1.0  T
   6   -208.5842107  0.102711E-01  0.297E-01    0.42       1.0  T
   7   -208.6150673 -0.308566E-01  0.286E-02    0.43       1.0  T
   8   -208.6129703  0.209705E-02  0.804E-02    0.42       1.0  T
   9   -208.6147330 -0.176276E-02  0.367E-02    0.44       1.0  T
  10   -208.6149004 -0.167403E-03  0.301E-02    0.43       1.0  T
  11   -208.6151743 -0.273900E-03  0.115E-02    0.44       1.0  T
  12   -208.6152236 -0.493142E-04  0.107E-03    0.44       9.6  T
  13   -208.6152190  0.464975E-05  0.374E-03    0.44       2.8  T
  14   -208.6152240 -0.503251E-05  0.199E-04    0.44      51.9  T
  15   -208.6152240  0.664667E-08  0.234E-04    0.44      44.1  T
  16   -208.6152240 -0.157022E-07  0.844E-05    0.44     122.3  T
  17   -208.6152240 -0.171235E-08  0.439E-05    0.44     234.9  T

   *** convergence criteria satisfied after 17 iterations ***

         #    Occupation            Energy/Eh            Energy/eV
      -------------------------------------------------------------
         1        2.0000           -4.5896560            -124.8909
       ...           ...                  ...                  ...
       151        2.0000           -0.4690577             -12.7637
       152        2.0000           -0.4620808             -12.5739
       153        2.0000           -0.4525382             -12.3142
       154        2.0000           -0.4430162             -12.0551
       155        2.0000           -0.4232538             -11.5173
       156        1.6248           -0.4138959             -11.2627
       157        1.3750           -0.4129263             -11.2363 (HOMO)
       158        0.0003           -0.3968986             -10.8002 (LUMO)
       159                         -0.3794011             -10.3240
       160                         -0.3710422             -10.0966
       161                         -0.3600261              -9.7968
       162                         -0.3459467              -9.4137
       ...                                ...                  ...
       396                        512.0095258           13932.4884
      -------------------------------------------------------------
                  HL-Gap            0.0160277 Eh            0.4361 eV
             Fermi-level           -0.4090886 Eh          -11.1319 eV

 SCC (total)                   0 d,  0 h,  0 min,  1.317 sec
 SCC setup                      ...        0 min,  0.004 sec (  0.272%)
 Dispersion                     ...        0 min,  0.000 sec (  0.013%)
 integral evaluation            ...        0 min,  0.706 sec ( 53.597%)
 zeroth order Hamiltonian       ...        0 min,  0.003 sec (  0.210%)
 iterations                     ...        0 min,  0.388 sec ( 29.428%)
 molecular gradient             ...        0 min,  0.213 sec ( 16.199%)
 printout                       ...        0 min,  0.004 sec (  0.277%)

         :::::::::::::::::::::::::::::::::::::::::::::::::::::
         ::                     SUMMARY                     ::
         :::::::::::::::::::::::::::::::::::::::::::::::::::::
         :: total energy            -205.185060895674 Eh    ::
         :: gradient norm              0.516561785910 Eh/a0 ::
         :: HOMO-LUMO gap              0.436136311061 eV    ::
         ::.................................................::
         :: SCC energy              -208.615224041435 Eh    ::
         :: -> electrostatic           0.371692595754 Eh    ::
         :: repulsion energy           3.510197268330 Eh    ::
         :: dispersion energy         -0.080034122569 Eh    ::
         :: halogen bond corr.         0.000000000000 Eh    ::
         :: add. restraining           0.000000000000 Eh    ::
         :::::::::::::::::::::::::::::::::::::::::::::::::::::

------------------------------------------------------------------------
empirical IP shift (eV):    4.8455
delta SCC IP (eV):    5.2385
------------------------------------------------------------------------
           ------------------------------------------------- 
          |        vertical delta SCC EA calculation        |
           ------------------------------------------------- 

          ...................................................
          :                      SETUP                      :
          :.................................................:
          :  # basis functions                 400          :
          :  # atomic orbitals                 396          :
          :  # shells                          252          :
          :  # electrons                       315          :
          :  # halogen bonds                     0          :
          :  max. iterations                   250          :
          :  Hamiltonian                  GFN1-xTB          :
          :  restarted?                       true          :
          :  GBSA solvation                  false          :
          :  PC potential                    false          :
          :  electronic temp.          300.0000000     K    :
          :  accuracy                    1.0000000          :
          :  -> integral cutoff          0.2500000E+02      :
          :  -> integral neglect         0.1000000E-07      :
          :  -> SCF convergence          0.1000000E-05 Eh   :
          :  -> wf. convergence          0.2000000E-04 e    :
          :  Broyden damping             0.4000000          :
          ...................................................

 iter      E             dE          RMSdq      gap      omega  full diag
   1   -209.2312947 -0.209231E+03  0.410E-01    0.48       0.0  T
   2   -208.7198978  0.511397E+00  0.990E-01    0.28       1.0  T
   3   -209.2471588 -0.527261E+00  0.291E-01    0.54       1.0  T
   4   -209.2635472 -0.163884E-01  0.195E-01    0.36       1.0  T
   5   -209.2675859 -0.403871E-02  0.146E-01    0.21       1.0  T
   6   -209.2719288 -0.434290E-02  0.730E-02    0.08       1.0  T
   7   -209.2677008  0.422806E-02  0.110E-01    0.19       1.0  T
   8   -209.2740645 -0.636370E-02  0.373E-02    0.10       1.0  T
   9   -209.2745522 -0.487720E-03  0.125E-02    0.11       1.0  T
  10   -209.2745777 -0.255015E-04  0.817E-03    0.11       1.3  T
  11   -209.2745793 -0.160741E-05  0.650E-03    0.11       1.6  T
  12   -209.2745833 -0.400990E-05  0.461E-03    0.11       2.2  T
  13   -209.2745888 -0.550927E-05  0.281E-03    0.11       3.7  T
  14   -209.2745901 -0.127950E-05  0.172E-03    0.11       6.0  T
  15   -209.2745911 -0.969555E-06  0.640E-04    0.11      16.1  T
  16   -209.2745912 -0.112782E-06  0.137E-04    0.11      75.2  T
  17   -209.2745912  0.301981E-09  0.145E-04    0.11      71.0  T

   *** convergence criteria satisfied after 17 iterations ***

         #    Occupation            Energy/Eh            Energy/eV
      -------------------------------------------------------------
         1        2.0000           -4.4429731            -120.8995
       ...           ...                  ...                  ...
       152        2.0000           -0.3169346              -8.6242
       153        2.0000           -0.3003340              -8.1725
       154        2.0000           -0.2958242              -8.0498
       155        2.0000           -0.2781983              -7.5702
       156        2.0000           -0.2679261              -7.2906
       157        1.9526           -0.2564620              -6.9787
       158        0.9361           -0.2507333              -6.8228 (HOMO)
       159        0.1113           -0.2467683              -6.7149 (LUMO)
       160        0.0000           -0.2369776              -6.4485
       161                         -0.2154405              -5.8624
       162                         -0.2054742              -5.5912
       163                         -0.1861252              -5.0647
       ...                                ...                  ...
       396                        512.1446132           13936.1643
      -------------------------------------------------------------
                  HL-Gap            0.0039650 Eh            0.1079 eV
             Fermi-level           -0.2511775 Eh           -6.8349 eV

 SCC (total)                   0 d,  0 h,  0 min,  1.325 sec
 SCC setup                      ...        0 min,  0.003 sec (  0.260%)
 Dispersion                     ...        0 min,  0.000 sec (  0.020%)
 integral evaluation            ...        0 min,  0.713 sec ( 53.797%)
 zeroth order Hamiltonian       ...        0 min,  0.003 sec (  0.209%)
 iterations                     ...        0 min,  0.391 sec ( 29.554%)
 molecular gradient             ...        0 min,  0.210 sec ( 15.859%)
 printout                       ...        0 min,  0.004 sec (  0.298%)

         :::::::::::::::::::::::::::::::::::::::::::::::::::::
         ::                     SUMMARY                     ::
         :::::::::::::::::::::::::::::::::::::::::::::::::::::
         :: total energy            -205.844428042924 Eh    ::
         :: gradient norm              0.524081546094 Eh/a0 ::
         :: HOMO-LUMO gap              0.107892242301 eV    ::
         ::.................................................::
         :: SCC energy              -209.274591188685 Eh    ::
         :: -> electrostatic           0.369377050390 Eh    ::
         :: repulsion energy           3.510197268330 Eh    ::
         :: dispersion energy         -0.080034122569 Eh    ::
         :: halogen bond corr.         0.000000000000 Eh    ::
         :: add. restraining           0.000000000000 Eh    ::
         :::::::::::::::::::::::::::::::::::::::::::::::::::::

------------------------------------------------------------------------
empirical EA shift (eV):    4.8455
delta SCC EA (eV):    3.0128
------------------------------------------------------------------------
           -------------------------------------------------
          |                Property Printout                |
           -------------------------------------------------

    * Orbital Energies and Occupations

         #    Occupation            Energy/Eh            Energy/eV
      -------------------------------------------------------------
         1        2.0000           -4.4429731            -120.8995
       ...           ...                  ...                  ...
       146        2.0000           -0.3585744              -9.7573
       147        2.0000           -0.3550151              -9.6605
       148        2.0000           -0.3475497              -9.4573
       149        2.0000           -0.3463401              -9.4244
       150        2.0000           -0.3337012              -9.0805
       151        2.0000           -0.3217954              -8.7565
       152        2.0000           -0.3169346              -8.6242
       153        2.0000           -0.3003340              -8.1725
       154        2.0000           -0.2958242              -8.0498
       155        2.0000           -0.2781983              -7.5702
       156        2.0000           -0.2679261              -7.2906
       157        1.9526           -0.2564620              -6.9787
       158        0.9361           -0.2507333              -6.8228 (HOMO)
       159        0.1113           -0.2467683              -6.7149 (LUMO)
       160        0.0000           -0.2369776              -6.4485
       161                         -0.2154405              -5.8624
       162                         -0.2054742              -5.5912
       163                         -0.1861252              -5.0647
       164                         -0.1799851              -4.8976
       165                         -0.1735691              -4.7231
       166                         -0.1672989              -4.5524
       167                         -0.1624934              -4.4217
       168                         -0.1529536              -4.1621
       169                         -0.1488642              -4.0508
       ...                                ...                  ...
       396                        512.1446132           13936.1643
      -------------------------------------------------------------
                  HL-Gap            0.0039650 Eh            0.1079 eV
             Fermi-level           -0.2511775 Eh           -6.8349 eV

  Mulliken/CM5 charges        n(s)   n(p)   n(d)
     1 C  -0.07473 -0.03917   0.719  3.206  0.000
     2 O   0.07322  0.02713   1.645  4.429  0.000
     3 C  -0.09268 -0.09430   0.566  3.341  0.000
     4 C   0.08577  0.03852   1.087  2.998  0.000
     5 C  -0.09746 -0.08074   1.144  2.759  0.000
     6 C  -0.09186 -0.07530   1.141  2.767  0.000
     7 C   0.02358 -0.02368   1.076  2.947  0.000
     8 C   0.08372  0.08065   1.013  3.071  0.000
     9 C  -0.00967 -0.01026   1.099  2.891  0.000
    10 C   0.01692  0.02316   1.019  2.998  0.000
    11 C  -0.09879  0.01908   1.207  2.694  0.000
    12 N   0.31543  0.18492   1.524  3.791  0.000
    13 C  -0.10090  0.01828   1.206  2.693  0.000
    14 N   0.31086  0.18064   1.530  3.781  0.000
    15 C   0.04618  0.04440   1.097  2.949  0.000
    16 C   0.02919 -0.01852   1.067  2.962  0.000
    17 C  -0.00843 -0.00231   1.143  2.849  0.000
    18 C   0.04194 -0.00862   1.062  2.980  0.000
    19 C   0.01766  0.00620   1.069  2.949  0.000
    20 C  -0.00038  0.01179   1.133  2.867  0.000
    21 S   0.06905  0.03853   1.877  4.086  0.106
    22 C   0.00384  0.01599   1.122  2.881  0.000
    23 C   0.00142  0.01385   1.122  2.880  0.000
    24 C   0.01327  0.00288   1.067  2.946  0.000
    25 C   0.03697 -0.01379   1.062  2.975  0.000
    26 C  -0.00443  0.00171   1.131  2.865  0.000
    27 S   0.10820  0.07139   1.892  4.068  0.148
    28 C   0.01780 -0.02994   1.071  2.946  0.000
    29 C   0.03271  0.03095   1.046  2.987  0.000
    30 C  -0.01160 -0.01219   1.085  2.903  0.000
    31 C  -0.00072  0.00552   1.030  2.970  0.000
    32 C  -0.10698  0.01216   1.203  2.690  0.000
    33 N   0.29299  0.16278   1.527  3.766  0.000
    34 C  -0.10857  0.00913   1.204  2.687  0.000
    35 N   0.29175  0.16138   1.525  3.767  0.000
    36 C  -0.00589 -0.00896   1.071  2.923  0.000
    37 C   0.01595 -0.03132   1.072  2.944  0.000
    38 C  -0.11373 -0.09720   1.143  2.744  0.000
    39 C  -0.10893 -0.09225   1.136  2.756  0.000
    40 C   0.01703 -0.03023   1.079  2.938  0.000
    41 C   0.00977  0.00815   1.084  2.925  0.000
    42 C  -0.14012 -0.10472   1.158  2.702  0.000
    43 O   0.33502  0.28842   1.645  4.690  0.000
    44 F   0.18644  0.16338   1.698  5.489  0.000
    45 F   0.17406  0.15104   1.694  5.480  0.000
    46 S   0.09216  0.05698   1.880  4.142  0.070
    47 C  -0.00657  0.00393   1.140  2.853  0.000
    48 C   0.04384 -0.00512   1.068  2.976  0.000
    49 C   0.02404  0.01297   1.105  2.919  0.000
    50 C  -0.01322 -0.00263   1.144  2.843  0.000
    51 C   0.05683  0.00760   1.049  3.008  0.000
    52 C   0.03918  0.02904   1.100  2.939  0.000
    53 C   0.00904  0.02105   1.114  2.895  0.000
    54 S   0.09319  0.05250   1.882  4.142  0.070
    55 C   0.02989 -0.07478   1.073  2.957  0.000
    56 C   0.06132 -0.09110   1.071  2.991  0.000
    57 C   0.03339 -0.07332   1.072  2.961  0.000
    58 C   0.06171 -0.09065   1.066  2.995  0.000
    59 C   0.18924  0.08217   1.024  3.165  0.000
    60 C   0.59777  0.44617   0.908  3.690  0.000
    61 C   0.28458  0.18001   1.029  3.256  0.000
    62 C   0.57663  0.42426   0.940  3.637  0.000
    63 F   0.18478  0.16148   1.697  5.488  0.000
    64 F   0.16956  0.14631   1.694  5.475  0.000
    65 H  -0.02706  0.03246   0.973  0.000  0.000
    66 H  -0.02567  0.03939   0.974  0.000  0.000
    67 H  -0.03200  0.03587   0.968  0.000  0.000
    68 H  -0.03066  0.02785   0.969  0.000  0.000
    69 H  -0.03198  0.02752   0.968  0.000  0.000
    70 H  -0.02795  0.03998   0.972  0.000  0.000
    71 H  -0.03726  0.02783   0.963  0.000  0.000
    72 H  -0.04002  0.01951   0.960  0.000  0.000
    73 H  -0.01832  0.04095   0.982  0.000  0.000
    74 H   0.00252  0.06335   1.003  0.000  0.000
    75 H  -0.01936  0.03932   0.981  0.000  0.000
    76 H  -0.02295  0.03508   0.977  0.000  0.000
    77 H  -0.01386  0.03897   0.986  0.000  0.000
    78 H  -0.01642  0.03537   0.984  0.000  0.000
    79 H  -0.01492  0.03782   0.985  0.000  0.000
    80 H  -0.00212  0.05565   0.998  0.000  0.000
    81 H  -0.02486  0.03089   0.975  0.000  0.000
    82 H   0.00698  0.06021   1.007  0.000  0.000
    83 H  -0.01442  0.03728   0.986  0.000  0.000
    84 H  -0.02091  0.03191   0.979  0.000  0.000
    85 H   0.06702  0.12335   1.067  0.000  0.000
    86 H  -0.30948 -0.25193   0.691  0.000  0.000
    87 H  -0.27642 -0.22373   0.724  0.000  0.000
    88 H  -0.25676 -0.20503   0.743  0.000  0.000
    89 H  -0.29450 -0.23977   0.705  0.000  0.000
    90 H  -0.30246 -0.24331   0.698  0.000  0.000
    91 H  -0.32833 -0.26951   0.672  0.000  0.000
    92 H  -0.30232 -0.24956   0.698  0.000  0.000
    93 H  -0.27118 -0.21930   0.729  0.000  0.000
    94 H  -0.31656 -0.26383   0.683  0.000  0.000
(R)spin-density population

 Mulliken population n(s)   n(p)   n(d)
     1 C   0.0522   0.011  0.041  0.000
     2 O   0.0496   0.008  0.041  0.000
     3 C   0.0038   0.000  0.004  0.000
     4 C   0.0393   0.004  0.036  0.000
     5 C   0.0063   0.001  0.005  0.000
     6 C   0.0197   0.000  0.020  0.000
     7 C   0.0042   0.000  0.004  0.000
     8 C   0.0273   0.001  0.026  0.000
     9 C   0.0281   0.001  0.028  0.000
    10 C   0.0588   0.000  0.059  0.000
    11 C   0.0046   0.000  0.005  0.000
    12 N   0.0252   0.000  0.025  0.000
    13 C   0.0044   0.000  0.004  0.000
    14 N   0.0232   0.000  0.023  0.000
    15 C   0.0708   0.008  0.063  0.000
    16 C   0.0844   0.001  0.083  0.000
    17 C   0.0038   0.000  0.003  0.000
    18 C   0.0473   0.000  0.047  0.000
    19 C   0.0004   0.000  0.000  0.000
    20 C   0.0538   0.001  0.053  0.000
    21 S   0.0300   0.000  0.022  0.007
    22 C   0.0029   0.000  0.003  0.000
    23 C   0.0057  -0.000  0.006  0.000
    24 C   0.0003   0.000  0.000  0.000
    25 C   0.0050  -0.000  0.005  0.000
    26 C   0.0004   0.000  0.000  0.000
    27 S   0.0049   0.000  0.004  0.001
    28 C   0.0113   0.000  0.011  0.000
    29 C   0.0018  -0.000  0.002  0.000
    30 C   0.0315  -0.000  0.032  0.000
    31 C   0.0253  -0.000  0.025  0.000
    32 C   0.0038   0.000  0.004  0.000
    33 N   0.0126  -0.000  0.013  0.000
    34 C   0.0039   0.000  0.004  0.000
    35 N   0.0130   0.000  0.013  0.000
    36 C   0.0088   0.000  0.009  0.000
    37 C   0.0071   0.000  0.007  0.000
    38 C   0.0033   0.000  0.003  0.000
    39 C   0.0105  -0.000  0.010  0.000
    40 C   0.0008   0.000  0.001  0.000
    41 C   0.0120   0.000  0.012  0.000
    42 C   0.0085   0.000  0.009  0.000
    43 O   0.0071   0.000  0.007  0.000
    44 F   0.0019   0.000  0.002  0.000
    45 F   0.0013  -0.000  0.001  0.000
    46 S   0.0115   0.000  0.010  0.001
    47 C   0.0140   0.000  0.014  0.000
    48 C   0.0041  -0.000  0.004  0.000
    49 C   0.0141   0.000  0.014  0.000
    50 C   0.0063  -0.000  0.006  0.000
    51 C   0.0122   0.000  0.012  0.000
    52 C   0.0023   0.000  0.002  0.000
    53 C   0.0011   0.000  0.001  0.000
    54 S   0.0028  -0.000  0.002  0.001
    55 C  -0.0000  -0.000  0.000  0.000
    56 C  -0.0000  -0.000  0.000  0.000
    57 C   0.0003   0.000  0.000  0.000
    58 C   0.0003   0.000  0.000  0.000
    59 C   0.0070  -0.000  0.007  0.000
    60 C   0.0308   0.000  0.031  0.000
    61 C   0.0162  -0.000  0.016  0.000
    62 C   0.0188   0.000  0.019  0.000
    63 F   0.0029  -0.000  0.003  0.000
    64 F   0.0004   0.000  0.000  0.000
    65 H   0.0009   0.001  0.000  0.000
    66 H  -0.0000  -0.000  0.000  0.000
    67 H   0.0050   0.005  0.000  0.000
    68 H   0.0001   0.000  0.000  0.000
    69 H   0.0000   0.000  0.000  0.000
    70 H   0.0000   0.000  0.000  0.000
    71 H   0.0000   0.000  0.000  0.000
    72 H   0.0000   0.000  0.000  0.000
    73 H   0.0001   0.000  0.000  0.000
    74 H   0.0000   0.000  0.000  0.000
    75 H   0.0000   0.000  0.000  0.000
    76 H   0.0000   0.000  0.000  0.000
    77 H   0.0000   0.000  0.000  0.000
    78 H   0.0000   0.000  0.000  0.000
    79 H   0.0000   0.000  0.000  0.000
    80 H   0.0001   0.000  0.000  0.000
    81 H   0.0000   0.000  0.000  0.000
    82 H   0.0002   0.000  0.000  0.000
    83 H   0.0002   0.000  0.000  0.000
    84 H   0.0001   0.000  0.000  0.000
    85 H   0.0031   0.003  0.000  0.000
    86 H   0.0026   0.003  0.000  0.000
    87 H   0.0053   0.005  0.000  0.000
    88 H   0.0001   0.000  0.000  0.000
    89 H   0.0039   0.004  0.000  0.000
    90 H   0.0030   0.003  0.000  0.000
    91 H   0.0025   0.003  0.000  0.000
    92 H   0.0027   0.003  0.000  0.000
    93 H   0.0001   0.000  0.000  0.000
    94 H   0.0033   0.003  0.000  0.000

Wiberg/Mayer (AO) data.
largest (>0.10) Wiberg bond orders for each atom
          total WBO             WBO to atom ...
     1  C   2.332        O    2 1.153    C   15 0.650    C    3 0.215    C    8 0.102
     2  O   1.694        C    1 1.153    C    3 0.189    C   15 0.113
     3  C   2.333        C    4 0.917    C    8 0.878    C    1 0.215    O    2 0.189
     4  C   3.737        C    5 1.565    H   65 0.976    C    3 0.917
     5  C   3.987        C    4 1.565    C    6 1.297    F   44 1.037
     6  C   3.952        C    7 1.422    C    5 1.297    F   63 1.039
     7  C   3.880        C    6 1.422    C    8 1.367    H   66 0.995
     8  C   3.668        C    7 1.367    C    9 1.212    C    3 0.878    C    1 0.102
     9  C   3.893        C   10 1.360    C    8 1.212    C   15 1.152
    10  C   3.701        C    9 1.360    C   11 1.171    C   13 1.165
    11  C   4.093        N   12 2.864    C   10 1.171
    12  N   2.901        C   11 2.864
    13  C   4.095        N   14 2.883    C   10 1.165
    14  N   2.917        C   13 2.883
    15  C   3.664        C   16 1.527    C    9 1.152    C    1 0.650    O    2 0.113
    16  C   3.731        C   15 1.527    C   17 1.288    H   67 0.969
    17  C   3.918        C   18 1.407    C   16 1.288    S   21 1.161
    18  C   3.755        C   17 1.407    C   19 1.377    H   68 0.992
    19  C   3.843        C   20 1.448    C   18 1.377    C   57 1.011
    20  C   3.814        C   19 1.448    S   21 1.162    C   22 1.162
    21  S   2.577        C   20 1.162    C   17 1.161
    22  C   3.839        C   49 1.470    C   20 1.162    S   46 1.157
    23  C   3.860        C   53 1.335    C   24 1.315    S   27 1.162
    24  C   3.823        C   25 1.491    C   23 1.315    C   55 1.013
    25  C   3.793        C   24 1.491    C   26 1.313    H   69 0.995
    26  C   3.898        C   28 1.396    C   25 1.313    S   27 1.140
    27  S   2.658        C   23 1.162    C   26 1.140    O   43 0.126
    28  C   3.763        C   26 1.396    C   29 1.394    H   70 0.988
    29  C   3.795        C   28 1.394    C   30 1.200    C   42 1.140
    30  C   3.807        C   31 1.430    C   29 1.200    C   36 1.099
    31  C   3.751        C   30 1.430    C   34 1.159    C   32 1.156
    32  C   4.090        N   33 2.894    C   31 1.156
    33  N   2.911        C   32 2.894
    34  C   4.094        N   35 2.888    C   31 1.159
    35  N   2.899        C   34 2.888
    36  C   3.861        C   37 1.420    C   41 1.315    C   30 1.099
    37  C   3.838        C   36 1.420    C   38 1.410    H   71 1.000
    38  C   3.981        C   37 1.410    C   39 1.387    F   64 1.057
    39  C   3.952        C   40 1.404    C   38 1.387    F   45 1.051
    40  C   3.881        C   41 1.441    C   39 1.404    H   72 0.994
    41  C   3.874        C   40 1.441    C   36 1.315    C   42 1.047
    42  C   3.948        O   43 1.723    C   29 1.140    C   41 1.047
    43  O   2.017        C   42 1.723    S   27 0.126
    44  F   0.966        C    5 1.037
    45  F   0.983        C   39 1.051
    46  S   2.502        C   47 1.179    C   22 1.157
    47  C   3.909        C   48 1.494    C   50 1.205    S   46 1.179
    48  C   3.819        C   47 1.494    C   49 1.310    H   73 0.990
    49  C   3.861        C   22 1.470    C   48 1.310    C   59 1.036
    50  C   3.914        C   51 1.500    C   47 1.205    S   54 1.170
    51  C   3.794        C   50 1.500    C   52 1.299    H   74 0.993
    52  C   3.864        C   53 1.325    C   51 1.299    C   61 1.144
    53  C   3.815        C   23 1.335    C   52 1.325    S   54 1.137
    54  S   2.477        C   50 1.170    C   53 1.137
    55  C   3.897        C   24 1.013    H   75 0.988    C   56 0.987    H   76 0.983
    56  C   3.916        H   77 1.005    H   79 1.004    H   78 0.995    C   55 0.987
    57  C   3.892        C   19 1.011    H   80 1.001    H   81 0.985    C   58 0.981
    58  C   3.897        H   82 1.004    H   84 0.998    H   83 0.991    C   57 0.981
    59  C   3.700        C   49 1.036    H   85 1.013    C   60 0.900    H   86 0.803
    60  C   3.376        C   59 0.900    H   88 0.877    H   87 0.828    H   89 0.801
    61  C   3.657        C   52 1.144    C   62 0.940    H   90 0.770    H   91 0.728
    62  C   3.434        C   61 0.940    H   93 0.879    H   92 0.794    H   94 0.752
    63  F   0.961        C    6 1.039
    64  F   0.993        C   38 1.057
    65  H   1.030        C    4 0.976
    66  H   1.063        C    7 0.995
    67  H   1.041        C   16 0.969
    68  H   1.031        C   18 0.992
    69  H   1.025        C   25 0.995
    70  H   1.053        C   28 0.988
    71  H   1.068        C   37 1.000
    72  H   1.034        C   40 0.994
    73  H   1.043        C   48 0.990
    74  H   1.072        C   51 0.993
    75  H   1.037        C   55 0.988
    76  H   1.033        C   55 0.983
    77  H   1.039        C   56 1.005
    78  H   1.031        C   56 0.995
    79  H   1.040        C   56 1.004
    80  H   1.069        C   57 1.001
    81  H   1.035        C   57 0.985
    82  H   1.075        C   58 1.004
    83  H   1.039        C   58 0.991
    84  H   1.039        C   58 0.998
    85  H   1.088        C   59 1.013
    86  H   0.943        C   59 0.803
    87  H   0.939        C   60 0.828
    88  H   0.951        C   60 0.877
    89  H   0.940        C   60 0.801
    90  H   0.915        C   61 0.770
    91  H   0.923        C   61 0.728
    92  H   0.916        C   62 0.794
    93  H   0.942        C   62 0.879
    94  H   0.898        C   62 0.752

 dipole moment from electron density (au)
     X       Y       Z   
   3.8224 -10.7503  -1.4224  total (Debye):   29.225


           -------------------------------------------------
          | TOTAL ENERGY             -205.844428042924 Eh   |
          | GRADIENT NORM               0.524081546094 Eh/α |
          | HOMO-LUMO GAP               0.107892242301 eV   |
           -------------------------------------------------

------------------------------------------------------------------------
 * finished run on 2021/12/02 at 16:19:06.080     
------------------------------------------------------------------------
 total:
 * wall-time:     0 d,  0 h,  0 min,  4.987 sec
 *  cpu-time:     0 d,  0 h,  0 min,  4.947 sec
 * ratio c/w:     0.992 speedup
 SCF:
 * wall-time:     0 d,  0 h,  0 min,  4.266 sec
 *  cpu-time:     0 d,  0 h,  0 min,  4.228 sec
 * ratio c/w:     0.991 speedup

