      -----------------------------------------------------------      
     |                   =====================                   |     
     |                           x T B                           |     
     |                   =====================                   |     
     |                         S. Grimme                         |     
     |          Mulliken Center for Theoretical Chemistry        |     
     |                    University of Bonn                     |     
     |                Version 6.2 RC2 (SAW190805)                |     
      -----------------------------------------------------------      

   This program is distributed in the hope that it will be useful,
   but WITHOUT ANY WARRANTY; without even the implied warranty of
   MERCHANTABILITY or FITNESS FOR A PARTICULAR PURPOSE.
   
   FOR NON-COMMERCIAL, ACADEMIA USE ONLY.
   
   Cite this work as:
   * S. Grimme, C. Bannwarth, P. Shushkov, J. Chem. Theory Comput., 2017,
     13, 1989-2009. DOI: 10.1021/acs.jctc.7b00118
   * C. Bannwarth, S. Ehlert and S. Grimme., J. Chem. Theory Comput., 2019,
     15, 1652-1671. DOI: 10.1021/acs.jctc.8b01176
   * P. Pracht, E. Caldeweyher, S. Ehlert, S. Grimme, ChemRxiv, 2019, preprint.
     DOI: 10.26434/chemrxiv.8326202.v1
   
   for DFT-D4:
   * E. Caldeweyher, C. Bannwarth and S. Grimme, J. Chem. Phys., 2017,
     147, 034112. DOI: 10.1063/1.4993215
   * E. Caldeweyher, S. Ehlert, A. Hansen, H. Neugebauer, S. Spicher,
     C. Bannwarth and S. Grimme, J. Chem. Phys., 2019, 150, 154122.
     DOI: 10.1063/1.5090222
   
   for sTDA-xTB:
   * S. Grimme and C. Bannwarth, J. Chem. Phys., 2016, 145, 054103.
     DOI: 10.1063/1.4959605
   
   in the mass-spec context:
   * V. Asgeirsson, C. Bauer and S. Grimme, Chem. Sci., 2017, 8, 4879.
     DOI: 10.1039/c7sc00601b
   
   for metadynamics refer to:
   * S. Grimme, J. Chem. Theory Comput., 2019, 155, 2847-2862
     DOI: 10.1021/acs.jctc.9b00143
   
   with help from (in alphabetical order)
   C. Bannwarth, F. Bohle, G. Brandenburg, E. Caldeweyher, M. Checinski,
   S. Dohm, S. Ehlert, S. Ehrlich, F. März, H. Neugebauer, J. Pisarek,
   P. Pracht, P. Shushkov, and S. Spicher.
   
 * started run on 2021/12/02 at 16:21:13.470     

           -------------------------------------------------
          |                Calculation Setup                |
           -------------------------------------------------

          program call               : /ihome/ghutchison/geoffh/xtb/xtb A-WSSe-Cl.xyz --vipea
          hostname                   : smp-n128
          coordinate file            : A-WSSe-Cl.xyz
          omp threads                :                     1
          number of atoms            :                    97
          number of electrons        :                   344
          charge                     :                     0
          spin                       :                   0.0
          first test random number   :      0.20428400736495


########################################################################
# WARNING! Please study the warnings concerning your input carefully
#  - XTBPATH is not set, using XTBHOME instead
########################################################################

           ------------------------------------------------- 
          |                 I P E A - x T B                 |
          |  Ionisation Potentials and Electron Affinities  |
           ------------------------------------------------- 
             KAB for M(3d)-M(3d) :                1.1000
             KAB for M(4d)-M(4d) :                1.2000
             KAB for M(5d)-M(5d) :                1.2000
             k(s)                :                2.1500
             k(p)                :                2.3000
             k(d)                :                2.0000
             k(f)                :                0.0000
             kEN (H0ij)          :                0.7000
             D3 a1               :                0.6300
             D3 a2               :                5.0000
             D3 s6               :                1.0000
             D3 s8               :                2.4000
             D3 s9               :                0.0000
             alphaj              :                1.0000
             XBdamp              :                0.4400
             XBrad               :                1.3000
             kcnsh               :      1.0000   -0.3000   -0.5000    0.5000

  Z AO/shell   Hii/eV     exponent
  1     Thu Sep 22 23:34:11 CEST 2016   EN: 2.200 GAM: 0.405  GM3: 0.1500
     1s    -10.521941    1.306199
     2s     -3.560151    0.398421
  6     Thu Sep 22 23:34:11 CEST 2016   EN: 2.550 GAM: 0.640  GM3: 0.1500
     2s    -15.968100    1.979793
     2p     -9.777107    1.850537
     3S     -3.366990    0.633095
  7     Thu Sep 22 23:34:11 CEST 2016   EN: 3.040 GAM: 0.493  GM3:-0.1000
     2s    -24.040776    2.126160
     2p    -14.426520    2.068425
     3S     -5.882278    0.671040
  8     Thu Sep 22 23:34:11 CEST 2016   EN: 3.440 GAM: 0.717  GM3:-0.2000
     2s    -26.695120    2.575264
     2p    -16.014457    2.159448
     3S     -6.622058    0.958679
 16     Tue Jan 17 20:57:36 CET 2017    EN: 2.580 GAM: 0.455  GM3: 0.1020
     3s    -24.488821    2.492075
     3p    -12.136640    1.997904
     3d     -1.796070    1.747541
 17     Tue Jan 17 19:45:33 CET 2017    EN: 3.160 GAM: 0.559  GM3: 0.2396
     3s    -24.452163    2.559226
     3p    -13.465451    2.054846
     3d     -1.836065    1.762522
 34     Mon Jan 23 10:29:23 CET 2017    EN: 2.550 GAM: 0.546  GM3: 0.1799
     4s    -23.000000    2.998140
     4p    -11.353754    2.073392
     4d     -0.978922    1.745074

           ------------------------------------------------- 
          |        Self-Consistent Charge Iterations        |
           ------------------------------------------------- 

          ...................................................
          :                      SETUP                      :
          :.................................................:
          :  # basis functions                 452          :
          :  # atomic orbitals                 443          :
          :  # shells                          265          :
          :  # electrons                       344          :
          :  # halogen bonds                    14          :
          :  max. iterations                   250          :
          :  Hamiltonian                  GFN1-xTB          :
          :  restarted?                      false          :
          :  GBSA solvation                  false          :
          :  PC potential                    false          :
          :  electronic temp.          300.0000000     K    :
          :  accuracy                    1.0000000          :
          :  -> integral cutoff          0.2500000E+02      :
          :  -> integral neglect         0.1000000E-07      :
          :  -> SCF convergence          0.1000000E-05 Eh   :
          :  -> wf. convergence          0.2000000E-04 e    :
          :  Broyden damping             0.4000000          :
          ...................................................

 iter      E             dE          RMSdq      gap      omega  full diag
   1   -217.5472861 -0.217547E+03  0.980E+00    0.20       0.0  T
   2   -215.5748558  0.197243E+01  0.622E+00    0.50       1.0  T
   3   -216.7006768 -0.112582E+01  0.727E+00    0.64       1.0  T
   4   -210.9266453  0.577403E+01  0.341E+00    0.48       1.0  T
   5   -216.4979394 -0.557129E+01  0.188E+00    0.21       1.0  T
   6   -218.6401594 -0.214222E+01  0.119E+00    1.20       1.0  T
   7   -218.7067139 -0.665544E-01  0.101E+00    1.24       1.0  T
   8   -218.7082310 -0.151717E-02  0.963E-01    1.23       1.0  T
   9   -218.7270401 -0.188091E-01  0.644E-01    1.05       1.0  T
  10   -218.7406216 -0.135815E-01  0.256E-01    0.74       1.0  T
  11   -218.7492238 -0.860221E-02  0.168E-01    0.77       1.0  T
  12   -218.7546649 -0.544106E-02  0.109E-01    0.89       1.0  T
  13   -218.7563117 -0.164685E-02  0.691E-02    1.01       1.0  T
  14   -218.7570766 -0.764890E-03  0.332E-02    1.09       1.0  T
  15   -218.7572714 -0.194827E-03  0.157E-02    1.14       1.0  T
  16   -218.7573001 -0.287018E-04  0.115E-02    1.15       1.0  T
  17   -218.7573159 -0.157672E-04  0.526E-03    1.16       1.9  T
  18   -218.7573184 -0.251551E-05  0.366E-03    1.16       2.8  T
  19   -218.7573216 -0.321088E-05  0.238E-03    1.16       4.3  T
  20   -218.7573232 -0.160215E-05  0.138E-03    1.16       7.4  T
  21   -218.7573238 -0.562864E-06  0.855E-04    1.16      11.9  T
  22   -218.7573240 -0.188980E-06  0.573E-04    1.17      17.7  T
  23   -218.7573241 -0.129917E-06  0.261E-04    1.17      38.9  T
  24   -218.7573241 -0.321200E-07  0.674E-05    1.17     150.7  T
  25   -218.7573241 -0.198003E-08  0.179E-05    1.17     567.3  T

   *** convergence criteria satisfied after 25 iterations ***

         #    Occupation            Energy/Eh            Energy/eV
      -------------------------------------------------------------
         1        2.0000           -1.3254754             -36.0680
       ...           ...                  ...                  ...
       166        2.0000           -0.4182357             -11.3808
       167        2.0000           -0.4121037             -11.2139
       168        2.0000           -0.4094630             -11.1421
       169        2.0000           -0.4052937             -11.0286
       170        2.0000           -0.4000429             -10.8857
       171        2.0000           -0.3918806             -10.6636
       172        2.0000           -0.3751021             -10.2070 (HOMO)
       173                         -0.3321966              -9.0395 (LUMO)
       174                         -0.3201085              -8.7106
       175                         -0.3104373              -8.4474
       176                         -0.3049929              -8.2993
       177                         -0.2992031              -8.1417
       ...                                ...                  ...
       443                        548.4945600           14925.2967
      -------------------------------------------------------------
                  HL-Gap            0.0429055 Eh            1.1675 eV
             Fermi-level           -0.3536494 Eh           -9.6233 eV

 SCC (total)                   0 d,  0 h,  0 min,  1.900 sec
 SCC setup                      ...        0 min,  0.004 sec (  0.209%)
 Dispersion                     ...        0 min,  0.000 sec (  0.016%)
 integral evaluation            ...        0 min,  0.847 sec ( 44.578%)
 zeroth order Hamiltonian       ...        0 min,  0.003 sec (  0.175%)
 iterations                     ...        0 min,  0.792 sec ( 41.658%)
 molecular gradient             ...        0 min,  0.249 sec ( 13.128%)
 printout                       ...        0 min,  0.004 sec (  0.233%)

         :::::::::::::::::::::::::::::::::::::::::::::::::::::
         ::                     SUMMARY                     ::
         :::::::::::::::::::::::::::::::::::::::::::::::::::::
         :: total energy            -215.177540181965 Eh    ::
         :: gradient norm              0.205715014387 Eh/a0 ::
         :: HOMO-LUMO gap              1.167518611408 eV    ::
         ::.................................................::
         :: SCC energy              -218.757324148275 Eh    ::
         :: -> electrostatic           0.211373188225 Eh    ::
         :: repulsion energy           3.675838613488 Eh    ::
         :: dispersion energy         -0.096054647178 Eh    ::
         :: halogen bond corr.         0.000000000000 Eh    ::
         :: add. restraining           0.000000000000 Eh    ::
         :::::::::::::::::::::::::::::::::::::::::::::::::::::

           ------------------------------------------------- 
          |        vertical delta SCC IP calculation        |
           ------------------------------------------------- 

          ...................................................
          :                      SETUP                      :
          :.................................................:
          :  # basis functions                 452          :
          :  # atomic orbitals                 443          :
          :  # shells                          265          :
          :  # electrons                       343          :
          :  # halogen bonds                    14          :
          :  max. iterations                   250          :
          :  Hamiltonian                  GFN1-xTB          :
          :  restarted?                       true          :
          :  GBSA solvation                  false          :
          :  PC potential                    false          :
          :  electronic temp.          300.0000000     K    :
          :  accuracy                    1.0000000          :
          :  -> integral cutoff          0.2500000E+02      :
          :  -> integral neglect         0.1000000E-07      :
          :  -> SCF convergence          0.1000000E-05 Eh   :
          :  -> wf. convergence          0.2000000E-04 e    :
          :  Broyden damping             0.4000000          :
          ...................................................

 iter      E             dE          RMSdq      gap      omega  full diag
   1   -218.3305155 -0.218331E+03  0.199E-01    1.17       0.0  T
   2   -218.3349834 -0.446793E-02  0.223E-01    1.45       1.0  T
   3   -218.3430335 -0.805008E-02  0.987E-02    1.34       1.0  T
   4   -218.3393064  0.372707E-02  0.122E-01    1.38       1.0  T
   5   -218.3438761 -0.456966E-02  0.490E-02    1.36       1.0  T
   6   -218.3443017 -0.425602E-03  0.248E-02    1.36       1.0  T
   7   -218.3443669 -0.651915E-04  0.105E-02    1.36       1.0  T
   8   -218.3443936 -0.267707E-04  0.439E-03    1.36       2.3  T
   9   -218.3443973 -0.361148E-05  0.204E-03    1.36       5.0  T
  10   -218.3443980 -0.710261E-06  0.835E-04    1.36      12.2  T
  11   -218.3443981 -0.997789E-07  0.430E-04    1.36      23.6  T
  12   -218.3443981 -0.255022E-07  0.173E-04    1.36      58.6  T
  13   -218.3443981 -0.482135E-08  0.715E-05    1.36     141.9  T

   *** convergence criteria satisfied after 13 iterations ***

         #    Occupation            Energy/Eh            Energy/eV
      -------------------------------------------------------------
         1        2.0000           -1.3940538             -37.9341
       ...           ...                  ...                  ...
       166        2.0000           -0.4841470             -13.1743
       167        2.0000           -0.4792751             -13.0417
       168        2.0000           -0.4762441             -12.9593
       169        2.0000           -0.4755871             -12.9414
       170        2.0000           -0.4736318             -12.8882
       171        1.9992           -0.4640207             -12.6266
       172        1.0008           -0.4504894             -12.2584 (HOMO)
       173                         -0.4005737             -10.9002 (LUMO)
       174                         -0.3892125             -10.5910
       175                         -0.3789995             -10.3131
       176                         -0.3749970             -10.2042
       177                         -0.3683137             -10.0223
       ...                                ...                  ...
       443                        548.4174354           14923.1980
      -------------------------------------------------------------
                  HL-Gap            0.0499156 Eh            1.3583 eV
             Fermi-level           -0.4413933 Eh          -12.0109 eV

 SCC (total)                   0 d,  0 h,  0 min,  1.515 sec
 SCC setup                      ...        0 min,  0.003 sec (  0.224%)
 Dispersion                     ...        0 min,  0.000 sec (  0.011%)
 integral evaluation            ...        0 min,  0.847 sec ( 55.897%)
 zeroth order Hamiltonian       ...        0 min,  0.003 sec (  0.215%)
 iterations                     ...        0 min,  0.408 sec ( 26.906%)
 molecular gradient             ...        0 min,  0.249 sec ( 16.444%)
 printout                       ...        0 min,  0.005 sec (  0.298%)

         :::::::::::::::::::::::::::::::::::::::::::::::::::::
         ::                     SUMMARY                     ::
         :::::::::::::::::::::::::::::::::::::::::::::::::::::
         :: total energy            -214.764614130071 Eh    ::
         :: gradient norm              0.211325720700 Eh/a0 ::
         :: HOMO-LUMO gap              1.358273458584 eV    ::
         ::.................................................::
         :: SCC energy              -218.344398096381 Eh    ::
         :: -> electrostatic           0.253431142029 Eh    ::
         :: repulsion energy           3.675838613488 Eh    ::
         :: dispersion energy         -0.096054647178 Eh    ::
         :: halogen bond corr.         0.000000000000 Eh    ::
         :: add. restraining           0.000000000000 Eh    ::
         :::::::::::::::::::::::::::::::::::::::::::::::::::::

------------------------------------------------------------------------
empirical IP shift (eV):    4.8455
delta SCC IP (eV):    6.3908
------------------------------------------------------------------------
           ------------------------------------------------- 
          |        vertical delta SCC EA calculation        |
           ------------------------------------------------- 

          ...................................................
          :                      SETUP                      :
          :.................................................:
          :  # basis functions                 452          :
          :  # atomic orbitals                 443          :
          :  # shells                          265          :
          :  # electrons                       345          :
          :  # halogen bonds                    14          :
          :  max. iterations                   250          :
          :  Hamiltonian                  GFN1-xTB          :
          :  restarted?                       true          :
          :  GBSA solvation                  false          :
          :  PC potential                    false          :
          :  electronic temp.          300.0000000     K    :
          :  accuracy                    1.0000000          :
          :  -> integral cutoff          0.2500000E+02      :
          :  -> integral neglect         0.1000000E-07      :
          :  -> SCF convergence          0.1000000E-05 Eh   :
          :  -> wf. convergence          0.2000000E-04 e    :
          :  Broyden damping             0.4000000          :
          ...................................................

 iter      E             dE          RMSdq      gap      omega  full diag
   1   -219.0067525 -0.219007E+03  0.353E-01    0.31       0.0  T
   2   -218.9643732  0.423793E-01  0.478E-01    0.40       1.0  T
   3   -219.0347335 -0.703603E-01  0.251E-01    0.25       1.0  T
   4   -219.0299946  0.473893E-02  0.217E-01    0.18       1.0  T
   5   -219.0309758 -0.981242E-03  0.196E-01    0.27       1.0  T
   6   -219.0480558 -0.170800E-01  0.824E-02    0.17       1.0  T
   7   -219.0496225 -0.156665E-02  0.520E-02    0.14       1.0  T
   8   -219.0512708 -0.164834E-02  0.153E-02    0.15       1.0  T
   9   -219.0513130 -0.422073E-04  0.583E-03    0.14       1.7  T
  10   -219.0513171 -0.406700E-05  0.276E-03    0.14       3.7  T
  11   -219.0513182 -0.115497E-05  0.166E-03    0.14       6.1  T
  12   -219.0513180  0.257362E-06  0.123E-03    0.14       8.3  T
  13   -219.0513187 -0.725958E-06  0.448E-04    0.14      22.7  T
  14   -219.0513188 -0.994657E-07  0.915E-05    0.14     111.0  T
  15   -219.0513188  0.156888E-08  0.775E-05    0.14     131.0  T

   *** convergence criteria satisfied after 15 iterations ***

         #    Occupation            Energy/Eh            Energy/eV
      -------------------------------------------------------------
         1        2.0000           -1.2533545             -34.1055
       ...           ...                  ...                  ...
       167        2.0000           -0.3469841              -9.4419
       168        2.0000           -0.3439731              -9.3600
       169        2.0000           -0.3354516              -9.1281
       170        2.0000           -0.3345456              -9.1034
       171        2.0000           -0.3220317              -8.7629
       172        2.0000           -0.3059870              -8.3263
       173        0.9414           -0.2581948              -7.0258 (HOMO)
       174        0.0586           -0.2529185              -6.8823 (LUMO)
       175        0.0000           -0.2435222              -6.6266
       176                         -0.2366067              -6.4384
       177                         -0.2358062              -6.4166
       178                         -0.2167317              -5.8976
       ...                                ...                  ...
       443                        548.5605957           14927.0936
      -------------------------------------------------------------
                  HL-Gap            0.0052763 Eh            0.1436 eV
             Fermi-level           -0.2688249 Eh           -7.3151 eV

 SCC (total)                   0 d,  0 h,  0 min,  1.577 sec
 SCC setup                      ...        0 min,  0.003 sec (  0.214%)
 Dispersion                     ...        0 min,  0.000 sec (  0.017%)
 integral evaluation            ...        0 min,  0.845 sec ( 53.620%)
 zeroth order Hamiltonian       ...        0 min,  0.003 sec (  0.206%)
 iterations                     ...        0 min,  0.471 sec ( 29.875%)
 molecular gradient             ...        0 min,  0.249 sec ( 15.780%)
 printout                       ...        0 min,  0.004 sec (  0.285%)

         :::::::::::::::::::::::::::::::::::::::::::::::::::::
         ::                     SUMMARY                     ::
         :::::::::::::::::::::::::::::::::::::::::::::::::::::
         :: total energy            -215.471534837710 Eh    ::
         :: gradient norm              0.220079052949 Eh/a0 ::
         :: HOMO-LUMO gap              0.143576465312 eV    ::
         ::.................................................::
         :: SCC energy              -219.051318804020 Eh    ::
         :: -> electrostatic           0.237829979123 Eh    ::
         :: repulsion energy           3.675838613488 Eh    ::
         :: dispersion energy         -0.096054647178 Eh    ::
         :: halogen bond corr.         0.000000000000 Eh    ::
         :: add. restraining           0.000000000000 Eh    ::
         :::::::::::::::::::::::::::::::::::::::::::::::::::::

------------------------------------------------------------------------
empirical EA shift (eV):    4.8455
delta SCC EA (eV):    3.1545
------------------------------------------------------------------------
           -------------------------------------------------
          |                Property Printout                |
           -------------------------------------------------

    * Orbital Energies and Occupations

         #    Occupation            Energy/Eh            Energy/eV
      -------------------------------------------------------------
         1        2.0000           -1.2533545             -34.1055
       ...           ...                  ...                  ...
       161        2.0000           -0.3756088             -10.2208
       162        2.0000           -0.3708132             -10.0903
       163        2.0000           -0.3688748             -10.0376
       164        2.0000           -0.3627853              -9.8719
       165        2.0000           -0.3590729              -9.7709
       166        2.0000           -0.3540095              -9.6331
       167        2.0000           -0.3469841              -9.4419
       168        2.0000           -0.3439731              -9.3600
       169        2.0000           -0.3354516              -9.1281
       170        2.0000           -0.3345456              -9.1034
       171        2.0000           -0.3220317              -8.7629
       172        2.0000           -0.3059870              -8.3263
       173        0.9414           -0.2581948              -7.0258 (HOMO)
       174        0.0586           -0.2529185              -6.8823 (LUMO)
       175        0.0000           -0.2435222              -6.6266
       176                         -0.2366067              -6.4384
       177                         -0.2358062              -6.4166
       178                         -0.2167317              -5.8976
       179                         -0.2003759              -5.4525
       180                         -0.1914806              -5.2105
       181                         -0.1825939              -4.9686
       182                         -0.1797415              -4.8910
       183                         -0.1740451              -4.7360
       184                         -0.1715704              -4.6687
       ...                                ...                  ...
       443                        548.5605957           14927.0936
      -------------------------------------------------------------
                  HL-Gap            0.0052763 Eh            0.1436 eV
             Fermi-level           -0.2688249 Eh           -7.3151 eV

  Mulliken/CM5 charges        n(s)   n(p)   n(d)
     1 C  -0.09085 -0.05549   0.744  3.165  0.000
     2 O   0.16520  0.11902   1.520  4.645  0.000
     3 C  -0.02366 -0.02545   1.137  2.839  0.000
     4 C   0.00913 -0.03971   1.096  2.913  0.000
     5 C  -0.05640 -0.06022   1.152  2.791  0.000
     6 C  -0.06314 -0.06712   1.165  2.772  0.000
     7 C   0.01072 -0.03819   1.076  2.935  0.000
     8 C  -0.01454 -0.01779   1.084  2.902  0.000
     9 C  -0.00688 -0.00756   1.086  2.907  0.000
    10 C   0.00331  0.00944   1.029  2.974  0.000
    11 C  -0.11062  0.00654   1.203  2.686  0.000
    12 N   0.28395  0.15073   1.503  3.781  0.000
    13 C  -0.10407  0.01503   1.205  2.691  0.000
    14 N   0.29613  0.16588   1.524  3.772  0.000
    15 C   0.06936  0.06746   1.061  3.008  0.000
    16 C   0.01612 -0.03203   1.079  2.937  0.000
    17 C  -0.01058 -0.00295   1.135  2.854  0.000
    18 S   0.06991  0.03780   1.885  4.045  0.140
    19 C  -0.00455  0.01317   1.118  2.877  0.000
    20 C  -0.00776  0.00543   1.137  2.856  0.000
    21 C  -0.00024 -0.00821   1.074  2.926  0.000
    22 C   0.02576 -0.08029   1.072  2.954  0.000
    23 C   0.05645 -0.09504   1.072  2.984  0.000
    24 S   0.06228  0.02962   1.877  4.118  0.068
    25 C  -0.00598  0.01628   1.141  2.853  0.000
    26 C  -0.04823  0.02172   1.060  2.892  0.000
    27 N   0.10870 -0.14900   1.253  3.855  0.000
    28 C  -0.03522 -0.08430   1.089  2.876  0.000
    29 C   0.05693 -0.09075   1.067  2.990  0.000
    30 C  -0.05200  0.01768   1.060  2.888  0.000
    31 C   0.01572  0.02898   1.073  2.943  0.000
    32 C  -0.06978  0.01832   1.148  2.782  0.000
    33 N   0.24651  0.08471   1.473  3.774  0.000
    34 S  -0.15850 -0.02369   1.863  3.674  0.304
    35 N   0.24767  0.08589   1.472  3.776  0.000
    36 C  -0.06927  0.01884   1.148  2.783  0.000
    37 C   0.01651  0.02977   1.072  2.944  0.000
    38 C  -0.05281  0.01649   1.061  2.886  0.000
    39 N   0.11075 -0.14691   1.253  3.858  0.000
    40 C  -0.03443 -0.08311   1.089  2.876  0.000
    41 C   0.05774 -0.08974   1.067  2.991  0.000
    42 C  -0.04423  0.02465   1.062  2.894  0.000
    43 C  -0.00581  0.01654   1.139  2.855  0.000
    44 S   0.06183  0.02763   1.877  4.115  0.070
    45 C  -0.00178  0.00901   1.151  2.847  0.000
    46 C   0.00970  0.00774   1.121  2.889  0.000
    47 Se  0.00571  0.01446   1.904  4.079  0.023
    48 C   0.01274  0.00298   1.148  2.865  0.000
    49 C   0.00163 -0.00716   1.088  2.913  0.000
    50 C   0.04111 -0.06282   1.086  2.955  0.000
    51 C   0.20121  0.05013   1.048  3.153  0.000
    52 C   0.12170  0.07279   1.057  3.065  0.000
    53 C   0.03387  0.03030   1.070  2.964  0.000
    54 C  -0.00308 -0.00393   1.110  2.887  0.000
    55 C   0.01218  0.01837   1.034  2.978  0.000
    56 C  -0.09901  0.02012   1.211  2.690  0.000
    57 N   0.30144  0.17153   1.526  3.775  0.000
    58 C  -0.09671  0.02141   1.215  2.689  0.000
    59 N   0.30335  0.17376   1.523  3.780  0.000
    60 C   0.01288  0.00958   1.079  2.934  0.000
    61 C   0.12685  0.07795   1.077  3.049  0.000
    62 C  -0.04392 -0.04790   1.173  2.783  0.000
    63 C  -0.04010 -0.04392   1.175  2.785  0.000
    64 C   0.13532  0.08646   1.060  3.076  0.000
    65 C   0.02740  0.02547   1.105  2.922  0.000
    66 C  -0.13621 -0.10242   1.175  2.689  0.000
    67 O   0.33793  0.28016   1.643  4.695  0.000
    68 Cl  0.17026  0.16938   1.859  5.291  0.021
    69 Cl  0.13025  0.12937   1.854  5.256  0.021
    70 Cl  0.11719  0.11617   1.852  5.250  0.015
    71 Cl  0.16476  0.16375   1.856  5.290  0.019
    72 H  -0.05344  0.00621   0.947  0.000  0.000
    73 H  -0.04886  0.01645   0.951  0.000  0.000
    74 H  -0.03342  0.03722   0.967  0.000  0.000
    75 H  -0.02284  0.03479   0.977  0.000  0.000
    76 H  -0.02073  0.03720   0.979  0.000  0.000
    77 H  -0.01822  0.03465   0.982  0.000  0.000
    78 H  -0.01553  0.03659   0.984  0.000  0.000
    79 H  -0.01465  0.03892   0.985  0.000  0.000
    80 H  -0.03909  0.03086   0.961  0.000  0.000
    81 H  -0.04081  0.02783   0.959  0.000  0.000
    82 H  -0.02093  0.03399   0.979  0.000  0.000
    83 H  -0.02754  0.02490   0.972  0.000  0.000
    84 H  -0.02347  0.03322   0.977  0.000  0.000
    85 H  -0.04068  0.02930   0.959  0.000  0.000
    86 H  -0.03559  0.03238   0.964  0.000  0.000
    87 H  -0.02222  0.03272   0.978  0.000  0.000
    88 H  -0.02835  0.02404   0.972  0.000  0.000
    89 H  -0.01769  0.03832   0.982  0.000  0.000
    90 H  -0.02523  0.04484   0.975  0.000  0.000
    91 H  -0.00042  0.05887   1.000  0.000  0.000
    92 H   0.03481  0.09071   1.035  0.000  0.000
    93 H  -0.00706  0.04489   0.993  0.000  0.000
    94 H  -0.30355 -0.25094   0.696  0.000  0.000
    95 H  -0.31843 -0.25151   0.682  0.000  0.000
    96 H  -0.29769 -0.23278   0.702  0.000  0.000
    97 H  -0.32613 -0.26649   0.674  0.000  0.000
(R)spin-density population

 Mulliken population n(s)   n(p)   n(d)
     1 C   0.0000  -0.000  0.000  0.000
     2 O   0.0005   0.000  0.000  0.000
     3 C   0.0201   0.000  0.020  0.000
     4 C   0.0030   0.000  0.003  0.000
     5 C   0.0316   0.000  0.032  0.000
     6 C   0.0017   0.000  0.002  0.000
     7 C   0.0229   0.000  0.023  0.000
     8 C   0.0134   0.000  0.013  0.000
     9 C   0.0735   0.000  0.074  0.000
    10 C   0.0753  -0.000  0.075  0.000
    11 C   0.0099  -0.000  0.010  0.000
    12 N   0.0366  -0.000  0.037  0.000
    13 C   0.0090  -0.000  0.009  0.000
    14 N   0.0350   0.000  0.035  0.000
    15 C   0.0136  -0.000  0.014  0.000
    16 C   0.0599  -0.000  0.060  0.000
    17 C   0.0041   0.000  0.004  0.000
    18 S   0.0215  -0.000  0.019  0.003
    19 C   0.0334   0.000  0.033  0.000
    20 C   0.0014  -0.000  0.001  0.000
    21 C   0.0387   0.000  0.039  0.000
    22 C   0.0003   0.000  0.000  0.000
    23 C   0.0024   0.001  0.002  0.000
    24 S   0.0044   0.000  0.004  0.001
    25 C   0.0079  -0.000  0.008  0.000
    26 C   0.0027   0.000  0.003  0.000
    27 N   0.0137   0.000  0.014  0.000
    28 C   0.0001   0.000  0.000  0.000
    29 C   0.0008   0.000  0.001  0.000
    30 C   0.0190   0.000  0.019  0.000
    31 C   0.0047   0.000  0.005  0.000
    32 C   0.0007   0.000  0.001  0.000
    33 N   0.0087  -0.000  0.009  0.000
    34 S   0.0159   0.000  0.012  0.004
    35 N   0.0106   0.000  0.011  0.000
    36 C   0.0014   0.000  0.001  0.000
    37 C   0.0076   0.000  0.008  0.000
    38 C   0.0146  -0.000  0.015  0.000
    39 N   0.0123   0.000  0.012  0.000
    40 C   0.0002   0.000  0.000  0.000
    41 C   0.0010   0.001  0.000  0.000
    42 C   0.0041   0.000  0.004  0.000
    43 C   0.0036  -0.000  0.004  0.000
    44 S   0.0041   0.000  0.004  0.000
    45 C   0.0040  -0.000  0.004  0.000
    46 C   0.0214  -0.000  0.021  0.000
    47 Se  0.0172   0.000  0.015  0.003
    48 C   0.0072  -0.000  0.007  0.000
    49 C   0.0257  -0.000  0.026  0.000
    50 C   0.0003  -0.000  0.000  0.000
    51 C   0.0012   0.000  0.001  0.000
    52 C   0.0499  -0.000  0.050  0.000
    53 C   0.0108   0.000  0.011  0.000
    54 C   0.0565   0.000  0.057  0.000
    55 C   0.0397   0.000  0.040  0.000
    56 C   0.0066  -0.000  0.007  0.000
    57 N   0.0207  -0.000  0.021  0.000
    58 C   0.0070   0.000  0.007  0.000
    59 N   0.0218  -0.000  0.022  0.000
    60 C   0.0020  -0.000  0.002  0.000
    61 C   0.0134  -0.000  0.013  0.000
    62 C   0.0005  -0.000  0.000  0.000
    63 C   0.0156   0.000  0.016  0.000
    64 C   0.0008   0.000  0.001  0.000
    65 C   0.0134  -0.000  0.013  0.000
    66 C   0.0010   0.000  0.001  0.000
    67 O   0.0008   0.000  0.001  0.000
    68 Cl  0.0037  -0.000  0.002  0.002
    69 Cl  0.0078   0.000  0.004  0.004
    70 Cl  0.0005   0.000  0.000  0.000
    71 Cl  0.0002   0.000  0.000  0.000
    72 H   0.0000   0.000  0.000  0.000
    73 H   0.0000   0.000  0.000  0.000
    74 H   0.0000   0.000  0.000  0.000
    75 H   0.0003   0.000  0.000  0.000
    76 H   0.0006   0.001  0.000  0.000
    77 H   0.0000   0.000  0.000  0.000
    78 H   0.0002   0.000  0.000  0.000
    79 H   0.0000   0.000  0.000  0.000
    80 H   0.0001   0.000  0.000  0.000
    81 H   0.0003   0.000  0.000  0.000
    82 H   0.0000   0.000  0.000  0.000
    83 H   0.0000   0.000  0.000  0.000
    84 H   0.0000   0.000  0.000  0.000
    85 H   0.0001   0.000  0.000  0.000
    86 H   0.0003   0.000  0.000  0.000
    87 H   0.0000   0.000  0.000  0.000
    88 H   0.0001   0.000  0.000  0.000
    89 H   0.0002   0.000  0.000  0.000
    90 H   0.0012   0.001  0.000  0.000
    91 H   0.0000   0.000  0.000  0.000
    92 H   0.0000   0.000  0.000  0.000
    93 H   0.0000   0.000  0.000  0.000
    94 H   0.0001   0.000  0.000  0.000
    95 H   0.0004   0.000  0.000  0.000
    96 H   0.0000   0.000  0.000  0.000
    97 H   0.0000   0.000  0.000  0.000

Wiberg/Mayer (AO) data.
largest (>0.10) Wiberg bond orders for each atom
          total WBO             WBO to atom ...
     1  C   2.382        O    2 0.986    C   15 0.788    C    3 0.561
     2  O   1.953        C    1 0.986    C    3 0.350    S   18 0.196    C   15 0.125
     3  C   3.905        C    4 1.428    C    8 1.308    C    1 0.561    O    2 0.350    C   15 0.147
     4  C   3.915        C    3 1.428    C    5 1.379    H   72 0.977
     5  C   3.905        C    4 1.379    C    6 1.368    Cl  69 1.088
     6  C   3.971        C    7 1.416    C    5 1.368    Cl  70 1.094
     7  C   3.831        C    6 1.416    C    8 1.399    H   73 0.990
     8  C   3.879        C    7 1.399    C    3 1.308    C    9 1.105
     9  C   3.801        C   10 1.405    C   15 1.199    C    8 1.105
    10  C   3.708        C    9 1.405    C   11 1.165    C   13 1.160
    11  C   4.087        N   12 2.869    C   10 1.165
    12  N   2.841        C   11 2.869
    13  C   4.087        N   14 2.888    C   10 1.160
    14  N   2.900        C   13 2.888
    15  C   3.753        C   16 1.450    C    9 1.199    C    1 0.788    C    3 0.147    O    2 0.125
    16  C   3.760        C   15 1.450    C   17 1.327    H   74 0.973
    17  C   3.882        C   21 1.365    C   16 1.327    S   18 1.134
    18  S   2.648        C   19 1.180    C   17 1.134    O    2 0.196
    19  C   3.824        C   20 1.338    C   26 1.288    S   18 1.180
    20  C   3.876        C   21 1.376    C   19 1.338    S   24 1.147
    21  C   3.785        C   20 1.376    C   17 1.365    C   22 1.014
    22  C   3.894        C   21 1.014    H   76 0.995    H   75 0.990    C   23 0.975
    23  C   3.914        H   79 1.002    H   77 0.997    H   78 0.993    C   22 0.975
    24  S   2.463        C   25 1.190    C   20 1.147
    25  C   3.890        C   26 1.336    C   31 1.314    S   24 1.190
    26  C   3.854        C   25 1.336    C   19 1.288    N   27 1.163
    27  N   3.122        C   30 1.172    C   26 1.163    C   28 0.970
    28  C   3.881        H   80 1.002    C   29 0.992    H   81 0.990    N   27 0.970
    29  C   3.892        H   82 1.001    H   84 0.998    H   83 0.992    C   28 0.992
    30  C   3.808        C   31 1.287    C   38 1.274    N   27 1.172
    31  C   3.870        C   25 1.314    C   30 1.287    C   32 1.209
    32  C   4.029        N   33 1.546    C   31 1.209    C   36 1.192    S   34 0.104
    33  N   2.995        C   32 1.546    S   34 1.390
    34  S   3.102        N   33 1.390    N   35 1.389    C   32 0.104    C   36 0.103
    35  N   2.991        C   36 1.544    S   34 1.389
    36  C   4.028        N   35 1.544    C   37 1.211    C   32 1.192    S   34 0.103
    37  C   3.868        C   43 1.305    C   38 1.292    C   36 1.211
    38  C   3.811        C   37 1.292    C   30 1.274    N   39 1.168
    39  N   3.120        C   38 1.168    C   42 1.161    C   40 0.972
    40  C   3.881        H   85 1.002    C   41 0.992    H   86 0.991    N   39 0.972
    41  C   3.888        H   87 1.001    H   89 0.999    H   88 0.992    C   40 0.992
    42  C   3.851        C   43 1.339    C   46 1.295    N   39 1.161
    43  C   3.895        C   42 1.339    C   37 1.305    S   44 1.197
    44  S   2.481        C   43 1.197    C   45 1.150
    45  C   3.890        C   46 1.386    C   49 1.326    S   44 1.150
    46  C   3.805        C   45 1.386    C   42 1.295    Se  47 1.145
    47  Se  2.355        C   46 1.145    C   48 1.051
    48  C   3.873        C   49 1.440    C   52 1.324    Se  47 1.051
    49  C   3.809        C   48 1.440    C   45 1.326    C   50 1.024
    50  C   3.911        C   49 1.024    H   91 0.992    C   51 0.979    H   90 0.961
    51  C   3.756        H   92 1.029    C   50 0.979    H   93 0.961    H   94 0.862
    52  C   3.583        C   53 1.489    C   48 1.324    H   95 0.799
    53  C   3.831        C   52 1.489    C   54 1.181    C   66 1.094
    54  C   3.839        C   55 1.436    C   53 1.181    C   60 1.109
    55  C   3.760        C   54 1.436    C   58 1.160    C   56 1.159
    56  C   4.099        N   57 2.888    C   55 1.159
    57  N   2.904        C   56 2.888
    58  C   4.106        N   59 2.869    C   55 1.160
    59  N   2.890        C   58 2.869
    60  C   3.873        C   61 1.429    C   65 1.312    C   54 1.109
    61  C   3.705        C   60 1.429    C   62 1.416    H   96 0.857
    62  C   3.965        C   61 1.416    C   63 1.383    Cl  71 1.068
    63  C   3.947        C   64 1.402    C   62 1.383    Cl  68 1.064
    64  C   3.744        C   65 1.459    C   63 1.402    H   97 0.837
    65  C   3.902        C   64 1.459    C   60 1.312    C   66 1.042
    66  C   3.990        O   67 1.792    C   53 1.094    C   65 1.042
    67  O   1.967        C   66 1.792
    68  Cl  1.175        C   63 1.064
    69  Cl  1.188        C    5 1.088
    70  Cl  1.203        C    6 1.094
    71  Cl  1.179        C   62 1.068
    72  H   1.029        C    4 0.977
    73  H   1.053        C    7 0.990
    74  H   1.055        C   16 0.973
    75  H   1.038        C   22 0.990
    76  H   1.055        C   22 0.995
    77  H   1.032        C   23 0.997
    78  H   1.048        C   23 0.993
    79  H   1.048        C   23 1.002
    80  H   1.036        C   28 1.002
    81  H   1.039        C   28 0.990
    82  H   1.041        C   29 1.001
    83  H   1.031        C   29 0.992
    84  H   1.047        C   29 0.998
    85  H   1.037        C   40 1.002
    86  H   1.043        C   40 0.991
    87  H   1.041        C   41 1.001
    88  H   1.030        C   41 0.992
    89  H   1.051        C   41 0.999
    90  H   1.046        C   50 0.961
    91  H   1.059        C   50 0.992
    92  H   1.072        C   51 1.029
    93  H   0.950        C   51 0.961
    94  H   0.934        C   51 0.862
    95  H   0.939        C   52 0.799
    96  H   0.946        C   61 0.857
    97  H   0.919        C   64 0.837

 dipole moment from electron density (au)
     X       Y       Z   
  -2.7459 -11.0493   0.4402  total (Debye):   28.961


           -------------------------------------------------
          | TOTAL ENERGY             -215.471534837710 Eh   |
          | GRADIENT NORM               0.220079052949 Eh/α |
          | HOMO-LUMO GAP               0.143576465312 eV   |
           -------------------------------------------------

------------------------------------------------------------------------
 * finished run on 2021/12/02 at 16:21:19.335     
------------------------------------------------------------------------
 total:
 * wall-time:     0 d,  0 h,  0 min,  5.866 sec
 *  cpu-time:     0 d,  0 h,  0 min,  5.844 sec
 * ratio c/w:     0.996 speedup
 SCF:
 * wall-time:     0 d,  0 h,  0 min,  4.993 sec
 *  cpu-time:     0 d,  0 h,  0 min,  4.981 sec
 * ratio c/w:     0.998 speedup

