      -----------------------------------------------------------      
     |                   =====================                   |     
     |                           x T B                           |     
     |                   =====================                   |     
     |                         S. Grimme                         |     
     |          Mulliken Center for Theoretical Chemistry        |     
     |                    University of Bonn                     |     
     |                Version 6.2 RC2 (SAW190805)                |     
      -----------------------------------------------------------      

   This program is distributed in the hope that it will be useful,
   but WITHOUT ANY WARRANTY; without even the implied warranty of
   MERCHANTABILITY or FITNESS FOR A PARTICULAR PURPOSE.
   
   FOR NON-COMMERCIAL, ACADEMIA USE ONLY.
   
   Cite this work as:
   * S. Grimme, C. Bannwarth, P. Shushkov, J. Chem. Theory Comput., 2017,
     13, 1989-2009. DOI: 10.1021/acs.jctc.7b00118
   * C. Bannwarth, S. Ehlert and S. Grimme., J. Chem. Theory Comput., 2019,
     15, 1652-1671. DOI: 10.1021/acs.jctc.8b01176
   * P. Pracht, E. Caldeweyher, S. Ehlert, S. Grimme, ChemRxiv, 2019, preprint.
     DOI: 10.26434/chemrxiv.8326202.v1
   
   for DFT-D4:
   * E. Caldeweyher, C. Bannwarth and S. Grimme, J. Chem. Phys., 2017,
     147, 034112. DOI: 10.1063/1.4993215
   * E. Caldeweyher, S. Ehlert, A. Hansen, H. Neugebauer, S. Spicher,
     C. Bannwarth and S. Grimme, J. Chem. Phys., 2019, 150, 154122.
     DOI: 10.1063/1.5090222
   
   for sTDA-xTB:
   * S. Grimme and C. Bannwarth, J. Chem. Phys., 2016, 145, 054103.
     DOI: 10.1063/1.4959605
   
   in the mass-spec context:
   * V. Asgeirsson, C. Bauer and S. Grimme, Chem. Sci., 2017, 8, 4879.
     DOI: 10.1039/c7sc00601b
   
   for metadynamics refer to:
   * S. Grimme, J. Chem. Theory Comput., 2019, 155, 2847-2862
     DOI: 10.1021/acs.jctc.9b00143
   
   with help from (in alphabetical order)
   C. Bannwarth, F. Bohle, G. Brandenburg, E. Caldeweyher, M. Checinski,
   S. Dohm, S. Ehlert, S. Ehrlich, F. März, H. Neugebauer, J. Pisarek,
   P. Pracht, P. Shushkov, and S. Spicher.
   
 * started run on 2021/12/02 at 16:23:00.691     

           -------------------------------------------------
          |                Calculation Setup                |
           -------------------------------------------------

          program call               : /ihome/ghutchison/geoffh/xtb/xtb AOT1.xyz --vipea
          hostname                   : smp-n128
          coordinate file            : AOT1.xyz
          omp threads                :                     1
          number of atoms            :                    91
          number of electrons        :                   314
          charge                     :                     0
          spin                       :                   0.0
          first test random number   :      0.86694550173840


########################################################################
# WARNING! Please study the warnings concerning your input carefully
#  - XTBPATH is not set, using XTBHOME instead
########################################################################

           ------------------------------------------------- 
          |                 I P E A - x T B                 |
          |  Ionisation Potentials and Electron Affinities  |
           ------------------------------------------------- 
             KAB for M(3d)-M(3d) :                1.1000
             KAB for M(4d)-M(4d) :                1.2000
             KAB for M(5d)-M(5d) :                1.2000
             k(s)                :                2.1500
             k(p)                :                2.3000
             k(d)                :                2.0000
             k(f)                :                0.0000
             kEN (H0ij)          :                0.7000
             D3 a1               :                0.6300
             D3 a2               :                5.0000
             D3 s6               :                1.0000
             D3 s8               :                2.4000
             D3 s9               :                0.0000
             alphaj              :                1.0000
             XBdamp              :                0.4400
             XBrad               :                1.3000
             kcnsh               :      1.0000   -0.3000   -0.5000    0.5000

  Z AO/shell   Hii/eV     exponent
  1     Thu Sep 22 23:34:11 CEST 2016   EN: 2.200 GAM: 0.405  GM3: 0.1500
     1s    -10.521941    1.306199
     2s     -3.560151    0.398421
  6     Thu Sep 22 23:34:11 CEST 2016   EN: 2.550 GAM: 0.640  GM3: 0.1500
     2s    -15.968100    1.979793
     2p     -9.777107    1.850537
     3S     -3.366990    0.633095
  7     Thu Sep 22 23:34:11 CEST 2016   EN: 3.040 GAM: 0.493  GM3:-0.1000
     2s    -24.040776    2.126160
     2p    -14.426520    2.068425
     3S     -5.882278    0.671040
  8     Thu Sep 22 23:34:11 CEST 2016   EN: 3.440 GAM: 0.717  GM3:-0.2000
     2s    -26.695120    2.575264
     2p    -16.014457    2.159448
     3S     -6.622058    0.958679
  9     Tue Jan 17 20:22:52 CET 2017    EN: 3.980 GAM: 0.574  GM3: 0.2000
     2s    -27.565998    2.304073
     2p    -17.439238    2.314354
     3S     -6.120500    0.570243
 16     Tue Jan 17 20:57:36 CET 2017    EN: 2.580 GAM: 0.455  GM3: 0.1020
     3s    -24.488821    2.492075
     3p    -12.136640    1.997904
     3d     -1.796070    1.747541

           ------------------------------------------------- 
          |        Self-Consistent Charge Iterations        |
           ------------------------------------------------- 

          ...................................................
          :                      SETUP                      :
          :.................................................:
          :  # basis functions                 386          :
          :  # atomic orbitals                 383          :
          :  # shells                          245          :
          :  # electrons                       314          :
          :  # halogen bonds                     0          :
          :  max. iterations                   250          :
          :  Hamiltonian                  GFN1-xTB          :
          :  restarted?                      false          :
          :  GBSA solvation                  false          :
          :  PC potential                    false          :
          :  electronic temp.          300.0000000     K    :
          :  accuracy                    1.0000000          :
          :  -> integral cutoff          0.2500000E+02      :
          :  -> integral neglect         0.1000000E-07      :
          :  -> SCF convergence          0.1000000E-05 Eh   :
          :  -> wf. convergence          0.2000000E-04 e    :
          :  Broyden damping             0.4000000          :
          ...................................................

 iter      E             dE          RMSdq      gap      omega  full diag
   1   -196.2708275 -0.196271E+03  0.102E+01    0.28       0.0  T
   2   -184.1289630  0.121419E+02  0.735E+00    0.08       1.0  T
   3    -10.9345479  0.173194E+03  0.126E+01    0.25       1.0  T
   4   -113.5651986 -0.102631E+03  0.100E+01    0.06       1.0  T
   5   -199.2496491 -0.856845E+02  0.343E+00    0.03       1.0  T
   6   -200.2703352 -0.102069E+01  0.194E+00    0.38       1.0  T
   7   -200.4007003 -0.130365E+00  0.185E+00    0.29       1.0  T
   8   -200.5557192 -0.155019E+00  0.151E+00    0.29       1.0  T
   9   -201.1902181 -0.634499E+00  0.119E+00    0.15       1.0  T
  10   -201.1624985  0.277196E-01  0.117E+00    0.13       1.0  T
  11   -201.3301460 -0.167648E+00  0.717E-01    0.59       1.0  T
  12   -201.3619508 -0.318048E-01  0.561E-01    0.62       1.0  T
  13   -201.3831494 -0.211986E-01  0.391E-01    0.65       1.0  T
  14   -201.3937578 -0.106084E-01  0.300E-01    0.67       1.0  T
  15   -201.4023146 -0.855680E-02  0.213E-01    0.64       1.0  T
  16   -201.4071202 -0.480559E-02  0.134E-01    0.55       1.0  T
  17   -201.4098327 -0.271257E-02  0.650E-02    0.34       1.0  T
  18   -201.4101928 -0.360073E-03  0.491E-02    0.34       1.0  T
  19   -201.4104597 -0.266898E-03  0.357E-02    0.31       1.0  T
  20   -201.4106010 -0.141311E-03  0.307E-02    0.31       1.0  T
  21   -201.4107551 -0.154100E-03  0.240E-02    0.32       1.0  T
  22   -201.4108238 -0.686776E-04  0.209E-02    0.33       1.0  T
  23   -201.4109656 -0.141795E-03  0.136E-02    0.33       1.0  T
  24   -201.4110596 -0.939620E-04  0.661E-03    0.30       1.6  T
  25   -201.4110807 -0.210905E-04  0.328E-03    0.28       3.2  T
  26   -201.4110870 -0.632739E-05  0.746E-04    0.27      14.1  T
  27   -201.4110869  0.350826E-07  0.658E-04    0.27      15.9  T
  28   -201.4110870 -0.101964E-06  0.310E-04    0.27      33.8  T
  29   -201.4110871 -0.520676E-07  0.141E-04    0.27      74.5  T
  30   -201.4110871 -0.718472E-09  0.112E-04    0.27      93.2  T

   *** convergence criteria satisfied after 30 iterations ***

         #    Occupation            Energy/Eh            Energy/eV
      -------------------------------------------------------------
         1        2.0000           -1.0736210             -29.2147
       ...           ...                  ...                  ...
       151        2.0000           -0.3993003             -10.8655
       152        2.0000           -0.3948547             -10.7445
       153        2.0000           -0.3895003             -10.5988
       154        2.0000           -0.3762596             -10.2385
       155        2.0000           -0.3656460              -9.9497
       156        2.0000           -0.3555637              -9.6754
       157        1.9888           -0.3146143              -8.5611 (HOMO)
       158        0.0110           -0.3047581              -8.2929 (LUMO)
       159        0.0002           -0.3010111              -8.1909
       160                         -0.2891841              -7.8691
       161                         -0.2704987              -7.3606
       162                         -0.2548459              -6.9347
       ...                                ...                  ...
       383                        482.4480284           13128.0791
      -------------------------------------------------------------
                  HL-Gap            0.0098562 Eh            0.2682 eV
             Fermi-level           -0.3096954 Eh           -8.4272 eV

 SCC (total)                   0 d,  0 h,  0 min,  1.547 sec
 SCC setup                      ...        0 min,  0.003 sec (  0.215%)
 Dispersion                     ...        0 min,  0.000 sec (  0.018%)
 integral evaluation            ...        0 min,  0.666 sec ( 43.016%)
 zeroth order Hamiltonian       ...        0 min,  0.003 sec (  0.178%)
 iterations                     ...        0 min,  0.663 sec ( 42.852%)
 molecular gradient             ...        0 min,  0.209 sec ( 13.502%)
 printout                       ...        0 min,  0.003 sec (  0.215%)

         :::::::::::::::::::::::::::::::::::::::::::::::::::::
         ::                     SUMMARY                     ::
         :::::::::::::::::::::::::::::::::::::::::::::::::::::
         :: total energy            -198.233254604236 Eh    ::
         :: gradient norm              0.289353015614 Eh/a0 ::
         :: HOMO-LUMO gap              0.268199807913 eV    ::
         ::.................................................::
         :: SCC energy              -201.411087100830 Eh    ::
         :: -> electrostatic           0.499934529140 Eh    ::
         :: repulsion energy           3.256821407725 Eh    ::
         :: dispersion energy         -0.078988911132 Eh    ::
         :: halogen bond corr.         0.000000000000 Eh    ::
         :: add. restraining           0.000000000000 Eh    ::
         :::::::::::::::::::::::::::::::::::::::::::::::::::::

           ------------------------------------------------- 
          |        vertical delta SCC IP calculation        |
           ------------------------------------------------- 

          ...................................................
          :                      SETUP                      :
          :.................................................:
          :  # basis functions                 386          :
          :  # atomic orbitals                 383          :
          :  # shells                          245          :
          :  # electrons                       313          :
          :  # halogen bonds                     0          :
          :  max. iterations                   250          :
          :  Hamiltonian                  GFN1-xTB          :
          :  restarted?                       true          :
          :  GBSA solvation                  false          :
          :  PC potential                    false          :
          :  electronic temp.          300.0000000     K    :
          :  accuracy                    1.0000000          :
          :  -> integral cutoff          0.2500000E+02      :
          :  -> integral neglect         0.1000000E-07      :
          :  -> SCF convergence          0.1000000E-05 Eh   :
          :  -> wf. convergence          0.2000000E-04 e    :
          :  Broyden damping             0.4000000          :
          ...................................................

 iter      E             dE          RMSdq      gap      omega  full diag
   1   -200.9934107 -0.200993E+03  0.405E-01    0.27       0.0  T
   2   -200.9029304  0.904803E-01  0.593E-01    1.06       1.0  T
   3   -201.0215878 -0.118657E+00  0.241E-01    0.93       1.0  T
   4   -201.0315970 -0.100092E-01  0.155E-01    1.05       1.0  T
   5   -201.0135712  0.180258E-01  0.235E-01    1.14       1.0  T
   6   -201.0372625 -0.236913E-01  0.838E-02    1.11       1.0  T
   7   -201.0391646 -0.190207E-02  0.387E-02    1.12       1.0  T
   8   -201.0397178 -0.553211E-03  0.143E-02    1.13       1.0  T
   9   -201.0397975 -0.796826E-04  0.471E-03    1.13       2.2  T
  10   -201.0397953  0.214994E-05  0.452E-03    1.13       2.3  T
  11   -201.0398029 -0.759945E-05  0.159E-03    1.13       6.6  T
  12   -201.0398036 -0.684852E-06  0.773E-04    1.13      13.6  T
  13   -201.0398038 -0.237161E-06  0.195E-04    1.13      53.7  T
  14   -201.0398038  0.136815E-07  0.212E-04    1.13      49.6  T
  15   -201.0398038 -0.204346E-07  0.560E-05    1.13     187.3  T

   *** convergence criteria satisfied after 15 iterations ***

         #    Occupation            Energy/Eh            Energy/eV
      -------------------------------------------------------------
         1        2.0000           -1.1392349             -31.0002
       ...           ...                  ...                  ...
       151        2.0000           -0.4750051             -12.9255
       152        2.0000           -0.4745757             -12.9139
       153        2.0000           -0.4684435             -12.7470
       154        2.0000           -0.4640322             -12.6270
       155        2.0000           -0.4485155             -12.2047
       156        1.9566           -0.4294589             -11.6862
       157        1.0434           -0.4235807             -11.5262 (HOMO)
       158                         -0.3821683             -10.3993 (LUMO)
       159                         -0.3670912              -9.9891
       160                         -0.3625146              -9.8645
       161                         -0.3533317              -9.6146
       162                         -0.3202580              -8.7147
       ...                                ...                  ...
       383                        482.3694257           13125.9402
      -------------------------------------------------------------
                  HL-Gap            0.0414124 Eh            1.1269 eV
             Fermi-level           -0.4146967 Eh          -11.2845 eV

 SCC (total)                   0 d,  0 h,  0 min,  1.212 sec
 SCC setup                      ...        0 min,  0.003 sec (  0.278%)
 Dispersion                     ...        0 min,  0.000 sec (  0.014%)
 integral evaluation            ...        0 min,  0.660 sec ( 54.443%)
 zeroth order Hamiltonian       ...        0 min,  0.003 sec (  0.223%)
 iterations                     ...        0 min,  0.334 sec ( 27.525%)
 molecular gradient             ...        0 min,  0.209 sec ( 17.216%)
 printout                       ...        0 min,  0.004 sec (  0.298%)

         :::::::::::::::::::::::::::::::::::::::::::::::::::::
         ::                     SUMMARY                     ::
         :::::::::::::::::::::::::::::::::::::::::::::::::::::
         :: total energy            -197.861971341493 Eh    ::
         :: gradient norm              0.276338662738 Eh/a0 ::
         :: HOMO-LUMO gap              1.126888702783 eV    ::
         ::.................................................::
         :: SCC energy              -201.039803838086 Eh    ::
         :: -> electrostatic           0.549136840979 Eh    ::
         :: repulsion energy           3.256821407725 Eh    ::
         :: dispersion energy         -0.078988911132 Eh    ::
         :: halogen bond corr.         0.000000000000 Eh    ::
         :: add. restraining           0.000000000000 Eh    ::
         :::::::::::::::::::::::::::::::::::::::::::::::::::::

------------------------------------------------------------------------
empirical IP shift (eV):    4.8455
delta SCC IP (eV):    5.2576
------------------------------------------------------------------------
           ------------------------------------------------- 
          |        vertical delta SCC EA calculation        |
           ------------------------------------------------- 

          ...................................................
          :                      SETUP                      :
          :.................................................:
          :  # basis functions                 386          :
          :  # atomic orbitals                 383          :
          :  # shells                          245          :
          :  # electrons                       315          :
          :  # halogen bonds                     0          :
          :  max. iterations                   250          :
          :  Hamiltonian                  GFN1-xTB          :
          :  restarted?                       true          :
          :  GBSA solvation                  false          :
          :  PC potential                    false          :
          :  electronic temp.          300.0000000     K    :
          :  accuracy                    1.0000000          :
          :  -> integral cutoff          0.2500000E+02      :
          :  -> integral neglect         0.1000000E-07      :
          :  -> SCF convergence          0.1000000E-05 Eh   :
          :  -> wf. convergence          0.2000000E-04 e    :
          :  Broyden damping             0.4000000          :
          ...................................................

 iter      E             dE          RMSdq      gap      omega  full diag
   1   -201.5946909 -0.201595E+03  0.491E-01    0.41       0.0  T
   2   -200.9117752  0.682916E+00  0.114E+00    0.23       1.0  T
   3   -201.6289688 -0.717194E+00  0.354E-01    0.24       1.0  T
   4   -201.6569183 -0.279495E-01  0.227E-01    0.11       1.0  T
   5   -201.6607403 -0.382204E-02  0.195E-01    0.06       1.0  T
   6   -201.6522525  0.848778E-02  0.189E-01    0.14       1.0  T
   7   -201.6475688  0.468374E-02  0.212E-01    0.10       1.0  T
   8   -201.6746039 -0.270351E-01  0.468E-02    0.04       1.0  T
   9   -201.6753883 -0.784368E-03  0.182E-02    0.03       1.0  T
  10   -201.6754685 -0.802515E-04  0.108E-02    0.03       1.0  T
  11   -201.6754740 -0.545089E-05  0.787E-03    0.03       1.3  T
  12   -201.6754841 -0.101694E-04  0.591E-03    0.03       1.8  T
  13   -201.6755032 -0.190908E-04  0.195E-03    0.03       5.4  T
  14   -201.6755052 -0.198722E-05  0.101E-03    0.03      10.4  T
  15   -201.6755056 -0.386385E-06  0.564E-04    0.03      18.6  T
  16   -201.6755057 -0.959991E-07  0.264E-04    0.03      39.6  T
  17   -201.6755057 -0.286651E-07  0.604E-05    0.03     173.5  T
  18   -201.6755057 -0.583498E-10  0.564E-05    0.03     185.9  T

   *** convergence criteria satisfied after 18 iterations ***

         #    Occupation            Energy/Eh            Energy/eV
      -------------------------------------------------------------
         1        2.0000           -1.0034765             -27.3060
       ...           ...                  ...                  ...
       152        2.0000           -0.3220619              -8.7637
       153        2.0000           -0.3171326              -8.6296
       154        2.0000           -0.3045364              -8.2869
       155        2.0000           -0.2918466              -7.9415
       156        2.0000           -0.2821256              -7.6770
       157        1.9999           -0.2427145              -6.6046
       158        0.6580           -0.2243715              -6.1055 (HOMO)
       159        0.3417           -0.2231269              -6.0716 (LUMO)
       160        0.0004           -0.2163930              -5.8884
       161                         -0.1968080              -5.3554
       162                         -0.1823550              -4.9621
       163                         -0.1788462              -4.8667
       ...                                ...                  ...
       383                        482.5273759           13130.2382
      -------------------------------------------------------------
                  HL-Gap            0.0012445 Eh            0.0339 eV
             Fermi-level           -0.2287033 Eh           -6.2233 eV

 SCC (total)                   0 d,  0 h,  0 min,  1.279 sec
 SCC setup                      ...        0 min,  0.003 sec (  0.257%)
 Dispersion                     ...        0 min,  0.000 sec (  0.020%)
 integral evaluation            ...        0 min,  0.660 sec ( 51.602%)
 zeroth order Hamiltonian       ...        0 min,  0.003 sec (  0.213%)
 iterations                     ...        0 min,  0.394 sec ( 30.772%)
 molecular gradient             ...        0 min,  0.214 sec ( 16.733%)
 printout                       ...        0 min,  0.005 sec (  0.398%)

         :::::::::::::::::::::::::::::::::::::::::::::::::::::
         ::                     SUMMARY                     ::
         :::::::::::::::::::::::::::::::::::::::::::::::::::::
         :: total energy            -198.497673238229 Eh    ::
         :: gradient norm              0.308247922781 Eh/a0 ::
         :: HOMO-LUMO gap              0.033865219110 eV    ::
         ::.................................................::
         :: SCC energy              -201.675505734823 Eh    ::
         :: -> electrostatic           0.534589530611 Eh    ::
         :: repulsion energy           3.256821407725 Eh    ::
         :: dispersion energy         -0.078988911132 Eh    ::
         :: halogen bond corr.         0.000000000000 Eh    ::
         :: add. restraining           0.000000000000 Eh    ::
         :::::::::::::::::::::::::::::::::::::::::::::::::::::

------------------------------------------------------------------------
empirical EA shift (eV):    4.8455
delta SCC EA (eV):    2.3497
------------------------------------------------------------------------
           -------------------------------------------------
          |                Property Printout                |
           -------------------------------------------------

    * Orbital Energies and Occupations

         #    Occupation            Energy/Eh            Energy/eV
      -------------------------------------------------------------
         1        2.0000           -1.0034765             -27.3060
       ...           ...                  ...                  ...
       146        2.0000           -0.3472450              -9.4490
       147        2.0000           -0.3441911              -9.3659
       148        2.0000           -0.3360349              -9.1440
       149        2.0000           -0.3356114              -9.1325
       150        2.0000           -0.3294728              -8.9654
       151        2.0000           -0.3237222              -8.8089
       152        2.0000           -0.3220619              -8.7637
       153        2.0000           -0.3171326              -8.6296
       154        2.0000           -0.3045364              -8.2869
       155        2.0000           -0.2918466              -7.9415
       156        2.0000           -0.2821256              -7.6770
       157        1.9999           -0.2427145              -6.6046
       158        0.6580           -0.2243715              -6.1055 (HOMO)
       159        0.3417           -0.2231269              -6.0716 (LUMO)
       160        0.0004           -0.2163930              -5.8884
       161                         -0.1968080              -5.3554
       162                         -0.1823550              -4.9621
       163                         -0.1788462              -4.8667
       164                         -0.1583604              -4.3092
       165                         -0.1564898              -4.2583
       166                         -0.1503376              -4.0909
       167                         -0.1447445              -3.9387
       168                         -0.1386282              -3.7723
       169                         -0.1378590              -3.7513
       ...                                ...                  ...
       383                        482.5273759           13130.2382
      -------------------------------------------------------------
                  HL-Gap            0.0012445 Eh            0.0339 eV
             Fermi-level           -0.2287033 Eh           -6.2233 eV

  Mulliken/CM5 charges        n(s)   n(p)   n(d)
     1 C  -0.40821 -0.45429   1.040  2.552  0.000
     2 C  -0.30818 -0.30961   0.953  2.739  0.000
     3 C  -0.41433 -0.41481   1.013  2.573  0.000
     4 C   0.05521  0.05213   0.584  3.472  0.000
     5 C   0.06470  0.06308   1.075  2.990  0.000
     6 C  -0.00427  0.03193   1.152  2.843  0.000
     7 O   0.39584  0.35121   1.623  4.773  0.000
     8 C   0.15582  0.16221   1.008  3.147  0.000
     9 C  -0.08414  0.03500   1.212  2.704  0.000
    10 N   0.31863  0.18874   1.523  3.796  0.000
    11 C  -0.07574  0.04289   1.210  2.714  0.000
    12 N   0.31607  0.18674   1.514  3.802  0.000
    13 C   0.04460 -0.00267   1.074  2.971  0.000
    14 C  -0.09777 -0.08125   1.140  2.763  0.000
    15 C  -0.10657 -0.08992   1.148  2.745  0.000
    16 C   0.02429 -0.02297   1.083  2.941  0.000
    17 F   0.18142  0.15821   1.693  5.488  0.000
    18 F   0.17738  0.15439   1.698  5.479  0.000
    19 C   0.11487  0.12642   1.104  3.011  0.000
    20 S   0.09971  0.06387   1.881  4.135  0.084
    21 C  -0.01674 -0.00512   1.126  2.858  0.000
    22 C   0.04934  0.00175   1.034  3.015  0.000
    23 C  -0.08075 -0.05668   1.094  2.825  0.000
    24 O   0.23443  0.14818   1.627  4.607  0.000
    25 C  -0.05544 -0.13921   1.127  2.817  0.000
    26 C   0.06183 -0.08797   1.076  2.986  0.000
    27 C  -0.00597  0.00984   1.121  2.873  0.000
    28 C  -0.07222 -0.04494   1.091  2.837  0.000
    29 C  -0.08349 -0.05624   1.087  2.829  0.000
    30 C   0.01034  0.02380   1.112  2.898  0.000
    31 S   0.10451  0.06764   1.883  4.144  0.078
    32 O   0.24893  0.16700   1.603  4.646  0.000
    33 O   0.23507  0.14726   1.607  4.628  0.000
    34 C  -0.05440 -0.13745   1.134  2.812  0.000
    35 C   0.05827 -0.09115   1.072  2.987  0.000
    36 C  -0.04212 -0.12489   1.132  2.826  0.000
    37 C   0.20838  0.05870   1.024  3.184  0.000
    38 C   0.01185  0.02187   1.132  2.879  0.000
    39 S   0.14153  0.10140   1.881  4.182  0.079
    40 C   0.01859  0.02829   1.128  2.890  0.000
    41 C  -0.06174 -0.03766   1.104  2.834  0.000
    42 C   0.16047  0.11499   1.069  3.091  0.000
    43 O   0.28037  0.19374   1.672  4.609  0.000
    44 C   0.22650  0.14426   1.047  3.180  0.000
    45 C   0.54725  0.39784   0.944  3.604  0.000
    46 C   0.14733  0.09947   1.040  3.107  0.000
    47 C   0.05861  0.05438   1.065  2.994  0.000
    48 C   0.01647  0.01563   1.096  2.921  0.000
    49 C   0.02783  0.02462   1.069  2.958  0.000
    50 C   0.04490  0.04298   1.093  2.952  0.000
    51 C  -0.11061 -0.07689   1.174  2.716  0.000
    52 O   0.37411  0.32749   1.634  4.740  0.000
    53 C   0.03119  0.03758   1.025  3.006  0.000
    54 C  -0.08891  0.03051   1.212  2.699  0.000
    55 N   0.32274  0.19321   1.524  3.799  0.000
    56 C  -0.08431  0.03460   1.221  2.695  0.000
    57 N   0.32838  0.19874   1.519  3.809  0.000
    58 C   0.15093  0.10366   1.052  3.099  0.000
    59 C  -0.08196 -0.06536   1.155  2.763  0.000
    60 C  -0.07752 -0.06079   1.156  2.767  0.000
    61 C   0.15159  0.10431   1.051  3.100  0.000
    62 F   0.20144  0.17816   1.703  5.498  0.000
    63 F   0.20601  0.18294   1.706  5.500  0.000
    64 H   0.14564  0.21149   1.146  0.000  0.000
    65 H  -0.01477  0.04998   0.985  0.000  0.000
    66 H  -0.03209  0.02744   0.968  0.000  0.000
    67 H  -0.03393  0.02786   0.966  0.000  0.000
    68 H  -0.03864  0.02603   0.961  0.000  0.000
    69 H  -0.03762  0.02602   0.962  0.000  0.000
    70 H  -0.02410  0.02999   0.976  0.000  0.000
    71 H  -0.03014  0.02208   0.970  0.000  0.000
    72 H  -0.02573  0.02902   0.974  0.000  0.000
    73 H  -0.03316  0.03107   0.967  0.000  0.000
    74 H  -0.03777  0.02709   0.962  0.000  0.000
    75 H  -0.02331  0.03319   0.977  0.000  0.000
    76 H  -0.02663  0.02563   0.973  0.000  0.000
    77 H  -0.02898  0.02809   0.971  0.000  0.000
    78 H  -0.02587  0.03891   0.974  0.000  0.000
    79 H  -0.01000  0.05755   0.990  0.000  0.000
    80 H   0.02681  0.08105   1.027  0.000  0.000
    81 H  -0.02117  0.03132   0.979  0.000  0.000
    82 H  -0.31338 -0.25646   0.687  0.000  0.000
    83 H  -0.27232 -0.21013   0.728  0.000  0.000
    84 H  -0.30761 -0.24271   0.692  0.000  0.000
    85 H  -0.29779 -0.22815   0.702  0.000  0.000
    86 H  -0.26056 -0.20808   0.739  0.000  0.000
    87 H  -0.29210 -0.23514   0.708  0.000  0.000
    88 H  -0.26172 -0.20720   0.738  0.000  0.000
    89 H  -0.29725 -0.23306   0.703  0.000  0.000
    90 H  -0.30937 -0.24531   0.691  0.000  0.000
    91 H  -0.30880 -0.24933   0.691  0.000  0.000
(R)spin-density population

 Mulliken population n(s)   n(p)   n(d)
     1 C   0.0046   0.000  0.005  0.000
     2 C   0.0034   0.000  0.003  0.000
     3 C   0.0225   0.000  0.022  0.000
     4 C   0.0551   0.000  0.055  0.000
     5 C   0.0677   0.000  0.068  0.000
     6 C   0.0604   0.000  0.060  0.000
     7 O   0.0612   0.000  0.061  0.000
     8 C   0.0175   0.000  0.018  0.000
     9 C   0.0033   0.000  0.003  0.000
    10 N   0.0091  -0.000  0.009  0.000
    11 C   0.0040   0.000  0.004  0.000
    12 N   0.0099  -0.000  0.010  0.000
    13 C   0.0212   0.000  0.021  0.000
    14 C   0.0323  -0.000  0.032  0.000
    15 C   0.0475  -0.000  0.047  0.000
    16 C   0.0070   0.000  0.007  0.000
    17 F   0.0038   0.000  0.004  0.000
    18 F   0.0054   0.000  0.005  0.000
    19 C   0.0108  -0.000  0.011  0.000
    20 S   0.0128   0.000  0.010  0.002
    21 C   0.0131  -0.000  0.013  0.000
    22 C   0.0108  -0.000  0.011  0.000
    23 C   0.0050  -0.000  0.005  0.000
    24 O   0.0023   0.000  0.002  0.000
    25 C   0.0003   0.000  0.000  0.000
    26 C   0.0002   0.000  0.000  0.000
    27 C   0.0107  -0.000  0.011  0.000
    28 C   0.0117  -0.000  0.012  0.000
    29 C   0.0049  -0.000  0.005  0.000
    30 C   0.0100   0.000  0.010  0.000
    31 S   0.0106   0.000  0.009  0.002
    32 O   0.0008   0.000  0.001  0.000
    33 O   0.0018   0.000  0.002  0.000
    34 C   0.0012   0.001  0.001  0.000
    35 C   0.0002   0.000  0.000  0.000
    36 C   0.0001   0.000  0.000  0.000
    37 C   0.0003   0.000  0.000  0.000
    38 C   0.0101   0.000  0.010  0.000
    39 S   0.0059   0.000  0.005  0.001
    40 C   0.0007  -0.000  0.001  0.000
    41 C   0.0089   0.000  0.009  0.000
    42 C   0.0060  -0.000  0.006  0.000
    43 O   0.0066   0.000  0.006  0.000
    44 C   0.0086  -0.000  0.009  0.000
    45 C   0.0126   0.000  0.012  0.000
    46 C   0.0257   0.000  0.026  0.000
    47 C   0.0014   0.000  0.001  0.000
    48 C   0.0961   0.000  0.096  0.000
    49 C   0.0124   0.000  0.012  0.000
    50 C   0.0288   0.000  0.029  0.000
    51 C   0.0150   0.000  0.015  0.000
    52 O   0.0161   0.000  0.016  0.000
    53 C   0.0522   0.000  0.052  0.000
    54 C   0.0117   0.000  0.012  0.000
    55 N   0.0303  -0.000  0.030  0.000
    56 C   0.0119  -0.000  0.012  0.000
    57 N   0.0298   0.000  0.030  0.000
    58 C   0.0204   0.000  0.020  0.000
    59 C   0.0051  -0.000  0.005  0.000
    60 C   0.0262  -0.000  0.026  0.000
    61 C   0.0009   0.000  0.001  0.000
    62 F   0.0006  -0.000  0.001  0.000
    63 F   0.0031  -0.000  0.003  0.000
    64 H   0.0003   0.000  0.000  0.000
    65 H   0.0000   0.000  0.000  0.000
    66 H   0.0000   0.000  0.000  0.000
    67 H   0.0001   0.000  0.000  0.000
    68 H   0.0001   0.000  0.000  0.000
    69 H   0.0002   0.000  0.000  0.000
    70 H   0.0001   0.000  0.000  0.000
    71 H   0.0001   0.000  0.000  0.000
    72 H   0.0000   0.000  0.000  0.000
    73 H   0.0001   0.000  0.000  0.000
    74 H   0.0001   0.000  0.000  0.000
    75 H   0.0001   0.000  0.000  0.000
    76 H   0.0003   0.000  0.000  0.000
    77 H   0.0001   0.000  0.000  0.000
    78 H   0.0000   0.000  0.000  0.000
    79 H   0.0002   0.000  0.000  0.000
    80 H   0.0001   0.000  0.000  0.000
    81 H   0.0000   0.000  0.000  0.000
    82 H   0.0001   0.000  0.000  0.000
    83 H   0.0000   0.000  0.000  0.000
    84 H   0.0012   0.001  0.000  0.000
    85 H   0.0024   0.002  0.000  0.000
    86 H   0.0003   0.000  0.000  0.000
    87 H   0.0015   0.002  0.000  0.000
    88 H   0.0017   0.002  0.000  0.000
    89 H   0.0000   0.000  0.000  0.000
    90 H   0.0000   0.000  0.000  0.000
    91 H   0.0001   0.000  0.000  0.000

Wiberg/Mayer (AO) data.
largest (>0.10) Wiberg bond orders for each atom
          total WBO             WBO to atom ...
     1  C   3.917        C    2 1.471    C   19 1.240    H   64 0.986
     2  C   4.022        C    1 1.471    C    3 1.147    C    6 1.129
     3  C   3.918        C    8 1.363    C    2 1.147    C    4 1.027
     4  C   3.561        C   13 1.290    C    5 1.139    C    3 1.027
     5  C   3.751        C   16 1.426    C    4 1.139    C    6 1.031
     6  C   3.887        O    7 1.627    C    2 1.129    C    5 1.031
     7  O   1.800        C    6 1.627
     8  C   3.709        C    3 1.363    C   11 1.149    C    9 1.134
     9  C   4.100        N   10 2.875    C    8 1.134
    10  N   2.911        C    9 2.875
    11  C   4.095        N   12 2.868    C    8 1.149
    12  N   2.904        C   11 2.868
    13  C   3.803        C   14 1.434    C    4 1.290    H   65 1.005
    14  C   3.930        C   13 1.434    C   15 1.347    F   17 1.040
    15  C   3.910        C   16 1.414    C   14 1.347    F   18 1.053
    16  C   3.885        C    5 1.426    C   15 1.414    H   66 0.996
    17  F   0.965        C   14 1.040
    18  F   0.984        C   15 1.053
    19  C   3.831        C   23 1.339    C    1 1.240    S   20 1.106
    20  S   2.512        C   21 1.193    C   19 1.106
    21  C   3.867        C   22 1.448    C   27 1.218    S   20 1.193
    22  C   3.756        C   21 1.448    C   23 1.329    H   67 0.989
    23  C   3.885        C   19 1.339    C   22 1.329    O   24 1.140
    24  O   2.249        C   23 1.140    C   25 0.972
    25  C   3.926        H   69 0.993    C   26 0.992    H   68 0.988    O   24 0.972
    26  C   3.924        H   72 1.003    H   70 0.998    C   25 0.992    H   71 0.987
    27  C   3.867        C   28 1.459    C   21 1.218    S   31 1.168
    28  C   3.866        C   27 1.459    C   29 1.242    O   32 1.075
    29  C   3.878        C   30 1.456    C   28 1.242    O   33 1.137
    30  C   3.822        C   29 1.456    C   38 1.169    S   31 1.132
    31  S   2.465        C   27 1.168    C   30 1.132
    32  O   2.078        C   28 1.075    C   34 0.954
    33  O   2.186        C   29 1.137    C   36 0.955
    34  C   3.933        H   73 0.997    H   74 0.994    C   35 0.991    O   32 0.954
    35  C   3.915        H   77 1.005    H   75 1.005    C   34 0.991    H   76 0.982
    36  C   3.923        C   37 0.999    H   79 0.987    H   78 0.986    O   33 0.955
    37  C   3.699        H   80 1.024    C   36 0.999    H   81 0.943    H   82 0.823
    38  C   3.877        C   42 1.515    C   30 1.169    S   39 1.143
    39  S   2.479        C   38 1.143    C   40 1.110
    40  C   3.864        C   41 1.340    C   46 1.339    S   39 1.110
    41  C   3.895        C   40 1.340    C   42 1.299    O   43 1.178
    42  C   3.750        C   38 1.515    C   41 1.299    H   83 0.870
    43  O   2.337        C   41 1.178    C   44 0.952
    44  C   3.583        C   45 0.953    O   43 0.952    H   84 0.800    H   85 0.750
    45  C   3.494        C   44 0.953    H   86 0.859    H   88 0.845    H   87 0.773
    46  C   3.635        C   47 1.430    C   40 1.339    H   89 0.814
    47  C   3.832        C   46 1.430    C   48 1.196    C   51 1.087
    48  C   3.762        C   53 1.381    C   47 1.196    C   49 1.118
    49  C   3.845        C   58 1.417    C   50 1.303    C   48 1.118
    50  C   3.859        C   61 1.448    C   49 1.303    C   51 1.042
    51  C   3.995        O   52 1.736    C   47 1.087    C   50 1.042
    52  O   1.912        C   51 1.736
    53  C   3.728        C   48 1.381    C   54 1.173    C   56 1.173
    54  C   4.095        N   55 2.860    C   53 1.173
    55  N   2.892        C   54 2.860
    56  C   4.104        N   57 2.852    C   53 1.173
    57  N   2.863        C   56 2.852
    58  C   3.680        C   59 1.433    C   49 1.417    H   90 0.833
    59  C   3.972        C   58 1.433    C   60 1.387    F   62 1.021
    60  C   3.955        C   61 1.422    C   59 1.387    F   63 1.017
    61  C   3.748        C   50 1.448    C   60 1.422    H   91 0.847
    62  F   0.971        C   59 1.021
    63  F   0.968        C   60 1.017
    64  H   1.076        C    1 0.986
    65  H   1.090        C   13 1.005
    66  H   1.040        C   16 0.996
    67  H   1.015        C   22 0.989
    68  H   1.045        C   25 0.988
    69  H   1.026        C   25 0.993
    70  H   1.031        C   26 0.998
    71  H   1.027        C   26 0.987
    72  H   1.027        C   26 1.003
    73  H   1.011        C   34 0.997
    74  H   1.033        C   34 0.994
    75  H   1.031        C   35 1.005
    76  H   1.028        C   35 0.982
    77  H   1.028        C   35 1.005
    78  H   1.028        C   36 0.986
    79  H   1.061        C   36 0.987
    80  H   1.051        C   37 1.024
    81  H   0.954        C   37 0.943
    82  H   0.921        C   37 0.823
    83  H   0.946        C   42 0.870
    84  H   0.937        C   44 0.800
    85  H   0.960        C   44 0.750
    86  H   0.943        C   45 0.859
    87  H   0.948        C   45 0.773
    88  H   0.934        C   45 0.845
    89  H   0.960        C   46 0.814
    90  H   0.945        C   58 0.833
    91  H   0.927        C   61 0.847

 dipole moment from electron density (au)
     X       Y       Z   
  -3.2023   4.6721   1.9502  total (Debye):   15.226


           -------------------------------------------------
          | TOTAL ENERGY             -198.497673238229 Eh   |
          | GRADIENT NORM               0.308247922781 Eh/α |
          | HOMO-LUMO GAP               0.033865219110 eV   |
           -------------------------------------------------

------------------------------------------------------------------------
 * finished run on 2021/12/02 at 16:23:05.417     
------------------------------------------------------------------------
 total:
 * wall-time:     0 d,  0 h,  0 min,  4.726 sec
 *  cpu-time:     0 d,  0 h,  0 min,  4.692 sec
 * ratio c/w:     0.993 speedup
 SCF:
 * wall-time:     0 d,  0 h,  0 min,  4.041 sec
 *  cpu-time:     0 d,  0 h,  0 min,  4.016 sec
 * ratio c/w:     0.994 speedup

