      -----------------------------------------------------------      
     |                   =====================                   |     
     |                           x T B                           |     
     |                   =====================                   |     
     |                         S. Grimme                         |     
     |          Mulliken Center for Theoretical Chemistry        |     
     |                    University of Bonn                     |     
     |                Version 6.2 RC2 (SAW190805)                |     
      -----------------------------------------------------------      

   This program is distributed in the hope that it will be useful,
   but WITHOUT ANY WARRANTY; without even the implied warranty of
   MERCHANTABILITY or FITNESS FOR A PARTICULAR PURPOSE.
   
   FOR NON-COMMERCIAL, ACADEMIA USE ONLY.
   
   Cite this work as:
   * S. Grimme, C. Bannwarth, P. Shushkov, J. Chem. Theory Comput., 2017,
     13, 1989-2009. DOI: 10.1021/acs.jctc.7b00118
   * C. Bannwarth, S. Ehlert and S. Grimme., J. Chem. Theory Comput., 2019,
     15, 1652-1671. DOI: 10.1021/acs.jctc.8b01176
   * P. Pracht, E. Caldeweyher, S. Ehlert, S. Grimme, ChemRxiv, 2019, preprint.
     DOI: 10.26434/chemrxiv.8326202.v1
   
   for DFT-D4:
   * E. Caldeweyher, C. Bannwarth and S. Grimme, J. Chem. Phys., 2017,
     147, 034112. DOI: 10.1063/1.4993215
   * E. Caldeweyher, S. Ehlert, A. Hansen, H. Neugebauer, S. Spicher,
     C. Bannwarth and S. Grimme, J. Chem. Phys., 2019, 150, 154122.
     DOI: 10.1063/1.5090222
   
   for sTDA-xTB:
   * S. Grimme and C. Bannwarth, J. Chem. Phys., 2016, 145, 054103.
     DOI: 10.1063/1.4959605
   
   in the mass-spec context:
   * V. Asgeirsson, C. Bauer and S. Grimme, Chem. Sci., 2017, 8, 4879.
     DOI: 10.1039/c7sc00601b
   
   for metadynamics refer to:
   * S. Grimme, J. Chem. Theory Comput., 2019, 155, 2847-2862
     DOI: 10.1021/acs.jctc.9b00143
   
   with help from (in alphabetical order)
   C. Bannwarth, F. Bohle, G. Brandenburg, E. Caldeweyher, M. Checinski,
   S. Dohm, S. Ehlert, S. Ehrlich, F. März, H. Neugebauer, J. Pisarek,
   P. Pracht, P. Shushkov, and S. Spicher.
   
 * started run on 2021/12/02 at 16:23:05.431     

           -------------------------------------------------
          |                Calculation Setup                |
           -------------------------------------------------

          program call               : /ihome/ghutchison/geoffh/xtb/xtb AOT2.xyz --vipea
          hostname                   : smp-n128
          coordinate file            : AOT2.xyz
          omp threads                :                     1
          number of atoms            :                    91
          number of electrons        :                   314
          charge                     :                     0
          spin                       :                   0.0
          first test random number   :      0.93912062040775


########################################################################
# WARNING! Please study the warnings concerning your input carefully
#  - XTBPATH is not set, using XTBHOME instead
########################################################################

           ------------------------------------------------- 
          |                 I P E A - x T B                 |
          |  Ionisation Potentials and Electron Affinities  |
           ------------------------------------------------- 
             KAB for M(3d)-M(3d) :                1.1000
             KAB for M(4d)-M(4d) :                1.2000
             KAB for M(5d)-M(5d) :                1.2000
             k(s)                :                2.1500
             k(p)                :                2.3000
             k(d)                :                2.0000
             k(f)                :                0.0000
             kEN (H0ij)          :                0.7000
             D3 a1               :                0.6300
             D3 a2               :                5.0000
             D3 s6               :                1.0000
             D3 s8               :                2.4000
             D3 s9               :                0.0000
             alphaj              :                1.0000
             XBdamp              :                0.4400
             XBrad               :                1.3000
             kcnsh               :      1.0000   -0.3000   -0.5000    0.5000

  Z AO/shell   Hii/eV     exponent
  1     Thu Sep 22 23:34:11 CEST 2016   EN: 2.200 GAM: 0.405  GM3: 0.1500
     1s    -10.521941    1.306199
     2s     -3.560151    0.398421
  6     Thu Sep 22 23:34:11 CEST 2016   EN: 2.550 GAM: 0.640  GM3: 0.1500
     2s    -15.968100    1.979793
     2p     -9.777107    1.850537
     3S     -3.366990    0.633095
  7     Thu Sep 22 23:34:11 CEST 2016   EN: 3.040 GAM: 0.493  GM3:-0.1000
     2s    -24.040776    2.126160
     2p    -14.426520    2.068425
     3S     -5.882278    0.671040
  8     Thu Sep 22 23:34:11 CEST 2016   EN: 3.440 GAM: 0.717  GM3:-0.2000
     2s    -26.695120    2.575264
     2p    -16.014457    2.159448
     3S     -6.622058    0.958679
  9     Tue Jan 17 20:22:52 CET 2017    EN: 3.980 GAM: 0.574  GM3: 0.2000
     2s    -27.565998    2.304073
     2p    -17.439238    2.314354
     3S     -6.120500    0.570243
 16     Tue Jan 17 20:57:36 CET 2017    EN: 2.580 GAM: 0.455  GM3: 0.1020
     3s    -24.488821    2.492075
     3p    -12.136640    1.997904
     3d     -1.796070    1.747541

           ------------------------------------------------- 
          |        Self-Consistent Charge Iterations        |
           ------------------------------------------------- 

          ...................................................
          :                      SETUP                      :
          :.................................................:
          :  # basis functions                 386          :
          :  # atomic orbitals                 383          :
          :  # shells                          245          :
          :  # electrons                       314          :
          :  # halogen bonds                     0          :
          :  max. iterations                   250          :
          :  Hamiltonian                  GFN1-xTB          :
          :  restarted?                      false          :
          :  GBSA solvation                  false          :
          :  PC potential                    false          :
          :  electronic temp.          300.0000000     K    :
          :  accuracy                    1.0000000          :
          :  -> integral cutoff          0.2500000E+02      :
          :  -> integral neglect         0.1000000E-07      :
          :  -> SCF convergence          0.1000000E-05 Eh   :
          :  -> wf. convergence          0.2000000E-04 e    :
          :  Broyden damping             0.4000000          :
          ...................................................

 iter      E             dE          RMSdq      gap      omega  full diag
   1   -196.0476623 -0.196048E+03  0.103E+01    0.22       0.0  T
   2   -191.8310542  0.421661E+01  0.719E+00    0.18       1.0  T
   3   -118.0439716  0.737871E+02  0.906E+00    0.22       1.0  T
   4    -63.5836943  0.544603E+02  0.111E+01    0.11       1.0  T
   5   -193.2611081 -0.129677E+03  0.420E+00    0.20       1.0  T
   6   -200.8911153 -0.763001E+01  0.171E+00    0.86       1.0  T
   7   -201.2935182 -0.402403E+00  0.109E+00    0.31       1.0  T
   8   -200.7270874  0.566431E+00  0.144E+00    0.24       1.0  T
   9   -201.2840016 -0.556914E+00  0.977E-01    0.76       1.0  T
  10   -201.3048100 -0.208085E-01  0.767E-01    0.28       1.0  T
  11   -200.7115467  0.593263E+00  0.120E+00    0.30       1.0  T
  12   -200.9460482 -0.234501E+00  0.957E-01    0.08       1.0  T
  13   -201.3406798 -0.394632E+00  0.450E-01    0.47       1.0  T
  14   -201.3478242 -0.714443E-02  0.400E-01    0.50       1.0  T
  15   -201.3526381 -0.481390E-02  0.356E-01    0.56       1.0  T
  16   -201.3571139 -0.447577E-02  0.304E-01    0.48       1.0  T
  17   -201.3639566 -0.684270E-02  0.226E-01    0.27       1.0  T
  18   -201.3785654 -0.146088E-01  0.580E-02    0.11       1.0  T
  19   -201.3781059  0.459486E-03  0.581E-02    0.10       1.0  T
  20   -201.3787245 -0.618555E-03  0.390E-02    0.10       1.0  T
  21   -201.3784141  0.310341E-03  0.474E-02    0.09       1.0  T
  22   -201.3788082 -0.394076E-03  0.317E-02    0.11       1.0  T
  23   -201.3778215  0.986750E-03  0.586E-02    0.09       1.0  T
  24   -201.3790938 -0.127235E-02  0.160E-02    0.11       1.0  T
  25   -201.3791640 -0.701423E-04  0.700E-03    0.10       1.5  T
  26   -201.3791559  0.809882E-05  0.916E-03    0.11       1.1  T
  27   -201.3791818 -0.259054E-04  0.323E-03    0.11       3.2  T
  28   -201.3791832 -0.145469E-05  0.292E-03    0.11       3.6  T
  29   -201.3791844 -0.116742E-05  0.261E-03    0.10       4.0  T
  30   -201.3791873 -0.294011E-05  0.157E-03    0.11       6.7  T
  31   -201.3791873  0.446576E-07  0.181E-03    0.11       5.8  T
  32   -201.3791881 -0.773395E-06  0.109E-03    0.10       9.6  T
  33   -201.3791884 -0.381091E-06  0.369E-04    0.11      28.4  T
  34   -201.3791885 -0.109336E-07  0.324E-04    0.11      32.4  T
  35   -201.3791885 -0.351484E-07  0.134E-04    0.11      78.4  T
  36   -201.3791885 -0.608080E-08  0.714E-05    0.11     146.7  T

   *** convergence criteria satisfied after 36 iterations ***

         #    Occupation            Energy/Eh            Energy/eV
      -------------------------------------------------------------
         1        2.0000           -1.0526601             -28.6443
       ...           ...                  ...                  ...
       151        2.0000           -0.3914847             -10.6528
       152        2.0000           -0.3892990             -10.5934
       153        2.0000           -0.3856082             -10.4929
       154        2.0000           -0.3766846             -10.2501
       155        2.0000           -0.3693292             -10.0500
       156        2.0000           -0.3467123              -9.4345
       157        1.7643           -0.3039910              -8.2720 (HOMO)
       158        0.2262           -0.3001219              -8.1667 (LUMO)
       159        0.0095           -0.2969988              -8.0817
       160        0.0000           -0.2863923              -7.7931
       161                         -0.2696747              -7.3382
       162                         -0.2444738              -6.6525
       ...                                ...                  ...
       383                        485.8181478           13219.7847
      -------------------------------------------------------------
                  HL-Gap            0.0038691 Eh            0.1053 eV
             Fermi-level           -0.3020785 Eh           -8.2200 eV

 SCC (total)                   0 d,  0 h,  0 min,  1.688 sec
 SCC setup                      ...        0 min,  0.003 sec (  0.202%)
 Dispersion                     ...        0 min,  0.000 sec (  0.016%)
 integral evaluation            ...        0 min,  0.673 sec ( 39.878%)
 zeroth order Hamiltonian       ...        0 min,  0.003 sec (  0.166%)
 iterations                     ...        0 min,  0.797 sec ( 47.180%)
 molecular gradient             ...        0 min,  0.209 sec ( 12.363%)
 printout                       ...        0 min,  0.003 sec (  0.192%)

         :::::::::::::::::::::::::::::::::::::::::::::::::::::
         ::                     SUMMARY                     ::
         :::::::::::::::::::::::::::::::::::::::::::::::::::::
         :: total energy            -198.197070068452 Eh    ::
         :: gradient norm              0.292461780699 Eh/a0 ::
         :: HOMO-LUMO gap              0.105282807633 eV    ::
         ::.................................................::
         :: SCC energy              -201.379188493781 Eh    ::
         :: -> electrostatic           0.515750011160 Eh    ::
         :: repulsion energy           3.258799846534 Eh    ::
         :: dispersion energy         -0.076681421205 Eh    ::
         :: halogen bond corr.         0.000000000000 Eh    ::
         :: add. restraining           0.000000000000 Eh    ::
         :::::::::::::::::::::::::::::::::::::::::::::::::::::

           ------------------------------------------------- 
          |        vertical delta SCC IP calculation        |
           ------------------------------------------------- 

          ...................................................
          :                      SETUP                      :
          :.................................................:
          :  # basis functions                 386          :
          :  # atomic orbitals                 383          :
          :  # shells                          245          :
          :  # electrons                       313          :
          :  # halogen bonds                     0          :
          :  max. iterations                   250          :
          :  Hamiltonian                  GFN1-xTB          :
          :  restarted?                       true          :
          :  GBSA solvation                  false          :
          :  PC potential                    false          :
          :  electronic temp.          300.0000000     K    :
          :  accuracy                    1.0000000          :
          :  -> integral cutoff          0.2500000E+02      :
          :  -> integral neglect         0.1000000E-07      :
          :  -> SCF convergence          0.1000000E-05 Eh   :
          :  -> wf. convergence          0.2000000E-04 e    :
          :  Broyden damping             0.4000000          :
          ...................................................

 iter      E             dE          RMSdq      gap      omega  full diag
   1   -200.9653328 -0.200965E+03  0.466E-01    0.11       0.0  T
   2   -200.8925181  0.728147E-01  0.638E-01    1.23       1.0  T
   3   -201.0010154 -0.108497E+00  0.267E-01    0.81       1.0  T
   4   -201.0098619 -0.884649E-02  0.187E-01    0.95       1.0  T
   5   -200.9690021  0.408598E-01  0.371E-01    1.15       1.0  T
   6   -201.0116839 -0.426818E-01  0.159E-01    1.01       1.0  T
   7   -201.0151065 -0.342263E-02  0.109E-01    1.05       1.0  T
   8   -201.0188513 -0.374471E-02  0.342E-02    1.13       1.0  T
   9   -201.0192198 -0.368585E-03  0.126E-02    1.11       1.0  T
  10   -201.0192643 -0.444563E-04  0.399E-03    1.11       2.6  T
  11   -201.0192566  0.774102E-05  0.580E-03    1.11       1.8  T
  12   -201.0192668 -0.102646E-04  0.174E-03    1.12       6.0  T
  13   -201.0192679 -0.107607E-05  0.302E-04    1.11      34.7  T
  14   -201.0192679 -0.212515E-07  0.102E-04    1.11     102.8  T
  15   -201.0192679 -0.159551E-08  0.406E-05    1.11     258.2  T

   *** convergence criteria satisfied after 15 iterations ***

         #    Occupation            Energy/Eh            Energy/eV
      -------------------------------------------------------------
         1        2.0000           -1.1328250             -30.8257
       ...           ...                  ...                  ...
       151        2.0000           -0.4643819             -12.6365
       152        2.0000           -0.4585853             -12.4787
       153        2.0000           -0.4506208             -12.2620
       154        2.0000           -0.4489750             -12.2172
       155        2.0000           -0.4429104             -12.0522
       156        1.7839           -0.4206917             -11.4476
       157        1.2161           -0.4182434             -11.3810 (HOMO)
       158                         -0.3772951             -10.2667 (LUMO)
       159                         -0.3705559             -10.0833
       160                         -0.3509243              -9.5491
       161                         -0.3397664              -9.2455
       162                         -0.3238983              -8.8137
       ...                                ...                  ...
       383                        485.7576606           13218.1387
      -------------------------------------------------------------
                  HL-Gap            0.0409482 Eh            1.1143 eV
             Fermi-level           -0.4086012 Eh          -11.1186 eV

 SCC (total)                   0 d,  0 h,  0 min,  1.229 sec
 SCC setup                      ...        0 min,  0.003 sec (  0.283%)
 Dispersion                     ...        0 min,  0.000 sec (  0.013%)
 integral evaluation            ...        0 min,  0.683 sec ( 55.535%)
 zeroth order Hamiltonian       ...        0 min,  0.003 sec (  0.224%)
 iterations                     ...        0 min,  0.328 sec ( 26.678%)
 molecular gradient             ...        0 min,  0.209 sec ( 16.978%)
 printout                       ...        0 min,  0.003 sec (  0.284%)

         :::::::::::::::::::::::::::::::::::::::::::::::::::::
         ::                     SUMMARY                     ::
         :::::::::::::::::::::::::::::::::::::::::::::::::::::
         :: total energy            -197.837149496604 Eh    ::
         :: gradient norm              0.277459480702 Eh/a0 ::
         :: HOMO-LUMO gap              1.114258091488 eV    ::
         ::.................................................::
         :: SCC energy              -201.019267921933 Eh    ::
         :: -> electrostatic           0.562104275111 Eh    ::
         :: repulsion energy           3.258799846534 Eh    ::
         :: dispersion energy         -0.076681421205 Eh    ::
         :: halogen bond corr.         0.000000000000 Eh    ::
         :: add. restraining           0.000000000000 Eh    ::
         :::::::::::::::::::::::::::::::::::::::::::::::::::::

------------------------------------------------------------------------
empirical IP shift (eV):    4.8455
delta SCC IP (eV):    4.9484
------------------------------------------------------------------------
           ------------------------------------------------- 
          |        vertical delta SCC EA calculation        |
           ------------------------------------------------- 

          ...................................................
          :                      SETUP                      :
          :.................................................:
          :  # basis functions                 386          :
          :  # atomic orbitals                 383          :
          :  # shells                          245          :
          :  # electrons                       315          :
          :  # halogen bonds                     0          :
          :  max. iterations                   250          :
          :  Hamiltonian                  GFN1-xTB          :
          :  restarted?                       true          :
          :  GBSA solvation                  false          :
          :  PC potential                    false          :
          :  electronic temp.          300.0000000     K    :
          :  accuracy                    1.0000000          :
          :  -> integral cutoff          0.2500000E+02      :
          :  -> integral neglect         0.1000000E-07      :
          :  -> SCF convergence          0.1000000E-05 Eh   :
          :  -> wf. convergence          0.2000000E-04 e    :
          :  Broyden damping             0.4000000          :
          ...................................................

 iter      E             dE          RMSdq      gap      omega  full diag
   1   -201.5739777 -0.201574E+03  0.530E-01    0.18       0.0  T
   2   -201.1078179  0.466160E+00  0.105E+00    0.04       1.0  T
   3   -201.5945991 -0.486781E+00  0.400E-01    0.02       1.0  T
   4   -201.6051289 -0.105298E-01  0.330E-01    0.13       1.0  T
   5   -201.6050786  0.502745E-04  0.290E-01    0.19       1.0  T
   6   -201.6201385 -0.150599E-01  0.216E-01    0.06       1.0  T
   7   -201.6274149 -0.727640E-02  0.172E-01    0.09       1.0  T
   8   -201.6338672 -0.645228E-02  0.106E-01    0.06       1.0  T
   9   -201.6250819  0.878527E-02  0.189E-01    0.03       1.0  T
  10   -201.6398556 -0.147737E-01  0.430E-02    0.03       1.0  T
  11   -201.6400751 -0.219448E-03  0.325E-02    0.04       1.0  T
  12   -201.6403164 -0.241297E-03  0.276E-02    0.03       1.0  T
  13   -201.6405505 -0.234113E-03  0.939E-03    0.03       1.1  T
  14   -201.6405813 -0.308238E-04  0.513E-03    0.03       2.0  T
  15   -201.6405928 -0.115124E-04  0.297E-03    0.03       3.5  T
  16   -201.6405953 -0.246526E-05  0.676E-04    0.03      15.5  T
  17   -201.6405955 -0.256530E-06  0.198E-04    0.03      52.8  T
  18   -201.6405955 -0.105675E-07  0.149E-04    0.03      70.3  T

   *** convergence criteria satisfied after 18 iterations ***

         #    Occupation            Energy/Eh            Energy/eV
      -------------------------------------------------------------
         1        2.0000           -0.9826481             -26.7392
       ...           ...                  ...                  ...
       152        2.0000           -0.3149654              -8.5706
       153        2.0000           -0.3134760              -8.5301
       154        2.0000           -0.3001109              -8.1664
       155        2.0000           -0.2948603              -8.0236
       156        2.0000           -0.2712330              -7.3806
       157        1.8839           -0.2267898              -6.1713
       158        0.7364           -0.2225356              -6.0555 (HOMO)
       159        0.3796           -0.2213642              -6.0236 (LUMO)
       160        0.0001           -0.2131434              -5.7999
       161                         -0.1951079              -5.3092
       162                         -0.1732871              -4.7154
       163                         -0.1678156              -4.5665
       ...                                ...                  ...
       383                        485.8923118           13221.8028
      -------------------------------------------------------------
                  HL-Gap            0.0011714 Eh            0.0319 eV
             Fermi-level           -0.2233711 Eh           -6.0782 eV

 SCC (total)                   0 d,  0 h,  0 min,  1.289 sec
 SCC setup                      ...        0 min,  0.003 sec (  0.260%)
 Dispersion                     ...        0 min,  0.000 sec (  0.019%)
 integral evaluation            ...        0 min,  0.677 sec ( 52.483%)
 zeroth order Hamiltonian       ...        0 min,  0.003 sec (  0.214%)
 iterations                     ...        0 min,  0.392 sec ( 30.442%)
 molecular gradient             ...        0 min,  0.209 sec ( 16.208%)
 printout                       ...        0 min,  0.005 sec (  0.369%)

         :::::::::::::::::::::::::::::::::::::::::::::::::::::
         ::                     SUMMARY                     ::
         :::::::::::::::::::::::::::::::::::::::::::::::::::::
         :: total energy            -198.458477115345 Eh    ::
         :: gradient norm              0.312443468579 Eh/a0 ::
         :: HOMO-LUMO gap              0.031875263822 eV    ::
         ::.................................................::
         :: SCC energy              -201.640595540674 Eh    ::
         :: -> electrostatic           0.552530319113 Eh    ::
         :: repulsion energy           3.258799846534 Eh    ::
         :: dispersion energy         -0.076681421205 Eh    ::
         :: halogen bond corr.         0.000000000000 Eh    ::
         :: add. restraining           0.000000000000 Eh    ::
         :::::::::::::::::::::::::::::::::::::::::::::::::::::

------------------------------------------------------------------------
empirical EA shift (eV):    4.8455
delta SCC EA (eV):    2.2677
------------------------------------------------------------------------
           -------------------------------------------------
          |                Property Printout                |
           -------------------------------------------------

    * Orbital Energies and Occupations

         #    Occupation            Energy/Eh            Energy/eV
      -------------------------------------------------------------
         1        2.0000           -0.9826481             -26.7392
       ...           ...                  ...                  ...
       146        2.0000           -0.3360462              -9.1443
       147        2.0000           -0.3332607              -9.0685
       148        2.0000           -0.3318599              -9.0304
       149        2.0000           -0.3270906              -8.9006
       150        2.0000           -0.3204325              -8.7194
       151        2.0000           -0.3187164              -8.6727
       152        2.0000           -0.3149654              -8.5706
       153        2.0000           -0.3134760              -8.5301
       154        2.0000           -0.3001109              -8.1664
       155        2.0000           -0.2948603              -8.0236
       156        2.0000           -0.2712330              -7.3806
       157        1.8839           -0.2267898              -6.1713
       158        0.7364           -0.2225356              -6.0555 (HOMO)
       159        0.3796           -0.2213642              -6.0236 (LUMO)
       160        0.0001           -0.2131434              -5.7999
       161                         -0.1951079              -5.3092
       162                         -0.1732871              -4.7154
       163                         -0.1678156              -4.5665
       164                         -0.1523042              -4.1444
       165                         -0.1468670              -3.9965
       166                         -0.1411655              -3.8413
       167                         -0.1323894              -3.6025
       168                         -0.1321560              -3.5961
       169                         -0.1286028              -3.4995
       ...                                ...                  ...
       383                        485.8923118           13221.8028
      -------------------------------------------------------------
                  HL-Gap            0.0011714 Eh            0.0319 eV
             Fermi-level           -0.2233711 Eh           -6.0782 eV

  Mulliken/CM5 charges        n(s)   n(p)   n(d)
     1 C  -0.40470 -0.45246   1.035  2.561  0.000
     2 C  -0.30791 -0.30969   0.941  2.751  0.000
     3 C  -0.40923 -0.40983   1.030  2.561  0.000
     4 C   0.07459  0.07152   0.571  3.504  0.000
     5 C   0.06585  0.06423   1.082  2.984  0.000
     6 C   0.00443  0.03984   1.150  2.855  0.000
     7 O   0.37691  0.32989   1.626  4.751  0.000
     8 C   0.15507  0.16130   1.020  3.135  0.000
     9 C  -0.08387  0.03526   1.214  2.702  0.000
    10 N   0.31938  0.18920   1.523  3.796  0.000
    11 C  -0.07824  0.03944   1.212  2.710  0.000
    12 N   0.32172  0.19117   1.505  3.817  0.000
    13 C   0.04217 -0.00509   1.078  2.964  0.000
    14 C  -0.09564 -0.07908   1.138  2.766  0.000
    15 C  -0.10661 -0.08990   1.148  2.745  0.000
    16 C   0.02502 -0.02224   1.083  2.942  0.000
    17 F   0.18387  0.16059   1.694  5.490  0.000
    18 F   0.17692  0.15387   1.698  5.479  0.000
    19 C   0.11891  0.12505   1.094  3.025  0.000
    20 S   0.10448  0.07294   1.893  4.052  0.159
    21 C   0.00726  0.02428   1.118  2.889  0.000
    22 C  -0.06813 -0.04541   1.094  2.838  0.000
    23 C   0.07166  0.02253   1.048  3.024  0.000
    24 C  -0.00975  0.00704   1.134  2.856  0.000
    25 C  -0.06733 -0.04241   1.067  2.866  0.000
    26 C  -0.08510 -0.05830   1.085  2.830  0.000
    27 C   0.00267  0.01863   1.123  2.879  0.000
    28 S   0.09607  0.06309   1.883  4.112  0.101
    29 O   0.25236  0.16459   1.598  4.654  0.000
    30 O   0.22621  0.13910   1.606  4.620  0.000
    31 C  -0.05637 -0.13979   1.131  2.812  0.000
    32 C   0.05906 -0.09062   1.072  2.987  0.000
    33 C  -0.05745 -0.14159   1.128  2.815  0.000
    34 C   0.05790 -0.09112   1.078  2.980  0.000
    35 C  -0.01079  0.00125   1.139  2.851  0.000
    36 S   0.07767  0.04742   1.894  4.039  0.144
    37 C   0.01561  0.02684   1.145  2.871  0.000
    38 C  -0.08221 -0.06041   1.116  2.802  0.000
    39 C   0.05594  0.00829   1.033  3.023  0.000
    40 O   0.25412  0.16354   1.634  4.620  0.000
    41 C  -0.02927 -0.11312   1.144  2.827  0.000
    42 C   0.35865  0.20893   1.000  3.359  0.000
    43 C   0.13405  0.08794   1.061  3.073  0.000
    44 C   0.04915  0.04751   1.058  2.991  0.000
    45 C   0.00543  0.00486   1.101  2.905  0.000
    46 C   0.01920  0.01612   1.076  2.943  0.000
    47 C   0.03274  0.03111   1.090  2.942  0.000
    48 C  -0.13537 -0.10006   1.169  2.696  0.000
    49 O   0.33175  0.28343   1.645  4.687  0.000
    50 C   0.02399  0.03026   1.026  2.997  0.000
    51 C  -0.09254  0.02652   1.213  2.694  0.000
    52 N   0.32214  0.19210   1.528  3.794  0.000
    53 C  -0.09135  0.02656   1.217  2.692  0.000
    54 N   0.32023  0.19019   1.517  3.803  0.000
    55 C   0.14264  0.09538   1.056  3.086  0.000
    56 C  -0.08724 -0.07075   1.157  2.755  0.000
    57 C  -0.08464 -0.06800   1.147  2.768  0.000
    58 C   0.12971  0.08243   1.083  3.047  0.000
    59 F   0.20083  0.17762   1.706  5.495  0.000
    60 F   0.20119  0.17822   1.705  5.496  0.000
    61 O   0.28255  0.19635   1.662  4.620  0.000
    62 C   0.24075  0.15703   1.036  3.204  0.000
    63 C   0.62716  0.47741   0.893  3.734  0.000
    64 H   0.17701  0.24521   1.177  0.000  0.000
    65 H  -0.01138  0.05368   0.989  0.000  0.000
    66 H  -0.03363  0.02588   0.966  0.000  0.000
    67 H   0.01565  0.07571   1.016  0.000  0.000
    68 H  -0.03442  0.03141   0.966  0.000  0.000
    69 H  -0.03119  0.03376   0.969  0.000  0.000
    70 H  -0.02579  0.02876   0.974  0.000  0.000
    71 H  -0.02731  0.02981   0.973  0.000  0.000
    72 H  -0.02478  0.02747   0.975  0.000  0.000
    73 H  -0.03855  0.03180   0.961  0.000  0.000
    74 H  -0.03855  0.02576   0.961  0.000  0.000
    75 H  -0.02317  0.02911   0.977  0.000  0.000
    76 H  -0.02446  0.03020   0.976  0.000  0.000
    77 H  -0.02642  0.03166   0.974  0.000  0.000
    78 H  -0.02059  0.04068   0.979  0.000  0.000
    79 H  -0.00639  0.05662   0.994  0.000  0.000
    80 H   0.00055  0.06487   1.001  0.000  0.000
    81 H   0.02026  0.07500   1.020  0.000  0.000
    82 H  -0.30921 -0.25699   0.691  0.000  0.000
    83 H  -0.27587 -0.22158   0.724  0.000  0.000
    84 H  -0.32552 -0.25241   0.674  0.000  0.000
    85 H  -0.30506 -0.24008   0.695  0.000  0.000
    86 H  -0.28514 -0.22561   0.715  0.000  0.000
    87 H  -0.29938 -0.23507   0.701  0.000  0.000
    88 H  -0.26892 -0.20583   0.731  0.000  0.000
    89 H  -0.29992 -0.24571   0.700  0.000  0.000
    90 H  -0.29199 -0.23972   0.708  0.000  0.000
    91 H  -0.31016 -0.25541   0.690  0.000  0.000
(R)spin-density population

 Mulliken population n(s)   n(p)   n(d)
     1 C   0.0067   0.000  0.007  0.000
     2 C   0.0060   0.000  0.006  0.000
     3 C   0.0229   0.000  0.023  0.000
     4 C   0.0488  -0.000  0.049  0.000
     5 C   0.0670   0.000  0.067  0.000
     6 C   0.0573  -0.000  0.057  0.000
     7 O   0.0563   0.000  0.056  0.000
     8 C   0.0181  -0.000  0.018  0.000
     9 C   0.0036  -0.000  0.004  0.000
    10 N   0.0098  -0.000  0.010  0.000
    11 C   0.0049   0.000  0.005  0.000
    12 N   0.0111   0.000  0.011  0.000
    13 C   0.0288  -0.000  0.029  0.000
    14 C   0.0277   0.000  0.028  0.000
    15 C   0.0517   0.000  0.052  0.000
    16 C   0.0069   0.000  0.007  0.000
    17 F   0.0033   0.000  0.003  0.000
    18 F   0.0060   0.000  0.006  0.000
    19 C   0.0168   0.000  0.017  0.000
    20 S   0.0147   0.000  0.013  0.002
    21 C   0.0049  -0.000  0.005  0.000
    22 C   0.0114  -0.000  0.011  0.000
    23 C   0.0082   0.000  0.008  0.000
    24 C   0.0214  -0.000  0.021  0.000
    25 C   0.0050  -0.000  0.005  0.000
    26 C   0.0155  -0.000  0.016  0.000
    27 C   0.0063   0.000  0.006  0.000
    28 S   0.0150   0.000  0.012  0.003
    29 O   0.0004   0.000  0.000  0.000
    30 O   0.0036   0.000  0.004  0.000
    31 C   0.0005   0.000  0.000  0.000
    32 C   0.0001   0.000  0.000  0.000
    33 C   0.0006   0.000  0.000  0.000
    34 C   0.0004   0.000  0.000  0.000
    35 C   0.0272  -0.000  0.027  0.000
    36 S   0.0166   0.000  0.014  0.002
    37 C   0.0022   0.000  0.002  0.000
    38 C   0.0186   0.000  0.019  0.000
    39 C   0.0048   0.000  0.005  0.000
    40 O   0.0061   0.000  0.006  0.000
    41 C   0.0001  -0.000  0.000  0.000
    42 C   0.0006   0.000  0.001  0.000
    43 C   0.0351   0.000  0.035  0.000
    44 C   0.0047   0.000  0.005  0.000
    45 C   0.0556   0.000  0.056  0.000
    46 C   0.0031   0.000  0.003  0.000
    47 C   0.0137   0.000  0.014  0.000
    48 C   0.0018   0.000  0.002  0.000
    49 O   0.0014   0.000  0.001  0.000
    50 C   0.0333   0.000  0.033  0.000
    51 C   0.0067   0.000  0.007  0.000
    52 N   0.0187   0.000  0.019  0.000
    53 C   0.0071   0.000  0.007  0.000
    54 N   0.0194   0.000  0.019  0.000
    55 C   0.0126   0.000  0.013  0.000
    56 C   0.0007   0.000  0.001  0.000
    57 C   0.0140   0.000  0.014  0.000
    58 C   0.0000  -0.000  0.000  0.000
    59 F   0.0001   0.000  0.000  0.000
    60 F   0.0017  -0.000  0.002  0.000
    61 O   0.0066   0.001  0.005  0.000
    62 C   0.0355  -0.000  0.036  0.000
    63 C   0.0590  -0.000  0.059  0.000
    64 H   0.0003   0.000  0.000  0.000
    65 H   0.0000   0.000  0.000  0.000
    66 H   0.0000   0.000  0.000  0.000
    67 H   0.0005   0.000  0.000  0.000
    68 H   0.0000   0.000  0.000  0.000
    69 H   0.0001   0.000  0.000  0.000
    70 H   0.0000   0.000  0.000  0.000
    71 H   0.0000   0.000  0.000  0.000
    72 H   0.0001   0.000  0.000  0.000
    73 H   0.0000   0.000  0.000  0.000
    74 H   0.0000   0.000  0.000  0.000
    75 H   0.0000   0.000  0.000  0.000
    76 H   0.0000   0.000  0.000  0.000
    77 H   0.0000   0.000  0.000  0.000
    78 H   0.0000   0.000  0.000  0.000
    79 H   0.0002   0.000  0.000  0.000
    80 H   0.0000   0.000  0.000  0.000
    81 H   0.0000   0.000  0.000  0.000
    82 H   0.0001   0.000  0.000  0.000
    83 H   0.0000   0.000  0.000  0.000
    84 H   0.0000   0.000  0.000  0.000
    85 H   0.0000   0.000  0.000  0.000
    86 H   0.0000   0.000  0.000  0.000
    87 H   0.0071   0.007  0.000  0.000
    88 H   0.0047   0.005  0.000  0.000
    89 H   0.0069   0.007  0.000  0.000
    90 H   0.0004   0.000  0.000  0.000
    91 H   0.0104   0.010  0.000  0.000

Wiberg/Mayer (AO) data.
largest (>0.10) Wiberg bond orders for each atom
          total WBO             WBO to atom ...
     1  C   3.911        C    2 1.464    C   19 1.264    H   64 0.991
     2  C   4.009        C    1 1.464    C    6 1.162    C    3 1.152
     3  C   3.910        C    8 1.366    C    2 1.152    C    4 1.026
     4  C   3.504        C   13 1.261    C    5 1.121    C    3 1.026
     5  C   3.733        C   16 1.426    C    4 1.121    C    6 1.040
     6  C   3.857        O    7 1.573    C    2 1.162    C    5 1.040
     7  O   1.859        C    6 1.573    S   20 0.143
     8  C   3.712        C    3 1.366    C   11 1.151    C    9 1.134
     9  C   4.101        N   10 2.878    C    8 1.134
    10  N   2.909        C    9 2.878
    11  C   4.089        N   12 2.853    C    8 1.151
    12  N   2.883        C   11 2.853
    13  C   3.785        C   14 1.444    C    4 1.261    H   65 1.006
    14  C   3.925        C   13 1.444    C   15 1.338    F   17 1.038
    15  C   3.894        C   16 1.413    C   14 1.338    F   18 1.054
    16  C   3.877        C    5 1.426    C   15 1.413    H   66 0.995
    17  F   0.963        C   14 1.038
    18  F   0.984        C   15 1.054
    19  C   3.813        C   23 1.325    C    1 1.264    S   20 1.149
    20  S   2.660        C   21 1.179    C   19 1.149    O    7 0.143
    21  C   3.846        C   22 1.321    C   24 1.285    S   20 1.179
    22  C   3.868        C   23 1.373    C   21 1.321    O   61 1.147
    23  C   3.770        C   22 1.373    C   19 1.325    H   67 0.986
    24  C   3.870        C   25 1.384    C   21 1.285    S   28 1.174
    25  C   3.807        C   24 1.384    C   26 1.334    O   29 1.060
    26  C   3.848        C   27 1.369    C   25 1.334    O   30 1.107
    27  C   3.857        C   26 1.369    C   35 1.269    S   28 1.151
    28  S   2.519        C   24 1.174    C   27 1.151
    29  O   2.044        C   25 1.060    C   31 0.954
    30  O   2.159        C   26 1.107    C   33 0.954
    31  C   3.921        H   69 1.001    H   68 0.994    C   32 0.990    O   29 0.954
    32  C   3.909        H   70 1.004    H   71 1.003    C   31 0.990    H   72 0.984
    33  C   3.910        H   73 1.003    H   74 0.992    C   34 0.990    O   30 0.954
    34  C   3.929        H   77 0.998    H   76 0.998    C   33 0.990    H   75 0.985
    35  C   3.878        C   39 1.379    C   27 1.269    S   36 1.190
    36  S   2.638        C   35 1.190    C   37 1.129    O   49 0.113
    37  C   3.897        C   43 1.411    C   38 1.268    S   36 1.129
    38  C   3.896        C   39 1.400    C   37 1.268    O   40 1.153
    39  C   3.760        C   38 1.400    C   35 1.379    H   78 0.994
    40  O   2.245        C   38 1.153    C   41 0.945
    41  C   3.937        C   42 0.996    H   80 0.996    H   79 0.989    O   40 0.945
    42  C   3.658        C   41 0.996    H   81 0.968    H   83 0.873    H   82 0.823
    43  C   3.613        C   37 1.411    C   44 1.410    H   84 0.786
    44  C   3.818        C   43 1.410    C   45 1.215    C   48 1.127
    45  C   3.801        C   50 1.397    C   44 1.215    C   46 1.103
    46  C   3.871        C   55 1.427    C   47 1.316    C   45 1.103
    47  C   3.875        C   58 1.452    C   46 1.316    C   48 1.047
    48  C   3.972        O   49 1.744    C   44 1.127    C   47 1.047
    49  O   2.020        C   48 1.744    S   36 0.113
    50  C   3.744        C   45 1.397    C   53 1.169    C   51 1.168
    51  C   4.096        N   52 2.863    C   50 1.168
    52  N   2.893        C   51 2.863
    53  C   4.105        N   54 2.849    C   50 1.169
    54  N   2.861        C   53 2.849
    55  C   3.701        C   46 1.427    C   56 1.424    H   85 0.849
    56  C   3.993        C   55 1.424    C   57 1.398    F   59 1.027
    57  C   3.950        C   58 1.411    C   56 1.398    F   60 1.026
    58  C   3.780        C   47 1.452    C   57 1.411    H   86 0.880
    59  F   0.979        C   56 1.027
    60  F   0.968        C   57 1.026
    61  O   2.264        C   22 1.147    C   62 0.901
    62  C   3.501        O   61 0.901    C   63 0.898    H   88 0.860    H   87 0.814
    63  C   3.294        C   62 0.898    H   90 0.807    H   89 0.806    H   91 0.739
    64  H   1.117        C    1 0.991
    65  H   1.093        C   13 1.006
    66  H   1.040        C   16 0.995
    67  H   1.091        C   23 0.986
    68  H   1.052        C   31 0.994
    69  H   1.016        C   31 1.001
    70  H   1.022        C   32 1.004
    71  H   1.027        C   32 1.003
    72  H   1.031        C   32 0.984
    73  H   1.021        C   33 1.003
    74  H   1.035        C   33 0.992
    75  H   1.027        C   34 0.985
    76  H   1.021        C   34 0.998
    77  H   1.041        C   34 0.998
    78  H   1.016        C   39 0.994
    79  H   1.030        C   41 0.989
    80  H   1.075        C   41 0.996
    81  H   0.948        C   42 0.968
    82  H   0.904        C   42 0.823
    83  H   0.931        C   42 0.873
    84  H   0.932        C   43 0.786
    85  H   0.939        C   55 0.849
    86  H   0.938        C   58 0.880
    87  H   0.923        C   62 0.814
    88  H   0.938        C   62 0.860
    89  H   0.930        C   63 0.806
    90  H   0.962        C   63 0.807
    91  H   0.911        C   63 0.739

 dipole moment from electron density (au)
     X       Y       Z   
   6.0264   0.9728 -15.4990  total (Debye):   42.340


           -------------------------------------------------
          | TOTAL ENERGY             -198.458477115345 Eh   |
          | GRADIENT NORM               0.312443468579 Eh/α |
          | HOMO-LUMO GAP               0.031875263822 eV   |
           -------------------------------------------------

------------------------------------------------------------------------
 * finished run on 2021/12/02 at 16:23:10.332     
------------------------------------------------------------------------
 total:
 * wall-time:     0 d,  0 h,  0 min,  4.901 sec
 *  cpu-time:     0 d,  0 h,  0 min,  4.866 sec
 * ratio c/w:     0.993 speedup
 SCF:
 * wall-time:     0 d,  0 h,  0 min,  4.210 sec
 *  cpu-time:     0 d,  0 h,  0 min,  4.186 sec
 * ratio c/w:     0.994 speedup

