      -----------------------------------------------------------      
     |                   =====================                   |     
     |                           x T B                           |     
     |                   =====================                   |     
     |                         S. Grimme                         |     
     |          Mulliken Center for Theoretical Chemistry        |     
     |                    University of Bonn                     |     
     |                Version 6.2 RC2 (SAW190805)                |     
      -----------------------------------------------------------      

   This program is distributed in the hope that it will be useful,
   but WITHOUT ANY WARRANTY; without even the implied warranty of
   MERCHANTABILITY or FITNESS FOR A PARTICULAR PURPOSE.
   
   FOR NON-COMMERCIAL, ACADEMIA USE ONLY.
   
   Cite this work as:
   * S. Grimme, C. Bannwarth, P. Shushkov, J. Chem. Theory Comput., 2017,
     13, 1989-2009. DOI: 10.1021/acs.jctc.7b00118
   * C. Bannwarth, S. Ehlert and S. Grimme., J. Chem. Theory Comput., 2019,
     15, 1652-1671. DOI: 10.1021/acs.jctc.8b01176
   * P. Pracht, E. Caldeweyher, S. Ehlert, S. Grimme, ChemRxiv, 2019, preprint.
     DOI: 10.26434/chemrxiv.8326202.v1
   
   for DFT-D4:
   * E. Caldeweyher, C. Bannwarth and S. Grimme, J. Chem. Phys., 2017,
     147, 034112. DOI: 10.1063/1.4993215
   * E. Caldeweyher, S. Ehlert, A. Hansen, H. Neugebauer, S. Spicher,
     C. Bannwarth and S. Grimme, J. Chem. Phys., 2019, 150, 154122.
     DOI: 10.1063/1.5090222
   
   for sTDA-xTB:
   * S. Grimme and C. Bannwarth, J. Chem. Phys., 2016, 145, 054103.
     DOI: 10.1063/1.4959605
   
   in the mass-spec context:
   * V. Asgeirsson, C. Bauer and S. Grimme, Chem. Sci., 2017, 8, 4879.
     DOI: 10.1039/c7sc00601b
   
   for metadynamics refer to:
   * S. Grimme, J. Chem. Theory Comput., 2019, 155, 2847-2862
     DOI: 10.1021/acs.jctc.9b00143
   
   with help from (in alphabetical order)
   C. Bannwarth, F. Bohle, G. Brandenburg, E. Caldeweyher, M. Checinski,
   S. Dohm, S. Ehlert, S. Ehrlich, F. März, H. Neugebauer, J. Pisarek,
   P. Pracht, P. Shushkov, and S. Spicher.
   
 * started run on 2021/12/02 at 16:23:10.346     

           -------------------------------------------------
          |                Calculation Setup                |
           -------------------------------------------------

          program call               : /ihome/ghutchison/geoffh/xtb/xtb AOT3.xyz --vipea
          hostname                   : smp-n128
          coordinate file            : AOT3.xyz
          omp threads                :                     1
          number of atoms            :                    91
          number of electrons        :                   314
          charge                     :                     0
          spin                       :                   0.0
          first test random number   :      0.13943337595641


########################################################################
# WARNING! Please study the warnings concerning your input carefully
#  - XTBPATH is not set, using XTBHOME instead
########################################################################

           ------------------------------------------------- 
          |                 I P E A - x T B                 |
          |  Ionisation Potentials and Electron Affinities  |
           ------------------------------------------------- 
             KAB for M(3d)-M(3d) :                1.1000
             KAB for M(4d)-M(4d) :                1.2000
             KAB for M(5d)-M(5d) :                1.2000
             k(s)                :                2.1500
             k(p)                :                2.3000
             k(d)                :                2.0000
             k(f)                :                0.0000
             kEN (H0ij)          :                0.7000
             D3 a1               :                0.6300
             D3 a2               :                5.0000
             D3 s6               :                1.0000
             D3 s8               :                2.4000
             D3 s9               :                0.0000
             alphaj              :                1.0000
             XBdamp              :                0.4400
             XBrad               :                1.3000
             kcnsh               :      1.0000   -0.3000   -0.5000    0.5000

  Z AO/shell   Hii/eV     exponent
  1     Thu Sep 22 23:34:11 CEST 2016   EN: 2.200 GAM: 0.405  GM3: 0.1500
     1s    -10.521941    1.306199
     2s     -3.560151    0.398421
  6     Thu Sep 22 23:34:11 CEST 2016   EN: 2.550 GAM: 0.640  GM3: 0.1500
     2s    -15.968100    1.979793
     2p     -9.777107    1.850537
     3S     -3.366990    0.633095
  7     Thu Sep 22 23:34:11 CEST 2016   EN: 3.040 GAM: 0.493  GM3:-0.1000
     2s    -24.040776    2.126160
     2p    -14.426520    2.068425
     3S     -5.882278    0.671040
  8     Thu Sep 22 23:34:11 CEST 2016   EN: 3.440 GAM: 0.717  GM3:-0.2000
     2s    -26.695120    2.575264
     2p    -16.014457    2.159448
     3S     -6.622058    0.958679
  9     Tue Jan 17 20:22:52 CET 2017    EN: 3.980 GAM: 0.574  GM3: 0.2000
     2s    -27.565998    2.304073
     2p    -17.439238    2.314354
     3S     -6.120500    0.570243
 16     Tue Jan 17 20:57:36 CET 2017    EN: 2.580 GAM: 0.455  GM3: 0.1020
     3s    -24.488821    2.492075
     3p    -12.136640    1.997904
     3d     -1.796070    1.747541

           ------------------------------------------------- 
          |        Self-Consistent Charge Iterations        |
           ------------------------------------------------- 

          ...................................................
          :                      SETUP                      :
          :.................................................:
          :  # basis functions                 386          :
          :  # atomic orbitals                 383          :
          :  # shells                          245          :
          :  # electrons                       314          :
          :  # halogen bonds                     0          :
          :  max. iterations                   250          :
          :  Hamiltonian                  GFN1-xTB          :
          :  restarted?                      false          :
          :  GBSA solvation                  false          :
          :  PC potential                    false          :
          :  electronic temp.          300.0000000     K    :
          :  accuracy                    1.0000000          :
          :  -> integral cutoff          0.2500000E+02      :
          :  -> integral neglect         0.1000000E-07      :
          :  -> SCF convergence          0.1000000E-05 Eh   :
          :  -> wf. convergence          0.2000000E-04 e    :
          :  Broyden damping             0.4000000          :
          ...................................................

 iter      E             dE          RMSdq      gap      omega  full diag
   1   -197.5630165 -0.197563E+03  0.102E+01    0.32       0.0  T
   2   -196.9926956  0.570321E+00  0.663E+00    0.17       1.0  T
   3   -173.0422342  0.239505E+02  0.663E+00    0.07       1.0  T
   4   -163.8427968  0.919944E+01  0.647E+00    0.20       1.0  T
   5   -200.0661999 -0.362234E+02  0.217E+00    0.80       1.0  T
   6   -200.9808658 -0.914666E+00  0.111E+00    0.23       1.0  T
   7   -201.2079204 -0.227055E+00  0.917E-01    0.33       1.0  T
   8   -201.0963075  0.111613E+00  0.863E-01    0.19       1.0  T
   9   -201.1883267 -0.920192E-01  0.859E-01    0.62       1.0  T
  10   -200.7665145  0.421812E+00  0.107E+00    0.17       1.0  T
  11   -201.1966101 -0.430096E+00  0.557E-01    0.11       1.0  T
  12   -200.9328638  0.263746E+00  0.827E-01    0.08       1.0  T
  13   -201.2692368 -0.336373E+00  0.324E-01    0.12       1.0  T
  14   -200.9586963  0.310541E+00  0.794E-01    0.08       1.0  T
  15   -201.2782067 -0.319510E+00  0.213E-01    0.10       1.0  T
  16   -201.2851524 -0.694571E-02  0.175E-01    0.10       1.0  T
  17   -201.2822660  0.288642E-02  0.176E-01    0.08       1.0  T
  18   -201.2963851 -0.141191E-01  0.537E-02    0.09       1.0  T
  19   -201.2961115  0.273654E-03  0.599E-02    0.10       1.0  T
  20   -201.2970360 -0.924596E-03  0.387E-02    0.09       1.0  T
  21   -201.2975427 -0.506650E-03  0.160E-02    0.10       1.0  T
  22   -201.2976234 -0.807010E-04  0.896E-03    0.10       1.2  T
  23   -201.2976195  0.393888E-05  0.833E-03    0.10       1.3  T
  24   -201.2976491 -0.296183E-04  0.265E-03    0.10       4.0  T
  25   -201.2976513 -0.226186E-05  0.155E-03    0.10       6.8  T
  26   -201.2976519 -0.594635E-06  0.810E-04    0.10      12.9  T
  27   -201.2976521 -0.123006E-06  0.629E-04    0.10      16.7  T
  28   -201.2976522 -0.186526E-06  0.128E-04    0.10      81.8  T
  29   -201.2976523 -0.667262E-08  0.467E-05    0.10     224.5  T

   *** convergence criteria satisfied after 29 iterations ***

         #    Occupation            Energy/Eh            Energy/eV
      -------------------------------------------------------------
         1        2.0000           -1.0578193             -28.7847
       ...           ...                  ...                  ...
       151        2.0000           -0.3894506             -10.5975
       152        2.0000           -0.3820663             -10.3966
       153        2.0000           -0.3779241             -10.2838
       154        2.0000           -0.3729334             -10.1480
       155        2.0000           -0.3493782              -9.5071
       156        1.9978           -0.3073101              -8.3623
       157        1.7436           -0.3026637              -8.2359 (HOMO)
       158        0.2239           -0.2988754              -8.1328 (LUMO)
       159        0.0347           -0.2970081              -8.0820
       160        0.0000           -0.2891730              -7.8688
       161                         -0.2803836              -7.6296
       162                         -0.2478944              -6.7456
       ...                                ...                  ...
       383                        484.1752974           13175.0804
      -------------------------------------------------------------
                  HL-Gap            0.0037883 Eh            0.1031 eV
             Fermi-level           -0.3008427 Eh           -8.1863 eV

 SCC (total)                   0 d,  0 h,  0 min,  1.537 sec
 SCC setup                      ...        0 min,  0.003 sec (  0.218%)
 Dispersion                     ...        0 min,  0.000 sec (  0.018%)
 integral evaluation            ...        0 min,  0.669 sec ( 43.532%)
 zeroth order Hamiltonian       ...        0 min,  0.003 sec (  0.183%)
 iterations                     ...        0 min,  0.648 sec ( 42.153%)
 molecular gradient             ...        0 min,  0.210 sec ( 13.680%)
 printout                       ...        0 min,  0.003 sec (  0.213%)

         :::::::::::::::::::::::::::::::::::::::::::::::::::::
         ::                     SUMMARY                     ::
         :::::::::::::::::::::::::::::::::::::::::::::::::::::
         :: total energy            -198.118581386221 Eh    ::
         :: gradient norm              0.264898657116 Eh/a0 ::
         :: HOMO-LUMO gap              0.103085930209 eV    ::
         ::.................................................::
         :: SCC energy              -201.297652250923 Eh    ::
         :: -> electrostatic           0.528383270876 Eh    ::
         :: repulsion energy           3.257306055553 Eh    ::
         :: dispersion energy         -0.078235190852 Eh    ::
         :: halogen bond corr.         0.000000000000 Eh    ::
         :: add. restraining           0.000000000000 Eh    ::
         :::::::::::::::::::::::::::::::::::::::::::::::::::::

           ------------------------------------------------- 
          |        vertical delta SCC IP calculation        |
           ------------------------------------------------- 

          ...................................................
          :                      SETUP                      :
          :.................................................:
          :  # basis functions                 386          :
          :  # atomic orbitals                 383          :
          :  # shells                          245          :
          :  # electrons                       313          :
          :  # halogen bonds                     0          :
          :  max. iterations                   250          :
          :  Hamiltonian                  GFN1-xTB          :
          :  restarted?                       true          :
          :  GBSA solvation                  false          :
          :  PC potential                    false          :
          :  electronic temp.          300.0000000     K    :
          :  accuracy                    1.0000000          :
          :  -> integral cutoff          0.2500000E+02      :
          :  -> integral neglect         0.1000000E-07      :
          :  -> SCF convergence          0.1000000E-05 Eh   :
          :  -> wf. convergence          0.2000000E-04 e    :
          :  Broyden damping             0.4000000          :
          ...................................................

 iter      E             dE          RMSdq      gap      omega  full diag
   1   -200.9249553 -0.200925E+03  0.312E-01    0.10       0.0  T
   2   -200.8410302  0.839251E-01  0.584E-01    0.51       1.0  T
   3   -200.9152177 -0.741875E-01  0.336E-01    0.44       1.0  T
   4   -200.9241142 -0.889653E-02  0.284E-01    0.37       1.0  T
   5   -200.9266863 -0.257210E-02  0.281E-01    0.23       1.0  T
   6   -200.9373446 -0.106583E-01  0.209E-01    0.24       1.0  T
   7   -200.9406245 -0.327988E-02  0.190E-01    0.30       1.0  T
   8   -200.9548006 -0.141761E-01  0.294E-02    0.30       1.0  T
   9   -200.9544615  0.339151E-03  0.396E-02    0.31       1.0  T
  10   -200.9550884 -0.626977E-03  0.422E-03    0.31       2.5  T
  11   -200.9550803  0.817940E-05  0.568E-03    0.31       1.8  T
  12   -200.9550920 -0.116864E-04  0.197E-03    0.31       5.3  T
  13   -200.9550925 -0.589692E-06  0.146E-03    0.31       7.2  T
  14   -200.9550933 -0.806539E-06  0.225E-04    0.31      46.6  T
  15   -200.9550934 -0.992378E-08  0.136E-04    0.31      77.2  T
  16   -200.9550934 -0.628822E-08  0.251E-05    0.31     418.1  T

   *** convergence criteria satisfied after 16 iterations ***

         #    Occupation            Energy/Eh            Energy/eV
      -------------------------------------------------------------
         1        2.0000           -1.1313954             -30.7868
       ...           ...                  ...                  ...
       151        2.0000           -0.4653058             -12.6616
       152        2.0000           -0.4623925             -12.5823
       153        2.0000           -0.4585895             -12.4789
       154        2.0000           -0.4484052             -12.2017
       155        2.0000           -0.4255471             -11.5797
       156        1.8249           -0.3881422             -10.5619
       157        1.1724           -0.3851961             -10.4817 (HOMO)
       158        0.0027           -0.3739267             -10.1751 (LUMO)
       159        0.0000           -0.3678516             -10.0098
       160                         -0.3599114              -9.7937
       161                         -0.3533785              -9.6159
       162                         -0.3189530              -8.6792
       ...                                ...                  ...
       383                        484.1039184           13173.1381
      -------------------------------------------------------------
                  HL-Gap            0.0112694 Eh            0.3067 eV
             Fermi-level           -0.3831052 Eh          -10.4248 eV

 SCC (total)                   0 d,  0 h,  0 min,  1.234 sec
 SCC setup                      ...        0 min,  0.003 sec (  0.273%)
 Dispersion                     ...        0 min,  0.000 sec (  0.013%)
 integral evaluation            ...        0 min,  0.659 sec ( 53.348%)
 zeroth order Hamiltonian       ...        0 min,  0.003 sec (  0.223%)
 iterations                     ...        0 min,  0.355 sec ( 28.749%)
 molecular gradient             ...        0 min,  0.211 sec ( 17.093%)
 printout                       ...        0 min,  0.004 sec (  0.296%)

         :::::::::::::::::::::::::::::::::::::::::::::::::::::
         ::                     SUMMARY                     ::
         :::::::::::::::::::::::::::::::::::::::::::::::::::::
         :: total energy            -197.776022500129 Eh    ::
         :: gradient norm              0.243524685556 Eh/a0 ::
         :: HOMO-LUMO gap              0.306655150113 eV    ::
         ::.................................................::
         :: SCC energy              -200.955093364830 Eh    ::
         :: -> electrostatic           0.568927491763 Eh    ::
         :: repulsion energy           3.257306055553 Eh    ::
         :: dispersion energy         -0.078235190852 Eh    ::
         :: halogen bond corr.         0.000000000000 Eh    ::
         :: add. restraining           0.000000000000 Eh    ::
         :::::::::::::::::::::::::::::::::::::::::::::::::::::

------------------------------------------------------------------------
empirical IP shift (eV):    4.8455
delta SCC IP (eV):    4.4760
------------------------------------------------------------------------
           ------------------------------------------------- 
          |        vertical delta SCC EA calculation        |
           ------------------------------------------------- 

          ...................................................
          :                      SETUP                      :
          :.................................................:
          :  # basis functions                 386          :
          :  # atomic orbitals                 383          :
          :  # shells                          245          :
          :  # electrons                       315          :
          :  # halogen bonds                     0          :
          :  max. iterations                   250          :
          :  Hamiltonian                  GFN1-xTB          :
          :  restarted?                       true          :
          :  GBSA solvation                  false          :
          :  PC potential                    false          :
          :  electronic temp.          300.0000000     K    :
          :  accuracy                    1.0000000          :
          :  -> integral cutoff          0.2500000E+02      :
          :  -> integral neglect         0.1000000E-07      :
          :  -> SCF convergence          0.1000000E-05 Eh   :
          :  -> wf. convergence          0.2000000E-04 e    :
          :  Broyden damping             0.4000000          :
          ...................................................

 iter      E             dE          RMSdq      gap      omega  full diag
   1   -201.5067956 -0.201507E+03  0.445E-01    0.17       0.0  T
   2   -200.8251423  0.681653E+00  0.120E+00    0.15       1.0  T
   3   -201.4662903 -0.641148E+00  0.445E-01    0.17       1.0  T
   4   -201.5264488 -0.601585E-01  0.305E-01    0.08       1.0  T
   5   -201.5057753  0.206735E-01  0.344E-01    0.20       1.0  T
   6   -201.5296978 -0.239225E-01  0.264E-01    0.08       1.0  T
   7   -201.5543966 -0.246988E-01  0.111E-01    0.07       1.0  T
   8   -201.5586219 -0.422532E-02  0.454E-02    0.04       1.0  T
   9   -201.5590726 -0.450686E-03  0.200E-02    0.04       1.0  T
  10   -201.5590761 -0.349820E-05  0.160E-02    0.04       1.0  T
  11   -201.5591805 -0.104429E-03  0.801E-03    0.04       1.3  T
  12   -201.5592021 -0.215598E-04  0.370E-03    0.04       2.8  T
  13   -201.5592033 -0.123670E-05  0.322E-03    0.04       3.3  T
  14   -201.5592039 -0.633592E-06  0.304E-03    0.04       3.4  T
  15   -201.5592088 -0.484923E-05  0.646E-04    0.04      16.2  T
  16   -201.5592090 -0.180221E-06  0.158E-04    0.04      66.5  T
  17   -201.5592089  0.188670E-07  0.216E-04    0.04      48.6  T
  18   -201.5592090 -0.143898E-07  0.147E-04    0.04      71.2  T

   *** convergence criteria satisfied after 18 iterations ***

         #    Occupation            Energy/Eh            Energy/eV
      -------------------------------------------------------------
         1        2.0000           -0.9904517             -26.9516
       ...           ...                  ...                  ...
       152        2.0000           -0.3078795              -8.3778
       153        2.0000           -0.3052815              -8.3071
       154        2.0000           -0.2993805              -8.1466
       155        2.0000           -0.2761970              -7.5157
       156        1.9997           -0.2334539              -6.3526
       157        1.9016           -0.2280006              -6.2042
       158        0.7685           -0.2235064              -6.0819 (HOMO)
       159        0.3275           -0.2219870              -6.0406 (LUMO)
       160        0.0027           -0.2171027              -5.9077
       161        0.0000           -0.2076809              -5.6513
       162                         -0.1822330              -4.9588
       163                         -0.1747699              -4.7557
       ...                                ...                  ...
       383                        484.2502273           13177.1194
      -------------------------------------------------------------
                  HL-Gap            0.0015194 Eh            0.0413 eV
             Fermi-level           -0.2242987 Eh           -6.1035 eV

 SCC (total)                   0 d,  0 h,  0 min,  1.273 sec
 SCC setup                      ...        0 min,  0.003 sec (  0.257%)
 Dispersion                     ...        0 min,  0.000 sec (  0.020%)
 integral evaluation            ...        0 min,  0.658 sec ( 51.693%)
 zeroth order Hamiltonian       ...        0 min,  0.003 sec (  0.215%)
 iterations                     ...        0 min,  0.393 sec ( 30.874%)
 molecular gradient             ...        0 min,  0.211 sec ( 16.538%)
 printout                       ...        0 min,  0.005 sec (  0.398%)

         :::::::::::::::::::::::::::::::::::::::::::::::::::::
         ::                     SUMMARY                     ::
         :::::::::::::::::::::::::::::::::::::::::::::::::::::
         :: total energy            -198.380138098042 Eh    ::
         :: gradient norm              0.295229986579 Eh/a0 ::
         :: HOMO-LUMO gap              0.041346116719 eV    ::
         ::.................................................::
         :: SCC energy              -201.559208962743 Eh    ::
         :: -> electrostatic           0.561098015920 Eh    ::
         :: repulsion energy           3.257306055553 Eh    ::
         :: dispersion energy         -0.078235190852 Eh    ::
         :: halogen bond corr.         0.000000000000 Eh    ::
         :: add. restraining           0.000000000000 Eh    ::
         :::::::::::::::::::::::::::::::::::::::::::::::::::::

------------------------------------------------------------------------
empirical EA shift (eV):    4.8455
delta SCC EA (eV):    2.2718
------------------------------------------------------------------------
           -------------------------------------------------
          |                Property Printout                |
           -------------------------------------------------

    * Orbital Energies and Occupations

         #    Occupation            Energy/Eh            Energy/eV
      -------------------------------------------------------------
         1        2.0000           -0.9904517             -26.9516
       ...           ...                  ...                  ...
       146        2.0000           -0.3381347              -9.2011
       147        2.0000           -0.3320777              -9.0363
       148        2.0000           -0.3299534              -8.9785
       149        2.0000           -0.3256497              -8.8614
       150        2.0000           -0.3195338              -8.6950
       151        2.0000           -0.3144659              -8.5571
       152        2.0000           -0.3078795              -8.3778
       153        2.0000           -0.3052815              -8.3071
       154        2.0000           -0.2993805              -8.1466
       155        2.0000           -0.2761970              -7.5157
       156        1.9997           -0.2334539              -6.3526
       157        1.9016           -0.2280006              -6.2042
       158        0.7685           -0.2235064              -6.0819 (HOMO)
       159        0.3275           -0.2219870              -6.0406 (LUMO)
       160        0.0027           -0.2171027              -5.9077
       161        0.0000           -0.2076809              -5.6513
       162                         -0.1822330              -4.9588
       163                         -0.1747699              -4.7557
       164                         -0.1595677              -4.3421
       165                         -0.1549106              -4.2153
       166                         -0.1487893              -4.0488
       167                         -0.1462160              -3.9787
       168                         -0.1430567              -3.8928
       169                         -0.1373691              -3.7380
       ...                                ...                  ...
       383                        484.2502273           13177.1194
      -------------------------------------------------------------
                  HL-Gap            0.0015194 Eh            0.0413 eV
             Fermi-level           -0.2242987 Eh           -6.1035 eV

  Mulliken/CM5 charges        n(s)   n(p)   n(d)
     1 C  -0.39897 -0.44579   1.046  2.555  0.000
     2 C  -0.29537 -0.29793   0.998  2.707  0.000
     3 C  -0.39210 -0.39247   1.017  2.591  0.000
     4 C   0.05656  0.05346   0.589  3.468  0.000
     5 C   0.07117  0.06945   1.078  2.994  0.000
     6 C  -0.00145  0.03337   1.163  2.835  0.000
     7 O   0.40489  0.35851   1.612  4.793  0.000
     8 C   0.16088  0.16707   1.021  3.140  0.000
     9 C  -0.08125  0.03795   1.216  2.703  0.000
    10 N   0.32097  0.19160   1.515  3.806  0.000
    11 C  -0.07447  0.04534   1.222  2.703  0.000
    12 N   0.30667  0.17711   1.489  3.818  0.000
    13 C   0.03856 -0.00868   1.067  2.972  0.000
    14 C  -0.09603 -0.07943   1.137  2.767  0.000
    15 C  -0.10639 -0.08967   1.147  2.746  0.000
    16 C   0.02531 -0.02198   1.082  2.943  0.000
    17 F   0.18131  0.15803   1.692  5.490  0.000
    18 F   0.17682  0.15375   1.698  5.479  0.000
    19 C   0.10176  0.10889   1.116  2.986  0.000
    20 S   0.10638  0.06933   1.879  4.136  0.091
    21 C   0.00279  0.02005   1.112  2.891  0.000
    22 C  -0.06427 -0.04069   1.102  2.834  0.000
    23 C   0.06691  0.02047   1.026  3.041  0.000
    24 C  -0.00233  0.01461   1.123  2.875  0.000
    25 C  -0.05426 -0.02994   1.053  2.893  0.000
    26 C  -0.07382 -0.04805   1.077  2.849  0.000
    27 C   0.01615  0.03217   1.113  2.904  0.000
    28 S   0.09574  0.06386   1.880  4.112  0.104
    29 O   0.25617  0.16672   1.591  4.665  0.000
    30 O   0.23900  0.15174   1.609  4.630  0.000
    31 C  -0.05595 -0.13957   1.130  2.814  0.000
    32 C   0.05725 -0.09223   1.082  2.975  0.000
    33 C  -0.05685 -0.14042   1.119  2.824  0.000
    34 C   0.05975 -0.09013   1.068  2.992  0.000
    35 C   0.01270  0.02862   1.102  2.910  0.000
    36 S   0.11063  0.07534   1.878  4.163  0.069
    37 C  -0.00887 -0.00298   1.136  2.855  0.000
    38 C   0.04466 -0.00101   1.085  2.960  0.000
    39 C  -0.06119 -0.03849   1.114  2.825  0.000
    40 C   0.02159 -0.02540   1.064  2.958  0.000
    41 C   0.03047  0.02806   1.053  2.978  0.000
    42 C  -0.00219 -0.00294   1.078  2.920  0.000
    43 C  -0.00411 -0.00718   1.071  2.925  0.000
    44 C   0.01677  0.01517   1.091  2.926  0.000
    45 C  -0.14327 -0.10824   1.164  2.693  0.000
    46 O   0.34104  0.28658   1.639  4.702  0.000
    47 C   0.00833  0.01442   1.025  2.984  0.000
    48 C  -0.10141  0.01779   1.205  2.694  0.000
    49 N   0.30829  0.17800   1.527  3.781  0.000
    50 C  -0.10256  0.01519   1.207  2.690  0.000
    51 N   0.30929  0.17928   1.526  3.783  0.000
    52 C   0.02068 -0.02658   1.068  2.953  0.000
    53 C  -0.11067 -0.09413   1.142  2.747  0.000
    54 C  -0.09966 -0.08295   1.137  2.763  0.000
    55 C   0.02466 -0.02257   1.112  2.912  0.000
    56 F   0.17541  0.15214   1.694  5.481  0.000
    57 F   0.18651  0.16347   1.702  5.485  0.000
    58 O   0.25673  0.17058   1.659  4.597  0.000
    59 C   0.23810  0.15492   1.037  3.201  0.000
    60 C   0.58727  0.43795   0.960  3.627  0.000
    61 O   0.28926  0.20510   1.652  4.637  0.000
    62 C   0.21408  0.13111   1.043  3.171  0.000
    63 C   0.60249  0.45300   0.921  3.682  0.000
    64 H   0.14471  0.20806   1.145  0.000  0.000
    65 H  -0.01435  0.04958   0.986  0.000  0.000
    66 H  -0.02974  0.02962   0.970  0.000  0.000
    67 H   0.02094  0.08395   1.021  0.000  0.000
    68 H  -0.02533  0.03958   0.975  0.000  0.000
    69 H  -0.03007  0.03276   0.970  0.000  0.000
    70 H  -0.02162  0.03393   0.978  0.000  0.000
    71 H  -0.02719  0.02517   0.973  0.000  0.000
    72 H  -0.02358  0.03096   0.976  0.000  0.000
    73 H  -0.03720  0.03043   0.963  0.000  0.000
    74 H  -0.03396  0.03083   0.966  0.000  0.000
    75 H  -0.01876  0.03373   0.981  0.000  0.000
    76 H  -0.01748  0.04175   0.983  0.000  0.000
    77 H   0.00639  0.06115   1.006  0.000  0.000
    78 H  -0.01983  0.05168   0.980  0.000  0.000
    79 H  -0.02323  0.04593   0.977  0.000  0.000
    80 H  -0.03165  0.03344   0.968  0.000  0.000
    81 H  -0.06376 -0.00413   0.936  0.000  0.000
    82 H  -0.30423 -0.24082   0.696  0.000  0.000
    83 H  -0.27347 -0.21102   0.727  0.000  0.000
    84 H  -0.29092 -0.23860   0.709  0.000  0.000
    85 H  -0.27725 -0.22255   0.723  0.000  0.000
    86 H  -0.26322 -0.20846   0.737  0.000  0.000
    87 H  -0.29864 -0.23475   0.701  0.000  0.000
    88 H  -0.28974 -0.22092   0.710  0.000  0.000
    89 H  -0.30897 -0.25465   0.691  0.000  0.000
    90 H  -0.29346 -0.24124   0.707  0.000  0.000
    91 H  -0.31097 -0.25618   0.689  0.000  0.000
(R)spin-density population

 Mulliken population n(s)   n(p)   n(d)
     1 C   0.0050   0.000  0.005  0.000
     2 C   0.0032   0.000  0.003  0.000
     3 C   0.0090   0.000  0.009  0.000
     4 C   0.0530   0.000  0.053  0.000
     5 C   0.0641   0.000  0.064  0.000
     6 C   0.0548   0.000  0.055  0.000
     7 O   0.0554   0.000  0.055  0.000
     8 C   0.0115   0.000  0.011  0.000
     9 C   0.0026   0.000  0.002  0.000
    10 N   0.0062   0.000  0.006  0.000
    11 C   0.0032   0.000  0.003  0.000
    12 N   0.0065   0.000  0.006  0.000
    13 C   0.0195  -0.000  0.020  0.000
    14 C   0.0308  -0.000  0.031  0.000
    15 C   0.0462   0.000  0.046  0.000
    16 C   0.0060   0.000  0.006  0.000
    17 F   0.0035  -0.000  0.004  0.000
    18 F   0.0052  -0.000  0.005  0.000
    19 C   0.0108  -0.000  0.011  0.000
    20 S   0.0049   0.000  0.004  0.001
    21 C   0.0016  -0.000  0.002  0.000
    22 C   0.0020   0.000  0.002  0.000
    23 C   0.0097   0.000  0.010  0.000
    24 C   0.0051  -0.000  0.005  0.000
    25 C   0.0014  -0.000  0.001  0.000
    26 C   0.0038  -0.000  0.004  0.000
    27 C   0.0006  -0.000  0.001  0.000
    28 S   0.0034   0.000  0.003  0.001
    29 O   0.0001   0.000  0.000  0.000
    30 O   0.0010   0.000  0.001  0.000
    31 C   0.0000  -0.000  0.000  0.000
    32 C  -0.0000  -0.000  0.000  0.000
    33 C  -0.0001  -0.000  0.000  0.000
    34 C   0.0000  -0.000  0.000  0.000
    35 C   0.0149   0.000  0.015  0.000
    36 S   0.0077   0.000  0.007  0.001
    37 C   0.0009   0.000  0.001  0.000
    38 C   0.0284  -0.000  0.029  0.000
    39 C   0.0007   0.000  0.000  0.000
    40 C   0.0429  -0.000  0.043  0.000
    41 C   0.0066  -0.000  0.007  0.000
    42 C   0.0594   0.000  0.059  0.000
    43 C   0.0073   0.000  0.007  0.000
    44 C   0.0154  -0.000  0.015  0.000
    45 C   0.0015   0.000  0.001  0.000
    46 O   0.0015   0.000  0.001  0.000
    47 C   0.0472  -0.000  0.047  0.000
    48 C   0.0073   0.000  0.007  0.000
    49 N   0.0239   0.000  0.024  0.000
    50 C   0.0073  -0.000  0.007  0.000
    51 N   0.0244  -0.000  0.024  0.000
    52 C   0.0168   0.000  0.017  0.000
    53 C   0.0007   0.000  0.001  0.000
    54 C   0.0190   0.000  0.019  0.000
    55 C   0.0012  -0.000  0.001  0.000
    56 F   0.0001   0.000  0.000  0.000
    57 F   0.0023  -0.000  0.002  0.000
    58 O   0.0103   0.000  0.010  0.000
    59 C   0.0235   0.000  0.023  0.000
    60 C   0.0165   0.000  0.016  0.000
    61 O   0.0131   0.000  0.013  0.000
    62 C   0.0532  -0.000  0.053  0.000
    63 C   0.0566  -0.000  0.057  0.000
    64 H   0.0005   0.000  0.000  0.000
    65 H   0.0000   0.000  0.000  0.000
    66 H   0.0000   0.000  0.000  0.000
    67 H   0.0000   0.000  0.000  0.000
    68 H   0.0000   0.000  0.000  0.000
    69 H   0.0000   0.000  0.000  0.000
    70 H   0.0002   0.000  0.000  0.000
    71 H   0.0001   0.000  0.000  0.000
    72 H   0.0002   0.000  0.000  0.000
    73 H   0.0002   0.000  0.000  0.000
    74 H   0.0006   0.001  0.000  0.000
    75 H   0.0012   0.001  0.000  0.000
    76 H   0.0002   0.000  0.000  0.000
    77 H   0.0012   0.001  0.000  0.000
    78 H   0.0001   0.000  0.000  0.000
    79 H   0.0001   0.000  0.000  0.000
    80 H   0.0000   0.000  0.000  0.000
    81 H   0.0000   0.000  0.000  0.000
    82 H   0.0047   0.005  0.000  0.000
    83 H   0.0041   0.004  0.000  0.000
    84 H   0.0001   0.000  0.000  0.000
    85 H   0.0042   0.004  0.000  0.000
    86 H   0.0033   0.003  0.000  0.000
    87 H   0.0103   0.010  0.000  0.000
    88 H   0.0078   0.008  0.000  0.000
    89 H   0.0079   0.008  0.000  0.000
    90 H   0.0009   0.001  0.000  0.000
    91 H   0.0117   0.012  0.000  0.000

Wiberg/Mayer (AO) data.
largest (>0.10) Wiberg bond orders for each atom
          total WBO             WBO to atom ...
     1  C   3.915        C    2 1.523    C   19 1.252    H   64 0.942
     2  C   4.010        C    1 1.523    C    3 1.201    C    6 1.067
     3  C   3.942        C    8 1.331    C    2 1.201    C    4 1.064
     4  C   3.565        C   13 1.266    C    5 1.129    C    3 1.064
     5  C   3.742        C   16 1.420    C    4 1.129    C    6 1.042
     6  C   3.892        O    7 1.629    C    2 1.067    C    5 1.042
     7  O   1.749        C    6 1.629
     8  C   3.736        C    3 1.331    C   11 1.159    C    9 1.140
     9  C   4.099        N   10 2.870    C    8 1.140
    10  N   2.897        C    9 2.870
    11  C   4.107        N   12 2.856    C    8 1.159
    12  N   2.826        C   11 2.856
    13  C   3.798        C   14 1.440    C    4 1.266    H   65 1.006
    14  C   3.921        C   13 1.440    C   15 1.337    F   17 1.038
    15  C   3.900        C   16 1.417    C   14 1.337    F   18 1.053
    16  C   3.880        C    5 1.420    C   15 1.417    H   66 0.996
    17  F   0.961        C   14 1.038
    18  F   0.983        C   15 1.053
    19  C   3.830        C   23 1.383    C    1 1.252    S   20 1.131
    20  S   2.508        C   21 1.181    C   19 1.131
    21  C   3.828        C   22 1.310    C   24 1.292    S   20 1.181
    22  C   3.927        C   23 1.331    C   21 1.310    O   58 1.182
    23  C   3.725        C   19 1.383    C   22 1.331    H   67 0.993
    24  C   3.876        C   25 1.376    C   21 1.292    S   28 1.172
    25  C   3.771        C   24 1.376    C   26 1.320    O   29 1.049
    26  C   3.842        C   27 1.380    C   25 1.320    O   30 1.108
    27  C   3.828        C   26 1.380    C   35 1.209    S   28 1.150
    28  S   2.545        C   24 1.172    C   27 1.150
    29  O   1.994        C   25 1.049    C   31 0.958
    30  O   2.162        C   26 1.108    C   33 0.973
    31  C   3.916        H   68 0.998    H   69 0.996    C   32 0.995    O   29 0.958
    32  C   3.944        H   72 1.001    H   70 0.998    C   31 0.995    H   71 0.986
    33  C   3.912        H   73 0.999    C   34 0.996    H   74 0.985    O   30 0.973
    34  C   3.903        H   76 1.001    H   77 0.997    C   33 0.996    H   75 0.982
    35  C   3.788        C   39 1.359    C   27 1.209    S   36 1.163
    36  S   2.439        C   35 1.163    C   37 1.127
    37  C   3.913        C   38 1.412    C   40 1.324    S   36 1.127
    38  C   3.796        C   37 1.412    C   39 1.353    H   78 0.990
    39  C   3.948        C   35 1.359    C   38 1.353    O   61 1.137
    40  C   3.711        C   41 1.441    C   37 1.324    H   79 0.991
    41  C   3.799        C   40 1.441    C   42 1.189    C   45 1.104
    42  C   3.760        C   47 1.399    C   41 1.189    C   43 1.111
    43  C   3.862        C   52 1.404    C   44 1.314    C   42 1.111
    44  C   3.882        C   55 1.460    C   43 1.314    C   45 1.044
    45  C   3.965        O   46 1.798    C   41 1.104    C   44 1.044
    46  O   1.967        C   45 1.798
    47  C   3.716        C   42 1.399    C   50 1.164    C   48 1.162
    48  C   4.085        N   49 2.880    C   47 1.162
    49  N   2.896        C   48 2.880
    50  C   4.091        N   51 2.876    C   47 1.164
    51  N   2.890        C   50 2.876
    52  C   3.823        C   53 1.415    C   43 1.404    H   80 1.000
    53  C   3.983        C   52 1.415    C   54 1.386    F   56 1.050
    54  C   3.943        C   55 1.410    C   53 1.386    F   57 1.045
    55  C   3.893        C   44 1.460    C   54 1.410    H   81 0.965
    56  F   0.987        C   53 1.050
    57  F   0.989        C   54 1.045
    58  O   2.308        C   22 1.182    C   59 0.890
    59  C   3.506        C   60 0.917    O   58 0.890    H   83 0.844    H   82 0.796
    60  C   3.493        C   59 0.917    H   86 0.871    H   85 0.838    H   84 0.827
    61  O   2.206        C   39 1.137    C   62 0.899
    62  C   3.474        C   63 0.931    O   61 0.899    H   88 0.817    H   87 0.784
    63  C   3.351        C   62 0.931    H   90 0.805    H   89 0.790    H   91 0.731
    64  H   1.060        C    1 0.942
    65  H   1.092        C   13 1.006
    66  H   1.045        C   16 0.996
    67  H   1.096        C   23 0.993
    68  H   1.036        C   31 0.998
    69  H   1.019        C   31 0.996
    70  H   1.034        C   32 0.998
    71  H   1.023        C   32 0.986
    72  H   1.022        C   32 1.001
    73  H   1.021        C   33 0.999
    74  H   1.050        C   33 0.985
    75  H   1.043        C   34 0.982
    76  H   1.051        C   34 1.001
    77  H   1.078        C   34 0.997
    78  H   1.062        C   38 0.990
    79  H   1.055        C   40 0.991
    80  H   1.071        C   52 1.000
    81  H   0.961        C   55 0.965
    82  H   0.926        C   59 0.796
    83  H   0.929        C   59 0.844
    84  H   0.947        C   60 0.827
    85  H   0.922        C   60 0.838
    86  H   0.930        C   60 0.871
    87  H   0.917        C   62 0.784
    88  H   0.924        C   62 0.817
    89  H   0.925        C   63 0.790
    90  H   0.964        C   63 0.805
    91  H   0.904        C   63 0.731

 dipole moment from electron density (au)
     X       Y       Z   
  -0.9521   2.6122  15.2674  total (Debye):   39.444


           -------------------------------------------------
          | TOTAL ENERGY             -198.380138098042 Eh   |
          | GRADIENT NORM               0.295229986579 Eh/α |
          | HOMO-LUMO GAP               0.041346116719 eV   |
           -------------------------------------------------

------------------------------------------------------------------------
 * finished run on 2021/12/02 at 16:23:15.078     
------------------------------------------------------------------------
 total:
 * wall-time:     0 d,  0 h,  0 min,  4.732 sec
 *  cpu-time:     0 d,  0 h,  0 min,  4.689 sec
 * ratio c/w:     0.991 speedup
 SCF:
 * wall-time:     0 d,  0 h,  0 min,  4.048 sec
 *  cpu-time:     0 d,  0 h,  0 min,  4.014 sec
 * ratio c/w:     0.992 speedup

