      -----------------------------------------------------------      
     |                   =====================                   |     
     |                           x T B                           |     
     |                   =====================                   |     
     |                         S. Grimme                         |     
     |          Mulliken Center for Theoretical Chemistry        |     
     |                    University of Bonn                     |     
     |                Version 6.2 RC2 (SAW190805)                |     
      -----------------------------------------------------------      

   This program is distributed in the hope that it will be useful,
   but WITHOUT ANY WARRANTY; without even the implied warranty of
   MERCHANTABILITY or FITNESS FOR A PARTICULAR PURPOSE.
   
   FOR NON-COMMERCIAL, ACADEMIA USE ONLY.
   
   Cite this work as:
   * S. Grimme, C. Bannwarth, P. Shushkov, J. Chem. Theory Comput., 2017,
     13, 1989-2009. DOI: 10.1021/acs.jctc.7b00118
   * C. Bannwarth, S. Ehlert and S. Grimme., J. Chem. Theory Comput., 2019,
     15, 1652-1671. DOI: 10.1021/acs.jctc.8b01176
   * P. Pracht, E. Caldeweyher, S. Ehlert, S. Grimme, ChemRxiv, 2019, preprint.
     DOI: 10.26434/chemrxiv.8326202.v1
   
   for DFT-D4:
   * E. Caldeweyher, C. Bannwarth and S. Grimme, J. Chem. Phys., 2017,
     147, 034112. DOI: 10.1063/1.4993215
   * E. Caldeweyher, S. Ehlert, A. Hansen, H. Neugebauer, S. Spicher,
     C. Bannwarth and S. Grimme, J. Chem. Phys., 2019, 150, 154122.
     DOI: 10.1063/1.5090222
   
   for sTDA-xTB:
   * S. Grimme and C. Bannwarth, J. Chem. Phys., 2016, 145, 054103.
     DOI: 10.1063/1.4959605
   
   in the mass-spec context:
   * V. Asgeirsson, C. Bauer and S. Grimme, Chem. Sci., 2017, 8, 4879.
     DOI: 10.1039/c7sc00601b
   
   for metadynamics refer to:
   * S. Grimme, J. Chem. Theory Comput., 2019, 155, 2847-2862
     DOI: 10.1021/acs.jctc.9b00143
   
   with help from (in alphabetical order)
   C. Bannwarth, F. Bohle, G. Brandenburg, E. Caldeweyher, M. Checinski,
   S. Dohm, S. Ehlert, S. Ehrlich, F. März, H. Neugebauer, J. Pisarek,
   P. Pracht, P. Shushkov, and S. Spicher.
   
 * started run on 2021/12/02 at 16:23:44.351     

           -------------------------------------------------
          |                Calculation Setup                |
           -------------------------------------------------

          program call               : /ihome/ghutchison/geoffh/xtb/xtb AY6.xyz --vipea
          hostname                   : smp-n128
          coordinate file            : AY6.xyz
          omp threads                :                     1
          number of atoms            :                    94
          number of electrons        :                   330
          charge                     :                     0
          spin                       :                   0.0
          first test random number   :      0.18650762916224


########################################################################
# WARNING! Please study the warnings concerning your input carefully
#  - XTBPATH is not set, using XTBHOME instead
########################################################################

           ------------------------------------------------- 
          |                 I P E A - x T B                 |
          |  Ionisation Potentials and Electron Affinities  |
           ------------------------------------------------- 
             KAB for M(3d)-M(3d) :                1.1000
             KAB for M(4d)-M(4d) :                1.2000
             KAB for M(5d)-M(5d) :                1.2000
             k(s)                :                2.1500
             k(p)                :                2.3000
             k(d)                :                2.0000
             k(f)                :                0.0000
             kEN (H0ij)          :                0.7000
             D3 a1               :                0.6300
             D3 a2               :                5.0000
             D3 s6               :                1.0000
             D3 s8               :                2.4000
             D3 s9               :                0.0000
             alphaj              :                1.0000
             XBdamp              :                0.4400
             XBrad               :                1.3000
             kcnsh               :      1.0000   -0.3000   -0.5000    0.5000

  Z AO/shell   Hii/eV     exponent
  1     Thu Sep 22 23:34:11 CEST 2016   EN: 2.200 GAM: 0.405  GM3: 0.1500
     1s    -10.521941    1.306199
     2s     -3.560151    0.398421
  6     Thu Sep 22 23:34:11 CEST 2016   EN: 2.550 GAM: 0.640  GM3: 0.1500
     2s    -15.968100    1.979793
     2p     -9.777107    1.850537
     3S     -3.366990    0.633095
  7     Thu Sep 22 23:34:11 CEST 2016   EN: 3.040 GAM: 0.493  GM3:-0.1000
     2s    -24.040776    2.126160
     2p    -14.426520    2.068425
     3S     -5.882278    0.671040
  8     Thu Sep 22 23:34:11 CEST 2016   EN: 3.440 GAM: 0.717  GM3:-0.2000
     2s    -26.695120    2.575264
     2p    -16.014457    2.159448
     3S     -6.622058    0.958679
  9     Tue Jan 17 20:22:52 CET 2017    EN: 3.980 GAM: 0.574  GM3: 0.2000
     2s    -27.565998    2.304073
     2p    -17.439238    2.314354
     3S     -6.120500    0.570243
 16     Tue Jan 17 20:57:36 CET 2017    EN: 2.580 GAM: 0.455  GM3: 0.1020
     3s    -24.488821    2.492075
     3p    -12.136640    1.997904
     3d     -1.796070    1.747541

           ------------------------------------------------- 
          |        Self-Consistent Charge Iterations        |
           ------------------------------------------------- 

          ...................................................
          :                      SETUP                      :
          :.................................................:
          :  # basis functions                 412          :
          :  # atomic orbitals                 408          :
          :  # shells                          256          :
          :  # electrons                       330          :
          :  # halogen bonds                     0          :
          :  max. iterations                   250          :
          :  Hamiltonian                  GFN1-xTB          :
          :  restarted?                      false          :
          :  GBSA solvation                  false          :
          :  PC potential                    false          :
          :  electronic temp.          300.0000000     K    :
          :  accuracy                    1.0000000          :
          :  -> integral cutoff          0.2500000E+02      :
          :  -> integral neglect         0.1000000E-07      :
          :  -> SCF convergence          0.1000000E-05 Eh   :
          :  -> wf. convergence          0.2000000E-04 e    :
          :  Broyden damping             0.4000000          :
          ...................................................

 iter      E             dE          RMSdq      gap      omega  full diag
   1   -220.0414215 -0.220041E+03  0.105E+01    0.13       0.0  T
   2   -216.8397992  0.320162E+01  0.681E+00    0.41       1.0  T
   3   -190.8693900  0.259704E+02  0.719E+00    0.21       1.0  T
   4   -163.0159468  0.278534E+02  0.805E+00    0.14       1.0  T
   5   -218.2685372 -0.552526E+02  0.244E+00    0.33       1.0  T
   6   -221.1767997 -0.290826E+01  0.141E+00    0.20       1.0  T
   7   -221.4589248 -0.282125E+00  0.999E-01    0.22       1.0  T
   8   -221.5084069 -0.494820E-01  0.895E-01    0.25       1.0  T
   9   -221.4608139  0.475930E-01  0.706E-01    0.13       1.0  T
  10   -220.9813931  0.479421E+00  0.103E+00    0.40       1.0  T
  11   -221.5251351 -0.543742E+00  0.591E-01    0.42       1.0  T
  12   -221.1038815  0.421254E+00  0.881E-01    0.13       1.0  T
  13   -221.5366788 -0.432797E+00  0.465E-01    0.38       1.0  T
  14   -221.5468080 -0.101292E-01  0.393E-01    0.32       1.0  T
  15   -221.5514831 -0.467518E-02  0.360E-01    0.30       1.0  T
  16   -221.5535204 -0.203725E-02  0.342E-01    0.29       1.0  T
  17   -221.5616631 -0.814274E-02  0.192E-01    0.03       1.0  T
  18   -221.5715302 -0.986706E-02  0.143E-01    0.04       1.0  T
  19   -221.5757486 -0.421839E-02  0.136E-01    0.04       1.0  T
  20   -221.5812638 -0.551522E-02  0.779E-02    0.09       1.0  T
  21   -221.5819336 -0.669758E-03  0.694E-02    0.06       1.0  T
  22   -221.5836779 -0.174437E-02  0.307E-03    0.07       3.4  T
  23   -221.5836788 -0.851594E-06  0.255E-03    0.07       4.1  T
  24   -221.5836718  0.694398E-05  0.464E-03    0.07       2.2  T
  25   -221.5836764 -0.458292E-05  0.334E-03    0.07       3.1  T
  26   -221.5836794 -0.296412E-05  0.194E-03    0.07       5.3  T
  27   -221.5836802 -0.847731E-06  0.107E-03    0.07       9.6  T
  28   -221.5836792  0.101503E-05  0.184E-03    0.07       5.6  T
  29   -221.5836805 -0.128451E-05  0.504E-04    0.07      20.5  T
  30   -221.5836804  0.660048E-07  0.667E-04    0.07      15.5  T
  31   -221.5836806 -0.169374E-06  0.108E-04    0.07      95.3  T
  32   -221.5836806 -0.437575E-08  0.872E-06    0.07    1183.5  T

   *** convergence criteria satisfied after 32 iterations ***

         #    Occupation            Energy/Eh            Energy/eV
      -------------------------------------------------------------
         1        2.0000           -4.7321935            -128.7695
       ...           ...                  ...                  ...
       159        2.0000           -0.3816363             -10.3849
       160        2.0000           -0.3770401             -10.2598
       161        2.0000           -0.3754173             -10.2156
       162        2.0000           -0.3718594             -10.1188
       163        2.0000           -0.3633907              -9.8884
       164        1.9989           -0.3186016              -8.6696
       165        1.6109           -0.3128075              -8.5119 (HOMO)
       166        0.3886           -0.3101062              -8.4384 (LUMO)
       167        0.0016           -0.3046843              -8.2909
       168                         -0.2943995              -8.0110
       169                         -0.2880345              -7.8378
       170                         -0.2808471              -7.6422
       ...                                ...                  ...
       408                        793.6806547           21597.1499
      -------------------------------------------------------------
                  HL-Gap            0.0027012 Eh            0.0735 eV
             Fermi-level           -0.3114576 Eh           -8.4752 eV

 SCC (total)                   0 d,  0 h,  0 min,  1.783 sec
 SCC setup                      ...        0 min,  0.004 sec (  0.204%)
 Dispersion                     ...        0 min,  0.000 sec (  0.016%)
 integral evaluation            ...        0 min,  0.746 sec ( 41.840%)
 zeroth order Hamiltonian       ...        0 min,  0.003 sec (  0.174%)
 iterations                     ...        0 min,  0.797 sec ( 44.664%)
 molecular gradient             ...        0 min,  0.230 sec ( 12.901%)
 printout                       ...        0 min,  0.004 sec (  0.198%)

         :::::::::::::::::::::::::::::::::::::::::::::::::::::
         ::                     SUMMARY                     ::
         :::::::::::::::::::::::::::::::::::::::::::::::::::::
         :: total energy            -218.101930248246 Eh    ::
         :: gradient norm              0.691317956931 Eh/a0 ::
         :: HOMO-LUMO gap              0.073504470802 eV    ::
         ::.................................................::
         :: SCC energy              -221.583680612171 Eh    ::
         :: -> electrostatic           0.445361406817 Eh    ::
         :: repulsion energy           3.568959283314 Eh    ::
         :: dispersion energy         -0.087208919389 Eh    ::
         :: halogen bond corr.         0.000000000000 Eh    ::
         :: add. restraining           0.000000000000 Eh    ::
         :::::::::::::::::::::::::::::::::::::::::::::::::::::

           ------------------------------------------------- 
          |        vertical delta SCC IP calculation        |
           ------------------------------------------------- 

          ...................................................
          :                      SETUP                      :
          :.................................................:
          :  # basis functions                 412          :
          :  # atomic orbitals                 408          :
          :  # shells                          256          :
          :  # electrons                       329          :
          :  # halogen bonds                     0          :
          :  max. iterations                   250          :
          :  Hamiltonian                  GFN1-xTB          :
          :  restarted?                       true          :
          :  GBSA solvation                  false          :
          :  PC potential                    false          :
          :  electronic temp.          300.0000000     K    :
          :  accuracy                    1.0000000          :
          :  -> integral cutoff          0.2500000E+02      :
          :  -> integral neglect         0.1000000E-07      :
          :  -> SCF convergence          0.1000000E-05 Eh   :
          :  -> wf. convergence          0.2000000E-04 e    :
          :  Broyden damping             0.4000000          :
          ...................................................

 iter      E             dE          RMSdq      gap      omega  full diag
   1   -221.1750635 -0.221175E+03  0.430E-01    0.07       0.0  T
   2   -220.9687944  0.206269E+00  0.736E-01    0.18       1.0  T
   3   -221.1556092 -0.186815E+00  0.425E-01    0.23       1.0  T
   4   -221.1628111 -0.720193E-02  0.427E-01    0.21       1.0  T
   5   -221.2249215 -0.621104E-01  0.131E-01    0.15       1.0  T
   6   -221.2224115  0.251004E-02  0.141E-01    0.19       1.0  T
   7   -221.1647320  0.576795E-01  0.388E-01    0.05       1.0  T
   8   -221.2266629 -0.619309E-01  0.102E-01    0.17       1.0  T
   9   -221.2304486 -0.378569E-02  0.244E-02    0.18       1.0  T
  10   -221.2304847 -0.361499E-04  0.191E-02    0.18       1.0  T
  11   -221.2305886 -0.103870E-03  0.117E-02    0.17       1.0  T
  12   -221.2305365  0.521436E-04  0.161E-02    0.18       1.0  T
  13   -221.2306480 -0.111502E-03  0.217E-03    0.17       4.7  T
  14   -221.2306467  0.127665E-05  0.246E-03    0.17       4.2  T
  15   -221.2306488 -0.213190E-05  0.908E-04    0.17      11.4  T
  16   -221.2306490 -0.134059E-06  0.590E-04    0.17      17.5  T
  17   -221.2306490 -0.815311E-07  0.307E-04    0.17      33.6  T
  18   -221.2306491 -0.347914E-07  0.747E-05    0.17     138.1  T
  19   -221.2306491 -0.317300E-09  0.476E-05    0.17     216.5  T

   *** convergence criteria satisfied after 19 iterations ***

         #    Occupation            Energy/Eh            Energy/eV
      -------------------------------------------------------------
         1        2.0000           -4.8107131            -130.9062
       ...           ...                  ...                  ...
       159        2.0000           -0.4535701             -12.3423
       160        2.0000           -0.4508740             -12.2689
       161        2.0000           -0.4491493             -12.2220
       162        2.0000           -0.4370032             -11.8915
       163        2.0000           -0.4348933             -11.8340
       164        1.6003           -0.3951447             -10.7524
       165        1.3568           -0.3942719             -10.7287 (HOMO)
       166        0.0429           -0.3879951             -10.5579 (LUMO)
       167                         -0.3738579             -10.1732
       168                         -0.3673328              -9.9956
       169                         -0.3578736              -9.7382
       170                         -0.3470699              -9.4443
       ...                                ...                  ...
       408                        793.6078269           21595.1682
      -------------------------------------------------------------
                  HL-Gap            0.0062768 Eh            0.1708 eV
             Fermi-level           -0.3928378 Eh          -10.6897 eV

 SCC (total)                   0 d,  0 h,  0 min,  1.453 sec
 SCC setup                      ...        0 min,  0.004 sec (  0.256%)
 Dispersion                     ...        0 min,  0.000 sec (  0.012%)
 integral evaluation            ...        0 min,  0.745 sec ( 51.296%)
 zeroth order Hamiltonian       ...        0 min,  0.003 sec (  0.211%)
 iterations                     ...        0 min,  0.467 sec ( 32.133%)
 molecular gradient             ...        0 min,  0.230 sec ( 15.832%)
 printout                       ...        0 min,  0.004 sec (  0.256%)

         :::::::::::::::::::::::::::::::::::::::::::::::::::::
         ::                     SUMMARY                     ::
         :::::::::::::::::::::::::::::::::::::::::::::::::::::
         :: total energy            -217.748898706513 Eh    ::
         :: gradient norm              0.696767113924 Eh/a0 ::
         :: HOMO-LUMO gap              0.170799570441 eV    ::
         ::.................................................::
         :: SCC energy              -221.230649070438 Eh    ::
         :: -> electrostatic           0.486758178665 Eh    ::
         :: repulsion energy           3.568959283314 Eh    ::
         :: dispersion energy         -0.087208919389 Eh    ::
         :: halogen bond corr.         0.000000000000 Eh    ::
         :: add. restraining           0.000000000000 Eh    ::
         :::::::::::::::::::::::::::::::::::::::::::::::::::::

------------------------------------------------------------------------
empirical IP shift (eV):    4.8455
delta SCC IP (eV):    4.7610
------------------------------------------------------------------------
           ------------------------------------------------- 
          |        vertical delta SCC EA calculation        |
           ------------------------------------------------- 

          ...................................................
          :                      SETUP                      :
          :.................................................:
          :  # basis functions                 412          :
          :  # atomic orbitals                 408          :
          :  # shells                          256          :
          :  # electrons                       331          :
          :  # halogen bonds                     0          :
          :  max. iterations                   250          :
          :  Hamiltonian                  GFN1-xTB          :
          :  restarted?                       true          :
          :  GBSA solvation                  false          :
          :  PC potential                    false          :
          :  electronic temp.          300.0000000     K    :
          :  accuracy                    1.0000000          :
          :  -> integral cutoff          0.2500000E+02      :
          :  -> integral neglect         0.1000000E-07      :
          :  -> SCF convergence          0.1000000E-05 Eh   :
          :  -> wf. convergence          0.2000000E-04 e    :
          :  Broyden damping             0.4000000          :
          ...................................................

 iter      E             dE          RMSdq      gap      omega  full diag
   1   -221.7804913 -0.221780E+03  0.485E-01    0.38       0.0  T
   2   -221.0249943  0.755497E+00  0.139E+00    0.10       1.0  T
   3   -221.8207261 -0.795732E+00  0.379E-01    0.20       1.0  T
   4   -221.7770224  0.437037E-01  0.347E-01    0.30       1.0  T
   5   -221.7385104  0.385120E-01  0.441E-01    0.23       1.0  T
   6   -221.8323939 -0.938835E-01  0.263E-01    0.17       1.0  T
   7   -221.8491321 -0.167382E-01  0.153E-01    0.14       1.0  T
   8   -221.8506044 -0.147232E-02  0.125E-01    0.13       1.0  T
   9   -221.8550909 -0.448644E-02  0.401E-02    0.13       1.0  T
  10   -221.8549029  0.188003E-03  0.458E-02    0.13       1.0  T
  11   -221.8560011 -0.109826E-02  0.118E-02    0.13       1.0  T
  12   -221.8560469 -0.457342E-04  0.837E-03    0.13       1.2  T
  13   -221.8560668 -0.199762E-04  0.319E-03    0.13       3.2  T
  14   -221.8560677 -0.814223E-06  0.251E-03    0.13       4.1  T
  15   -221.8560691 -0.148894E-05  0.156E-03    0.13       6.6  T
  16   -221.8560696 -0.482507E-06  0.807E-04    0.13      12.8  T
  17   -221.8560698 -0.138185E-06  0.333E-04    0.13      31.0  T
  18   -221.8560698 -0.391153E-07  0.676E-05    0.13     152.5  T
  19   -221.8560698  0.388226E-08  0.109E-04    0.13      94.6  T

   *** convergence criteria satisfied after 19 iterations ***

         #    Occupation            Energy/Eh            Energy/eV
      -------------------------------------------------------------
         1        2.0000           -4.6551800            -126.6739
       ...           ...                  ...                  ...
       160        2.0000           -0.3071117              -8.3569
       161        2.0000           -0.3049827              -8.2990
       162        2.0000           -0.3019401              -8.2162
       163        2.0000           -0.2916277              -7.9356
       164        2.0000           -0.2466120              -6.7107
       165        1.7299           -0.2376589              -6.4670
       166        1.1874           -0.2356680              -6.4129 (HOMO)
       167        0.0827           -0.2309111              -6.2834 (LUMO)
       168        0.0000           -0.2230087              -6.0684
       169                         -0.2161537              -5.8818
       170                         -0.2108147              -5.7366
       171                         -0.1853688              -5.0441
       ...                                ...                  ...
       408                        793.7506170           21599.0537
      -------------------------------------------------------------
                  HL-Gap            0.0047569 Eh            0.1294 eV
             Fermi-level           -0.2349478 Eh           -6.3933 eV

 SCC (total)                   0 d,  0 h,  0 min,  1.453 sec
 SCC setup                      ...        0 min,  0.004 sec (  0.247%)
 Dispersion                     ...        0 min,  0.000 sec (  0.018%)
 integral evaluation            ...        0 min,  0.745 sec ( 51.247%)
 zeroth order Hamiltonian       ...        0 min,  0.003 sec (  0.209%)
 iterations                     ...        0 min,  0.467 sec ( 32.150%)
 molecular gradient             ...        0 min,  0.230 sec ( 15.837%)
 printout                       ...        0 min,  0.004 sec (  0.289%)

         :::::::::::::::::::::::::::::::::::::::::::::::::::::
         ::                     SUMMARY                     ::
         :::::::::::::::::::::::::::::::::::::::::::::::::::::
         :: total energy            -218.374319431844 Eh    ::
         :: gradient norm              0.690370870055 Eh/a0 ::
         :: HOMO-LUMO gap              0.129442096406 eV    ::
         ::.................................................::
         :: SCC energy              -221.856069795769 Eh    ::
         :: -> electrostatic           0.473363487199 Eh    ::
         :: repulsion energy           3.568959283314 Eh    ::
         :: dispersion energy         -0.087208919389 Eh    ::
         :: halogen bond corr.         0.000000000000 Eh    ::
         :: add. restraining           0.000000000000 Eh    ::
         :::::::::::::::::::::::::::::::::::::::::::::::::::::

------------------------------------------------------------------------
empirical EA shift (eV):    4.8455
delta SCC EA (eV):    2.5666
------------------------------------------------------------------------
           -------------------------------------------------
          |                Property Printout                |
           -------------------------------------------------

    * Orbital Energies and Occupations

         #    Occupation            Energy/Eh            Energy/eV
      -------------------------------------------------------------
         1        2.0000           -4.6551800            -126.6739
       ...           ...                  ...                  ...
       154        2.0000           -0.3368617              -9.1665
       155        2.0000           -0.3280357              -8.9263
       156        2.0000           -0.3273552              -8.9078
       157        2.0000           -0.3221935              -8.7673
       158        2.0000           -0.3156200              -8.5885
       159        2.0000           -0.3118664              -8.4863
       160        2.0000           -0.3071117              -8.3569
       161        2.0000           -0.3049827              -8.2990
       162        2.0000           -0.3019401              -8.2162
       163        2.0000           -0.2916277              -7.9356
       164        2.0000           -0.2466120              -6.7107
       165        1.7299           -0.2376589              -6.4670
       166        1.1874           -0.2356680              -6.4129 (HOMO)
       167        0.0827           -0.2309111              -6.2834 (LUMO)
       168        0.0000           -0.2230087              -6.0684
       169                         -0.2161537              -5.8818
       170                         -0.2108147              -5.7366
       171                         -0.1853688              -5.0441
       172                         -0.1742816              -4.7424
       173                         -0.1601931              -4.3591
       174                         -0.1553553              -4.2274
       175                         -0.1530959              -4.1660
       176                         -0.1492301              -4.0608
       177                         -0.1454022              -3.9566
       ...                                ...                  ...
       408                        793.7506170           21599.0537
      -------------------------------------------------------------
                  HL-Gap            0.0047569 Eh            0.1294 eV
             Fermi-level           -0.2349478 Eh           -6.3933 eV

  Mulliken/CM5 charges        n(s)   n(p)   n(d)
     1 C  -0.02775  0.00767   0.892  3.080  0.000
     2 O  -0.49876 -0.54482   1.932  3.570  0.000
     3 C  -0.05662 -0.05824   0.869  3.075  0.000
     4 C  -0.09150 -0.13876   0.770  3.138  0.000
     5 C  -0.06772 -0.05102   1.126  2.807  0.000
     6 F   0.19045  0.16742   1.702  5.488  0.000
     7 C  -0.07147 -0.05491   1.127  2.801  0.000
     8 F   0.19620  0.17292   1.698  5.498  0.000
     9 C   0.03613 -0.01112   1.073  2.963  0.000
    10 C   0.11243  0.10936   1.009  3.104  0.000
    11 C  -0.00892 -0.00958   1.082  2.909  0.000
    12 C   0.03350  0.03964   0.999  3.035  0.000
    13 C  -0.09536  0.02184   1.201  2.703  0.000
    14 N   0.31233  0.17907   1.501  3.812  0.000
    15 C  -0.09492  0.02422   1.204  2.701  0.000
    16 N   0.32087  0.19062   1.531  3.790  0.000
    17 C   0.01865  0.01675   1.049  2.969  0.000
    18 C   0.05090  0.00273   1.033  3.018  0.000
    19 C   0.00833  0.01594   1.113  2.895  0.000
    20 S   0.20043  0.16869   1.877  4.126  0.198
    21 C   0.01312  0.03076   1.112  2.901  0.000
    22 C  -0.00142  0.01179   1.137  2.862  0.000
    23 C   0.01692  0.00894   1.058  2.959  0.000
    24 C   0.02662 -0.07943   1.072  2.955  0.000
    25 C   0.05700 -0.09450   1.072  2.985  0.000
    26 S   0.08451  0.05179   1.877  4.137  0.071
    27 C   0.00142  0.02351   1.141  2.860  0.000
    28 C  -0.03999  0.02910   1.072  2.888  0.000
    29 N   0.13207 -0.12358   1.265  3.867  0.000
    30 C  -0.00786 -0.05800   1.103  2.889  0.000
    31 C  -0.03970  0.02836   1.059  2.901  0.000
    32 C   0.02121  0.03422   1.076  2.946  0.000
    33 C  -0.06591  0.02217   1.150  2.784  0.000
    34 N   0.25590  0.09420   1.473  3.783  0.000
    35 S  -0.13747 -0.00244   1.862  3.693  0.307
    36 N   0.25212  0.08995   1.469  3.783  0.000
    37 C  -0.06682  0.02138   1.150  2.783  0.000
    38 C   0.02569  0.03894   1.071  2.955  0.000
    39 C  -0.04624  0.02285   1.071  2.883  0.000
    40 N   0.12577 -0.13073   1.245  3.881  0.000
    41 C  -0.03236 -0.08144   1.093  2.874  0.000
    42 C   0.05945 -0.08977   1.063  2.997  0.000
    43 C  -0.02763  0.03843   1.056  2.916  0.000
    44 C  -0.00016  0.02288   1.151  2.849  0.000
    45 S   0.08901  0.05999   1.886  4.075  0.128
    46 C   0.01973  0.02735   1.146  2.874  0.000
    47 C   0.04064  0.03468   1.099  2.942  0.000
    48 C   0.05052  0.04844   1.057  2.994  0.000
    49 C   0.00819  0.00742   1.093  2.915  0.000
    50 C   0.02526  0.03130   1.026  2.999  0.000
    51 C  -0.09634  0.02275   1.209  2.695  0.000
    52 N   0.31222  0.18201   1.530  3.782  0.000
    53 C  -0.08664  0.03002   1.219  2.694  0.000
    54 N   0.33165  0.19716   1.497  3.834  0.000
    55 C   0.00760  0.00453   1.070  2.937  0.000
    56 C   0.03270 -0.01456   1.100  2.933  0.000
    57 C  -0.10229 -0.08577   1.148  2.750  0.000
    58 F   0.18300  0.15975   1.698  5.485  0.000
    59 C  -0.08657 -0.06987   1.150  2.764  0.000
    60 F   0.19631  0.17328   1.703  5.493  0.000
    61 C   0.13644  0.08919   1.071  3.066  0.000
    62 C   0.03159  0.02997   1.096  2.936  0.000
    63 C  -0.13401 -0.09829   1.173  2.693  0.000
    64 O   0.32845  0.28256   1.651  4.678  0.000
    65 C   0.55455  0.40756   0.919  3.636  0.000
    66 C   0.33227  0.22442   0.971  3.361  0.000
    67 C   0.58495  0.43307   0.914  3.671  0.000
    68 C   0.15056  0.10193   1.052  3.099  0.000
    69 H   0.09604  0.15557   1.096  0.000  0.000
    70 H  -0.02458  0.04052   0.975  0.000  0.000
    71 H  -0.04208  0.02862   0.958  0.000  0.000
    72 H  -0.01384  0.04420   0.986  0.000  0.000
    73 H  -0.01859  0.03901   0.981  0.000  0.000
    74 H  -0.00962  0.04384   0.990  0.000  0.000
    75 H  -0.01299  0.03910   0.987  0.000  0.000
    76 H  -0.01437  0.03854   0.986  0.000  0.000
    77 H   0.01513  0.08588   1.015  0.000  0.000
    78 H   0.00526  0.07414   1.005  0.000  0.000
    79 H  -0.00164  0.06582   0.998  0.000  0.000
    80 H  -0.02807  0.04118   0.972  0.000  0.000
    81 H   0.00940  0.06454   1.009  0.000  0.000
    82 H  -0.00801  0.04422   0.992  0.000  0.000
    83 H  -0.00111  0.05520   0.999  0.000  0.000
    84 H  -0.06933 -0.00420   0.931  0.000  0.000
    85 H  -0.31671 -0.25718   0.683  0.000  0.000
    86 H  -0.27946 -0.22408   0.721  0.000  0.000
    87 H  -0.25277 -0.19733   0.747  0.000  0.000
    88 H  -0.28651 -0.23416   0.713  0.000  0.000
    89 H  -0.27674 -0.21751   0.723  0.000  0.000
    90 H  -0.29594 -0.23673   0.704  0.000  0.000
    91 H  -0.28938 -0.23663   0.711  0.000  0.000
    92 H  -0.25817 -0.20592   0.742  0.000  0.000
    93 H  -0.31270 -0.25868   0.687  0.000  0.000
    94 H  -0.29647 -0.22468   0.704  0.000  0.000
(R)spin-density population

 Mulliken population n(s)   n(p)   n(d)
     1 C   0.0243   0.003  0.021  0.000
     2 O   0.0624   0.008  0.054  0.000
     3 C   0.0164   0.008  0.009  0.000
     4 C   0.0545   0.002  0.052  0.000
     5 C   0.0023   0.000  0.002  0.000
     6 F   0.0007  -0.000  0.001  0.000
     7 C   0.0124  -0.000  0.013  0.000
     8 F   0.0019   0.000  0.002  0.000
     9 C   0.0041   0.000  0.004  0.000
    10 C   0.0515   0.009  0.043  0.000
    11 C   0.0098   0.001  0.009  0.000
    12 C   0.0012   0.000  0.001  0.000
    13 C   0.0004   0.000  0.000  0.000
    14 N   0.0012   0.000  0.001  0.000
    15 C   0.0010   0.000  0.001  0.000
    16 N   0.0010   0.000  0.001  0.000
    17 C   0.0746   0.009  0.066  0.000
    18 C   0.0140   0.001  0.013  0.000
    19 C   0.0059   0.001  0.005  0.000
    20 S   0.0167   0.000  0.009  0.008
    21 C   0.0110   0.000  0.011  0.000
    22 C   0.0023   0.000  0.002  0.000
    23 C   0.0096   0.000  0.009  0.000
    24 C   0.0001   0.000  0.000  0.000
    25 C   0.0008   0.000  0.000  0.000
    26 S   0.0022   0.000  0.002  0.001
    27 C   0.0013  -0.000  0.001  0.000
    28 C   0.0028  -0.000  0.003  0.000
    29 N   0.0072  -0.000  0.007  0.000
    30 C   0.0001  -0.000  0.000  0.000
    31 C   0.0070  -0.000  0.007  0.000
    32 C   0.0053   0.000  0.005  0.000
    33 C   0.0012  -0.000  0.001  0.000
    34 N   0.0074   0.000  0.007  0.000
    35 S   0.0104  -0.000  0.008  0.003
    36 N   0.0056   0.000  0.006  0.000
    37 C   0.0005   0.000  0.000  0.000
    38 C   0.0027  -0.000  0.003  0.000
    39 C   0.0134  -0.000  0.014  0.000
    40 N   0.0069  -0.000  0.007  0.000
    41 C   0.0001   0.000  0.000  0.000
    42 C   0.0011   0.000  0.001  0.000
    43 C   0.0025   0.000  0.002  0.000
    44 C   0.0066  -0.000  0.007  0.000
    45 S   0.0055   0.000  0.004  0.001
    46 C   0.0039   0.000  0.004  0.000
    47 C   0.0209  -0.000  0.021  0.000
    48 C   0.0030   0.000  0.003  0.000
    49 C   0.0480   0.000  0.048  0.000
    50 C   0.0290   0.000  0.029  0.000
    51 C   0.0048  -0.000  0.005  0.000
    52 N   0.0153  -0.000  0.015  0.000
    53 C   0.0076   0.000  0.007  0.000
    54 N   0.0181   0.000  0.018  0.000
    55 C   0.0053  -0.000  0.005  0.000
    56 C   0.0113  -0.000  0.011  0.000
    57 C   0.0010   0.000  0.001  0.000
    58 F   0.0001   0.000  0.000  0.000
    59 C   0.0131   0.000  0.013  0.000
    60 F   0.0016   0.000  0.002  0.000
    61 C   0.0003  -0.000  0.000  0.000
    62 C   0.0128  -0.000  0.013  0.000
    63 C   0.0039   0.000  0.004  0.000
    64 O   0.0033   0.000  0.003  0.000
    65 C   0.0002  -0.000  0.000  0.000
    66 C   0.0737  -0.000  0.074  0.000
    67 C   0.1229   0.000  0.123  0.000
    68 C   0.0264   0.000  0.026  0.000
    69 H   0.0212   0.021  0.000  0.000
    70 H   0.0031   0.003  0.000  0.000
    71 H   0.0039   0.004  0.000  0.000
    72 H   0.0003   0.000  0.000  0.000
    73 H   0.0001   0.000  0.000  0.000
    74 H   0.0003   0.000  0.000  0.000
    75 H   0.0002   0.000  0.000  0.000
    76 H   0.0002   0.000  0.000  0.000
    77 H   0.0028   0.003  0.000  0.000
    78 H   0.0012   0.001  0.000  0.000
    79 H   0.0008   0.001  0.000  0.000
    80 H   0.0009   0.001  0.000  0.000
    81 H   0.0008   0.001  0.000  0.000
    82 H   0.0017   0.002  0.000  0.000
    83 H   0.0009   0.001  0.000  0.000
    84 H   0.0000   0.000  0.000  0.000
    85 H   0.0000   0.000  0.000  0.000
    86 H   0.0007   0.001  0.000  0.000
    87 H   0.0004   0.000  0.000  0.000
    88 H   0.0017   0.002  0.000  0.000
    89 H   0.0133   0.013  0.000  0.000
    90 H   0.0124   0.012  0.000  0.000
    91 H   0.0167   0.017  0.000  0.000
    92 H   0.0010   0.001  0.000  0.000
    93 H   0.0186   0.019  0.000  0.000
    94 H   0.0004   0.000  0.000  0.000

Wiberg/Mayer (AO) data.
largest (>0.10) Wiberg bond orders for each atom
          total WBO             WBO to atom ...
     1  C   2.308        O    2 1.203    C   17 0.559    C    3 0.312
     2  O   1.909        C    1 1.203    C   17 0.249    S   20 0.172    C    3 0.168
     3  C   2.337        C   10 0.875    C    4 0.724    C    1 0.312    O    2 0.168
     4  C   3.293        C    5 1.349    H   69 0.854    C    3 0.724
     5  C   3.927        C    7 1.367    C    4 1.349    F    6 1.033
     6  F   0.979        C    5 1.033
     7  C   3.935        C    9 1.382    C    5 1.367    F    8 1.027
     8  F   0.951        C    7 1.027
     9  C   3.859        C   10 1.409    C    7 1.382    H   70 0.995
    10  C   3.632        C    9 1.409    C   11 1.189    C    3 0.875
    11  C   3.866        C   12 1.306    C   10 1.189    C   17 1.125
    12  C   3.725        C   11 1.306    C   13 1.182    C   15 1.170
    13  C   4.083        N   14 2.836    C   12 1.182
    14  N   2.851        C   13 2.836
    15  C   4.092        N   16 2.872    C   12 1.170
    16  N   2.933        C   15 2.872
    17  C   3.549        C   18 1.403    C   11 1.125    C    1 0.559    O    2 0.249
    18  C   3.704        C   17 1.403    C   19 1.349    H   71 0.960
    19  C   3.814        C   18 1.349    C   23 1.339    S   20 1.094
    20  S   2.637        C   21 1.138    C   19 1.094    O    2 0.172
    21  C   3.769        C   22 1.330    C   28 1.296    S   20 1.138
    22  C   3.872        C   23 1.385    C   21 1.330    S   26 1.143
    23  C   3.749        C   22 1.385    C   19 1.339    C   24 1.009
    24  C   3.895        C   23 1.009    H   72 0.997    H   73 0.991    C   25 0.976
    25  C   3.914        H   74 1.002    H   76 0.997    H   75 0.993    C   24 0.976
    26  S   2.443        C   27 1.181    C   22 1.143
    27  C   3.884        C   28 1.328    C   32 1.319    S   26 1.181
    28  C   3.874        C   27 1.328    C   21 1.296    N   29 1.164
    29  N   3.084        C   28 1.164    C   31 1.160    C   30 0.943
    30  C   3.859        H   78 0.998    H   77 0.996    C   65 0.960    N   29 0.943
    31  C   3.801        C   39 1.293    C   32 1.278    N   29 1.160
    32  C   3.868        C   27 1.319    C   31 1.278    C   33 1.210
    33  C   4.029        N   34 1.546    C   32 1.210    C   37 1.190    S   35 0.104
    34  N   2.977        C   33 1.546    S   35 1.379
    35  S   3.079        N   36 1.380    N   34 1.379    C   33 0.104    C   37 0.100
    36  N   2.975        C   37 1.541    S   35 1.380
    37  C   4.028        N   36 1.541    C   38 1.212    C   33 1.190    S   35 0.100
    38  C   3.864        C   44 1.310    C   39 1.286    C   37 1.212
    39  C   3.810        C   31 1.293    C   38 1.286    N   40 1.161
    40  N   3.053        C   39 1.161    C   43 1.131    C   41 0.984
    41  C   3.897        H   80 1.000    H   79 0.999    C   42 0.995    N   40 0.984
    42  C   3.874        H   83 1.006    H   81 0.998    C   41 0.995    H   82 0.992
    43  C   3.815        C   47 1.356    C   44 1.301    N   40 1.131
    44  C   3.916        C   38 1.310    C   43 1.301    S   45 1.231
    45  S   2.621        C   44 1.231    C   46 1.113    O   64 0.116
    46  C   3.868        C   68 1.387    C   47 1.330    S   45 1.113
    47  C   3.765        C   43 1.356    C   46 1.330    C   66 1.039
    48  C   3.815        C   68 1.433    C   49 1.204    C   63 1.114
    49  C   3.770        C   50 1.382    C   48 1.204    C   55 1.113
    50  C   3.734        C   49 1.382    C   53 1.181    C   51 1.163
    51  C   4.093        N   52 2.887    C   50 1.163
    52  N   2.898        C   51 2.887
    53  C   4.094        N   54 2.810    C   50 1.181
    54  N   2.791        C   53 2.810
    55  C   3.853        C   56 1.423    C   62 1.310    C   49 1.113
    56  C   3.842        C   57 1.428    C   55 1.423    H   84 0.966
    57  C   3.981        C   56 1.428    C   59 1.390    F   58 1.044
    58  F   0.985        C   57 1.044
    59  C   3.960        C   61 1.415    C   57 1.390    F   60 1.028
    60  F   0.975        C   59 1.028
    61  C   3.756        C   62 1.454    C   59 1.415    H   85 0.851
    62  C   3.887        C   61 1.454    C   55 1.310    C   63 1.046
    63  C   3.978        O   64 1.764    C   48 1.114    C   62 1.046
    64  O   2.040        C   63 1.764    S   45 0.116
    65  C   3.462        C   30 0.960    H   87 0.882    H   86 0.849    H   88 0.817
    66  C   3.420        C   47 1.039    C   67 0.889    H   89 0.819    H   90 0.773
    67  C   3.225        C   66 0.889    H   92 0.876    H   91 0.787    H   93 0.733
    68  C   3.565        C   48 1.433    C   46 1.387    H   94 0.768
    69  H   0.986        C    4 0.854
    70  H   1.061        C    9 0.995
    71  H   1.056        C   18 0.960
    72  H   1.059        C   24 0.997
    73  H   1.042        C   24 0.991
    74  H   1.049        C   25 1.002
    75  H   1.050        C   25 0.993
    76  H   1.032        C   25 0.997
    77  H   1.065        C   30 0.996
    78  H   1.046        C   30 0.998
    79  H   1.083        C   41 0.999
    80  H   1.059        C   41 1.000
    81  H   1.091        C   42 0.998
    82  H   1.053        C   42 0.992
    83  H   1.071        C   42 1.006
    84  H   0.955        C   56 0.966
    85  H   0.927        C   61 0.851
    86  H   0.941        C   65 0.849
    87  H   0.952        C   65 0.882
    88  H   0.929        C   65 0.817
    89  H   0.916        C   66 0.819
    90  H   0.946        C   66 0.773
    91  H   0.926        C   67 0.787
    92  H   0.957        C   67 0.876
    93  H   0.917        C   67 0.733
    94  H   0.978        C   68 0.768

 dipole moment from electron density (au)
     X       Y       Z   
  20.6401  12.2303  38.5164  total (Debye):  115.338


           -------------------------------------------------
          | TOTAL ENERGY             -218.374319431844 Eh   |
          | GRADIENT NORM               0.690370870055 Eh/α |
          | HOMO-LUMO GAP               0.129442096406 eV   |
           -------------------------------------------------

------------------------------------------------------------------------
 * finished run on 2021/12/02 at 16:23:49.818     
------------------------------------------------------------------------
 total:
 * wall-time:     0 d,  0 h,  0 min,  5.467 sec
 *  cpu-time:     0 d,  0 h,  0 min,  5.445 sec
 * ratio c/w:     0.996 speedup
 SCF:
 * wall-time:     0 d,  0 h,  0 min,  4.693 sec
 *  cpu-time:     0 d,  0 h,  0 min,  4.681 sec
 * ratio c/w:     0.998 speedup

