      -----------------------------------------------------------      
     |                   =====================                   |     
     |                           x T B                           |     
     |                   =====================                   |     
     |                         S. Grimme                         |     
     |          Mulliken Center for Theoretical Chemistry        |     
     |                    University of Bonn                     |     
     |                Version 6.2 RC2 (SAW190805)                |     
      -----------------------------------------------------------      

   This program is distributed in the hope that it will be useful,
   but WITHOUT ANY WARRANTY; without even the implied warranty of
   MERCHANTABILITY or FITNESS FOR A PARTICULAR PURPOSE.
   
   FOR NON-COMMERCIAL, ACADEMIA USE ONLY.
   
   Cite this work as:
   * S. Grimme, C. Bannwarth, P. Shushkov, J. Chem. Theory Comput., 2017,
     13, 1989-2009. DOI: 10.1021/acs.jctc.7b00118
   * C. Bannwarth, S. Ehlert and S. Grimme., J. Chem. Theory Comput., 2019,
     15, 1652-1671. DOI: 10.1021/acs.jctc.8b01176
   * P. Pracht, E. Caldeweyher, S. Ehlert, S. Grimme, ChemRxiv, 2019, preprint.
     DOI: 10.26434/chemrxiv.8326202.v1
   
   for DFT-D4:
   * E. Caldeweyher, C. Bannwarth and S. Grimme, J. Chem. Phys., 2017,
     147, 034112. DOI: 10.1063/1.4993215
   * E. Caldeweyher, S. Ehlert, A. Hansen, H. Neugebauer, S. Spicher,
     C. Bannwarth and S. Grimme, J. Chem. Phys., 2019, 150, 154122.
     DOI: 10.1063/1.5090222
   
   for sTDA-xTB:
   * S. Grimme and C. Bannwarth, J. Chem. Phys., 2016, 145, 054103.
     DOI: 10.1063/1.4959605
   
   in the mass-spec context:
   * V. Asgeirsson, C. Bauer and S. Grimme, Chem. Sci., 2017, 8, 4879.
     DOI: 10.1039/c7sc00601b
   
   for metadynamics refer to:
   * S. Grimme, J. Chem. Theory Comput., 2019, 155, 2847-2862
     DOI: 10.1021/acs.jctc.9b00143
   
   with help from (in alphabetical order)
   C. Bannwarth, F. Bohle, G. Brandenburg, E. Caldeweyher, M. Checinski,
   S. Dohm, S. Ehlert, S. Ehrlich, F. März, H. Neugebauer, J. Pisarek,
   P. Pracht, P. Shushkov, and S. Spicher.
   
 * started run on 2021/12/02 at 16:29:17.069     

           -------------------------------------------------
          |                Calculation Setup                |
           -------------------------------------------------

          program call               : /ihome/ghutchison/geoffh/xtb/xtb BT-BIC.xyz --vipea
          hostname                   : smp-n128
          coordinate file            : BT-BIC.xyz
          omp threads                :                     1
          number of atoms            :                   109
          number of electrons        :                   356
          charge                     :                     0
          spin                       :                   0.0
          first test random number   :      0.44541636242549


########################################################################
# WARNING! Please study the warnings concerning your input carefully
#  - XTBPATH is not set, using XTBHOME instead
########################################################################

           ------------------------------------------------- 
          |                 I P E A - x T B                 |
          |  Ionisation Potentials and Electron Affinities  |
           ------------------------------------------------- 
             KAB for M(3d)-M(3d) :                1.1000
             KAB for M(4d)-M(4d) :                1.2000
             KAB for M(5d)-M(5d) :                1.2000
             k(s)                :                2.1500
             k(p)                :                2.3000
             k(d)                :                2.0000
             k(f)                :                0.0000
             kEN (H0ij)          :                0.7000
             D3 a1               :                0.6300
             D3 a2               :                5.0000
             D3 s6               :                1.0000
             D3 s8               :                2.4000
             D3 s9               :                0.0000
             alphaj              :                1.0000
             XBdamp              :                0.4400
             XBrad               :                1.3000
             kcnsh               :      1.0000   -0.3000   -0.5000    0.5000

  Z AO/shell   Hii/eV     exponent
  1     Thu Sep 22 23:34:11 CEST 2016   EN: 2.200 GAM: 0.405  GM3: 0.1500
     1s    -10.521941    1.306199
     2s     -3.560151    0.398421
  6     Thu Sep 22 23:34:11 CEST 2016   EN: 2.550 GAM: 0.640  GM3: 0.1500
     2s    -15.968100    1.979793
     2p     -9.777107    1.850537
     3S     -3.366990    0.633095
  7     Thu Sep 22 23:34:11 CEST 2016   EN: 3.040 GAM: 0.493  GM3:-0.1000
     2s    -24.040776    2.126160
     2p    -14.426520    2.068425
     3S     -5.882278    0.671040
  8     Thu Sep 22 23:34:11 CEST 2016   EN: 3.440 GAM: 0.717  GM3:-0.2000
     2s    -26.695120    2.575264
     2p    -16.014457    2.159448
     3S     -6.622058    0.958679
 16     Tue Jan 17 20:57:36 CET 2017    EN: 2.580 GAM: 0.455  GM3: 0.1020
     3s    -24.488821    2.492075
     3p    -12.136640    1.997904
     3d     -1.796070    1.747541

           ------------------------------------------------- 
          |        Self-Consistent Charge Iterations        |
           ------------------------------------------------- 

          ...................................................
          :                      SETUP                      :
          :.................................................:
          :  # basis functions                 468          :
          :  # atomic orbitals                 463          :
          :  # shells                          293          :
          :  # electrons                       356          :
          :  # halogen bonds                     0          :
          :  max. iterations                   250          :
          :  Hamiltonian                  GFN1-xTB          :
          :  restarted?                      false          :
          :  GBSA solvation                  false          :
          :  PC potential                    false          :
          :  electronic temp.          300.0000000     K    :
          :  accuracy                    1.0000000          :
          :  -> integral cutoff          0.2500000E+02      :
          :  -> integral neglect         0.1000000E-07      :
          :  -> SCF convergence          0.1000000E-05 Eh   :
          :  -> wf. convergence          0.2000000E-04 e    :
          :  Broyden damping             0.4000000          :
          ...................................................

 iter      E             dE          RMSdq      gap      omega  full diag
   1   -216.0485512 -0.216049E+03  0.112E+01    0.11       0.0  T
   2   -197.9928839  0.180557E+02  0.727E+00    0.07       1.0  T
   3    161.8616942  0.359855E+03  0.147E+01    0.24       1.0  T
   4    -67.8417114 -0.229703E+03  0.117E+01    0.11       1.0  T
   5   -208.4676538 -0.140626E+03  0.416E+00    0.12       1.0  T
   6   -216.7385458 -0.827089E+01  0.253E+00    0.08       1.0  T
   7   -219.2150709 -0.247653E+01  0.139E+00    0.51       1.0  T
   8   -218.7342833  0.480788E+00  0.138E+00    0.24       1.0  T
   9   -217.6732371  0.106105E+01  0.148E+00    0.00       1.0  T
  10   -219.1336948 -0.146046E+01  0.912E-01    0.16       1.0  T
  11   -219.2815483 -0.147854E+00  0.530E-01    0.18       1.0  T
  12   -219.3477003 -0.661520E-01  0.426E-01    0.47       1.0  T
  13   -219.3710393 -0.233390E-01  0.334E-01    0.62       1.0  T
  14   -219.3882749 -0.172356E-01  0.238E-01    0.79       1.0  T
  15   -219.4020989 -0.138240E-01  0.148E-01    0.82       1.0  T
  16   -219.4089544 -0.685543E-02  0.106E-01    0.64       1.0  T
  17   -219.4130859 -0.413156E-02  0.723E-02    0.45       1.0  T
  18   -219.4145795 -0.149357E-02  0.573E-02    0.39       1.0  T
  19   -219.4161267 -0.154722E-02  0.400E-02    0.30       1.0  T
  20   -219.4161472 -0.204430E-04  0.385E-02    0.30       1.0  T
  21   -219.4161605 -0.133793E-04  0.245E-02    0.27       1.0  T
  22   -219.4163639 -0.203397E-03  0.153E-02    0.29       1.0  T
  23   -219.4163547  0.924603E-05  0.124E-02    0.28       1.0  T
  24   -219.4164734 -0.118698E-03  0.925E-03    0.30       1.0  T
  25   -219.4164887 -0.153323E-04  0.792E-03    0.30       1.2  T
  26   -219.4164961 -0.742745E-05  0.587E-03    0.31       1.6  T
  27   -219.4165048 -0.862703E-05  0.334E-03    0.30       2.9  T
  28   -219.4165076 -0.279226E-05  0.165E-03    0.30       5.8  T
  29   -219.4165082 -0.674116E-06  0.701E-04    0.30      13.7  T
  30   -219.4165083 -0.103740E-06  0.404E-04    0.30      23.7  T
  31   -219.4165083 -0.646463E-08  0.289E-04    0.30      33.1  T
  32   -219.4165084 -0.431236E-07  0.155E-04    0.30      61.9  T
  33   -219.4165084 -0.868286E-08  0.994E-05    0.30      96.4  T

   *** convergence criteria satisfied after 33 iterations ***

         #    Occupation            Energy/Eh            Energy/eV
      -------------------------------------------------------------
         1        2.0000           -1.0219928             -27.8098
       ...           ...                  ...                  ...
       172        2.0000           -0.3579634              -9.7407
       173        2.0000           -0.3532306              -9.6119
       174        2.0000           -0.3506182              -9.5408
       175        2.0000           -0.3344452              -9.1007
       176        2.0000           -0.3305796              -8.9955
       177        2.0000           -0.3259590              -8.8698
       178        1.9945           -0.2820796              -7.6758 (HOMO)
       179        0.0055           -0.2708917              -7.3713 (LUMO)
       180                         -0.2602004              -7.0804
       181                         -0.2539049              -6.9091
       182                         -0.2480448              -6.7496
       183                         -0.2326427              -6.3305
       ...                                ...                  ...
       463                        572.3369484           15574.0811
      -------------------------------------------------------------
                  HL-Gap            0.0111879 Eh            0.3044 eV
             Fermi-level           -0.2764856 Eh           -7.5236 eV

 SCC (total)                   0 d,  0 h,  0 min,  2.435 sec
 SCC setup                      ...        0 min,  0.005 sec (  0.192%)
 Dispersion                     ...        0 min,  0.000 sec (  0.016%)
 integral evaluation            ...        0 min,  0.960 sec ( 39.427%)
 zeroth order Hamiltonian       ...        0 min,  0.004 sec (  0.161%)
 iterations                     ...        0 min,  1.174 sec ( 48.216%)
 molecular gradient             ...        0 min,  0.286 sec ( 11.742%)
 printout                       ...        0 min,  0.006 sec (  0.243%)

         :::::::::::::::::::::::::::::::::::::::::::::::::::::
         ::                     SUMMARY                     ::
         :::::::::::::::::::::::::::::::::::::::::::::::::::::
         :: total energy            -215.259709322720 Eh    ::
         :: gradient norm              0.476843340300 Eh/a0 ::
         :: HOMO-LUMO gap              0.304437612066 eV    ::
         ::.................................................::
         :: SCC energy              -219.416508399026 Eh    ::
         :: -> electrostatic           0.568068163378 Eh    ::
         :: repulsion energy           4.261306900681 Eh    ::
         :: dispersion energy         -0.104507824374 Eh    ::
         :: halogen bond corr.         0.000000000000 Eh    ::
         :: add. restraining           0.000000000000 Eh    ::
         :::::::::::::::::::::::::::::::::::::::::::::::::::::

           ------------------------------------------------- 
          |        vertical delta SCC IP calculation        |
           ------------------------------------------------- 

          ...................................................
          :                      SETUP                      :
          :.................................................:
          :  # basis functions                 468          :
          :  # atomic orbitals                 463          :
          :  # shells                          293          :
          :  # electrons                       355          :
          :  # halogen bonds                     0          :
          :  max. iterations                   250          :
          :  Hamiltonian                  GFN1-xTB          :
          :  restarted?                       true          :
          :  GBSA solvation                  false          :
          :  PC potential                    false          :
          :  electronic temp.          300.0000000     K    :
          :  accuracy                    1.0000000          :
          :  -> integral cutoff          0.2500000E+02      :
          :  -> integral neglect         0.1000000E-07      :
          :  -> SCF convergence          0.1000000E-05 Eh   :
          :  -> wf. convergence          0.2000000E-04 e    :
          :  Broyden damping             0.4000000          :
          ...................................................

 iter      E             dE          RMSdq      gap      omega  full diag
   1   -219.0750182 -0.219075E+03  0.219E-01    0.30       0.0  T
   2   -219.0864385 -0.114204E-01  0.208E-01    0.93       1.0  T
   3   -219.0945730 -0.813443E-02  0.111E-01    0.85       1.0  T
   4   -219.0941475  0.425499E-03  0.842E-02    0.87       1.0  T
   5   -219.0947214 -0.573947E-03  0.449E-02    0.89       1.0  T
   6   -219.0949246 -0.203155E-03  0.260E-02    0.87       1.0  T
   7   -219.0949883 -0.637365E-04  0.148E-02    0.87       1.0  T
   8   -219.0950005 -0.122088E-04  0.751E-03    0.87       1.3  T
   9   -219.0950082 -0.771590E-05  0.390E-03    0.87       2.5  T
  10   -219.0950104 -0.218759E-05  0.165E-03    0.87       5.8  T
  11   -219.0950109 -0.515575E-06  0.709E-04    0.87      13.5  T
  12   -219.0950110 -0.889050E-07  0.266E-04    0.87      36.0  T
  13   -219.0950110 -0.113800E-07  0.127E-04    0.87      75.5  T
  14   -219.0950111 -0.173128E-08  0.700E-05    0.87     136.8  T

   *** convergence criteria satisfied after 14 iterations ***

         #    Occupation            Energy/Eh            Energy/eV
      -------------------------------------------------------------
         1        2.0000           -1.0891335             -29.6368
       ...           ...                  ...                  ...
       172        2.0000           -0.4156900             -11.3115
       173        2.0000           -0.4125803             -11.2269
       174        2.0000           -0.4081262             -11.1057
       175        2.0000           -0.3961097             -10.7787
       176        1.9999           -0.3791600             -10.3175
       177        1.9998           -0.3789452             -10.3116
       178        1.0003           -0.3630365              -9.8787 (HOMO)
       179                         -0.3310412              -9.0081 (LUMO)
       180                         -0.3252794              -8.8513
       181                         -0.3201119              -8.7107
       182                         -0.3113289              -8.4717
       183                         -0.3087611              -8.4018
       ...                                ...                  ...
       463                        572.2722744           15572.3212
      -------------------------------------------------------------
                  HL-Gap            0.0319953 Eh            0.8706 eV
             Fermi-level           -0.3588761 Eh           -9.7655 eV

 SCC (total)                   0 d,  0 h,  0 min,  1.752 sec
 SCC setup                      ...        0 min,  0.004 sec (  0.227%)
 Dispersion                     ...        0 min,  0.000 sec (  0.013%)
 integral evaluation            ...        0 min,  0.960 sec ( 54.812%)
 zeroth order Hamiltonian       ...        0 min,  0.004 sec (  0.200%)
 iterations                     ...        0 min,  0.493 sec ( 28.133%)
 molecular gradient             ...        0 min,  0.284 sec ( 16.229%)
 printout                       ...        0 min,  0.007 sec (  0.382%)

         :::::::::::::::::::::::::::::::::::::::::::::::::::::
         ::                     SUMMARY                     ::
         :::::::::::::::::::::::::::::::::::::::::::::::::::::
         :: total energy            -214.938211975078 Eh    ::
         :: gradient norm              0.465928977187 Eh/a0 ::
         :: HOMO-LUMO gap              0.870637317692 eV    ::
         ::.................................................::
         :: SCC energy              -219.095011051384 Eh    ::
         :: -> electrostatic           0.625428722702 Eh    ::
         :: repulsion energy           4.261306900681 Eh    ::
         :: dispersion energy         -0.104507824374 Eh    ::
         :: halogen bond corr.         0.000000000000 Eh    ::
         :: add. restraining           0.000000000000 Eh    ::
         :::::::::::::::::::::::::::::::::::::::::::::::::::::

------------------------------------------------------------------------
empirical IP shift (eV):    4.8455
delta SCC IP (eV):    3.9029
------------------------------------------------------------------------
           ------------------------------------------------- 
          |        vertical delta SCC EA calculation        |
           ------------------------------------------------- 

          ...................................................
          :                      SETUP                      :
          :.................................................:
          :  # basis functions                 468          :
          :  # atomic orbitals                 463          :
          :  # shells                          293          :
          :  # electrons                       357          :
          :  # halogen bonds                     0          :
          :  max. iterations                   250          :
          :  Hamiltonian                  GFN1-xTB          :
          :  restarted?                       true          :
          :  GBSA solvation                  false          :
          :  PC potential                    false          :
          :  electronic temp.          300.0000000     K    :
          :  accuracy                    1.0000000          :
          :  -> integral cutoff          0.2500000E+02      :
          :  -> integral neglect         0.1000000E-07      :
          :  -> SCF convergence          0.1000000E-05 Eh   :
          :  -> wf. convergence          0.2000000E-04 e    :
          :  Broyden damping             0.4000000          :
          ...................................................

 iter      E             dE          RMSdq      gap      omega  full diag
   1   -219.6062192 -0.219606E+03  0.342E-01    0.16       0.0  T
   2   -219.5630259  0.431933E-01  0.439E-01    0.30       1.0  T
   3   -219.6286686 -0.656428E-01  0.300E-01    0.23       1.0  T
   4   -219.6447333 -0.160646E-01  0.212E-01    0.24       1.0  T
   5   -219.6461764 -0.144311E-02  0.140E-01    0.19       1.0  T
   6   -219.6488885 -0.271210E-02  0.748E-02    0.21       1.0  T
   7   -219.6502038 -0.131530E-02  0.228E-02    0.20       1.0  T
   8   -219.6503418 -0.138033E-03  0.103E-02    0.20       1.0  T
   9   -219.6503699 -0.280803E-04  0.661E-03    0.20       1.4  T
  10   -219.6503763 -0.644845E-05  0.261E-03    0.20       3.7  T
  11   -219.6503778 -0.151213E-05  0.115E-03    0.20       8.3  T
  12   -219.6503780 -0.157135E-06  0.572E-04    0.20      16.8  T
  13   -219.6503780 -0.110154E-08  0.447E-04    0.20      21.4  T
  14   -219.6503780 -0.533149E-07  0.157E-04    0.20      61.0  T
  15   -219.6503781 -0.360788E-08  0.797E-05    0.20     120.1  T

   *** convergence criteria satisfied after 15 iterations ***

         #    Occupation            Energy/Eh            Energy/eV
      -------------------------------------------------------------
         1        2.0000           -0.9532307             -25.9387
       ...           ...                  ...                  ...
       173        2.0000           -0.2844948              -7.7415
       174        2.0000           -0.2822800              -7.6812
       175        2.0000           -0.2681096              -7.2956
       176        2.0000           -0.2654373              -7.2229
       177        2.0000           -0.2565346              -6.9807
       178        2.0000           -0.2194027              -5.9703
       179        0.9800           -0.1970589              -5.3622 (HOMO)
       180        0.0196           -0.1896444              -5.1605 (LUMO)
       181        0.0005           -0.1860820              -5.0635
       182        0.0000           -0.1818280              -4.9478
       183                         -0.1724365              -4.6922
       184                         -0.1595625              -4.3419
       ...                                ...                  ...
       463                        572.4028163           15575.8734
      -------------------------------------------------------------
                  HL-Gap            0.0074145 Eh            0.2018 eV
             Fermi-level           -0.2007971 Eh           -5.4640 eV

 SCC (total)                   0 d,  0 h,  0 min,  1.787 sec
 SCC setup                      ...        0 min,  0.005 sec (  0.260%)
 Dispersion                     ...        0 min,  0.000 sec (  0.020%)
 integral evaluation            ...        0 min,  0.958 sec ( 53.623%)
 zeroth order Hamiltonian       ...        0 min,  0.004 sec (  0.214%)
 iterations                     ...        0 min,  0.530 sec ( 29.674%)
 molecular gradient             ...        0 min,  0.285 sec ( 15.927%)
 printout                       ...        0 min,  0.005 sec (  0.279%)

         :::::::::::::::::::::::::::::::::::::::::::::::::::::
         ::                     SUMMARY                     ::
         :::::::::::::::::::::::::::::::::::::::::::::::::::::
         :: total energy            -215.493578976266 Eh    ::
         :: gradient norm              0.478784134208 Eh/a0 ::
         :: HOMO-LUMO gap              0.201757903984 eV    ::
         ::.................................................::
         :: SCC energy              -219.650378052572 Eh    ::
         :: -> electrostatic           0.601985477717 Eh    ::
         :: repulsion energy           4.261306900681 Eh    ::
         :: dispersion energy         -0.104507824374 Eh    ::
         :: halogen bond corr.         0.000000000000 Eh    ::
         :: add. restraining           0.000000000000 Eh    ::
         :::::::::::::::::::::::::::::::::::::::::::::::::::::

------------------------------------------------------------------------
empirical EA shift (eV):    4.8455
delta SCC EA (eV):    1.5184
------------------------------------------------------------------------
           -------------------------------------------------
          |                Property Printout                |
           -------------------------------------------------

    * Orbital Energies and Occupations

         #    Occupation            Energy/Eh            Energy/eV
      -------------------------------------------------------------
         1        2.0000           -0.9532307             -25.9387
       ...           ...                  ...                  ...
       167        2.0000           -0.3096666              -8.4265
       168        2.0000           -0.3076413              -8.3713
       169        2.0000           -0.3005707              -8.1789
       170        2.0000           -0.2981510              -8.1131
       171        2.0000           -0.2959734              -8.0538
       172        2.0000           -0.2918208              -7.9408
       173        2.0000           -0.2844948              -7.7415
       174        2.0000           -0.2822800              -7.6812
       175        2.0000           -0.2681096              -7.2956
       176        2.0000           -0.2654373              -7.2229
       177        2.0000           -0.2565346              -6.9807
       178        2.0000           -0.2194027              -5.9703
       179        0.9800           -0.1970589              -5.3622 (HOMO)
       180        0.0196           -0.1896444              -5.1605 (LUMO)
       181        0.0005           -0.1860820              -5.0635
       182        0.0000           -0.1818280              -4.9478
       183                         -0.1724365              -4.6922
       184                         -0.1595625              -4.3419
       185                         -0.1583684              -4.3094
       186                         -0.1379127              -3.7528
       187                         -0.1346484              -3.6640
       188                         -0.1291516              -3.5144
       189                         -0.1240824              -3.3765
       190                         -0.1221986              -3.3252
       ...                                ...                  ...
       463                        572.4028163           15575.8734
      -------------------------------------------------------------
                  HL-Gap            0.0074145 Eh            0.2018 eV
             Fermi-level           -0.2007971 Eh           -5.4640 eV

  Mulliken/CM5 charges        n(s)   n(p)   n(d)
     1 C  -0.24467 -0.21028   1.122  2.634  0.000
     2 O  -0.82147 -0.87181   1.940  3.238  0.000
     3 C  -0.33587 -0.33520   1.241  2.423  0.000
     4 C  -0.08607 -0.08981   0.662  3.252  0.000
     5 C   0.12029  0.11281   1.093  3.028  0.000
     6 C   0.09866  0.04521   1.081  3.017  0.000
     7 C   0.05514  0.00258   1.084  2.972  0.000
     8 C   0.17607  0.17277   1.057  3.119  0.000
     9 C   0.05312  0.05348   1.068  2.985  0.000
    10 C   0.04770  0.05503   1.006  3.042  0.000
    11 C  -0.09009  0.03108   1.208  2.702  0.000
    12 N   0.31574  0.18546   1.479  3.837  0.000
    13 C  -0.08538  0.03377   1.205  2.709  0.000
    14 N   0.33543  0.20642   1.523  3.813  0.000
    15 C   0.15699  0.15500   1.068  3.089  0.000
    16 C   0.10113  0.05367   1.025  3.077  0.000
    17 C   0.00372  0.01221   1.111  2.893  0.000
    18 S   0.10459  0.06967   1.881  4.140  0.083
    19 C   0.00085  0.01876   1.108  2.893  0.000
    20 C   0.00061  0.01428   1.136  2.865  0.000
    21 C   0.03068  0.02324   1.042  2.989  0.000
    22 C   0.03028 -0.07531   1.071  2.959  0.000
    23 C   0.05909 -0.09211   1.074  2.986  0.000
    24 S   0.09964  0.06688   1.876  4.150  0.074
    25 C   0.00194  0.02398   1.136  2.866  0.000
    26 C  -0.04430  0.02486   1.061  2.895  0.000
    27 N   0.12477 -0.13086   1.252  3.873  0.000
    28 C  -0.03883 -0.08854   1.086  2.875  0.000
    29 C   0.05056 -0.09589   1.063  2.988  0.000
    30 C  -0.04576  0.02292   1.054  2.900  0.000
    31 C   0.02258  0.03558   1.071  2.951  0.000
    32 C  -0.06246  0.02565   1.149  2.789  0.000
    33 N   0.27041  0.10871   1.473  3.797  0.000
    34 S  -0.10887  0.02589   1.862  3.717  0.312
    35 N   0.26505  0.10333   1.474  3.791  0.000
    36 C  -0.06527  0.02286   1.150  2.784  0.000
    37 C   0.02223  0.03540   1.071  2.951  0.000
    38 C  -0.04587  0.02402   1.056  2.898  0.000
    39 N   0.11857 -0.13896   1.251  3.867  0.000
    40 C  -0.03759 -0.08596   1.096  2.867  0.000
    41 C   0.05335 -0.09445   1.065  2.988  0.000
    42 C  -0.04375  0.02603   1.058  2.898  0.000
    43 C  -0.00264  0.01960   1.142  2.855  0.000
    44 S   0.09319  0.06036   1.876  4.146  0.070
    45 C  -0.00377  0.00947   1.135  2.861  0.000
    46 C   0.00424  0.02199   1.114  2.890  0.000
    47 S   0.08828  0.05620   1.891  4.051  0.147
    48 C  -0.01115 -0.00346   1.123  2.866  0.000
    49 C   0.00792 -0.00005   1.066  2.942  0.000
    50 C   0.02494 -0.08113   1.071  2.954  0.000
    51 C   0.05497 -0.09649   1.072  2.983  0.000
    52 C   0.01940 -0.02873   1.058  2.961  0.000
    53 C   0.03284  0.03094   1.060  2.973  0.000
    54 C   0.00389  0.00316   1.097  2.906  0.000
    55 C   0.02074  0.02683   1.028  2.993  0.000
    56 C  -0.08866  0.03012   1.220  2.691  0.000
    57 N   0.33899  0.20893   1.531  3.808  0.000
    58 C  -0.10377  0.01330   1.207  2.690  0.000
    59 N   0.30524  0.17204   1.500  3.805  0.000
    60 C   0.02417  0.02086   1.088  2.936  0.000
    61 C   0.17144  0.11882   1.081  3.090  0.000
    62 C   0.19519  0.14169   1.102  3.093  0.000
    63 C   0.05019  0.04270   1.098  2.952  0.000
    64 C   0.02556  0.02185   1.083  2.943  0.000
    65 C   0.03858  0.03935   1.091  2.948  0.000
    66 C  -0.13285 -0.09789   1.180  2.688  0.000
    67 O   0.34178  0.29092   1.664  4.678  0.000
    68 C   0.19824  0.14448   1.084  3.115  0.000
    69 C   0.22005  0.16379   1.120  3.100  0.000
    70 C   0.23496  0.17878   1.071  3.164  0.000
    71 C   0.28333  0.23064   1.094  3.189  0.000
    72 C   0.19421  0.14154   1.085  3.109  0.000
    73 C   0.21257  0.15638   1.092  3.121  0.000
    74 C   0.18876  0.13249   1.129  3.060  0.000
    75 C   0.19824  0.14447   1.087  3.111  0.000
    76 H   0.01806  0.07555   1.018  0.000  0.000
    77 H  -0.01256  0.05010   0.987  0.000  0.000
    78 H   0.05655  0.11950   1.057  0.000  0.000
    79 H  -0.01801  0.03932   0.982  0.000  0.000
    80 H   0.00727  0.06351   1.007  0.000  0.000
    81 H  -0.01546  0.03794   0.985  0.000  0.000
    82 H  -0.00192  0.04986   0.998  0.000  0.000
    83 H   0.00724  0.06128   1.007  0.000  0.000
    84 H  -0.02728  0.04108   0.973  0.000  0.000
    85 H  -0.03278  0.03789   0.967  0.000  0.000
    86 H  -0.01233  0.04255   0.988  0.000  0.000
    87 H  -0.01467  0.04253   0.985  0.000  0.000
    88 H  -0.01441  0.03803   0.986  0.000  0.000
    89 H  -0.02646  0.04210   0.974  0.000  0.000
    90 H  -0.03149  0.03605   0.969  0.000  0.000
    91 H  -0.02320  0.03207   0.977  0.000  0.000
    92 H  -0.01785  0.03451   0.982  0.000  0.000
    93 H  -0.02205  0.03515   0.978  0.000  0.000
    94 H  -0.01189  0.04609   0.988  0.000  0.000
    95 H  -0.01333  0.04431   0.987  0.000  0.000
    96 H  -0.01026  0.04329   0.990  0.000  0.000
    97 H  -0.00582  0.04629   0.994  0.000  0.000
    98 H  -0.01306  0.03989   0.987  0.000  0.000
    99 H  -0.02122  0.04948   0.979  0.000  0.000
   100 H  -0.25662 -0.19226   0.743  0.000  0.000
   101 H  -0.27160 -0.21409   0.728  0.000  0.000
   102 H  -0.27999 -0.22263   0.720  0.000  0.000
   103 H  -0.25520 -0.19871   0.745  0.000  0.000
   104 H  -0.27830 -0.22177   0.722  0.000  0.000
   105 H  -0.21995 -0.15632   0.780  0.000  0.000
   106 H  -0.28711 -0.22299   0.713  0.000  0.000
   107 H  -0.26101 -0.20446   0.739  0.000  0.000
   108 H  -0.19634 -0.13984   0.804  0.000  0.000
   109 H  -0.22900 -0.17163   0.771  0.000  0.000
(R)spin-density population

 Mulliken population n(s)   n(p)   n(d)
     1 C   0.0008   0.000  0.001  0.000
     2 O   0.0359  -0.000  0.036  0.000
     3 C   0.0082   0.002  0.006  0.000
     4 C   0.0021   0.000  0.002  0.000
     5 C   0.0028   0.000  0.003  0.000
     6 C   0.0000   0.000  0.000  0.000
     7 C   0.0016  -0.000  0.002  0.000
     8 C   0.0014  -0.000  0.001  0.000
     9 C   0.0021  -0.000  0.002  0.000
    10 C   0.0024   0.000  0.002  0.000
    11 C   0.0001  -0.000  0.000  0.000
    12 N   0.0006  -0.000  0.001  0.000
    13 C   0.0004  -0.000  0.000  0.000
    14 N   0.0012  -0.000  0.001  0.000
    15 C   0.0227   0.005  0.018  0.000
    16 C   0.0021   0.001  0.001  0.000
    17 C   0.0093   0.000  0.009  0.000
    18 S   0.0048   0.000  0.004  0.001
    19 C   0.0013  -0.000  0.001  0.000
    20 C   0.0090  -0.000  0.009  0.000
    21 C  -0.0001  -0.000  0.000  0.000
    22 C   0.0001   0.000  0.000  0.000
    23 C   0.0000   0.000  0.000  0.000
    24 S   0.0016   0.000  0.000  0.001
    25 C   0.0020   0.000  0.002  0.000
    26 C   0.0109  -0.000  0.011  0.000
    27 N   0.0154   0.000  0.015  0.000
    28 C   0.0004  -0.000  0.000  0.000
    29 C   0.0011   0.000  0.001  0.000
    30 C   0.0128  -0.000  0.013  0.000
    31 C   0.0212   0.000  0.021  0.000
    32 C   0.0109  -0.000  0.011  0.000
    33 N   0.0398   0.000  0.040  0.000
    34 S   0.0461  -0.000  0.033  0.013
    35 N   0.0244   0.000  0.024  0.000
    36 C   0.0026   0.000  0.003  0.000
    37 C   0.0042   0.000  0.004  0.000
    38 C   0.0372  -0.000  0.037  0.000
    39 N   0.0207  -0.000  0.021  0.000
    40 C   0.0005   0.000  0.000  0.000
    41 C   0.0016   0.001  0.001  0.000
    42 C   0.0029   0.000  0.003  0.000
    43 C   0.0118  -0.000  0.012  0.000
    44 S   0.0062  -0.000  0.005  0.001
    45 C   0.0020  -0.000  0.002  0.000
    46 C   0.0494  -0.000  0.049  0.000
    47 S   0.0332  -0.000  0.028  0.005
    48 C   0.0099  -0.000  0.010  0.000
    49 C   0.0544  -0.000  0.054  0.000
    50 C   0.0003   0.000  0.000  0.000
    51 C   0.0034   0.001  0.002  0.000
    52 C   0.0789  -0.000  0.079  0.000
    53 C   0.0308  -0.000  0.031  0.000
    54 C   0.0960  -0.000  0.096  0.000
    55 C   0.0631   0.000  0.063  0.000
    56 C   0.0122   0.000  0.012  0.000
    57 N   0.0346  -0.000  0.035  0.000
    58 C   0.0125   0.000  0.012  0.000
    59 N   0.0353   0.000  0.035  0.000
    60 C   0.0007   0.000  0.001  0.000
    61 C   0.0095   0.000  0.010  0.000
    62 C   0.0004   0.000  0.000  0.000
    63 C   0.0122  -0.000  0.012  0.000
    64 C   0.0001  -0.000  0.000  0.000
    65 C   0.0373  -0.000  0.037  0.000
    66 C   0.0012  -0.000  0.001  0.000
    67 O   0.0007  -0.000  0.001  0.000
    68 C   0.0004  -0.000  0.001  0.000
    69 C   0.0024  -0.000  0.002  0.000
    70 C   0.0009   0.000  0.000  0.000
    71 C   0.0070   0.002  0.005  0.000
    72 C   0.0094  -0.000  0.009  0.000
    73 C   0.0001  -0.000  0.000  0.000
    74 C   0.0114  -0.000  0.011  0.000
    75 C   0.0001  -0.000  0.000  0.000
    76 H   0.0000   0.000  0.000  0.000
    77 H   0.0002   0.000  0.000  0.000
    78 H   0.0011   0.001  0.000  0.000
    79 H   0.0002   0.000  0.000  0.000
    80 H   0.0008   0.001  0.000  0.000
    81 H   0.0000   0.000  0.000  0.000
    82 H   0.0004   0.000  0.000  0.000
    83 H   0.0003   0.000  0.000  0.000
    84 H   0.0001   0.000  0.000  0.000
    85 H   0.0001   0.000  0.000  0.000
    86 H   0.0000   0.000  0.000  0.000
    87 H  -0.0000  -0.000  0.000  0.000
    88 H   0.0001   0.000  0.000  0.000
    89 H   0.0002   0.000  0.000  0.000
    90 H   0.0006   0.001  0.000  0.000
    91 H   0.0002   0.000  0.000  0.000
    92 H   0.0003   0.000  0.000  0.000
    93 H   0.0003   0.000  0.000  0.000
    94 H   0.0007   0.001  0.000  0.000
    95 H   0.0004   0.000  0.000  0.000
    96 H   0.0001   0.000  0.000  0.000
    97 H   0.0003   0.000  0.000  0.000
    98 H   0.0001   0.000  0.000  0.000
    99 H   0.0000   0.000  0.000  0.000
   100 H   0.0000   0.000  0.000  0.000
   101 H   0.0000   0.000  0.000  0.000
   102 H   0.0000   0.000  0.000  0.000
   103 H   0.0001   0.000  0.000  0.000
   104 H   0.0003   0.000  0.000  0.000
   105 H   0.0001   0.000  0.000  0.000
   106 H   0.0000   0.000  0.000  0.000
   107 H   0.0000   0.000  0.000  0.000
   108 H   0.0000   0.000  0.000  0.000
   109 H   0.0000   0.000  0.000  0.000

Wiberg/Mayer (AO) data.
largest (>0.10) Wiberg bond orders for each atom
          total WBO             WBO to atom ...
     1  C   3.868        O    2 2.115    C    3 0.955    C   15 0.760
     2  O   2.751        C    1 2.115
     3  C   3.767        C    8 1.320    C    4 1.169    C    1 0.955
     4  C   3.726        C    3 1.169    C   71 1.169    C    5 1.054
     5  C   3.745        C    6 1.305    C   68 1.297    C    4 1.054
     6  C   3.912        C    7 1.528    C    5 1.305    H   76 0.988
     7  C   3.872        C    6 1.528    C    8 1.290    H   77 0.996
     8  C   3.817        C    3 1.320    C    7 1.290    C    9 1.085
     9  C   3.823        C   10 1.293    C   15 1.250    C    8 1.085
    10  C   3.753        C    9 1.293    C   13 1.188    C   11 1.184
    11  C   4.102        N   12 2.824    C   10 1.184
    12  N   2.776        C   11 2.824
    13  C   4.088        N   14 2.848    C   10 1.188
    14  N   2.894        C   13 2.848
    15  C   3.728        C   16 1.416    C    9 1.250    C    1 0.760
    16  C   3.709        C   15 1.416    C   17 1.268    H   78 0.981
    17  C   3.826        C   21 1.406    C   16 1.268    S   18 1.132
    18  S   2.487        C   19 1.177    C   17 1.132
    19  C   3.824        C   20 1.363    C   26 1.282    S   18 1.177
    20  C   3.880        C   19 1.363    C   21 1.325    S   24 1.151
    21  C   3.773        C   17 1.406    C   20 1.325    C   22 1.005
    22  C   3.893        C   21 1.005    H   80 0.999    H   79 0.996    C   23 0.976
    23  C   3.918        H   83 1.009    H   81 1.003    H   82 0.992    C   22 0.976
    24  S   2.451        C   25 1.179    C   20 1.151
    25  C   3.881        C   26 1.358    C   31 1.288    S   24 1.179
    26  C   3.855        C   25 1.358    C   19 1.282    N   27 1.149
    27  N   3.051        C   26 1.149    C   30 1.145    C   28 0.965
    28  C   3.877        H   85 1.004    H   84 0.994    C   29 0.988    N   27 0.965
    29  C   3.883        H   87 1.008    H   86 1.001    H   88 0.994    C   28 0.988
    30  C   3.786        C   31 1.294    C   38 1.291    N   27 1.145
    31  C   3.854        C   30 1.294    C   25 1.288    C   32 1.219
    32  C   4.017        N   33 1.528    C   31 1.219    C   36 1.190
    33  N   2.940        C   32 1.528    S   34 1.368
    34  S   3.036        N   33 1.368    N   35 1.368
    35  N   2.954        C   36 1.539    S   34 1.368
    36  C   4.024        N   35 1.539    C   37 1.214    C   32 1.190
    37  C   3.862        C   43 1.309    C   38 1.282    C   36 1.214
    38  C   3.791        C   30 1.291    C   37 1.282    N   39 1.157
    39  N   3.087        C   38 1.157    C   42 1.152    C   40 0.974
    40  C   3.898        H   89 1.005    H   90 0.992    C   41 0.991    N   39 0.974
    41  C   3.890        H   91 1.004    H   93 0.997    H   92 0.994    C   40 0.991
    42  C   3.848        C   43 1.341    C   46 1.291    N   39 1.152
    43  C   3.892        C   42 1.341    C   37 1.309    S   44 1.185
    44  S   2.450        C   43 1.185    C   45 1.141
    45  C   3.870        C   49 1.382    C   46 1.333    S   44 1.141
    46  C   3.802        C   45 1.333    C   42 1.291    S   47 1.182
    47  S   2.613        C   46 1.182    C   48 1.137    O   67 0.147
    48  C   3.861        C   49 1.354    C   52 1.346    S   47 1.137
    49  C   3.761        C   45 1.382    C   48 1.354    C   50 1.012
    50  C   3.894        C   49 1.012    H   94 0.998    H   95 0.992    C   51 0.977
    51  C   3.915        H   96 1.003    H   98 0.998    H   97 0.995    C   50 0.977
    52  C   3.700        C   53 1.451    C   48 1.346    H   99 0.988
    53  C   3.798        C   52 1.451    C   54 1.205    C   66 1.102
    54  C   3.781        C   55 1.394    C   53 1.205    C   60 1.113
    55  C   3.729        C   54 1.394    C   56 1.173    C   58 1.171
    56  C   4.098        N   57 2.859    C   55 1.173
    57  N   2.881        C   56 2.859
    58  C   4.080        N   59 2.853    C   55 1.171
    59  N   2.825        C   58 2.853
    60  C   3.869        C   65 1.376    C   61 1.351    C   54 1.113
    61  C   3.782        C   62 1.541    C   60 1.351    H  100 0.903
    62  C   3.795        C   61 1.541    C   63 1.314    H  101 0.873
    63  C   3.888        C   62 1.314    C   75 1.309    C   64 1.269
    64  C   3.865        C   72 1.319    C   65 1.300    C   63 1.269
    65  C   3.837        C   60 1.376    C   64 1.300    C   66 1.087
    66  C   3.976        O   67 1.731    C   53 1.102    C   65 1.087
    67  O   2.076        C   66 1.731    S   47 0.147
    68  C   3.799        C   69 1.567    C    5 1.297    H  102 0.872    C   71 0.104
    69  C   3.827        C   68 1.567    C   70 1.308    H  103 0.907
    70  C   3.800        C   71 1.578    C   69 1.308    H  104 0.884
    71  C   3.765        C   70 1.578    C    4 1.169    H  105 0.838    C   68 0.104
    72  C   3.769        C   73 1.562    C   64 1.319    H  106 0.852
    73  C   3.833        C   72 1.562    C   74 1.338    H  107 0.908
    74  C   3.853        C   75 1.563    C   73 1.338    H  108 0.948
    75  C   3.824        C   74 1.563    C   63 1.309    H  109 0.916
    76  H   1.052        C    6 0.988
    77  H   1.061        C    7 0.996
    78  H   1.078        C   16 0.981
    79  H   1.035        C   22 0.996
    80  H   1.040        C   22 0.999
    81  H   1.053        C   23 1.003
    82  H   1.040        C   23 0.992
    83  H   1.067        C   23 1.009
    84  H   1.047        C   28 0.994
    85  H   1.041        C   28 1.004
    86  H   1.054        C   29 1.001
    87  H   1.049        C   29 1.008
    88  H   1.050        C   29 0.994
    89  H   1.054        C   40 1.005
    90  H   1.034        C   40 0.992
    91  H   1.030        C   41 1.004
    92  H   1.035        C   41 0.994
    93  H   1.049        C   41 0.997
    94  H   1.059        C   50 0.998
    95  H   1.045        C   50 0.992
    96  H   1.051        C   51 1.003
    97  H   1.053        C   51 0.995
    98  H   1.035        C   51 0.998
    99  H   1.064        C   52 0.988
   100  H   0.940        C   61 0.903
   101  H   0.957        C   62 0.873
   102  H   0.952        C   68 0.872
   103  H   0.958        C   69 0.907
   104  H   0.948        C   70 0.884
   105  H   0.991        C   71 0.838
   106  H   0.950        C   72 0.852
   107  H   0.949        C   73 0.908
   108  H   0.950        C   74 0.948
   109  H   0.968        C   75 0.916

 dipole moment from electron density (au)
     X       Y       Z   
  -9.4987 -31.5808  23.8546  total (Debye):  103.453


           -------------------------------------------------
          | TOTAL ENERGY             -215.493578976266 Eh   |
          | GRADIENT NORM               0.478784134208 Eh/α |
          | HOMO-LUMO GAP               0.201757903984 eV   |
           -------------------------------------------------

------------------------------------------------------------------------
 * finished run on 2021/12/02 at 16:29:24.036     
------------------------------------------------------------------------
 total:
 * wall-time:     0 d,  0 h,  0 min,  6.967 sec
 *  cpu-time:     0 d,  0 h,  0 min,  6.939 sec
 * ratio c/w:     0.996 speedup
 SCF:
 * wall-time:     0 d,  0 h,  0 min,  5.977 sec
 *  cpu-time:     0 d,  0 h,  0 min,  5.961 sec
 * ratio c/w:     0.997 speedup

