      -----------------------------------------------------------      
     |                   =====================                   |     
     |                           x T B                           |     
     |                   =====================                   |     
     |                         S. Grimme                         |     
     |          Mulliken Center for Theoretical Chemistry        |     
     |                    University of Bonn                     |     
     |                Version 6.2 RC2 (SAW190805)                |     
      -----------------------------------------------------------      

   This program is distributed in the hope that it will be useful,
   but WITHOUT ANY WARRANTY; without even the implied warranty of
   MERCHANTABILITY or FITNESS FOR A PARTICULAR PURPOSE.
   
   FOR NON-COMMERCIAL, ACADEMIA USE ONLY.
   
   Cite this work as:
   * S. Grimme, C. Bannwarth, P. Shushkov, J. Chem. Theory Comput., 2017,
     13, 1989-2009. DOI: 10.1021/acs.jctc.7b00118
   * C. Bannwarth, S. Ehlert and S. Grimme., J. Chem. Theory Comput., 2019,
     15, 1652-1671. DOI: 10.1021/acs.jctc.8b01176
   * P. Pracht, E. Caldeweyher, S. Ehlert, S. Grimme, ChemRxiv, 2019, preprint.
     DOI: 10.26434/chemrxiv.8326202.v1
   
   for DFT-D4:
   * E. Caldeweyher, C. Bannwarth and S. Grimme, J. Chem. Phys., 2017,
     147, 034112. DOI: 10.1063/1.4993215
   * E. Caldeweyher, S. Ehlert, A. Hansen, H. Neugebauer, S. Spicher,
     C. Bannwarth and S. Grimme, J. Chem. Phys., 2019, 150, 154122.
     DOI: 10.1063/1.5090222
   
   for sTDA-xTB:
   * S. Grimme and C. Bannwarth, J. Chem. Phys., 2016, 145, 054103.
     DOI: 10.1063/1.4959605
   
   in the mass-spec context:
   * V. Asgeirsson, C. Bauer and S. Grimme, Chem. Sci., 2017, 8, 4879.
     DOI: 10.1039/c7sc00601b
   
   for metadynamics refer to:
   * S. Grimme, J. Chem. Theory Comput., 2019, 155, 2847-2862
     DOI: 10.1021/acs.jctc.9b00143
   
   with help from (in alphabetical order)
   C. Bannwarth, F. Bohle, G. Brandenburg, E. Caldeweyher, M. Checinski,
   S. Dohm, S. Ehlert, S. Ehrlich, F. März, H. Neugebauer, J. Pisarek,
   P. Pracht, P. Shushkov, and S. Spicher.
   
 * started run on 2021/12/02 at 16:29:43.800     

           -------------------------------------------------
          |                Calculation Setup                |
           -------------------------------------------------

          program call               : /ihome/ghutchison/geoffh/xtb/xtb BT-IC4F.xyz --vipea
          hostname                   : smp-n128
          coordinate file            : BT-IC4F.xyz
          omp threads                :                     1
          number of atoms            :                   107
          number of electrons        :                   364
          charge                     :                     0
          spin                       :                   0.0
          first test random number   :      0.75765400165719


########################################################################
# WARNING! Please study the warnings concerning your input carefully
#  - XTBPATH is not set, using XTBHOME instead
########################################################################

           ------------------------------------------------- 
          |                 I P E A - x T B                 |
          |  Ionisation Potentials and Electron Affinities  |
           ------------------------------------------------- 
             KAB for M(3d)-M(3d) :                1.1000
             KAB for M(4d)-M(4d) :                1.2000
             KAB for M(5d)-M(5d) :                1.2000
             k(s)                :                2.1500
             k(p)                :                2.3000
             k(d)                :                2.0000
             k(f)                :                0.0000
             kEN (H0ij)          :                0.7000
             D3 a1               :                0.6300
             D3 a2               :                5.0000
             D3 s6               :                1.0000
             D3 s8               :                2.4000
             D3 s9               :                0.0000
             alphaj              :                1.0000
             XBdamp              :                0.4400
             XBrad               :                1.3000
             kcnsh               :      1.0000   -0.3000   -0.5000    0.5000

  Z AO/shell   Hii/eV     exponent
  1     Thu Sep 22 23:34:11 CEST 2016   EN: 2.200 GAM: 0.405  GM3: 0.1500
     1s    -10.521941    1.306199
     2s     -3.560151    0.398421
  6     Thu Sep 22 23:34:11 CEST 2016   EN: 2.550 GAM: 0.640  GM3: 0.1500
     2s    -15.968100    1.979793
     2p     -9.777107    1.850537
     3S     -3.366990    0.633095
  7     Thu Sep 22 23:34:11 CEST 2016   EN: 3.040 GAM: 0.493  GM3:-0.1000
     2s    -24.040776    2.126160
     2p    -14.426520    2.068425
     3S     -5.882278    0.671040
  8     Thu Sep 22 23:34:11 CEST 2016   EN: 3.440 GAM: 0.717  GM3:-0.2000
     2s    -26.695120    2.575264
     2p    -16.014457    2.159448
     3S     -6.622058    0.958679
  9     Tue Jan 17 20:22:52 CET 2017    EN: 3.980 GAM: 0.574  GM3: 0.2000
     2s    -27.565998    2.304073
     2p    -17.439238    2.314354
     3S     -6.120500    0.570243
 16     Tue Jan 17 20:57:36 CET 2017    EN: 2.580 GAM: 0.455  GM3: 0.1020
     3s    -24.488821    2.492075
     3p    -12.136640    1.997904
     3d     -1.796070    1.747541

           ------------------------------------------------- 
          |        Self-Consistent Charge Iterations        |
           ------------------------------------------------- 

          ...................................................
          :                      SETUP                      :
          :.................................................:
          :  # basis functions                 464          :
          :  # atomic orbitals                 459          :
          :  # shells                          289          :
          :  # electrons                       364          :
          :  # halogen bonds                     0          :
          :  max. iterations                   250          :
          :  Hamiltonian                  GFN1-xTB          :
          :  restarted?                      false          :
          :  GBSA solvation                  false          :
          :  PC potential                    false          :
          :  electronic temp.          300.0000000     K    :
          :  accuracy                    1.0000000          :
          :  -> integral cutoff          0.2500000E+02      :
          :  -> integral neglect         0.1000000E-07      :
          :  -> SCF convergence          0.1000000E-05 Eh   :
          :  -> wf. convergence          0.2000000E-04 e    :
          :  Broyden damping             0.4000000          :
          ...................................................

 iter      E             dE          RMSdq      gap      omega  full diag
   1   -227.4723213 -0.227472E+03  0.109E+01    0.17       0.0  T
   2   -225.4385642  0.203376E+01  0.683E+00    0.06       1.0  T
   3   -199.9156187  0.255229E+02  0.693E+00    0.26       1.0  T
   4   -171.3959144  0.285197E+02  0.763E+00    0.03       1.0  T
   5   -226.7743726 -0.553785E+02  0.243E+00    0.44       1.0  T
   6   -229.3135832 -0.253921E+01  0.124E+00    0.13       1.0  T
   7   -229.5262484 -0.212665E+00  0.802E-01    0.45       1.0  T
   8   -229.4932464  0.330020E-01  0.573E-01    0.04       1.0  T
   9   -229.5115952 -0.183488E-01  0.604E-01    0.33       1.0  T
  10   -229.3971987  0.114396E+00  0.698E-01    0.09       1.0  T
  11   -229.5312887 -0.134090E+00  0.449E-01    0.32       1.0  T
  12   -229.5458466 -0.145579E-01  0.298E-01    0.20       1.0  T
  13   -229.5462514 -0.404839E-03  0.246E-01    0.15       1.0  T
  14   -229.5501721 -0.392072E-02  0.208E-01    0.16       1.0  T
  15   -229.5413043  0.886780E-02  0.251E-01    0.14       1.0  T
  16   -229.5208544  0.204499E-01  0.302E-01    0.03       1.0  T
  17   -229.5580338 -0.371795E-01  0.102E-01    0.19       1.0  T
  18   -229.5607798 -0.274599E-02  0.523E-02    0.11       1.0  T
  19   -229.5615498 -0.770010E-03  0.285E-02    0.11       1.0  T
  20   -229.5617963 -0.246474E-03  0.187E-02    0.13       1.0  T
  21   -229.5618366 -0.402444E-04  0.134E-02    0.12       1.0  T
  22   -229.5618167  0.198916E-04  0.145E-02    0.12       1.0  T
  23   -229.5618444 -0.277780E-04  0.819E-03    0.13       1.2  T
  24   -229.5618800 -0.355156E-04  0.191E-03    0.12       5.1  T
  25   -229.5618816 -0.168689E-05  0.120E-03    0.12       8.0  T
  26   -229.5618817 -0.807892E-07  0.786E-04    0.12      12.3  T
  27   -229.5618816  0.818060E-07  0.126E-03    0.12       7.7  T
  28   -229.5618818 -0.182728E-06  0.981E-04    0.12       9.9  T
  29   -229.5618821 -0.276397E-06  0.349E-04    0.12      27.7  T
  30   -229.5618821 -0.124541E-08  0.312E-04    0.12      31.0  T
  31   -229.5618821 -0.361768E-07  0.271E-05    0.12     356.4  T
  32   -229.5618821  0.287685E-09  0.366E-05    0.12     264.1  T

   *** convergence criteria satisfied after 32 iterations ***

         #    Occupation            Energy/Eh            Energy/eV
      -------------------------------------------------------------
         1        2.0000           -1.0752767             -29.2598
       ...           ...                  ...                  ...
       176        2.0000           -0.3576257              -9.7315
       177        2.0000           -0.3563525              -9.6968
       178        2.0000           -0.3546442              -9.6504
       179        2.0000           -0.3508958              -9.5484
       180        2.0000           -0.3406485              -9.2695
       181        1.9830           -0.3147665              -8.5652
       182        1.8409           -0.3125696              -8.5055 (HOMO)
       183        0.1756           -0.3080193              -8.3816 (LUMO)
       184        0.0005           -0.3023182              -8.2265
       185        0.0000           -0.2955236              -8.0416
       186                         -0.2901957              -7.8966
       187                         -0.2866913              -7.8013
       ...                                ...                  ...
       459                        699.8101530           19042.8035
      -------------------------------------------------------------
                  HL-Gap            0.0045504 Eh            0.1238 eV
             Fermi-level           -0.3102433 Eh           -8.4422 eV

 SCC (total)                   0 d,  0 h,  0 min,  2.233 sec
 SCC setup                      ...        0 min,  0.004 sec (  0.201%)
 Dispersion                     ...        0 min,  0.000 sec (  0.016%)
 integral evaluation            ...        0 min,  0.857 sec ( 38.352%)
 zeroth order Hamiltonian       ...        0 min,  0.003 sec (  0.155%)
 iterations                     ...        0 min,  1.109 sec ( 49.637%)
 molecular gradient             ...        0 min,  0.253 sec ( 11.313%)
 printout                       ...        0 min,  0.007 sec (  0.323%)

         :::::::::::::::::::::::::::::::::::::::::::::::::::::
         ::                     SUMMARY                     ::
         :::::::::::::::::::::::::::::::::::::::::::::::::::::
         :: total energy            -225.640936242492 Eh    ::
         :: gradient norm              0.440951407328 Eh/a0 ::
         :: HOMO-LUMO gap              0.123821798572 eV    ::
         ::.................................................::
         :: SCC energy              -229.561882142877 Eh    ::
         :: -> electrostatic           0.465378586903 Eh    ::
         :: repulsion energy           4.017098499978 Eh    ::
         :: dispersion energy         -0.096152599593 Eh    ::
         :: halogen bond corr.         0.000000000000 Eh    ::
         :: add. restraining           0.000000000000 Eh    ::
         :::::::::::::::::::::::::::::::::::::::::::::::::::::

           ------------------------------------------------- 
          |        vertical delta SCC IP calculation        |
           ------------------------------------------------- 

          ...................................................
          :                      SETUP                      :
          :.................................................:
          :  # basis functions                 464          :
          :  # atomic orbitals                 459          :
          :  # shells                          289          :
          :  # electrons                       363          :
          :  # halogen bonds                     0          :
          :  max. iterations                   250          :
          :  Hamiltonian                  GFN1-xTB          :
          :  restarted?                       true          :
          :  GBSA solvation                  false          :
          :  PC potential                    false          :
          :  electronic temp.          300.0000000     K    :
          :  accuracy                    1.0000000          :
          :  -> integral cutoff          0.2500000E+02      :
          :  -> integral neglect         0.1000000E-07      :
          :  -> SCF convergence          0.1000000E-05 Eh   :
          :  -> wf. convergence          0.2000000E-04 e    :
          :  Broyden damping             0.4000000          :
          ...................................................

 iter      E             dE          RMSdq      gap      omega  full diag
   1   -229.1734811 -0.229173E+03  0.335E-01    0.12       0.0  T
   2   -229.1399806  0.335005E-01  0.441E-01    0.53       1.0  T
   3   -229.1454043 -0.542365E-02  0.409E-01    0.50       1.0  T
   4   -229.1699321 -0.245279E-01  0.306E-01    0.56       1.0  T
   5   -229.1592544  0.106777E-01  0.362E-01    0.45       1.0  T
   6   -229.1692006 -0.994622E-02  0.313E-01    0.45       1.0  T
   7   -229.1802258 -0.110252E-01  0.272E-01    0.49       1.0  T
   8   -229.2084067 -0.281809E-01  0.766E-02    0.51       1.0  T
   9   -229.2030734  0.533328E-02  0.133E-01    0.50       1.0  T
  10   -229.2107159 -0.764252E-02  0.223E-02    0.53       1.0  T
  11   -229.2109260 -0.210110E-03  0.193E-03    0.53       5.0  T
  12   -229.2109253  0.745460E-06  0.219E-03    0.53       4.4  T
  13   -229.2109271 -0.186593E-05  0.365E-04    0.53      26.5  T
  14   -229.2109271 -0.254533E-08  0.257E-04    0.53      37.6  T
  15   -229.2109270  0.904078E-07  0.503E-04    0.53      19.2  T
  16   -229.2109272 -0.111914E-06  0.611E-05    0.53     158.2  T
  17   -229.2109272  0.943203E-09  0.721E-05    0.53     134.1  T

   *** convergence criteria satisfied after 17 iterations ***

         #    Occupation            Energy/Eh            Energy/eV
      -------------------------------------------------------------
         1        2.0000           -1.1526274             -31.3646
       ...           ...                  ...                  ...
       176        2.0000           -0.4396573             -11.9637
       177        2.0000           -0.4288417             -11.6694
       178        2.0000           -0.4261125             -11.5951
       179        2.0000           -0.4202477             -11.4355
       180        2.0000           -0.4122176             -11.2170
       181        1.5813           -0.3952270             -10.7547
       182        1.4186           -0.3946032             -10.7377 (HOMO)
       183        0.0000           -0.3752671             -10.2115 (LUMO)
       184                         -0.3627675              -9.8714
       185                         -0.3625909              -9.8666
       186                         -0.3543595              -9.6426
       187                         -0.3462773              -9.4227
       ...                                ...                  ...
       459                        699.7438717           19040.9999
      -------------------------------------------------------------
                  HL-Gap            0.0193360 Eh            0.5262 eV
             Fermi-level           -0.3898259 Eh          -10.6077 eV

 SCC (total)                   0 d,  0 h,  0 min,  1.705 sec
 SCC setup                      ...        0 min,  0.004 sec (  0.218%)
 Dispersion                     ...        0 min,  0.000 sec (  0.011%)
 integral evaluation            ...        0 min,  0.855 sec ( 50.120%)
 zeroth order Hamiltonian       ...        0 min,  0.003 sec (  0.179%)
 iterations                     ...        0 min,  0.586 sec ( 34.399%)
 molecular gradient             ...        0 min,  0.252 sec ( 14.787%)
 printout                       ...        0 min,  0.005 sec (  0.282%)

         :::::::::::::::::::::::::::::::::::::::::::::::::::::
         ::                     SUMMARY                     ::
         :::::::::::::::::::::::::::::::::::::::::::::::::::::
         :: total energy            -225.289981250890 Eh    ::
         :: gradient norm              0.434676276585 Eh/a0 ::
         :: HOMO-LUMO gap              0.526159382076 eV    ::
         ::.................................................::
         :: SCC energy              -229.210927151275 Eh    ::
         :: -> electrostatic           0.505789845746 Eh    ::
         :: repulsion energy           4.017098499978 Eh    ::
         :: dispersion energy         -0.096152599593 Eh    ::
         :: halogen bond corr.         0.000000000000 Eh    ::
         :: add. restraining           0.000000000000 Eh    ::
         :::::::::::::::::::::::::::::::::::::::::::::::::::::

------------------------------------------------------------------------
empirical IP shift (eV):    4.8455
delta SCC IP (eV):    4.7045
------------------------------------------------------------------------
           ------------------------------------------------- 
          |        vertical delta SCC EA calculation        |
           ------------------------------------------------- 

          ...................................................
          :                      SETUP                      :
          :.................................................:
          :  # basis functions                 464          :
          :  # atomic orbitals                 459          :
          :  # shells                          289          :
          :  # electrons                       365          :
          :  # halogen bonds                     0          :
          :  max. iterations                   250          :
          :  Hamiltonian                  GFN1-xTB          :
          :  restarted?                       true          :
          :  GBSA solvation                  false          :
          :  PC potential                    false          :
          :  electronic temp.          300.0000000     K    :
          :  accuracy                    1.0000000          :
          :  -> integral cutoff          0.2500000E+02      :
          :  -> integral neglect         0.1000000E-07      :
          :  -> SCF convergence          0.1000000E-05 Eh   :
          :  -> wf. convergence          0.2000000E-04 e    :
          :  Broyden damping             0.4000000          :
          ...................................................

 iter      E             dE          RMSdq      gap      omega  full diag
   1   -229.7816795 -0.229782E+03  0.394E-01    0.34       0.0  T
   2   -229.1683409  0.613339E+00  0.113E+00    0.09       1.0  T
   3   -229.7967237 -0.628383E+00  0.315E-01    0.27       1.0  T
   4   -229.8148149 -0.180913E-01  0.222E-01    0.14       1.0  T
   5   -229.7988740  0.159410E-01  0.253E-01    0.25       1.0  T
   6   -229.8342219 -0.353479E-01  0.881E-02    0.11       1.0  T
   7   -229.8341204  0.101465E-03  0.733E-02    0.08       1.0  T
   8   -229.8340633  0.571361E-04  0.735E-02    0.09       1.0  T
   9   -229.8358428 -0.177950E-02  0.312E-02    0.09       1.0  T
  10   -229.8362513 -0.408525E-03  0.149E-02    0.10       1.0  T
  11   -229.8363228 -0.715099E-04  0.106E-02    0.10       1.0  T
  12   -229.8363635 -0.406448E-04  0.510E-03    0.10       1.9  T
  13   -229.8363816 -0.181372E-04  0.215E-03    0.10       4.5  T
  14   -229.8363823 -0.686763E-06  0.120E-03    0.10       8.0  T
  15   -229.8363830 -0.749052E-06  0.390E-04    0.10      24.8  T
  16   -229.8363831 -0.382767E-07  0.213E-04    0.10      45.4  T
  17   -229.8363831 -0.145652E-07  0.118E-04    0.10      81.6  T
  18   -229.8363831 -0.473725E-08  0.292E-05    0.10     331.5  T

   *** convergence criteria satisfied after 18 iterations ***

         #    Occupation            Energy/Eh            Energy/eV
      -------------------------------------------------------------
         1        2.0000           -1.0071884             -27.4070
       ...           ...                  ...                  ...
       177        2.0000           -0.2911900              -7.9237
       178        2.0000           -0.2902199              -7.8973
       179        2.0000           -0.2876830              -7.8283
       180        2.0000           -0.2812733              -7.6538
       181        1.9780           -0.2473684              -6.7312
       182        1.9569           -0.2467097              -6.7133
       183        0.9316           -0.2411866              -6.5630 (HOMO)
       184        0.1331           -0.2375983              -6.4654 (LUMO)
       185        0.0004           -0.2319047              -6.3104
       186        0.0000           -0.2276330              -6.1942
       187                         -0.2199037              -5.9839
       188                         -0.1961325              -5.3370
       ...                                ...                  ...
       459                        699.8710422           19044.4604
      -------------------------------------------------------------
                  HL-Gap            0.0035884 Eh            0.0976 eV
             Fermi-level           -0.2415724 Eh           -6.5735 eV

 SCC (total)                   0 d,  0 h,  0 min,  1.745 sec
 SCC setup                      ...        0 min,  0.005 sec (  0.264%)
 Dispersion                     ...        0 min,  0.000 sec (  0.012%)
 integral evaluation            ...        0 min,  0.857 sec ( 49.136%)
 zeroth order Hamiltonian       ...        0 min,  0.003 sec (  0.193%)
 iterations                     ...        0 min,  0.622 sec ( 35.666%)
 molecular gradient             ...        0 min,  0.252 sec ( 14.443%)
 printout                       ...        0 min,  0.005 sec (  0.281%)

         :::::::::::::::::::::::::::::::::::::::::::::::::::::
         ::                     SUMMARY                     ::
         :::::::::::::::::::::::::::::::::::::::::::::::::::::
         :: total energy            -225.915437198956 Eh    ::
         :: gradient norm              0.452428425402 Eh/a0 ::
         :: HOMO-LUMO gap              0.097644150798 eV    ::
         ::.................................................::
         :: SCC energy              -229.836383099342 Eh    ::
         :: -> electrostatic           0.499011260892 Eh    ::
         :: repulsion energy           4.017098499978 Eh    ::
         :: dispersion energy         -0.096152599593 Eh    ::
         :: halogen bond corr.         0.000000000000 Eh    ::
         :: add. restraining           0.000000000000 Eh    ::
         :::::::::::::::::::::::::::::::::::::::::::::::::::::

------------------------------------------------------------------------
empirical EA shift (eV):    4.8455
delta SCC EA (eV):    2.6240
------------------------------------------------------------------------
           -------------------------------------------------
          |                Property Printout                |
           -------------------------------------------------

    * Orbital Energies and Occupations

         #    Occupation            Energy/Eh            Energy/eV
      -------------------------------------------------------------
         1        2.0000           -1.0071884             -27.4070
       ...           ...                  ...                  ...
       171        2.0000           -0.3436332              -9.3507
       172        2.0000           -0.3393670              -9.2346
       173        2.0000           -0.3361029              -9.1458
       174        2.0000           -0.3298784              -8.9764
       175        2.0000           -0.3120455              -8.4912
       176        2.0000           -0.2930950              -7.9755
       177        2.0000           -0.2911900              -7.9237
       178        2.0000           -0.2902199              -7.8973
       179        2.0000           -0.2876830              -7.8283
       180        2.0000           -0.2812733              -7.6538
       181        1.9780           -0.2473684              -6.7312
       182        1.9569           -0.2467097              -6.7133
       183        0.9316           -0.2411866              -6.5630 (HOMO)
       184        0.1331           -0.2375983              -6.4654 (LUMO)
       185        0.0004           -0.2319047              -6.3104
       186        0.0000           -0.2276330              -6.1942
       187                         -0.2199037              -5.9839
       188                         -0.1961325              -5.3370
       189                         -0.1829797              -4.9791
       190                         -0.1663549              -4.5267
       191                         -0.1651456              -4.4938
       192                         -0.1562818              -4.2526
       193                         -0.1542181              -4.1965
       194                         -0.1480350              -4.0282
       ...                                ...                  ...
       459                        699.8710422           19044.4604
      -------------------------------------------------------------
                  HL-Gap            0.0035884 Eh            0.0976 eV
             Fermi-level           -0.2415724 Eh           -6.5735 eV

  Mulliken/CM5 charges        n(s)   n(p)   n(d)
     1 S  -0.46680 -0.32809   0.684  1.873  2.976
     2 N  -0.38477 -0.55248   1.239  3.376  0.000
     3 C  -0.34837 -0.26173   1.042  2.610  0.000
     4 C   0.06083  0.14746   1.101  2.960  0.000
     5 N   0.39911  0.23140   1.409  3.990  0.000
     6 C   0.13421  0.13598   1.046  3.089  0.000
     7 C   0.05724  0.00411   1.056  3.002  0.000
     8 C   0.06019  0.00706   1.049  3.011  0.000
     9 C   0.03139  0.03317   1.067  2.965  0.000
    10 C  -0.00741  0.00301   1.150  2.843  0.000
    11 C   0.02325  0.03366   1.144  2.879  0.000
    12 C   0.04122 -0.00935   1.033  3.009  0.000
    13 C   0.01403  0.00872   1.058  2.956  0.000
    14 C   0.00549  0.01965   1.125  2.880  0.000
    15 S   0.18864  0.16015   1.873  4.131  0.185
    16 C  -0.02307 -0.04034   1.085  2.892  0.000
    17 C   0.01098  0.00535   1.073  2.938  0.000
    18 C  -0.00680  0.00772   1.143  2.850  0.000
    19 C   0.03160 -0.01739   1.060  2.972  0.000
    20 C  -0.00810 -0.00302   1.150  2.842  0.000
    21 S   0.08219  0.04699   1.877  4.138  0.067
    22 C   0.04389 -0.00618   1.060  2.983  0.000
    23 C   0.01038  0.00471   1.095  2.915  0.000
    24 C   0.00567  0.01977   1.146  2.859  0.000
    25 S   0.09326  0.06480   1.883  4.104  0.106
    26 C   0.00295 -0.01432   1.098  2.905  0.000
    27 C   0.01749  0.01223   1.084  2.933  0.000
    28 C  -0.01330  0.00124   1.158  2.829  0.000
    29 C   0.03774 -0.01181   1.076  2.961  0.000
    30 C   0.00864  0.01382   1.155  2.853  0.000
    31 S   0.10228  0.06716   1.878  4.154  0.070
    32 C   0.02056 -0.02652   1.069  2.952  0.000
    33 C   0.03013  0.02766   1.051  2.980  0.000
    34 C  -0.01014 -0.01091   1.085  2.905  0.000
    35 C  -0.00681 -0.00988   1.071  2.922  0.000
    36 C   0.00851  0.00691   1.087  2.921  0.000
    37 C  -0.14677 -0.11209   1.158  2.695  0.000
    38 C   0.01780 -0.02946   1.071  2.947  0.000
    39 C  -0.11333 -0.09681   1.143  2.743  0.000
    40 C  -0.10829 -0.09161   1.136  2.756  0.000
    41 C   0.01550 -0.03173   1.080  2.936  0.000
    42 C   0.00130  0.00736   1.028  2.973  0.000
    43 O   0.33584  0.28014   1.637  4.699  0.000
    44 C  -0.10589  0.01325   1.204  2.690  0.000
    45 C  -0.10640  0.01103   1.207  2.687  0.000
    46 N   0.29764  0.16729   1.526  3.771  0.000
    47 N   0.29899  0.16899   1.529  3.770  0.000
    48 F   0.17188  0.14863   1.695  5.477  0.000
    49 F   0.17654  0.15354   1.696  5.480  0.000
    50 C   0.02708 -0.07998   1.079  2.949  0.000
    51 C   0.02531 -0.08214   1.067  2.958  0.000
    52 C   0.05966 -0.09298   1.062  2.998  0.000
    53 C   0.06025 -0.09108   1.068  2.993  0.000
    54 C   0.05207 -0.05484   1.088  2.964  0.000
    55 C   0.18954  0.08209   1.046  3.144  0.000
    56 C   0.12006  0.07300   1.069  3.051  0.000
    57 C   0.04600  0.04357   1.058  2.988  0.000
    58 C   0.00061 -0.00013   1.105  2.896  0.000
    59 C   0.01782  0.01474   1.076  2.942  0.000
    60 C   0.03344  0.03183   1.091  2.943  0.000
    61 C  -0.13308 -0.09842   1.170  2.697  0.000
    62 C   0.14411  0.09685   1.050  3.094  0.000
    63 C  -0.08909 -0.07256   1.159  2.752  0.000
    64 C  -0.08644 -0.06977   1.149  2.764  0.000
    65 C   0.13054  0.08330   1.073  3.057  0.000
    66 O   0.35799  0.30260   1.643  4.715  0.000
    67 C   0.01718  0.02330   1.029  2.988  0.000
    68 C  -0.09663  0.02253   1.213  2.690  0.000
    69 C  -0.09409  0.02377   1.212  2.694  0.000
    70 N   0.30972  0.18005   1.527  3.782  0.000
    71 N   0.31091  0.18080   1.527  3.784  0.000
    72 F   0.19858  0.17558   1.704  5.494  0.000
    73 F   0.19659  0.17334   1.705  5.492  0.000
    74 C   0.60924  0.45792   0.917  3.692  0.000
    75 C   0.58907  0.43631   0.881  3.708  0.000
    76 H  -0.01739  0.04122   0.983  0.000  0.000
    77 H  -0.01240  0.04622   0.988  0.000  0.000
    78 H  -0.02431  0.03453   0.976  0.000  0.000
    79 H  -0.03688  0.03435   0.963  0.000  0.000
    80 H  -0.00570  0.05281   0.994  0.000  0.000
    81 H   0.00299  0.07341   1.003  0.000  0.000
    82 H  -0.02405  0.04556   0.976  0.000  0.000
    83 H  -0.03461  0.03060   0.965  0.000  0.000
    84 H  -0.04193  0.01773   0.958  0.000  0.000
    85 H  -0.01167  0.04564   0.988  0.000  0.000
    86 H  -0.01934  0.03763   0.981  0.000  0.000
    87 H  -0.01747  0.03981   0.983  0.000  0.000
    88 H  -0.02260  0.03417   0.977  0.000  0.000
    89 H  -0.00907  0.04481   0.991  0.000  0.000
    90 H  -0.01277  0.03903   0.987  0.000  0.000
    91 H  -0.01389  0.03909   0.986  0.000  0.000
    92 H  -0.00565  0.04844   0.994  0.000  0.000
    93 H  -0.00829  0.04350   0.992  0.000  0.000
    94 H  -0.01176  0.04239   0.988  0.000  0.000
    95 H   0.03840  0.09514   1.038  0.000  0.000
    96 H   0.03652  0.09376   1.037  0.000  0.000
    97 H   0.03744  0.09407   1.037  0.000  0.000
    98 H  -0.26656 -0.20908   0.733  0.000  0.000
    99 H  -0.29127 -0.22281   0.709  0.000  0.000
   100 H  -0.31307 -0.24813   0.687  0.000  0.000
   101 H  -0.28569 -0.22606   0.714  0.000  0.000
   102 H  -0.27117 -0.21701   0.729  0.000  0.000
   103 H  -0.26114 -0.20935   0.739  0.000  0.000
   104 H  -0.25111 -0.19700   0.749  0.000  0.000
   105 H  -0.24821 -0.19517   0.752  0.000  0.000
   106 H  -0.29065 -0.23883   0.709  0.000  0.000
   107 H  -0.28426 -0.22936   0.716  0.000  0.000
(R)spin-density population

 Mulliken population n(s)   n(p)   n(d)
     1 S   0.0444   0.008  0.002  0.035
     2 N   0.1026   0.013  0.090  0.000
     3 C   0.0135   0.005  0.008  0.000
     4 C   0.0202   0.001  0.019  0.000
     5 N   0.0161   0.000  0.016  0.000
     6 C   0.0042   0.003  0.001  0.000
     7 C   0.0027   0.000  0.003  0.000
     8 C   0.0008  -0.000  0.001  0.000
     9 C   0.0038   0.000  0.004  0.000
    10 C   0.0132  -0.000  0.013  0.000
    11 C   0.0287   0.001  0.027  0.000
    12 C   0.0004  -0.000  0.001  0.000
    13 C   0.0236  -0.000  0.024  0.000
    14 C   0.0086   0.001  0.008  0.000
    15 S   0.0279   0.001  0.013  0.015
    16 C   0.0001  -0.000  0.000  0.000
    17 C   0.0006  -0.000  0.001  0.000
    18 C   0.0407   0.000  0.041  0.000
    19 C   0.0343   0.000  0.034  0.000
    20 C   0.0040   0.000  0.004  0.000
    21 S   0.0260   0.000  0.022  0.004
    22 C   0.0021   0.000  0.002  0.000
    23 C   0.0121   0.000  0.012  0.000
    24 C   0.0017   0.000  0.002  0.000
    25 S   0.0077   0.000  0.006  0.002
    26 C   0.0016   0.000  0.001  0.000
    27 C   0.0005   0.000  0.000  0.000
    28 C   0.0208  -0.000  0.021  0.000
    29 C   0.0189  -0.000  0.019  0.000
    30 C   0.0019  -0.000  0.002  0.000
    31 S   0.0126   0.000  0.010  0.002
    32 C   0.0587   0.000  0.059  0.000
    33 C   0.0129   0.000  0.013  0.000
    34 C   0.0487  -0.000  0.049  0.000
    35 C   0.0021   0.000  0.002  0.000
    36 C   0.0093   0.000  0.009  0.000
    37 C   0.0017   0.000  0.002  0.000
    38 C   0.0149   0.000  0.015  0.000
    39 C   0.0004   0.000  0.000  0.000
    40 C   0.0140   0.000  0.014  0.000
    41 C   0.0028   0.000  0.003  0.000
    42 C   0.0418  -0.000  0.042  0.000
    43 O   0.0018   0.000  0.002  0.000
    44 C   0.0060  -0.000  0.006  0.000
    45 C   0.0058   0.000  0.006  0.000
    46 N   0.0207  -0.000  0.021  0.000
    47 N   0.0211   0.000  0.021  0.000
    48 F   0.0000   0.000  0.000  0.000
    49 F   0.0018  -0.000  0.002  0.000
    50 C   0.0016   0.001  0.001  0.000
    51 C   0.0005   0.000  0.000  0.000
    52 C   0.0001   0.000  0.000  0.000
    53 C   0.0001   0.000  0.000  0.000
    54 C   0.0008   0.000  0.001  0.000
    55 C   0.0073   0.000  0.007  0.000
    56 C   0.0322  -0.000  0.032  0.000
    57 C   0.0044  -0.000  0.004  0.000
    58 C   0.0450   0.000  0.045  0.000
    59 C   0.0024   0.000  0.002  0.000
    60 C   0.0110   0.000  0.011  0.000
    61 C   0.0016   0.000  0.002  0.000
    62 C   0.0104  -0.000  0.010  0.000
    63 C   0.0006  -0.000  0.001  0.000
    64 C   0.0114   0.000  0.011  0.000
    65 C   0.0002   0.000  0.000  0.000
    66 O   0.0016   0.000  0.002  0.000
    67 C   0.0274   0.000  0.027  0.000
    68 C   0.0055   0.000  0.005  0.000
    69 C   0.0053   0.000  0.005  0.000
    70 N   0.0155   0.000  0.015  0.000
    71 N   0.0153   0.000  0.015  0.000
    72 F   0.0014  -0.000  0.001  0.000
    73 F   0.0001  -0.000  0.000  0.000
    74 C   0.0212   0.000  0.021  0.000
    75 C   0.0031  -0.000  0.003  0.000
    76 H   0.0001   0.000  0.000  0.000
    77 H  -0.0000  -0.000  0.000  0.000
    78 H   0.0003   0.000  0.000  0.000
    79 H   0.0000   0.000  0.000  0.000
    80 H   0.0001   0.000  0.000  0.000
    81 H   0.0000   0.000  0.000  0.000
    82 H   0.0000   0.000  0.000  0.000
    83 H   0.0000   0.000  0.000  0.000
    84 H   0.0000   0.000  0.000  0.000
    85 H   0.0003   0.000  0.000  0.000
    86 H   0.0002   0.000  0.000  0.000
    87 H  -0.0000  -0.000  0.000  0.000
    88 H   0.0000   0.000  0.000  0.000
    89 H   0.0001   0.000  0.000  0.000
    90 H   0.0002   0.000  0.000  0.000
    91 H   0.0000   0.000  0.000  0.000
    92 H   0.0000   0.000  0.000  0.000
    93 H   0.0000   0.000  0.000  0.000
    94 H   0.0000   0.000  0.000  0.000
    95 H   0.0000   0.000  0.000  0.000
    96 H   0.0005   0.000  0.000  0.000
    97 H   0.0006   0.001  0.000  0.000
    98 H   0.0021   0.002  0.000  0.000
    99 H   0.0000   0.000  0.000  0.000
   100 H   0.0000   0.000  0.000  0.000
   101 H   0.0000   0.000  0.000  0.000
   102 H   0.0056   0.006  0.000  0.000
   103 H   0.0017   0.002  0.000  0.000
   104 H   0.0006   0.001  0.000  0.000
   105 H   0.0004   0.000  0.000  0.000
   106 H   0.0003   0.000  0.000  0.000
   107 H   0.0001   0.000  0.000  0.000

Wiberg/Mayer (AO) data.
largest (>0.10) Wiberg bond orders for each atom
          total WBO             WBO to atom ...
     1  S   3.727        N    2 1.641    N    5 1.413    C    3 0.307    C    6 0.127
     2  N   3.549        S    1 1.641    C    3 1.448    S   15 0.208    C    6 0.108
     3  C   4.241        N    2 1.448    C    4 1.160    C    6 1.137    S    1 0.307
     4  C   3.829        C    9 1.300    N    5 1.179    C    3 1.160
     5  N   2.815        S    1 1.413    C    4 1.179
     6  C   3.809        C    7 1.261    C   11 1.186    C    3 1.137    S    1 0.127    N    2 0.108
     7  C   3.837        C    8 1.499    C    6 1.261    H   76 0.984
     8  C   3.818        C    7 1.499    C    9 1.306    H   77 0.989
     9  C   3.851        C    8 1.306    C    4 1.300    C   10 1.195
    10  C   3.862        C   22 1.456    C    9 1.195    S   25 1.191
    11  C   3.851        C   12 1.433    C    6 1.186    S   15 1.145
    12  C   3.738        C   11 1.433    C   13 1.403    H   78 0.997
    13  C   3.740        C   12 1.403    C   14 1.369    C   16 1.010
    14  C   3.834        C   13 1.369    C   18 1.257    S   15 1.150
    15  S   2.706        C   14 1.150    C   11 1.145    N    2 0.208
    16  C   3.882        C   13 1.010    C   17 1.001    C   51 0.976    C   50 0.965
    17  C   3.810        C   19 1.465    C   18 1.333    C   16 1.001
    18  C   3.846        C   17 1.333    C   14 1.257    S   21 1.226
    19  C   3.736        C   17 1.465    C   20 1.352    H   79 0.988
    20  C   3.904        C   32 1.365    C   19 1.352    S   21 1.122
    21  S   2.460        C   18 1.226    C   20 1.122
    22  C   3.812        C   10 1.456    C   23 1.392    H   80 0.996
    23  C   3.810        C   22 1.392    C   24 1.371    C   26 1.009
    24  C   3.916        C   23 1.371    C   28 1.259    S   25 1.197
    25  S   2.576        C   24 1.197    C   10 1.191
    26  C   3.870        C   27 1.016    C   23 1.009    C   55 0.962    C   54 0.940
    27  C   3.822        C   29 1.450    C   28 1.334    C   26 1.016
    28  C   3.890        C   27 1.334    C   24 1.259    S   31 1.234
    29  C   3.789        C   27 1.450    C   30 1.368    H   81 0.993
    30  C   3.911        C   29 1.368    C   56 1.362    S   31 1.115
    31  S   2.492        C   28 1.234    C   30 1.115
    32  C   3.722        C   33 1.414    C   20 1.365    H   82 0.991
    33  C   3.790        C   32 1.414    C   34 1.196    C   37 1.115
    34  C   3.802        C   42 1.425    C   33 1.196    C   35 1.100
    35  C   3.872        C   38 1.417    C   36 1.324    C   34 1.100
    36  C   3.886        C   41 1.448    C   35 1.324    C   37 1.038
    37  C   3.957        O   43 1.787    C   33 1.115    C   36 1.038
    38  C   3.834        C   35 1.417    C   39 1.410    H   83 1.001
    39  C   3.989        C   38 1.410    C   40 1.391    F   48 1.055
    40  C   3.952        C   41 1.400    C   39 1.391    F   49 1.051
    41  C   3.884        C   36 1.448    C   40 1.400    H   84 0.994
    42  C   3.746        C   34 1.425    C   45 1.159    C   44 1.157
    43  O   1.966        C   37 1.787
    44  C   4.089        N   46 2.889    C   42 1.157
    45  C   4.096        N   47 2.887    C   42 1.159
    46  N   2.906        C   44 2.889
    47  N   2.904        C   45 2.887
    48  F   0.991        C   39 1.055
    49  F   0.983        C   40 1.051
    50  C   3.869        H   85 1.004    H   86 1.000    C   52 0.992    C   16 0.965
    51  C   3.853        H   87 1.000    H   88 0.999    C   53 0.992    C   16 0.976
    52  C   3.889        H   89 1.006    H   91 1.005    H   90 0.993    C   50 0.992
    53  C   3.905        H   92 1.006    H   94 1.005    H   93 0.993    C   51 0.992
    54  C   3.848        H   96 1.002    H   95 0.999    C   75 0.959    C   26 0.940
    55  C   3.643        H   97 0.969    C   26 0.962    C   74 0.946    H   98 0.847
    56  C   3.625        C   57 1.446    C   30 1.362    H   99 0.851
    57  C   3.808        C   56 1.446    C   58 1.196    C   61 1.105
    58  C   3.822        C   67 1.425    C   57 1.196    C   59 1.102
    59  C   3.876        C   62 1.427    C   60 1.319    C   58 1.102
    60  C   3.880        C   65 1.450    C   59 1.319    C   61 1.043
    61  C   3.969        O   66 1.780    C   57 1.105    C   60 1.043
    62  C   3.693        C   59 1.427    C   63 1.425    H  100 0.832
    63  C   4.001        C   62 1.425    C   64 1.396    F   73 1.028
    64  C   3.957        C   65 1.414    C   63 1.396    F   72 1.029
    65  C   3.785        C   60 1.450    C   64 1.414    H  101 0.884
    66  O   1.962        C   61 1.780
    67  C   3.756        C   58 1.425    C   69 1.162    C   68 1.162
    68  C   4.100        N   71 2.868    C   67 1.162
    69  C   4.102        N   70 2.877    C   67 1.162
    70  N   2.899        C   69 2.877
    71  N   2.900        C   68 2.868
    72  F   0.972        C   64 1.029
    73  F   0.983        C   63 1.028
    74  C   3.396        C   55 0.946    H  104 0.876    H  103 0.848    H  102 0.825
    75  C   3.364        C   54 0.959    H  105 0.858    H  106 0.822    H  107 0.819
    76  H   1.028        C    7 0.984
    77  H   1.041        C    8 0.989
    78  H   1.040        C   12 0.997
    79  H   1.045        C   19 0.988
    80  H   1.071        C   22 0.996
    81  H   1.106        C   29 0.993
    82  H   1.054        C   32 0.991
    83  H   1.070        C   38 1.001
    84  H   1.036        C   41 0.994
    85  H   1.051        C   50 1.004
    86  H   1.040        C   50 1.000
    87  H   1.038        C   51 1.000
    88  H   1.033        C   51 0.999
    89  H   1.047        C   52 1.006
    90  H   1.042        C   52 0.993
    91  H   1.038        C   52 1.005
    92  H   1.051        C   53 1.006
    93  H   1.044        C   53 0.993
    94  H   1.046        C   53 1.005
    95  H   1.073        C   54 0.999
    96  H   1.070        C   54 1.002
    97  H   0.942        C   55 0.969
    98  H   0.983        C   55 0.847
    99  H   0.931        C   56 0.851
   100  H   0.939        C   62 0.832
   101  H   0.929        C   65 0.884
   102  H   0.956        C   74 0.825
   103  H   0.952        C   74 0.848
   104  H   0.992        C   74 0.876
   105  H   0.949        C   75 0.858
   106  H   0.934        C   75 0.822
   107  H   0.962        C   75 0.819

 dipole moment from electron density (au)
     X       Y       Z   
  -7.3342   6.3282  -1.7372  total (Debye):   25.015


           -------------------------------------------------
          | TOTAL ENERGY             -225.915437198956 Eh   |
          | GRADIENT NORM               0.452428425402 Eh/α |
          | HOMO-LUMO GAP               0.097644150798 eV   |
           -------------------------------------------------

------------------------------------------------------------------------
 * finished run on 2021/12/02 at 16:29:50.371     
------------------------------------------------------------------------
 total:
 * wall-time:     0 d,  0 h,  0 min,  6.571 sec
 *  cpu-time:     0 d,  0 h,  0 min,  6.546 sec
 * ratio c/w:     0.996 speedup
 SCF:
 * wall-time:     0 d,  0 h,  0 min,  5.686 sec
 *  cpu-time:     0 d,  0 h,  0 min,  5.672 sec
 * ratio c/w:     0.998 speedup

