      -----------------------------------------------------------      
     |                   =====================                   |     
     |                           x T B                           |     
     |                   =====================                   |     
     |                         S. Grimme                         |     
     |          Mulliken Center for Theoretical Chemistry        |     
     |                    University of Bonn                     |     
     |                Version 6.2 RC2 (SAW190805)                |     
      -----------------------------------------------------------      

   This program is distributed in the hope that it will be useful,
   but WITHOUT ANY WARRANTY; without even the implied warranty of
   MERCHANTABILITY or FITNESS FOR A PARTICULAR PURPOSE.
   
   FOR NON-COMMERCIAL, ACADEMIA USE ONLY.
   
   Cite this work as:
   * S. Grimme, C. Bannwarth, P. Shushkov, J. Chem. Theory Comput., 2017,
     13, 1989-2009. DOI: 10.1021/acs.jctc.7b00118
   * C. Bannwarth, S. Ehlert and S. Grimme., J. Chem. Theory Comput., 2019,
     15, 1652-1671. DOI: 10.1021/acs.jctc.8b01176
   * P. Pracht, E. Caldeweyher, S. Ehlert, S. Grimme, ChemRxiv, 2019, preprint.
     DOI: 10.26434/chemrxiv.8326202.v1
   
   for DFT-D4:
   * E. Caldeweyher, C. Bannwarth and S. Grimme, J. Chem. Phys., 2017,
     147, 034112. DOI: 10.1063/1.4993215
   * E. Caldeweyher, S. Ehlert, A. Hansen, H. Neugebauer, S. Spicher,
     C. Bannwarth and S. Grimme, J. Chem. Phys., 2019, 150, 154122.
     DOI: 10.1063/1.5090222
   
   for sTDA-xTB:
   * S. Grimme and C. Bannwarth, J. Chem. Phys., 2016, 145, 054103.
     DOI: 10.1063/1.4959605
   
   in the mass-spec context:
   * V. Asgeirsson, C. Bauer and S. Grimme, Chem. Sci., 2017, 8, 4879.
     DOI: 10.1039/c7sc00601b
   
   for metadynamics refer to:
   * S. Grimme, J. Chem. Theory Comput., 2019, 155, 2847-2862
     DOI: 10.1021/acs.jctc.9b00143
   
   with help from (in alphabetical order)
   C. Bannwarth, F. Bohle, G. Brandenburg, E. Caldeweyher, M. Checinski,
   S. Dohm, S. Ehlert, S. Ehrlich, F. März, H. Neugebauer, J. Pisarek,
   P. Pracht, P. Shushkov, and S. Spicher.
   
 * started run on 2021/12/02 at 16:31:07.306     

           -------------------------------------------------
          |                Calculation Setup                |
           -------------------------------------------------

          program call               : /ihome/ghutchison/geoffh/xtb/xtb BT2b.xyz --vipea
          hostname                   : smp-n128
          coordinate file            : BT2b.xyz
          omp threads                :                     1
          number of atoms            :                   104
          number of electrons        :                   322
          charge                     :                     0
          spin                       :                   0.0
          first test random number   :      0.10075329363534


########################################################################
# WARNING! Please study the warnings concerning your input carefully
#  - XTBPATH is not set, using XTBHOME instead
########################################################################

           ------------------------------------------------- 
          |                 I P E A - x T B                 |
          |  Ionisation Potentials and Electron Affinities  |
           ------------------------------------------------- 
             KAB for M(3d)-M(3d) :                1.1000
             KAB for M(4d)-M(4d) :                1.2000
             KAB for M(5d)-M(5d) :                1.2000
             k(s)                :                2.1500
             k(p)                :                2.3000
             k(d)                :                2.0000
             k(f)                :                0.0000
             kEN (H0ij)          :                0.7000
             D3 a1               :                0.6300
             D3 a2               :                5.0000
             D3 s6               :                1.0000
             D3 s8               :                2.4000
             D3 s9               :                0.0000
             alphaj              :                1.0000
             XBdamp              :                0.4400
             XBrad               :                1.3000
             kcnsh               :      1.0000   -0.3000   -0.5000    0.5000

  Z AO/shell   Hii/eV     exponent
  1     Thu Sep 22 23:34:11 CEST 2016   EN: 2.200 GAM: 0.405  GM3: 0.1500
     1s    -10.521941    1.306199
     2s     -3.560151    0.398421
  6     Thu Sep 22 23:34:11 CEST 2016   EN: 2.550 GAM: 0.640  GM3: 0.1500
     2s    -15.968100    1.979793
     2p     -9.777107    1.850537
     3S     -3.366990    0.633095
  7     Thu Sep 22 23:34:11 CEST 2016   EN: 3.040 GAM: 0.493  GM3:-0.1000
     2s    -24.040776    2.126160
     2p    -14.426520    2.068425
     3S     -5.882278    0.671040
  8     Thu Sep 22 23:34:11 CEST 2016   EN: 3.440 GAM: 0.717  GM3:-0.2000
     2s    -26.695120    2.575264
     2p    -16.014457    2.159448
     3S     -6.622058    0.958679
 16     Tue Jan 17 20:57:36 CET 2017    EN: 2.580 GAM: 0.455  GM3: 0.1020
     3s    -24.488821    2.492075
     3p    -12.136640    1.997904
     3d     -1.796070    1.747541

           ------------------------------------------------- 
          |        Self-Consistent Charge Iterations        |
           ------------------------------------------------- 

          ...................................................
          :                      SETUP                      :
          :.................................................:
          :  # basis functions                 430          :
          :  # atomic orbitals                 424          :
          :  # shells                          272          :
          :  # electrons                       322          :
          :  # halogen bonds                     0          :
          :  max. iterations                   250          :
          :  Hamiltonian                  GFN1-xTB          :
          :  restarted?                      false          :
          :  GBSA solvation                  false          :
          :  PC potential                    false          :
          :  electronic temp.          300.0000000     K    :
          :  accuracy                    1.0000000          :
          :  -> integral cutoff          0.2500000E+02      :
          :  -> integral neglect         0.1000000E-07      :
          :  -> SCF convergence          0.1000000E-05 Eh   :
          :  -> wf. convergence          0.2000000E-04 e    :
          :  Broyden damping             0.4000000          :
          ...................................................

 iter      E             dE          RMSdq      gap      omega  full diag
   1   -203.1945823 -0.203195E+03  0.899E+00    0.07       0.0  T
   2   -199.5852682  0.360931E+01  0.637E+00    0.19       1.0  T
   3   -157.2696295  0.423156E+02  0.717E+00    0.10       1.0  T
   4   -113.2302135  0.440394E+02  0.106E+01    0.13       1.0  T
   5   -202.3502043 -0.891200E+02  0.273E+00    0.19       1.0  T
   6   -204.2265437 -0.187634E+01  0.123E+00    0.34       1.0  T
   7   -204.8587898 -0.632246E+00  0.127E+00    0.27       1.0  T
   8   -204.7900742  0.687156E-01  0.112E+00    0.05       1.0  T
   9   -204.9320444 -0.141970E+00  0.106E+00    0.12       1.0  T
  10   -204.5204917  0.411553E+00  0.112E+00    0.31       1.0  T
  11   -204.5208211 -0.329375E-03  0.806E-01    0.43       1.0  T
  12   -204.5905422 -0.697212E-01  0.734E-01    0.19       1.0  T
  13   -204.9825363 -0.391994E+00  0.230E-01    0.04       1.0  T
  14   -204.9158472  0.666891E-01  0.634E-01    0.03       1.0  T
  15   -205.0132529 -0.974057E-01  0.208E-01    0.19       1.0  T
  16   -205.0290829 -0.158301E-01  0.139E-01    0.12       1.0  T
  17   -204.9947588  0.343242E-01  0.315E-01    0.02       1.0  T
  18   -205.0367718 -0.420130E-01  0.798E-02    0.07       1.0  T
  19   -205.0369385 -0.166728E-03  0.630E-02    0.08       1.0  T
  20   -205.0372827 -0.344178E-03  0.600E-02    0.07       1.0  T
  21   -205.0367608  0.521850E-03  0.627E-02    0.09       1.0  T
  22   -205.0380857 -0.132492E-02  0.298E-02    0.07       1.0  T
  23   -205.0381870 -0.101296E-03  0.233E-02    0.07       1.0  T
  24   -205.0383237 -0.136678E-03  0.160E-02    0.07       1.0  T
  25   -205.0384554 -0.131657E-03  0.770E-03    0.07       1.3  T
  26   -205.0384704 -0.149893E-04  0.441E-03    0.07       2.2  T
  27   -205.0384707 -0.323590E-06  0.460E-03    0.07       2.1  T
  28   -205.0384809 -0.102111E-04  0.173E-03    0.07       5.7  T
  29   -205.0384827 -0.179613E-05  0.446E-04    0.07      22.0  T
  30   -205.0384826  0.885636E-07  0.468E-04    0.07      21.0  T
  31   -205.0384827 -0.115867E-06  0.315E-04    0.07      31.2  T
  32   -205.0384828 -0.270639E-07  0.143E-04    0.07      68.8  T
  33   -205.0384828  0.125272E-08  0.129E-04    0.07      75.8  T

   *** convergence criteria satisfied after 33 iterations ***

         #    Occupation            Energy/Eh            Energy/eV
      -------------------------------------------------------------
         1        2.0000           -1.0752076             -29.2579
       ...           ...                  ...                  ...
       155        2.0000           -0.4073575             -11.0848
       156        2.0000           -0.3956748             -10.7669
       157        2.0000           -0.3849487             -10.4750
       158        2.0000           -0.3738312             -10.1725
       159        2.0000           -0.3601378              -9.7998
       160        1.9381           -0.3181098              -8.6562
       161        1.6102           -0.3161851              -8.6038 (HOMO)
       162        0.4426           -0.3136423              -8.5346 (LUMO)
       163        0.0091           -0.3097212              -8.4279
       164                         -0.2891977              -7.8695
       165                         -0.2712669              -7.3815
       166                         -0.2691827              -7.3248
       ...                                ...                  ...
       424                        558.8255272           15206.4166
      -------------------------------------------------------------
                  HL-Gap            0.0025429 Eh            0.0692 eV
             Fermi-level           -0.3148376 Eh           -8.5672 eV

 SCC (total)                   0 d,  0 h,  0 min,  1.900 sec
 SCC setup                      ...        0 min,  0.004 sec (  0.212%)
 Dispersion                     ...        0 min,  0.000 sec (  0.018%)
 integral evaluation            ...        0 min,  0.750 sec ( 39.488%)
 zeroth order Hamiltonian       ...        0 min,  0.003 sec (  0.166%)
 iterations                     ...        0 min,  0.904 sec ( 47.581%)
 molecular gradient             ...        0 min,  0.234 sec ( 12.330%)
 printout                       ...        0 min,  0.004 sec (  0.202%)

         :::::::::::::::::::::::::::::::::::::::::::::::::::::
         ::                     SUMMARY                     ::
         :::::::::::::::::::::::::::::::::::::::::::::::::::::
         :: total energy            -201.815578511127 Eh    ::
         :: gradient norm              0.415326308109 Eh/a0 ::
         :: HOMO-LUMO gap              0.069194969846 eV    ::
         ::.................................................::
         :: SCC energy              -205.038482751427 Eh    ::
         :: -> electrostatic           0.293560086814 Eh    ::
         :: repulsion energy           3.312408819381 Eh    ::
         :: dispersion energy         -0.089504579082 Eh    ::
         :: halogen bond corr.         0.000000000000 Eh    ::
         :: add. restraining           0.000000000000 Eh    ::
         :::::::::::::::::::::::::::::::::::::::::::::::::::::

           ------------------------------------------------- 
          |        vertical delta SCC IP calculation        |
           ------------------------------------------------- 

          ...................................................
          :                      SETUP                      :
          :.................................................:
          :  # basis functions                 430          :
          :  # atomic orbitals                 424          :
          :  # shells                          272          :
          :  # electrons                       321          :
          :  # halogen bonds                     0          :
          :  max. iterations                   250          :
          :  Hamiltonian                  GFN1-xTB          :
          :  restarted?                       true          :
          :  GBSA solvation                  false          :
          :  PC potential                    false          :
          :  electronic temp.          300.0000000     K    :
          :  accuracy                    1.0000000          :
          :  -> integral cutoff          0.2500000E+02      :
          :  -> integral neglect         0.1000000E-07      :
          :  -> SCF convergence          0.1000000E-05 Eh   :
          :  -> wf. convergence          0.2000000E-04 e    :
          :  Broyden damping             0.4000000          :
          ...................................................

 iter      E             dE          RMSdq      gap      omega  full diag
   1   -204.6576453 -0.204658E+03  0.312E-01    0.07       0.0  T
   2   -204.5917321  0.659131E-01  0.491E-01    0.24       1.0  T
   3   -204.6231529 -0.314208E-01  0.368E-01    0.35       1.0  T
   4   -204.6430056 -0.198527E-01  0.300E-01    0.33       1.0  T
   5   -204.6403204  0.268522E-02  0.313E-01    0.16       1.0  T
   6   -204.6663917 -0.260713E-01  0.202E-01    0.17       1.0  T
   7   -204.6438380  0.225537E-01  0.283E-01    0.20       1.0  T
   8   -204.6616917 -0.178536E-01  0.217E-01    0.16       1.0  T
   9   -204.6854183 -0.237267E-01  0.470E-02    0.22       1.0  T
  10   -204.6851928  0.225512E-03  0.531E-02    0.23       1.0  T
  11   -204.6865871 -0.139429E-02  0.115E-02    0.22       1.0  T
  12   -204.6866574 -0.702695E-04  0.223E-03    0.22       4.4  T
  13   -204.6866520  0.543910E-05  0.375E-03    0.22       2.6  T
  14   -204.6866592 -0.723264E-05  0.556E-04    0.22      17.6  T
  15   -204.6866593 -0.140250E-06  0.172E-04    0.22      57.1  T
  16   -204.6866593  0.741005E-08  0.182E-04    0.22      53.8  T

   *** convergence criteria satisfied after 16 iterations ***

         #    Occupation            Energy/Eh            Energy/eV
      -------------------------------------------------------------
         1        2.0000           -1.1509780             -31.3197
       ...           ...                  ...                  ...
       155        2.0000           -0.4718265             -12.8391
       156        2.0000           -0.4609976             -12.5444
       157        2.0000           -0.4576952             -12.4545
       158        2.0000           -0.4391595             -11.9501
       159        2.0000           -0.4279943             -11.6463
       160        1.5636           -0.3908503             -10.6356
       161        1.4182           -0.3903130             -10.6210 (HOMO)
       162        0.0181           -0.3822783             -10.4023 (LUMO)
       163        0.0000           -0.3760033             -10.2316
       164                         -0.3616069              -9.8398
       165                         -0.3399919              -9.2517
       166                         -0.3329956              -9.0613
       ...                                ...                  ...
       424                        558.7572010           15204.5573
      -------------------------------------------------------------
                  HL-Gap            0.0080346 Eh            0.2186 eV
             Fermi-level           -0.3883303 Eh          -10.5670 eV

 SCC (total)                   0 d,  0 h,  0 min,  1.441 sec
 SCC setup                      ...        0 min,  0.004 sec (  0.287%)
 Dispersion                     ...        0 min,  0.000 sec (  0.013%)
 integral evaluation            ...        0 min,  0.747 sec ( 51.836%)
 zeroth order Hamiltonian       ...        0 min,  0.003 sec (  0.215%)
 iterations                     ...        0 min,  0.447 sec ( 31.062%)
 molecular gradient             ...        0 min,  0.235 sec ( 16.308%)
 printout                       ...        0 min,  0.004 sec (  0.274%)

         :::::::::::::::::::::::::::::::::::::::::::::::::::::
         ::                     SUMMARY                     ::
         :::::::::::::::::::::::::::::::::::::::::::::::::::::
         :: total energy            -201.463755076407 Eh    ::
         :: gradient norm              0.394648810314 Eh/a0 ::
         :: HOMO-LUMO gap              0.218633269205 eV    ::
         ::.................................................::
         :: SCC energy              -204.686659316706 Eh    ::
         :: -> electrostatic           0.324478071921 Eh    ::
         :: repulsion energy           3.312408819381 Eh    ::
         :: dispersion energy         -0.089504579082 Eh    ::
         :: halogen bond corr.         0.000000000000 Eh    ::
         :: add. restraining           0.000000000000 Eh    ::
         :::::::::::::::::::::::::::::::::::::::::::::::::::::

------------------------------------------------------------------------
empirical IP shift (eV):    4.8455
delta SCC IP (eV):    4.7281
------------------------------------------------------------------------
           ------------------------------------------------- 
          |        vertical delta SCC EA calculation        |
           ------------------------------------------------- 

          ...................................................
          :                      SETUP                      :
          :.................................................:
          :  # basis functions                 430          :
          :  # atomic orbitals                 424          :
          :  # shells                          272          :
          :  # electrons                       323          :
          :  # halogen bonds                     0          :
          :  max. iterations                   250          :
          :  Hamiltonian                  GFN1-xTB          :
          :  restarted?                       true          :
          :  GBSA solvation                  false          :
          :  PC potential                    false          :
          :  electronic temp.          300.0000000     K    :
          :  accuracy                    1.0000000          :
          :  -> integral cutoff          0.2500000E+02      :
          :  -> integral neglect         0.1000000E-07      :
          :  -> SCF convergence          0.1000000E-05 Eh   :
          :  -> wf. convergence          0.2000000E-04 e    :
          :  Broyden damping             0.4000000          :
          ...................................................

 iter      E             dE          RMSdq      gap      omega  full diag
   1   -205.2660288 -0.205266E+03  0.418E-01    0.17       0.0  T
   2   -204.6337658  0.632263E+00  0.117E+00    0.10       1.0  T
   3   -205.2448922 -0.611126E+00  0.432E-01    0.28       1.0  T
   4   -205.2743465 -0.294543E-01  0.309E-01    0.23       1.0  T
   5   -205.2799462 -0.559970E-02  0.300E-01    0.25       1.0  T
   6   -205.2953539 -0.154077E-01  0.243E-01    0.12       1.0  T
   7   -205.3061924 -0.108385E-01  0.162E-01    0.12       1.0  T
   8   -205.2962913  0.990111E-02  0.201E-01    0.11       1.0  T
   9   -205.3089686 -0.126773E-01  0.107E-01    0.12       1.0  T
  10   -205.3166569 -0.768834E-02  0.266E-02    0.11       1.0  T
  11   -205.3170328 -0.375895E-03  0.106E-02    0.11       1.0  T
  12   -205.3169023  0.130483E-03  0.158E-02    0.11       1.0  T
  13   -205.3170709 -0.168543E-03  0.580E-03    0.11       1.7  T
  14   -205.3170805 -0.957744E-05  0.281E-03    0.11       3.5  T
  15   -205.3170832 -0.269400E-05  0.125E-03    0.11       7.8  T
  16   -205.3170839 -0.750115E-06  0.655E-04    0.11      15.0  T
  17   -205.3170842 -0.303570E-06  0.227E-04    0.11      43.2  T
  18   -205.3170842  0.485926E-08  0.244E-04    0.11      40.2  T
  19   -205.3170842 -0.198716E-07  0.687E-05    0.11     142.6  T
  20   -205.3170842 -0.336419E-08  0.219E-05    0.11     448.4  T

   *** convergence criteria satisfied after 20 iterations ***

         #    Occupation            Energy/Eh            Energy/eV
      -------------------------------------------------------------
         1        2.0000           -1.0088082             -27.4511
       ...           ...                  ...                  ...
       156        2.0000           -0.3293195              -8.9612
       157        2.0000           -0.3161337              -8.6024
       158        2.0000           -0.3061896              -8.3318
       159        2.0000           -0.2927383              -7.9658
       160        1.9997           -0.2530005              -6.8845
       161        1.7655           -0.2463895              -6.7046
       162        1.1188           -0.2440203              -6.6401 (HOMO)
       163        0.1160           -0.2399924              -6.5305 (LUMO)
       164                         -0.2242097              -6.1011
       165                         -0.2026238              -5.5137
       166                         -0.2012835              -5.4772
       167                         -0.1911754              -5.2021
       ...                                ...                  ...
       424                        558.8925995           15208.2417
      -------------------------------------------------------------
                  HL-Gap            0.0040279 Eh            0.1096 eV
             Fermi-level           -0.2435876 Eh           -6.6284 eV

 SCC (total)                   0 d,  0 h,  0 min,  1.561 sec
 SCC setup                      ...        0 min,  0.004 sec (  0.264%)
 Dispersion                     ...        0 min,  0.000 sec (  0.020%)
 integral evaluation            ...        0 min,  0.750 sec ( 48.046%)
 zeroth order Hamiltonian       ...        0 min,  0.003 sec (  0.202%)
 iterations                     ...        0 min,  0.564 sec ( 36.151%)
 molecular gradient             ...        0 min,  0.235 sec ( 15.027%)
 printout                       ...        0 min,  0.004 sec (  0.286%)

         :::::::::::::::::::::::::::::::::::::::::::::::::::::
         ::                     SUMMARY                     ::
         :::::::::::::::::::::::::::::::::::::::::::::::::::::
         :: total energy            -202.094179984413 Eh    ::
         :: gradient norm              0.427844487694 Eh/a0 ::
         :: HOMO-LUMO gap              0.109605009065 eV    ::
         ::.................................................::
         :: SCC energy              -205.317084224712 Eh    ::
         :: -> electrostatic           0.331768407742 Eh    ::
         :: repulsion energy           3.312408819381 Eh    ::
         :: dispersion energy         -0.089504579082 Eh    ::
         :: halogen bond corr.         0.000000000000 Eh    ::
         :: add. restraining           0.000000000000 Eh    ::
         :::::::::::::::::::::::::::::::::::::::::::::::::::::

------------------------------------------------------------------------
empirical EA shift (eV):    4.8455
delta SCC EA (eV):    2.7356
------------------------------------------------------------------------
           -------------------------------------------------
          |                Property Printout                |
           -------------------------------------------------

    * Orbital Energies and Occupations

         #    Occupation            Energy/Eh            Energy/eV
      -------------------------------------------------------------
         1        2.0000           -1.0088082             -27.4511
       ...           ...                  ...                  ...
       150        2.0000           -0.3571637              -9.7189
       151        2.0000           -0.3566132              -9.7039
       152        2.0000           -0.3564670              -9.7000
       153        2.0000           -0.3537196              -9.6252
       154        2.0000           -0.3457861              -9.4093
       155        2.0000           -0.3418423              -9.3020
       156        2.0000           -0.3293195              -8.9612
       157        2.0000           -0.3161337              -8.6024
       158        2.0000           -0.3061896              -8.3318
       159        2.0000           -0.2927383              -7.9658
       160        1.9997           -0.2530005              -6.8845
       161        1.7655           -0.2463895              -6.7046
       162        1.1188           -0.2440203              -6.6401 (HOMO)
       163        0.1160           -0.2399924              -6.5305 (LUMO)
       164                         -0.2242097              -6.1011
       165                         -0.2026238              -5.5137
       166                         -0.2012835              -5.4772
       167                         -0.1911754              -5.2021
       168                         -0.1820198              -4.9530
       169                         -0.1717035              -4.6723
       170                         -0.1684614              -4.5841
       171                         -0.1598359              -4.3494
       172                         -0.1552259              -4.2239
       173                         -0.1521416              -4.1400
       ...                                ...                  ...
       424                        558.8925995           15208.2417
      -------------------------------------------------------------
                  HL-Gap            0.0040279 Eh            0.1096 eV
             Fermi-level           -0.2435876 Eh           -6.6284 eV

  Mulliken/CM5 charges        n(s)   n(p)   n(d)
     1 C  -0.35522 -0.35919   1.771  1.874  0.000
     2 C   0.03032  0.02265   1.632  2.398  0.000
     3 C   0.02291 -0.02774   1.117  2.906  0.000
     4 C   0.02136  0.01740   1.059  2.962  0.000
     5 C  -0.00359 -0.01126   1.096  2.901  0.000
     6 C   0.13170  0.08104   1.058  3.074  0.000
     7 C  -0.00475  0.00790   1.128  2.867  0.000
     8 C   0.01010  0.00459   1.057  2.953  0.000
     9 C  -0.02050 -0.03807   1.086  2.893  0.000
    10 C   0.08817  0.10081   1.150  2.939  0.000
    11 C   0.01138  0.00586   1.060  2.952  0.000
    12 C  -0.00135 -0.01891   1.094  2.904  0.000
    13 S   0.07842  0.04149   1.877  4.129  0.072
    14 C  -0.01175 -0.00216   1.152  2.836  0.000
    15 C   0.03402 -0.01391   1.064  2.970  0.000
    16 S   0.10478  0.06787   1.878  4.125  0.102
    17 C  -0.01272 -0.00313   1.154  2.833  0.000
    18 C   0.03417 -0.01374   1.060  2.974  0.000
    19 C   0.02645 -0.08099   1.075  2.952  0.000
    20 C   0.02696 -0.08044   1.075  2.952  0.000
    21 C   0.05994 -0.09132   1.066  2.994  0.000
    22 C   0.05963 -0.09165   1.065  2.994  0.000
    23 C   0.02643 -0.08097   1.083  2.943  0.000
    24 C   0.02269 -0.08475   1.083  2.940  0.000
    25 C   0.06102 -0.09024   1.067  2.994  0.000
    26 C   0.06042 -0.09085   1.067  2.993  0.000
    27 C   0.00509  0.00652   1.080  2.925  0.000
    28 C   0.00496  0.00640   1.076  2.929  0.000
    29 C   0.03490 -0.01691   1.074  2.961  0.000
    30 C   0.03026 -0.02207   1.066  2.964  0.000
    31 C   0.00956  0.00743   1.069  2.941  0.000
    32 C  -0.07062  0.01427   1.153  2.776  0.000
    33 C  -0.07077  0.01426   1.142  2.787  0.000
    34 C   0.03709 -0.01473   1.069  2.968  0.000
    35 C   0.03168 -0.02067   1.065  2.966  0.000
    36 C   0.01124  0.00911   1.067  2.944  0.000
    37 C  -0.06928  0.01561   1.153  2.778  0.000
    38 C  -0.07000  0.01504   1.143  2.787  0.000
    39 N   0.25721  0.08898   1.466  3.791  0.000
    40 S  -0.14131 -0.00276   1.854  3.677  0.327
    41 N   0.25581  0.08364   1.454  3.802  0.000
    42 N   0.26049  0.09234   1.465  3.795  0.000
    43 S  -0.13815  0.00040   1.854  3.679  0.328
    44 N   0.25639  0.08429   1.455  3.801  0.000
    45 C   0.01053 -0.03515   1.091  2.920  0.000
    46 C   0.01365 -0.03206   1.087  2.927  0.000
    47 C  -0.00566  0.01073   1.125  2.869  0.000
    48 S   0.10100  0.07734   1.887  4.169  0.045
    49 C  -0.21945 -0.10098   1.212  2.568  0.000
    50 N   0.13157 -0.12033   1.298  3.833  0.000
    51 C  -0.20139 -0.09947   1.153  2.646  0.000
    52 O   0.32932  0.28702   1.621  4.708  0.000
    53 C  -0.03454 -0.08202   1.103  2.863  0.000
    54 C   0.05726 -0.08870   1.102  2.955  0.000
    55 O   0.34945  0.30313   1.611  4.738  0.000
    56 C  -0.00357  0.01281   1.126  2.871  0.000
    57 S   0.12894  0.10516   1.887  4.193  0.048
    58 C  -0.20274 -0.08427   1.227  2.570  0.000
    59 N   0.17811 -0.07378   1.341  3.837  0.000
    60 C  -0.18173 -0.07984   1.172  2.646  0.000
    61 O   0.35622  0.31384   1.632  4.724  0.000
    62 C   0.25783  0.21038   1.030  3.228  0.000
    63 C   0.59396  0.44793   0.934  3.659  0.000
    64 O   0.37823  0.33194   1.625  4.753  0.000
    65 H  -0.06231 -0.00382   0.938  0.000  0.000
    66 H  -0.01061  0.04789   0.989  0.000  0.000
    67 H  -0.02290  0.04483   0.977  0.000  0.000
    68 H  -0.01895  0.04887   0.981  0.000  0.000
    69 H  -0.01515  0.04158   0.985  0.000  0.000
    70 H  -0.01772  0.03891   0.982  0.000  0.000
    71 H  -0.01744  0.03917   0.983  0.000  0.000
    72 H  -0.01496  0.04176   0.985  0.000  0.000
    73 H  -0.01032  0.04383   0.990  0.000  0.000
    74 H  -0.01091  0.04086   0.989  0.000  0.000
    75 H  -0.00353  0.05067   0.996  0.000  0.000
    76 H  -0.00300  0.05120   0.997  0.000  0.000
    77 H  -0.01123  0.04054   0.989  0.000  0.000
    78 H  -0.01055  0.04360   0.989  0.000  0.000
    79 H  -0.02849  0.02812   0.972  0.000  0.000
    80 H  -0.01589  0.04083   0.984  0.000  0.000
    81 H  -0.01610  0.04063   0.984  0.000  0.000
    82 H  -0.03117  0.02546   0.969  0.000  0.000
    83 H  -0.00625  0.04790   0.994  0.000  0.000
    84 H  -0.01237  0.03940   0.988  0.000  0.000
    85 H  -0.00203  0.05216   0.998  0.000  0.000
    86 H  -0.00639  0.04777   0.994  0.000  0.000
    87 H  -0.00129  0.05291   0.999  0.000  0.000
    88 H  -0.01233  0.03944   0.988  0.000  0.000
    89 H  -0.01894  0.04170   0.981  0.000  0.000
    90 H  -0.03145  0.03109   0.969  0.000  0.000
    91 H  -0.02295  0.03773   0.977  0.000  0.000
    92 H  -0.03142  0.03126   0.969  0.000  0.000
    93 H  -0.03018  0.03809   0.970  0.000  0.000
    94 H  -0.02559  0.04254   0.974  0.000  0.000
    95 H  -0.04881  0.02249   0.951  0.000  0.000
    96 H  -0.04760  0.02128   0.952  0.000  0.000
    97 H  -0.02441  0.03086   0.976  0.000  0.000
    98 H  -0.01854  0.03385   0.981  0.000  0.000
    99 H  -0.04947  0.00664   0.951  0.000  0.000
   100 H  -0.27967 -0.21093   0.720  0.000  0.000
   101 H  -0.31416 -0.24270   0.686  0.000  0.000
   102 H  -0.29897 -0.24268   0.701  0.000  0.000
   103 H  -0.26150 -0.20911   0.739  0.000  0.000
   104 H  -0.30695 -0.25172   0.693  0.000  0.000
(R)spin-density population

 Mulliken population n(s)   n(p)   n(d)
     1 C   0.0042   0.000  0.004  0.000
     2 C   0.0012   0.000  0.001  0.000
     3 C   0.0064  -0.000  0.006  0.000
     4 C   0.0023   0.000  0.002  0.000
     5 C   0.0039   0.000  0.004  0.000
     6 C   0.0035   0.000  0.003  0.000
     7 C   0.0187  -0.000  0.019  0.000
     8 C   0.0010  -0.000  0.001  0.000
     9 C   0.0002   0.000  0.000  0.000
    10 C   0.0192   0.000  0.019  0.000
    11 C   0.0014   0.000  0.001  0.000
    12 C   0.0002   0.000  0.000  0.000
    13 S   0.0113  -0.000  0.009  0.002
    14 C   0.0026  -0.000  0.003  0.000
    15 C   0.0181  -0.000  0.018  0.000
    16 S   0.0141   0.000  0.012  0.002
    17 C   0.0035   0.000  0.003  0.000
    18 C   0.0172  -0.000  0.017  0.000
    19 C   0.0003   0.000  0.000  0.000
    20 C   0.0002   0.000  0.000  0.000
    21 C   0.0000   0.000  0.000  0.000
    22 C   0.0001   0.000  0.000  0.000
    23 C   0.0000  -0.000  0.000  0.000
    24 C   0.0001   0.000  0.000  0.000
    25 C   0.0000  -0.000  0.000  0.000
    26 C   0.0000   0.000  0.000  0.000
    27 C   0.0366   0.000  0.037  0.000
    28 C   0.0357   0.000  0.036  0.000
    29 C   0.0166   0.000  0.017  0.000
    30 C   0.0290  -0.000  0.029  0.000
    31 C   0.0250  -0.000  0.025  0.000
    32 C   0.0005  -0.000  0.001  0.000
    33 C   0.0021  -0.000  0.002  0.000
    34 C   0.0169   0.000  0.017  0.000
    35 C   0.0273   0.000  0.027  0.000
    36 C   0.0259   0.000  0.026  0.000
    37 C   0.0009   0.000  0.001  0.000
    38 C   0.0025   0.000  0.002  0.000
    39 N   0.0316   0.000  0.032  0.000
    40 S   0.0638   0.000  0.050  0.014
    41 N   0.0359  -0.000  0.036  0.000
    42 N   0.0344   0.000  0.034  0.000
    43 S   0.0672  -0.000  0.052  0.015
    44 N   0.0381  -0.000  0.038  0.000
    45 C   0.0161  -0.000  0.016  0.000
    46 C   0.0126   0.000  0.013  0.000
    47 C   0.0254   0.000  0.025  0.000
    48 S   0.0057  -0.000  0.003  0.003
    49 C   0.0053  -0.000  0.005  0.000
    50 N   0.0009   0.000  0.001  0.000
    51 C   0.0128  -0.000  0.013  0.000
    52 O   0.0055  -0.000  0.006  0.000
    53 C   0.0000   0.000  0.000  0.000
    54 C   0.0001   0.000  0.000  0.000
    55 O   0.0140  -0.000  0.014  0.000
    56 C   0.0257   0.000  0.026  0.000
    57 S   0.0067   0.000  0.004  0.003
    58 C   0.0059   0.000  0.006  0.000
    59 N   0.0012   0.000  0.001  0.000
    60 C   0.0113   0.000  0.011  0.000
    61 O   0.0052  -0.000  0.005  0.000
    62 C   0.0543   0.000  0.054  0.000
    63 C   0.1047  -0.000  0.105  0.000
    64 O   0.0119   0.000  0.012  0.000
    65 H   0.0001   0.000  0.000  0.000
    66 H   0.0007   0.001  0.000  0.000
    67 H   0.0000   0.000  0.000  0.000
    68 H   0.0000   0.000  0.000  0.000
    69 H   0.0000   0.000  0.000  0.000
    70 H   0.0000   0.000  0.000  0.000
    71 H   0.0000   0.000  0.000  0.000
    72 H   0.0000   0.000  0.000  0.000
    73 H   0.0000   0.000  0.000  0.000
    74 H   0.0000   0.000  0.000  0.000
    75 H   0.0000   0.000  0.000  0.000
    76 H   0.0000   0.000  0.000  0.000
    77 H   0.0001   0.000  0.000  0.000
    78 H   0.0001   0.000  0.000  0.000
    79 H  -0.0000  -0.000  0.000  0.000
    80 H   0.0000   0.000  0.000  0.000
    81 H   0.0000   0.000  0.000  0.000
    82 H   0.0000   0.000  0.000  0.000
    83 H   0.0000   0.000  0.000  0.000
    84 H   0.0000   0.000  0.000  0.000
    85 H   0.0000   0.000  0.000  0.000
    86 H   0.0001   0.000  0.000  0.000
    87 H   0.0000   0.000  0.000  0.000
    88 H   0.0001   0.000  0.000  0.000
    89 H   0.0000   0.000  0.000  0.000
    90 H   0.0000   0.000  0.000  0.000
    91 H   0.0000   0.000  0.000  0.000
    92 H  -0.0000  -0.000  0.000  0.000
    93 H   0.0000   0.000  0.000  0.000
    94 H   0.0000   0.000  0.000  0.000
    95 H   0.0000   0.000  0.000  0.000
    96 H   0.0000   0.000  0.000  0.000
    97 H   0.0000   0.000  0.000  0.000
    98 H   0.0000   0.000  0.000  0.000
    99 H  -0.0000  -0.000  0.000  0.000
   100 H   0.0114   0.011  0.000  0.000
   101 H   0.0093   0.009  0.000  0.000
   102 H   0.0155   0.015  0.000  0.000
   103 H   0.0001   0.000  0.000  0.000
   104 H   0.0174   0.017  0.000  0.000

Wiberg/Mayer (AO) data.
largest (>0.10) Wiberg bond orders for each atom
          total WBO             WBO to atom ...
     1  C   2.716        C    6 0.913    C   10 0.869    C    2 0.691
     2  C   2.597        C    3 1.068    C    1 0.691    C   12 0.660
     3  C   3.748        C    4 1.413    C    2 1.068    H   65 0.908    C    6 0.144
     4  C   3.837        C    3 1.413    C    5 1.269    C    7 1.142
     5  C   3.833        C    6 1.553    C    4 1.269    C    9 0.993
     6  C   3.655        C    5 1.553    H   66 0.923    C    1 0.913    C    3 0.144    C   12 0.121
     7  C   3.816        C    8 1.446    S   13 1.229    C    4 1.142
     8  C   3.779        C    7 1.446    C   15 1.367    C    9 1.010
     9  C   3.869        C    8 1.010    C    5 0.993    C   19 0.969    C   20 0.969
    10  C   3.637        C   11 1.424    S   16 1.151    C    1 0.869
    11  C   3.803        C   10 1.424    C   18 1.359    C   12 0.998
    12  C   3.811        C   11 0.998    C   23 0.946    C   24 0.938    C    2 0.660    C    6 0.121
    13  S   2.513        C    7 1.229    C   14 1.164
    14  C   3.906        C   15 1.473    C   28 1.207    S   13 1.164
    15  C   3.768        C   14 1.473    C    8 1.367    H   67 1.000
    16  S   2.596        C   17 1.177    C   10 1.151
    17  C   3.897        C   18 1.470    C   27 1.205    S   16 1.177
    18  C   3.754        C   17 1.470    C   11 1.359    H   68 1.000
    19  C   3.867        H   69 1.001    H   70 0.999    C   22 0.998    C    9 0.969
    20  C   3.869        H   72 1.001    H   71 0.999    C   21 0.998    C    9 0.969
    21  C   3.901        H   75 1.007    H   73 1.006    C   20 0.998    H   74 0.992
    22  C   3.898        H   76 1.007    H   78 1.006    C   19 0.998    H   77 0.992
    23  C   3.882        C   25 0.998    H   80 0.997    H   79 0.980    C   12 0.946
    24  C   3.884        H   81 0.997    C   26 0.996    H   82 0.978    C   12 0.938
    25  C   3.903        H   83 1.005    H   85 1.005    C   23 0.998    H   84 0.992
    26  C   3.902        H   87 1.005    H   86 1.004    C   24 0.996    H   88 0.992
    27  C   3.801        C   29 1.370    C   33 1.227    C   17 1.205
    28  C   3.799        C   34 1.371    C   38 1.227    C   14 1.207
    29  C   3.841        C   30 1.444    C   27 1.370    H   89 0.983
    30  C   3.787        C   29 1.444    C   31 1.366    H   90 0.985
    31  C   3.829        C   30 1.366    C   45 1.233    C   32 1.216
    32  C   4.023        N   39 1.508    C   31 1.216    C   33 1.201
    33  C   3.996        N   41 1.494    C   27 1.227    C   32 1.201
    34  C   3.833        C   35 1.442    C   28 1.371    H   91 0.983
    35  C   3.791        C   34 1.442    C   36 1.369    H   92 0.985
    36  C   3.826        C   35 1.369    C   46 1.226    C   37 1.218
    37  C   4.022        N   42 1.505    C   36 1.218    C   38 1.201
    38  C   3.996        N   44 1.494    C   28 1.227    C   37 1.201
    39  N   2.937        C   32 1.508    S   40 1.407
    40  S   3.076        N   39 1.407    N   41 1.404
    41  N   2.898        C   33 1.494    S   40 1.404
    42  N   2.928        C   37 1.505    S   43 1.405
    43  S   3.070        N   42 1.405    N   44 1.403
    44  N   2.895        C   38 1.494    S   43 1.403
    45  C   3.848        C   47 1.591    C   31 1.233    H   93 0.993
    46  C   3.852        C   56 1.606    C   36 1.226    H   94 0.994
    47  C   3.816        C   45 1.591    S   48 1.111    C   51 1.097
    48  S   2.378        C   47 1.111    C   49 1.058    O   52 0.124
    49  C   4.123        O   52 1.811    N   50 1.202    S   48 1.058
    50  N   3.276        C   49 1.202    C   51 1.128    C   53 0.957
    51  C   4.037        O   55 1.741    N   50 1.128    C   47 1.097
    52  O   1.998        C   49 1.811    S   48 0.124
    53  C   3.930        C   54 1.000    H   95 0.992    H   96 0.990    N   50 0.957
    54  C   3.921        H   97 1.006    H   98 1.000    C   53 1.000    H   99 0.969
    55  O   1.877        C   51 1.741
    56  C   3.812        C   46 1.606    S   57 1.115    C   60 1.086
    57  S   2.373        C   56 1.115    C   58 1.037    O   61 0.118
    58  C   4.142        O   61 1.789    N   59 1.223    S   57 1.037
    59  N   3.333        C   58 1.223    C   60 1.148    C   62 0.917
    60  C   4.078        O   64 1.726    N   59 1.148    C   56 1.086
    61  O   1.995        C   58 1.789    S   57 0.118
    62  C   3.521        N   59 0.917    C   63 0.899    H  100 0.855    H  101 0.814
    63  C   3.343        C   62 0.899    H  103 0.881    H  102 0.811    H  104 0.786
    64  O   1.887        C   60 1.726
    65  H   1.063        C    3 0.908
    66  H   1.112        C    6 0.923
    67  H   1.066        C   15 1.000
    68  H   1.070        C   18 1.000
    69  H   1.039        C   19 1.001
    70  H   1.044        C   19 0.999
    71  H   1.043        C   20 0.999
    72  H   1.038        C   20 1.001
    73  H   1.048        C   21 1.006
    74  H   1.046        C   21 0.992
    75  H   1.052        C   21 1.007
    76  H   1.054        C   22 1.007
    77  H   1.046        C   22 0.992
    78  H   1.047        C   22 1.006
    79  H   1.032        C   23 0.980
    80  H   1.040        C   23 0.997
    81  H   1.043        C   24 0.997
    82  H   1.034        C   24 0.978
    83  H   1.061        C   25 1.005
    84  H   1.046        C   25 0.992
    85  H   1.058        C   25 1.005
    86  H   1.062        C   26 1.004
    87  H   1.062        C   26 1.005
    88  H   1.047        C   26 0.992
    89  H   1.033        C   29 0.983
    90  H   1.019        C   30 0.985
    91  H   1.027        C   34 0.983
    92  H   1.020        C   35 0.985
    93  H   1.066        C   45 0.993
    94  H   1.067        C   46 0.994
    95  H   1.031        C   53 0.992
    96  H   1.018        C   53 0.990
    97  H   1.028        C   54 1.006
    98  H   1.027        C   54 1.000
    99  H   0.957        C   54 0.969
   100  H   0.915        C   62 0.855
   101  H   0.929        C   62 0.814
   102  H   0.906        C   63 0.811
   103  H   0.947        C   63 0.881
   104  H   0.896        C   63 0.786

 dipole moment from electron density (au)
     X       Y       Z   
 -10.5792  -6.1070  -1.5461  total (Debye):   31.296


           -------------------------------------------------
          | TOTAL ENERGY             -202.094179984413 Eh   |
          | GRADIENT NORM               0.427844487694 Eh/α |
          | HOMO-LUMO GAP               0.109605009065 eV   |
           -------------------------------------------------

------------------------------------------------------------------------
 * finished run on 2021/12/02 at 16:31:12.983     
------------------------------------------------------------------------
 total:
 * wall-time:     0 d,  0 h,  0 min,  5.678 sec
 *  cpu-time:     0 d,  0 h,  0 min,  5.640 sec
 * ratio c/w:     0.993 speedup
 SCF:
 * wall-time:     0 d,  0 h,  0 min,  4.905 sec
 *  cpu-time:     0 d,  0 h,  0 min,  4.879 sec
 * ratio c/w:     0.995 speedup

