      -----------------------------------------------------------      
     |                   =====================                   |     
     |                           x T B                           |     
     |                   =====================                   |     
     |                         S. Grimme                         |     
     |          Mulliken Center for Theoretical Chemistry        |     
     |                    University of Bonn                     |     
     |                Version 6.2 RC2 (SAW190805)                |     
      -----------------------------------------------------------      

   This program is distributed in the hope that it will be useful,
   but WITHOUT ANY WARRANTY; without even the implied warranty of
   MERCHANTABILITY or FITNESS FOR A PARTICULAR PURPOSE.
   
   FOR NON-COMMERCIAL, ACADEMIA USE ONLY.
   
   Cite this work as:
   * S. Grimme, C. Bannwarth, P. Shushkov, J. Chem. Theory Comput., 2017,
     13, 1989-2009. DOI: 10.1021/acs.jctc.7b00118
   * C. Bannwarth, S. Ehlert and S. Grimme., J. Chem. Theory Comput., 2019,
     15, 1652-1671. DOI: 10.1021/acs.jctc.8b01176
   * P. Pracht, E. Caldeweyher, S. Ehlert, S. Grimme, ChemRxiv, 2019, preprint.
     DOI: 10.26434/chemrxiv.8326202.v1
   
   for DFT-D4:
   * E. Caldeweyher, C. Bannwarth and S. Grimme, J. Chem. Phys., 2017,
     147, 034112. DOI: 10.1063/1.4993215
   * E. Caldeweyher, S. Ehlert, A. Hansen, H. Neugebauer, S. Spicher,
     C. Bannwarth and S. Grimme, J. Chem. Phys., 2019, 150, 154122.
     DOI: 10.1063/1.5090222
   
   for sTDA-xTB:
   * S. Grimme and C. Bannwarth, J. Chem. Phys., 2016, 145, 054103.
     DOI: 10.1063/1.4959605
   
   in the mass-spec context:
   * V. Asgeirsson, C. Bauer and S. Grimme, Chem. Sci., 2017, 8, 4879.
     DOI: 10.1039/c7sc00601b
   
   for metadynamics refer to:
   * S. Grimme, J. Chem. Theory Comput., 2019, 155, 2847-2862
     DOI: 10.1021/acs.jctc.9b00143
   
   with help from (in alphabetical order)
   C. Bannwarth, F. Bohle, G. Brandenburg, E. Caldeweyher, M. Checinski,
   S. Dohm, S. Ehlert, S. Ehrlich, F. März, H. Neugebauer, J. Pisarek,
   P. Pracht, P. Shushkov, and S. Spicher.
   
 * started run on 2021/12/02 at 16:30:22.985     

           -------------------------------------------------
          |                Calculation Setup                |
           -------------------------------------------------

          program call               : /ihome/ghutchison/geoffh/xtb/xtb BT2F-IC4F.xyz --vipea
          hostname                   : smp-n128
          coordinate file            : BT2F-IC4F.xyz
          omp threads                :                     1
          number of atoms            :                   107
          number of electrons        :                   376
          charge                     :                     0
          spin                       :                   0.0
          first test random number   :      0.66770250525079


########################################################################
# WARNING! Please study the warnings concerning your input carefully
#  - XTBPATH is not set, using XTBHOME instead
########################################################################

           ------------------------------------------------- 
          |                 I P E A - x T B                 |
          |  Ionisation Potentials and Electron Affinities  |
           ------------------------------------------------- 
             KAB for M(3d)-M(3d) :                1.1000
             KAB for M(4d)-M(4d) :                1.2000
             KAB for M(5d)-M(5d) :                1.2000
             k(s)                :                2.1500
             k(p)                :                2.3000
             k(d)                :                2.0000
             k(f)                :                0.0000
             kEN (H0ij)          :                0.7000
             D3 a1               :                0.6300
             D3 a2               :                5.0000
             D3 s6               :                1.0000
             D3 s8               :                2.4000
             D3 s9               :                0.0000
             alphaj              :                1.0000
             XBdamp              :                0.4400
             XBrad               :                1.3000
             kcnsh               :      1.0000   -0.3000   -0.5000    0.5000

  Z AO/shell   Hii/eV     exponent
  1     Thu Sep 22 23:34:11 CEST 2016   EN: 2.200 GAM: 0.405  GM3: 0.1500
     1s    -10.521941    1.306199
     2s     -3.560151    0.398421
  6     Thu Sep 22 23:34:11 CEST 2016   EN: 2.550 GAM: 0.640  GM3: 0.1500
     2s    -15.968100    1.979793
     2p     -9.777107    1.850537
     3S     -3.366990    0.633095
  7     Thu Sep 22 23:34:11 CEST 2016   EN: 3.040 GAM: 0.493  GM3:-0.1000
     2s    -24.040776    2.126160
     2p    -14.426520    2.068425
     3S     -5.882278    0.671040
  8     Thu Sep 22 23:34:11 CEST 2016   EN: 3.440 GAM: 0.717  GM3:-0.2000
     2s    -26.695120    2.575264
     2p    -16.014457    2.159448
     3S     -6.622058    0.958679
  9     Tue Jan 17 20:22:52 CET 2017    EN: 3.980 GAM: 0.574  GM3: 0.2000
     2s    -27.565998    2.304073
     2p    -17.439238    2.314354
     3S     -6.120500    0.570243
 16     Tue Jan 17 20:57:36 CET 2017    EN: 2.580 GAM: 0.455  GM3: 0.1020
     3s    -24.488821    2.492075
     3p    -12.136640    1.997904
     3d     -1.796070    1.747541

           ------------------------------------------------- 
          |        Self-Consistent Charge Iterations        |
           ------------------------------------------------- 

          ...................................................
          :                      SETUP                      :
          :.................................................:
          :  # basis functions                 470          :
          :  # atomic orbitals                 465          :
          :  # shells                          291          :
          :  # electrons                       376          :
          :  # halogen bonds                     0          :
          :  max. iterations                   250          :
          :  Hamiltonian                  GFN1-xTB          :
          :  restarted?                      false          :
          :  GBSA solvation                  false          :
          :  PC potential                    false          :
          :  electronic temp.          300.0000000     K    :
          :  accuracy                    1.0000000          :
          :  -> integral cutoff          0.2500000E+02      :
          :  -> integral neglect         0.1000000E-07      :
          :  -> SCF convergence          0.1000000E-05 Eh   :
          :  -> wf. convergence          0.2000000E-04 e    :
          :  Broyden damping             0.4000000          :
          ...................................................

 iter      E             dE          RMSdq      gap      omega  full diag
   1   -232.1670527 -0.232167E+03  0.108E+01    0.03       0.0  T
   2   -217.1117823  0.150553E+02  0.794E+00    0.03       1.0  T
   3    -28.8697027  0.188242E+03  0.118E+01    0.04       1.0  T
   4    -13.7847643  0.150849E+02  0.139E+01    0.05       1.0  T
   5   -224.2516648 -0.210467E+03  0.514E+00    0.07       1.0  T
   6   -231.3204310 -0.706877E+01  0.336E+00    0.12       1.0  T
   7   -236.4246978 -0.510427E+01  0.209E+00    0.42       1.0  T
   8   -236.8346871 -0.409989E+00  0.160E+00    0.02       1.0  T
   9   -236.7285928  0.106094E+00  0.146E+00    0.37       1.0  T
  10   -236.8254053 -0.968125E-01  0.106E+00    0.12       1.0  T
  11   -236.9647657 -0.139360E+00  0.723E-01    0.06       1.0  T
  12   -237.1468213 -0.182056E+00  0.438E-01    0.06       1.0  T
  13   -237.1498409 -0.301960E-02  0.576E-01    0.05       1.0  T
  14   -237.1589429 -0.910198E-02  0.386E-01    0.15       1.0  T
  15   -237.1820141 -0.230713E-01  0.278E-01    0.10       1.0  T
  16   -237.2192671 -0.372529E-01  0.178E-01    0.02       1.0  T
  17   -237.2232597 -0.399264E-02  0.933E-02    0.02       1.0  T
  18   -237.1817442  0.415155E-01  0.304E-01    0.06       1.0  T
  19   -237.2171276 -0.353835E-01  0.179E-01    0.05       1.0  T
  20   -237.2234426 -0.631493E-02  0.778E-02    0.02       1.0  T
  21   -237.2214700  0.197260E-02  0.119E-01    0.03       1.0  T
  22   -237.2237833 -0.231330E-02  0.600E-02    0.02       1.0  T
  23   -237.2241981 -0.414808E-03  0.378E-02    0.02       1.0  T
  24   -237.2243739 -0.175864E-03  0.236E-02    0.02       1.0  T
  25   -237.2243969 -0.229651E-04  0.204E-02    0.02       1.0  T
  26   -237.2244685 -0.716115E-04  0.988E-03    0.02       1.0  T
  27   -237.2244907 -0.222367E-04  0.162E-03    0.02       6.0  T
  28   -237.2244892  0.149717E-05  0.255E-03    0.02       3.8  T
  29   -237.2244913 -0.206140E-05  0.546E-04    0.02      17.7  T
  30   -237.2244914 -0.625115E-07  0.240E-04    0.02      40.3  T
  31   -237.2244914  0.103649E-07  0.276E-04    0.02      35.0  T
  32   -237.2244914 -0.256161E-07  0.938E-05    0.02     103.0  T
  33   -237.2244914  0.860638E-09  0.112E-04    0.02      86.1  T

   *** convergence criteria satisfied after 33 iterations ***

         #    Occupation            Energy/Eh            Energy/eV
      -------------------------------------------------------------
         1        2.0000           -1.1110934             -30.2344
       ...           ...                  ...                  ...
       182        2.0000           -0.3521539              -9.5826
       183        2.0000           -0.3513832              -9.5616
       184        2.0000           -0.3389194              -9.2225
       185        2.0000           -0.3373959              -9.1810
       186        1.9996           -0.3294520              -8.9648
       187        1.9990           -0.3284970              -8.9389
       188        1.1625           -0.3215883              -8.7509 (HOMO)
       189        0.8389           -0.3209679              -8.7340 (LUMO)
       190        0.0000           -0.3082978              -8.3892
       191                         -0.3017771              -8.2118
       192                         -0.2925679              -7.9612
       193                         -0.2782731              -7.5722
       ...                                ...                  ...
       465                        568.0878197           15458.4564
      -------------------------------------------------------------
                  HL-Gap            0.0006204 Eh            0.0169 eV
             Fermi-level           -0.3212768 Eh           -8.7424 eV

 SCC (total)                   0 d,  0 h,  0 min,  2.349 sec
 SCC setup                      ...        0 min,  0.005 sec (  0.194%)
 Dispersion                     ...        0 min,  0.000 sec (  0.015%)
 integral evaluation            ...        0 min,  0.903 sec ( 38.437%)
 zeroth order Hamiltonian       ...        0 min,  0.003 sec (  0.149%)
 iterations                     ...        0 min,  1.173 sec ( 49.944%)
 molecular gradient             ...        0 min,  0.259 sec ( 11.010%)
 printout                       ...        0 min,  0.006 sec (  0.248%)

         :::::::::::::::::::::::::::::::::::::::::::::::::::::
         ::                     SUMMARY                     ::
         :::::::::::::::::::::::::::::::::::::::::::::::::::::
         :: total energy            -233.339498353435 Eh    ::
         :: gradient norm              0.395638709332 Eh/a0 ::
         :: HOMO-LUMO gap              0.016881851333 eV    ::
         ::.................................................::
         :: SCC energy              -237.224491386115 Eh    ::
         :: -> electrostatic           0.620860883030 Eh    ::
         :: repulsion energy           3.981027235435 Eh    ::
         :: dispersion energy         -0.096034202755 Eh    ::
         :: halogen bond corr.         0.000000000000 Eh    ::
         :: add. restraining           0.000000000000 Eh    ::
         :::::::::::::::::::::::::::::::::::::::::::::::::::::

           ------------------------------------------------- 
          |        vertical delta SCC IP calculation        |
           ------------------------------------------------- 

          ...................................................
          :                      SETUP                      :
          :.................................................:
          :  # basis functions                 470          :
          :  # atomic orbitals                 465          :
          :  # shells                          291          :
          :  # electrons                       375          :
          :  # halogen bonds                     0          :
          :  max. iterations                   250          :
          :  Hamiltonian                  GFN1-xTB          :
          :  restarted?                       true          :
          :  GBSA solvation                  false          :
          :  PC potential                    false          :
          :  electronic temp.          300.0000000     K    :
          :  accuracy                    1.0000000          :
          :  -> integral cutoff          0.2500000E+02      :
          :  -> integral neglect         0.1000000E-07      :
          :  -> SCF convergence          0.1000000E-05 Eh   :
          :  -> wf. convergence          0.2000000E-04 e    :
          :  Broyden damping             0.4000000          :
          ...................................................

 iter      E             dE          RMSdq      gap      omega  full diag
   1   -236.8451054 -0.236845E+03  0.255E-01    0.02       0.0  T
   2   -235.5906850  0.125442E+01  0.160E+00    0.24       1.0  T
   3   -236.6154247 -0.102474E+01  0.843E-01    0.13       1.0  T
   4   -236.7669123 -0.151488E+00  0.504E-01    0.15       1.0  T
   5   -236.8630985 -0.961862E-01  0.154E-01    0.04       1.0  T
   6   -236.8634639 -0.365351E-03  0.127E-01    0.04       1.0  T
   7   -236.8662752 -0.281130E-02  0.701E-02    0.07       1.0  T
   8   -236.8673016 -0.102646E-02  0.336E-02    0.09       1.0  T
   9   -236.8673192 -0.175633E-04  0.313E-02    0.09       1.0  T
  10   -236.8672524  0.667532E-04  0.313E-02    0.09       1.0  T
  11   -236.8675562 -0.303749E-03  0.525E-03    0.08       1.8  T
  12   -236.8675427  0.134310E-04  0.821E-03    0.08       1.2  T
  13   -236.8675625 -0.197943E-04  0.267E-03    0.08       3.6  T
  14   -236.8675642 -0.165954E-05  0.177E-03    0.08       5.5  T
  15   -236.8675640  0.167255E-06  0.167E-03    0.08       5.8  T
  16   -236.8675647 -0.711281E-06  0.603E-04    0.08      16.0  T
  17   -236.8675648 -0.101425E-06  0.702E-05    0.08     137.6  T
  18   -236.8675648 -0.263270E-09  0.628E-05    0.08     153.9  T

   *** convergence criteria satisfied after 18 iterations ***

         #    Occupation            Energy/Eh            Energy/eV
      -------------------------------------------------------------
         1        2.0000           -1.1836409             -32.2085
       ...           ...                  ...                  ...
       182        2.0000           -0.4193502             -11.4111
       183        2.0000           -0.4132313             -11.2446
       184        2.0000           -0.4036032             -10.9826
       185        1.9999           -0.4018975             -10.9362
       186        1.9587           -0.3961260             -10.7791
       187        1.8713           -0.3949624             -10.7475
       188        0.9781           -0.3914821             -10.6528 (HOMO)
       189        0.1920           -0.3885974             -10.5743 (LUMO)
       190        0.0000           -0.3757417             -10.2245
       191                         -0.3584614              -9.7542
       192                         -0.3473246              -9.4512
       193                         -0.3415949              -9.2953
       ...                                ...                  ...
       465                        568.0212048           15456.6437
      -------------------------------------------------------------
                  HL-Gap            0.0028847 Eh            0.0785 eV
             Fermi-level           -0.3915576 Eh          -10.6548 eV

 SCC (total)                   0 d,  0 h,  0 min,  1.818 sec
 SCC setup                      ...        0 min,  0.004 sec (  0.209%)
 Dispersion                     ...        0 min,  0.000 sec (  0.011%)
 integral evaluation            ...        0 min,  0.912 sec ( 50.155%)
 zeroth order Hamiltonian       ...        0 min,  0.003 sec (  0.171%)
 iterations                     ...        0 min,  0.633 sec ( 34.816%)
 molecular gradient             ...        0 min,  0.259 sec ( 14.226%)
 printout                       ...        0 min,  0.007 sec (  0.409%)

         :::::::::::::::::::::::::::::::::::::::::::::::::::::
         ::                     SUMMARY                     ::
         :::::::::::::::::::::::::::::::::::::::::::::::::::::
         :: total energy            -232.982571813294 Eh    ::
         :: gradient norm              0.385142909423 Eh/a0 ::
         :: HOMO-LUMO gap              0.078497711155 eV    ::
         ::.................................................::
         :: SCC energy              -236.867564845974 Eh    ::
         :: -> electrostatic           0.657634265700 Eh    ::
         :: repulsion energy           3.981027235435 Eh    ::
         :: dispersion energy         -0.096034202755 Eh    ::
         :: halogen bond corr.         0.000000000000 Eh    ::
         :: add. restraining           0.000000000000 Eh    ::
         :::::::::::::::::::::::::::::::::::::::::::::::::::::

------------------------------------------------------------------------
empirical IP shift (eV):    4.8455
delta SCC IP (eV):    4.8670
------------------------------------------------------------------------
           ------------------------------------------------- 
          |        vertical delta SCC EA calculation        |
           ------------------------------------------------- 

          ...................................................
          :                      SETUP                      :
          :.................................................:
          :  # basis functions                 470          :
          :  # atomic orbitals                 465          :
          :  # shells                          291          :
          :  # electrons                       377          :
          :  # halogen bonds                     0          :
          :  max. iterations                   250          :
          :  Hamiltonian                  GFN1-xTB          :
          :  restarted?                       true          :
          :  GBSA solvation                  false          :
          :  PC potential                    false          :
          :  electronic temp.          300.0000000     K    :
          :  accuracy                    1.0000000          :
          :  -> integral cutoff          0.2500000E+02      :
          :  -> integral neglect         0.1000000E-07      :
          :  -> SCF convergence          0.1000000E-05 Eh   :
          :  -> wf. convergence          0.2000000E-04 e    :
          :  Broyden damping             0.4000000          :
          ...................................................

 iter      E             dE          RMSdq      gap      omega  full diag
   1   -237.4418221 -0.237442E+03  0.440E-01    0.35       0.0  T
   2   -236.8977882  0.544034E+00  0.978E-01    0.27       1.0  T
   3   -237.4597620 -0.561974E+00  0.304E-01    0.40       1.0  T
   4   -237.4921739 -0.324118E-01  0.211E-01    0.26       1.0  T
   5   -237.5032304 -0.110565E-01  0.153E-01    0.25       1.0  T
   6   -237.5073881 -0.415775E-02  0.114E-01    0.18       1.0  T
   7   -237.5045448  0.284336E-02  0.110E-01    0.18       1.0  T
   8   -237.5061551 -0.161034E-02  0.100E-01    0.24       1.0  T
   9   -237.5094010 -0.324590E-02  0.482E-02    0.24       1.0  T
  10   -237.5104058 -0.100477E-02  0.152E-02    0.21       1.0  T
  11   -237.5104582 -0.524302E-04  0.107E-02    0.22       1.0  T
  12   -237.5104943 -0.360848E-04  0.342E-03    0.23       2.8  T
  13   -237.5105003 -0.599976E-05  0.132E-03    0.22       7.3  T
  14   -237.5105006 -0.278379E-06  0.687E-04    0.22      14.1  T
  15   -237.5105006 -0.529009E-07  0.488E-04    0.22      19.8  T
  16   -237.5105007 -0.270354E-07  0.325E-04    0.22      29.7  T
  17   -237.5105007 -0.358976E-07  0.542E-05    0.22     178.5  T
  18   -237.5105007 -0.703778E-09  0.179E-05    0.22     539.7  T

   *** convergence criteria satisfied after 18 iterations ***

         #    Occupation            Energy/Eh            Energy/eV
      -------------------------------------------------------------
         1        2.0000           -1.0398694             -28.2963
       ...           ...                  ...                  ...
       183        2.0000           -0.2877247              -7.8294
       184        2.0000           -0.2843557              -7.7377
       185        2.0000           -0.2752539              -7.4900
       186        2.0000           -0.2749637              -7.4821
       187        2.0000           -0.2637387              -7.1767
       188        1.7039           -0.2545228              -6.9259
       189        1.2819           -0.2528577              -6.8806 (HOMO)
       190        0.0141           -0.2446281              -6.6567 (LUMO)
       191        0.0001           -0.2393983              -6.5144
       192                         -0.2306087              -6.2752
       193                         -0.2148599              -5.8466
       194                         -0.2006000              -5.4586
       ...                                ...                  ...
       465                        568.1536562           15460.2479
      -------------------------------------------------------------
                  HL-Gap            0.0082296 Eh            0.2239 eV
             Fermi-level           -0.2511788 Eh           -6.8349 eV

 SCC (total)                   0 d,  0 h,  0 min,  1.830 sec
 SCC setup                      ...        0 min,  0.004 sec (  0.242%)
 Dispersion                     ...        0 min,  0.000 sec (  0.017%)
 integral evaluation            ...        0 min,  0.902 sec ( 49.283%)
 zeroth order Hamiltonian       ...        0 min,  0.003 sec (  0.186%)
 iterations                     ...        0 min,  0.643 sec ( 35.137%)
 molecular gradient             ...        0 min,  0.267 sec ( 14.614%)
 printout                       ...        0 min,  0.009 sec (  0.518%)

         :::::::::::::::::::::::::::::::::::::::::::::::::::::
         ::                     SUMMARY                     ::
         :::::::::::::::::::::::::::::::::::::::::::::::::::::
         :: total energy            -233.625507661386 Eh    ::
         :: gradient norm              0.412114763558 Eh/a0 ::
         :: HOMO-LUMO gap              0.223938609607 eV    ::
         ::.................................................::
         :: SCC energy              -237.510500694067 Eh    ::
         :: -> electrostatic           0.646119403165 Eh    ::
         :: repulsion energy           3.981027235435 Eh    ::
         :: dispersion energy         -0.096034202755 Eh    ::
         :: halogen bond corr.         0.000000000000 Eh    ::
         :: add. restraining           0.000000000000 Eh    ::
         :::::::::::::::::::::::::::::::::::::::::::::::::::::

------------------------------------------------------------------------
empirical EA shift (eV):    4.8455
delta SCC EA (eV):    2.9372
------------------------------------------------------------------------
           -------------------------------------------------
          |                Property Printout                |
           -------------------------------------------------

    * Orbital Energies and Occupations

         #    Occupation            Energy/Eh            Energy/eV
      -------------------------------------------------------------
         1        2.0000           -1.0398694             -28.2963
       ...           ...                  ...                  ...
       177        2.0000           -0.3343174              -9.0972
       178        2.0000           -0.3245169              -8.8306
       179        2.0000           -0.3092369              -8.4148
       180        2.0000           -0.3025538              -8.2329
       181        2.0000           -0.2985629              -8.1243
       182        2.0000           -0.2915922              -7.9346
       183        2.0000           -0.2877247              -7.8294
       184        2.0000           -0.2843557              -7.7377
       185        2.0000           -0.2752539              -7.4900
       186        2.0000           -0.2749637              -7.4821
       187        2.0000           -0.2637387              -7.1767
       188        1.7039           -0.2545228              -6.9259
       189        1.2819           -0.2528577              -6.8806 (HOMO)
       190        0.0141           -0.2446281              -6.6567 (LUMO)
       191        0.0001           -0.2393983              -6.5144
       192                         -0.2306087              -6.2752
       193                         -0.2148599              -5.8466
       194                         -0.2006000              -5.4586
       195                         -0.1891678              -5.1475
       196                         -0.1704073              -4.6370
       197                         -0.1641484              -4.4667
       198                         -0.1620342              -4.4092
       199                         -0.1613441              -4.3904
       200                         -0.1433775              -3.9015
       ...                                ...                  ...
       465                        568.1536562           15460.2479
      -------------------------------------------------------------
                  HL-Gap            0.0082296 Eh            0.2239 eV
             Fermi-level           -0.2511788 Eh           -6.8349 eV

  Mulliken/CM5 charges        n(s)   n(p)   n(d)
     1 C  -0.33208 -0.29656   0.928  2.739  0.000
     2 O  -0.51907 -0.56506   1.774  3.707  0.000
     3 C  -0.30676 -0.30839   1.084  2.609  0.000
     4 C  -0.28830 -0.33556   0.949  2.762  0.000
     5 C   0.01858  0.03529   1.087  2.931  0.000
     6 C  -0.06233 -0.04579   1.121  2.816  0.000
     7 C   0.06388  0.01662   1.043  3.021  0.000
     8 C   0.16538  0.16231   0.971  3.194  0.000
     9 C   0.01639  0.01578   1.073  2.944  0.000
    10 C   0.02261  0.02883   1.007  3.016  0.000
    11 C  -0.09634  0.02130   1.203  2.701  0.000
    12 N   0.30945  0.17894   1.521  3.788  0.000
    13 C  -0.09708  0.02206   1.203  2.700  0.000
    14 N   0.30832  0.17814   1.532  3.777  0.000
    15 C   0.13179  0.13000   1.026  3.106  0.000
    16 F   0.19293  0.16966   1.695  5.498  0.000
    17 C   0.06144  0.01368   1.049  3.013  0.000
    18 F   0.22429  0.20124   1.715  5.509  0.000
    19 C  -0.14738 -0.11271   1.157  2.695  0.000
    20 O   0.33174  0.27542   1.638  4.694  0.000
    21 C   0.00603  0.00444   1.088  2.918  0.000
    22 C   0.01378 -0.03345   1.080  2.934  0.000
    23 C  -0.11150 -0.09480   1.138  2.751  0.000
    24 C  -0.11481 -0.09829   1.143  2.742  0.000
    25 C   0.01502 -0.03224   1.072  2.943  0.000
    26 C  -0.00842 -0.01149   1.071  2.921  0.000
    27 C  -0.01785 -0.01863   1.091  2.891  0.000
    28 C  -0.00530  0.00073   1.031  2.964  0.000
    29 C  -0.11099  0.00631   1.205  2.684  0.000
    30 N   0.28539  0.15510   1.528  3.758  0.000
    31 C  -0.10982  0.00928   1.204  2.687  0.000
    32 N   0.28859  0.15820   1.526  3.763  0.000
    33 C   0.02880  0.02632   1.048  2.980  0.000
    34 F   0.16899  0.14573   1.694  5.475  0.000
    35 C   0.01292 -0.03419   1.074  2.939  0.000
    36 F   0.17274  0.14971   1.695  5.478  0.000
    37 C  -0.00795 -0.00291   1.151  2.841  0.000
    38 S   0.06844  0.03309   1.877  4.127  0.065
    39 C  -0.01960 -0.00501   1.161  2.820  0.000
    40 C   0.00318 -0.00208   1.081  2.922  0.000
    41 C   0.02439 -0.02508   1.073  2.952  0.000
    42 C  -0.00133  0.01287   1.142  2.857  0.000
    43 C   0.00592  0.00029   1.095  2.911  0.000
    44 C  -0.01529 -0.03256   1.086  2.898  0.000
    45 S   0.06312  0.03537   1.881  4.083  0.099
    46 C  -0.01613 -0.00445   1.153  2.831  0.000
    47 C   0.03736 -0.01165   1.060  2.977  0.000
    48 C   0.00928  0.01659   1.065  2.944  0.000
    49 C  -0.09558 -0.07547   1.128  2.776  0.000
    50 C  -0.09159 -0.07069   1.132  2.776  0.000
    51 C   0.00752  0.01430   1.069  2.939  0.000
    52 C  -0.07231  0.01315   1.137  2.790  0.000
    53 C  -0.07107  0.01633   1.141  2.787  0.000
    54 N   0.25218  0.07771   1.444  3.808  0.000
    55 S  -0.14216 -0.00324   1.855  3.678  0.325
    56 N   0.24397  0.07456   1.452  3.792  0.000
    57 C  -0.01334 -0.00208   1.151  2.836  0.000
    58 S   0.08577  0.05294   1.877  4.128  0.081
    59 C  -0.00093  0.01363   1.143  2.856  0.000
    60 C   0.00841  0.00328   1.086  2.922  0.000
    61 C   0.03865 -0.00952   1.072  2.966  0.000
    62 C   0.00190  0.01656   1.141  2.861  0.000
    63 C   0.01112  0.00580   1.082  2.929  0.000
    64 C  -0.01285 -0.03007   1.090  2.897  0.000
    65 S   0.21489  0.18504   1.880  4.140  0.195
    66 C   0.02483  0.03049   1.130  2.894  0.000
    67 C   0.04357 -0.00720   1.073  2.971  0.000
    68 F   0.15679  0.13148   1.659  5.497  0.000
    69 F   0.16602  0.14323   1.677  5.489  0.000
    70 C   0.04120 -0.06576   1.084  2.957  0.000
    71 C   0.05106 -0.05646   1.079  2.972  0.000
    72 C   0.04847 -0.05863   1.080  2.969  0.000
    73 C   0.04724 -0.05986   1.078  2.969  0.000
    74 C   0.36062  0.20789   0.929  3.432  0.000
    75 C   0.58287  0.43153   0.914  3.669  0.000
    76 C   0.60387  0.45109   0.853  3.751  0.000
    77 C   0.58375  0.43091   0.874  3.710  0.000
    78 H   0.16934  0.22885   1.169  0.000  0.000
    79 H  -0.02394  0.04112   0.976  0.000  0.000
    80 H  -0.02835  0.03989   0.972  0.000  0.000
    81 H  -0.04442  0.01524   0.956  0.000  0.000
    82 H  -0.03785  0.02746   0.962  0.000  0.000
    83 H  -0.02952  0.04068   0.970  0.000  0.000
    84 H  -0.02999  0.04184   0.970  0.000  0.000
    85 H  -0.00941  0.05178   0.991  0.000  0.000
    86 H   0.00190  0.07162   1.002  0.000  0.000
    87 H   0.00392  0.06234   1.004  0.000  0.000
    88 H   0.02233  0.07958   1.022  0.000  0.000
    89 H   0.02889  0.08569   1.029  0.000  0.000
    90 H   0.03897  0.09651   1.039  0.000  0.000
    91 H   0.03903  0.09573   1.039  0.000  0.000
    92 H   0.04579  0.10335   1.046  0.000  0.000
    93 H   0.03920  0.09643   1.039  0.000  0.000
    94 H   0.04806  0.10550   1.048  0.000  0.000
    95 H   0.03697  0.09423   1.037  0.000  0.000
    96 H   0.06325  0.11748   1.063  0.000  0.000
    97 H  -0.30898 -0.25718   0.691  0.000  0.000
    98 H  -0.28024 -0.22720   0.720  0.000  0.000
    99 H  -0.28129 -0.22721   0.719  0.000  0.000
   100 H  -0.27346 -0.22164   0.727  0.000  0.000
   101 H  -0.24842 -0.19428   0.752  0.000  0.000
   102 H  -0.29577 -0.24250   0.704  0.000  0.000
   103 H  -0.27171 -0.21992   0.728  0.000  0.000
   104 H  -0.28834 -0.23429   0.712  0.000  0.000
   105 H  -0.26912 -0.21585   0.731  0.000  0.000
   106 H  -0.26314 -0.21135   0.737  0.000  0.000
   107 H  -0.29097 -0.23719   0.709  0.000  0.000
(R)spin-density population

 Mulliken population n(s)   n(p)   n(d)
     1 C   0.0196   0.001  0.019  0.000
     2 O   0.2623   0.008  0.254  0.000
     3 C   0.0103  -0.000  0.010  0.000
     4 C   0.0582   0.049  0.009  0.000
     5 C   0.0110   0.009  0.002  0.000
     6 C  -0.0017  -0.003  0.001  0.000
     7 C  -0.0009  -0.003  0.002  0.000
     8 C   0.0055   0.004  0.002  0.000
     9 C   0.0269   0.003  0.024  0.000
    10 C   0.0175   0.001  0.016  0.000
    11 C   0.0021   0.000  0.002  0.000
    12 N   0.0088   0.000  0.009  0.000
    13 C   0.0032   0.001  0.003  0.000
    14 N   0.0077   0.000  0.008  0.000
    15 C   0.1737   0.021  0.152  0.000
    16 F  -0.0037  -0.004  0.000  0.000
    17 C   0.0216   0.001  0.021  0.000
    18 F   0.0175   0.016  0.002  0.000
    19 C   0.0011   0.000  0.001  0.000
    20 O   0.0011   0.000  0.001  0.000
    21 C   0.0018   0.000  0.002  0.000
    22 C   0.0007   0.000  0.001  0.000
    23 C   0.0025   0.000  0.002  0.000
    24 C   0.0003   0.000  0.000  0.000
    25 C   0.0026   0.000  0.003  0.000
    26 C   0.0006   0.000  0.001  0.000
    27 C   0.0086   0.000  0.009  0.000
    28 C   0.0079  -0.000  0.008  0.000
    29 C   0.0010   0.000  0.001  0.000
    30 N   0.0039   0.000  0.004  0.000
    31 C   0.0011   0.000  0.001  0.000
    32 N   0.0038   0.000  0.004  0.000
    33 C   0.0034   0.000  0.003  0.000
    34 F   0.0000  -0.000  0.000  0.000
    35 C   0.0111   0.000  0.011  0.000
    36 F   0.0003  -0.000  0.000  0.000
    37 C   0.0018   0.000  0.002  0.000
    38 S   0.0056  -0.000  0.005  0.001
    39 C   0.0055   0.000  0.005  0.000
    40 C   0.0011   0.000  0.001  0.000
    41 C   0.0059   0.000  0.006  0.000
    42 C   0.0041   0.000  0.004  0.000
    43 C   0.0020   0.000  0.002  0.000
    44 C   0.0002   0.000  0.000  0.000
    45 S   0.0047   0.000  0.004  0.001
    46 C   0.0024   0.000  0.002  0.000
    47 C   0.0053   0.000  0.005  0.000
    48 C   0.0113  -0.000  0.011  0.000
    49 C   0.0066   0.000  0.007  0.000
    50 C   0.0093   0.000  0.009  0.000
    51 C   0.0083   0.000  0.008  0.000
    52 C   0.0002   0.000  0.000  0.000
    53 C   0.0006  -0.000  0.001  0.000
    54 N   0.0095   0.000  0.009  0.000
    55 S   0.0197   0.000  0.016  0.004
    56 N   0.0108  -0.000  0.011  0.000
    57 C   0.0055   0.000  0.005  0.000
    58 S   0.0054  -0.000  0.005  0.001
    59 C   0.0039   0.000  0.004  0.000
    60 C   0.0058   0.000  0.006  0.000
    61 C   0.0039   0.000  0.004  0.000
    62 C   0.0291   0.004  0.025  0.000
    63 C   0.0014  -0.000  0.001  0.000
    64 C   0.0015   0.000  0.001  0.000
    65 S   0.0513   0.001  0.008  0.043
    66 C   0.0074   0.001  0.007  0.000
    67 C   0.0129   0.000  0.012  0.000
    68 F   0.0009  -0.000  0.001  0.000
    69 F   0.0013  -0.000  0.001  0.000
    70 C   0.0003   0.000  0.000  0.000
    71 C   0.0002   0.000  0.000  0.000
    72 C   0.0005   0.000  0.001  0.000
    73 C   0.0007   0.000  0.001  0.000
    74 C   0.0004   0.000  0.000  0.000
    75 C   0.0001   0.000  0.000  0.000
    76 C   0.0080   0.000  0.008  0.000
    77 C   0.0044  -0.000  0.004  0.000
    78 H   0.0343   0.034  0.000  0.000
    79 H  -0.0013  -0.001  0.000  0.000
    80 H   0.0106   0.011  0.000  0.000
    81 H   0.0000   0.000  0.000  0.000
    82 H   0.0000   0.000  0.000  0.000
    83 H   0.0000   0.000  0.000  0.000
    84 H   0.0000   0.000  0.000  0.000
    85 H   0.0000   0.000  0.000  0.000
    86 H   0.0001   0.000  0.000  0.000
    87 H   0.0004   0.000  0.000  0.000
    88 H   0.0000   0.000  0.000  0.000
    89 H   0.0000   0.000  0.000  0.000
    90 H   0.0000   0.000  0.000  0.000
    91 H   0.0000   0.000  0.000  0.000
    92 H   0.0003   0.000  0.000  0.000
    93 H   0.0002   0.000  0.000  0.000
    94 H   0.0001   0.000  0.000  0.000
    95 H   0.0004   0.000  0.000  0.000
    96 H  -0.0000  -0.000  0.000  0.000
    97 H   0.0001   0.000  0.000  0.000
    98 H   0.0000   0.000  0.000  0.000
    99 H   0.0000   0.000  0.000  0.000
   100 H   0.0000   0.000  0.000  0.000
   101 H   0.0000   0.000  0.000  0.000
   102 H   0.0013   0.001  0.000  0.000
   103 H   0.0005   0.000  0.000  0.000
   104 H   0.0004   0.000  0.000  0.000
   105 H   0.0005   0.000  0.000  0.000
   106 H   0.0001   0.000  0.000  0.000
   107 H   0.0005   0.000  0.000  0.000

Wiberg/Mayer (AO) data.
largest (>0.10) Wiberg bond orders for each atom
          total WBO             WBO to atom ...
     1  C   3.763        O    2 1.721    C    3 1.101    C   15 0.773
     2  O   2.196        C    1 1.721    S   65 0.140    C    4 0.112
     3  C   3.820        C    4 1.271    C    8 1.222    C    1 1.101
     4  C   4.121        C    5 1.417    C    3 1.271    H   78 0.946    C    7 0.113    O    2 0.112
     5  C   3.862        C    4 1.417    C    6 1.317    F   18 0.985
     6  C   3.953        C    7 1.455    C    5 1.317    F   16 1.032
     7  C   3.818        C    6 1.455    C    8 1.309    H   79 0.996    C    4 0.113
     8  C   3.731        C    7 1.309    C    3 1.222    C    9 1.068
     9  C   3.760        C   10 1.349    C   15 1.155    C    8 1.068
    10  C   3.681        C    9 1.349    C   11 1.171    C   13 1.164
    11  C   4.089        N   12 2.862    C   10 1.171
    12  N   2.897        C   11 2.862
    13  C   4.088        N   14 2.880    C   10 1.164
    14  N   2.916        C   13 2.880
    15  C   3.498        C   17 1.384    C    9 1.155    C    1 0.773
    16  F   0.960        C    6 1.032
    17  C   3.703        C   15 1.384    C   66 1.378    H   80 0.971
    18  F   0.951        C    5 0.985
    19  C   3.959        O   20 1.790    C   33 1.114    C   21 1.038
    20  O   1.974        C   19 1.790
    21  C   3.893        C   22 1.446    C   26 1.328    C   19 1.038
    22  C   3.885        C   21 1.446    C   23 1.403    H   81 0.993
    23  C   3.964        C   22 1.403    C   24 1.391    F   36 1.055
    24  C   3.990        C   25 1.409    C   23 1.391    F   34 1.057
    25  C   3.843        C   26 1.423    C   24 1.409    H   82 1.000
    26  C   3.877        C   25 1.423    C   21 1.328    C   27 1.095
    27  C   3.836        C   28 1.453    C   33 1.194    C   26 1.095
    28  C   3.772        C   27 1.453    C   29 1.153    C   31 1.151
    29  C   4.100        N   30 2.897    C   28 1.153
    30  N   2.916        C   29 2.897
    31  C   4.092        N   32 2.898    C   28 1.151
    32  N   2.917        C   31 2.898
    33  C   3.797        C   35 1.418    C   27 1.194    C   19 1.114
    34  F   0.994        C   24 1.057
    35  C   3.755        C   33 1.418    C   37 1.376    H   83 0.989
    36  F   0.989        C   23 1.055
    37  C   3.912        C   35 1.376    C   41 1.348    S   38 1.120
    38  S   2.489        C   39 1.238    C   37 1.120
    39  C   3.899        C   40 1.310    C   42 1.280    S   38 1.238
    40  C   3.810        C   41 1.479    C   39 1.310    C   44 1.015
    41  C   3.775        C   40 1.479    C   37 1.348    H   84 0.989
    42  C   3.893        C   43 1.348    C   39 1.280    S   45 1.197
    43  C   3.817        C   47 1.424    C   42 1.348    C   44 1.008
    44  C   3.862        C   40 1.015    C   43 1.008    C   71 0.957    C   70 0.940
    45  S   2.564        C   42 1.197    C   46 1.183
    46  C   3.882        C   47 1.420    C   48 1.235    S   45 1.183
    47  C   3.782        C   43 1.424    C   46 1.420    H   85 1.001
    48  C   3.821        C   49 1.341    C   46 1.235    C   53 1.220
    49  C   3.889        C   50 1.405    C   48 1.341    F   68 1.034
    50  C   3.897        C   49 1.405    C   51 1.336    F   69 1.031
    51  C   3.826        C   50 1.336    C   57 1.246    C   52 1.213
    52  C   3.998        N   54 1.502    C   51 1.213    C   53 1.195
    53  C   4.006        N   56 1.494    C   48 1.220    C   52 1.195
    54  N   2.888        C   52 1.502    S   55 1.394
    55  S   3.052        N   54 1.394    N   56 1.377
    56  N   2.933        C   53 1.494    S   55 1.377
    57  C   3.881        C   61 1.414    C   51 1.246    S   58 1.166
    58  S   2.500        C   59 1.205    C   57 1.166
    59  C   3.892        C   60 1.340    C   62 1.290    S   58 1.205
    60  C   3.793        C   61 1.430    C   59 1.340    C   64 1.009
    61  C   3.806        C   60 1.430    C   57 1.414    H   86 0.996
    62  C   3.810        C   63 1.307    C   59 1.290    S   65 1.171
    63  C   3.813        C   67 1.487    C   62 1.307    C   64 1.007
    64  C   3.862        C   60 1.009    C   63 1.007    C   72 0.954    C   73 0.949
    65  S   2.594        C   62 1.171    C   66 1.113    O    2 0.140
    66  C   3.855        C   17 1.378    C   67 1.311    S   65 1.113
    67  C   3.786        C   63 1.487    C   66 1.311    H   87 0.991
    68  F   0.841        C   49 1.034
    69  F   0.898        C   50 1.031
    70  C   3.860        H   89 1.004    H   88 1.001    C   74 0.976    C   44 0.940
    71  C   3.841        H   90 1.000    H   91 0.999    C   75 0.958    C   44 0.957
    72  C   3.838        H   93 0.999    H   92 0.995    C   64 0.954    C   77 0.952
    73  C   3.825        H   94 0.998    H   95 0.996    C   76 0.950    C   64 0.949
    74  C   3.561        H   96 1.023    C   70 0.976    H   98 0.857    H   97 0.813
    75  C   3.439        C   71 0.958    H  101 0.881    H  100 0.843    H   99 0.843
    76  C   3.303        C   73 0.950    H  103 0.831    H  104 0.818    H  102 0.786
    77  C   3.354        C   72 0.952    H  106 0.856    H  105 0.838    H  107 0.802
    78  H   1.055        C    4 0.946
    79  H   1.069        C    7 0.996
    80  H   1.047        C   17 0.971
    81  H   1.035        C   22 0.993
    82  H   1.068        C   25 1.000
    83  H   1.051        C   35 0.989
    84  H   1.065        C   41 0.989
    85  H   1.077        C   47 1.001
    86  H   1.109        C   61 0.996
    87  H   1.096        C   67 0.991
    88  H   1.074        C   70 1.001
    89  H   1.088        C   70 1.004
    90  H   1.083        C   71 1.000
    91  H   1.077        C   71 0.999
    92  H   1.097        C   72 0.995
    93  H   1.087        C   72 0.999
    94  H   1.093        C   73 0.998
    95  H   1.075        C   73 0.996
    96  H   1.077        C   74 1.023
    97  H   0.907        C   74 0.813
    98  H   0.931        C   74 0.857
    99  H   0.962        C   75 0.843
   100  H   0.942        C   75 0.843
   101  H   0.970        C   75 0.881
   102  H   0.949        C   76 0.786
   103  H   0.936        C   76 0.831
   104  H   0.961        C   76 0.818
   105  H   0.955        C   77 0.838
   106  H   0.949        C   77 0.856
   107  H   0.946        C   77 0.802

 dipole moment from electron density (au)
     X       Y       Z   
  -7.8273 -10.4753 -16.7417  total (Debye):   53.995


           -------------------------------------------------
          | TOTAL ENERGY             -233.625507661386 Eh   |
          | GRADIENT NORM               0.412114763558 Eh/α |
          | HOMO-LUMO GAP               0.223938609607 eV   |
           -------------------------------------------------

------------------------------------------------------------------------
 * finished run on 2021/12/02 at 16:30:29.905     
------------------------------------------------------------------------
 total:
 * wall-time:     0 d,  0 h,  0 min,  6.920 sec
 *  cpu-time:     0 d,  0 h,  0 min,  6.861 sec
 * ratio c/w:     0.992 speedup
 SCF:
 * wall-time:     0 d,  0 h,  0 min,  6.000 sec
 *  cpu-time:     0 d,  0 h,  0 min,  5.953 sec
 * ratio c/w:     0.992 speedup

