      -----------------------------------------------------------      
     |                   =====================                   |     
     |                           x T B                           |     
     |                   =====================                   |     
     |                         S. Grimme                         |     
     |          Mulliken Center for Theoretical Chemistry        |     
     |                    University of Bonn                     |     
     |                Version 6.2 RC2 (SAW190805)                |     
      -----------------------------------------------------------      

   This program is distributed in the hope that it will be useful,
   but WITHOUT ANY WARRANTY; without even the implied warranty of
   MERCHANTABILITY or FITNESS FOR A PARTICULAR PURPOSE.
   
   FOR NON-COMMERCIAL, ACADEMIA USE ONLY.
   
   Cite this work as:
   * S. Grimme, C. Bannwarth, P. Shushkov, J. Chem. Theory Comput., 2017,
     13, 1989-2009. DOI: 10.1021/acs.jctc.7b00118
   * C. Bannwarth, S. Ehlert and S. Grimme., J. Chem. Theory Comput., 2019,
     15, 1652-1671. DOI: 10.1021/acs.jctc.8b01176
   * P. Pracht, E. Caldeweyher, S. Ehlert, S. Grimme, ChemRxiv, 2019, preprint.
     DOI: 10.26434/chemrxiv.8326202.v1
   
   for DFT-D4:
   * E. Caldeweyher, C. Bannwarth and S. Grimme, J. Chem. Phys., 2017,
     147, 034112. DOI: 10.1063/1.4993215
   * E. Caldeweyher, S. Ehlert, A. Hansen, H. Neugebauer, S. Spicher,
     C. Bannwarth and S. Grimme, J. Chem. Phys., 2019, 150, 154122.
     DOI: 10.1063/1.5090222
   
   for sTDA-xTB:
   * S. Grimme and C. Bannwarth, J. Chem. Phys., 2016, 145, 054103.
     DOI: 10.1063/1.4959605
   
   in the mass-spec context:
   * V. Asgeirsson, C. Bauer and S. Grimme, Chem. Sci., 2017, 8, 4879.
     DOI: 10.1039/c7sc00601b
   
   for metadynamics refer to:
   * S. Grimme, J. Chem. Theory Comput., 2019, 155, 2847-2862
     DOI: 10.1021/acs.jctc.9b00143
   
   with help from (in alphabetical order)
   C. Bannwarth, F. Bohle, G. Brandenburg, E. Caldeweyher, M. Checinski,
   S. Dohm, S. Ehlert, S. Ehrlich, F. März, H. Neugebauer, J. Pisarek,
   P. Pracht, P. Shushkov, and S. Spicher.
   
 * started run on 2021/12/02 at 16:34:25.671     

           -------------------------------------------------
          |                Calculation Setup                |
           -------------------------------------------------

          program call               : /ihome/ghutchison/geoffh/xtb/xtb BTCIC.xyz --vipea
          hostname                   : smp-n128
          coordinate file            : BTCIC.xyz
          omp threads                :                     1
          number of atoms            :                   107
          number of electrons        :                   340
          charge                     :                     0
          spin                       :                   0.0
          first test random number   :      0.09030147952755


########################################################################
# WARNING! Please study the warnings concerning your input carefully
#  - XTBPATH is not set, using XTBHOME instead
########################################################################

           ------------------------------------------------- 
          |                 I P E A - x T B                 |
          |  Ionisation Potentials and Electron Affinities  |
           ------------------------------------------------- 
             KAB for M(3d)-M(3d) :                1.1000
             KAB for M(4d)-M(4d) :                1.2000
             KAB for M(5d)-M(5d) :                1.2000
             k(s)                :                2.1500
             k(p)                :                2.3000
             k(d)                :                2.0000
             k(f)                :                0.0000
             kEN (H0ij)          :                0.7000
             D3 a1               :                0.6300
             D3 a2               :                5.0000
             D3 s6               :                1.0000
             D3 s8               :                2.4000
             D3 s9               :                0.0000
             alphaj              :                1.0000
             XBdamp              :                0.4400
             XBrad               :                1.3000
             kcnsh               :      1.0000   -0.3000   -0.5000    0.5000

  Z AO/shell   Hii/eV     exponent
  1     Thu Sep 22 23:34:11 CEST 2016   EN: 2.200 GAM: 0.405  GM3: 0.1500
     1s    -10.521941    1.306199
     2s     -3.560151    0.398421
  6     Thu Sep 22 23:34:11 CEST 2016   EN: 2.550 GAM: 0.640  GM3: 0.1500
     2s    -15.968100    1.979793
     2p     -9.777107    1.850537
     3S     -3.366990    0.633095
  7     Thu Sep 22 23:34:11 CEST 2016   EN: 3.040 GAM: 0.493  GM3:-0.1000
     2s    -24.040776    2.126160
     2p    -14.426520    2.068425
     3S     -5.882278    0.671040
  8     Thu Sep 22 23:34:11 CEST 2016   EN: 3.440 GAM: 0.717  GM3:-0.2000
     2s    -26.695120    2.575264
     2p    -16.014457    2.159448
     3S     -6.622058    0.958679
 16     Tue Jan 17 20:57:36 CET 2017    EN: 2.580 GAM: 0.455  GM3: 0.1020
     3s    -24.488821    2.492075
     3p    -12.136640    1.997904
     3d     -1.796070    1.747541

           ------------------------------------------------- 
          |        Self-Consistent Charge Iterations        |
           ------------------------------------------------- 

          ...................................................
          :                      SETUP                      :
          :.................................................:
          :  # basis functions                 452          :
          :  # atomic orbitals                 447          :
          :  # shells                          285          :
          :  # electrons                       340          :
          :  # halogen bonds                     0          :
          :  max. iterations                   250          :
          :  Hamiltonian                  GFN1-xTB          :
          :  restarted?                      false          :
          :  GBSA solvation                  false          :
          :  PC potential                    false          :
          :  electronic temp.          300.0000000     K    :
          :  accuracy                    1.0000000          :
          :  -> integral cutoff          0.2500000E+02      :
          :  -> integral neglect         0.1000000E-07      :
          :  -> SCF convergence          0.1000000E-05 Eh   :
          :  -> wf. convergence          0.2000000E-04 e    :
          :  Broyden damping             0.4000000          :
          ...................................................

 iter      E             dE          RMSdq      gap      omega  full diag
   1   -213.9085851 -0.213909E+03  0.105E+01    0.23       0.0  T
   2   -211.4271166  0.248147E+01  0.858E+00    0.15       1.0  T
   3   -201.6427735  0.978434E+01  0.628E+00    0.07       1.0  T
   4   -171.6157560  0.300270E+02  0.763E+00    0.06       1.0  T
   5   -210.2637084 -0.386480E+02  0.372E+00    0.50       1.0  T
   6   -213.2992752 -0.303557E+01  0.280E+00    0.03       1.0  T
   7   -214.0066181 -0.707343E+00  0.234E+00    0.36       1.0  T
   8   -214.7842773 -0.777659E+00  0.179E+00    0.15       1.0  T
   9   -214.9981251 -0.213848E+00  0.150E+00    0.32       1.0  T
  10   -215.5698480 -0.571723E+00  0.936E-01    0.38       1.0  T
  11   -215.8789376 -0.309090E+00  0.364E-01    0.26       1.0  T
  12   -215.6302937  0.248644E+00  0.808E-01    0.34       1.0  T
  13   -215.5558443  0.744493E-01  0.101E+00    0.63       1.0  T
  14   -215.6877361 -0.131892E+00  0.772E-01    0.42       1.0  T
  15   -215.9038321 -0.216096E+00  0.139E-01    0.26       1.0  T
  16   -215.8400602  0.637720E-01  0.381E-01    0.33       1.0  T
  17   -215.8566973 -0.166371E-01  0.349E-01    0.26       1.0  T
  18   -215.8927377 -0.360404E-01  0.189E-01    0.25       1.0  T
  19   -215.9080517 -0.153140E-01  0.217E-02    0.25       1.0  T
  20   -215.9075593  0.492422E-03  0.394E-02    0.25       1.0  T
  21   -215.9082157 -0.656473E-03  0.770E-03    0.25       1.3  T
  22   -215.9081968  0.189110E-04  0.106E-02    0.25       1.0  T
  23   -215.9081899  0.692516E-05  0.105E-02    0.25       1.0  T
  24   -215.9082358 -0.459111E-04  0.406E-03    0.25       2.4  T
  25   -215.9082277  0.809908E-05  0.583E-03    0.25       1.7  T
  26   -215.9082420 -0.142450E-04  0.911E-04    0.25      10.6  T
  27   -215.9082412  0.782567E-06  0.162E-03    0.25       6.0  T
  28   -215.9082421 -0.916094E-06  0.774E-04    0.25      12.5  T
  29   -215.9082423 -0.206507E-06  0.376E-04    0.25      25.7  T
  30   -215.9082423 -0.248873E-07  0.293E-04    0.25      33.0  T
  31   -215.9082424 -0.363264E-07  0.243E-05    0.25     397.3  T
  32   -215.9082424  0.185170E-08  0.713E-05    0.25     135.6  T

   *** convergence criteria satisfied after 32 iterations ***

         #    Occupation            Energy/Eh            Energy/eV
      -------------------------------------------------------------
         1        2.0000           -3.5227720             -95.8595
       ...           ...                  ...                  ...
       164        2.0000           -0.3702179             -10.0741
       165        2.0000           -0.3628283              -9.8731
       166        2.0000           -0.3562671              -9.6945
       167        2.0000           -0.3493668              -9.5068
       168        2.0000           -0.3433314              -9.3425
       169        2.0000           -0.3195476              -8.6953
       170        1.9834           -0.3065192              -8.3408 (HOMO)
       171        0.0166           -0.2974280              -8.0934 (LUMO)
       172        0.0000           -0.2877702              -7.8306
       173                         -0.2815641              -7.6617
       174                         -0.2772288              -7.5438
       175                         -0.2712590              -7.3813
       ...                                ...                  ...
       447                        544.8317763           14825.6273
      -------------------------------------------------------------
                  HL-Gap            0.0090913 Eh            0.2474 eV
             Fermi-level           -0.3019736 Eh           -8.2171 eV

 SCC (total)                   0 d,  0 h,  0 min,  2.104 sec
 SCC setup                      ...        0 min,  0.004 sec (  0.207%)
 Dispersion                     ...        0 min,  0.000 sec (  0.017%)
 integral evaluation            ...        0 min,  0.814 sec ( 38.693%)
 zeroth order Hamiltonian       ...        0 min,  0.003 sec (  0.157%)
 iterations                     ...        0 min,  1.028 sec ( 48.863%)
 molecular gradient             ...        0 min,  0.246 sec ( 11.714%)
 printout                       ...        0 min,  0.007 sec (  0.347%)

         :::::::::::::::::::::::::::::::::::::::::::::::::::::
         ::                     SUMMARY                     ::
         :::::::::::::::::::::::::::::::::::::::::::::::::::::
         :: total energy            -211.930281730803 Eh    ::
         :: gradient norm              0.658628790227 Eh/a0 ::
         :: HOMO-LUMO gap              0.247386012710 eV    ::
         ::.................................................::
         :: SCC energy              -215.908242369157 Eh    ::
         :: -> electrostatic           0.398080414537 Eh    ::
         :: repulsion energy           4.073450980898 Eh    ::
         :: dispersion energy         -0.095490342543 Eh    ::
         :: halogen bond corr.         0.000000000000 Eh    ::
         :: add. restraining           0.000000000000 Eh    ::
         :::::::::::::::::::::::::::::::::::::::::::::::::::::

           ------------------------------------------------- 
          |        vertical delta SCC IP calculation        |
           ------------------------------------------------- 

          ...................................................
          :                      SETUP                      :
          :.................................................:
          :  # basis functions                 452          :
          :  # atomic orbitals                 447          :
          :  # shells                          285          :
          :  # electrons                       339          :
          :  # halogen bonds                     0          :
          :  max. iterations                   250          :
          :  Hamiltonian                  GFN1-xTB          :
          :  restarted?                       true          :
          :  GBSA solvation                  false          :
          :  PC potential                    false          :
          :  electronic temp.          300.0000000     K    :
          :  accuracy                    1.0000000          :
          :  -> integral cutoff          0.2500000E+02      :
          :  -> integral neglect         0.1000000E-07      :
          :  -> SCF convergence          0.1000000E-05 Eh   :
          :  -> wf. convergence          0.2000000E-04 e    :
          :  Broyden damping             0.4000000          :
          ...................................................

 iter      E             dE          RMSdq      gap      omega  full diag
   1   -215.5262584 -0.215526E+03  0.296E-01    0.25       0.0  T
   2   -211.8072799  0.371898E+01  0.328E+00    0.07       1.0  T
   3   -215.5121136 -0.370483E+01  0.392E-01    0.49       1.0  T
   4   -215.5124136 -0.299988E-03  0.391E-01    0.26       1.0  T
   5   -215.5267549 -0.143413E-01  0.315E-01    0.33       1.0  T
   6   -215.5532051 -0.264502E-01  0.187E-01    0.25       1.0  T
   7   -215.5604608 -0.725565E-02  0.121E-01    0.25       1.0  T
   8   -215.5635027 -0.304193E-02  0.690E-02    0.25       1.0  T
   9   -215.5630151  0.487616E-03  0.762E-02    0.25       1.0  T
  10   -215.5630885 -0.734196E-04  0.554E-02    0.25       1.0  T
  11   -215.5634424 -0.353878E-03  0.312E-02    0.26       1.0  T
  12   -215.5636555 -0.213101E-03  0.230E-02    0.26       1.0  T
  13   -215.5637020 -0.465224E-04  0.120E-02    0.26       1.0  T
  14   -215.5637188 -0.168111E-04  0.286E-03    0.26       3.4  T
  15   -215.5637203 -0.150314E-05  0.103E-03    0.26       9.4  T
  16   -215.5637207 -0.438186E-06  0.404E-04    0.26      23.9  T
  17   -215.5637208 -0.215575E-07  0.260E-04    0.26      37.2  T
  18   -215.5637208 -0.160122E-07  0.904E-05    0.26     106.9  T
  19   -215.5637208 -0.498630E-09  0.462E-05    0.26     209.5  T

   *** convergence criteria satisfied after 19 iterations ***

         #    Occupation            Energy/Eh            Energy/eV
      -------------------------------------------------------------
         1        2.0000           -3.5973631             -97.8892
       ...           ...                  ...                  ...
       164        2.0000           -0.4250750             -11.5669
       165        2.0000           -0.4174683             -11.3599
       166        2.0000           -0.4129003             -11.2356
       167        2.0000           -0.4100881             -11.1591
       168        2.0000           -0.4066089             -11.0644
       169        1.8880           -0.3870337             -10.5317
       170        1.1055           -0.3830976             -10.4246 (HOMO)
       171        0.0065           -0.3735176             -10.1639 (LUMO)
       172                         -0.3555059              -9.6738
       173                         -0.3539803              -9.6323
       174                         -0.3460395              -9.4162
       175                         -0.3433018              -9.3417
       ...                                ...                  ...
       447                        544.7666046           14823.8538
      -------------------------------------------------------------
                  HL-Gap            0.0095800 Eh            0.2607 eV
             Fermi-level           -0.3816828 Eh          -10.3861 eV

 SCC (total)                   0 d,  0 h,  0 min,  1.689 sec
 SCC setup                      ...        0 min,  0.004 sec (  0.212%)
 Dispersion                     ...        0 min,  0.000 sec (  0.011%)
 integral evaluation            ...        0 min,  0.822 sec ( 48.690%)
 zeroth order Hamiltonian       ...        0 min,  0.003 sec (  0.173%)
 iterations                     ...        0 min,  0.610 sec ( 36.116%)
 molecular gradient             ...        0 min,  0.245 sec ( 14.520%)
 printout                       ...        0 min,  0.005 sec (  0.275%)

         :::::::::::::::::::::::::::::::::::::::::::::::::::::
         ::                     SUMMARY                     ::
         :::::::::::::::::::::::::::::::::::::::::::::::::::::
         :: total energy            -211.585760148962 Eh    ::
         :: gradient norm              0.648908640354 Eh/a0 ::
         :: HOMO-LUMO gap              0.260686088811 eV    ::
         ::.................................................::
         :: SCC energy              -215.563720787316 Eh    ::
         :: -> electrostatic           0.428094945216 Eh    ::
         :: repulsion energy           4.073450980898 Eh    ::
         :: dispersion energy         -0.095490342543 Eh    ::
         :: halogen bond corr.         0.000000000000 Eh    ::
         :: add. restraining           0.000000000000 Eh    ::
         :::::::::::::::::::::::::::::::::::::::::::::::::::::

------------------------------------------------------------------------
empirical IP shift (eV):    4.8455
delta SCC IP (eV):    4.5294
------------------------------------------------------------------------
           ------------------------------------------------- 
          |        vertical delta SCC EA calculation        |
           ------------------------------------------------- 

          ...................................................
          :                      SETUP                      :
          :.................................................:
          :  # basis functions                 452          :
          :  # atomic orbitals                 447          :
          :  # shells                          285          :
          :  # electrons                       341          :
          :  # halogen bonds                     0          :
          :  max. iterations                   250          :
          :  Hamiltonian                  GFN1-xTB          :
          :  restarted?                       true          :
          :  GBSA solvation                  false          :
          :  PC potential                    false          :
          :  electronic temp.          300.0000000     K    :
          :  accuracy                    1.0000000          :
          :  -> integral cutoff          0.2500000E+02      :
          :  -> integral neglect         0.1000000E-07      :
          :  -> SCF convergence          0.1000000E-05 Eh   :
          :  -> wf. convergence          0.2000000E-04 e    :
          :  Broyden damping             0.4000000          :
          ...................................................

 iter      E             dE          RMSdq      gap      omega  full diag
   1   -215.9980758 -0.215998E+03  0.659E-01    0.49       0.0  T
   2   -215.2934833  0.704593E+00  0.143E+00    0.18       1.0  T
   3   -215.9249177 -0.631434E+00  0.752E-01    0.22       1.0  T
   4   -216.1402173 -0.215300E+00  0.267E-01    0.11       1.0  T
   5   -216.0677393  0.724780E-01  0.479E-01    0.16       1.0  T
   6   -216.1556017 -0.878624E-01  0.166E-01    0.09       1.0  T
   7   -216.0790489  0.765528E-01  0.428E-01    0.09       1.0  T
   8   -216.1443925 -0.653436E-01  0.233E-01    0.14       1.0  T
   9   -216.1656118 -0.212193E-01  0.822E-02    0.04       1.0  T
  10   -216.1678597 -0.224788E-02  0.418E-02    0.05       1.0  T
  11   -216.1684708 -0.611094E-03  0.175E-02    0.05       1.0  T
  12   -216.1683293  0.141529E-03  0.238E-02    0.06       1.0  T
  13   -216.1685892 -0.259954E-03  0.469E-03    0.05       2.1  T
  14   -216.1685979 -0.866905E-05  0.142E-03    0.05       6.8  T
  15   -216.1685963  0.161525E-05  0.226E-03    0.05       4.3  T
  16   -216.1685987 -0.239466E-05  0.383E-04    0.05      25.3  T
  17   -216.1685987 -0.562654E-07  0.106E-04    0.05      91.5  T
  18   -216.1685987  0.933738E-09  0.109E-04    0.05      88.3  T

   *** convergence criteria satisfied after 18 iterations ***

         #    Occupation            Energy/Eh            Energy/eV
      -------------------------------------------------------------
         1        2.0000           -3.4515543             -93.9216
       ...           ...                  ...                  ...
       165        2.0000           -0.2978498              -8.1049
       166        2.0000           -0.2940815              -8.0024
       167        2.0000           -0.2881587              -7.8412
       168        2.0000           -0.2825786              -7.6894
       169        2.0000           -0.2641367              -7.1875
       170        1.9979           -0.2357890              -6.4161
       171        0.7253           -0.2239748              -6.0947 (HOMO)
       172        0.2765           -0.2221462              -6.0449 (LUMO)
       173        0.0004           -0.2155404              -5.8652
       174                         -0.2064968              -5.6191
       175                         -0.2052397              -5.5849
       176                         -0.1972082              -5.3663
       ...                                ...                  ...
       447                        544.8949493           14827.3463
      -------------------------------------------------------------
                  HL-Gap            0.0018286 Eh            0.0498 eV
             Fermi-level           -0.2265041 Eh           -6.1635 eV

 SCC (total)                   0 d,  0 h,  0 min,  1.658 sec
 SCC setup                      ...        0 min,  0.004 sec (  0.271%)
 Dispersion                     ...        0 min,  0.000 sec (  0.013%)
 integral evaluation            ...        0 min,  0.819 sec ( 49.416%)
 zeroth order Hamiltonian       ...        0 min,  0.003 sec (  0.195%)
 iterations                     ...        0 min,  0.576 sec ( 34.729%)
 molecular gradient             ...        0 min,  0.250 sec ( 15.078%)
 printout                       ...        0 min,  0.005 sec (  0.294%)

         :::::::::::::::::::::::::::::::::::::::::::::::::::::
         ::                     SUMMARY                     ::
         :::::::::::::::::::::::::::::::::::::::::::::::::::::
         :: total energy            -212.190638069852 Eh    ::
         :: gradient norm              0.663047952953 Eh/a0 ::
         :: HOMO-LUMO gap              0.049758562486 eV    ::
         ::.................................................::
         :: SCC energy              -216.168598708207 Eh    ::
         :: -> electrostatic           0.433294076657 Eh    ::
         :: repulsion energy           4.073450980898 Eh    ::
         :: dispersion energy         -0.095490342543 Eh    ::
         :: halogen bond corr.         0.000000000000 Eh    ::
         :: add. restraining           0.000000000000 Eh    ::
         :::::::::::::::::::::::::::::::::::::::::::::::::::::

------------------------------------------------------------------------
empirical EA shift (eV):    4.8455
delta SCC EA (eV):    2.2392
------------------------------------------------------------------------
           -------------------------------------------------
          |                Property Printout                |
           -------------------------------------------------

    * Orbital Energies and Occupations

         #    Occupation            Energy/Eh            Energy/eV
      -------------------------------------------------------------
         1        2.0000           -3.4515543             -93.9216
       ...           ...                  ...                  ...
       159        2.0000           -0.3343895              -9.0992
       160        2.0000           -0.3304189              -8.9912
       161        2.0000           -0.3254989              -8.8573
       162        2.0000           -0.3229885              -8.7890
       163        2.0000           -0.3191581              -8.6847
       164        2.0000           -0.3161399              -8.6026
       165        2.0000           -0.2978498              -8.1049
       166        2.0000           -0.2940815              -8.0024
       167        2.0000           -0.2881587              -7.8412
       168        2.0000           -0.2825786              -7.6894
       169        2.0000           -0.2641367              -7.1875
       170        1.9979           -0.2357890              -6.4161
       171        0.7253           -0.2239748              -6.0947 (HOMO)
       172        0.2765           -0.2221462              -6.0449 (LUMO)
       173        0.0004           -0.2155404              -5.8652
       174                         -0.2064968              -5.6191
       175                         -0.2052397              -5.5849
       176                         -0.1972082              -5.3663
       177                         -0.1909198              -5.1952
       178                         -0.1807373              -4.9181
       179                         -0.1709866              -4.6528
       180                         -0.1625627              -4.4236
       181                         -0.1578980              -4.2966
       182                         -0.1473666              -4.0100
       ...                                ...                  ...
       447                        544.8949493           14827.3463
      -------------------------------------------------------------
                  HL-Gap            0.0018286 Eh            0.0498 eV
             Fermi-level           -0.2265041 Eh           -6.1635 eV

  Mulliken/CM5 charges        n(s)   n(p)   n(d)
     1 S  -0.86225 -0.72373   1.521  1.560  2.056
     2 N  -0.05008 -0.22342   1.196  3.754  0.000
     3 C  -0.19921 -0.11408   0.687  3.113  0.000
     4 C  -0.01040  0.07479   1.184  2.806  0.000
     5 N   0.37003  0.19716   1.332  4.038  0.000
     6 C   0.09555  0.09707   1.080  3.015  0.000
     7 C   0.05068 -0.00112   1.081  2.970  0.000
     8 C   0.04410 -0.00769   1.084  2.960  0.000
     9 C   0.03176  0.03330   1.069  2.963  0.000
    10 C   0.00218  0.01194   1.141  2.861  0.000
    11 C   0.02751  0.03728   1.135  2.892  0.000
    12 C   0.05276  0.00454   1.050  3.003  0.000
    13 C   0.01964  0.01456   1.060  2.960  0.000
    14 C  -0.00137  0.01302   1.133  2.865  0.000
    15 S   0.10081  0.06462   1.876  4.153  0.072
    16 C  -0.02247 -0.03969   1.084  2.893  0.000
    17 C   0.01697  0.01178   1.069  2.948  0.000
    18 C  -0.00342  0.01130   1.140  2.857  0.000
    19 C   0.03562 -0.01370   1.057  2.979  0.000
    20 C  -0.00496  0.00015   1.147  2.848  0.000
    21 S   0.08845  0.05323   1.876  4.147  0.066
    22 C   0.04784 -0.00003   1.054  2.994  0.000
    23 C   0.01436  0.00888   1.075  2.940  0.000
    24 C  -0.00360  0.01055   1.132  2.865  0.000
    25 S   0.08944  0.05322   1.876  4.140  0.074
    26 C  -0.01495 -0.03221   1.087  2.898  0.000
    27 C   0.01370  0.00846   1.065  2.949  0.000
    28 C  -0.01143  0.00310   1.142  2.846  0.000
    29 C   0.03586 -0.01358   1.068  2.968  0.000
    30 C   0.00922  0.01431   1.159  2.851  0.000
    31 S   0.10448  0.06921   1.878  4.154  0.073
    32 C   0.02509 -0.02198   1.066  2.959  0.000
    33 C   0.03567  0.03317   1.054  2.982  0.000
    34 C  -0.00800 -0.00882   1.095  2.897  0.000
    35 C  -0.00403 -0.00755   1.081  2.915  0.000
    36 C   0.01126  0.00922   1.097  2.915  0.000
    37 C  -0.14045 -0.10596   1.165  2.695  0.000
    38 C   0.02513 -0.02755   1.075  2.950  0.000
    39 C   0.02939 -0.02688   1.090  2.940  0.000
    40 C   0.03508 -0.02105   1.085  2.950  0.000
    41 C   0.02435 -0.02807   1.084  2.940  0.000
    42 C   0.00495  0.01098   1.031  2.974  0.000
    43 O   0.34568  0.28924   1.638  4.707  0.000
    44 C  -0.10370  0.01525   1.208  2.688  0.000
    45 C  -0.10524  0.01212   1.208  2.686  0.000
    46 N   0.30686  0.17679   1.526  3.781  0.000
    47 N   0.30198  0.17194   1.529  3.773  0.000
    48 C   0.02489 -0.08221   1.069  2.956  0.000
    49 C   0.02635 -0.08068   1.070  2.957  0.000
    50 C   0.05931 -0.09344   1.058  3.001  0.000
    51 C   0.05664 -0.09623   1.057  3.000  0.000
    52 C   0.02720 -0.08025   1.070  2.957  0.000
    53 C   0.05823 -0.09307   1.061  2.997  0.000
    54 C   0.05518 -0.05174   1.089  2.966  0.000
    55 C   0.14810  0.10103   1.032  3.116  0.000
    56 C   0.04904  0.04654   1.071  2.978  0.000
    57 C  -0.00016 -0.00098   1.125  2.875  0.000
    58 C   0.03053  0.02701   1.076  2.955  0.000
    59 C   0.04662  0.04457   1.096  2.950  0.000
    60 C  -0.12563 -0.09113   1.182  2.692  0.000
    61 C   0.16729  0.11461   1.085  3.082  0.000
    62 C   0.21221  0.15594   1.102  3.110  0.000
    63 C   0.21034  0.15421   1.098  3.113  0.000
    64 C   0.17299  0.12057   1.104  3.069  0.000
    65 O   0.36741  0.31109   1.644  4.724  0.000
    66 C   0.02246  0.02849   1.032  2.991  0.000
    67 C  -0.09505  0.02390   1.218  2.687  0.000
    68 C  -0.09080  0.02662   1.221  2.688  0.000
    69 N   0.31604  0.18603   1.528  3.788  0.000
    70 N   0.32356  0.19352   1.527  3.797  0.000
    71 C   0.60874  0.45600   0.863  3.746  0.000
    72 H  -0.02511  0.03555   0.975  0.000  0.000
    73 H  -0.02691  0.03375   0.973  0.000  0.000
    74 H   0.01559  0.08422   1.016  0.000  0.000
    75 H  -0.03368  0.03839   0.966  0.000  0.000
    76 H  -0.00261  0.06528   0.997  0.000  0.000
    77 H  -0.00749  0.06448   0.993  0.000  0.000
    78 H  -0.02178  0.04796   0.978  0.000  0.000
    79 H  -0.02033  0.04368   0.980  0.000  0.000
    80 H  -0.02012  0.03652   0.980  0.000  0.000
    81 H  -0.01974  0.03679   0.980  0.000  0.000
    82 H  -0.02397  0.03462   0.976  0.000  0.000
    83 H  -0.01432  0.04290   0.986  0.000  0.000
    84 H  -0.02100  0.03660   0.979  0.000  0.000
    85 H  -0.01183  0.04536   0.988  0.000  0.000
    86 H  -0.00460  0.05287   0.995  0.000  0.000
    87 H   0.00026  0.05425   1.000  0.000  0.000
    88 H  -0.00909  0.04268   0.991  0.000  0.000
    89 H  -0.00819  0.04511   0.992  0.000  0.000
    90 H  -0.01932  0.03486   0.981  0.000  0.000
    91 H  -0.00873  0.04304   0.991  0.000  0.000
    92 H  -0.01340  0.03990   0.987  0.000  0.000
    93 H   0.00460  0.06213   1.005  0.000  0.000
    94 H   0.00483  0.06150   1.005  0.000  0.000
    95 H  -0.01338  0.04073   0.987  0.000  0.000
    96 H  -0.00416  0.04763   0.996  0.000  0.000
    97 H  -0.00682  0.04731   0.993  0.000  0.000
    98 H   0.04337  0.10060   1.043  0.000  0.000
    99 H   0.01413  0.07097   1.014  0.000  0.000
   100 H  -0.33788 -0.26825   0.662  0.000  0.000
   101 H  -0.25787 -0.19390   0.742  0.000  0.000
   102 H  -0.28407 -0.22743   0.716  0.000  0.000
   103 H  -0.27196 -0.21544   0.728  0.000  0.000
   104 H  -0.26238 -0.20379   0.738  0.000  0.000
   105 H  -0.29951 -0.24528   0.700  0.000  0.000
   106 H  -0.27150 -0.21972   0.729  0.000  0.000
   107 H  -0.28337 -0.23035   0.717  0.000  0.000
(R)spin-density population

 Mulliken population n(s)   n(p)   n(d)
     1 S   0.4394   0.000  0.079  0.360
     2 N   0.0178   0.014  0.004  0.000
     3 C   0.0289   0.023  0.006  0.000
     4 C   0.0320   0.014  0.018  0.000
     5 N   0.0164  -0.001  0.017  0.000
     6 C   0.0047   0.004  0.000  0.000
     7 C  -0.0005  -0.001  0.000  0.000
     8 C   0.0009  -0.000  0.001  0.000
     9 C   0.0000  -0.001  0.001  0.000
    10 C   0.0132  -0.001  0.014  0.000
    11 C   0.0147   0.001  0.014  0.000
    12 C   0.0031   0.003  0.000  0.000
    13 C   0.0107  -0.002  0.012  0.000
    14 C  -0.0007  -0.002  0.001  0.000
    15 S   0.0064  -0.000  0.005  0.002
    16 C  -0.0012  -0.001  0.000  0.000
    17 C  -0.0003  -0.001  0.000  0.000
    18 C   0.0200  -0.000  0.020  0.000
    19 C   0.0177  -0.000  0.018  0.000
    20 C   0.0023   0.000  0.002  0.000
    21 S   0.0136   0.000  0.012  0.002
    22 C   0.0001  -0.000  0.000  0.000
    23 C   0.0122   0.000  0.012  0.000
    24 C   0.0013  -0.000  0.001  0.000
    25 S   0.0062   0.000  0.005  0.001
    26 C   0.0000  -0.000  0.000  0.000
    27 C   0.0007  -0.000  0.001  0.000
    28 C   0.0193  -0.000  0.019  0.000
    29 C   0.0161  -0.000  0.016  0.000
    30 C   0.0042  -0.000  0.004  0.000
    31 S   0.0133   0.000  0.011  0.002
    32 C   0.0310   0.000  0.031  0.000
    33 C   0.0067   0.000  0.007  0.000
    34 C   0.0296  -0.000  0.030  0.000
    35 C   0.0015   0.000  0.001  0.000
    36 C   0.0059   0.000  0.006  0.000
    37 C   0.0005   0.000  0.000  0.000
    38 C   0.0087  -0.000  0.009  0.000
    39 C   0.0001  -0.000  0.000  0.000
    40 C   0.0089  -0.000  0.009  0.000
    41 C   0.0014  -0.000  0.001  0.000
    42 C   0.0240  -0.000  0.024  0.000
    43 O   0.0005   0.000  0.000  0.000
    44 C   0.0038  -0.000  0.004  0.000
    45 C   0.0035   0.000  0.004  0.000
    46 N   0.0122   0.000  0.012  0.000
    47 N   0.0123   0.000  0.012  0.000
    48 C  -0.0001  -0.001  0.000  0.000
    49 C  -0.0008  -0.001  0.000  0.000
    50 C   0.0012   0.001  0.000  0.000
    51 C  -0.0004  -0.000  0.000  0.000
    52 C   0.0006   0.000  0.000  0.000
    53 C   0.0001   0.000  0.000  0.000
    54 C   0.0006   0.000  0.001  0.000
    55 C   0.0263   0.000  0.026  0.000
    56 C   0.0061  -0.000  0.006  0.000
    57 C   0.0244  -0.000  0.024  0.000
    58 C   0.0001   0.000  0.000  0.000
    59 C   0.0051   0.000  0.005  0.000
    60 C   0.0003   0.000  0.000  0.000
    61 C   0.0055  -0.000  0.005  0.000
    62 C   0.0002  -0.000  0.000  0.000
    63 C   0.0059  -0.000  0.006  0.000
    64 C   0.0001   0.000  0.000  0.000
    65 O   0.0003   0.000  0.000  0.000
    66 C   0.0133   0.000  0.013  0.000
    67 C   0.0030   0.000  0.003  0.000
    68 C   0.0029   0.000  0.003  0.000
    69 N   0.0080   0.000  0.008  0.000
    70 N   0.0079   0.000  0.008  0.000
    71 C   0.0009  -0.000  0.001  0.000
    72 H  -0.0005  -0.000  0.000  0.000
    73 H  -0.0007  -0.001  0.000  0.000
    74 H   0.0129   0.013  0.000  0.000
    75 H  -0.0000  -0.000  0.000  0.000
    76 H  -0.0010  -0.001  0.000  0.000
    77 H   0.0000   0.000  0.000  0.000
    78 H   0.0000   0.000  0.000  0.000
    79 H   0.0000   0.000  0.000  0.000
    80 H   0.0000   0.000  0.000  0.000
    81 H   0.0000   0.000  0.000  0.000
    82 H   0.0000   0.000  0.000  0.000
    83 H   0.0003   0.000  0.000  0.000
    84 H   0.0000   0.000  0.000  0.000
    85 H   0.0000   0.000  0.000  0.000
    86 H   0.0020   0.002  0.000  0.000
    87 H   0.0059   0.006  0.000  0.000
    88 H   0.0026   0.003  0.000  0.000
    89 H   0.0029   0.003  0.000  0.000
    90 H  -0.0000  -0.000  0.000  0.000
    91 H   0.0002   0.000  0.000  0.000
    92 H   0.0002   0.000  0.000  0.000
    93 H   0.0000   0.000  0.000  0.000
    94 H   0.0003   0.000  0.000  0.000
    95 H   0.0000   0.000  0.000  0.000
    96 H   0.0001   0.000  0.000  0.000
    97 H   0.0000   0.000  0.000  0.000
    98 H   0.0000   0.000  0.000  0.000
    99 H   0.0001   0.000  0.000  0.000
   100 H   0.0000   0.000  0.000  0.000
   101 H   0.0000   0.000  0.000  0.000
   102 H   0.0000   0.000  0.000  0.000
   103 H   0.0000   0.000  0.000  0.000
   104 H   0.0000   0.000  0.000  0.000
   105 H   0.0001   0.000  0.000  0.000
   106 H   0.0001   0.000  0.000  0.000
   107 H   0.0001   0.000  0.000  0.000

Wiberg/Mayer (AO) data.
largest (>0.10) Wiberg bond orders for each atom
          total WBO             WBO to atom ...
     1  S   3.784        N    5 1.912    N    2 1.206    C    3 0.323    C    4 0.125
     2  N   2.393        S    1 1.206    C    3 0.895    C    4 0.110
     3  C   3.611        C    6 1.071    C    4 1.044    N    2 0.895    S    1 0.323
     4  C   3.866        C    9 1.351    N    5 1.103    C    3 1.044    S    1 0.125    N    2 0.110
     5  N   3.062        S    1 1.912    C    4 1.103
     6  C   3.715        C    7 1.283    C   11 1.270    C    3 1.071
     7  C   3.890        C    8 1.542    C    6 1.283    H   72 0.982
     8  C   3.842        C    7 1.542    C    9 1.259    H   73 0.985
     9  C   3.853        C    4 1.351    C    8 1.259    C   10 1.195
    10  C   3.840        C   22 1.451    C    9 1.195    S   25 1.161
    11  C   3.856        C   12 1.371    C    6 1.270    S   15 1.133
    12  C   3.775        C   13 1.429    C   11 1.371    H   74 0.942
    13  C   3.760        C   12 1.429    C   14 1.341    C   16 1.002
    14  C   3.864        C   13 1.341    C   18 1.288    S   15 1.183
    15  S   2.422        C   14 1.183    C   11 1.133
    16  C   3.880        C   13 1.002    C   17 1.000    C   48 0.976    C   49 0.976
    17  C   3.796        C   19 1.477    C   18 1.313    C   16 1.000
    18  C   3.860        C   17 1.313    C   14 1.288    S   21 1.214
    19  C   3.743        C   17 1.477    C   20 1.342    H   75 0.988
    20  C   3.898        C   32 1.377    C   19 1.342    S   21 1.115
    21  S   2.436        C   18 1.214    C   20 1.115
    22  C   3.786        C   10 1.451    C   23 1.396    H   76 1.006
    23  C   3.779        C   22 1.396    C   24 1.376    C   26 1.005
    24  C   3.877        C   23 1.376    C   28 1.253    S   25 1.195
    25  S   2.479        C   24 1.195    C   10 1.161
    26  C   3.875        C   27 1.011    C   23 1.005    C   52 0.974    C   54 0.946
    27  C   3.784        C   29 1.442    C   28 1.341    C   26 1.011
    28  C   3.859        C   27 1.341    C   24 1.253    S   31 1.230
    29  C   3.762        C   27 1.442    C   30 1.373    H   77 0.988
    30  C   3.907        C   29 1.373    C   55 1.344    S   31 1.106
    31  S   2.470        C   28 1.230    C   30 1.106
    32  C   3.730        C   33 1.404    C   20 1.377    H   78 0.990
    33  C   3.798        C   32 1.404    C   34 1.205    C   37 1.116
    34  C   3.830        C   42 1.427    C   33 1.205    C   35 1.097
    35  C   3.881        C   38 1.431    C   36 1.331    C   34 1.097
    36  C   3.897        C   41 1.457    C   35 1.331    C   37 1.044
    37  C   3.967        O   43 1.778    C   33 1.116    C   36 1.044
    38  C   3.838        C   35 1.431    C   39 1.423    H   79 0.997
    39  C   3.912        C   40 1.452    C   38 1.423    H   80 0.984
    40  C   3.884        C   39 1.452    C   41 1.411    H   81 0.986
    41  C   3.882        C   36 1.457    C   40 1.411    H   82 0.989
    42  C   3.765        C   34 1.427    C   44 1.160    C   45 1.159
    43  O   1.955        C   37 1.778
    44  C   4.092        N   46 2.885    C   42 1.160
    45  C   4.099        N   47 2.885    C   42 1.159
    46  N   2.903        C   44 2.885
    47  N   2.906        C   45 2.885
    48  C   3.854        H   84 1.000    H   83 1.000    C   50 0.989    C   16 0.976
    49  C   3.858        H   86 1.003    H   85 1.001    C   51 0.990    C   16 0.976
    50  C   3.881        H   89 1.007    H   87 1.006    H   88 0.994    C   48 0.989
    51  C   3.879        H   92 1.006    H   90 1.003    H   91 0.994    C   49 0.990
    52  C   3.867        H   94 1.001    H   93 1.000    C   53 0.991    C   26 0.974
    53  C   3.892        H   97 1.006    H   95 1.005    H   96 0.994    C   52 0.991
    54  C   3.852        H   98 1.012    H   99 0.989    C   71 0.947    C   26 0.946
    55  C   3.562        C   56 1.465    C   30 1.344    H  100 0.754
    56  C   3.822        C   55 1.465    C   57 1.188    C   60 1.092
    57  C   3.875        C   66 1.435    C   56 1.188    C   58 1.107
    58  C   3.862        C   61 1.442    C   59 1.315    C   57 1.107
    59  C   3.885        C   64 1.462    C   58 1.315    C   60 1.055
    60  C   3.982        O   65 1.781    C   56 1.092    C   59 1.055
    61  C   3.768        C   58 1.442    C   62 1.434    H  101 0.901
    62  C   3.814        C   63 1.465    C   61 1.434    H  102 0.883
    63  C   3.803        C   62 1.465    C   64 1.422    H  103 0.898
    64  C   3.797        C   59 1.462    C   63 1.422    H  104 0.894
    65  O   1.958        C   60 1.781
    66  C   3.782        C   57 1.435    C   67 1.164    C   68 1.157
    67  C   4.104        N   70 2.871    C   66 1.164
    68  C   4.118        N   69 2.846    C   66 1.157
    69  N   2.904        C   68 2.846
    70  N   2.898        C   67 2.871
    71  C   3.346        C   54 0.947    H  106 0.847    H  107 0.833    H  105 0.796
    72  H   1.024        C    7 0.982
    73  H   1.029        C    8 0.985
    74  H   1.077        C   12 0.942
    75  H   1.044        C   19 0.988
    76  H   1.065        C   22 1.006
    77  H   1.094        C   29 0.988
    78  H   1.054        C   32 0.990
    79  H   1.067        C   38 0.997
    80  H   1.040        C   39 0.984
    81  H   1.029        C   40 0.986
    82  H   1.039        C   41 0.989
    83  H   1.057        C   48 1.000
    84  H   1.043        C   48 1.000
    85  H   1.059        C   49 1.001
    86  H   1.044        C   49 1.003
    87  H   1.052        C   50 1.006
    88  H   1.049        C   50 0.994
    89  H   1.041        C   50 1.007
    90  H   1.050        C   51 1.003
    91  H   1.048        C   51 0.994
    92  H   1.038        C   51 1.006
    93  H   1.076        C   52 1.000
    94  H   1.064        C   52 1.001
    95  H   1.045        C   53 1.005
    96  H   1.045        C   53 0.994
    97  H   1.047        C   53 1.006
    98  H   1.086        C   54 1.012
    99  H   1.006        C   54 0.989
   100  H   0.910        C   55 0.754
   101  H   0.947        C   61 0.901
   102  H   0.954        C   62 0.883
   103  H   0.946        C   63 0.898
   104  H   0.953        C   64 0.894
   105  H   0.930        C   71 0.796
   106  H   0.937        C   71 0.847
   107  H   0.945        C   71 0.833

 dipole moment from electron density (au)
     X       Y       Z   
  19.5216  11.5207  -1.3768  total (Debye):   57.721


           -------------------------------------------------
          | TOTAL ENERGY             -212.190638069852 Eh   |
          | GRADIENT NORM               0.663047952953 Eh/α |
          | HOMO-LUMO GAP               0.049758562486 eV   |
           -------------------------------------------------

------------------------------------------------------------------------
 * finished run on 2021/12/02 at 16:34:31.967     
------------------------------------------------------------------------
 total:
 * wall-time:     0 d,  0 h,  0 min,  6.296 sec
 *  cpu-time:     0 d,  0 h,  0 min,  6.249 sec
 * ratio c/w:     0.992 speedup
 SCF:
 * wall-time:     0 d,  0 h,  0 min,  5.453 sec
 *  cpu-time:     0 d,  0 h,  0 min,  5.417 sec
 * ratio c/w:     0.993 speedup

