      -----------------------------------------------------------      
     |                   =====================                   |     
     |                           x T B                           |     
     |                   =====================                   |     
     |                         S. Grimme                         |     
     |          Mulliken Center for Theoretical Chemistry        |     
     |                    University of Bonn                     |     
     |                Version 6.2 RC2 (SAW190805)                |     
      -----------------------------------------------------------      

   This program is distributed in the hope that it will be useful,
   but WITHOUT ANY WARRANTY; without even the implied warranty of
   MERCHANTABILITY or FITNESS FOR A PARTICULAR PURPOSE.
   
   FOR NON-COMMERCIAL, ACADEMIA USE ONLY.
   
   Cite this work as:
   * S. Grimme, C. Bannwarth, P. Shushkov, J. Chem. Theory Comput., 2017,
     13, 1989-2009. DOI: 10.1021/acs.jctc.7b00118
   * C. Bannwarth, S. Ehlert and S. Grimme., J. Chem. Theory Comput., 2019,
     15, 1652-1671. DOI: 10.1021/acs.jctc.8b01176
   * P. Pracht, E. Caldeweyher, S. Ehlert, S. Grimme, ChemRxiv, 2019, preprint.
     DOI: 10.26434/chemrxiv.8326202.v1
   
   for DFT-D4:
   * E. Caldeweyher, C. Bannwarth and S. Grimme, J. Chem. Phys., 2017,
     147, 034112. DOI: 10.1063/1.4993215
   * E. Caldeweyher, S. Ehlert, A. Hansen, H. Neugebauer, S. Spicher,
     C. Bannwarth and S. Grimme, J. Chem. Phys., 2019, 150, 154122.
     DOI: 10.1063/1.5090222
   
   for sTDA-xTB:
   * S. Grimme and C. Bannwarth, J. Chem. Phys., 2016, 145, 054103.
     DOI: 10.1063/1.4959605
   
   in the mass-spec context:
   * V. Asgeirsson, C. Bauer and S. Grimme, Chem. Sci., 2017, 8, 4879.
     DOI: 10.1039/c7sc00601b
   
   for metadynamics refer to:
   * S. Grimme, J. Chem. Theory Comput., 2019, 155, 2847-2862
     DOI: 10.1021/acs.jctc.9b00143
   
   with help from (in alphabetical order)
   C. Bannwarth, F. Bohle, G. Brandenburg, E. Caldeweyher, M. Checinski,
   S. Dohm, S. Ehlert, S. Ehrlich, F. März, H. Neugebauer, J. Pisarek,
   P. Pracht, P. Shushkov, and S. Spicher.
   
 * started run on 2021/12/02 at 16:34:31.987     

           -------------------------------------------------
          |                Calculation Setup                |
           -------------------------------------------------

          program call               : /ihome/ghutchison/geoffh/xtb/xtb BTDT2R.xyz --vipea
          hostname                   : smp-n128
          coordinate file            : BTDT2R.xyz
          omp threads                :                     1
          number of atoms            :                    71
          number of electrons        :                   232
          charge                     :                     0
          spin                       :                   0.0
          first test random number   :      0.18757746412609


########################################################################
# WARNING! Please study the warnings concerning your input carefully
#  - XTBPATH is not set, using XTBHOME instead
########################################################################

           ------------------------------------------------- 
          |                 I P E A - x T B                 |
          |  Ionisation Potentials and Electron Affinities  |
           ------------------------------------------------- 
             KAB for M(3d)-M(3d) :                1.1000
             KAB for M(4d)-M(4d) :                1.2000
             KAB for M(5d)-M(5d) :                1.2000
             k(s)                :                2.1500
             k(p)                :                2.3000
             k(d)                :                2.0000
             k(f)                :                0.0000
             kEN (H0ij)          :                0.7000
             D3 a1               :                0.6300
             D3 a2               :                5.0000
             D3 s6               :                1.0000
             D3 s8               :                2.4000
             D3 s9               :                0.0000
             alphaj              :                1.0000
             XBdamp              :                0.4400
             XBrad               :                1.3000
             kcnsh               :      1.0000   -0.3000   -0.5000    0.5000

  Z AO/shell   Hii/eV     exponent
  1     Thu Sep 22 23:34:11 CEST 2016   EN: 2.200 GAM: 0.405  GM3: 0.1500
     1s    -10.521941    1.306199
     2s     -3.560151    0.398421
  6     Thu Sep 22 23:34:11 CEST 2016   EN: 2.550 GAM: 0.640  GM3: 0.1500
     2s    -15.968100    1.979793
     2p     -9.777107    1.850537
     3S     -3.366990    0.633095
  7     Thu Sep 22 23:34:11 CEST 2016   EN: 3.040 GAM: 0.493  GM3:-0.1000
     2s    -24.040776    2.126160
     2p    -14.426520    2.068425
     3S     -5.882278    0.671040
  8     Thu Sep 22 23:34:11 CEST 2016   EN: 3.440 GAM: 0.717  GM3:-0.2000
     2s    -26.695120    2.575264
     2p    -16.014457    2.159448
     3S     -6.622058    0.958679
 16     Tue Jan 17 20:57:36 CET 2017    EN: 2.580 GAM: 0.455  GM3: 0.1020
     3s    -24.488821    2.492075
     3p    -12.136640    1.997904
     3d     -1.796070    1.747541

           ------------------------------------------------- 
          |        Self-Consistent Charge Iterations        |
           ------------------------------------------------- 

          ...................................................
          :                      SETUP                      :
          :.................................................:
          :  # basis functions                 312          :
          :  # atomic orbitals                 305          :
          :  # shells                          187          :
          :  # electrons                       232          :
          :  # halogen bonds                     0          :
          :  max. iterations                   250          :
          :  Hamiltonian                  GFN1-xTB          :
          :  restarted?                      false          :
          :  GBSA solvation                  false          :
          :  PC potential                    false          :
          :  electronic temp.          300.0000000     K    :
          :  accuracy                    1.0000000          :
          :  -> integral cutoff          0.2500000E+02      :
          :  -> integral neglect         0.1000000E-07      :
          :  -> SCF convergence          0.1000000E-05 Eh   :
          :  -> wf. convergence          0.2000000E-04 e    :
          :  Broyden damping             0.4000000          :
          ...................................................

 iter      E             dE          RMSdq      gap      omega  full diag
   1   -148.8852405 -0.148885E+03  0.840E+00    1.28       0.0  T
   2   -149.3401757 -0.454935E+00  0.555E+00    1.19       1.0  T
   3   -148.6847317  0.655444E+00  0.320E+00    1.21       1.0  T
   4   -149.5391307 -0.854399E+00  0.894E-01    1.01       1.0  T
   5   -149.6871266 -0.147996E+00  0.300E-01    1.15       1.0  T
   6   -149.7013116 -0.141851E-01  0.625E-02    1.14       1.0  T
   7   -149.7015744 -0.262792E-03  0.393E-02    1.15       1.0  T
   8   -149.7016903 -0.115944E-03  0.225E-02    1.15       1.0  T
   9   -149.7017311 -0.407066E-04  0.110E-02    1.15       1.1  T
  10   -149.7017455 -0.144015E-04  0.413E-03    1.15       2.9  T
  11   -149.7017468 -0.135414E-05  0.211E-03    1.15       5.6  T
  12   -149.7017475 -0.724524E-06  0.791E-04    1.15      15.0  T
  13   -149.7017476 -0.828678E-07  0.192E-04    1.15      61.8  T
  14   -149.7017476 -0.372319E-08  0.121E-04    1.15      97.7  T

   *** convergence criteria satisfied after 14 iterations ***

         #    Occupation            Energy/Eh            Energy/eV
      -------------------------------------------------------------
         1        2.0000           -1.0803986             -29.3991
       ...           ...                  ...                  ...
       110        2.0000           -0.4368743             -11.8880
       111        2.0000           -0.4241099             -11.5406
       112        2.0000           -0.4154283             -11.3044
       113        2.0000           -0.3972947             -10.8109
       114        2.0000           -0.3890244             -10.5859
       115        2.0000           -0.3878640             -10.5543
       116        2.0000           -0.3805675             -10.3558 (HOMO)
       117                         -0.3382981              -9.2056 (LUMO)
       118                         -0.3112976              -8.4708
       119                         -0.3087803              -8.4023
       120                         -0.2708851              -7.3712
       121                         -0.2628522              -7.1526
       ...                                ...                  ...
       305                        519.4129759           14133.9465
      -------------------------------------------------------------
                  HL-Gap            0.0422694 Eh            1.1502 eV
             Fermi-level           -0.3594325 Eh           -9.7807 eV

 SCC (total)                   0 d,  0 h,  0 min,  0.741 sec
 SCC setup                      ...        0 min,  0.002 sec (  0.284%)
 Dispersion                     ...        0 min,  0.000 sec (  0.023%)
 integral evaluation            ...        0 min,  0.401 sec ( 54.155%)
 zeroth order Hamiltonian       ...        0 min,  0.002 sec (  0.256%)
 iterations                     ...        0 min,  0.185 sec ( 25.017%)
 molecular gradient             ...        0 min,  0.148 sec ( 20.001%)
 printout                       ...        0 min,  0.002 sec (  0.256%)

         :::::::::::::::::::::::::::::::::::::::::::::::::::::
         ::                     SUMMARY                     ::
         :::::::::::::::::::::::::::::::::::::::::::::::::::::
         :: total energy            -147.637866135358 Eh    ::
         :: gradient norm              0.090541331032 Eh/a0 ::
         :: HOMO-LUMO gap              1.150209049137 eV    ::
         ::.................................................::
         :: SCC energy              -149.701747622868 Eh    ::
         :: -> electrostatic           0.126183595187 Eh    ::
         :: repulsion energy           2.125875943445 Eh    ::
         :: dispersion energy         -0.061994455936 Eh    ::
         :: halogen bond corr.         0.000000000000 Eh    ::
         :: add. restraining           0.000000000000 Eh    ::
         :::::::::::::::::::::::::::::::::::::::::::::::::::::

           ------------------------------------------------- 
          |        vertical delta SCC IP calculation        |
           ------------------------------------------------- 

          ...................................................
          :                      SETUP                      :
          :.................................................:
          :  # basis functions                 312          :
          :  # atomic orbitals                 305          :
          :  # shells                          187          :
          :  # electrons                       231          :
          :  # halogen bonds                     0          :
          :  max. iterations                   250          :
          :  Hamiltonian                  GFN1-xTB          :
          :  restarted?                       true          :
          :  GBSA solvation                  false          :
          :  PC potential                    false          :
          :  electronic temp.          300.0000000     K    :
          :  accuracy                    1.0000000          :
          :  -> integral cutoff          0.2500000E+02      :
          :  -> integral neglect         0.1000000E-07      :
          :  -> SCF convergence          0.1000000E-05 Eh   :
          :  -> wf. convergence          0.2000000E-04 e    :
          :  Broyden damping             0.4000000          :
          ...................................................

 iter      E             dE          RMSdq      gap      omega  full diag
   1   -149.2688803 -0.149269E+03  0.260E-01    1.15       0.0  T
   2   -149.1854446  0.834357E-01  0.900E-01    1.11       1.0  T
   3   -149.2251352 -0.396905E-01  0.705E-01    1.18       1.0  T
   4   -149.2125347  0.126005E-01  0.765E-01    1.18       1.0  T
   5   -149.2762361 -0.637014E-01  0.114E-01    1.23       1.0  T
   6   -149.2775434 -0.130732E-02  0.751E-02    1.22       1.0  T
   7   -149.2781829 -0.639496E-03  0.552E-02    1.21       1.0  T
   8   -149.2785004 -0.317518E-03  0.326E-02    1.22       1.0  T
   9   -149.2786154 -0.114991E-03  0.116E-02    1.22       1.0  T
  10   -149.2786156 -0.198253E-06  0.105E-02    1.22       1.1  T
  11   -149.2786250 -0.938107E-05  0.557E-03    1.22       2.1  T
  12   -149.2786267 -0.169048E-05  0.357E-03    1.22       3.3  T
  13   -149.2786278 -0.108994E-05  0.200E-03    1.22       5.9  T
  14   -149.2786280 -0.183732E-06  0.146E-03    1.22       8.1  T
  15   -149.2786281 -0.109056E-06  0.103E-03    1.22      11.6  T
  16   -149.2786281 -0.560082E-07  0.688E-04    1.22      17.3  T
  17   -149.2786282 -0.295680E-07  0.425E-04    1.22      27.9  T
  18   -149.2786282 -0.880652E-08  0.301E-04    1.22      39.4  T
  19   -149.2786282 -0.457575E-08  0.212E-04    1.22      56.0  T
  20   -149.2786282 -0.369624E-08  0.888E-05    1.22     133.7  T
  21   -149.2786282 -0.727312E-09  0.224E-05    1.22     530.7  T

   *** convergence criteria satisfied after 21 iterations ***

         #    Occupation            Energy/Eh            Energy/eV
      -------------------------------------------------------------
         1        2.0000           -1.1631975             -31.6522
       ...           ...                  ...                  ...
       110        2.0000           -0.5179466             -14.0940
       111        2.0000           -0.5052181             -13.7477
       112        2.0000           -0.4973649             -13.5340
       113        2.0000           -0.4812016             -13.0942
       114        1.9438           -0.4703942             -12.8001
       115        1.9414           -0.4703530             -12.7990
       116        1.1148           -0.4657744             -12.6744 (HOMO)
       117                         -0.4209793             -11.4554 (LUMO)
       118                         -0.3931982             -10.6995
       119                         -0.3917764             -10.6608
       120                         -0.3538473              -9.6287
       121                         -0.3460673              -9.4170
       ...                                ...                  ...
       305                        519.3271072           14131.6099
      -------------------------------------------------------------
                  HL-Gap            0.0447951 Eh            1.2189 eV
             Fermi-level           -0.4555421 Eh          -12.3959 eV

 SCC (total)                   0 d,  0 h,  0 min,  0.823 sec
 SCC setup                      ...        0 min,  0.002 sec (  0.218%)
 Dispersion                     ...        0 min,  0.000 sec (  0.013%)
 integral evaluation            ...        0 min,  0.400 sec ( 48.682%)
 zeroth order Hamiltonian       ...        0 min,  0.002 sec (  0.210%)
 iterations                     ...        0 min,  0.269 sec ( 32.654%)
 molecular gradient             ...        0 min,  0.148 sec ( 17.989%)
 printout                       ...        0 min,  0.002 sec (  0.227%)

         :::::::::::::::::::::::::::::::::::::::::::::::::::::
         ::                     SUMMARY                     ::
         :::::::::::::::::::::::::::::::::::::::::::::::::::::
         :: total energy            -147.214746689534 Eh    ::
         :: gradient norm              0.101215938857 Eh/a0 ::
         :: HOMO-LUMO gap              1.218936658112 eV    ::
         ::.................................................::
         :: SCC energy              -149.278628177043 Eh    ::
         :: -> electrostatic           0.163867348806 Eh    ::
         :: repulsion energy           2.125875943445 Eh    ::
         :: dispersion energy         -0.061994455936 Eh    ::
         :: halogen bond corr.         0.000000000000 Eh    ::
         :: add. restraining           0.000000000000 Eh    ::
         :::::::::::::::::::::::::::::::::::::::::::::::::::::

------------------------------------------------------------------------
empirical IP shift (eV):    4.8455
delta SCC IP (eV):    6.6682
------------------------------------------------------------------------
           ------------------------------------------------- 
          |        vertical delta SCC EA calculation        |
           ------------------------------------------------- 

          ...................................................
          :                      SETUP                      :
          :.................................................:
          :  # basis functions                 312          :
          :  # atomic orbitals                 305          :
          :  # shells                          187          :
          :  # electrons                       233          :
          :  # halogen bonds                     0          :
          :  max. iterations                   250          :
          :  Hamiltonian                  GFN1-xTB          :
          :  restarted?                       true          :
          :  GBSA solvation                  false          :
          :  PC potential                    false          :
          :  electronic temp.          300.0000000     K    :
          :  accuracy                    1.0000000          :
          :  -> integral cutoff          0.2500000E+02      :
          :  -> integral neglect         0.1000000E-07      :
          :  -> SCF convergence          0.1000000E-05 Eh   :
          :  -> wf. convergence          0.2000000E-04 e    :
          :  Broyden damping             0.4000000          :
          ...................................................

 iter      E             dE          RMSdq      gap      omega  full diag
   1   -149.9606788 -0.149961E+03  0.473E-01    0.76       0.0  T
   2   -149.9757804 -0.151016E-01  0.420E-01    0.44       1.0  T
   3   -149.9913110 -0.155307E-01  0.257E-01    0.60       1.0  T
   4   -149.9906035  0.707559E-03  0.137E-01    0.51       1.0  T
   5   -149.9934609 -0.285745E-02  0.663E-02    0.55       1.0  T
   6   -149.9937128 -0.251887E-03  0.323E-02    0.55       1.0  T
   7   -149.9938813 -0.168484E-03  0.741E-03    0.55       1.6  T
   8   -149.9938838 -0.251658E-05  0.484E-03    0.55       2.5  T
   9   -149.9938862 -0.243617E-05  0.226E-03    0.55       5.2  T
  10   -149.9938869 -0.626315E-06  0.984E-04    0.55      12.1  T
  11   -149.9938870 -0.839078E-07  0.482E-04    0.55      24.6  T
  12   -149.9938870 -0.246159E-07  0.210E-04    0.55      56.4  T
  13   -149.9938870 -0.372256E-08  0.972E-05    0.55     122.1  T
  14   -149.9938870 -0.325258E-09  0.400E-05    0.55     296.5  T

   *** convergence criteria satisfied after 14 iterations ***

         #    Occupation            Energy/Eh            Energy/eV
      -------------------------------------------------------------
         1        2.0000           -0.9981161             -27.1601
       ...           ...                  ...                  ...
       111        2.0000           -0.3451269              -9.3914
       112        2.0000           -0.3368372              -9.1658
       113        2.0000           -0.3164318              -8.6105
       114        2.0000           -0.3162175              -8.6047
       115        2.0000           -0.3155524              -8.5866
       116        2.0000           -0.2954598              -8.0399
       117        1.0000           -0.2480973              -6.7511 (HOMO)
       118        0.0000           -0.2278522              -6.2002 (LUMO)
       119        0.0000           -0.2233399              -6.0774
       120                         -0.1895747              -5.1586
       121                         -0.1841878              -5.0120
       122                         -0.1706870              -4.6446
       ...                                ...                  ...
       305                        519.5074942           14136.5185
      -------------------------------------------------------------
                  HL-Gap            0.0202451 Eh            0.5509 eV
             Fermi-level           -0.2548787 Eh           -6.9356 eV

 SCC (total)                   0 d,  0 h,  0 min,  0.734 sec
 SCC setup                      ...        0 min,  0.002 sec (  0.220%)
 Dispersion                     ...        0 min,  0.000 sec (  0.015%)
 integral evaluation            ...        0 min,  0.398 sec ( 54.193%)
 zeroth order Hamiltonian       ...        0 min,  0.002 sec (  0.238%)
 iterations                     ...        0 min,  0.182 sec ( 24.805%)
 molecular gradient             ...        0 min,  0.148 sec ( 20.202%)
 printout                       ...        0 min,  0.002 sec (  0.320%)

         :::::::::::::::::::::::::::::::::::::::::::::::::::::
         ::                     SUMMARY                     ::
         :::::::::::::::::::::::::::::::::::::::::::::::::::::
         :: total energy            -147.930005496432 Eh    ::
         :: gradient norm              0.122661087762 Eh/a0 ::
         :: HOMO-LUMO gap              0.550898265415 eV    ::
         ::.................................................::
         :: SCC energy              -149.993886983941 Eh    ::
         :: -> electrostatic           0.166559590845 Eh    ::
         :: repulsion energy           2.125875943445 Eh    ::
         :: dispersion energy         -0.061994455936 Eh    ::
         :: halogen bond corr.         0.000000000000 Eh    ::
         :: add. restraining           0.000000000000 Eh    ::
         :::::::::::::::::::::::::::::::::::::::::::::::::::::

------------------------------------------------------------------------
empirical EA shift (eV):    4.8455
delta SCC EA (eV):    3.1040
------------------------------------------------------------------------
           -------------------------------------------------
          |                Property Printout                |
           -------------------------------------------------

    * Orbital Energies and Occupations

         #    Occupation            Energy/Eh            Energy/eV
      -------------------------------------------------------------
         1        2.0000           -0.9981161             -27.1601
       ...           ...                  ...                  ...
       105        2.0000           -0.3706658             -10.0863
       106        2.0000           -0.3646145              -9.9217
       107        2.0000           -0.3571237              -9.7178
       108        2.0000           -0.3548601              -9.6562
       109        2.0000           -0.3540305              -9.6337
       110        2.0000           -0.3504373              -9.5359
       111        2.0000           -0.3451269              -9.3914
       112        2.0000           -0.3368372              -9.1658
       113        2.0000           -0.3164318              -8.6105
       114        2.0000           -0.3162175              -8.6047
       115        2.0000           -0.3155524              -8.5866
       116        2.0000           -0.2954598              -8.0399
       117        1.0000           -0.2480973              -6.7511 (HOMO)
       118        0.0000           -0.2278522              -6.2002 (LUMO)
       119        0.0000           -0.2233399              -6.0774
       120                         -0.1895747              -5.1586
       121                         -0.1841878              -5.0120
       122                         -0.1706870              -4.6446
       123                         -0.1597185              -4.3462
       124                         -0.1572952              -4.2802
       125                         -0.1550589              -4.2194
       126                         -0.1543749              -4.2008
       127                         -0.1536239              -4.1803
       128                         -0.1496474              -4.0721
       ...                                ...                  ...
       305                        519.5074942           14136.5185
      -------------------------------------------------------------
                  HL-Gap            0.0202451 Eh            0.5509 eV
             Fermi-level           -0.2548787 Eh           -6.9356 eV

  Mulliken/CM5 charges        n(s)   n(p)   n(d)
     1 C   0.00633  0.01360   1.070  2.936  0.000
     2 C  -0.07799 -0.05403   1.086  2.836  0.000
     3 C  -0.08352 -0.05917   1.085  2.831  0.000
     4 C   0.00724  0.01453   1.068  2.939  0.000
     5 C  -0.07010  0.01551   1.144  2.786  0.000
     6 C  -0.06994  0.01571   1.144  2.787  0.000
     7 N   0.25386  0.08045   1.454  3.800  0.000
     8 S  -0.14079 -0.00226   1.854  3.680  0.326
     9 N   0.25361  0.08004   1.454  3.800  0.000
    10 O   0.23391  0.14379   1.600  4.634  0.000
    11 O   0.23016  0.14053   1.605  4.625  0.000
    12 C  -0.05711 -0.14105   1.123  2.820  0.000
    13 C  -0.05727 -0.14076   1.127  2.816  0.000
    14 C  -0.02142 -0.00943   1.141  2.838  0.000
    15 C  -0.02198 -0.01000   1.141  2.837  0.000
    16 S   0.06546  0.03227   1.886  4.071  0.108
    17 C  -0.00417  0.00243   1.124  2.872  0.000
    18 C   0.03743 -0.01441   1.082  2.956  0.000
    19 C   0.04113 -0.00853   1.085  2.956  0.000
    20 C   0.04145 -0.00822   1.085  2.956  0.000
    21 C   0.03738 -0.01443   1.082  2.956  0.000
    22 C  -0.00366  0.00299   1.124  2.872  0.000
    23 S   0.06343  0.03003   1.886  4.065  0.112
    24 C   0.01680 -0.02953   1.079  2.938  0.000
    25 C  -0.00425  0.01345   1.128  2.868  0.000
    26 C   0.01654 -0.02978   1.080  2.937  0.000
    27 C  -0.00418  0.01354   1.129  2.867  0.000
    28 C  -0.19558 -0.09410   1.151  2.653  0.000
    29 N   0.10314 -0.15283   1.285  3.818  0.000
    30 C  -0.13620 -0.03543   1.229  2.635  0.000
    31 S   0.04927  0.02523   1.882  4.098  0.069
    32 S   0.04857  0.02593   1.882  4.097  0.070
    33 C  -0.13644 -0.03568   1.229  2.635  0.000
    34 N   0.10308 -0.15290   1.285  3.818  0.000
    35 C  -0.19582 -0.09432   1.151  2.653  0.000
    36 O   0.36129  0.31552   1.617  4.745  0.000
    37 C  -0.03860 -0.08564   1.103  2.858  0.000
    38 S   0.36292  0.34646   1.883  4.472  0.007
    39 S   0.36378  0.34736   1.883  4.474  0.007
    40 C  -0.03861 -0.08566   1.103  2.858  0.000
    41 O   0.36119  0.31547   1.617  4.744  0.000
    42 C   0.05675 -0.08940   1.074  2.983  0.000
    43 C   0.05637 -0.09324   1.082  2.975  0.000
    44 C   0.05828 -0.09091   1.071  2.988  0.000
    45 C   0.05667 -0.08945   1.073  2.983  0.000
    46 H  -0.05071  0.01431   0.949  0.000  0.000
    47 H  -0.04160  0.02911   0.958  0.000  0.000
    48 H  -0.03753  0.03104   0.962  0.000  0.000
    49 H  -0.03623  0.02699   0.964  0.000  0.000
    50 H  -0.03139  0.02587   0.969  0.000  0.000
    51 H  -0.02335  0.04447   0.977  0.000  0.000
    52 H  -0.02272  0.04495   0.977  0.000  0.000
    53 H  -0.03131  0.02592   0.969  0.000  0.000
    54 H  -0.04202  0.01992   0.958  0.000  0.000
    55 H  -0.04219  0.01968   0.958  0.000  0.000
    56 H  -0.04486  0.02693   0.955  0.000  0.000
    57 H  -0.05719  0.01062   0.943  0.000  0.000
    58 H  -0.05726  0.01060   0.943  0.000  0.000
    59 H  -0.04492  0.02684   0.955  0.000  0.000
    60 H  -0.02820  0.02711   0.972  0.000  0.000
    61 H  -0.02445  0.02797   0.976  0.000  0.000
    62 H  -0.03784  0.01794   0.962  0.000  0.000
    63 H  -0.03190  0.02258   0.968  0.000  0.000
    64 H  -0.03233  0.02005   0.968  0.000  0.000
    65 H  -0.03529  0.02183   0.965  0.000  0.000
    66 H  -0.02925  0.02648   0.971  0.000  0.000
    67 H  -0.02888  0.02346   0.971  0.000  0.000
    68 H  -0.02521  0.02987   0.975  0.000  0.000
    69 H  -0.03877  0.01703   0.961  0.000  0.000
    70 H  -0.02462  0.02779   0.975  0.000  0.000
    71 H  -0.02835  0.02693   0.972  0.000  0.000
(R)spin-density population

 Mulliken population n(s)   n(p)   n(d)
     1 C   0.0513   0.000  0.051  0.000
     2 C   0.0470   0.000  0.047  0.000
     3 C   0.0432   0.000  0.043  0.000
     4 C   0.0487   0.000  0.049  0.000
     5 C   0.0020   0.000  0.002  0.000
     6 C   0.0023   0.000  0.002  0.000
     7 N   0.0551   0.000  0.055  0.000
     8 S   0.1063   0.000  0.083  0.023
     9 N   0.0564   0.000  0.056  0.000
    10 O   0.0057   0.000  0.005  0.000
    11 O   0.0080   0.000  0.008  0.000
    12 C   0.0022   0.001  0.002  0.000
    13 C   0.0032   0.001  0.002  0.000
    14 C   0.0180   0.000  0.018  0.000
    15 C   0.0165   0.000  0.017  0.000
    16 S   0.0318  -0.000  0.029  0.003
    17 C   0.0255   0.000  0.025  0.000
    18 C   0.0138  -0.000  0.014  0.000
    19 C   0.0204   0.000  0.020  0.000
    20 C   0.0192   0.000  0.019  0.000
    21 C   0.0126   0.000  0.013  0.000
    22 C   0.0241   0.000  0.024  0.000
    23 S   0.0302   0.000  0.028  0.002
    24 C   0.0329  -0.000  0.033  0.000
    25 C   0.0347  -0.000  0.035  0.000
    26 C   0.0313  -0.000  0.031  0.000
    27 C   0.0329  -0.000  0.033  0.000
    28 C   0.0239  -0.000  0.024  0.000
    29 N   0.0000  -0.000  0.000  0.000
    30 C   0.0211  -0.000  0.021  0.000
    31 S   0.0067  -0.000  0.001  0.005
    32 S   0.0064   0.000  0.001  0.005
    33 C   0.0200   0.000  0.020  0.000
    34 N   0.0000   0.000  0.000  0.000
    35 C   0.0227   0.000  0.023  0.000
    36 O   0.0279   0.000  0.028  0.000
    37 C   0.0000  -0.000  0.000  0.000
    38 S   0.0341  -0.000  0.032  0.002
    39 S   0.0325   0.000  0.030  0.002
    40 C   0.0000   0.000  0.000  0.000
    41 O   0.0264   0.000  0.026  0.000
    42 C   0.0000   0.000  0.000  0.000
    43 C   0.0003   0.000  0.000  0.000
    44 C   0.0010   0.000  0.001  0.000
    45 C   0.0000   0.000  0.000  0.000
    46 H   0.0000   0.000  0.000  0.000
    47 H   0.0001   0.000  0.000  0.000
    48 H   0.0001   0.000  0.000  0.000
    49 H   0.0004   0.000  0.000  0.000
    50 H   0.0000   0.000  0.000  0.000
    51 H   0.0000   0.000  0.000  0.000
    52 H   0.0000   0.000  0.000  0.000
    53 H   0.0000   0.000  0.000  0.000
    54 H   0.0000   0.000  0.000  0.000
    55 H   0.0000   0.000  0.000  0.000
    56 H   0.0000   0.000  0.000  0.000
    57 H   0.0000   0.000  0.000  0.000
    58 H   0.0000   0.000  0.000  0.000
    59 H   0.0000   0.000  0.000  0.000
    60 H  -0.0000  -0.000  0.000  0.000
    61 H   0.0000   0.000  0.000  0.000
    62 H   0.0000   0.000  0.000  0.000
    63 H   0.0000   0.000  0.000  0.000
    64 H   0.0003   0.000  0.000  0.000
    65 H   0.0001   0.000  0.000  0.000
    66 H   0.0001   0.000  0.000  0.000
    67 H   0.0002   0.000  0.000  0.000
    68 H  -0.0000  -0.000  0.000  0.000
    69 H   0.0000   0.000  0.000  0.000
    70 H  -0.0000  -0.000  0.000  0.000
    71 H  -0.0000  -0.000  0.000  0.000

Wiberg/Mayer (AO) data.
largest (>0.10) Wiberg bond orders for each atom
          total WBO             WBO to atom ...
     1  C   3.810        C    2 1.345    C   14 1.227    C    6 1.219
     2  C   3.811        C    3 1.366    C    1 1.345    O   10 1.055
     3  C   3.804        C    2 1.366    C    4 1.339    O   11 1.070
     4  C   3.812        C    3 1.339    C   15 1.228    C    5 1.221
     5  C   4.008        N    7 1.503    C    4 1.221    C    6 1.195
     6  C   4.006        N    9 1.503    C    1 1.219    C    5 1.195
     7  N   2.902        C    5 1.503    S    8 1.400
     8  S   3.062        N    9 1.400    N    7 1.400
     9  N   2.902        C    6 1.503    S    8 1.400
    10  O   2.079        C    2 1.055    C   13 0.955
    11  O   2.127        C    3 1.070    C   12 0.950
    12  C   3.899        H   47 0.999    C   44 0.994    H   46 0.990    O   11 0.950
    13  C   3.903        H   48 1.000    C   43 0.996    H   49 0.993    O   10 0.955
    14  C   3.869        C   19 1.427    C    1 1.227    S   16 1.195
    15  C   3.869        C   20 1.427    C    4 1.228    S   23 1.195
    16  S   2.581        C   14 1.195    C   17 1.155
    17  C   3.878        C   18 1.396    C   24 1.282    S   16 1.155
    18  C   3.854        C   19 1.419    C   17 1.396    H   50 0.988
    19  C   3.849        C   14 1.427    C   18 1.419    H   51 0.993
    20  C   3.850        C   15 1.427    C   21 1.419    H   52 0.993
    21  C   3.855        C   20 1.419    C   22 1.396    H   53 0.988
    22  C   3.879        C   21 1.396    C   26 1.281    S   23 1.154
    23  S   2.596        C   15 1.195    C   22 1.154
    24  C   3.818        C   25 1.535    C   17 1.282    H   54 0.982
    25  C   3.854        C   24 1.535    S   31 1.130    C   28 1.118
    26  C   3.820        C   27 1.536    C   22 1.281    H   55 0.982
    27  C   3.856        C   26 1.536    S   32 1.130    C   35 1.118
    28  C   4.025        O   36 1.723    N   29 1.124    C   25 1.118
    29  N   3.297        C   30 1.225    C   28 1.124    C   37 0.951
    30  C   3.989        S   38 1.609    N   29 1.225    S   31 1.145
    31  S   2.507        C   30 1.145    C   25 1.130    S   38 0.133
    32  S   2.509        C   33 1.144    C   27 1.130    S   39 0.133
    33  C   3.987        S   39 1.606    N   34 1.224    S   32 1.144
    34  N   3.297        C   33 1.224    C   35 1.124    C   40 0.951
    35  C   4.026        O   41 1.724    N   34 1.124    C   27 1.118
    36  O   1.875        C   28 1.723
    37  C   3.923        H   56 0.994    C   42 0.990    H   57 0.986    N   29 0.951
    38  S   1.845        C   30 1.609    S   31 0.133
    39  S   1.844        C   33 1.606    S   32 0.133
    40  C   3.924        H   59 0.993    C   45 0.990    H   58 0.986    N   34 0.951
    41  O   1.876        C   35 1.724
    42  C   3.927        H   62 0.999    H   60 0.997    H   61 0.991    C   37 0.990
    43  C   3.936        H   63 0.999    H   65 0.998    C   13 0.996    H   64 0.985
    44  C   3.915        H   66 0.999    H   68 0.998    C   12 0.994    H   67 0.983
    45  C   3.927        H   69 1.000    H   71 0.997    H   70 0.991    C   40 0.990
    46  H   1.021        C   12 0.990
    47  H   1.023        C   12 0.999
    48  H   1.026        C   13 1.000
    49  H   1.022        C   13 0.993
    50  H   1.020        C   18 0.988
    51  H   1.057        C   19 0.993
    52  H   1.058        C   20 0.993
    53  H   1.020        C   21 0.988
    54  H   1.031        C   24 0.982
    55  H   1.030        C   26 0.982
    56  H   1.039        C   37 0.994
    57  H   1.006        C   37 0.986
    58  H   1.007        C   40 0.986
    59  H   1.039        C   40 0.993
    60  H   1.029        C   42 0.997
    61  H   1.029        C   42 0.991
    62  H   1.011        C   42 0.999
    63  H   1.016        C   43 0.999
    64  H   1.020        C   43 0.985
    65  H   1.018        C   43 0.998
    66  H   1.025        C   44 0.999
    67  H   1.029        C   44 0.983
    68  H   1.032        C   44 0.998
    69  H   1.010        C   45 1.000
    70  H   1.029        C   45 0.991
    71  H   1.029        C   45 0.997

 dipole moment from electron density (au)
     X       Y       Z   
  -0.9066  -0.3041  -3.7462  total (Debye):    9.827


           -------------------------------------------------
          | TOTAL ENERGY             -147.930005496432 Eh   |
          | GRADIENT NORM               0.122661087762 Eh/α |
          | HOMO-LUMO GAP               0.550898265415 eV   |
           -------------------------------------------------

------------------------------------------------------------------------
 * finished run on 2021/12/02 at 16:34:34.711     
------------------------------------------------------------------------
 total:
 * wall-time:     0 d,  0 h,  0 min,  2.724 sec
 *  cpu-time:     0 d,  0 h,  0 min,  2.706 sec
 * ratio c/w:     0.993 speedup
 SCF:
 * wall-time:     0 d,  0 h,  0 min,  2.299 sec
 *  cpu-time:     0 d,  0 h,  0 min,  2.293 sec
 * ratio c/w:     0.997 speedup

