      -----------------------------------------------------------      
     |                   =====================                   |     
     |                           x T B                           |     
     |                   =====================                   |     
     |                         S. Grimme                         |     
     |          Mulliken Center for Theoretical Chemistry        |     
     |                    University of Bonn                     |     
     |                Version 6.2 RC2 (SAW190805)                |     
      -----------------------------------------------------------      

   This program is distributed in the hope that it will be useful,
   but WITHOUT ANY WARRANTY; without even the implied warranty of
   MERCHANTABILITY or FITNESS FOR A PARTICULAR PURPOSE.
   
   FOR NON-COMMERCIAL, ACADEMIA USE ONLY.
   
   Cite this work as:
   * S. Grimme, C. Bannwarth, P. Shushkov, J. Chem. Theory Comput., 2017,
     13, 1989-2009. DOI: 10.1021/acs.jctc.7b00118
   * C. Bannwarth, S. Ehlert and S. Grimme., J. Chem. Theory Comput., 2019,
     15, 1652-1671. DOI: 10.1021/acs.jctc.8b01176
   * P. Pracht, E. Caldeweyher, S. Ehlert, S. Grimme, ChemRxiv, 2019, preprint.
     DOI: 10.26434/chemrxiv.8326202.v1
   
   for DFT-D4:
   * E. Caldeweyher, C. Bannwarth and S. Grimme, J. Chem. Phys., 2017,
     147, 034112. DOI: 10.1063/1.4993215
   * E. Caldeweyher, S. Ehlert, A. Hansen, H. Neugebauer, S. Spicher,
     C. Bannwarth and S. Grimme, J. Chem. Phys., 2019, 150, 154122.
     DOI: 10.1063/1.5090222
   
   for sTDA-xTB:
   * S. Grimme and C. Bannwarth, J. Chem. Phys., 2016, 145, 054103.
     DOI: 10.1063/1.4959605
   
   in the mass-spec context:
   * V. Asgeirsson, C. Bauer and S. Grimme, Chem. Sci., 2017, 8, 4879.
     DOI: 10.1039/c7sc00601b
   
   for metadynamics refer to:
   * S. Grimme, J. Chem. Theory Comput., 2019, 155, 2847-2862
     DOI: 10.1021/acs.jctc.9b00143
   
   with help from (in alphabetical order)
   C. Bannwarth, F. Bohle, G. Brandenburg, E. Caldeweyher, M. Checinski,
   S. Dohm, S. Ehlert, S. Ehrlich, F. März, H. Neugebauer, J. Pisarek,
   P. Pracht, P. Shushkov, and S. Spicher.
   
 * started run on 2021/12/02 at 16:35:18.777     

           -------------------------------------------------
          |                Calculation Setup                |
           -------------------------------------------------

          program call               : /ihome/ghutchison/geoffh/xtb/xtb BTIC-F-m.xyz --vipea
          hostname                   : smp-n128
          coordinate file            : BTIC-F-m.xyz
          omp threads                :                     1
          number of atoms            :                    97
          number of electrons        :                   332
          charge                     :                     0
          spin                       :                   0.0
          first test random number   :      0.91352588806753


########################################################################
# WARNING! Please study the warnings concerning your input carefully
#  - XTBPATH is not set, using XTBHOME instead
########################################################################

           ------------------------------------------------- 
          |                 I P E A - x T B                 |
          |  Ionisation Potentials and Electron Affinities  |
           ------------------------------------------------- 
             KAB for M(3d)-M(3d) :                1.1000
             KAB for M(4d)-M(4d) :                1.2000
             KAB for M(5d)-M(5d) :                1.2000
             k(s)                :                2.1500
             k(p)                :                2.3000
             k(d)                :                2.0000
             k(f)                :                0.0000
             kEN (H0ij)          :                0.7000
             D3 a1               :                0.6300
             D3 a2               :                5.0000
             D3 s6               :                1.0000
             D3 s8               :                2.4000
             D3 s9               :                0.0000
             alphaj              :                1.0000
             XBdamp              :                0.4400
             XBrad               :                1.3000
             kcnsh               :      1.0000   -0.3000   -0.5000    0.5000

  Z AO/shell   Hii/eV     exponent
  1     Thu Sep 22 23:34:11 CEST 2016   EN: 2.200 GAM: 0.405  GM3: 0.1500
     1s    -10.521941    1.306199
     2s     -3.560151    0.398421
  6     Thu Sep 22 23:34:11 CEST 2016   EN: 2.550 GAM: 0.640  GM3: 0.1500
     2s    -15.968100    1.979793
     2p     -9.777107    1.850537
     3S     -3.366990    0.633095
  7     Thu Sep 22 23:34:11 CEST 2016   EN: 3.040 GAM: 0.493  GM3:-0.1000
     2s    -24.040776    2.126160
     2p    -14.426520    2.068425
     3S     -5.882278    0.671040
  8     Thu Sep 22 23:34:11 CEST 2016   EN: 3.440 GAM: 0.717  GM3:-0.2000
     2s    -26.695120    2.575264
     2p    -16.014457    2.159448
     3S     -6.622058    0.958679
  9     Tue Jan 17 20:22:52 CET 2017    EN: 3.980 GAM: 0.574  GM3: 0.2000
     2s    -27.565998    2.304073
     2p    -17.439238    2.314354
     3S     -6.120500    0.570243
 16     Tue Jan 17 20:57:36 CET 2017    EN: 2.580 GAM: 0.455  GM3: 0.1020
     3s    -24.488821    2.492075
     3p    -12.136640    1.997904
     3d     -1.796070    1.747541

           ------------------------------------------------- 
          |        Self-Consistent Charge Iterations        |
           ------------------------------------------------- 

          ...................................................
          :                      SETUP                      :
          :.................................................:
          :  # basis functions                 426          :
          :  # atomic orbitals                 421          :
          :  # shells                          263          :
          :  # electrons                       332          :
          :  # halogen bonds                     0          :
          :  max. iterations                   250          :
          :  Hamiltonian                  GFN1-xTB          :
          :  restarted?                      false          :
          :  GBSA solvation                  false          :
          :  PC potential                    false          :
          :  electronic temp.          300.0000000     K    :
          :  accuracy                    1.0000000          :
          :  -> integral cutoff          0.2500000E+02      :
          :  -> integral neglect         0.1000000E-07      :
          :  -> SCF convergence          0.1000000E-05 Eh   :
          :  -> wf. convergence          0.2000000E-04 e    :
          :  Broyden damping             0.4000000          :
          ...................................................

 iter      E             dE          RMSdq      gap      omega  full diag
   1   -205.3745924 -0.205375E+03  0.107E+01    0.08       0.0  T
   2   -200.9951668  0.437943E+01  0.706E+00    0.34       1.0  T
   3    -98.3874120  0.102608E+03  0.106E+01    0.11       1.0  T
   4   -109.6481908 -0.112608E+02  0.951E+00    0.02       1.0  T
   5   -205.7508304 -0.961026E+02  0.327E+00    0.41       1.0  T
   6   -208.3309150 -0.258008E+01  0.180E+00    0.03       1.0  T
   7   -208.8424470 -0.511532E+00  0.133E+00    0.50       1.0  T
   8   -208.9047527 -0.623057E-01  0.108E+00    0.49       1.0  T
   9   -208.9458996 -0.411469E-01  0.880E-01    0.42       1.0  T
  10   -208.9699469 -0.240472E-01  0.501E-01    0.27       1.0  T
  11   -208.9831951 -0.132482E-01  0.304E-01    0.35       1.0  T
  12   -209.0002054 -0.170103E-01  0.181E-01    0.35       1.0  T
  13   -209.0062626 -0.605723E-02  0.131E-01    0.38       1.0  T
  14   -209.0104286 -0.416598E-02  0.968E-02    0.42       1.0  T
  15   -209.0134768 -0.304819E-02  0.707E-02    0.44       1.0  T
  16   -209.0153753 -0.189853E-02  0.474E-02    0.47       1.0  T
  17   -209.0160334 -0.658041E-03  0.304E-02    0.48       1.0  T
  18   -209.0164195 -0.386113E-03  0.162E-02    0.48       1.0  T
  19   -209.0164931 -0.735933E-04  0.827E-03    0.46       1.2  T
  20   -209.0164917  0.137802E-05  0.524E-03    0.45       1.9  T
  21   -209.0164985 -0.678021E-05  0.290E-03    0.45       3.5  T
  22   -209.0165003 -0.185961E-05  0.172E-03    0.45       5.9  T
  23   -209.0165016 -0.126580E-05  0.870E-04    0.45      11.7  T
  24   -209.0165018 -0.250272E-06  0.467E-04    0.46      21.7  T
  25   -209.0165019 -0.278123E-07  0.284E-04    0.46      35.8  T
  26   -209.0165019 -0.196376E-07  0.161E-04    0.46      63.2  T
  27   -209.0165019 -0.526376E-08  0.102E-04    0.46      99.1  T

   *** convergence criteria satisfied after 27 iterations ***

         #    Occupation            Energy/Eh            Energy/eV
      -------------------------------------------------------------
         1        2.0000           -1.1462189             -31.1902
       ...           ...                  ...                  ...
       160        2.0000           -0.3813105             -10.3760
       161        2.0000           -0.3776958             -10.2776
       162        2.0000           -0.3738740             -10.1736
       163        2.0000           -0.3697644             -10.0618
       164        2.0000           -0.3492739              -9.5042
       165        2.0000           -0.3471657              -9.4469
       166        1.9997           -0.3063944              -8.3374 (HOMO)
       167        0.0003           -0.2896418              -7.8816 (LUMO)
       168        0.0000           -0.2873043              -7.8179
       169                         -0.2792782              -7.5995
       170                         -0.2699776              -7.3465
       171                         -0.2684025              -7.3036
       ...                                ...                  ...
       421                        582.2867222           15844.8282
      -------------------------------------------------------------
                  HL-Gap            0.0167526 Eh            0.4559 eV
             Fermi-level           -0.2980571 Eh           -8.1105 eV

 SCC (total)                   0 d,  0 h,  0 min,  1.797 sec
 SCC setup                      ...        0 min,  0.004 sec (  0.211%)
 Dispersion                     ...        0 min,  0.000 sec (  0.017%)
 integral evaluation            ...        0 min,  0.788 sec ( 43.853%)
 zeroth order Hamiltonian       ...        0 min,  0.003 sec (  0.180%)
 iterations                     ...        0 min,  0.759 sec ( 42.217%)
 molecular gradient             ...        0 min,  0.239 sec ( 13.296%)
 printout                       ...        0 min,  0.004 sec (  0.223%)

         :::::::::::::::::::::::::::::::::::::::::::::::::::::
         ::                     SUMMARY                     ::
         :::::::::::::::::::::::::::::::::::::::::::::::::::::
         :: total energy            -205.381743949877 Eh    ::
         :: gradient norm              0.383933618716 Eh/a0 ::
         :: HOMO-LUMO gap              0.455861076492 eV    ::
         ::.................................................::
         :: SCC energy              -209.016501887443 Eh    ::
         :: -> electrostatic           0.568680722607 Eh    ::
         :: repulsion energy           3.725832810432 Eh    ::
         :: dispersion energy         -0.091074872865 Eh    ::
         :: halogen bond corr.         0.000000000000 Eh    ::
         :: add. restraining           0.000000000000 Eh    ::
         :::::::::::::::::::::::::::::::::::::::::::::::::::::

           ------------------------------------------------- 
          |        vertical delta SCC IP calculation        |
           ------------------------------------------------- 

          ...................................................
          :                      SETUP                      :
          :.................................................:
          :  # basis functions                 426          :
          :  # atomic orbitals                 421          :
          :  # shells                          263          :
          :  # electrons                       331          :
          :  # halogen bonds                     0          :
          :  max. iterations                   250          :
          :  Hamiltonian                  GFN1-xTB          :
          :  restarted?                       true          :
          :  GBSA solvation                  false          :
          :  PC potential                    false          :
          :  electronic temp.          300.0000000     K    :
          :  accuracy                    1.0000000          :
          :  -> integral cutoff          0.2500000E+02      :
          :  -> integral neglect         0.1000000E-07      :
          :  -> SCF convergence          0.1000000E-05 Eh   :
          :  -> wf. convergence          0.2000000E-04 e    :
          :  Broyden damping             0.4000000          :
          ...................................................

 iter      E             dE          RMSdq      gap      omega  full diag
   1   -208.6458458 -0.208646E+03  0.256E-01    0.46       0.0  T
   2   -208.6508297 -0.498392E-02  0.244E-01    0.61       1.0  T
   3   -208.6650681 -0.142384E-01  0.116E-01    0.53       1.0  T
   4   -208.6664999 -0.143174E-02  0.540E-02    0.53       1.0  T
   5   -208.6652675  0.123235E-02  0.631E-02    0.53       1.0  T
   6   -208.6666554 -0.138786E-02  0.224E-02    0.53       1.0  T
   7   -208.6666962 -0.408152E-04  0.126E-02    0.52       1.0  T
   8   -208.6667128 -0.166180E-04  0.717E-03    0.53       1.4  T
   9   -208.6667288 -0.159887E-04  0.299E-03    0.53       3.4  T
  10   -208.6667304 -0.161957E-05  0.101E-03    0.53      10.0  T
  11   -208.6667305 -0.802031E-07  0.540E-04    0.53      18.8  T
  12   -208.6667305 -0.258678E-07  0.342E-04    0.53      29.7  T
  13   -208.6667305 -0.161944E-07  0.142E-04    0.53      71.3  T
  14   -208.6667306 -0.285513E-08  0.491E-05    0.53     206.6  T

   *** convergence criteria satisfied after 14 iterations ***

         #    Occupation            Energy/Eh            Energy/eV
      -------------------------------------------------------------
         1        2.0000           -1.2302199             -33.4760
       ...           ...                  ...                  ...
       160        2.0000           -0.4404214             -11.9845
       161        2.0000           -0.4393891             -11.9564
       162        2.0000           -0.4355838             -11.8528
       163        2.0000           -0.4282864             -11.6543
       164        2.0000           -0.4118831             -11.2079
       165        1.9839           -0.4007665             -10.9054
       166        1.0160           -0.3929500             -10.6927 (HOMO)
       167        0.0000           -0.3736364             -10.1672 (LUMO)
       168                         -0.3581847              -9.7467
       169                         -0.3485961              -9.4858
       170                         -0.3405216              -9.2661
       171                         -0.3259466              -8.8695
       ...                                ...                  ...
       421                        582.2178283           15842.9535
      -------------------------------------------------------------
                  HL-Gap            0.0193136 Eh            0.5256 eV
             Fermi-level           -0.3900757 Eh          -10.6145 eV

 SCC (total)                   0 d,  0 h,  0 min,  1.426 sec
 SCC setup                      ...        0 min,  0.004 sec (  0.276%)
 Dispersion                     ...        0 min,  0.000 sec (  0.012%)
 integral evaluation            ...        0 min,  0.788 sec ( 55.276%)
 zeroth order Hamiltonian       ...        0 min,  0.003 sec (  0.223%)
 iterations                     ...        0 min,  0.387 sec ( 27.146%)
 molecular gradient             ...        0 min,  0.239 sec ( 16.770%)
 printout                       ...        0 min,  0.004 sec (  0.293%)

         :::::::::::::::::::::::::::::::::::::::::::::::::::::
         ::                     SUMMARY                     ::
         :::::::::::::::::::::::::::::::::::::::::::::::::::::
         :: total energy            -205.031972613951 Eh    ::
         :: gradient norm              0.374886974367 Eh/a0 ::
         :: HOMO-LUMO gap              0.525551129882 eV    ::
         ::.................................................::
         :: SCC energy              -208.666730551518 Eh    ::
         :: -> electrostatic           0.606925942818 Eh    ::
         :: repulsion energy           3.725832810432 Eh    ::
         :: dispersion energy         -0.091074872865 Eh    ::
         :: halogen bond corr.         0.000000000000 Eh    ::
         :: add. restraining           0.000000000000 Eh    ::
         :::::::::::::::::::::::::::::::::::::::::::::::::::::

------------------------------------------------------------------------
empirical IP shift (eV):    4.8455
delta SCC IP (eV):    4.6723
------------------------------------------------------------------------
           ------------------------------------------------- 
          |        vertical delta SCC EA calculation        |
           ------------------------------------------------- 

          ...................................................
          :                      SETUP                      :
          :.................................................:
          :  # basis functions                 426          :
          :  # atomic orbitals                 421          :
          :  # shells                          263          :
          :  # electrons                       333          :
          :  # halogen bonds                     0          :
          :  max. iterations                   250          :
          :  Hamiltonian                  GFN1-xTB          :
          :  restarted?                       true          :
          :  GBSA solvation                  false          :
          :  PC potential                    false          :
          :  electronic temp.          300.0000000     K    :
          :  accuracy                    1.0000000          :
          :  -> integral cutoff          0.2500000E+02      :
          :  -> integral neglect         0.1000000E-07      :
          :  -> SCF convergence          0.1000000E-05 Eh   :
          :  -> wf. convergence          0.2000000E-04 e    :
          :  Broyden damping             0.4000000          :
          ...................................................

 iter      E             dE          RMSdq      gap      omega  full diag
   1   -209.1798350 -0.209180E+03  0.427E-01    0.42       0.0  T
   2   -208.6671390  0.512696E+00  0.964E-01    0.27       1.0  T
   3   -209.2410380 -0.573899E+00  0.317E-01    0.14       1.0  T
   4   -209.2672825 -0.262445E-01  0.166E-01    0.06       1.0  T
   5   -209.2580537  0.922874E-02  0.161E-01    0.09       1.0  T
   6   -209.2501357  0.791805E-02  0.183E-01    0.20       1.0  T
   7   -209.2687105 -0.185748E-01  0.633E-02    0.09       1.0  T
   8   -209.2701007 -0.139023E-02  0.336E-02    0.07       1.0  T
   9   -209.2705046 -0.403874E-03  0.147E-02    0.07       1.0  T
  10   -209.2705230 -0.184706E-04  0.103E-02    0.07       1.0  T
  11   -209.2705784 -0.553830E-04  0.235E-03    0.07       4.3  T
  12   -209.2705790 -0.615949E-06  0.146E-03    0.07       7.0  T
  13   -209.2705791 -0.926827E-07  0.842E-04    0.07      12.1  T
  14   -209.2705789  0.243532E-06  0.848E-04    0.07      12.0  T
  15   -209.2705790 -0.126810E-06  0.746E-04    0.07      13.6  T
  16   -209.2705794 -0.389359E-06  0.143E-04    0.07      71.1  T
  17   -209.2705794 -0.729639E-08  0.612E-05    0.07     166.0  T

   *** convergence criteria satisfied after 17 iterations ***

         #    Occupation            Energy/Eh            Energy/eV
      -------------------------------------------------------------
         1        2.0000           -1.0702780             -29.1237
       ...           ...                  ...                  ...
       161        2.0000           -0.3138650              -8.5407
       162        2.0000           -0.3062466              -8.3334
       163        2.0000           -0.2995468              -8.1511
       164        2.0000           -0.2859999              -7.7825
       165        2.0000           -0.2775949              -7.5537
       166        1.9999           -0.2363530              -6.4315
       167        0.8055           -0.2178011              -5.9267 (HOMO)
       168        0.1939           -0.2150979              -5.8531 (LUMO)
       169        0.0007           -0.2094873              -5.7004
       170                         -0.2000997              -5.4450
       171                         -0.1984986              -5.4014
       172                         -0.1755324              -4.7765
       ...                                ...                  ...
       421                        582.3505914           15846.5662
      -------------------------------------------------------------
                  HL-Gap            0.0027032 Eh            0.0736 eV
             Fermi-level           -0.2217777 Eh           -6.0349 eV

 SCC (total)                   0 d,  0 h,  0 min,  1.509 sec
 SCC setup                      ...        0 min,  0.004 sec (  0.260%)
 Dispersion                     ...        0 min,  0.000 sec (  0.019%)
 integral evaluation            ...        0 min,  0.787 sec ( 52.174%)
 zeroth order Hamiltonian       ...        0 min,  0.003 sec (  0.213%)
 iterations                     ...        0 min,  0.471 sec ( 31.186%)
 molecular gradient             ...        0 min,  0.239 sec ( 15.832%)
 printout                       ...        0 min,  0.005 sec (  0.310%)

         :::::::::::::::::::::::::::::::::::::::::::::::::::::
         ::                     SUMMARY                     ::
         :::::::::::::::::::::::::::::::::::::::::::::::::::::
         :: total energy            -205.635821476499 Eh    ::
         :: gradient norm              0.391157174125 Eh/a0 ::
         :: HOMO-LUMO gap              0.073558345434 eV    ::
         ::.................................................::
         :: SCC energy              -209.270579414066 Eh    ::
         :: -> electrostatic           0.598387942769 Eh    ::
         :: repulsion energy           3.725832810432 Eh    ::
         :: dispersion energy         -0.091074872865 Eh    ::
         :: halogen bond corr.         0.000000000000 Eh    ::
         :: add. restraining           0.000000000000 Eh    ::
         :::::::::::::::::::::::::::::::::::::::::::::::::::::

------------------------------------------------------------------------
empirical EA shift (eV):    4.8455
delta SCC EA (eV):    2.0683
------------------------------------------------------------------------
           -------------------------------------------------
          |                Property Printout                |
           -------------------------------------------------

    * Orbital Energies and Occupations

         #    Occupation            Energy/Eh            Energy/eV
      -------------------------------------------------------------
         1        2.0000           -1.0702780             -29.1237
       ...           ...                  ...                  ...
       155        2.0000           -0.3293387              -8.9618
       156        2.0000           -0.3229339              -8.7875
       157        2.0000           -0.3215765              -8.7505
       158        2.0000           -0.3202342              -8.7140
       159        2.0000           -0.3170910              -8.6285
       160        2.0000           -0.3147797              -8.5656
       161        2.0000           -0.3138650              -8.5407
       162        2.0000           -0.3062466              -8.3334
       163        2.0000           -0.2995468              -8.1511
       164        2.0000           -0.2859999              -7.7825
       165        2.0000           -0.2775949              -7.5537
       166        1.9999           -0.2363530              -6.4315
       167        0.8055           -0.2178011              -5.9267 (HOMO)
       168        0.1939           -0.2150979              -5.8531 (LUMO)
       169        0.0007           -0.2094873              -5.7004
       170                         -0.2000997              -5.4450
       171                         -0.1984986              -5.4014
       172                         -0.1755324              -4.7765
       173                         -0.1728722              -4.7041
       174                         -0.1587235              -4.3191
       175                         -0.1580287              -4.3002
       176                         -0.1502447              -4.0884
       177                         -0.1438643              -3.9147
       178                         -0.1355892              -3.6896
       ...                                ...                  ...
       421                        582.3505914           15846.5662
      -------------------------------------------------------------
                  HL-Gap            0.0027032 Eh            0.0736 eV
             Fermi-level           -0.2217777 Eh           -6.0349 eV

  Mulliken/CM5 charges        n(s)   n(p)   n(d)
     1 C  -0.37326 -0.33797   0.994  2.633  0.000
     2 O  -0.63856 -0.68481   1.823  3.539  0.000
     3 C  -0.40750 -0.40947   1.005  2.587  0.000
     4 C   0.20498  0.15284   1.033  3.172  0.000
     5 C   0.06093  0.00975   1.059  3.002  0.000
     6 C  -0.08278 -0.07149   1.138  2.779  0.000
     7 F   0.19132  0.16703   1.697  5.494  0.000
     8 C   0.04903  0.00153   1.065  2.984  0.000
     9 C   0.11736  0.11421   1.036  3.082  0.000
    10 C   0.06009  0.05942   1.050  3.010  0.000
    11 C   0.04974  0.05589   0.991  3.059  0.000
    12 C  -0.08652  0.03068   1.199  2.715  0.000
    13 N   0.32383  0.19071   1.503  3.821  0.000
    14 C  -0.08198  0.03716   1.202  2.716  0.000
    15 N   0.33749  0.20741   1.530  3.808  0.000
    16 C   0.12084  0.11894   1.005  3.116  0.000
    17 C   0.08874  0.04059   1.011  3.078  0.000
    18 C   0.02517  0.03282   1.107  2.918  0.000
    19 S   0.26936  0.23712   1.866  4.176  0.227
    20 C   0.01819  0.03605   1.106  2.912  0.000
    21 C  -0.00004  0.01317   1.138  2.862  0.000
    22 C   0.03061  0.02264   1.044  2.986  0.000
    23 C   0.02712 -0.07890   1.072  2.955  0.000
    24 C   0.05733 -0.09415   1.072  2.985  0.000
    25 S   0.08840  0.05569   1.877  4.138  0.073
    26 C   0.00487  0.02704   1.136  2.869  0.000
    27 C  -0.03658  0.03324   1.065  2.898  0.000
    28 N   0.13287 -0.12479   1.261  3.872  0.000
    29 C  -0.00668 -0.05512   1.114  2.879  0.000
    30 C  -0.04208  0.02776   1.057  2.901  0.000
    31 C   0.02358  0.03671   1.071  2.953  0.000
    32 C  -0.06460  0.02351   1.149  2.786  0.000
    33 N   0.26254  0.10080   1.473  3.789  0.000
    34 S  -0.12253  0.01235   1.862  3.705  0.310
    35 N   0.26373  0.10197   1.473  3.791  0.000
    36 C  -0.06424  0.02386   1.150  2.786  0.000
    37 C   0.02241  0.03541   1.070  2.952  0.000
    38 C  -0.04607  0.02256   1.056  2.898  0.000
    39 N   0.12252 -0.13332   1.248  3.874  0.000
    40 C  -0.03301 -0.08261   1.094  2.873  0.000
    41 C   0.05929 -0.08749   1.069  2.990  0.000
    42 C  -0.04250  0.02677   1.059  2.899  0.000
    43 C  -0.00040  0.02168   1.139  2.861  0.000
    44 S   0.09785  0.06345   1.877  4.139  0.082
    45 C  -0.00192  0.01149   1.139  2.859  0.000
    46 C  -0.00354  0.01432   1.116  2.880  0.000
    47 S   0.12122  0.08481   1.880  4.166  0.075
    48 C  -0.00201  0.00597   1.157  2.841  0.000
    49 C   0.00031 -0.00639   1.070  2.930  0.000
    50 C   0.04133 -0.06313   1.081  2.961  0.000
    51 C   0.35950  0.20871   0.950  3.410  0.000
    52 C   0.12903  0.08199   1.057  3.072  0.000
    53 C   0.04109  0.03812   1.075  2.966  0.000
    54 C   0.00606  0.00545   1.106  2.900  0.000
    55 C   0.02334  0.02971   1.029  2.995  0.000
    56 C  -0.09062  0.02796   1.216  2.694  0.000
    57 N   0.32188  0.19256   1.527  3.795  0.000
    58 C  -0.09182  0.02741   1.215  2.693  0.000
    59 N   0.32425  0.19448   1.529  3.795  0.000
    60 C   0.02329  0.02010   1.079  2.944  0.000
    61 C   0.15228  0.10478   1.058  3.095  0.000
    62 C  -0.06463 -0.05332   1.167  2.768  0.000
    63 F   0.22687  0.20259   1.709  5.518  0.000
    64 C   0.17550  0.12432   1.105  3.070  0.000
    65 C   0.16947  0.11730   1.069  3.100  0.000
    66 C   0.04244  0.04033   1.095  2.948  0.000
    67 C  -0.13243 -0.09831   1.181  2.687  0.000
    68 O   0.34900  0.29370   1.646  4.703  0.000
    69 C   0.57725  0.42929   0.901  3.676  0.000
    70 H   0.01506  0.07363   1.015  0.000  0.000
    71 H  -0.02496  0.03280   0.975  0.000  0.000
    72 H  -0.02770  0.03719   0.972  0.000  0.000
    73 H  -0.03326  0.03734   0.967  0.000  0.000
    74 H  -0.01696  0.04069   0.983  0.000  0.000
    75 H  -0.01016  0.04794   0.990  0.000  0.000
    76 H  -0.01359  0.03924   0.986  0.000  0.000
    77 H  -0.01205  0.03999   0.988  0.000  0.000
    78 H  -0.00487  0.04850   0.995  0.000  0.000
    79 H   0.00748  0.07590   1.007  0.000  0.000
    80 H   0.01969  0.08737   1.020  0.000  0.000
    81 H  -0.03364  0.03641   0.966  0.000  0.000
    82 H  -0.01303  0.05613   0.987  0.000  0.000
    83 H  -0.02499  0.03030   0.975  0.000  0.000
    84 H  -0.00438  0.04796   0.996  0.000  0.000
    85 H  -0.00268  0.05299   0.997  0.000  0.000
    86 H   0.01251  0.07334   1.013  0.000  0.000
    87 H   0.01655  0.07292   1.017  0.000  0.000
    88 H   0.06321  0.12501   1.063  0.000  0.000
    89 H  -0.30553 -0.25342   0.694  0.000  0.000
    90 H  -0.28457 -0.22925   0.715  0.000  0.000
    91 H  -0.31450 -0.24851   0.686  0.000  0.000
    92 H  -0.29684 -0.23238   0.703  0.000  0.000
    93 H  -0.26759 -0.20983   0.732  0.000  0.000
    94 H  -0.28649 -0.22795   0.714  0.000  0.000
    95 H  -0.24785 -0.19058   0.752  0.000  0.000
    96 H  -0.29792 -0.24204   0.702  0.000  0.000
    97 H  -0.28893 -0.23653   0.711  0.000  0.000
(R)spin-density population

 Mulliken population n(s)   n(p)   n(d)
     1 C   0.0237   0.004  0.020  0.000
     2 O   0.0451   0.001  0.044  0.000
     3 C   0.0178   0.003  0.015  0.000
     4 C   0.0151   0.001  0.014  0.000
     5 C   0.0319   0.002  0.030  0.000
     6 C   0.0024   0.001  0.002  0.000
     7 F   0.0003   0.000  0.000  0.000
     8 C   0.0212   0.000  0.021  0.000
     9 C   0.0197   0.000  0.020  0.000
    10 C   0.0340   0.000  0.034  0.000
    11 C   0.0264   0.000  0.026  0.000
    12 C   0.0044  -0.000  0.005  0.000
    13 N   0.0139  -0.000  0.014  0.000
    14 C   0.0041   0.000  0.004  0.000
    15 N   0.0133  -0.000  0.013  0.000
    16 C   0.0386   0.008  0.030  0.000
    17 C   0.0035  -0.000  0.004  0.000
    18 C   0.0063   0.000  0.006  0.000
    19 S   0.0463   0.001  0.008  0.037
    20 C   0.0184   0.005  0.014  0.000
    21 C   0.0055   0.000  0.005  0.000
    22 C   0.0015   0.000  0.001  0.000
    23 C   0.0002   0.000  0.000  0.000
    24 C   0.0000   0.000  0.000  0.000
    25 S   0.0051   0.000  0.003  0.002
    26 C   0.0036   0.000  0.003  0.000
    27 C   0.0067   0.000  0.007  0.000
    28 N   0.0090  -0.000  0.009  0.000
    29 C   0.0005   0.000  0.000  0.000
    30 C   0.0058  -0.000  0.006  0.000
    31 C   0.0118   0.000  0.012  0.000
    32 C   0.0071   0.000  0.007  0.000
    33 N   0.0251   0.000  0.025  0.000
    34 S   0.0299   0.000  0.021  0.009
    35 N   0.0167  -0.000  0.017  0.000
    36 C   0.0022   0.000  0.002  0.000
    37 C   0.0030   0.000  0.003  0.000
    38 C   0.0244  -0.000  0.024  0.000
    39 N   0.0119   0.000  0.012  0.000
    40 C   0.0003  -0.000  0.000  0.000
    41 C   0.0008   0.000  0.001  0.000
    42 C   0.0019   0.000  0.002  0.000
    43 C   0.0069   0.000  0.007  0.000
    44 S   0.0046   0.000  0.004  0.001
    45 C   0.0029   0.000  0.003  0.000
    46 C   0.0271   0.000  0.027  0.000
    47 S   0.0201   0.000  0.017  0.003
    48 C   0.0063   0.000  0.006  0.000
    49 C   0.0327   0.000  0.033  0.000
    50 C   0.0007   0.000  0.000  0.000
    51 C   0.0025   0.001  0.002  0.000
    52 C   0.0728   0.000  0.073  0.000
    53 C   0.0123   0.000  0.012  0.000
    54 C   0.0743   0.000  0.074  0.000
    55 C   0.0431   0.000  0.043  0.000
    56 C   0.0090   0.000  0.009  0.000
    57 N   0.0252  -0.000  0.025  0.000
    58 C   0.0090   0.000  0.009  0.000
    59 N   0.0246   0.000  0.025  0.000
    60 C   0.0006   0.000  0.001  0.000
    61 C   0.0175   0.000  0.017  0.000
    62 C   0.0001   0.000  0.000  0.000
    63 F   0.0000   0.000  0.000  0.000
    64 C   0.0185   0.000  0.018  0.000
    65 C   0.0004   0.000  0.000  0.000
    66 C   0.0160   0.000  0.016  0.000
    67 C   0.0008   0.000  0.001  0.000
    68 O   0.0007   0.000  0.001  0.000
    69 C   0.0014   0.001  0.001  0.000
    70 H   0.0023   0.002  0.000  0.000
    71 H   0.0015   0.001  0.000  0.000
    72 H  -0.0000  -0.000  0.000  0.000
    73 H   0.0027   0.003  0.000  0.000
    74 H   0.0000   0.000  0.000  0.000
    75 H   0.0000   0.000  0.000  0.000
    76 H   0.0000   0.000  0.000  0.000
    77 H   0.0000   0.000  0.000  0.000
    78 H   0.0000   0.000  0.000  0.000
    79 H   0.0001   0.000  0.000  0.000
    80 H   0.0005   0.000  0.000  0.000
    81 H   0.0001   0.000  0.000  0.000
    82 H   0.0001   0.000  0.000  0.000
    83 H   0.0001   0.000  0.000  0.000
    84 H   0.0001   0.000  0.000  0.000
    85 H  -0.0000  -0.000  0.000  0.000
    86 H   0.0001   0.000  0.000  0.000
    87 H   0.0010   0.001  0.000  0.000
    88 H   0.0001   0.000  0.000  0.000
    89 H   0.0005   0.000  0.000  0.000
    90 H   0.0000   0.000  0.000  0.000
    91 H   0.0004   0.000  0.000  0.000
    92 H   0.0000   0.000  0.000  0.000
    93 H   0.0000   0.000  0.000  0.000
    94 H   0.0000   0.000  0.000  0.000
    95 H  -0.0000  -0.000  0.000  0.000
    96 H   0.0002   0.000  0.000  0.000
    97 H   0.0005   0.000  0.000  0.000

Wiberg/Mayer (AO) data.
largest (>0.10) Wiberg bond orders for each atom
          total WBO             WBO to atom ...
     1  C   3.698        O    2 1.890    C    3 0.888    C   16 0.818
     2  O   2.490        C    1 1.890    S   19 0.206    C   16 0.138
     3  C   3.842        C    4 1.328    C    9 1.284    C    1 0.888
     4  C   3.739        C    3 1.328    C    5 1.277    H   70 0.959
     5  C   3.777        C    6 1.411    C    4 1.277    H   71 0.980
     6  C   3.964        C    8 1.414    C    5 1.411    F    7 1.025
     7  F   0.981        C    6 1.025
     8  C   3.796        C    6 1.414    C    9 1.342    H   72 1.001
     9  C   3.799        C    8 1.342    C    3 1.284    C   10 1.111
    10  C   3.750        C   11 1.262    C   16 1.183    C    9 1.111
    11  C   3.672        C   10 1.262    C   12 1.191    C   14 1.184
    12  C   4.082        N   13 2.820    C   11 1.191
    13  N   2.847        C   12 2.820
    14  C   4.085        N   15 2.847    C   11 1.184
    15  N   2.903        C   14 2.847
    16  C   3.689        C   17 1.276    C   10 1.183    C    1 0.818    O    2 0.138
    17  C   3.673        C   18 1.363    C   16 1.276    H   73 0.966
    18  C   3.798        C   17 1.363    C   22 1.335    S   19 1.081
    19  S   2.628        C   18 1.081    C   20 1.056    O    2 0.206
    20  C   3.695        C   21 1.335    C   27 1.288    S   19 1.056
    21  C   3.875        C   22 1.372    C   20 1.335    S   25 1.147
    22  C   3.737        C   21 1.372    C   18 1.335    C   23 1.007
    23  C   3.896        C   22 1.007    H   75 0.997    H   74 0.992    C   24 0.977
    24  C   3.917        H   78 1.002    H   76 0.998    H   77 0.993    C   23 0.977
    25  S   2.434        C   26 1.174    C   21 1.147
    26  C   3.865        C   27 1.334    C   31 1.304    S   25 1.174
    27  C   3.862        C   26 1.334    C   20 1.288    N   28 1.165
    28  N   3.097        C   27 1.165    C   30 1.163    C   29 0.952
    29  C   3.885        H   79 1.000    H   80 0.996    C   69 0.957    N   28 0.952
    30  C   3.806        C   38 1.290    C   31 1.282    N   28 1.163
    31  C   3.859        C   26 1.304    C   30 1.282    C   32 1.215
    32  C   4.021        N   33 1.536    C   31 1.215    C   36 1.189
    33  N   2.961        C   32 1.536    S   34 1.374
    34  S   3.055        N   33 1.374    N   35 1.374
    35  N   2.959        C   36 1.536    S   34 1.374
    36  C   4.025        N   35 1.536    C   37 1.215    C   32 1.189
    37  C   3.858        C   38 1.295    C   43 1.292    C   36 1.215
    38  C   3.785        C   37 1.295    C   30 1.290    N   39 1.148
    39  N   3.047        C   38 1.148    C   42 1.144    C   40 0.969
    40  C   3.900        H   82 1.001    H   81 0.993    C   41 0.992    N   39 0.969
    41  C   3.907        H   85 1.003    H   83 0.998    C   40 0.992    H   84 0.991
    42  C   3.855        C   43 1.354    C   46 1.288    N   39 1.144
    43  C   3.893        C   42 1.354    C   37 1.292    S   44 1.186
    44  S   2.484        C   43 1.186    C   45 1.149
    45  C   3.872        C   46 1.365    C   49 1.325    S   44 1.149
    46  C   3.829        C   45 1.365    C   42 1.288    S   47 1.190
    47  S   2.451        C   46 1.190    C   48 1.102
    48  C   3.913        C   49 1.427    C   52 1.289    S   47 1.102
    49  C   3.765        C   48 1.427    C   45 1.325    C   50 1.010
    50  C   3.893        C   49 1.010    H   86 0.996    H   87 0.985    C   51 0.951
    51  C   3.610        H   88 1.014    C   50 0.951    H   90 0.849    H   89 0.819
    52  C   3.565        C   53 1.501    C   48 1.289    H   91 0.806
    53  C   3.836        C   52 1.501    C   54 1.199    C   67 1.072
    54  C   3.808        C   55 1.407    C   53 1.199    C   60 1.107
    55  C   3.750        C   54 1.407    C   58 1.167    C   56 1.167
    56  C   4.103        N   57 2.862    C   55 1.167
    57  N   2.890        C   56 2.862
    58  C   4.099        N   59 2.865    C   55 1.167
    59  N   2.898        C   58 2.865
    60  C   3.879        C   61 1.433    C   66 1.312    C   54 1.107
    61  C   3.693        C   60 1.433    C   62 1.420    H   92 0.853
    62  C   3.976        C   64 1.441    C   61 1.420    F   63 0.988
    63  F   0.952        C   62 0.988
    64  C   3.792        C   62 1.441    C   65 1.420    H   93 0.897
    65  C   3.786        C   66 1.460    C   64 1.420    H   94 0.876
    66  C   3.874        C   65 1.460    C   60 1.312    C   67 1.047
    67  C   3.988        O   68 1.808    C   53 1.072    C   66 1.047
    68  O   1.970        C   67 1.808
    69  C   3.402        C   29 0.957    H   95 0.868    H   97 0.832    H   96 0.825
    70  H   1.038        C    4 0.959
    71  H   1.027        C    5 0.980
    72  H   1.079        C    8 1.001
    73  H   1.060        C   17 0.966
    74  H   1.043        C   23 0.992
    75  H   1.061        C   23 0.997
    76  H   1.035        C   24 0.998
    77  H   1.050        C   24 0.993
    78  H   1.053        C   24 1.002
    79  H   1.070        C   29 1.000
    80  H   1.058        C   29 0.996
    81  H   1.045        C   40 0.993
    82  H   1.067        C   40 1.001
    83  H   1.035        C   41 0.998
    84  H   1.058        C   41 0.991
    85  H   1.074        C   41 1.003
    86  H   1.064        C   50 0.996
    87  H   1.067        C   50 0.985
    88  H   1.093        C   51 1.014
    89  H   0.917        C   51 0.819
    90  H   0.922        C   51 0.849
    91  H   0.934        C   52 0.806
    92  H   0.949        C   61 0.853
    93  H   0.949        C   64 0.897
    94  H   0.943        C   65 0.876
    95  H   0.938        C   69 0.868
    96  H   0.944        C   69 0.825
    97  H   0.946        C   69 0.832

 dipole moment from electron density (au)
     X       Y       Z   
  12.2508  -9.2551   4.6219  total (Debye):   40.755


           -------------------------------------------------
          | TOTAL ENERGY             -205.635821476499 Eh   |
          | GRADIENT NORM               0.391157174125 Eh/α |
          | HOMO-LUMO GAP               0.073558345434 eV   |
           -------------------------------------------------

------------------------------------------------------------------------
 * finished run on 2021/12/02 at 16:35:24.325     
------------------------------------------------------------------------
 total:
 * wall-time:     0 d,  0 h,  0 min,  5.547 sec
 *  cpu-time:     0 d,  0 h,  0 min,  5.527 sec
 * ratio c/w:     0.996 speedup
 SCF:
 * wall-time:     0 d,  0 h,  0 min,  4.735 sec
 *  cpu-time:     0 d,  0 h,  0 min,  4.723 sec
 * ratio c/w:     0.997 speedup

