      -----------------------------------------------------------      
     |                   =====================                   |     
     |                           x T B                           |     
     |                   =====================                   |     
     |                         S. Grimme                         |     
     |          Mulliken Center for Theoretical Chemistry        |     
     |                    University of Bonn                     |     
     |                Version 6.2 RC2 (SAW190805)                |     
      -----------------------------------------------------------      

   This program is distributed in the hope that it will be useful,
   but WITHOUT ANY WARRANTY; without even the implied warranty of
   MERCHANTABILITY or FITNESS FOR A PARTICULAR PURPOSE.
   
   FOR NON-COMMERCIAL, ACADEMIA USE ONLY.
   
   Cite this work as:
   * S. Grimme, C. Bannwarth, P. Shushkov, J. Chem. Theory Comput., 2017,
     13, 1989-2009. DOI: 10.1021/acs.jctc.7b00118
   * C. Bannwarth, S. Ehlert and S. Grimme., J. Chem. Theory Comput., 2019,
     15, 1652-1671. DOI: 10.1021/acs.jctc.8b01176
   * P. Pracht, E. Caldeweyher, S. Ehlert, S. Grimme, ChemRxiv, 2019, preprint.
     DOI: 10.26434/chemrxiv.8326202.v1
   
   for DFT-D4:
   * E. Caldeweyher, C. Bannwarth and S. Grimme, J. Chem. Phys., 2017,
     147, 034112. DOI: 10.1063/1.4993215
   * E. Caldeweyher, S. Ehlert, A. Hansen, H. Neugebauer, S. Spicher,
     C. Bannwarth and S. Grimme, J. Chem. Phys., 2019, 150, 154122.
     DOI: 10.1063/1.5090222
   
   for sTDA-xTB:
   * S. Grimme and C. Bannwarth, J. Chem. Phys., 2016, 145, 054103.
     DOI: 10.1063/1.4959605
   
   in the mass-spec context:
   * V. Asgeirsson, C. Bauer and S. Grimme, Chem. Sci., 2017, 8, 4879.
     DOI: 10.1039/c7sc00601b
   
   for metadynamics refer to:
   * S. Grimme, J. Chem. Theory Comput., 2019, 155, 2847-2862
     DOI: 10.1021/acs.jctc.9b00143
   
   with help from (in alphabetical order)
   C. Bannwarth, F. Bohle, G. Brandenburg, E. Caldeweyher, M. Checinski,
   S. Dohm, S. Ehlert, S. Ehrlich, F. März, H. Neugebauer, J. Pisarek,
   P. Pracht, P. Shushkov, and S. Spicher.
   
 * started run on 2021/12/02 at 16:34:40.821     

           -------------------------------------------------
          |                Calculation Setup                |
           -------------------------------------------------

          program call               : /ihome/ghutchison/geoffh/xtb/xtb BTIC-4EO-4Br.xyz --vipea
          hostname                   : smp-n128
          coordinate file            : BTIC-4EO-4Br.xyz
          omp threads                :                     1
          number of atoms            :                    97
          number of electrons        :                   344
          charge                     :                     0
          spin                       :                   0.0
          first test random number   :      0.05787620224034


########################################################################
# WARNING! Please study the warnings concerning your input carefully
#  - XTBPATH is not set, using XTBHOME instead
########################################################################

           ------------------------------------------------- 
          |                 I P E A - x T B                 |
          |  Ionisation Potentials and Electron Affinities  |
           ------------------------------------------------- 
             KAB for M(3d)-M(3d) :                1.1000
             KAB for M(4d)-M(4d) :                1.2000
             KAB for M(5d)-M(5d) :                1.2000
             k(s)                :                2.1500
             k(p)                :                2.3000
             k(d)                :                2.0000
             k(f)                :                0.0000
             kEN (H0ij)          :                0.7000
             D3 a1               :                0.6300
             D3 a2               :                5.0000
             D3 s6               :                1.0000
             D3 s8               :                2.4000
             D3 s9               :                0.0000
             alphaj              :                1.0000
             XBdamp              :                0.4400
             XBrad               :                1.3000
             kcnsh               :      1.0000   -0.3000   -0.5000    0.5000

  Z AO/shell   Hii/eV     exponent
  1     Thu Sep 22 23:34:11 CEST 2016   EN: 2.200 GAM: 0.405  GM3: 0.1500
     1s    -10.521941    1.306199
     2s     -3.560151    0.398421
  6     Thu Sep 22 23:34:11 CEST 2016   EN: 2.550 GAM: 0.640  GM3: 0.1500
     2s    -15.968100    1.979793
     2p     -9.777107    1.850537
     3S     -3.366990    0.633095
  7     Thu Sep 22 23:34:11 CEST 2016   EN: 3.040 GAM: 0.493  GM3:-0.1000
     2s    -24.040776    2.126160
     2p    -14.426520    2.068425
     3S     -5.882278    0.671040
  8     Thu Sep 22 23:34:11 CEST 2016   EN: 3.440 GAM: 0.717  GM3:-0.2000
     2s    -26.695120    2.575264
     2p    -16.014457    2.159448
     3S     -6.622058    0.958679
 16     Tue Jan 17 20:57:36 CET 2017    EN: 2.580 GAM: 0.455  GM3: 0.1020
     3s    -24.488821    2.492075
     3p    -12.136640    1.997904
     3d     -1.796070    1.747541
 35     Mon Aug 22 11:29:28 CEST 2016   EN: 2.960 GAM: 0.733  GM3:-0.0500
     4s    -19.875752    2.886237
     4p    -12.818655    2.190987
     4d     -3.348113    1.789395

           ------------------------------------------------- 
          |        Self-Consistent Charge Iterations        |
           ------------------------------------------------- 

          ...................................................
          :                      SETUP                      :
          :.................................................:
          :  # basis functions                 452          :
          :  # atomic orbitals                 443          :
          :  # shells                          265          :
          :  # electrons                       344          :
          :  # halogen bonds                    16          :
          :  max. iterations                   250          :
          :  Hamiltonian                  GFN1-xTB          :
          :  restarted?                      false          :
          :  GBSA solvation                  false          :
          :  PC potential                    false          :
          :  electronic temp.          300.0000000     K    :
          :  accuracy                    1.0000000          :
          :  -> integral cutoff          0.2500000E+02      :
          :  -> integral neglect         0.1000000E-07      :
          :  -> SCF convergence          0.1000000E-05 Eh   :
          :  -> wf. convergence          0.2000000E-04 e    :
          :  Broyden damping             0.4000000          :
          ...................................................

 iter      E             dE          RMSdq      gap      omega  full diag
   1   -215.5476354 -0.215548E+03  0.996E+00    0.11       0.0  T
   2   -212.5060955  0.304154E+01  0.634E+00    0.35       1.0  T
   3   -210.7753737  0.173072E+01  0.717E+00    0.55       1.0  T
   4   -199.1868904  0.115885E+02  0.447E+00    0.12       1.0  T
   5   -214.0684136 -0.148815E+02  0.232E+00    0.50       1.0  T
   6   -216.9043888 -0.283598E+01  0.145E+00    1.42       1.0  T
   7   -216.9814723 -0.770835E-01  0.126E+00    1.35       1.0  T
   8   -216.9790682  0.240413E-02  0.116E+00    1.26       1.0  T
   9   -216.9925092 -0.134410E-01  0.682E-01    0.85       1.0  T
  10   -217.0109064 -0.183972E-01  0.386E-01    0.69       1.0  T
  11   -217.0355505 -0.246441E-01  0.283E-01    0.83       1.0  T
  12   -217.0527293 -0.171788E-01  0.205E-01    0.99       1.0  T
  13   -217.0565801 -0.385079E-02  0.141E-01    1.04       1.0  T
  14   -217.0588587 -0.227867E-02  0.622E-02    0.96       1.0  T
  15   -217.0593384 -0.479671E-03  0.190E-02    0.88       1.0  T
  16   -217.0593690 -0.305986E-04  0.148E-02    0.90       1.0  T
  17   -217.0593846 -0.156159E-04  0.467E-03    0.89       2.2  T
  18   -217.0593870 -0.234310E-05  0.155E-03    0.90       6.6  T
  19   -217.0593873 -0.354778E-06  0.125E-03    0.90       8.1  T
  20   -217.0593875 -0.201485E-06  0.461E-04    0.90      22.0  T
  21   -217.0593875 -0.269672E-07  0.343E-04    0.90      29.6  T
  22   -217.0593876 -0.347714E-07  0.206E-04    0.90      49.4  T
  23   -217.0593876 -0.112654E-07  0.152E-04    0.90      66.9  T
  24   -217.0593876 -0.260079E-08  0.132E-04    0.90      77.0  T

   *** convergence criteria satisfied after 24 iterations ***

         #    Occupation            Energy/Eh            Energy/eV
      -------------------------------------------------------------
         1        2.0000           -1.3346697             -36.3182
       ...           ...                  ...                  ...
       166        2.0000           -0.4092158             -11.1353
       167        2.0000           -0.4014825             -10.9249
       168        2.0000           -0.4001098             -10.8875
       169        2.0000           -0.3933243             -10.7029
       170        2.0000           -0.3793559             -10.3228
       171        2.0000           -0.3776298             -10.2758
       172        2.0000           -0.3620689              -9.8524 (HOMO)
       173                         -0.3290802              -8.9547 (LUMO)
       174                         -0.3227646              -8.7829
       175                         -0.3096512              -8.4260
       176                         -0.3020169              -8.2183
       177                         -0.2927292              -7.9656
       ...                                ...                  ...
       443                        543.1102569           14778.7823
      -------------------------------------------------------------
                  HL-Gap            0.0329887 Eh            0.8977 eV
             Fermi-level           -0.3455752 Eh           -9.4036 eV

 SCC (total)                   0 d,  0 h,  0 min,  1.886 sec
 SCC setup                      ...        0 min,  0.004 sec (  0.209%)
 Dispersion                     ...        0 min,  0.000 sec (  0.016%)
 integral evaluation            ...        0 min,  0.860 sec ( 45.600%)
 zeroth order Hamiltonian       ...        0 min,  0.003 sec (  0.177%)
 iterations                     ...        0 min,  0.764 sec ( 40.489%)
 molecular gradient             ...        0 min,  0.250 sec ( 13.270%)
 printout                       ...        0 min,  0.004 sec (  0.236%)

         :::::::::::::::::::::::::::::::::::::::::::::::::::::
         ::                     SUMMARY                     ::
         :::::::::::::::::::::::::::::::::::::::::::::::::::::
         :: total energy            -213.452863173432 Eh    ::
         :: gradient norm              0.205871901408 Eh/a0 ::
         :: HOMO-LUMO gap              0.897666966362 eV    ::
         ::.................................................::
         :: SCC energy              -217.059387589077 Eh    ::
         :: -> electrostatic           0.218124826784 Eh    ::
         :: repulsion energy           3.702702589689 Eh    ::
         :: dispersion energy         -0.096177983767 Eh    ::
         :: halogen bond corr.         0.000000000000 Eh    ::
         :: add. restraining           0.000000000000 Eh    ::
         :::::::::::::::::::::::::::::::::::::::::::::::::::::

           ------------------------------------------------- 
          |        vertical delta SCC IP calculation        |
           ------------------------------------------------- 

          ...................................................
          :                      SETUP                      :
          :.................................................:
          :  # basis functions                 452          :
          :  # atomic orbitals                 443          :
          :  # shells                          265          :
          :  # electrons                       343          :
          :  # halogen bonds                    16          :
          :  max. iterations                   250          :
          :  Hamiltonian                  GFN1-xTB          :
          :  restarted?                       true          :
          :  GBSA solvation                  false          :
          :  PC potential                    false          :
          :  electronic temp.          300.0000000     K    :
          :  accuracy                    1.0000000          :
          :  -> integral cutoff          0.2500000E+02      :
          :  -> integral neglect         0.1000000E-07      :
          :  -> SCF convergence          0.1000000E-05 Eh   :
          :  -> wf. convergence          0.2000000E-04 e    :
          :  Broyden damping             0.4000000          :
          ...................................................

 iter      E             dE          RMSdq      gap      omega  full diag
   1   -216.5582469 -0.216558E+03  0.584E-01    0.90       0.0  T
   2   -215.0028983  0.155535E+01  0.144E+00    0.14       1.0  T
   3   -216.5791221 -0.157622E+01  0.422E-01    1.17       1.0  T
   4   -216.6393745 -0.602525E-01  0.258E-01    1.21       1.0  T
   5   -216.6430398 -0.366528E-02  0.115E-01    1.31       1.0  T
   6   -216.6409845  0.205527E-02  0.201E-01    1.28       1.0  T
   7   -216.6431300 -0.214543E-02  0.172E-01    1.29       1.0  T
   8   -216.6440632 -0.933274E-03  0.158E-01    1.30       1.0  T
   9   -216.6247979  0.192654E-01  0.321E-01    1.30       1.0  T
  10   -216.6381678 -0.133699E-01  0.231E-01    1.31       1.0  T
  11   -216.6463526 -0.818482E-02  0.116E-01    1.31       1.0  T
  12   -216.6478872 -0.153463E-02  0.715E-02    1.31       1.0  T
  13   -216.6484673 -0.580076E-03  0.407E-02    1.30       1.0  T
  14   -216.6486570 -0.189718E-03  0.180E-02    1.30       1.0  T
  15   -216.6487081 -0.510845E-04  0.101E-02    1.30       1.0  T
  16   -216.6487286 -0.205385E-04  0.311E-03    1.30       3.3  T
  17   -216.6487296 -0.934735E-06  0.197E-03    1.30       5.2  T
  18   -216.6487304 -0.791474E-06  0.578E-04    1.30      17.6  T
  19   -216.6487304 -0.436038E-07  0.818E-05    1.30     124.1  T
  20   -216.6487304  0.109893E-08  0.110E-04    1.30      92.1  T

   *** convergence criteria satisfied after 20 iterations ***

         #    Occupation            Energy/Eh            Energy/eV
      -------------------------------------------------------------
         1        2.0000           -1.4223226             -38.7034
       ...           ...                  ...                  ...
       166        2.0000           -0.4750626             -12.9271
       167        2.0000           -0.4716379             -12.8339
       168        2.0000           -0.4674741             -12.7206
       169        2.0000           -0.4663599             -12.6903
       170        1.9441           -0.4547170             -12.3735
       171        1.8812           -0.4539342             -12.3522
       172        1.1747           -0.4505553             -12.2602 (HOMO)
       173                         -0.4027362             -10.9590 (LUMO)
       174                         -0.3879480             -10.5566
       175                         -0.3769407             -10.2571
       176                         -0.3729044             -10.1472
       177                         -0.3668784              -9.9833
       ...                                ...                  ...
       443                        543.0344692           14776.7200
      -------------------------------------------------------------
                  HL-Gap            0.0478192 Eh            1.3012 eV
             Fermi-level           -0.4393286 Eh          -11.9547 eV

 SCC (total)                   0 d,  0 h,  0 min,  1.739 sec
 SCC setup                      ...        0 min,  0.004 sec (  0.209%)
 Dispersion                     ...        0 min,  0.000 sec (  0.010%)
 integral evaluation            ...        0 min,  0.850 sec ( 48.887%)
 zeroth order Hamiltonian       ...        0 min,  0.003 sec (  0.189%)
 iterations                     ...        0 min,  0.628 sec ( 36.103%)
 molecular gradient             ...        0 min,  0.249 sec ( 14.341%)
 printout                       ...        0 min,  0.004 sec (  0.258%)

         :::::::::::::::::::::::::::::::::::::::::::::::::::::
         ::                     SUMMARY                     ::
         :::::::::::::::::::::::::::::::::::::::::::::::::::::
         :: total energy            -213.042205979792 Eh    ::
         :: gradient norm              0.207090127770 Eh/a0 ::
         :: HOMO-LUMO gap              1.301225677546 eV    ::
         ::.................................................::
         :: SCC energy              -216.648730395437 Eh    ::
         :: -> electrostatic           0.257771434647 Eh    ::
         :: repulsion energy           3.702702589689 Eh    ::
         :: dispersion energy         -0.096177983767 Eh    ::
         :: halogen bond corr.         0.000000000000 Eh    ::
         :: add. restraining           0.000000000000 Eh    ::
         :::::::::::::::::::::::::::::::::::::::::::::::::::::

------------------------------------------------------------------------
empirical IP shift (eV):    4.8455
delta SCC IP (eV):    6.3290
------------------------------------------------------------------------
           ------------------------------------------------- 
          |        vertical delta SCC EA calculation        |
           ------------------------------------------------- 

          ...................................................
          :                      SETUP                      :
          :.................................................:
          :  # basis functions                 452          :
          :  # atomic orbitals                 443          :
          :  # shells                          265          :
          :  # electrons                       345          :
          :  # halogen bonds                    16          :
          :  max. iterations                   250          :
          :  Hamiltonian                  GFN1-xTB          :
          :  restarted?                       true          :
          :  GBSA solvation                  false          :
          :  PC potential                    false          :
          :  electronic temp.          300.0000000     K    :
          :  accuracy                    1.0000000          :
          :  -> integral cutoff          0.2500000E+02      :
          :  -> integral neglect         0.1000000E-07      :
          :  -> SCF convergence          0.1000000E-05 Eh   :
          :  -> wf. convergence          0.2000000E-04 e    :
          :  Broyden damping             0.4000000          :
          ...................................................

 iter      E             dE          RMSdq      gap      omega  full diag
   1   -217.2956592 -0.217296E+03  0.382E-01    0.40       0.0  T
   2   -217.2576160  0.380431E-01  0.498E-01    0.40       1.0  T
   3   -217.3464632 -0.888472E-01  0.205E-01    0.19       1.0  T
   4   -217.3318246  0.146387E-01  0.219E-01    0.21       1.0  T
   5   -217.3257291  0.609544E-02  0.220E-01    0.32       1.0  T
   6   -217.3456851 -0.199559E-01  0.106E-01    0.20       1.0  T
   7   -217.3520084 -0.632331E-02  0.231E-02    0.16       1.0  T
   8   -217.3516972  0.311191E-03  0.303E-02    0.17       1.0  T
   9   -217.3521682 -0.471041E-03  0.126E-02    0.16       1.0  T
  10   -217.3522571 -0.888707E-04  0.365E-03    0.16       2.8  T
  11   -217.3522547  0.243537E-05  0.296E-03    0.16       3.4  T
  12   -217.3522584 -0.373552E-05  0.156E-03    0.16       6.5  T
  13   -217.3522591 -0.736968E-06  0.781E-04    0.16      13.0  T
  14   -217.3522595 -0.371121E-06  0.158E-04    0.16      64.2  T
  15   -217.3522595 -0.894224E-08  0.803E-05    0.16     126.4  T

   *** convergence criteria satisfied after 15 iterations ***

         #    Occupation            Energy/Eh            Energy/eV
      -------------------------------------------------------------
         1        2.0000           -1.2652234             -34.4285
       ...           ...                  ...                  ...
       167        2.0000           -0.3382424              -9.2040
       168        2.0000           -0.3291680              -8.9571
       169        2.0000           -0.3272834              -8.9058
       170        2.0000           -0.3178397              -8.6489
       171        2.0000           -0.3072959              -8.3619
       172        2.0000           -0.2923656              -7.9557
       173        0.9590           -0.2567054              -6.9853 (HOMO)
       174        0.0410           -0.2507135              -6.8223 (LUMO)
       175        0.0000           -0.2416631              -6.5760
       176                         -0.2357997              -6.4164
       177                         -0.2235916              -6.0842
       178                         -0.2057424              -5.5985
       ...                                ...                  ...
       443                        543.1783318           14780.6347
      -------------------------------------------------------------
                  HL-Gap            0.0059920 Eh            0.1630 eV
             Fermi-level           -0.2641229 Eh           -7.1872 eV

 SCC (total)                   0 d,  0 h,  0 min,  1.581 sec
 SCC setup                      ...        0 min,  0.004 sec (  0.227%)
 Dispersion                     ...        0 min,  0.000 sec (  0.017%)
 integral evaluation            ...        0 min,  0.848 sec ( 53.618%)
 zeroth order Hamiltonian       ...        0 min,  0.003 sec (  0.210%)
 iterations                     ...        0 min,  0.471 sec ( 29.770%)
 molecular gradient             ...        0 min,  0.251 sec ( 15.870%)
 printout                       ...        0 min,  0.004 sec (  0.284%)

         :::::::::::::::::::::::::::::::::::::::::::::::::::::
         ::                     SUMMARY                     ::
         :::::::::::::::::::::::::::::::::::::::::::::::::::::
         :: total energy            -213.745735104797 Eh    ::
         :: gradient norm              0.215509843864 Eh/a0 ::
         :: HOMO-LUMO gap              0.163049703206 eV    ::
         ::.................................................::
         :: SCC energy              -217.352259520442 Eh    ::
         :: -> electrostatic           0.249662045337 Eh    ::
         :: repulsion energy           3.702702589689 Eh    ::
         :: dispersion energy         -0.096177983767 Eh    ::
         :: halogen bond corr.         0.000000000000 Eh    ::
         :: add. restraining           0.000000000000 Eh    ::
         :::::::::::::::::::::::::::::::::::::::::::::::::::::

------------------------------------------------------------------------
empirical EA shift (eV):    4.8455
delta SCC EA (eV):    3.1239
------------------------------------------------------------------------
           -------------------------------------------------
          |                Property Printout                |
           -------------------------------------------------

    * Orbital Energies and Occupations

         #    Occupation            Energy/Eh            Energy/eV
      -------------------------------------------------------------
         1        2.0000           -1.2652234             -34.4285
       ...           ...                  ...                  ...
       161        2.0000           -0.3604145              -9.8074
       162        2.0000           -0.3591614              -9.7733
       163        2.0000           -0.3570575              -9.7160
       164        2.0000           -0.3530719              -9.6076
       165        2.0000           -0.3491483              -9.5008
       166        2.0000           -0.3417211              -9.2987
       167        2.0000           -0.3382424              -9.2040
       168        2.0000           -0.3291680              -8.9571
       169        2.0000           -0.3272834              -8.9058
       170        2.0000           -0.3178397              -8.6489
       171        2.0000           -0.3072959              -8.3619
       172        2.0000           -0.2923656              -7.9557
       173        0.9590           -0.2567054              -6.9853 (HOMO)
       174        0.0410           -0.2507135              -6.8223 (LUMO)
       175        0.0000           -0.2416631              -6.5760
       176                         -0.2357997              -6.4164
       177                         -0.2235916              -6.0842
       178                         -0.2057424              -5.5985
       179                         -0.1930378              -5.2528
       180                         -0.1869250              -5.0865
       181                         -0.1866712              -5.0796
       182                         -0.1812454              -4.9319
       183                         -0.1723289              -4.6893
       184                         -0.1710963              -4.6558
       ...                                ...                  ...
       443                        543.1783318           14780.6347
      -------------------------------------------------------------
                  HL-Gap            0.0059920 Eh            0.1630 eV
             Fermi-level           -0.2641229 Eh           -7.1872 eV

  Mulliken/CM5 charges        n(s)   n(p)   n(d)
     1 C  -0.13005 -0.09470   0.779  3.091  0.000
     2 O   0.18726  0.14119   1.488  4.700  0.000
     3 C   0.03042  0.02855   1.099  2.931  0.000
     4 C   0.01870 -0.03142   1.108  2.911  0.000
     5 C  -0.02244 -0.04162   1.175  2.802  0.000
     6 Br  0.06943  0.08553   1.908  5.121  0.040
     7 C  -0.02763 -0.04693   1.180  2.792  0.000
     8 Br  0.05914  0.07515   1.907  5.120  0.032
     9 C   0.01672 -0.03362   1.082  2.934  0.000
    10 C  -0.00748 -0.01081   1.079  2.914  0.000
    11 C  -0.01336 -0.01405   1.091  2.895  0.000
    12 C   0.00182  0.00796   1.028  2.973  0.000
    13 C  -0.11157  0.00570   1.202  2.686  0.000
    14 N   0.28178  0.14837   1.502  3.780  0.000
    15 C  -0.10671  0.01240   1.205  2.688  0.000
    16 N   0.29294  0.16252   1.525  3.768  0.000
    17 C   0.03856  0.03666   1.065  2.973  0.000
    18 C   0.01050 -0.03766   1.081  2.929  0.000
    19 C  -0.00834 -0.00074   1.130  2.861  0.000
    20 S   0.07545  0.04387   1.884  4.039  0.153
    21 C  -0.00542  0.01227   1.130  2.865  0.000
    22 C  -0.00701  0.00621   1.136  2.857  0.000
    23 C  -0.00146 -0.00942   1.073  2.926  0.000
    24 C   0.02584 -0.08015   1.071  2.955  0.000
    25 C   0.05619 -0.09517   1.072  2.984  0.000
    26 S   0.06973  0.03698   1.876  4.124  0.069
    27 C  -0.00506  0.01714   1.144  2.851  0.000
    28 C  -0.04632  0.02324   1.071  2.882  0.000
    29 N   0.11613 -0.14163   1.268  3.848  0.000
    30 C  -0.00824 -0.05745   1.104  2.888  0.000
    31 C  -0.05047  0.01835   1.065  2.885  0.000
    32 C   0.01848  0.03158   1.073  2.945  0.000
    33 C  -0.06930  0.01887   1.150  2.781  0.000
    34 N   0.24770  0.08580   1.472  3.776  0.000
    35 S  -0.15495 -0.02006   1.863  3.678  0.304
    36 N   0.24810  0.08626   1.471  3.777  0.000
    37 C  -0.06890  0.01925   1.149  2.782  0.000
    38 C   0.01751  0.03063   1.073  2.945  0.000
    39 C  -0.05170  0.01688   1.066  2.882  0.000
    40 N   0.11433 -0.14314   1.259  3.855  0.000
    41 C  -0.03416 -0.08319   1.093  2.873  0.000
    42 C   0.05469 -0.09238   1.065  2.990  0.000
    43 C  -0.04623  0.02344   1.063  2.891  0.000
    44 C  -0.00551  0.01679   1.140  2.855  0.000
    45 S   0.05736  0.02202   1.876  4.109  0.072
    46 C  -0.01019  0.00331   1.133  2.857  0.000
    47 C  -0.01094  0.00688   1.122  2.867  0.000
    48 S   0.06970  0.03297   1.880  4.121  0.069
    49 C  -0.01606 -0.00833   1.139  2.845  0.000
    50 C  -0.00838 -0.01503   1.072  2.920  0.000
    51 C   0.02382 -0.07985   1.071  2.952  0.000
    52 C   0.06062 -0.09016   1.071  2.989  0.000
    53 C   0.00908 -0.03812   1.073  2.937  0.000
    54 C   0.02247  0.01933   1.061  2.962  0.000
    55 C  -0.01421 -0.01487   1.097  2.889  0.000
    56 C  -0.00307  0.00324   1.037  2.960  0.000
    57 C  -0.10567  0.01340   1.210  2.685  0.000
    58 N   0.29339  0.16354   1.531  3.762  0.000
    59 C  -0.10910  0.00946   1.205  2.686  0.000
    60 N   0.28824  0.15911   1.527  3.761  0.000
    61 C   0.00065 -0.00272   1.078  2.923  0.000
    62 C   0.02775 -0.02252   1.111  2.917  0.000
    63 C  -0.02011 -0.03937   1.186  2.794  0.000
    64 Br  0.07040  0.08639   1.906  5.130  0.034
    65 C  -0.00467 -0.02387   1.189  2.806  0.000
    66 Br  0.08549  0.10161   1.909  5.138  0.038
    67 C   0.13590  0.08574   1.081  3.055  0.000
    68 C   0.02630  0.02431   1.104  2.922  0.000
    69 C  -0.13913 -0.10521   1.175  2.685  0.000
    70 O   0.34081  0.28729   1.638  4.703  0.000
    71 C   0.53788  0.39094   0.946  3.592  0.000
    72 H  -0.03630  0.02310   0.964  0.000  0.000
    73 H  -0.03835  0.02693   0.962  0.000  0.000
    74 H  -0.04026  0.03040   0.960  0.000  0.000
    75 H  -0.02317  0.03445   0.977  0.000  0.000
    76 H  -0.02011  0.03779   0.980  0.000  0.000
    77 H  -0.01961  0.03324   0.980  0.000  0.000
    78 H  -0.01551  0.03657   0.984  0.000  0.000
    79 H  -0.01557  0.03796   0.984  0.000  0.000
    80 H  -0.00552  0.06186   0.994  0.000  0.000
    81 H   0.00108  0.07231   1.001  0.000  0.000
    82 H  -0.02432  0.04308   0.976  0.000  0.000
    83 H  -0.03773  0.03324   0.962  0.000  0.000
    84 H  -0.02082  0.03662   0.979  0.000  0.000
    85 H  -0.02422  0.02811   0.976  0.000  0.000
    86 H  -0.02388  0.03087   0.976  0.000  0.000
    87 H  -0.02420  0.03692   0.976  0.000  0.000
    88 H  -0.03169  0.03183   0.968  0.000  0.000
    89 H  -0.01960  0.03336   0.980  0.000  0.000
    90 H  -0.01923  0.03265   0.981  0.000  0.000
    91 H  -0.01637  0.03954   0.984  0.000  0.000
    92 H  -0.03459  0.03138   0.965  0.000  0.000
    93 H  -0.06854 -0.00385   0.931  0.000  0.000
    94 H  -0.32085 -0.26147   0.679  0.000  0.000
    95 H  -0.28139 -0.22661   0.719  0.000  0.000
    96 H  -0.23735 -0.18012   0.763  0.000  0.000
    97 H  -0.27937 -0.22708   0.721  0.000  0.000
(R)spin-density population

 Mulliken population n(s)   n(p)   n(d)
     1 C   0.0001   0.000  0.000  0.000
     2 O   0.0005   0.000  0.000  0.000
     3 C   0.0132   0.000  0.013  0.000
     4 C   0.0026   0.000  0.003  0.000
     5 C   0.0195   0.000  0.019  0.000
     6 Br  0.0063   0.000  0.003  0.003
     7 C   0.0000  -0.000  0.000  0.000
     8 Br  0.0001   0.000  0.000  0.000
     9 C   0.0179   0.000  0.018  0.000
    10 C   0.0030   0.000  0.003  0.000
    11 C   0.0628  -0.000  0.063  0.000
    12 C   0.0569  -0.000  0.057  0.000
    13 C   0.0084   0.000  0.008  0.000
    14 N   0.0287   0.000  0.029  0.000
    15 C   0.0073   0.000  0.007  0.000
    16 N   0.0272   0.000  0.027  0.000
    17 C   0.0166  -0.000  0.017  0.000
    18 C   0.0650  -0.000  0.065  0.000
    19 C   0.0034  -0.000  0.003  0.000
    20 S   0.0234   0.000  0.020  0.003
    21 C   0.0372   0.000  0.037  0.000
    22 C   0.0008  -0.000  0.001  0.000
    23 C   0.0422  -0.000  0.042  0.000
    24 C   0.0003   0.000  0.000  0.000
    25 C   0.0026   0.001  0.002  0.000
    26 S   0.0037  -0.000  0.003  0.000
    27 C   0.0076   0.000  0.008  0.000
    28 C   0.0025   0.000  0.003  0.000
    29 N   0.0159   0.000  0.016  0.000
    30 C   0.0006   0.000  0.001  0.000
    31 C   0.0171   0.000  0.017  0.000
    32 C   0.0045   0.000  0.004  0.000
    33 C   0.0006   0.000  0.001  0.000
    34 N   0.0070   0.000  0.007  0.000
    35 S   0.0124  -0.000  0.009  0.003
    36 N   0.0079   0.000  0.008  0.000
    37 C   0.0009   0.000  0.001  0.000
    38 C   0.0059   0.000  0.006  0.000
    39 C   0.0184   0.000  0.018  0.000
    40 N   0.0140   0.000  0.014  0.000
    41 C   0.0002   0.000  0.000  0.000
    42 C   0.0008   0.000  0.001  0.000
    43 C   0.0033   0.000  0.003  0.000
    44 C   0.0069   0.000  0.007  0.000
    45 S   0.0047   0.000  0.004  0.001
    46 C   0.0023   0.000  0.002  0.000
    47 C   0.0311   0.000  0.031  0.000
    48 S   0.0238   0.000  0.021  0.003
    49 C   0.0060   0.000  0.006  0.000
    50 C   0.0389   0.000  0.039  0.000
    51 C   0.0006   0.000  0.001  0.000
    52 C   0.0009   0.000  0.001  0.000
    53 C   0.0744   0.000  0.074  0.000
    54 C   0.0214   0.000  0.021  0.000
    55 C   0.0524   0.000  0.052  0.000
    56 C   0.0477   0.000  0.048  0.000
    57 C   0.0063   0.000  0.006  0.000
    58 N   0.0230  -0.000  0.023  0.000
    59 C   0.0063   0.000  0.006  0.000
    60 N   0.0235   0.000  0.023  0.000
    61 C   0.0008   0.000  0.001  0.000
    62 C   0.0140   0.000  0.014  0.000
    63 C   0.0005  -0.000  0.001  0.000
    64 Br  0.0002   0.000  0.000  0.000
    65 C   0.0138   0.000  0.014  0.000
    66 Br  0.0044   0.000  0.002  0.002
    67 C   0.0029   0.000  0.003  0.000
    68 C   0.0107   0.000  0.011  0.000
    69 C   0.0031   0.000  0.003  0.000
    70 O   0.0031   0.000  0.003  0.000
    71 C   0.0017   0.000  0.002  0.000
    72 H   0.0000   0.000  0.000  0.000
    73 H   0.0000   0.000  0.000  0.000
    74 H   0.0000   0.000  0.000  0.000
    75 H   0.0003   0.000  0.000  0.000
    76 H   0.0006   0.001  0.000  0.000
    77 H   0.0000   0.000  0.000  0.000
    78 H   0.0002   0.000  0.000  0.000
    79 H   0.0000   0.000  0.000  0.000
    80 H   0.0005   0.000  0.000  0.000
    81 H   0.0000   0.000  0.000  0.000
    82 H   0.0005   0.000  0.000  0.000
    83 H   0.0000   0.000  0.000  0.000
    84 H   0.0000   0.000  0.000  0.000
    85 H   0.0001   0.000  0.000  0.000
    86 H   0.0000   0.000  0.000  0.000
    87 H   0.0004   0.000  0.000  0.000
    88 H   0.0021   0.002  0.000  0.000
    89 H   0.0000   0.000  0.000  0.000
    90 H   0.0001   0.000  0.000  0.000
    91 H   0.0000   0.000  0.000  0.000
    92 H   0.0004   0.000  0.000  0.000
    93 H   0.0000   0.000  0.000  0.000
    94 H   0.0000   0.000  0.000  0.000
    95 H   0.0000   0.000  0.000  0.000
    96 H   0.0000   0.000  0.000  0.000
    97 H   0.0002   0.000  0.000  0.000

Wiberg/Mayer (AO) data.
largest (>0.10) Wiberg bond orders for each atom
          total WBO             WBO to atom ...
     1  C   2.305        O    2 0.972    C    3 0.631    C   17 0.630
     2  O   1.849        C    1 0.972    C   17 0.233    S   20 0.230    C    3 0.208
     3  C   3.893        C    4 1.434    C   10 1.323    C    1 0.631    O    2 0.208    C   17 0.189
     4  C   3.928        C    3 1.434    C    5 1.381    H   72 0.980
     5  C   3.917        C    7 1.388    C    4 1.381    Br   6 1.086
     6  Br  1.224        C    5 1.086
     7  C   3.967        C    9 1.411    C    5 1.388    Br   8 1.090
     8  Br  1.226        C    7 1.090
     9  C   3.842        C   10 1.415    C    7 1.411    H   73 0.995
    10  C   3.886        C    9 1.415    C    3 1.323    C   11 1.093
    11  C   3.816        C   12 1.421    C   17 1.216    C   10 1.093
    12  C   3.729        C   11 1.421    C   13 1.163    C   15 1.158
    13  C   4.086        N   14 2.871    C   12 1.163
    14  N   2.846        C   13 2.871
    15  C   4.090        N   16 2.895    C   12 1.158
    16  N   2.910        C   15 2.895
    17  C   3.793        C   18 1.438    C   11 1.216    C    1 0.630    O    2 0.233    C    3 0.189
    18  C   3.753        C   17 1.438    C   19 1.336    H   74 0.965
    19  C   3.877        C   23 1.354    C   18 1.336    S   20 1.130
    20  S   2.682        C   21 1.179    C   19 1.130    O    2 0.230
    21  C   3.838        C   22 1.333    C   28 1.290    S   20 1.179
    22  C   3.875        C   23 1.385    C   21 1.333    S   26 1.145
    23  C   3.777        C   22 1.385    C   19 1.354    C   24 1.014
    24  C   3.893        C   23 1.014    H   76 0.996    H   75 0.990    C   25 0.974
    25  C   3.913        H   79 1.002    H   77 0.996    H   78 0.993    C   24 0.974
    26  S   2.461        C   27 1.188    C   22 1.145
    27  C   3.887        C   28 1.326    C   32 1.320    S   26 1.188
    28  C   3.882        C   27 1.326    C   21 1.290    N   29 1.174
    29  N   3.137        C   31 1.190    C   28 1.174    C   30 0.943
    30  C   3.854        H   81 0.995    H   80 0.993    C   71 0.961    N   29 0.943
    31  C   3.820        C   32 1.281    C   39 1.278    N   29 1.190
    32  C   3.872        C   27 1.320    C   31 1.281    C   33 1.210
    33  C   4.032        N   34 1.547    C   32 1.210    C   37 1.191    S   35 0.104
    34  N   2.995        C   33 1.547    S   35 1.388
    35  S   3.102        N   34 1.388    N   36 1.388    C   37 0.105    C   33 0.104
    36  N   2.991        C   37 1.547    S   35 1.388
    37  C   4.029        N   36 1.547    C   38 1.208    C   33 1.191    S   35 0.105
    38  C   3.868        C   44 1.308    C   39 1.295    C   37 1.208
    39  C   3.815        C   38 1.295    C   31 1.278    N   40 1.171
    40  N   3.118        C   39 1.171    C   43 1.159    C   41 0.966
    41  C   3.889        H   82 0.997    H   83 0.993    C   42 0.993    N   40 0.966
    42  C   3.883        H   84 1.009    H   86 1.000    C   41 0.993    H   85 0.992
    43  C   3.868        C   44 1.337    C   47 1.290    N   40 1.159
    44  C   3.890        C   43 1.337    C   38 1.308    S   45 1.191
    45  S   2.482        C   44 1.191    C   46 1.152
    46  C   3.866        C   47 1.354    C   50 1.344    S   45 1.152
    47  C   3.838        C   46 1.354    C   43 1.290    S   48 1.202
    48  S   2.471        C   47 1.202    C   49 1.121
    49  C   3.897        C   50 1.404    C   53 1.306    S   48 1.121
    50  C   3.780        C   49 1.404    C   46 1.344    C   51 1.025
    51  C   3.887        C   50 1.025    H   87 0.998    H   88 0.977    C   52 0.975
    52  C   3.912        H   89 1.003    H   91 1.001    H   90 0.994    C   51 0.975
    53  C   3.724        C   54 1.469    C   49 1.306    H   92 0.986
    54  C   3.803        C   53 1.469    C   55 1.183    C   69 1.093
    55  C   3.833        C   56 1.452    C   54 1.183    C   61 1.104
    56  C   3.762        C   55 1.452    C   57 1.155    C   59 1.155
    57  C   4.103        N   58 2.905    C   56 1.155
    58  N   2.913        C   57 2.905
    59  C   4.096        N   60 2.898    C   56 1.155
    60  N   2.909        C   59 2.898
    61  C   3.876        C   62 1.439    C   68 1.309    C   55 1.104
    62  C   3.854        C   61 1.439    C   63 1.418    H   93 0.965
    63  C   3.966        C   62 1.418    C   65 1.389    Br  64 1.088
    64  Br  1.225        C   63 1.088
    65  C   3.955        C   67 1.402    C   63 1.389    Br  66 1.079
    66  Br  1.221        C   65 1.079
    67  C   3.752        C   68 1.459    C   65 1.402    H   94 0.845
    68  C   3.907        C   67 1.459    C   61 1.309    C   69 1.043
    69  C   3.990        O   70 1.799    C   54 1.093    C   68 1.043
    70  O   1.951        C   69 1.799
    71  C   3.502        C   30 0.961    H   96 0.900    H   95 0.857    H   97 0.850
    72  H   1.037        C    4 0.980
    73  H   1.054        C    9 0.995
    74  H   1.056        C   18 0.965
    75  H   1.039        C   24 0.990
    76  H   1.054        C   24 0.996
    77  H   1.032        C   25 0.996
    78  H   1.048        C   25 0.993
    79  H   1.046        C   25 1.002
    80  H   1.033        C   30 0.993
    81  H   1.070        C   30 0.995
    82  H   1.057        C   41 0.997
    83  H   1.045        C   41 0.993
    84  H   1.048        C   42 1.009
    85  H   1.037        C   42 0.992
    86  H   1.032        C   42 1.000
    87  H   1.033        C   51 0.998
    88  H   1.044        C   51 0.977
    89  H   1.028        C   52 1.003
    90  H   1.030        C   52 0.994
    91  H   1.042        C   52 1.001
    92  H   1.047        C   53 0.986
    93  H   0.957        C   62 0.965
    94  H   0.926        C   67 0.845
    95  H   0.942        C   71 0.857
    96  H   0.953        C   71 0.900
    97  H   0.929        C   71 0.850

 dipole moment from electron density (au)
     X       Y       Z   
  -3.7895 -11.6408  -2.7384  total (Debye):   31.885


           -------------------------------------------------
          | TOTAL ENERGY             -213.745735104797 Eh   |
          | GRADIENT NORM               0.215509843864 Eh/α |
          | HOMO-LUMO GAP               0.163049703206 eV   |
           -------------------------------------------------

------------------------------------------------------------------------
 * finished run on 2021/12/02 at 16:34:46.902     
------------------------------------------------------------------------
 total:
 * wall-time:     0 d,  0 h,  0 min,  6.081 sec
 *  cpu-time:     0 d,  0 h,  0 min,  6.049 sec
 * ratio c/w:     0.995 speedup
 SCF:
 * wall-time:     0 d,  0 h,  0 min,  5.208 sec
 *  cpu-time:     0 d,  0 h,  0 min,  5.185 sec
 * ratio c/w:     0.996 speedup

