      -----------------------------------------------------------      
     |                   =====================                   |     
     |                           x T B                           |     
     |                   =====================                   |     
     |                         S. Grimme                         |     
     |          Mulliken Center for Theoretical Chemistry        |     
     |                    University of Bonn                     |     
     |                Version 6.2 RC2 (SAW190805)                |     
      -----------------------------------------------------------      

   This program is distributed in the hope that it will be useful,
   but WITHOUT ANY WARRANTY; without even the implied warranty of
   MERCHANTABILITY or FITNESS FOR A PARTICULAR PURPOSE.
   
   FOR NON-COMMERCIAL, ACADEMIA USE ONLY.
   
   Cite this work as:
   * S. Grimme, C. Bannwarth, P. Shushkov, J. Chem. Theory Comput., 2017,
     13, 1989-2009. DOI: 10.1021/acs.jctc.7b00118
   * C. Bannwarth, S. Ehlert and S. Grimme., J. Chem. Theory Comput., 2019,
     15, 1652-1671. DOI: 10.1021/acs.jctc.8b01176
   * P. Pracht, E. Caldeweyher, S. Ehlert, S. Grimme, ChemRxiv, 2019, preprint.
     DOI: 10.26434/chemrxiv.8326202.v1
   
   for DFT-D4:
   * E. Caldeweyher, C. Bannwarth and S. Grimme, J. Chem. Phys., 2017,
     147, 034112. DOI: 10.1063/1.4993215
   * E. Caldeweyher, S. Ehlert, A. Hansen, H. Neugebauer, S. Spicher,
     C. Bannwarth and S. Grimme, J. Chem. Phys., 2019, 150, 154122.
     DOI: 10.1063/1.5090222
   
   for sTDA-xTB:
   * S. Grimme and C. Bannwarth, J. Chem. Phys., 2016, 145, 054103.
     DOI: 10.1063/1.4959605
   
   in the mass-spec context:
   * V. Asgeirsson, C. Bauer and S. Grimme, Chem. Sci., 2017, 8, 4879.
     DOI: 10.1039/c7sc00601b
   
   for metadynamics refer to:
   * S. Grimme, J. Chem. Theory Comput., 2019, 155, 2847-2862
     DOI: 10.1021/acs.jctc.9b00143
   
   with help from (in alphabetical order)
   C. Bannwarth, F. Bohle, G. Brandenburg, E. Caldeweyher, M. Checinski,
   S. Dohm, S. Ehlert, S. Ehrlich, F. März, H. Neugebauer, J. Pisarek,
   P. Pracht, P. Shushkov, and S. Spicher.
   
 * started run on 2021/12/02 at 16:35:51.889     

           -------------------------------------------------
          |                Calculation Setup                |
           -------------------------------------------------

          program call               : /ihome/ghutchison/geoffh/xtb/xtb BTP-ClBr1.xyz --vipea
          hostname                   : smp-n128
          coordinate file            : BTP-ClBr1.xyz
          omp threads                :                     1
          number of atoms            :                    97
          number of electrons        :                   344
          charge                     :                     0
          spin                       :                   0.0
          first test random number   :      0.13737580863617


########################################################################
# WARNING! Please study the warnings concerning your input carefully
#  - XTBPATH is not set, using XTBHOME instead
########################################################################

           ------------------------------------------------- 
          |                 I P E A - x T B                 |
          |  Ionisation Potentials and Electron Affinities  |
           ------------------------------------------------- 
             KAB for M(3d)-M(3d) :                1.1000
             KAB for M(4d)-M(4d) :                1.2000
             KAB for M(5d)-M(5d) :                1.2000
             k(s)                :                2.1500
             k(p)                :                2.3000
             k(d)                :                2.0000
             k(f)                :                0.0000
             kEN (H0ij)          :                0.7000
             D3 a1               :                0.6300
             D3 a2               :                5.0000
             D3 s6               :                1.0000
             D3 s8               :                2.4000
             D3 s9               :                0.0000
             alphaj              :                1.0000
             XBdamp              :                0.4400
             XBrad               :                1.3000
             kcnsh               :      1.0000   -0.3000   -0.5000    0.5000

  Z AO/shell   Hii/eV     exponent
  1     Thu Sep 22 23:34:11 CEST 2016   EN: 2.200 GAM: 0.405  GM3: 0.1500
     1s    -10.521941    1.306199
     2s     -3.560151    0.398421
  6     Thu Sep 22 23:34:11 CEST 2016   EN: 2.550 GAM: 0.640  GM3: 0.1500
     2s    -15.968100    1.979793
     2p     -9.777107    1.850537
     3S     -3.366990    0.633095
  7     Thu Sep 22 23:34:11 CEST 2016   EN: 3.040 GAM: 0.493  GM3:-0.1000
     2s    -24.040776    2.126160
     2p    -14.426520    2.068425
     3S     -5.882278    0.671040
  8     Thu Sep 22 23:34:11 CEST 2016   EN: 3.440 GAM: 0.717  GM3:-0.2000
     2s    -26.695120    2.575264
     2p    -16.014457    2.159448
     3S     -6.622058    0.958679
 16     Tue Jan 17 20:57:36 CET 2017    EN: 2.580 GAM: 0.455  GM3: 0.1020
     3s    -24.488821    2.492075
     3p    -12.136640    1.997904
     3d     -1.796070    1.747541
 17     Tue Jan 17 19:45:33 CET 2017    EN: 3.160 GAM: 0.559  GM3: 0.2396
     3s    -24.452163    2.559226
     3p    -13.465451    2.054846
     3d     -1.836065    1.762522
 35     Mon Aug 22 11:29:28 CEST 2016   EN: 2.960 GAM: 0.733  GM3:-0.0500
     4s    -19.875752    2.886237
     4p    -12.818655    2.190987
     4d     -3.348113    1.789395

           ------------------------------------------------- 
          |        Self-Consistent Charge Iterations        |
           ------------------------------------------------- 

          ...................................................
          :                      SETUP                      :
          :.................................................:
          :  # basis functions                 452          :
          :  # atomic orbitals                 443          :
          :  # shells                          265          :
          :  # electrons                       344          :
          :  # halogen bonds                    16          :
          :  max. iterations                   250          :
          :  Hamiltonian                  GFN1-xTB          :
          :  restarted?                      false          :
          :  GBSA solvation                  false          :
          :  PC potential                    false          :
          :  electronic temp.          300.0000000     K    :
          :  accuracy                    1.0000000          :
          :  -> integral cutoff          0.2500000E+02      :
          :  -> integral neglect         0.1000000E-07      :
          :  -> SCF convergence          0.1000000E-05 Eh   :
          :  -> wf. convergence          0.2000000E-04 e    :
          :  Broyden damping             0.4000000          :
          ...................................................

 iter      E             dE          RMSdq      gap      omega  full diag
   1   -216.8526577 -0.216853E+03  0.983E+00    0.61       0.0  T
   2   -215.4048106  0.144785E+01  0.621E+00    0.18       1.0  T
   3   -216.7587318 -0.135392E+01  0.728E+00    0.21       1.0  T
   4   -211.7819284  0.497680E+01  0.271E+00    0.09       1.0  T
   5   -216.7878261 -0.500590E+01  0.168E+00    0.42       1.0  T
   6   -218.0238719 -0.123605E+01  0.957E-01    1.12       1.0  T
   7   -218.0412468 -0.173749E-01  0.877E-01    0.99       1.0  T
   8   -218.0404765  0.770266E-03  0.822E-01    1.00       1.0  T
   9   -218.0410777 -0.601143E-03  0.476E-01    1.05       1.0  T
  10   -218.0441363 -0.305866E-02  0.232E-01    0.75       1.0  T
  11   -218.0576968 -0.135604E-01  0.139E-01    0.94       1.0  T
  12   -218.0638241 -0.612734E-02  0.872E-02    1.02       1.0  T
  13   -218.0662573 -0.243319E-02  0.446E-02    1.13       1.0  T
  14   -218.0669191 -0.661764E-03  0.246E-02    1.04       1.0  T
  15   -218.0670717 -0.152599E-03  0.113E-02    0.96       1.0  T
  16   -218.0670862 -0.144895E-04  0.777E-03    0.95       1.3  T
  17   -218.0670918 -0.560809E-05  0.230E-03    0.96       4.4  T
  18   -218.0670929 -0.108742E-05  0.153E-03    0.96       6.6  T
  19   -218.0670932 -0.315041E-06  0.594E-04    0.96      17.1  T
  20   -218.0670932 -0.601159E-08  0.497E-04    0.97      20.4  T
  21   -218.0670932 -0.302861E-07  0.316E-04    0.97      32.2  T
  22   -218.0670932 -0.339905E-07  0.190E-04    0.97      53.4  T
  23   -218.0670933 -0.831892E-08  0.120E-04    0.97      84.5  T

   *** convergence criteria satisfied after 23 iterations ***

         #    Occupation            Energy/Eh            Energy/eV
      -------------------------------------------------------------
         1        2.0000           -1.3134924             -35.7419
       ...           ...                  ...                  ...
       166        2.0000           -0.4074444             -11.0871
       167        2.0000           -0.4040543             -10.9949
       168        2.0000           -0.4025244             -10.9532
       169        2.0000           -0.3926742             -10.6852
       170        2.0000           -0.3885085             -10.5719
       171        2.0000           -0.3787659             -10.3067
       172        2.0000           -0.3699712             -10.0674 (HOMO)
       173                         -0.3344128              -9.0998 (LUMO)
       174                         -0.3229835              -8.7888
       175                         -0.2993728              -8.1463
       176                         -0.2932797              -7.9805
       177                         -0.2805264              -7.6335
       ...                                ...                  ...
       443                        538.0182465           14640.2217
      -------------------------------------------------------------
                  HL-Gap            0.0355584 Eh            0.9676 eV
             Fermi-level           -0.3521920 Eh           -9.5836 eV

 SCC (total)                   0 d,  0 h,  0 min,  1.844 sec
 SCC setup                      ...        0 min,  0.004 sec (  0.213%)
 Dispersion                     ...        0 min,  0.000 sec (  0.017%)
 integral evaluation            ...        0 min,  0.853 sec ( 46.261%)
 zeroth order Hamiltonian       ...        0 min,  0.003 sec (  0.183%)
 iterations                     ...        0 min,  0.727 sec ( 39.434%)
 molecular gradient             ...        0 min,  0.252 sec ( 13.646%)
 printout                       ...        0 min,  0.004 sec (  0.242%)

         :::::::::::::::::::::::::::::::::::::::::::::::::::::
         ::                     SUMMARY                     ::
         :::::::::::::::::::::::::::::::::::::::::::::::::::::
         :: total energy            -214.495704311202 Eh    ::
         :: gradient norm              0.219093725256 Eh/a0 ::
         :: HOMO-LUMO gap              0.967592729799 eV    ::
         ::.................................................::
         :: SCC energy              -218.067093254304 Eh    ::
         :: -> electrostatic           0.200307161811 Eh    ::
         :: repulsion energy           3.665439665341 Eh    ::
         :: dispersion energy         -0.094050546360 Eh    ::
         :: halogen bond corr.         0.000000000000 Eh    ::
         :: add. restraining           0.000000000000 Eh    ::
         :::::::::::::::::::::::::::::::::::::::::::::::::::::

           ------------------------------------------------- 
          |        vertical delta SCC IP calculation        |
           ------------------------------------------------- 

          ...................................................
          :                      SETUP                      :
          :.................................................:
          :  # basis functions                 452          :
          :  # atomic orbitals                 443          :
          :  # shells                          265          :
          :  # electrons                       343          :
          :  # halogen bonds                    16          :
          :  max. iterations                   250          :
          :  Hamiltonian                  GFN1-xTB          :
          :  restarted?                       true          :
          :  GBSA solvation                  false          :
          :  PC potential                    false          :
          :  electronic temp.          300.0000000     K    :
          :  accuracy                    1.0000000          :
          :  -> integral cutoff          0.2500000E+02      :
          :  -> integral neglect         0.1000000E-07      :
          :  -> SCF convergence          0.1000000E-05 Eh   :
          :  -> wf. convergence          0.2000000E-04 e    :
          :  Broyden damping             0.4000000          :
          ...................................................

 iter      E             dE          RMSdq      gap      omega  full diag
   1   -217.6374153 -0.217637E+03  0.226E-01    0.97       0.0  T
   2   -217.5669296  0.704857E-01  0.575E-01    1.53       1.0  T
   3   -217.6504056 -0.834760E-01  0.186E-01    1.53       1.0  T
   4   -217.6543390 -0.393338E-02  0.972E-02    1.49       1.0  T
   5   -217.6420569  0.122821E-01  0.155E-01    1.43       1.0  T
   6   -217.6548150 -0.127581E-01  0.500E-02    1.50       1.0  T
   7   -217.6553173 -0.502282E-03  0.227E-02    1.48       1.0  T
   8   -217.6553686 -0.513224E-04  0.153E-02    1.48       1.0  T
   9   -217.6554155 -0.468682E-04  0.749E-03    1.48       1.4  T
  10   -217.6554265 -0.110229E-04  0.358E-03    1.48       2.8  T
  11   -217.6554298 -0.330292E-05  0.177E-03    1.48       5.7  T
  12   -217.6554305 -0.706919E-06  0.675E-04    1.48      15.0  T
  13   -217.6554305 -0.467363E-07  0.288E-04    1.48      35.2  T
  14   -217.6554306 -0.125101E-07  0.148E-04    1.48      68.5  T
  15   -217.6554306 -0.403020E-08  0.525E-05    1.48     193.6  T

   *** convergence criteria satisfied after 15 iterations ***

         #    Occupation            Energy/Eh            Energy/eV
      -------------------------------------------------------------
         1        2.0000           -1.3863171             -37.7236
       ...           ...                  ...                  ...
       166        2.0000           -0.4837396             -13.1632
       167        2.0000           -0.4814703             -13.1015
       168        2.0000           -0.4732071             -12.8766
       169        2.0000           -0.4691512             -12.7663
       170        1.9931           -0.4589179             -12.4878
       171        1.9488           -0.4569680             -12.4347
       172        1.0580           -0.4515459             -12.2872 (HOMO)
       173                         -0.3970545             -10.8044 (LUMO)
       174                         -0.3887843             -10.5794
       175                         -0.3778933             -10.2830
       176                         -0.3667720              -9.9804
       177                         -0.3543922              -9.6435
       ...                                ...                  ...
       443                        537.9332067           14637.9076
      -------------------------------------------------------------
                  HL-Gap            0.0544913 Eh            1.4828 eV
             Fermi-level           -0.4392469 Eh          -11.9525 eV

 SCC (total)                   0 d,  0 h,  0 min,  1.583 sec
 SCC setup                      ...        0 min,  0.003 sec (  0.214%)
 Dispersion                     ...        0 min,  0.000 sec (  0.011%)
 integral evaluation            ...        0 min,  0.852 sec ( 53.816%)
 zeroth order Hamiltonian       ...        0 min,  0.003 sec (  0.208%)
 iterations                     ...        0 min,  0.469 sec ( 29.601%)
 molecular gradient             ...        0 min,  0.251 sec ( 15.862%)
 printout                       ...        0 min,  0.004 sec (  0.283%)

         :::::::::::::::::::::::::::::::::::::::::::::::::::::
         ::                     SUMMARY                     ::
         :::::::::::::::::::::::::::::::::::::::::::::::::::::
         :: total energy            -214.084041619687 Eh    ::
         :: gradient norm              0.223844058144 Eh/a0 ::
         :: HOMO-LUMO gap              1.482784895769 eV    ::
         ::.................................................::
         :: SCC energy              -217.655430562789 Eh    ::
         :: -> electrostatic           0.240740978012 Eh    ::
         :: repulsion energy           3.665439665341 Eh    ::
         :: dispersion energy         -0.094050546360 Eh    ::
         :: halogen bond corr.         0.000000000000 Eh    ::
         :: add. restraining           0.000000000000 Eh    ::
         :::::::::::::::::::::::::::::::::::::::::::::::::::::

------------------------------------------------------------------------
empirical IP shift (eV):    4.8455
delta SCC IP (eV):    6.3564
------------------------------------------------------------------------
           ------------------------------------------------- 
          |        vertical delta SCC EA calculation        |
           ------------------------------------------------- 

          ...................................................
          :                      SETUP                      :
          :.................................................:
          :  # basis functions                 452          :
          :  # atomic orbitals                 443          :
          :  # shells                          265          :
          :  # electrons                       345          :
          :  # halogen bonds                    16          :
          :  max. iterations                   250          :
          :  Hamiltonian                  GFN1-xTB          :
          :  restarted?                       true          :
          :  GBSA solvation                  false          :
          :  PC potential                    false          :
          :  electronic temp.          300.0000000     K    :
          :  accuracy                    1.0000000          :
          :  -> integral cutoff          0.2500000E+02      :
          :  -> integral neglect         0.1000000E-07      :
          :  -> SCF convergence          0.1000000E-05 Eh   :
          :  -> wf. convergence          0.2000000E-04 e    :
          :  Broyden damping             0.4000000          :
          ...................................................

 iter      E             dE          RMSdq      gap      omega  full diag
   1   -218.3004398 -0.218300E+03  0.374E-01    0.22       0.0  T
   2   -218.2636619  0.367779E-01  0.511E-01    0.96       1.0  T
   3   -218.3227934 -0.591315E-01  0.281E-01    0.17       1.0  T
   4   -218.3176823  0.511111E-02  0.298E-01    0.52       1.0  T
   5   -218.3295759 -0.118936E-01  0.221E-01    0.29       1.0  T
   6   -218.3482622 -0.186862E-01  0.142E-01    0.05       1.0  T
   7   -218.3351396  0.131226E-01  0.185E-01    0.15       1.0  T
   8   -218.3371251 -0.198548E-02  0.172E-01    0.09       1.0  T
   9   -218.3581501 -0.210250E-01  0.319E-02    0.03       1.0  T
  10   -218.3585728 -0.422699E-03  0.201E-02    0.01       1.0  T
  11   -218.3584794  0.934211E-04  0.232E-02    0.02       1.0  T
  12   -218.3588724 -0.393033E-03  0.220E-03    0.01       4.6  T
  13   -218.3588686  0.378540E-05  0.299E-03    0.01       3.4  T
  14   -218.3588751 -0.648779E-05  0.496E-04    0.01      20.5  T
  15   -218.3588752 -0.109219E-06  0.243E-04    0.01      41.8  T
  16   -218.3588753 -0.306007E-07  0.993E-05    0.01     102.3  T
  17   -218.3588753  0.388013E-09  0.935E-05    0.01     108.5  T

   *** convergence criteria satisfied after 17 iterations ***

         #    Occupation            Energy/Eh            Energy/eV
      -------------------------------------------------------------
         1        2.0000           -1.2466223             -33.9223
       ...           ...                  ...                  ...
       167        2.0000           -0.3426807              -9.3248
       168        2.0000           -0.3324004              -9.0451
       169        2.0000           -0.3293061              -8.9609
       170        2.0000           -0.3235824              -8.8051
       171        2.0000           -0.3224584              -8.7745
       172        2.0000           -0.3050421              -8.3006
       173        0.5620           -0.2531775              -6.8893 (HOMO)
       174        0.4380           -0.2527041              -6.8764 (LUMO)
       175        0.0000           -0.2382200              -6.4823
       176                         -0.2275746              -6.1926
       177                         -0.2143519              -5.8328
       178                         -0.2025175              -5.5108
       ...                                ...                  ...
       443                        538.0798859           14641.8990
      -------------------------------------------------------------
                  HL-Gap            0.0004734 Eh            0.0129 eV
             Fermi-level           -0.2661364 Eh           -7.2419 eV

 SCC (total)                   0 d,  0 h,  0 min,  1.653 sec
 SCC setup                      ...        0 min,  0.003 sec (  0.203%)
 Dispersion                     ...        0 min,  0.000 sec (  0.017%)
 integral evaluation            ...        0 min,  0.859 sec ( 51.937%)
 zeroth order Hamiltonian       ...        0 min,  0.003 sec (  0.199%)
 iterations                     ...        0 min,  0.532 sec ( 32.185%)
 molecular gradient             ...        0 min,  0.251 sec ( 15.185%)
 printout                       ...        0 min,  0.004 sec (  0.271%)

         :::::::::::::::::::::::::::::::::::::::::::::::::::::
         ::                     SUMMARY                     ::
         :::::::::::::::::::::::::::::::::::::::::::::::::::::
         :: total energy            -214.787486328183 Eh    ::
         :: gradient norm              0.230779378749 Eh/a0 ::
         :: HOMO-LUMO gap              0.012882400432 eV    ::
         ::.................................................::
         :: SCC energy              -218.358875271284 Eh    ::
         :: -> electrostatic           0.230979415403 Eh    ::
         :: repulsion energy           3.665439665341 Eh    ::
         :: dispersion energy         -0.094050546360 Eh    ::
         :: halogen bond corr.         0.000000000000 Eh    ::
         :: add. restraining           0.000000000000 Eh    ::
         :::::::::::::::::::::::::::::::::::::::::::::::::::::

------------------------------------------------------------------------
empirical EA shift (eV):    4.8455
delta SCC EA (eV):    3.0943
------------------------------------------------------------------------
           -------------------------------------------------
          |                Property Printout                |
           -------------------------------------------------

    * Orbital Energies and Occupations

         #    Occupation            Energy/Eh            Energy/eV
      -------------------------------------------------------------
         1        2.0000           -1.2466223             -33.9223
       ...           ...                  ...                  ...
       161        2.0000           -0.3669035              -9.9840
       162        2.0000           -0.3617123              -9.8427
       163        2.0000           -0.3560010              -9.6873
       164        2.0000           -0.3554763              -9.6730
       165        2.0000           -0.3499257              -9.5220
       166        2.0000           -0.3488447              -9.4925
       167        2.0000           -0.3426807              -9.3248
       168        2.0000           -0.3324004              -9.0451
       169        2.0000           -0.3293061              -8.9609
       170        2.0000           -0.3235824              -8.8051
       171        2.0000           -0.3224584              -8.7745
       172        2.0000           -0.3050421              -8.3006
       173        0.5620           -0.2531775              -6.8893 (HOMO)
       174        0.4380           -0.2527041              -6.8764 (LUMO)
       175        0.0000           -0.2382200              -6.4823
       176                         -0.2275746              -6.1926
       177                         -0.2143519              -5.8328
       178                         -0.2025175              -5.5108
       179                         -0.1953955              -5.3170
       180                         -0.1887895              -5.1372
       181                         -0.1844976              -5.0204
       182                         -0.1823611              -4.9623
       183                         -0.1738356              -4.7303
       184                         -0.1719753              -4.6797
       ...                                ...                  ...
       443                        538.0798859           14641.8990
      -------------------------------------------------------------
                  HL-Gap            0.0004734 Eh            0.0129 eV
             Fermi-level           -0.2661364 Eh           -7.2419 eV

  Mulliken/CM5 charges        n(s)   n(p)   n(d)
     1 C  -0.08160 -0.04624   0.736  3.182  0.000
     2 O   0.14892  0.10292   1.528  4.621  0.000
     3 C   0.00205  0.00023   1.136  2.866  0.000
     4 C   0.01450 -0.03441   1.096  2.919  0.000
     5 C  -0.05298 -0.05810   1.162  2.785  0.000
     6 Cl  0.14228  0.14042   1.856  5.265  0.022
     7 C  -0.03171 -0.04973   1.174  2.794  0.000
     8 Br  0.05347  0.07049   1.905  5.120  0.028
     9 C   0.01539 -0.03482   1.082  2.934  0.000
    10 C  -0.01045 -0.01376   1.082  2.908  0.000
    11 C  -0.01040 -0.01109   1.089  2.900  0.000
    12 C   0.00314  0.00927   1.029  2.974  0.000
    13 C  -0.11074  0.00635   1.203  2.686  0.000
    14 N   0.28378  0.15058   1.502  3.782  0.000
    15 C  -0.10515  0.01387   1.205  2.690  0.000
    16 N   0.29571  0.16543   1.525  3.771  0.000
    17 C   0.05015  0.04825   1.076  2.974  0.000
    18 C   0.01520 -0.03295   1.080  2.936  0.000
    19 C  -0.00900 -0.00144   1.134  2.857  0.000
    20 S   0.06573  0.03445   1.886  4.048  0.132
    21 C  -0.00501  0.01281   1.129  2.866  0.000
    22 C  -0.00667  0.00652   1.136  2.858  0.000
    23 C  -0.00057 -0.00855   1.073  2.926  0.000
    24 C   0.02566 -0.08040   1.071  2.955  0.000
    25 C   0.05607 -0.09544   1.072  2.984  0.000
    26 S   0.06774  0.03499   1.876  4.122  0.070
    27 C  -0.00404  0.01799   1.142  2.854  0.000
    28 C  -0.04532  0.02377   1.072  2.883  0.000
    29 N   0.11933 -0.13693   1.275  3.845  0.000
    30 C  -0.00808 -0.05749   1.104  2.887  0.000
    31 C  -0.05120  0.01802   1.068  2.881  0.000
    32 C   0.01752  0.03050   1.073  2.945  0.000
    33 C  -0.07035  0.01779   1.151  2.779  0.000
    34 N   0.24546  0.08377   1.473  3.773  0.000
    35 S  -0.15873 -0.02382   1.863  3.674  0.304
    36 N   0.24833  0.08658   1.474  3.775  0.000
    37 C  -0.06855  0.01947   1.150  2.782  0.000
    38 C   0.01718  0.03023   1.072  2.945  0.000
    39 C  -0.05286  0.01638   1.071  2.876  0.000
    40 N   0.11145 -0.14610   1.260  3.851  0.000
    41 C  -0.03646 -0.08512   1.097  2.866  0.000
    42 C   0.05745 -0.09011   1.068  2.989  0.000
    43 C  -0.04837  0.02153   1.057  2.894  0.000
    44 C  -0.00204  0.01977   1.138  2.860  0.000
    45 S   0.04797  0.01639   1.875  4.086  0.087
    46 C   0.00413  0.01899   1.150  2.854  0.000
    47 C  -0.00902  0.00653   1.115  2.876  0.000
    48 S   0.13360  0.10152   1.912  4.184  0.037
    49 C  -0.07083 -0.04946   1.109  2.821  0.000
    50 C  -0.05422 -0.05275   1.180  2.766  0.000
    51 C   0.02884 -0.07471   1.085  2.944  0.000
    52 C   0.06149 -0.08898   1.072  2.990  0.000
    53 C   0.03431 -0.01253   1.056  2.978  0.000
    54 C   0.02887  0.02912   1.059  2.970  0.000
    55 C  -0.01056 -0.01046   1.091  2.898  0.000
    56 C  -0.00885 -0.00197   1.047  2.944  0.000
    57 C  -0.10641  0.01343   1.206  2.687  0.000
    58 N   0.28972  0.16084   1.533  3.757  0.000
    59 C  -0.11101  0.00982   1.203  2.686  0.000
    60 N   0.28179  0.15385   1.525  3.757  0.000
    61 C   0.01348  0.01006   1.071  2.942  0.000
    62 C   0.02759 -0.02262   1.113  2.915  0.000
    63 C  -0.01254 -0.03047   1.172  2.815  0.000
    64 Br  0.07567  0.09263   1.905  5.137  0.034
    65 C  -0.03232 -0.03748   1.176  2.792  0.000
    66 Cl  0.18195  0.18002   1.859  5.299  0.024
    67 C   0.14631  0.09714   1.068  3.078  0.000
    68 C   0.02062  0.01815   1.087  2.934  0.000
    69 C  -0.05956 -0.03339   1.105  2.835  0.000
    70 O   0.17085  0.10032   1.643  4.528  0.000
    71 C   0.50792  0.36122   0.967  3.541  0.000
    72 H  -0.04547  0.01421   0.955  0.000  0.000
    73 H  -0.04233  0.02283   0.958  0.000  0.000
    74 H  -0.03618  0.03448   0.964  0.000  0.000
    75 H  -0.02297  0.03465   0.977  0.000  0.000
    76 H  -0.02005  0.03795   0.980  0.000  0.000
    77 H  -0.01972  0.03317   0.980  0.000  0.000
    78 H  -0.01555  0.03660   0.984  0.000  0.000
    79 H  -0.01537  0.03816   0.985  0.000  0.000
    80 H  -0.00579  0.06222   0.994  0.000  0.000
    81 H  -0.00011  0.07034   1.000  0.000  0.000
    82 H  -0.04111  0.02545   0.959  0.000  0.000
    83 H  -0.03833  0.03047   0.962  0.000  0.000
    84 H  -0.01932  0.03704   0.981  0.000  0.000
    85 H  -0.02421  0.02812   0.976  0.000  0.000
    86 H  -0.00626  0.04923   0.994  0.000  0.000
    87 H  -0.02909  0.02825   0.971  0.000  0.000
    88 H  -0.03086  0.02764   0.969  0.000  0.000
    89 H  -0.02431  0.03004   0.976  0.000  0.000
    90 H  -0.02285  0.02910   0.977  0.000  0.000
    91 H  -0.02232  0.03537   0.978  0.000  0.000
    92 H  -0.03902  0.02268   0.961  0.000  0.000
    93 H  -0.06571 -0.00275   0.934  0.000  0.000
    94 H  -0.31877 -0.25996   0.681  0.000  0.000
    95 H  -0.27660 -0.22147   0.723  0.000  0.000
    96 H  -0.20715 -0.15066   0.793  0.000  0.000
    97 H  -0.27659 -0.22426   0.723  0.000  0.000
(R)spin-density population

 Mulliken population n(s)   n(p)   n(d)
     1 C  -0.0000  -0.000 -0.000  0.000
     2 O   0.0001   0.000  0.000  0.000
     3 C   0.0172   0.000  0.017  0.000
     4 C   0.0026  -0.000  0.003  0.000
     5 C   0.0262   0.000  0.026  0.000
     6 Cl  0.0063   0.000  0.003  0.003
     7 C   0.0008  -0.000  0.001  0.000
     8 Br  0.0004   0.000  0.000  0.000
     9 C   0.0206   0.000  0.021  0.000
    10 C   0.0085  -0.000  0.009  0.000
    11 C   0.0698   0.000  0.070  0.000
    12 C   0.0618   0.000  0.062  0.000
    13 C   0.0093   0.000  0.009  0.000
    14 N   0.0315   0.000  0.031  0.000
    15 C   0.0082   0.000  0.008  0.000
    16 N   0.0298  -0.000  0.030  0.000
    17 C   0.0099   0.000  0.010  0.000
    18 C   0.0601  -0.000  0.060  0.000
    19 C   0.0011  -0.000  0.001  0.000
    20 S   0.0167   0.000  0.014  0.003
    21 C   0.0335   0.000  0.034  0.000
    22 C  -0.0000  -0.000  0.000  0.000
    23 C   0.0410  -0.000  0.041  0.000
    24 C   0.0003   0.000  0.000  0.000
    25 C   0.0025   0.001  0.002  0.000
    26 S   0.0043  -0.000  0.003  0.001
    27 C   0.0125   0.000  0.012  0.000
    28 C   0.0000   0.000  0.000  0.000
    29 N   0.0071   0.000  0.007  0.000
    30 C   0.0003  -0.000  0.000  0.000
    31 C   0.0153  -0.000  0.015  0.000
    32 C   0.0001   0.000  0.000  0.000
    33 C   0.0000   0.000  0.000  0.000
    34 N   0.0021   0.000  0.002  0.000
    35 S   0.0073   0.000  0.005  0.002
    36 N   0.0077   0.000  0.008  0.000
    37 C   0.0024   0.000  0.002  0.000
    38 C   0.0078   0.000  0.008  0.000
    39 C   0.0019  -0.000  0.002  0.000
    40 N   0.0042   0.000  0.004  0.000
    41 C   0.0002   0.000  0.000  0.000
    42 C   0.0003   0.000  0.000  0.000
    43 C   0.0040   0.000  0.004  0.000
    44 C   0.0009   0.000  0.001  0.000
    45 S   0.0009   0.000  0.000  0.001
    46 C   0.0048   0.000  0.005  0.000
    47 C   0.0003   0.000  0.000  0.000
    48 S   0.0006   0.000  0.001  0.000
    49 C   0.0019   0.000  0.002  0.000
    50 C   0.0001  -0.000  0.000  0.000
    51 C   0.0002   0.000  0.000  0.000
    52 C   0.0000  -0.000  0.000  0.000
    53 C   0.0092  -0.000  0.009  0.000
    54 C   0.0082  -0.000  0.008  0.000
    55 C   0.0843   0.000  0.084  0.000
    56 C   0.0784   0.000  0.078  0.000
    57 C   0.0106   0.000  0.011  0.000
    58 N   0.0372  -0.000  0.037  0.000
    59 C   0.0104   0.000  0.010  0.000
    60 N   0.0356  -0.000  0.036  0.000
    61 C   0.0246   0.000  0.025  0.000
    62 C   0.0165   0.000  0.017  0.000
    63 C   0.0147  -0.000  0.015  0.000
    64 Br  0.0051  -0.000  0.002  0.003
    65 C   0.0274  -0.000  0.027  0.000
    66 Cl  0.0066  -0.000  0.003  0.003
    67 C   0.0046   0.000  0.005  0.000
    68 C   0.0285   0.000  0.028  0.000
    69 C   0.0367   0.000  0.037  0.000
    70 O   0.0133   0.000  0.013  0.000
    71 C   0.0007   0.000  0.001  0.000
    72 H   0.0000   0.000  0.000  0.000
    73 H   0.0000   0.000  0.000  0.000
    74 H   0.0000   0.000  0.000  0.000
    75 H   0.0003   0.000  0.000  0.000
    76 H   0.0006   0.001  0.000  0.000
    77 H   0.0000   0.000  0.000  0.000
    78 H   0.0002   0.000  0.000  0.000
    79 H   0.0000   0.000  0.000  0.000
    80 H   0.0001   0.000  0.000  0.000
    81 H  -0.0000  -0.000  0.000  0.000
    82 H   0.0002   0.000  0.000  0.000
    83 H   0.0000   0.000  0.000  0.000
    84 H   0.0001   0.000  0.000  0.000
    85 H   0.0001   0.000  0.000  0.000
    86 H   0.0001   0.000  0.000  0.000
    87 H   0.0000   0.000  0.000  0.000
    88 H   0.0000   0.000  0.000  0.000
    89 H   0.0000   0.000  0.000  0.000
    90 H   0.0000   0.000  0.000  0.000
    91 H   0.0000   0.000  0.000  0.000
    92 H   0.0000   0.000  0.000  0.000
    93 H   0.0000   0.000  0.000  0.000
    94 H   0.0000   0.000  0.000  0.000
    95 H   0.0000   0.000  0.000  0.000
    96 H   0.0000   0.000  0.000  0.000
    97 H   0.0001   0.000  0.000  0.000

Wiberg/Mayer (AO) data.
largest (>0.10) Wiberg bond orders for each atom
          total WBO             WBO to atom ...
     1  C   2.399        O    2 0.987    C   17 0.759    C    3 0.618
     2  O   1.917        C    1 0.987    C    3 0.293    S   20 0.177    C   17 0.176
     3  C   3.899        C    4 1.431    C   10 1.309    C    1 0.618    O    2 0.293    C   17 0.151
     4  C   3.914        C    3 1.431    C    5 1.382    H   72 0.980
     5  C   3.920        C    4 1.382    C    7 1.378    Cl   6 1.084
     6  Cl  1.192        C    5 1.084
     7  C   3.962        C    9 1.415    C    5 1.378    Br   8 1.090
     8  Br  1.207        C    7 1.090
     9  C   3.839        C    7 1.415    C   10 1.407    H   73 0.994
    10  C   3.883        C    9 1.407    C    3 1.309    C   11 1.100
    11  C   3.804        C   12 1.411    C   17 1.198    C   10 1.100
    12  C   3.716        C   11 1.411    C   13 1.164    C   15 1.160
    13  C   4.086        N   14 2.868    C   12 1.164
    14  N   2.842        C   13 2.868
    15  C   4.088        N   16 2.890    C   12 1.160
    16  N   2.903        C   15 2.890
    17  C   3.791        C   18 1.448    C   11 1.198    C    1 0.759    O    2 0.176    C    3 0.151
    18  C   3.754        C   17 1.448    C   19 1.331    H   74 0.970
    19  C   3.884        C   23 1.365    C   18 1.331    S   20 1.132
    20  S   2.631        C   21 1.187    C   19 1.132    O    2 0.177
    21  C   3.845        C   22 1.340    C   28 1.286    S   20 1.187
    22  C   3.876        C   23 1.375    C   21 1.340    S   26 1.148
    23  C   3.782        C   22 1.375    C   19 1.365    C   24 1.014
    24  C   3.894        C   23 1.014    H   76 0.996    H   75 0.990    C   25 0.975
    25  C   3.913        H   79 1.002    H   77 0.996    H   78 0.993    C   24 0.975
    26  S   2.467        C   27 1.189    C   22 1.148
    27  C   3.886        C   28 1.337    C   32 1.302    S   26 1.189
    28  C   3.885        C   27 1.337    C   21 1.286    N   29 1.169
    29  N   3.142        C   31 1.192    C   28 1.169    C   30 0.940
    30  C   3.861        H   81 0.997    H   80 0.996    C   71 0.967    N   29 0.940
    31  C   3.832        C   32 1.299    C   39 1.264    N   29 1.192
    32  C   3.878        C   27 1.302    C   31 1.299    C   33 1.210
    33  C   4.032        N   34 1.551    C   32 1.210    C   37 1.184    S   35 0.106
    34  N   3.007        C   33 1.551    S   35 1.390
    35  S   3.110        N   36 1.392    N   34 1.390    C   33 0.106    C   37 0.104
    36  N   3.002        C   37 1.544    S   35 1.392
    37  C   4.031        N   36 1.544    C   38 1.214    C   33 1.184    S   35 0.104
    38  C   3.867        C   39 1.320    C   44 1.274    C   37 1.214
    39  C   3.864        C   38 1.320    C   31 1.264    N   40 1.172
    40  N   3.131        C   39 1.172    C   43 1.166    C   41 0.967
    41  C   3.893        H   83 1.001    C   42 0.995    H   82 0.991    N   40 0.967
    42  C   3.892        H   86 1.009    H   84 1.002    C   41 0.995    H   85 0.993
    43  C   3.858        C   44 1.358    C   47 1.257    N   40 1.166
    44  C   3.909        C   43 1.358    C   38 1.274    S   45 1.199
    45  S   2.573        C   46 1.206    C   44 1.199
    46  C   3.852        C   47 1.578    S   45 1.206    C   50 0.991
    47  C   3.856        C   46 1.578    C   43 1.257    S   48 1.082
    48  S   2.185        C   47 1.082    C   50 0.935
    49  C   3.862        C   53 1.559    O   70 1.142    C   50 1.053    C   69 0.100
    50  C   3.958        C   49 1.053    C   51 0.999    C   46 0.991    S   48 0.935
    51  C   3.906        C   50 0.999    H   87 0.997    C   52 0.989    H   88 0.987
    52  C   3.921        H   91 0.998    H   89 0.994    H   90 0.992    C   51 0.989
    53  C   3.796        C   49 1.559    C   54 1.297    H   92 1.005
    54  C   3.839        C   69 1.389    C   53 1.297    C   55 1.147
    55  C   3.781        C   56 1.459    C   54 1.147    C   61 1.117
    56  C   3.736        C   55 1.459    C   57 1.159    C   59 1.149
    57  C   4.099        N   58 2.908    C   56 1.159
    58  N   2.911        C   57 2.908
    59  C   4.089        N   60 2.910    C   56 1.149
    60  N   2.905        C   59 2.910
    61  C   3.829        C   62 1.455    C   68 1.244    C   55 1.117
    62  C   3.857        C   61 1.455    C   63 1.404    H   93 0.965
    63  C   3.926        C   62 1.404    C   65 1.383    Br  64 1.084
    64  Br  1.201        C   63 1.084
    65  C   3.925        C   67 1.400    C   63 1.383    Cl  66 1.063
    66  Cl  1.171        C   65 1.063
    67  C   3.750        C   68 1.443    C   65 1.400    H   94 0.847
    68  C   3.865        C   67 1.443    C   61 1.244    C   69 1.134
    69  C   3.851        C   54 1.389    O   70 1.192    C   68 1.134    C   49 0.100
    70  O   2.391        C   69 1.192    C   49 1.142
    71  C   3.537        C   30 0.967    H   96 0.927    H   95 0.863    H   97 0.852
    72  H   1.032        C    4 0.980
    73  H   1.052        C    9 0.994
    74  H   1.058        C   18 0.970
    75  H   1.039        C   24 0.990
    76  H   1.054        C   24 0.996
    77  H   1.032        C   25 0.996
    78  H   1.048        C   25 0.993
    79  H   1.047        C   25 1.002
    80  H   1.036        C   30 0.996
    81  H   1.069        C   30 0.997
    82  H   1.026        C   41 0.991
    83  H   1.051        C   41 1.001
    84  H   1.041        C   42 1.002
    85  H   1.037        C   42 0.993
    86  H   1.058        C   42 1.009
    87  H   1.020        C   51 0.997
    88  H   1.035        C   51 0.987
    89  H   1.029        C   52 0.994
    90  H   1.027        C   52 0.992
    91  H   1.033        C   52 0.998
    92  H   1.035        C   53 1.005
    93  H   0.958        C   62 0.965
    94  H   0.927        C   67 0.847
    95  H   0.944        C   71 0.863
    96  H   0.948        C   71 0.927
    97  H   0.935        C   71 0.852

 dipole moment from electron density (au)
     X       Y       Z   
  -7.1859 -10.4761  -1.6479  total (Debye):   32.560


           -------------------------------------------------
          | TOTAL ENERGY             -214.787486328183 Eh   |
          | GRADIENT NORM               0.230779378749 Eh/α |
          | HOMO-LUMO GAP               0.012882400432 eV   |
           -------------------------------------------------

------------------------------------------------------------------------
 * finished run on 2021/12/02 at 16:35:57.848     
------------------------------------------------------------------------
 total:
 * wall-time:     0 d,  0 h,  0 min,  5.958 sec
 *  cpu-time:     0 d,  0 h,  0 min,  5.927 sec
 * ratio c/w:     0.995 speedup
 SCF:
 * wall-time:     0 d,  0 h,  0 min,  5.081 sec
 *  cpu-time:     0 d,  0 h,  0 min,  5.060 sec
 * ratio c/w:     0.996 speedup

