      -----------------------------------------------------------      
     |                   =====================                   |     
     |                           x T B                           |     
     |                   =====================                   |     
     |                         S. Grimme                         |     
     |          Mulliken Center for Theoretical Chemistry        |     
     |                    University of Bonn                     |     
     |                Version 6.2 RC2 (SAW190805)                |     
      -----------------------------------------------------------      

   This program is distributed in the hope that it will be useful,
   but WITHOUT ANY WARRANTY; without even the implied warranty of
   MERCHANTABILITY or FITNESS FOR A PARTICULAR PURPOSE.
   
   FOR NON-COMMERCIAL, ACADEMIA USE ONLY.
   
   Cite this work as:
   * S. Grimme, C. Bannwarth, P. Shushkov, J. Chem. Theory Comput., 2017,
     13, 1989-2009. DOI: 10.1021/acs.jctc.7b00118
   * C. Bannwarth, S. Ehlert and S. Grimme., J. Chem. Theory Comput., 2019,
     15, 1652-1671. DOI: 10.1021/acs.jctc.8b01176
   * P. Pracht, E. Caldeweyher, S. Ehlert, S. Grimme, ChemRxiv, 2019, preprint.
     DOI: 10.26434/chemrxiv.8326202.v1
   
   for DFT-D4:
   * E. Caldeweyher, C. Bannwarth and S. Grimme, J. Chem. Phys., 2017,
     147, 034112. DOI: 10.1063/1.4993215
   * E. Caldeweyher, S. Ehlert, A. Hansen, H. Neugebauer, S. Spicher,
     C. Bannwarth and S. Grimme, J. Chem. Phys., 2019, 150, 154122.
     DOI: 10.1063/1.5090222
   
   for sTDA-xTB:
   * S. Grimme and C. Bannwarth, J. Chem. Phys., 2016, 145, 054103.
     DOI: 10.1063/1.4959605
   
   in the mass-spec context:
   * V. Asgeirsson, C. Bauer and S. Grimme, Chem. Sci., 2017, 8, 4879.
     DOI: 10.1039/c7sc00601b
   
   for metadynamics refer to:
   * S. Grimme, J. Chem. Theory Comput., 2019, 155, 2847-2862
     DOI: 10.1021/acs.jctc.9b00143
   
   with help from (in alphabetical order)
   C. Bannwarth, F. Bohle, G. Brandenburg, E. Caldeweyher, M. Checinski,
   S. Dohm, S. Ehlert, S. Ehrlich, F. März, H. Neugebauer, J. Pisarek,
   P. Pracht, P. Shushkov, and S. Spicher.
   
 * started run on 2021/12/02 at 16:35:45.602     

           -------------------------------------------------
          |                Calculation Setup                |
           -------------------------------------------------

          program call               : /ihome/ghutchison/geoffh/xtb/xtb BTP-4Cl.xyz --vipea
          hostname                   : smp-n128
          coordinate file            : BTP-4Cl.xyz
          omp threads                :                     1
          number of atoms            :                    97
          number of electrons        :                   344
          charge                     :                     0
          spin                       :                   0.0
          first test random number   :      0.86488793395249


########################################################################
# WARNING! Please study the warnings concerning your input carefully
#  - XTBPATH is not set, using XTBHOME instead
########################################################################

           ------------------------------------------------- 
          |                 I P E A - x T B                 |
          |  Ionisation Potentials and Electron Affinities  |
           ------------------------------------------------- 
             KAB for M(3d)-M(3d) :                1.1000
             KAB for M(4d)-M(4d) :                1.2000
             KAB for M(5d)-M(5d) :                1.2000
             k(s)                :                2.1500
             k(p)                :                2.3000
             k(d)                :                2.0000
             k(f)                :                0.0000
             kEN (H0ij)          :                0.7000
             D3 a1               :                0.6300
             D3 a2               :                5.0000
             D3 s6               :                1.0000
             D3 s8               :                2.4000
             D3 s9               :                0.0000
             alphaj              :                1.0000
             XBdamp              :                0.4400
             XBrad               :                1.3000
             kcnsh               :      1.0000   -0.3000   -0.5000    0.5000

  Z AO/shell   Hii/eV     exponent
  1     Thu Sep 22 23:34:11 CEST 2016   EN: 2.200 GAM: 0.405  GM3: 0.1500
     1s    -10.521941    1.306199
     2s     -3.560151    0.398421
  6     Thu Sep 22 23:34:11 CEST 2016   EN: 2.550 GAM: 0.640  GM3: 0.1500
     2s    -15.968100    1.979793
     2p     -9.777107    1.850537
     3S     -3.366990    0.633095
  7     Thu Sep 22 23:34:11 CEST 2016   EN: 3.040 GAM: 0.493  GM3:-0.1000
     2s    -24.040776    2.126160
     2p    -14.426520    2.068425
     3S     -5.882278    0.671040
  8     Thu Sep 22 23:34:11 CEST 2016   EN: 3.440 GAM: 0.717  GM3:-0.2000
     2s    -26.695120    2.575264
     2p    -16.014457    2.159448
     3S     -6.622058    0.958679
 16     Tue Jan 17 20:57:36 CET 2017    EN: 2.580 GAM: 0.455  GM3: 0.1020
     3s    -24.488821    2.492075
     3p    -12.136640    1.997904
     3d     -1.796070    1.747541
 17     Tue Jan 17 19:45:33 CET 2017    EN: 3.160 GAM: 0.559  GM3: 0.2396
     3s    -24.452163    2.559226
     3p    -13.465451    2.054846
     3d     -1.836065    1.762522

           ------------------------------------------------- 
          |        Self-Consistent Charge Iterations        |
           ------------------------------------------------- 

          ...................................................
          :                      SETUP                      :
          :.................................................:
          :  # basis functions                 452          :
          :  # atomic orbitals                 443          :
          :  # shells                          265          :
          :  # electrons                       344          :
          :  # halogen bonds                    16          :
          :  max. iterations                   250          :
          :  Hamiltonian                  GFN1-xTB          :
          :  restarted?                      false          :
          :  GBSA solvation                  false          :
          :  PC potential                    false          :
          :  electronic temp.          300.0000000     K    :
          :  accuracy                    1.0000000          :
          :  -> integral cutoff          0.2500000E+02      :
          :  -> integral neglect         0.1000000E-07      :
          :  -> SCF convergence          0.1000000E-05 Eh   :
          :  -> wf. convergence          0.2000000E-04 e    :
          :  Broyden damping             0.4000000          :
          ...................................................

 iter      E             dE          RMSdq      gap      omega  full diag
   1   -217.8453361 -0.217845E+03  0.983E+00    0.43       0.0  T
   2   -215.2168184  0.262852E+01  0.637E+00    0.63       1.0  T
   3   -216.1106276 -0.893809E+00  0.734E+00    0.39       1.0  T
   4   -213.4751675  0.263546E+01  0.316E+00    0.20       1.0  T
   5   -217.9781062 -0.450294E+01  0.170E+00    0.19       1.0  T
   6   -218.9731514 -0.995045E+00  0.125E+00    1.36       1.0  T
   7   -219.0088565 -0.357051E-01  0.112E+00    1.40       1.0  T
   8   -219.0082147  0.641796E-03  0.103E+00    1.33       1.0  T
   9   -219.0062544  0.196033E-02  0.553E-01    0.38       1.0  T
  10   -218.1967775  0.809477E+00  0.130E+00    0.13       1.0  T
  11   -219.0164536 -0.819676E+00  0.283E-01    0.31       1.0  T
  12   -219.0260919 -0.963831E-02  0.212E-01    0.54       1.0  T
  13   -219.0320885 -0.599665E-02  0.158E-01    0.88       1.0  T
  14   -219.0339289 -0.184031E-02  0.131E-01    1.18       1.0  T
  15   -219.0341474 -0.218569E-03  0.113E-01    1.25       1.0  T
  16   -219.0340016  0.145778E-03  0.104E-01    1.22       1.0  T
  17   -219.0342179 -0.216281E-03  0.992E-02    1.22       1.0  T
  18   -219.0343703 -0.152350E-03  0.957E-02    1.22       1.0  T
  19   -219.0344382 -0.679438E-04  0.936E-02    1.21       1.0  T
  20   -219.0345593 -0.121084E-03  0.898E-02    1.21       1.0  T
  21   -219.0347065 -0.147215E-03  0.851E-02    1.19       1.0  T
  22   -219.0350224 -0.315889E-03  0.745E-02    1.14       1.0  T
  23   -219.0354417 -0.419250E-03  0.567E-02    1.06       1.0  T
  24   -219.0357268 -0.285099E-03  0.401E-02    0.97       1.0  T
  25   -219.0359043 -0.177527E-03  0.256E-02    0.89       1.0  T
  26   -219.0359720 -0.677379E-04  0.173E-02    0.84       1.0  T
  27   -219.0360140 -0.419721E-04  0.924E-03    0.79       1.1  T
  28   -219.0360280 -0.140391E-04  0.384E-03    0.75       2.6  T
  29   -219.0360307 -0.270390E-05  0.133E-03    0.73       7.6  T
  30   -219.0360311 -0.359438E-06  0.233E-04    0.73      43.5  T
  31   -219.0360311 -0.127021E-07  0.837E-05    0.73     121.3  T
  32   -219.0360311 -0.638352E-10  0.852E-05    0.73     119.2  T

   *** convergence criteria satisfied after 32 iterations ***

         #    Occupation            Energy/Eh            Energy/eV
      -------------------------------------------------------------
         1        2.0000           -1.3177571             -35.8580
       ...           ...                  ...                  ...
       166        2.0000           -0.4169126             -11.3448
       167        2.0000           -0.4123689             -11.2211
       168        2.0000           -0.4056811             -11.0391
       169        2.0000           -0.4015544             -10.9269
       170        2.0000           -0.3919833             -10.6664
       171        2.0000           -0.3846857             -10.4678
       172        2.0000           -0.3631111              -9.8808 (HOMO)
       173        0.0000           -0.3364440              -9.1551 (LUMO)
       174                         -0.3303489              -8.9893
       175                         -0.3202713              -8.7150
       176                         -0.3090807              -8.4105
       177                         -0.2940564              -8.0017
       ...                                ...                  ...
       443                        547.1490078           14888.6823
      -------------------------------------------------------------
                  HL-Gap            0.0266672 Eh            0.7257 eV
             Fermi-level           -0.3497783 Eh           -9.5180 eV

 SCC (total)                   0 d,  0 h,  0 min,  2.152 sec
 SCC setup                      ...        0 min,  0.004 sec (  0.186%)
 Dispersion                     ...        0 min,  0.000 sec (  0.014%)
 integral evaluation            ...        0 min,  0.867 sec ( 40.287%)
 zeroth order Hamiltonian       ...        0 min,  0.003 sec (  0.156%)
 iterations                     ...        0 min,  1.019 sec ( 47.354%)
 molecular gradient             ...        0 min,  0.251 sec ( 11.677%)
 printout                       ...        0 min,  0.007 sec (  0.323%)

         :::::::::::::::::::::::::::::::::::::::::::::::::::::
         ::                     SUMMARY                     ::
         :::::::::::::::::::::::::::::::::::::::::::::::::::::
         :: total energy            -215.441873982733 Eh    ::
         :: gradient norm              0.211286772941 Eh/a0 ::
         :: HOMO-LUMO gap              0.725650634324 eV    ::
         ::.................................................::
         :: SCC energy              -219.036031106262 Eh    ::
         :: -> electrostatic           0.217615768539 Eh    ::
         :: repulsion energy           3.689360862848 Eh    ::
         :: dispersion energy         -0.095203739320 Eh    ::
         :: halogen bond corr.         0.000000000000 Eh    ::
         :: add. restraining           0.000000000000 Eh    ::
         :::::::::::::::::::::::::::::::::::::::::::::::::::::

           ------------------------------------------------- 
          |        vertical delta SCC IP calculation        |
           ------------------------------------------------- 

          ...................................................
          :                      SETUP                      :
          :.................................................:
          :  # basis functions                 452          :
          :  # atomic orbitals                 443          :
          :  # shells                          265          :
          :  # electrons                       343          :
          :  # halogen bonds                    16          :
          :  max. iterations                   250          :
          :  Hamiltonian                  GFN1-xTB          :
          :  restarted?                       true          :
          :  GBSA solvation                  false          :
          :  PC potential                    false          :
          :  electronic temp.          300.0000000     K    :
          :  accuracy                    1.0000000          :
          :  -> integral cutoff          0.2500000E+02      :
          :  -> integral neglect         0.1000000E-07      :
          :  -> SCF convergence          0.1000000E-05 Eh   :
          :  -> wf. convergence          0.2000000E-04 e    :
          :  Broyden damping             0.4000000          :
          ...................................................

 iter      E             dE          RMSdq      gap      omega  full diag
   1   -218.5014163 -0.218501E+03  0.661E-01    0.73       0.0  T
   2   -218.5251795 -0.237632E-01  0.659E-01    1.02       1.0  T
   3   -218.5967581 -0.715786E-01  0.326E-01    1.43       1.0  T
   4   -218.5990185 -0.226043E-02  0.262E-01    1.39       1.0  T
   5   -218.6122615 -0.132430E-01  0.155E-01    1.40       1.0  T
   6   -218.6128144 -0.552863E-03  0.144E-01    1.41       1.0  T
   7   -218.6102800  0.253442E-02  0.165E-01    1.41       1.0  T
   8   -218.6149451 -0.466517E-02  0.115E-01    1.42       1.0  T
   9   -218.6191001 -0.415498E-02  0.100E-02    1.42       1.0  T
  10   -218.6191146 -0.144957E-04  0.796E-03    1.42       1.3  T
  11   -218.6191281 -0.134566E-04  0.309E-03    1.42       3.3  T
  12   -218.6191303 -0.222014E-05  0.866E-04    1.42      11.7  T
  13   -218.6191296  0.652197E-06  0.161E-03    1.42       6.3  T
  14   -218.6191305 -0.837689E-06  0.212E-04    1.42      47.8  T
  15   -218.6191305 -0.700985E-08  0.126E-04    1.42      80.6  T
  16   -218.6191305 -0.464948E-08  0.374E-05    1.42     271.5  T

   *** convergence criteria satisfied after 16 iterations ***

         #    Occupation            Energy/Eh            Energy/eV
      -------------------------------------------------------------
         1        2.0000           -1.3824878             -37.6194
       ...           ...                  ...                  ...
       166        2.0000           -0.4870727             -13.2539
       167        2.0000           -0.4854383             -13.2094
       168        2.0000           -0.4791020             -13.0370
       169        2.0000           -0.4770965             -12.9825
       170        2.0000           -0.4709939             -12.8164
       171        1.8914           -0.4607125             -12.5366
       172        1.1086           -0.4567133             -12.4278 (HOMO)
       173                         -0.4046479             -11.0110 (LUMO)
       174                         -0.3964999             -10.7893
       175                         -0.3881104             -10.5610
       176                         -0.3793397             -10.3224
       177                         -0.3579871              -9.7413
       ...                                ...                  ...
       443                        547.0748821           14886.6653
      -------------------------------------------------------------
                  HL-Gap            0.0520654 Eh            1.4168 eV
             Fermi-level           -0.4446968 Eh          -12.1008 eV

 SCC (total)                   0 d,  0 h,  0 min,  1.629 sec
 SCC setup                      ...        0 min,  0.004 sec (  0.232%)
 Dispersion                     ...        0 min,  0.000 sec (  0.011%)
 integral evaluation            ...        0 min,  0.865 sec ( 53.101%)
 zeroth order Hamiltonian       ...        0 min,  0.003 sec (  0.185%)
 iterations                     ...        0 min,  0.503 sec ( 30.865%)
 molecular gradient             ...        0 min,  0.250 sec ( 15.331%)
 printout                       ...        0 min,  0.004 sec (  0.272%)

         :::::::::::::::::::::::::::::::::::::::::::::::::::::
         ::                     SUMMARY                     ::
         :::::::::::::::::::::::::::::::::::::::::::::::::::::
         :: total energy            -215.024973372379 Eh    ::
         :: gradient norm              0.219512421085 Eh/a0 ::
         :: HOMO-LUMO gap              1.416771884475 eV    ::
         ::.................................................::
         :: SCC energy              -218.619130495907 Eh    ::
         :: -> electrostatic           0.260166190709 Eh    ::
         :: repulsion energy           3.689360862848 Eh    ::
         :: dispersion energy         -0.095203739320 Eh    ::
         :: halogen bond corr.         0.000000000000 Eh    ::
         :: add. restraining           0.000000000000 Eh    ::
         :::::::::::::::::::::::::::::::::::::::::::::::::::::

------------------------------------------------------------------------
empirical IP shift (eV):    4.8455
delta SCC IP (eV):    6.4989
------------------------------------------------------------------------
           ------------------------------------------------- 
          |        vertical delta SCC EA calculation        |
           ------------------------------------------------- 

          ...................................................
          :                      SETUP                      :
          :.................................................:
          :  # basis functions                 452          :
          :  # atomic orbitals                 443          :
          :  # shells                          265          :
          :  # electrons                       345          :
          :  # halogen bonds                    16          :
          :  max. iterations                   250          :
          :  Hamiltonian                  GFN1-xTB          :
          :  restarted?                       true          :
          :  GBSA solvation                  false          :
          :  PC potential                    false          :
          :  electronic temp.          300.0000000     K    :
          :  accuracy                    1.0000000          :
          :  -> integral cutoff          0.2500000E+02      :
          :  -> integral neglect         0.1000000E-07      :
          :  -> SCF convergence          0.1000000E-05 Eh   :
          :  -> wf. convergence          0.2000000E-04 e    :
          :  Broyden damping             0.4000000          :
          ...................................................

 iter      E             dE          RMSdq      gap      omega  full diag
   1   -219.3034570 -0.219303E+03  0.337E-01    0.22       0.0  T
   2   -219.3126027 -0.914573E-02  0.341E-01    0.17       1.0  T
   3   -219.2990381  0.135646E-01  0.290E-01    0.22       1.0  T
   4   -219.3105341 -0.114960E-01  0.248E-01    0.35       1.0  T
   5   -219.3331252 -0.225911E-01  0.120E-01    0.18       1.0  T
   6   -219.3360717 -0.294650E-02  0.535E-02    0.13       1.0  T
   7   -219.3365953 -0.523603E-03  0.237E-02    0.14       1.0  T
   8   -219.3367073 -0.112025E-03  0.115E-02    0.14       1.0  T
   9   -219.3367060  0.137562E-05  0.757E-03    0.14       1.3  T
  10   -219.3367294 -0.234668E-04  0.304E-03    0.14       3.3  T
  11   -219.3367327 -0.323660E-05  0.164E-03    0.14       6.2  T
  12   -219.3367335 -0.858844E-06  0.646E-04    0.14      15.7  T
  13   -219.3367335 -0.245484E-08  0.444E-04    0.14      22.9  T
  14   -219.3367336 -0.881101E-07  0.111E-04    0.14      91.6  T
  15   -219.3367336 -0.299886E-08  0.485E-05    0.14     209.5  T

   *** convergence criteria satisfied after 15 iterations ***

         #    Occupation            Energy/Eh            Energy/eV
      -------------------------------------------------------------
         1        2.0000           -1.2491000             -33.9897
       ...           ...                  ...                  ...
       167        2.0000           -0.3449133              -9.3856
       168        2.0000           -0.3386642              -9.2155
       169        2.0000           -0.3336151              -9.0781
       170        2.0000           -0.3305467              -8.9946
       171        2.0000           -0.3150570              -8.5731
       172        2.0000           -0.3028738              -8.2416
       173        0.9344           -0.2650074              -7.2112 (HOMO)
       174        0.0655           -0.2599584              -7.0738 (LUMO)
       175        0.0000           -0.2521220              -6.8606
       176                         -0.2434711              -6.6252
       177                         -0.2251659              -6.1271
       178                         -0.2119708              -5.7680
       ...                                ...                  ...
       443                        547.2163321           14890.5143
      -------------------------------------------------------------
                  HL-Gap            0.0050490 Eh            0.1374 eV
             Fermi-level           -0.2732130 Eh           -7.4345 eV

 SCC (total)                   0 d,  0 h,  0 min,  1.597 sec
 SCC setup                      ...        0 min,  0.004 sec (  0.233%)
 Dispersion                     ...        0 min,  0.000 sec (  0.013%)
 integral evaluation            ...        0 min,  0.863 sec ( 54.059%)
 zeroth order Hamiltonian       ...        0 min,  0.003 sec (  0.209%)
 iterations                     ...        0 min,  0.472 sec ( 29.577%)
 molecular gradient             ...        0 min,  0.250 sec ( 15.628%)
 printout                       ...        0 min,  0.004 sec (  0.279%)

         :::::::::::::::::::::::::::::::::::::::::::::::::::::
         ::                     SUMMARY                     ::
         :::::::::::::::::::::::::::::::::::::::::::::::::::::
         :: total energy            -215.742576502137 Eh    ::
         :: gradient norm              0.217689305750 Eh/a0 ::
         :: HOMO-LUMO gap              0.137389336669 eV    ::
         ::.................................................::
         :: SCC energy              -219.336733625665 Eh    ::
         :: -> electrostatic           0.243198313733 Eh    ::
         :: repulsion energy           3.689360862848 Eh    ::
         :: dispersion energy         -0.095203739320 Eh    ::
         :: halogen bond corr.         0.000000000000 Eh    ::
         :: add. restraining           0.000000000000 Eh    ::
         :::::::::::::::::::::::::::::::::::::::::::::::::::::

------------------------------------------------------------------------
empirical EA shift (eV):    4.8455
delta SCC EA (eV):    3.3370
------------------------------------------------------------------------
           -------------------------------------------------
          |                Property Printout                |
           -------------------------------------------------

    * Orbital Energies and Occupations

         #    Occupation            Energy/Eh            Energy/eV
      -------------------------------------------------------------
         1        2.0000           -1.2491000             -33.9897
       ...           ...                  ...                  ...
       161        2.0000           -0.3728582             -10.1460
       162        2.0000           -0.3694380             -10.0529
       163        2.0000           -0.3655123              -9.9461
       164        2.0000           -0.3627291              -9.8704
       165        2.0000           -0.3593307              -9.7779
       166        2.0000           -0.3493829              -9.5072
       167        2.0000           -0.3449133              -9.3856
       168        2.0000           -0.3386642              -9.2155
       169        2.0000           -0.3336151              -9.0781
       170        2.0000           -0.3305467              -8.9946
       171        2.0000           -0.3150570              -8.5731
       172        2.0000           -0.3028738              -8.2416
       173        0.9344           -0.2650074              -7.2112 (HOMO)
       174        0.0655           -0.2599584              -7.0738 (LUMO)
       175        0.0000           -0.2521220              -6.8606
       176                         -0.2434711              -6.6252
       177                         -0.2251659              -6.1271
       178                         -0.2119708              -5.7680
       179                         -0.2023425              -5.5060
       180                         -0.1904107              -5.1813
       181                         -0.1794417              -4.8829
       182                         -0.1761419              -4.7931
       183                         -0.1744832              -4.7479
       184                         -0.1689143              -4.5964
       ...                                ...                  ...
       443                        547.2163321           14890.5143
      -------------------------------------------------------------
                  HL-Gap            0.0050490 Eh            0.1374 eV
             Fermi-level           -0.2732130 Eh           -7.4345 eV

  Mulliken/CM5 charges        n(s)   n(p)   n(d)
     1 C  -0.08292 -0.04756   0.737  3.180  0.000
     2 O   0.17277  0.12655   1.499  4.674  0.000
     3 C   0.05934  0.05754   1.099  2.960  0.000
     4 C   0.02032 -0.02853   1.098  2.922  0.000
     5 C  -0.05745 -0.06127   1.164  2.778  0.000
     6 Cl  0.14179  0.14092   1.854  5.268  0.019
     7 C  -0.05867 -0.06266   1.164  2.777  0.000
     8 Cl  0.13333  0.13232   1.853  5.265  0.016
     9 C   0.01385 -0.03506   1.076  2.938  0.000
    10 C  -0.00448 -0.00774   1.073  2.922  0.000
    11 C  -0.02059 -0.02128   1.094  2.885  0.000
    12 C  -0.00177  0.00437   1.027  2.971  0.000
    13 C  -0.11270  0.00442   1.202  2.686  0.000
    14 N   0.27522  0.14197   1.503  3.772  0.000
    15 C  -0.10956  0.00947   1.204  2.687  0.000
    16 N   0.28599  0.15581   1.525  3.761  0.000
    17 C  -0.02226 -0.02416   1.117  2.861  0.000
    18 C   0.00563 -0.04253   1.077  2.928  0.000
    19 C  -0.01028 -0.00265   1.125  2.865  0.000
    20 S   0.05999  0.02768   1.886  4.035  0.139
    21 C  -0.00552  0.01224   1.118  2.877  0.000
    22 C  -0.00428  0.00891   1.137  2.859  0.000
    23 C   0.00030 -0.00767   1.085  2.915  0.000
    24 C   0.04096 -0.06509   1.083  2.958  0.000
    25 S   0.06579  0.03313   1.877  4.121  0.069
    26 C  -0.00701  0.01523   1.141  2.852  0.000
    27 C  -0.04895  0.02107   1.059  2.892  0.000
    28 N   0.10705 -0.15069   1.253  3.854  0.000
    29 C  -0.05376  0.01596   1.061  2.885  0.000
    30 C   0.01512  0.02836   1.073  2.942  0.000
    31 C  -0.07016  0.01800   1.148  2.782  0.000
    32 N   0.24623  0.08446   1.472  3.774  0.000
    33 S  -0.16033 -0.02564   1.863  3.673  0.303
    34 N   0.24628  0.08452   1.473  3.774  0.000
    35 C  -0.07010  0.01807   1.149  2.781  0.000
    36 C   0.01573  0.02898   1.073  2.943  0.000
    37 C  -0.05454  0.01527   1.062  2.883  0.000
    38 N   0.10611 -0.15190   1.254  3.852  0.000
    39 C  -0.04888  0.02118   1.060  2.891  0.000
    40 C  -0.00767  0.01457   1.144  2.848  0.000
    41 S   0.06533  0.03270   1.877  4.120  0.068
    42 C  -0.00535  0.00783   1.142  2.853  0.000
    43 C  -0.00695  0.01080   1.123  2.870  0.000
    44 S   0.05941  0.02722   1.890  4.030  0.140
    45 C  -0.01285 -0.00523   1.127  2.860  0.000
    46 C  -0.00400 -0.01197   1.101  2.895  0.000
    47 C   0.05237 -0.05368   1.086  2.967  0.000
    48 C   0.00560 -0.04256   1.076  2.930  0.000
    49 C   0.02561  0.02372   1.054  2.972  0.000
    50 C  -0.01299 -0.01368   1.090  2.897  0.000
    51 C  -0.00283  0.00331   1.033  2.964  0.000
    52 C  -0.10833  0.01072   1.204  2.688  0.000
    53 N   0.28707  0.15686   1.526  3.762  0.000
    54 C  -0.11017  0.00700   1.207  2.683  0.000
    55 N   0.28303  0.14975   1.510  3.773  0.000
    56 C  -0.00848 -0.01174   1.076  2.916  0.000
    57 C   0.01297 -0.03594   1.076  2.937  0.000
    58 C  -0.06210 -0.06608   1.167  2.771  0.000
    59 Cl  0.12192  0.12090   1.852  5.255  0.015
    60 C  -0.05718 -0.06100   1.159  2.784  0.000
    61 Cl  0.13030  0.12943   1.854  5.258  0.018
    62 C   0.01006 -0.03878   1.084  2.926  0.000
    63 C   0.00430  0.00250   1.090  2.914  0.000
    64 C  -0.14800 -0.11263   1.164  2.688  0.000
    65 O   0.31149  0.26530   1.651  4.661  0.000
    66 C  -0.03526 -0.08435   1.089  2.876  0.000
    67 C  -0.03556 -0.08464   1.088  2.876  0.000
    68 C   0.05620 -0.09146   1.066  2.990  0.000
    69 C   0.05663 -0.09115   1.066  2.990  0.000
    70 C   0.20116  0.04969   1.059  3.143  0.000
    71 C   0.51436  0.36288   0.978  3.536  0.000
    72 H  -0.03625  0.02341   0.964  0.000  0.000
    73 H  -0.04019  0.02511   0.960  0.000  0.000
    74 H  -0.05352  0.01708   0.946  0.000  0.000
    75 H  -0.01283  0.04497   0.987  0.000  0.000
    76 H  -0.00119  0.05643   0.999  0.000  0.000
    77 H   0.01347  0.07144   1.013  0.000  0.000
    78 H   0.01699  0.07462   1.017  0.000  0.000
    79 H  -0.02562  0.04506   0.974  0.000  0.000
    80 H  -0.04384  0.02149   0.956  0.000  0.000
    81 H  -0.05449  0.00517   0.946  0.000  0.000
    82 H  -0.04028  0.02986   0.960  0.000  0.000
    83 H  -0.04177  0.02650   0.958  0.000  0.000
    84 H  -0.04030  0.02999   0.960  0.000  0.000
    85 H  -0.04454  0.02398   0.955  0.000  0.000
    86 H  -0.03065  0.02182   0.969  0.000  0.000
    87 H  -0.02541  0.03139   0.975  0.000  0.000
    88 H  -0.02037  0.03454   0.980  0.000  0.000
    89 H  -0.02262  0.03438   0.977  0.000  0.000
    90 H  -0.02222  0.03277   0.978  0.000  0.000
    91 H  -0.03002  0.02246   0.970  0.000  0.000
    92 H   0.03582  0.08956   1.036  0.000  0.000
    93 H  -0.01150  0.04067   0.989  0.000  0.000
    94 H  -0.30695 -0.25406   0.693  0.000  0.000
    95 H  -0.27173 -0.21819   0.728  0.000  0.000
    96 H  -0.21324 -0.16112   0.787  0.000  0.000
    97 H  -0.26447 -0.21161   0.736  0.000  0.000
(R)spin-density population

 Mulliken population n(s)   n(p)   n(d)
     1 C   0.0001  -0.000  0.000  0.000
     2 O   0.0030   0.000  0.003  0.000
     3 C   0.0113  -0.000  0.011  0.000
     4 C   0.0028   0.000  0.003  0.000
     5 C   0.0152  -0.000  0.015  0.000
     6 Cl  0.0037   0.000  0.002  0.002
     7 C   0.0002   0.000  0.000  0.000
     8 Cl  0.0001   0.000  0.000  0.000
     9 C   0.0153   0.000  0.015  0.000
    10 C   0.0009   0.000  0.001  0.000
    11 C   0.0555   0.000  0.055  0.000
    12 C   0.0536   0.000  0.054  0.000
    13 C   0.0074   0.000  0.007  0.000
    14 N   0.0267   0.000  0.027  0.000
    15 C   0.0064   0.000  0.006  0.000
    16 N   0.0252   0.000  0.025  0.000
    17 C   0.0200  -0.000  0.020  0.000
    18 C   0.0731  -0.000  0.073  0.000
    19 C   0.0035  -0.000  0.004  0.000
    20 S   0.0250  -0.000  0.022  0.003
    21 C   0.0411  -0.000  0.041  0.000
    22 C   0.0013  -0.000  0.001  0.000
    23 C   0.0480  -0.000  0.048  0.000
    24 C   0.0007   0.000  0.001  0.000
    25 S   0.0055   0.000  0.005  0.001
    26 C   0.0104   0.000  0.010  0.000
    27 C   0.0026   0.000  0.003  0.000
    28 N   0.0154   0.000  0.015  0.000
    29 C   0.0220   0.000  0.022  0.000
    30 C   0.0045   0.000  0.004  0.000
    31 C   0.0004   0.000  0.000  0.000
    32 N   0.0074   0.000  0.007  0.000
    33 S   0.0141   0.000  0.011  0.003
    34 N   0.0093   0.000  0.009  0.000
    35 C   0.0011   0.000  0.001  0.000
    36 C   0.0075   0.000  0.007  0.000
    37 C   0.0154   0.000  0.015  0.000
    38 N   0.0144   0.000  0.014  0.000
    39 C   0.0044   0.000  0.004  0.000
    40 C   0.0045   0.000  0.005  0.000
    41 S   0.0037   0.000  0.003  0.000
    42 C   0.0024  -0.000  0.002  0.000
    43 C   0.0265  -0.000  0.026  0.000
    44 S   0.0169  -0.000  0.015  0.002
    45 C   0.0022  -0.000  0.002  0.000
    46 C   0.0304  -0.000  0.030  0.000
    47 C   0.0012   0.000  0.001  0.000
    48 C   0.0488  -0.000  0.049  0.000
    49 C   0.0106  -0.000  0.011  0.000
    50 C   0.0619  -0.000  0.062  0.000
    51 C   0.0551   0.000  0.055  0.000
    52 C   0.0072  -0.000  0.007  0.000
    53 N   0.0265  -0.000  0.026  0.000
    54 C   0.0079   0.000  0.008  0.000
    55 N   0.0277   0.000  0.028  0.000
    56 C   0.0082  -0.000  0.008  0.000
    57 C   0.0165   0.000  0.017  0.000
    58 C   0.0021   0.000  0.002  0.000
    59 Cl  0.0006   0.000  0.000  0.000
    60 C   0.0216   0.000  0.022  0.000
    61 Cl  0.0053   0.000  0.003  0.003
    62 C   0.0018   0.000  0.002  0.000
    63 C   0.0167  -0.000  0.017  0.000
    64 C   0.0034  -0.000  0.003  0.000
    65 O   0.0030  -0.000  0.003  0.000
    66 C   0.0002   0.000  0.000  0.000
    67 C   0.0001   0.000  0.000  0.000
    68 C   0.0009   0.000  0.001  0.000
    69 C   0.0009   0.000  0.001  0.000
    70 C   0.0033   0.001  0.003  0.000
    71 C   0.0035   0.000  0.003  0.000
    72 H   0.0000   0.000  0.000  0.000
    73 H   0.0000   0.000  0.000  0.000
    74 H   0.0000   0.000  0.000  0.000
    75 H   0.0008   0.001  0.000  0.000
    76 H   0.0004   0.000  0.000  0.000
    77 H   0.0004   0.000  0.000  0.000
    78 H   0.0004   0.000  0.000  0.000
    79 H   0.0000   0.000  0.000  0.000
    80 H   0.0000   0.000  0.000  0.000
    81 H   0.0000   0.000  0.000  0.000
    82 H   0.0001   0.000  0.000  0.000
    83 H   0.0004   0.000  0.000  0.000
    84 H   0.0001   0.000  0.000  0.000
    85 H   0.0004   0.000  0.000  0.000
    86 H   0.0000   0.000  0.000  0.000
    87 H   0.0000   0.000  0.000  0.000
    88 H   0.0000   0.000  0.000  0.000
    89 H   0.0000   0.000  0.000  0.000
    90 H   0.0000   0.000  0.000  0.000
    91 H   0.0000   0.000  0.000  0.000
    92 H   0.0000   0.000  0.000  0.000
    93 H   0.0003   0.000  0.000  0.000
    94 H   0.0000   0.000  0.000  0.000
    95 H   0.0001   0.000  0.000  0.000
    96 H   0.0005   0.001  0.000  0.000
    97 H   0.0000   0.000  0.000  0.000

Wiberg/Mayer (AO) data.
largest (>0.10) Wiberg bond orders for each atom
          total WBO             WBO to atom ...
     1  C   2.379        O    2 0.990    C    3 0.807    C   17 0.553
     2  O   1.949        C    1 0.990    C   17 0.369    S   20 0.183    C    3 0.105
     3  C   3.812        C    4 1.422    C   10 1.304    C    1 0.807    C   17 0.117    O    2 0.105
     4  C   3.915        C    3 1.422    C    5 1.396    H   72 0.983
     5  C   3.936        C    4 1.396    C    7 1.380    Cl   6 1.084
     6  Cl  1.189        C    5 1.084
     7  C   3.976        C    9 1.410    C    5 1.380    Cl   8 1.085
     8  Cl  1.193        C    7 1.085
     9  C   3.841        C   10 1.418    C    7 1.410    H   73 0.993
    10  C   3.886        C    9 1.418    C    3 1.304    C   11 1.095
    11  C   3.839        C   12 1.430    C   17 1.207    C   10 1.095
    12  C   3.737        C   11 1.430    C   13 1.159    C   15 1.155
    13  C   4.087        N   14 2.879    C   12 1.159
    14  N   2.851        C   13 2.879
    15  C   4.091        N   16 2.901    C   12 1.155
    16  N   2.916        C   15 2.901
    17  C   3.785        C   18 1.425    C   11 1.207    C    1 0.553    O    2 0.369    C    3 0.117
    18  C   3.739        C   17 1.425    C   19 1.350    H   74 0.956
    19  C   3.869        C   18 1.350    C   23 1.346    S   20 1.128
    20  S   2.637        C   21 1.183    C   19 1.128    O    2 0.183
    21  C   3.814        C   22 1.330    C   27 1.294    S   20 1.183
    22  C   3.877        C   23 1.386    C   21 1.330    S   25 1.145
    23  C   3.788        C   22 1.386    C   19 1.346    C   24 1.017
    24  C   3.909        C   23 1.017    H   75 0.993    H   76 0.993    C   70 0.974
    25  S   2.461        C   26 1.190    C   22 1.145
    26  C   3.886        C   27 1.331    C   30 1.317    S   25 1.190
    27  C   3.856        C   26 1.331    C   21 1.294    N   28 1.165
    28  N   3.122        C   29 1.174    C   27 1.165    C   66 0.969
    29  C   3.809        C   30 1.286    C   37 1.274    N   28 1.174
    30  C   3.869        C   26 1.317    C   29 1.286    C   31 1.207
    31  C   4.029        N   32 1.549    C   30 1.207    C   35 1.191    S   33 0.105
    32  N   2.995        C   31 1.549    S   33 1.388
    33  S   3.102        N   32 1.388    N   34 1.388    C   31 0.105    C   35 0.104
    34  N   2.995        C   35 1.548    S   33 1.388
    35  C   4.029        N   34 1.548    C   36 1.208    C   31 1.191    S   33 0.104
    36  C   3.869        C   40 1.317    C   37 1.284    C   35 1.208
    37  C   3.813        C   36 1.284    C   29 1.274    N   38 1.178
    38  N   3.127        C   37 1.178    C   39 1.164    C   67 0.969
    39  C   3.855        C   40 1.333    C   43 1.292    N   38 1.164
    40  C   3.893        C   39 1.333    C   36 1.317    S   41 1.193
    41  S   2.466        C   40 1.193    C   42 1.145
    42  C   3.884        C   46 1.386    C   43 1.330    S   41 1.145
    43  C   3.836        C   42 1.330    C   39 1.292    S   44 1.203
    44  S   2.643        C   43 1.203    C   45 1.132    O   65 0.141
    45  C   3.873        C   48 1.373    C   46 1.335    S   44 1.132
    46  C   3.823        C   42 1.386    C   45 1.335    C   47 1.024
    47  C   3.886        C   46 1.024    H   77 0.995    H   78 0.992    C   71 0.927
    48  C   3.751        C   49 1.437    C   45 1.373    H   79 0.985
    49  C   3.812        C   48 1.437    C   50 1.185    C   64 1.125
    50  C   3.809        C   51 1.436    C   49 1.185    C   56 1.108
    51  C   3.745        C   50 1.436    C   54 1.159    C   52 1.156
    52  C   4.090        N   53 2.899    C   51 1.156
    53  N   2.907        C   52 2.899
    54  C   4.096        N   55 2.881    C   51 1.159
    55  N   2.851        C   54 2.881
    56  C   3.865        C   57 1.419    C   63 1.306    C   50 1.108
    57  C   3.838        C   56 1.419    C   58 1.410    H   80 0.993
    58  C   3.969        C   57 1.410    C   60 1.375    Cl  59 1.092
    59  Cl  1.201        C   58 1.092
    60  C   3.932        C   62 1.395    C   58 1.375    Cl  61 1.091
    61  Cl  1.194        C   60 1.091
    62  C   3.886        C   63 1.451    C   60 1.395    H   81 0.983
    63  C   3.879        C   62 1.451    C   56 1.306    C   64 1.050
    64  C   3.973        O   65 1.754    C   49 1.125    C   63 1.050
    65  O   2.057        C   64 1.754    S   44 0.141
    66  C   3.879        H   82 1.002    C   69 0.992    H   83 0.989    N   28 0.969
    67  C   3.878        H   84 1.002    C   68 0.992    H   85 0.989    N   38 0.969
    68  C   3.890        H   88 1.001    H   87 0.998    C   67 0.992    H   86 0.992
    69  C   3.890        H   90 1.000    H   89 0.998    C   66 0.992    H   91 0.992
    70  C   3.771        H   92 1.031    C   24 0.974    H   93 0.960    H   94 0.861
    71  C   3.556        C   47 0.927    H   96 0.917    H   97 0.879    H   95 0.869
    72  H   1.039        C    4 0.983
    73  H   1.057        C    9 0.993
    74  H   1.069        C   18 0.956
    75  H   1.046        C   24 0.993
    76  H   1.062        C   24 0.993
    77  H   1.066        C   47 0.995
    78  H   1.061        C   47 0.992
    79  H   1.085        C   48 0.985
    80  H   1.055        C   57 0.993
    81  H   1.021        C   62 0.983
    82  H   1.039        C   66 1.002
    83  H   1.037        C   66 0.989
    84  H   1.038        C   67 1.002
    85  H   1.034        C   67 0.989
    86  H   1.029        C   68 0.992
    87  H   1.043        C   68 0.998
    88  H   1.041        C   68 1.001
    89  H   1.049        C   69 0.998
    90  H   1.040        C   69 1.000
    91  H   1.031        C   69 0.992
    92  H   1.074        C   70 1.031
    93  H   0.950        C   70 0.960
    94  H   0.930        C   70 0.861
    95  H   0.949        C   71 0.869
    96  H   0.928        C   71 0.917
    97  H   0.945        C   71 0.879

 dipole moment from electron density (au)
     X       Y       Z   
  -2.9531 -12.7332   3.4033  total (Debye):   34.331


           -------------------------------------------------
          | TOTAL ENERGY             -215.742576502137 Eh   |
          | GRADIENT NORM               0.217689305750 Eh/α |
          | HOMO-LUMO GAP               0.137389336669 eV   |
           -------------------------------------------------

------------------------------------------------------------------------
 * finished run on 2021/12/02 at 16:35:51.873     
------------------------------------------------------------------------
 total:
 * wall-time:     0 d,  0 h,  0 min,  6.270 sec
 *  cpu-time:     0 d,  0 h,  0 min,  6.245 sec
 * ratio c/w:     0.996 speedup
 SCF:
 * wall-time:     0 d,  0 h,  0 min,  5.379 sec
 *  cpu-time:     0 d,  0 h,  0 min,  5.366 sec
 * ratio c/w:     0.997 speedup

