      -----------------------------------------------------------      
     |                   =====================                   |     
     |                           x T B                           |     
     |                   =====================                   |     
     |                         S. Grimme                         |     
     |          Mulliken Center for Theoretical Chemistry        |     
     |                    University of Bonn                     |     
     |                Version 6.2 RC2 (SAW190805)                |     
      -----------------------------------------------------------      

   This program is distributed in the hope that it will be useful,
   but WITHOUT ANY WARRANTY; without even the implied warranty of
   MERCHANTABILITY or FITNESS FOR A PARTICULAR PURPOSE.
   
   FOR NON-COMMERCIAL, ACADEMIA USE ONLY.
   
   Cite this work as:
   * S. Grimme, C. Bannwarth, P. Shushkov, J. Chem. Theory Comput., 2017,
     13, 1989-2009. DOI: 10.1021/acs.jctc.7b00118
   * C. Bannwarth, S. Ehlert and S. Grimme., J. Chem. Theory Comput., 2019,
     15, 1652-1671. DOI: 10.1021/acs.jctc.8b01176
   * P. Pracht, E. Caldeweyher, S. Ehlert, S. Grimme, ChemRxiv, 2019, preprint.
     DOI: 10.26434/chemrxiv.8326202.v1
   
   for DFT-D4:
   * E. Caldeweyher, C. Bannwarth and S. Grimme, J. Chem. Phys., 2017,
     147, 034112. DOI: 10.1063/1.4993215
   * E. Caldeweyher, S. Ehlert, A. Hansen, H. Neugebauer, S. Spicher,
     C. Bannwarth and S. Grimme, J. Chem. Phys., 2019, 150, 154122.
     DOI: 10.1063/1.5090222
   
   for sTDA-xTB:
   * S. Grimme and C. Bannwarth, J. Chem. Phys., 2016, 145, 054103.
     DOI: 10.1063/1.4959605
   
   in the mass-spec context:
   * V. Asgeirsson, C. Bauer and S. Grimme, Chem. Sci., 2017, 8, 4879.
     DOI: 10.1039/c7sc00601b
   
   for metadynamics refer to:
   * S. Grimme, J. Chem. Theory Comput., 2019, 155, 2847-2862
     DOI: 10.1021/acs.jctc.9b00143
   
   with help from (in alphabetical order)
   C. Bannwarth, F. Bohle, G. Brandenburg, E. Caldeweyher, M. Checinski,
   S. Dohm, S. Ehlert, S. Ehrlich, F. März, H. Neugebauer, J. Pisarek,
   P. Pracht, P. Shushkov, and S. Spicher.
   
 * started run on 2021/12/02 at 16:36:19.968     

           -------------------------------------------------
          |                Calculation Setup                |
           -------------------------------------------------

          program call               : /ihome/ghutchison/geoffh/xtb/xtb CBM.xyz --vipea
          hostname                   : smp-n128
          coordinate file            : CBM.xyz
          omp threads                :                     1
          number of atoms            :                    62
          number of electrons        :                   210
          charge                     :                     0
          spin                       :                   0.0
          first test random number   :      0.81048911711740


########################################################################
# WARNING! Please study the warnings concerning your input carefully
#  - XTBPATH is not set, using XTBHOME instead
########################################################################

           ------------------------------------------------- 
          |                 I P E A - x T B                 |
          |  Ionisation Potentials and Electron Affinities  |
           ------------------------------------------------- 
             KAB for M(3d)-M(3d) :                1.1000
             KAB for M(4d)-M(4d) :                1.2000
             KAB for M(5d)-M(5d) :                1.2000
             k(s)                :                2.1500
             k(p)                :                2.3000
             k(d)                :                2.0000
             k(f)                :                0.0000
             kEN (H0ij)          :                0.7000
             D3 a1               :                0.6300
             D3 a2               :                5.0000
             D3 s6               :                1.0000
             D3 s8               :                2.4000
             D3 s9               :                0.0000
             alphaj              :                1.0000
             XBdamp              :                0.4400
             XBrad               :                1.3000
             kcnsh               :      1.0000   -0.3000   -0.5000    0.5000

  Z AO/shell   Hii/eV     exponent
  1     Thu Sep 22 23:34:11 CEST 2016   EN: 2.200 GAM: 0.405  GM3: 0.1500
     1s    -10.521941    1.306199
     2s     -3.560151    0.398421
  6     Thu Sep 22 23:34:11 CEST 2016   EN: 2.550 GAM: 0.640  GM3: 0.1500
     2s    -15.968100    1.979793
     2p     -9.777107    1.850537
     3S     -3.366990    0.633095
  7     Thu Sep 22 23:34:11 CEST 2016   EN: 3.040 GAM: 0.493  GM3:-0.1000
     2s    -24.040776    2.126160
     2p    -14.426520    2.068425
     3S     -5.882278    0.671040
 16     Tue Jan 17 20:57:36 CET 2017    EN: 2.580 GAM: 0.455  GM3: 0.1020
     3s    -24.488821    2.492075
     3p    -12.136640    1.997904
     3d     -1.796070    1.747541

           ------------------------------------------------- 
          |        Self-Consistent Charge Iterations        |
           ------------------------------------------------- 

          ...................................................
          :                      SETUP                      :
          :.................................................:
          :  # basis functions                 269          :
          :  # atomic orbitals                 267          :
          :  # shells                          169          :
          :  # electrons                       210          :
          :  # halogen bonds                     0          :
          :  max. iterations                   250          :
          :  Hamiltonian                  GFN1-xTB          :
          :  restarted?                      false          :
          :  GBSA solvation                  false          :
          :  PC potential                    false          :
          :  electronic temp.          300.0000000     K    :
          :  accuracy                    1.0000000          :
          :  -> integral cutoff          0.2500000E+02      :
          :  -> integral neglect         0.1000000E-07      :
          :  -> SCF convergence          0.1000000E-05 Eh   :
          :  -> wf. convergence          0.2000000E-04 e    :
          :  Broyden damping             0.4000000          :
          ...................................................

 iter      E             dE          RMSdq      gap      omega  full diag
   1   -137.0991631 -0.137099E+03  0.109E+01    1.20       0.0  T
   2   -136.8934755  0.205688E+00  0.701E+00    1.03       1.0  T
   3   -134.5524502  0.234103E+01  0.631E+00    1.71       1.0  T
   4   -137.4593179 -0.290687E+01  0.226E+00    0.67       1.0  T
   5   -138.1036196 -0.644302E+00  0.557E-01    0.27       1.0  T
   6   -138.0566256  0.469939E-01  0.807E-01    0.23       1.0  T
   7   -138.1425688 -0.859432E-01  0.187E-01    0.15       1.0  T
   8   -138.1437087 -0.113990E-02  0.121E-01    0.09       1.0  T
   9   -138.1453410 -0.163222E-02  0.692E-02    0.13       1.0  T
  10   -138.1455306 -0.189662E-03  0.449E-02    0.12       1.0  T
  11   -138.1457488 -0.218220E-03  0.253E-02    0.12       1.0  T
  12   -138.1458022 -0.533332E-04  0.134E-02    0.12       1.0  T
  13   -138.1458215 -0.193635E-04  0.336E-03    0.11       3.8  T
  14   -138.1458226 -0.110376E-05  0.132E-03    0.11       9.6  T
  15   -138.1458228 -0.124935E-06  0.811E-04    0.11      15.7  T
  16   -138.1458228 -0.164741E-07  0.668E-04    0.11      19.0  T
  17   -138.1458228 -0.414398E-07  0.307E-04    0.11      41.4  T
  18   -138.1458228 -0.960617E-08  0.103E-04    0.11     123.7  T
  19   -138.1458228 -0.929191E-09  0.456E-05    0.11     278.5  T

   *** convergence criteria satisfied after 19 iterations ***

         #    Occupation            Energy/Eh            Energy/eV
      -------------------------------------------------------------
         1        2.0000           -1.4539642             -39.5644
       ...           ...                  ...                  ...
        99        2.0000           -0.4287580             -11.6671
       100        2.0000           -0.4220946             -11.4858
       101        2.0000           -0.4181500             -11.3784
       102        2.0000           -0.4122079             -11.2167
       103        2.0000           -0.4042117             -10.9992
       104        2.0000           -0.3973541             -10.8126
       105        1.8022           -0.3654333              -9.9439 (HOMO)
       106        0.1978           -0.3612352              -9.8297 (LUMO)
       107                         -0.3268161              -8.8931
       108                         -0.3113645              -8.4727
       109                         -0.2813272              -7.6553
       110                         -0.2732668              -7.4360
       ...                                ...                  ...
       267                        534.2811577           14538.5303
      -------------------------------------------------------------
                  HL-Gap            0.0041981 Eh            0.1142 eV
             Fermi-level           -0.3633342 Eh           -9.8868 eV

 SCC (total)                   0 d,  0 h,  0 min,  0.631 sec
 SCC setup                      ...        0 min,  0.002 sec (  0.271%)
 Dispersion                     ...        0 min,  0.000 sec (  0.020%)
 integral evaluation            ...        0 min,  0.325 sec ( 51.449%)
 zeroth order Hamiltonian       ...        0 min,  0.001 sec (  0.231%)
 iterations                     ...        0 min,  0.185 sec ( 29.318%)
 molecular gradient             ...        0 min,  0.116 sec ( 18.458%)
 printout                       ...        0 min,  0.002 sec (  0.243%)

         :::::::::::::::::::::::::::::::::::::::::::::::::::::
         ::                     SUMMARY                     ::
         :::::::::::::::::::::::::::::::::::::::::::::::::::::
         :: total energy            -135.529402928077 Eh    ::
         :: gradient norm              0.358156950192 Eh/a0 ::
         :: HOMO-LUMO gap              0.114237258318 eV    ::
         ::.................................................::
         :: SCC energy              -138.145822838693 Eh    ::
         :: -> electrostatic           0.270161333559 Eh    ::
         :: repulsion energy           2.668023214417 Eh    ::
         :: dispersion energy         -0.051603303802 Eh    ::
         :: halogen bond corr.         0.000000000000 Eh    ::
         :: add. restraining           0.000000000000 Eh    ::
         :::::::::::::::::::::::::::::::::::::::::::::::::::::

           ------------------------------------------------- 
          |        vertical delta SCC IP calculation        |
           ------------------------------------------------- 

          ...................................................
          :                      SETUP                      :
          :.................................................:
          :  # basis functions                 269          :
          :  # atomic orbitals                 267          :
          :  # shells                          169          :
          :  # electrons                       209          :
          :  # halogen bonds                     0          :
          :  max. iterations                   250          :
          :  Hamiltonian                  GFN1-xTB          :
          :  restarted?                       true          :
          :  GBSA solvation                  false          :
          :  PC potential                    false          :
          :  electronic temp.          300.0000000     K    :
          :  accuracy                    1.0000000          :
          :  -> integral cutoff          0.2500000E+02      :
          :  -> integral neglect         0.1000000E-07      :
          :  -> SCF convergence          0.1000000E-05 Eh   :
          :  -> wf. convergence          0.2000000E-04 e    :
          :  Broyden damping             0.4000000          :
          ...................................................

 iter      E             dE          RMSdq      gap      omega  full diag
   1   -137.6932561 -0.137693E+03  0.406E-01    0.11       0.0  T
   2   -137.5367489  0.156507E+00  0.859E-01    0.27       1.0  T
   3   -137.7233053 -0.186556E+00  0.213E-01    0.24       1.0  T
   4   -137.7294683 -0.616306E-02  0.124E-01    0.20       1.0  T
   5   -137.7285517  0.916638E-03  0.101E-01    0.15       1.0  T
   6   -137.7299253 -0.137357E-02  0.623E-02    0.19       1.0  T
   7   -137.7304455 -0.520234E-03  0.214E-02    0.18       1.0  T
   8   -137.7305285 -0.829636E-04  0.830E-03    0.18       1.5  T
   9   -137.7305361 -0.765934E-05  0.478E-03    0.18       2.7  T
  10   -137.7305383 -0.213309E-05  0.239E-03    0.18       5.3  T
  11   -137.7305388 -0.584089E-06  0.103E-03    0.18      12.3  T
  12   -137.7305388 -0.935117E-08  0.726E-04    0.18      17.5  T
  13   -137.7305389 -0.786858E-07  0.280E-04    0.18      45.4  T
  14   -137.7305389 -0.507168E-08  0.962E-05    0.18     132.1  T
  15   -137.7305389 -0.132806E-08  0.495E-05    0.18     256.4  T

   *** convergence criteria satisfied after 15 iterations ***

         #    Occupation            Energy/Eh            Energy/eV
      -------------------------------------------------------------
         1        2.0000           -1.5534236             -42.2708
       ...           ...                  ...                  ...
        99        2.0000           -0.5151817             -14.0188
       100        2.0000           -0.5063310             -13.7780
       101        2.0000           -0.5011981             -13.6383
       102        2.0000           -0.4992293             -13.5847
       103        2.0000           -0.4902398             -13.3401
       104        1.9999           -0.4818273             -13.1112
       105        0.9727           -0.4634317             -12.6106 (HOMO)
       106        0.0274           -0.4566470             -12.4260 (LUMO)
       107                         -0.4038844             -10.9903
       108                         -0.3979319             -10.8283
       109                         -0.3568228              -9.7096
       110                         -0.3552011              -9.6655
       ...                                ...                  ...
       267                        534.1933096           14536.1398
      -------------------------------------------------------------
                  HL-Gap            0.0067847 Eh            0.1846 eV
             Fermi-level           -0.4663346 Eh          -12.6896 eV

 SCC (total)                   0 d,  0 h,  0 min,  0.586 sec
 SCC setup                      ...        0 min,  0.001 sec (  0.239%)
 Dispersion                     ...        0 min,  0.000 sec (  0.014%)
 integral evaluation            ...        0 min,  0.324 sec ( 55.314%)
 zeroth order Hamiltonian       ...        0 min,  0.001 sec (  0.225%)
 iterations                     ...        0 min,  0.141 sec ( 24.119%)
 molecular gradient             ...        0 min,  0.116 sec ( 19.830%)
 printout                       ...        0 min,  0.001 sec (  0.250%)

         :::::::::::::::::::::::::::::::::::::::::::::::::::::
         ::                     SUMMARY                     ::
         :::::::::::::::::::::::::::::::::::::::::::::::::::::
         :: total energy            -135.114119023562 Eh    ::
         :: gradient norm              0.346088770906 Eh/a0 ::
         :: HOMO-LUMO gap              0.184620802435 eV    ::
         ::.................................................::
         :: SCC energy              -137.730538934177 Eh    ::
         :: -> electrostatic           0.302572925167 Eh    ::
         :: repulsion energy           2.668023214417 Eh    ::
         :: dispersion energy         -0.051603303802 Eh    ::
         :: halogen bond corr.         0.000000000000 Eh    ::
         :: add. restraining           0.000000000000 Eh    ::
         :::::::::::::::::::::::::::::::::::::::::::::::::::::

------------------------------------------------------------------------
empirical IP shift (eV):    4.8455
delta SCC IP (eV):    6.4549
------------------------------------------------------------------------
           ------------------------------------------------- 
          |        vertical delta SCC EA calculation        |
           ------------------------------------------------- 

          ...................................................
          :                      SETUP                      :
          :.................................................:
          :  # basis functions                 269          :
          :  # atomic orbitals                 267          :
          :  # shells                          169          :
          :  # electrons                       211          :
          :  # halogen bonds                     0          :
          :  max. iterations                   250          :
          :  Hamiltonian                  GFN1-xTB          :
          :  restarted?                       true          :
          :  GBSA solvation                  false          :
          :  PC potential                    false          :
          :  electronic temp.          300.0000000     K    :
          :  accuracy                    1.0000000          :
          :  -> integral cutoff          0.2500000E+02      :
          :  -> integral neglect         0.1000000E-07      :
          :  -> SCF convergence          0.1000000E-05 Eh   :
          :  -> wf. convergence          0.2000000E-04 e    :
          :  Broyden damping             0.4000000          :
          ...................................................

 iter      E             dE          RMSdq      gap      omega  full diag
   1   -138.3587303 -0.138359E+03  0.632E-01    1.44       0.0  T
   2   -137.9284119  0.430318E+00  0.133E+00    0.50       1.0  T
   3   -138.4401085 -0.511697E+00  0.371E-01    0.87       1.0  T
   4   -138.4499365 -0.982796E-02  0.219E-01    0.60       1.0  T
   5   -138.4516220 -0.168551E-02  0.201E-01    0.25       1.0  T
   6   -138.4544933 -0.287126E-02  0.122E-01    0.25       1.0  T
   7   -138.4548342 -0.340922E-03  0.679E-02    0.20       1.0  T
   8   -138.4561353 -0.130110E-02  0.168E-02    0.26       1.0  T
   9   -138.4561750 -0.396579E-04  0.972E-03    0.28       1.3  T
  10   -138.4561806 -0.568708E-05  0.465E-03    0.28       2.7  T
  11   -138.4561832 -0.251015E-05  0.338E-03    0.28       3.8  T
  12   -138.4561843 -0.117179E-05  0.929E-04    0.28      13.7  T
  13   -138.4561844 -0.922605E-07  0.394E-04    0.28      32.2  T
  14   -138.4561844 -0.142772E-07  0.136E-04    0.28      93.2  T
  15   -138.4561844 -0.186148E-08  0.523E-05    0.28     243.0  T

   *** convergence criteria satisfied after 15 iterations ***

         #    Occupation            Energy/Eh            Energy/eV
      -------------------------------------------------------------
         1        2.0000           -1.3526414             -36.8072
       ...           ...                  ...                  ...
       100        2.0000           -0.3398723              -9.2484
       101        2.0000           -0.3288367              -8.9481
       102        2.0000           -0.3274867              -8.9114
       103        2.0000           -0.3202000              -8.7131
       104        2.0000           -0.3055337              -8.3140
       105        1.9920           -0.2695539              -7.3349
       106        1.0033           -0.2603853              -7.0854 (HOMO)
       107        0.0047           -0.2501912              -6.8080 (LUMO)
       108                         -0.2229173              -6.0659
       109                         -0.2096028              -5.7036
       110                         -0.1895690              -5.1584
       111                         -0.1709220              -4.6510
       ...                                ...                  ...
       267                        534.3667391           14540.8591
      -------------------------------------------------------------
                  HL-Gap            0.0101941 Eh            0.2774 eV
             Fermi-level           -0.2601289 Eh           -7.0785 eV

 SCC (total)                   0 d,  0 h,  0 min,  0.584 sec
 SCC setup                      ...        0 min,  0.001 sec (  0.222%)
 Dispersion                     ...        0 min,  0.000 sec (  0.014%)
 integral evaluation            ...        0 min,  0.322 sec ( 55.180%)
 zeroth order Hamiltonian       ...        0 min,  0.001 sec (  0.224%)
 iterations                     ...        0 min,  0.141 sec ( 24.184%)
 molecular gradient             ...        0 min,  0.116 sec ( 19.912%)
 printout                       ...        0 min,  0.001 sec (  0.254%)

         :::::::::::::::::::::::::::::::::::::::::::::::::::::
         ::                     SUMMARY                     ::
         :::::::::::::::::::::::::::::::::::::::::::::::::::::
         :: total energy            -135.839764524288 Eh    ::
         :: gradient norm              0.347815954877 Eh/a0 ::
         :: HOMO-LUMO gap              0.277395961445 eV    ::
         ::.................................................::
         :: SCC energy              -138.456184434903 Eh    ::
         :: -> electrostatic           0.317079544073 Eh    ::
         :: repulsion energy           2.668023214417 Eh    ::
         :: dispersion energy         -0.051603303802 Eh    ::
         :: halogen bond corr.         0.000000000000 Eh    ::
         :: add. restraining           0.000000000000 Eh    ::
         :::::::::::::::::::::::::::::::::::::::::::::::::::::

------------------------------------------------------------------------
empirical EA shift (eV):    4.8455
delta SCC EA (eV):    3.5999
------------------------------------------------------------------------
           -------------------------------------------------
          |                Property Printout                |
           -------------------------------------------------

    * Orbital Energies and Occupations

         #    Occupation            Energy/Eh            Energy/eV
      -------------------------------------------------------------
         1        2.0000           -1.3526414             -36.8072
       ...           ...                  ...                  ...
        94        2.0000           -0.3654107              -9.9433
        95        2.0000           -0.3615285              -9.8377
        96        2.0000           -0.3575609              -9.7297
        97        2.0000           -0.3484402              -9.4815
        98        2.0000           -0.3441512              -9.3648
        99        2.0000           -0.3416915              -9.2979
       100        2.0000           -0.3398723              -9.2484
       101        2.0000           -0.3288367              -8.9481
       102        2.0000           -0.3274867              -8.9114
       103        2.0000           -0.3202000              -8.7131
       104        2.0000           -0.3055337              -8.3140
       105        1.9920           -0.2695539              -7.3349
       106        1.0033           -0.2603853              -7.0854 (HOMO)
       107        0.0047           -0.2501912              -6.8080 (LUMO)
       108                         -0.2229173              -6.0659
       109                         -0.2096028              -5.7036
       110                         -0.1895690              -5.1584
       111                         -0.1709220              -4.6510
       112                         -0.1497843              -4.0758
       113                         -0.1459083              -3.9704
       114                         -0.1386319              -3.7724
       115                         -0.1348017              -3.6681
       116                         -0.1297675              -3.5312
       117                         -0.1273739              -3.4660
       ...                                ...                  ...
       267                        534.3667391           14540.8591
      -------------------------------------------------------------
                  HL-Gap            0.0101941 Eh            0.2774 eV
             Fermi-level           -0.2601289 Eh           -7.0785 eV

  Mulliken/CM5 charges        n(s)   n(p)   n(d)
     1 C  -0.08148 -0.13301   0.644  3.275  0.000
     2 C  -0.16078 -0.21346   0.606  3.233  0.000
     3 C   0.35773  0.36066   0.321  4.037  0.000
     4 C  -0.08546 -0.02183   1.103  2.812  0.000
     5 C   0.04127 -0.00546   1.070  2.971  0.000
     6 C   0.07550  0.06883   1.078  2.998  0.000
     7 C  -0.06981 -0.06688   1.118  2.812  0.000
     8 C  -0.05955  0.00407   1.110  2.831  0.000
     9 N   0.10703 -0.15564   1.301  3.806  0.000
    10 C   0.02714 -0.02567   1.099  2.928  0.000
    11 C   0.04269 -0.01092   1.072  2.971  0.000
    12 C   0.01663  0.00997   1.082  2.935  0.000
    13 C   0.03350 -0.01122   1.065  2.968  0.000
    14 C  -0.02670 -0.07423   1.097  2.876  0.000
    15 C   0.20288  0.05627   1.013  3.190  0.000
    16 C   0.01191  0.01109   1.105  2.906  0.000
    17 C  -0.07312  0.01101   1.145  2.782  0.000
    18 C  -0.06315  0.02161   1.160  2.777  0.000
    19 C   0.03818  0.03588   1.083  2.955  0.000
    20 C   0.14595  0.09354   1.099  3.047  0.000
    21 C   0.17097  0.11762   1.054  3.117  0.000
    22 N   0.23928  0.06785   1.455  3.784  0.000
    23 S  -0.15895 -0.01991   1.854  3.657  0.330
    24 N   0.26369  0.09571   1.470  3.794  0.000
    25 C   0.11178  0.06487   1.104  3.008  0.000
    26 C   0.02152  0.02424   1.056  2.966  0.000
    27 C   0.00018 -0.00063   1.125  2.876  0.000
    28 C  -0.07555  0.00877   1.159  2.765  0.000
    29 C  -0.06236  0.02235   1.160  2.778  0.000
    30 C   0.04042  0.03809   1.086  2.954  0.000
    31 C   0.15681  0.10442   1.082  3.074  0.000
    32 C   0.16746  0.11421   1.066  3.102  0.000
    33 N   0.22482  0.05443   1.485  3.740  0.000
    34 S  -0.15678 -0.01750   1.854  3.662  0.327
    35 N   0.26920  0.10148   1.471  3.798  0.000
    36 C   0.10945  0.06253   1.120  2.989  0.000
    37 C  -0.09756  0.02254   1.215  2.687  0.000
    38 C  -0.09970  0.01879   1.209  2.691  0.000
    39 C   0.02552  0.02824   1.053  2.973  0.000
    40 C  -0.09650  0.02362   1.214  2.689  0.000
    41 C  -0.09746  0.02100   1.214  2.689  0.000
    42 N   0.30784  0.18188   1.532  3.776  0.000
    43 N   0.31275  0.18335   1.530  3.783  0.000
    44 N   0.30548  0.17607   1.530  3.776  0.000
    45 N   0.30167  0.17573   1.533  3.769  0.000
    46 H   0.21930  0.28466   1.219  0.000  0.000
    47 H   0.22954  0.28690   1.230  0.000  0.000
    48 H   0.01714  0.07807   1.017  0.000  0.000
    49 H  -0.01411  0.04318   0.986  0.000  0.000
    50 H   0.00570  0.06431   1.006  0.000  0.000
    51 H  -0.00283  0.06634   0.997  0.000  0.000
    52 H  -0.02334  0.04305   0.977  0.000  0.000
    53 H  -0.01179  0.05438   0.988  0.000  0.000
    54 H   0.02803  0.08272   1.028  0.000  0.000
    55 H  -0.00571  0.04647   0.994  0.000  0.000
    56 H  -0.30981 -0.25443   0.690  0.000  0.000
    57 H  -0.28417 -0.21969   0.716  0.000  0.000
    58 H  -0.31067 -0.25189   0.689  0.000  0.000
    59 H  -0.30810 -0.24311   0.692  0.000  0.000
    60 H  -0.30400 -0.23952   0.696  0.000  0.000
    61 H  -0.29193 -0.23321   0.708  0.000  0.000
    62 H  -0.29760 -0.23261   0.702  0.000  0.000
(R)spin-density population

 Mulliken population n(s)   n(p)   n(d)
     1 C   0.1189   0.001  0.118  0.000
     2 C   0.0818   0.000  0.082  0.000
     3 C   0.0026   0.000  0.003  0.000
     4 C   0.1511  -0.000  0.151  0.000
     5 C   0.2016   0.000  0.202  0.000
     6 C   0.0564   0.000  0.056  0.000
     7 C   0.0378   0.000  0.038  0.000
     8 C   0.0003  -0.000  0.000  0.000
     9 N   0.1282   0.000  0.128  0.000
    10 C   0.0006   0.000  0.000  0.000
    11 C   0.0334   0.000  0.033  0.000
    12 C   0.0004   0.000  0.000  0.000
    13 C   0.0297  -0.000  0.030  0.000
    14 C   0.0022   0.000  0.002  0.000
    15 C   0.0101   0.002  0.008  0.000
    16 C   0.0004   0.000  0.000  0.000
    17 C   0.0002   0.000  0.000  0.000
    18 C   0.0001   0.000  0.000  0.000
    19 C   0.0003   0.000  0.000  0.000
    20 C   0.0006   0.000  0.001  0.000
    21 C   0.0005   0.000  0.000  0.000
    22 N   0.0007  -0.000  0.001  0.000
    23 S   0.0011   0.000  0.001  0.000
    24 N   0.0006  -0.000  0.001  0.000
    25 C   0.0002   0.000  0.000  0.000
    26 C   0.0003   0.000  0.000  0.000
    27 C   0.0010   0.000  0.001  0.000
    28 C   0.0031   0.000  0.003  0.000
    29 C   0.0005  -0.000  0.001  0.000
    30 C   0.0227   0.000  0.023  0.000
    31 C   0.0061   0.000  0.006  0.000
    32 C   0.0319   0.000  0.032  0.000
    33 N   0.0065   0.002  0.004  0.000
    34 S   0.0121  -0.000  0.010  0.002
    35 N   0.0102  -0.000  0.010  0.000
    36 C   0.0064   0.000  0.006  0.000
    37 C   0.0000   0.000  0.000  0.000
    38 C   0.0000  -0.000  0.000  0.000
    39 C   0.0153   0.000  0.015  0.000
    40 C   0.0011   0.000  0.001  0.000
    41 C   0.0013   0.000  0.001  0.000
    42 N   0.0059  -0.000  0.006  0.000
    43 N   0.0063   0.000  0.006  0.000
    44 N   0.0001  -0.000  0.000  0.000
    45 N   0.0001   0.000  0.000  0.000
    46 H   0.0021   0.002  0.000  0.000
    47 H   0.0007   0.001  0.000  0.000
    48 H   0.0002   0.000  0.000  0.000
    49 H   0.0001   0.000  0.000  0.000
    50 H   0.0001   0.000  0.000  0.000
    51 H   0.0001   0.000  0.000  0.000
    52 H   0.0011   0.001  0.000  0.000
    53 H   0.0027   0.003  0.000  0.000
    54 H   0.0001   0.000  0.000  0.000
    55 H   0.0008   0.001  0.000  0.000
    56 H   0.0001   0.000  0.000  0.000
    57 H   0.0000   0.000  0.000  0.000
    58 H   0.0000   0.000  0.000  0.000
    59 H   0.0000   0.000  0.000  0.000
    60 H   0.0003   0.000  0.000  0.000
    61 H   0.0005   0.000  0.000  0.000
    62 H   0.0000   0.000  0.000  0.000

Wiberg/Mayer (AO) data.
largest (>0.10) Wiberg bond orders for each atom
          total WBO             WBO to atom ...
     1  C   2.280        C    6 1.023    H   46 0.767    C    2 0.337
     2  C   2.236        H   47 0.867    C    3 0.432    C    1 0.337    C    7 0.306    C    6 0.101
     3  C   1.951        C    4 1.001    C    7 0.547    C    2 0.432
     4  C   3.759        C    5 1.289    N    9 1.219    C    3 1.001    C    7 0.103
     5  C   3.576        C    6 1.352    C    4 1.289    H   48 0.997
     6  C   3.682        C    5 1.352    C   27 1.148    C    1 1.023    C    2 0.101
     7  C   3.807        C   10 1.392    C    8 1.277    C    3 0.547    C    2 0.306    C    4 0.103
     8  C   3.947        C   13 1.425    C    7 1.277    N    9 1.149
     9  N   3.195        C    4 1.219    C    8 1.149    C   14 0.977
    10  C   3.901        C   11 1.492    C    7 1.392    H   49 0.989
    11  C   3.820        C   10 1.492    C   12 1.335    H   50 0.988
    12  C   3.874        C   13 1.394    C   11 1.335    C   16 1.126
    13  C   3.782        C    8 1.425    C   12 1.394    H   51 1.007
    14  C   3.900        H   53 0.996    H   52 0.996    N    9 0.977    C   15 0.976
    15  C   3.739        H   54 1.020    H   55 0.979    C   14 0.976    H   56 0.850
    16  C   3.857        C   21 1.462    C   17 1.236    C   12 1.126
    17  C   3.994        N   22 1.494    C   16 1.236    C   18 1.194    S   23 0.111
    18  C   4.012        N   24 1.502    C   19 1.214    C   17 1.194    S   23 0.100
    19  C   3.894        C   20 1.416    C   25 1.226    C   18 1.214
    20  C   3.707        C   19 1.416    C   21 1.401    H   57 0.871
    21  C   3.721        C   16 1.462    C   20 1.401    H   58 0.841
    22  N   2.943        C   17 1.494    S   23 1.442
    23  S   3.197        N   22 1.442    N   24 1.424    C   17 0.111    C   18 0.100
    24  N   2.971        C   18 1.502    S   23 1.424
    25  C   3.751        C   26 1.550    C   19 1.226    H   59 0.863
    26  C   3.841        C   25 1.550    C   38 1.154    C   37 1.130
    27  C   3.896        C   32 1.438    C   28 1.218    C    6 1.148
    28  C   4.020        N   33 1.508    C   27 1.218    C   29 1.196    S   34 0.114
    29  C   4.013        N   35 1.507    C   30 1.208    C   28 1.196    S   34 0.102
    30  C   3.891        C   31 1.407    C   36 1.239    C   29 1.208
    31  C   3.697        C   32 1.413    C   30 1.407    H   60 0.837
    32  C   3.707        C   27 1.438    C   31 1.413    H   61 0.852
    33  N   3.039        C   28 1.508    S   34 1.458
    34  S   3.220        N   33 1.458    N   35 1.420    C   28 0.114    C   29 0.102
    35  N   2.979        C   29 1.507    S   34 1.420
    36  C   3.758        C   39 1.535    C   30 1.239    H   62 0.868
    37  C   4.117        N   45 2.912    C   26 1.130
    38  C   4.092        N   44 2.894    C   26 1.154
    39  C   3.831        C   36 1.535    C   41 1.157    C   40 1.135
    40  C   4.113        N   42 2.906    C   39 1.135
    41  C   4.099        N   43 2.880    C   39 1.157
    42  N   2.939        C   40 2.906
    43  N   2.942        C   41 2.880
    44  N   2.946        C   38 2.894
    45  N   2.942        C   37 2.912
    46  H   1.011        C    1 0.767    H   47 0.109
    47  H   1.008        C    2 0.867    H   46 0.109
    48  H   1.061        C    5 0.997
    49  H   1.063        C   10 0.989
    50  H   1.072        C   11 0.988
    51  H   1.077        C   13 1.007
    52  H   1.038        C   14 0.996
    53  H   1.057        C   14 0.996
    54  H   1.067        C   15 1.020
    55  H   1.001        C   15 0.979
    56  H   0.924        C   15 0.850
    57  H   0.956        C   20 0.871
    58  H   0.928        C   21 0.841
    59  H   0.921        C   25 0.863
    60  H   0.956        C   31 0.837
    61  H   0.943        C   32 0.852
    62  H   0.937        C   36 0.868

 dipole moment from electron density (au)
     X       Y       Z   
   3.1564  -0.8451   0.1362  total (Debye):    8.313


           -------------------------------------------------
          | TOTAL ENERGY             -135.839764524288 Eh   |
          | GRADIENT NORM               0.347815954877 Eh/α |
          | HOMO-LUMO GAP               0.277395961445 eV   |
           -------------------------------------------------

------------------------------------------------------------------------
 * finished run on 2021/12/02 at 16:36:22.115     
------------------------------------------------------------------------
 total:
 * wall-time:     0 d,  0 h,  0 min,  2.146 sec
 *  cpu-time:     0 d,  0 h,  0 min,  2.135 sec
 * ratio c/w:     0.994 speedup
 SCF:
 * wall-time:     0 d,  0 h,  0 min,  1.802 sec
 *  cpu-time:     0 d,  0 h,  0 min,  1.797 sec
 * ratio c/w:     0.997 speedup

