      -----------------------------------------------------------      
     |                   =====================                   |     
     |                           x T B                           |     
     |                   =====================                   |     
     |                         S. Grimme                         |     
     |          Mulliken Center for Theoretical Chemistry        |     
     |                    University of Bonn                     |     
     |                Version 6.2 RC2 (SAW190805)                |     
      -----------------------------------------------------------      

   This program is distributed in the hope that it will be useful,
   but WITHOUT ANY WARRANTY; without even the implied warranty of
   MERCHANTABILITY or FITNESS FOR A PARTICULAR PURPOSE.
   
   FOR NON-COMMERCIAL, ACADEMIA USE ONLY.
   
   Cite this work as:
   * S. Grimme, C. Bannwarth, P. Shushkov, J. Chem. Theory Comput., 2017,
     13, 1989-2009. DOI: 10.1021/acs.jctc.7b00118
   * C. Bannwarth, S. Ehlert and S. Grimme., J. Chem. Theory Comput., 2019,
     15, 1652-1671. DOI: 10.1021/acs.jctc.8b01176
   * P. Pracht, E. Caldeweyher, S. Ehlert, S. Grimme, ChemRxiv, 2019, preprint.
     DOI: 10.26434/chemrxiv.8326202.v1
   
   for DFT-D4:
   * E. Caldeweyher, C. Bannwarth and S. Grimme, J. Chem. Phys., 2017,
     147, 034112. DOI: 10.1063/1.4993215
   * E. Caldeweyher, S. Ehlert, A. Hansen, H. Neugebauer, S. Spicher,
     C. Bannwarth and S. Grimme, J. Chem. Phys., 2019, 150, 154122.
     DOI: 10.1063/1.5090222
   
   for sTDA-xTB:
   * S. Grimme and C. Bannwarth, J. Chem. Phys., 2016, 145, 054103.
     DOI: 10.1063/1.4959605
   
   in the mass-spec context:
   * V. Asgeirsson, C. Bauer and S. Grimme, Chem. Sci., 2017, 8, 4879.
     DOI: 10.1039/c7sc00601b
   
   for metadynamics refer to:
   * S. Grimme, J. Chem. Theory Comput., 2019, 155, 2847-2862
     DOI: 10.1021/acs.jctc.9b00143
   
   with help from (in alphabetical order)
   C. Bannwarth, F. Bohle, G. Brandenburg, E. Caldeweyher, M. Checinski,
   S. Dohm, S. Ehlert, S. Ehrlich, F. März, H. Neugebauer, J. Pisarek,
   P. Pracht, P. Shushkov, and S. Spicher.
   
 * started run on 2021/12/02 at 16:37:14.769     

           -------------------------------------------------
          |                Calculation Setup                |
           -------------------------------------------------

          program call               : /ihome/ghutchison/geoffh/xtb/xtb CPDT-4Cl.xyz --vipea
          hostname                   : smp-n128
          coordinate file            : CPDT-4Cl.xyz
          omp threads                :                     1
          number of atoms            :                    96
          number of electrons        :                   322
          charge                     :                     0
          spin                       :                   0.0
          first test random number   :      0.28748690822925


########################################################################
# WARNING! Please study the warnings concerning your input carefully
#  - XTBPATH is not set, using XTBHOME instead
########################################################################

           ------------------------------------------------- 
          |                 I P E A - x T B                 |
          |  Ionisation Potentials and Electron Affinities  |
           ------------------------------------------------- 
             KAB for M(3d)-M(3d) :                1.1000
             KAB for M(4d)-M(4d) :                1.2000
             KAB for M(5d)-M(5d) :                1.2000
             k(s)                :                2.1500
             k(p)                :                2.3000
             k(d)                :                2.0000
             k(f)                :                0.0000
             kEN (H0ij)          :                0.7000
             D3 a1               :                0.6300
             D3 a2               :                5.0000
             D3 s6               :                1.0000
             D3 s8               :                2.4000
             D3 s9               :                0.0000
             alphaj              :                1.0000
             XBdamp              :                0.4400
             XBrad               :                1.3000
             kcnsh               :      1.0000   -0.3000   -0.5000    0.5000

  Z AO/shell   Hii/eV     exponent
  1     Thu Sep 22 23:34:11 CEST 2016   EN: 2.200 GAM: 0.405  GM3: 0.1500
     1s    -10.521941    1.306199
     2s     -3.560151    0.398421
  6     Thu Sep 22 23:34:11 CEST 2016   EN: 2.550 GAM: 0.640  GM3: 0.1500
     2s    -15.968100    1.979793
     2p     -9.777107    1.850537
     3S     -3.366990    0.633095
  7     Thu Sep 22 23:34:11 CEST 2016   EN: 3.040 GAM: 0.493  GM3:-0.1000
     2s    -24.040776    2.126160
     2p    -14.426520    2.068425
     3S     -5.882278    0.671040
  8     Thu Sep 22 23:34:11 CEST 2016   EN: 3.440 GAM: 0.717  GM3:-0.2000
     2s    -26.695120    2.575264
     2p    -16.014457    2.159448
     3S     -6.622058    0.958679
 16     Tue Jan 17 20:57:36 CET 2017    EN: 2.580 GAM: 0.455  GM3: 0.1020
     3s    -24.488821    2.492075
     3p    -12.136640    1.997904
     3d     -1.796070    1.747541
 17     Tue Jan 17 19:45:33 CET 2017    EN: 3.160 GAM: 0.559  GM3: 0.2396
     3s    -24.452163    2.559226
     3p    -13.465451    2.054846
     3d     -1.836065    1.762522

           ------------------------------------------------- 
          |        Self-Consistent Charge Iterations        |
           ------------------------------------------------- 

          ...................................................
          :                      SETUP                      :
          :.................................................:
          :  # basis functions                 430          :
          :  # atomic orbitals                 422          :
          :  # shells                          258          :
          :  # electrons                       322          :
          :  # halogen bonds                    16          :
          :  max. iterations                   250          :
          :  Hamiltonian                  GFN1-xTB          :
          :  restarted?                      false          :
          :  GBSA solvation                  false          :
          :  PC potential                    false          :
          :  electronic temp.          300.0000000     K    :
          :  accuracy                    1.0000000          :
          :  -> integral cutoff          0.2500000E+02      :
          :  -> integral neglect         0.1000000E-07      :
          :  -> SCF convergence          0.1000000E-05 Eh   :
          :  -> wf. convergence          0.2000000E-04 e    :
          :  Broyden damping             0.4000000          :
          ...................................................

 iter      E             dE          RMSdq      gap      omega  full diag
   1   -201.5628589 -0.201563E+03  0.966E+00    1.13       0.0  T
   2   -200.3973241  0.116553E+01  0.644E+00    0.51       1.0  T
   3   -191.2814636  0.911586E+01  0.608E+00    0.11       1.0  T
   4   -197.9452800 -0.666382E+01  0.293E+00    0.28       1.0  T
   5   -202.0805804 -0.413530E+01  0.117E+00    0.18       1.0  T
   6   -202.5833452 -0.502765E+00  0.843E-01    1.17       1.0  T
   7   -202.6101648 -0.268196E-01  0.689E-01    1.04       1.0  T
   8   -202.6235907 -0.134259E-01  0.551E-01    0.80       1.0  T
   9   -202.6348935 -0.113028E-01  0.215E-01    0.19       1.0  T
  10   -202.6391253 -0.423185E-02  0.120E-01    0.21       1.0  T
  11   -202.6257323  0.133930E-01  0.183E-01    0.13       1.0  T
  12   -202.6393906 -0.136583E-01  0.130E-01    0.35       1.0  T
  13   -202.6399026 -0.512023E-03  0.106E-01    0.32       1.0  T
  14   -202.6410917 -0.118913E-02  0.501E-02    0.25       1.0  T
  15   -202.6414851 -0.393388E-03  0.260E-02    0.22       1.0  T
  16   -202.6416514 -0.166252E-03  0.133E-02    0.18       1.0  T
  17   -202.6416841 -0.327725E-04  0.452E-03    0.19       2.3  T
  18   -202.6416849 -0.725421E-06  0.327E-03    0.19       3.1  T
  19   -202.6416857 -0.887918E-06  0.329E-03    0.19       3.1  T
  20   -202.6416889 -0.315181E-05  0.756E-04    0.19      13.5  T
  21   -202.6416890 -0.101064E-06  0.465E-04    0.19      22.0  T
  22   -202.6416891 -0.768427E-07  0.217E-04    0.19      47.1  T
  23   -202.6416891 -0.195479E-08  0.152E-04    0.19      67.1  T
  24   -202.6416891 -0.555204E-08  0.885E-05    0.19     115.3  T

   *** convergence criteria satisfied after 24 iterations ***

         #    Occupation            Energy/Eh            Energy/eV
      -------------------------------------------------------------
         1        2.0000           -1.2873396             -35.0303
       ...           ...                  ...                  ...
       155        2.0000           -0.4332328             -11.7889
       156        2.0000           -0.4298468             -11.6967
       157        2.0000           -0.4221328             -11.4868
       158        2.0000           -0.4106177             -11.1735
       159        2.0000           -0.3865103             -10.5175
       160        2.0000           -0.3759370             -10.2298
       161        1.9486           -0.3550436              -9.6612 (HOMO)
       162        0.0514           -0.3481358              -9.4733 (LUMO)
       163        0.0000           -0.3405654              -9.2673
       164                         -0.3292716              -8.9599
       165                         -0.3250104              -8.8440
       166                         -0.3196415              -8.6979
       ...                                ...                  ...
       422                        499.9220075           13603.5702
      -------------------------------------------------------------
                  HL-Gap            0.0069078 Eh            0.1880 eV
             Fermi-level           -0.3515899 Eh           -9.5672 eV

 SCC (total)                   0 d,  0 h,  0 min,  1.674 sec
 SCC setup                      ...        0 min,  0.004 sec (  0.222%)
 Dispersion                     ...        0 min,  0.000 sec (  0.018%)
 integral evaluation            ...        0 min,  0.766 sec ( 45.742%)
 zeroth order Hamiltonian       ...        0 min,  0.003 sec (  0.186%)
 iterations                     ...        0 min,  0.666 sec ( 39.755%)
 molecular gradient             ...        0 min,  0.232 sec ( 13.839%)
 printout                       ...        0 min,  0.004 sec (  0.236%)

         :::::::::::::::::::::::::::::::::::::::::::::::::::::
         ::                     SUMMARY                     ::
         :::::::::::::::::::::::::::::::::::::::::::::::::::::
         :: total energy            -199.149896712369 Eh    ::
         :: gradient norm              0.269037439227 Eh/a0 ::
         :: HOMO-LUMO gap              0.187969631893 eV    ::
         ::.................................................::
         :: SCC energy              -202.641689085773 Eh    ::
         :: -> electrostatic           0.214297554428 Eh    ::
         :: repulsion energy           3.583703648691 Eh    ::
         :: dispersion energy         -0.091911275287 Eh    ::
         :: halogen bond corr.         0.000000000000 Eh    ::
         :: add. restraining           0.000000000000 Eh    ::
         :::::::::::::::::::::::::::::::::::::::::::::::::::::

           ------------------------------------------------- 
          |        vertical delta SCC IP calculation        |
           ------------------------------------------------- 

          ...................................................
          :                      SETUP                      :
          :.................................................:
          :  # basis functions                 430          :
          :  # atomic orbitals                 422          :
          :  # shells                          258          :
          :  # electrons                       321          :
          :  # halogen bonds                    16          :
          :  max. iterations                   250          :
          :  Hamiltonian                  GFN1-xTB          :
          :  restarted?                       true          :
          :  GBSA solvation                  false          :
          :  PC potential                    false          :
          :  electronic temp.          300.0000000     K    :
          :  accuracy                    1.0000000          :
          :  -> integral cutoff          0.2500000E+02      :
          :  -> integral neglect         0.1000000E-07      :
          :  -> SCF convergence          0.1000000E-05 Eh   :
          :  -> wf. convergence          0.2000000E-04 e    :
          :  Broyden damping             0.4000000          :
          ...................................................

 iter      E             dE          RMSdq      gap      omega  full diag
   1   -202.1323550 -0.202132E+03  0.645E-01    0.19       0.0  T
   2   -202.1396066 -0.725155E-02  0.663E-01    1.04       1.0  T
   3   -202.2092089 -0.696023E-01  0.304E-01    1.16       1.0  T
   4   -202.2282384 -0.190295E-01  0.108E-01    1.10       1.0  T
   5   -202.2180940  0.101444E-01  0.217E-01    1.02       1.0  T
   6   -202.2145434  0.355065E-02  0.238E-01    1.09       1.0  T
   7   -202.2296658 -0.151224E-01  0.275E-02    1.08       1.0  T
   8   -202.2282950  0.137083E-02  0.746E-02    1.09       1.0  T
   9   -202.2297519 -0.145688E-02  0.979E-03    1.08       1.0  T
  10   -202.2297613 -0.940623E-05  0.738E-03    1.08       1.4  T
  11   -202.2297733 -0.120106E-04  0.258E-03    1.08       4.0  T
  12   -202.2297749 -0.160435E-05  0.611E-04    1.08      16.7  T
  13   -202.2297749 -0.352773E-07  0.394E-04    1.08      25.9  T
  14   -202.2297750 -0.354091E-07  0.135E-04    1.08      75.4  T
  15   -202.2297750 -0.202724E-08  0.780E-05    1.08     130.9  T

   *** convergence criteria satisfied after 15 iterations ***

         #    Occupation            Energy/Eh            Energy/eV
      -------------------------------------------------------------
         1        2.0000           -1.3481566             -36.6852
       ...           ...                  ...                  ...
       155        2.0000           -0.4916400             -13.3782
       156        2.0000           -0.4904046             -13.3446
       157        2.0000           -0.4846905             -13.1891
       158        2.0000           -0.4831128             -13.1462
       159        2.0000           -0.4800149             -13.0619
       160        1.9678           -0.4636913             -12.6177
       161        1.0322           -0.4572276             -12.4418 (HOMO)
       162                         -0.4176478             -11.3648 (LUMO)
       163                         -0.4057609             -11.0413
       164                         -0.3966900             -10.7945
       165                         -0.3882055             -10.5636
       166                         -0.3825147             -10.4088
       ...                                ...                  ...
       422                        499.8447660           13601.4684
      -------------------------------------------------------------
                  HL-Gap            0.0395798 Eh            1.0770 eV
             Fermi-level           -0.4489484 Eh          -12.2165 eV

 SCC (total)                   0 d,  0 h,  0 min,  1.421 sec
 SCC setup                      ...        0 min,  0.004 sec (  0.269%)
 Dispersion                     ...        0 min,  0.000 sec (  0.013%)
 integral evaluation            ...        0 min,  0.766 sec ( 53.907%)
 zeroth order Hamiltonian       ...        0 min,  0.003 sec (  0.214%)
 iterations                     ...        0 min,  0.413 sec ( 29.034%)
 molecular gradient             ...        0 min,  0.231 sec ( 16.261%)
 printout                       ...        0 min,  0.004 sec (  0.298%)

         :::::::::::::::::::::::::::::::::::::::::::::::::::::
         ::                     SUMMARY                     ::
         :::::::::::::::::::::::::::::::::::::::::::::::::::::
         :: total energy            -198.737982595105 Eh    ::
         :: gradient norm              0.268611186434 Eh/a0 ::
         :: HOMO-LUMO gap              1.077021135664 eV    ::
         ::.................................................::
         :: SCC energy              -202.229774968508 Eh    ::
         :: -> electrostatic           0.262681570850 Eh    ::
         :: repulsion energy           3.583703648691 Eh    ::
         :: dispersion energy         -0.091911275287 Eh    ::
         :: halogen bond corr.         0.000000000000 Eh    ::
         :: add. restraining           0.000000000000 Eh    ::
         :::::::::::::::::::::::::::::::::::::::::::::::::::::

------------------------------------------------------------------------
empirical IP shift (eV):    4.8455
delta SCC IP (eV):    6.3632
------------------------------------------------------------------------
           ------------------------------------------------- 
          |        vertical delta SCC EA calculation        |
           ------------------------------------------------- 

          ...................................................
          :                      SETUP                      :
          :.................................................:
          :  # basis functions                 430          :
          :  # atomic orbitals                 422          :
          :  # shells                          258          :
          :  # electrons                       323          :
          :  # halogen bonds                    16          :
          :  max. iterations                   250          :
          :  Hamiltonian                  GFN1-xTB          :
          :  restarted?                       true          :
          :  GBSA solvation                  false          :
          :  PC potential                    false          :
          :  electronic temp.          300.0000000     K    :
          :  accuracy                    1.0000000          :
          :  -> integral cutoff          0.2500000E+02      :
          :  -> integral neglect         0.1000000E-07      :
          :  -> SCF convergence          0.1000000E-05 Eh   :
          :  -> wf. convergence          0.2000000E-04 e    :
          :  Broyden damping             0.4000000          :
          ...................................................

 iter      E             dE          RMSdq      gap      omega  full diag
   1   -202.9111308 -0.202911E+03  0.392E-01    0.32       0.0  T
   2   -202.9114460 -0.315127E-03  0.388E-01    0.22       1.0  T
   3   -202.9085228  0.292319E-02  0.310E-01    0.37       1.0  T
   4   -202.9258864 -0.173636E-01  0.260E-01    0.29       1.0  T
   5   -202.9519620 -0.260756E-01  0.117E-01    0.19       1.0  T
   6   -202.9535228 -0.156076E-02  0.630E-02    0.18       1.0  T
   7   -202.9540716 -0.548800E-03  0.326E-02    0.19       1.0  T
   8   -202.9543831 -0.311570E-03  0.139E-02    0.19       1.0  T
   9   -202.9544326 -0.495032E-04  0.720E-03    0.19       1.4  T
  10   -202.9544407 -0.808008E-05  0.534E-03    0.19       1.9  T
  11   -202.9544543 -0.136106E-04  0.135E-03    0.19       7.5  T
  12   -202.9544546 -0.240414E-06  0.900E-04    0.19      11.3  T
  13   -202.9544546 -0.361496E-08  0.451E-04    0.19      22.6  T
  14   -202.9544547 -0.974019E-07  0.172E-04    0.19      59.2  T
  15   -202.9544547 -0.170363E-07  0.753E-05    0.19     135.5  T

   *** convergence criteria satisfied after 15 iterations ***

         #    Occupation            Energy/Eh            Energy/eV
      -------------------------------------------------------------
         1        2.0000           -1.2170130             -33.1166
       ...           ...                  ...                  ...
       156        2.0000           -0.3612410              -9.8299
       157        2.0000           -0.3525251              -9.5927
       158        2.0000           -0.3402065              -9.2575
       159        2.0000           -0.3165547              -8.6139
       160        2.0000           -0.3073799              -8.3642
       161        1.9873           -0.2858607              -7.7787
       162        0.9882           -0.2775918              -7.5537 (HOMO)
       163        0.0245           -0.2705945              -7.3633 (LUMO)
       164        0.0000           -0.2624057              -7.1404
       165                         -0.2558175              -6.9611
       166                         -0.2499897              -6.8026
       167                         -0.2259839              -6.1493
       ...                                ...                  ...
       422                        499.9897954           13605.4148
      -------------------------------------------------------------
                  HL-Gap            0.0069973 Eh            0.1904 eV
             Fermi-level           -0.2779098 Eh           -7.5623 eV

 SCC (total)                   0 d,  0 h,  0 min,  1.423 sec
 SCC setup                      ...        0 min,  0.004 sec (  0.256%)
 Dispersion                     ...        0 min,  0.000 sec (  0.019%)
 integral evaluation            ...        0 min,  0.764 sec ( 53.711%)
 zeroth order Hamiltonian       ...        0 min,  0.003 sec (  0.215%)
 iterations                     ...        0 min,  0.415 sec ( 29.187%)
 molecular gradient             ...        0 min,  0.232 sec ( 16.280%)
 printout                       ...        0 min,  0.005 sec (  0.328%)

         :::::::::::::::::::::::::::::::::::::::::::::::::::::
         ::                     SUMMARY                     ::
         :::::::::::::::::::::::::::::::::::::::::::::::::::::
         :: total energy            -199.462662318717 Eh    ::
         :: gradient norm              0.289722258699 Eh/a0 ::
         :: HOMO-LUMO gap              0.190406771081 eV    ::
         ::.................................................::
         :: SCC energy              -202.954454692121 Eh    ::
         :: -> electrostatic           0.234498822826 Eh    ::
         :: repulsion energy           3.583703648691 Eh    ::
         :: dispersion energy         -0.091911275287 Eh    ::
         :: halogen bond corr.         0.000000000000 Eh    ::
         :: add. restraining           0.000000000000 Eh    ::
         :::::::::::::::::::::::::::::::::::::::::::::::::::::

------------------------------------------------------------------------
empirical EA shift (eV):    4.8455
delta SCC EA (eV):    3.6653
------------------------------------------------------------------------
           -------------------------------------------------
          |                Property Printout                |
           -------------------------------------------------

    * Orbital Energies and Occupations

         #    Occupation            Energy/Eh            Energy/eV
      -------------------------------------------------------------
         1        2.0000           -1.2170130             -33.1166
       ...           ...                  ...                  ...
       150        2.0000           -0.3854519             -10.4887
       151        2.0000           -0.3829726             -10.4212
       152        2.0000           -0.3764906             -10.2448
       153        2.0000           -0.3732623             -10.1570
       154        2.0000           -0.3700116             -10.0685
       155        2.0000           -0.3658656              -9.9557
       156        2.0000           -0.3612410              -9.8299
       157        2.0000           -0.3525251              -9.5927
       158        2.0000           -0.3402065              -9.2575
       159        2.0000           -0.3165547              -8.6139
       160        2.0000           -0.3073799              -8.3642
       161        1.9873           -0.2858607              -7.7787
       162        0.9882           -0.2775918              -7.5537 (HOMO)
       163        0.0245           -0.2705945              -7.3633 (LUMO)
       164        0.0000           -0.2624057              -7.1404
       165                         -0.2558175              -6.9611
       166                         -0.2499897              -6.8026
       167                         -0.2259839              -6.1493
       168                         -0.2040025              -5.5512
       169                         -0.1887155              -5.1352
       170                         -0.1771313              -4.8200
       171                         -0.1767100              -4.8085
       172                         -0.1717558              -4.6737
       173                         -0.1687531              -4.5920
       ...                                ...                  ...
       422                        499.9897954           13605.4148
      -------------------------------------------------------------
                  HL-Gap            0.0069973 Eh            0.1904 eV
             Fermi-level           -0.2779098 Eh           -7.5623 eV

  Mulliken/CM5 charges        n(s)   n(p)   n(d)
     1 C  -0.01010 -0.05901   0.716  3.274  0.000
     2 C  -0.23802 -0.24201   0.885  2.877  0.000
     3 C  -0.01878 -0.02260   1.216  2.765  0.000
     4 C   0.02148 -0.02734   1.082  2.939  0.000
     5 C  -0.00473 -0.00650   1.110  2.885  0.000
     6 C  -0.03166 -0.03492   1.120  2.849  0.000
     7 C  -0.15273 -0.11807   1.160  2.687  0.000
     8 C   0.01679  0.01432   1.059  2.958  0.000
     9 C  -0.02962 -0.03041   1.107  2.863  0.000
    10 C   0.00804 -0.03903   1.076  2.932  0.000
    11 C  -0.01240 -0.00734   1.153  2.834  0.000
    12 C   0.02590 -0.02314   1.072  2.954  0.000
    13 C   0.00502 -0.00057   1.081  2.924  0.000
    14 C  -0.01591 -0.00164   1.154  2.830  0.000
    15 S   0.04891  0.01364   1.877  4.106  0.065
    16 C  -0.01549 -0.03284   1.094  2.890  0.000
    17 C   0.00481 -0.00070   1.085  2.920  0.000
    18 C  -0.00855  0.00529   1.146  2.845  0.000
    19 C   0.03617 -0.01273   1.063  2.974  0.000
    20 C  -0.00998 -0.00001   1.155  2.835  0.000
    21 S   0.05577  0.02100   1.878  4.110  0.068
    22 C  -0.01284 -0.00291   1.152  2.835  0.000
    23 S   0.04295  0.00805   1.878  4.099  0.066
    24 C  -0.01534 -0.00143   1.138  2.846  0.000
    25 C   0.00157 -0.00393   1.069  2.932  0.000
    26 C   0.03279 -0.01610   1.053  2.980  0.000
    27 C  -0.02250 -0.00818   1.146  2.831  0.000
    28 C   0.00308 -0.00236   1.067  2.937  0.000
    29 C  -0.02407 -0.04137   1.088  2.888  0.000
    30 S   0.03660  0.00309   1.875  4.092  0.069
    31 C  -0.01344 -0.00693   1.147  2.839  0.000
    32 C   0.02319 -0.02658   1.065  2.959  0.000
    33 C   0.00864 -0.03843   1.082  2.926  0.000
    34 C   0.02389  0.02200   1.068  2.955  0.000
    35 C  -0.02286 -0.02246   1.095  2.882  0.000
    36 C  -0.01380 -0.01705   1.080  2.906  0.000
    37 C   0.00046 -0.00143   1.092  2.909  0.000
    38 C  -0.14970 -0.11479   1.177  2.673  0.000
    39 C   0.01067 -0.03820   1.075  2.935  0.000
    40 C  -0.06416 -0.06810   1.167  2.768  0.000
    41 C  -0.06015 -0.06397   1.161  2.779  0.000
    42 C   0.00858 -0.04030   1.083  2.925  0.000
    43 Cl  0.12347  0.12259   1.854  5.253  0.017
    44 Cl  0.11433  0.11335   1.852  5.248  0.014
    45 O   0.32505  0.27926   1.642  4.683  0.000
    46 C  -0.00995 -0.00260   1.042  2.949  0.000
    47 C  -0.11090  0.00854   1.204  2.686  0.000
    48 C  -0.11837  0.00284   1.209  2.673  0.000
    49 C   0.02703 -0.08019   1.076  2.951  0.000
    50 C   0.02843 -0.07891   1.075  2.953  0.000
    51 C   0.06199 -0.08930   1.067  2.995  0.000
    52 C   0.06078 -0.09032   1.068  2.993  0.000
    53 C   0.05124 -0.05612   1.090  2.961  0.000
    54 C   0.02710 -0.08031   1.074  2.953  0.000
    55 C   0.06609 -0.08521   1.065  3.001  0.000
    56 C   0.59555  0.44426   0.890  3.705  0.000
    57 O   0.32435  0.26858   1.641  4.683  0.000
    58 Cl  0.20758  0.20657   1.870  5.293  0.044
    59 Cl  0.14526  0.14439   1.853  5.269  0.023
    60 C  -0.01528 -0.00924   1.041  2.944  0.000
    61 C  -0.11465  0.00437   1.211  2.674  0.000
    62 C  -0.11365  0.00382   1.206  2.681  0.000
    63 N   0.28141  0.15136   1.526  3.755  0.000
    64 N   0.27658  0.14633   1.535  3.742  0.000
    65 N   0.27835  0.14930   1.527  3.752  0.000
    66 N   0.26132  0.12954   1.486  3.776  0.000
    67 H   0.21565  0.28104   1.216  0.000  0.000
    68 H  -0.05213  0.00766   0.948  0.000  0.000
    69 H  -0.03767  0.03192   0.962  0.000  0.000
    70 H  -0.03963  0.03164   0.960  0.000  0.000
    71 H  -0.03045  0.02900   0.970  0.000  0.000
    72 H  -0.03869  0.02068   0.961  0.000  0.000
    73 H  -0.03625  0.02180   0.964  0.000  0.000
    74 H  -0.03857  0.02314   0.961  0.000  0.000
    75 H  -0.04866  0.01501   0.951  0.000  0.000
    76 H  -0.05595  0.00354   0.944  0.000  0.000
    77 H  -0.02080  0.03575   0.979  0.000  0.000
    78 H  -0.02058  0.03611   0.979  0.000  0.000
    79 H  -0.02270  0.03391   0.977  0.000  0.000
    80 H  -0.02273  0.03387   0.977  0.000  0.000
    81 H  -0.01548  0.03858   0.985  0.000  0.000
    82 H  -0.01671  0.03509   0.983  0.000  0.000
    83 H  -0.01523  0.03883   0.985  0.000  0.000
    84 H  -0.00949  0.04476   0.991  0.000  0.000
    85 H  -0.01053  0.04140   0.989  0.000  0.000
    86 H  -0.00818  0.04927   0.992  0.000  0.000
    87 H   0.02326  0.07985   1.023  0.000  0.000
    88 H   0.01776  0.07450   1.018  0.000  0.000
    89 H  -0.02078  0.03602   0.979  0.000  0.000
    90 H  -0.01635  0.04024   0.984  0.000  0.000
    91 H  -0.01235  0.04180   0.988  0.000  0.000
    92 H  -0.01004  0.04179   0.990  0.000  0.000
    93 H  -0.03729  0.01681   0.963  0.000  0.000
    94 H  -0.29702 -0.24293   0.703  0.000  0.000
    95 H  -0.26852 -0.21670   0.731  0.000  0.000
    96 H  -0.29544 -0.24129   0.705  0.000  0.000
(R)spin-density population

 Mulliken population n(s)   n(p)   n(d)
     1 C   0.0105   0.000  0.010  0.000
     2 C   0.0600   0.011  0.049  0.000
     3 C   0.0045   0.000  0.004  0.000
     4 C   0.0259   0.000  0.026  0.000
     5 C   0.0025   0.000  0.002  0.000
     6 C   0.0687   0.012  0.057  0.000
     7 C   0.0088   0.001  0.008  0.000
     8 C   0.0142   0.000  0.014  0.000
     9 C   0.0319   0.001  0.031  0.000
    10 C   0.0471   0.000  0.047  0.000
    11 C   0.0051   0.000  0.005  0.000
    12 C   0.0243   0.000  0.024  0.000
    13 C   0.0023  -0.000  0.002  0.000
    14 C   0.0275  -0.000  0.028  0.000
    15 S   0.0229  -0.000  0.020  0.003
    16 C   0.0003   0.000  0.000  0.000
    17 C   0.0137   0.000  0.014  0.000
    18 C   0.0092   0.000  0.009  0.000
    19 C   0.0111   0.000  0.011  0.000
    20 C   0.0181   0.000  0.018  0.000
    21 S   0.0173  -0.000  0.015  0.002
    22 C   0.0202  -0.000  0.020  0.000
    23 S   0.0198  -0.000  0.017  0.003
    24 C   0.0110  -0.000  0.011  0.000
    25 C   0.0140  -0.000  0.014  0.000
    26 C   0.0093  -0.000  0.009  0.000
    27 C   0.0297  -0.000  0.030  0.000
    28 C   0.0054   0.000  0.005  0.000
    29 C   0.0002  -0.000  0.000  0.000
    30 S   0.0254   0.000  0.021  0.005
    31 C   0.0110   0.000  0.011  0.000
    32 C   0.0266   0.000  0.026  0.000
    33 C   0.0568   0.000  0.057  0.000
    34 C   0.0198   0.000  0.020  0.000
    35 C   0.0427   0.000  0.043  0.000
    36 C   0.0012   0.000  0.001  0.000
    37 C   0.0071   0.000  0.007  0.000
    38 C   0.0046   0.000  0.004  0.000
    39 C   0.0126   0.000  0.013  0.000
    40 C   0.0006  -0.000  0.001  0.000
    41 C   0.0115   0.000  0.011  0.000
    42 C   0.0040   0.000  0.004  0.000
    43 Cl  0.0029   0.000  0.002  0.001
    44 Cl  0.0002   0.000  0.000  0.000
    45 O   0.0042   0.000  0.004  0.000
    46 C   0.0370   0.000  0.037  0.000
    47 C   0.0043   0.000  0.004  0.000
    48 C   0.0057   0.000  0.006  0.000
    49 C   0.0013   0.000  0.001  0.000
    50 C   0.0013   0.000  0.001  0.000
    51 C   0.0002   0.000  0.000  0.000
    52 C   0.0001   0.000  0.000  0.000
    53 C   0.0013   0.000  0.001  0.000
    54 C   0.0010   0.000  0.001  0.000
    55 C   0.0002   0.000  0.000  0.000
    56 C   0.0131   0.000  0.013  0.000
    57 O   0.0094   0.000  0.009  0.000
    58 Cl  0.0179   0.000  0.012  0.005
    59 Cl  0.0038   0.000  0.003  0.001
    60 C   0.0446   0.000  0.044  0.000
    61 C   0.0029   0.000  0.003  0.000
    62 C   0.0040   0.000  0.004  0.000
    63 N   0.0197  -0.000  0.020  0.000
    64 N   0.0188  -0.000  0.019  0.000
    65 N   0.0173   0.000  0.017  0.000
    66 N   0.0205   0.000  0.020  0.000
    67 H   0.0022   0.002  0.000  0.000
    68 H   0.0003   0.000  0.000  0.000
    69 H   0.0002   0.000  0.000  0.000
    70 H   0.0001   0.000  0.000  0.000
    71 H   0.0001   0.000  0.000  0.000
    72 H   0.0000   0.000  0.000  0.000
    73 H   0.0001   0.000  0.000  0.000
    74 H   0.0002   0.000  0.000  0.000
    75 H   0.0000   0.000  0.000  0.000
    76 H   0.0000   0.000  0.000  0.000
    77 H   0.0000   0.000  0.000  0.000
    78 H   0.0000   0.000  0.000  0.000
    79 H   0.0000   0.000  0.000  0.000
    80 H   0.0000   0.000  0.000  0.000
    81 H   0.0000   0.000  0.000  0.000
    82 H   0.0001   0.000  0.000  0.000
    83 H   0.0000   0.000  0.000  0.000
    84 H   0.0000   0.000  0.000  0.000
    85 H   0.0001   0.000  0.000  0.000
    86 H   0.0000   0.000  0.000  0.000
    87 H   0.0006   0.001  0.000  0.000
    88 H   0.0006   0.001  0.000  0.000
    89 H   0.0000   0.000  0.000  0.000
    90 H   0.0000   0.000  0.000  0.000
    91 H   0.0000   0.000  0.000  0.000
    92 H   0.0001   0.000  0.000  0.000
    93 H   0.0000   0.000  0.000  0.000
    94 H   0.0024   0.002  0.000  0.000
    95 H   0.0002   0.000  0.000  0.000
    96 H   0.0014   0.001  0.000  0.000

Wiberg/Mayer (AO) data.
largest (>0.10) Wiberg bond orders for each atom
          total WBO             WBO to atom ...
     1  C   2.414        H   67 0.814    C    2 0.762    C    6 0.729
     2  C   3.764        C    3 1.331    Cl  58 1.070    C    1 0.762    C    6 0.250    C    5 0.101
     3  C   3.882        C    4 1.345    C    2 1.331    Cl  59 1.066
     4  C   3.858        C    5 1.436    C    3 1.345    H   68 0.982
     5  C   3.938        C    4 1.436    C    6 1.298    C    7 1.026    C    2 0.101
     6  C   3.596        C    5 1.298    C    9 1.136    C    1 0.729    C    2 0.250
     7  C   3.956        O   57 1.794    C    8 1.108    C    5 1.026
     8  C   3.797        C   10 1.470    C    9 1.142    C    7 1.108
     9  C   3.889        C   60 1.466    C    8 1.142    C    6 1.136
    10  C   3.772        C    8 1.470    C   11 1.334    H   69 0.987
    11  C   3.909        C   12 1.375    C   10 1.334    S   15 1.133
    12  C   3.783        C   13 1.455    C   11 1.375    H   70 0.986
    13  C   3.812        C   12 1.455    C   14 1.333    C   16 1.012
    14  C   3.896        C   13 1.333    C   18 1.256    S   15 1.243
    15  S   2.502        C   14 1.243    C   11 1.133
    16  C   3.888        C   17 1.013    C   13 1.012    C   54 0.962    C   53 0.945
    17  C   3.799        C   19 1.408    C   18 1.365    C   16 1.013
    18  C   3.896        C   17 1.365    C   14 1.256    S   21 1.204
    19  C   3.809        C   20 1.423    C   17 1.408    H   71 0.988
    20  C   3.880        C   19 1.423    C   22 1.255    S   21 1.165
    21  S   2.505        C   18 1.204    C   20 1.165
    22  C   3.879        C   26 1.420    C   20 1.255    S   23 1.168
    23  S   2.505        C   24 1.210    C   22 1.168
    24  C   3.888        C   25 1.372    C   27 1.248    S   23 1.210
    25  C   3.775        C   26 1.411    C   24 1.372    C   29 1.011
    26  C   3.792        C   22 1.420    C   25 1.411    H   72 0.988
    27  C   3.881        C   28 1.351    C   24 1.248    S   30 1.228
    28  C   3.791        C   32 1.442    C   27 1.351    C   29 1.009
    29  C   3.888        C   25 1.011    C   28 1.009    C   50 0.967    C   49 0.963
    30  S   2.523        C   27 1.228    C   31 1.148
    31  C   3.893        C   32 1.387    C   33 1.305    S   30 1.148
    32  C   3.790        C   28 1.442    C   31 1.387    H   73 0.991
    33  C   3.768        C   34 1.490    C   31 1.305    H   74 0.981
    34  C   3.829        C   33 1.490    C   35 1.186    C   38 1.070
    35  C   3.831        C   46 1.461    C   34 1.186    C   36 1.094
    36  C   3.888        C   39 1.430    C   37 1.314    C   35 1.094
    37  C   3.890        C   42 1.452    C   36 1.314    C   38 1.038
    38  C   4.003        O   45 1.836    C   34 1.070    C   37 1.038
    39  C   3.843        C   36 1.430    C   40 1.402    H   75 0.991
    40  C   3.978        C   39 1.402    C   41 1.382    Cl  44 1.096
    41  C   3.948        C   42 1.393    C   40 1.382    Cl  43 1.093
    42  C   3.886        C   37 1.452    C   41 1.393    H   76 0.982
    43  Cl  1.200        C   41 1.093
    44  Cl  1.207        C   40 1.096
    45  O   1.986        C   38 1.836
    46  C   3.798        C   35 1.461    C   47 1.155    C   48 1.155
    47  C   4.095        N   65 2.909    C   46 1.155
    48  C   4.103        N   66 2.881    C   46 1.155
    49  C   3.867        H   77 1.000    H   78 0.999    C   52 0.994    C   29 0.963
    50  C   3.869        H   79 0.999    H   80 0.999    C   51 0.996    C   29 0.967
    51  C   3.898        H   81 1.006    H   83 1.006    C   50 0.996    H   82 0.991
    52  C   3.897        H   86 1.012    H   84 1.008    C   49 0.994    H   85 0.992
    53  C   3.850        H   87 0.997    H   88 0.995    C   56 0.958    C   16 0.945
    54  C   3.868        H   90 1.000    H   89 0.999    C   55 0.995    C   16 0.962
    55  C   3.892        H   91 1.014    H   92 1.002    C   54 0.995    H   93 0.981
    56  C   3.387        C   53 0.958    H   95 0.851    H   96 0.823    H   94 0.801
    57  O   1.985        C    7 1.794
    58  Cl  1.260        C    2 1.070
    59  Cl  1.217        C    3 1.066
    60  C   3.783        C    9 1.466    C   62 1.154    C   61 1.140
    61  C   4.123        N   64 2.912    C   60 1.140
    62  C   4.099        N   63 2.897    C   60 1.154
    63  N   2.915        C   62 2.897
    64  N   2.925        C   61 2.912
    65  N   2.921        C   47 2.909
    66  N   2.808        C   48 2.881
    67  H   0.919        C    1 0.814
    68  H   1.015        C    4 0.982
    69  H   1.047        C   10 0.987
    70  H   1.058        C   12 0.986
    71  H   1.048        C   19 0.988
    72  H   1.030        C   26 0.988
    73  H   1.040        C   32 0.991
    74  H   1.037        C   33 0.981
    75  H   1.051        C   39 0.991
    76  H   1.022        C   42 0.982
    77  H   1.036        C   49 1.000
    78  H   1.037        C   49 0.999
    79  H   1.035        C   50 0.999
    80  H   1.036        C   50 0.999
    81  H   1.040        C   51 1.006
    82  H   1.042        C   51 0.991
    83  H   1.040        C   51 1.006
    84  H   1.044        C   52 1.008
    85  H   1.049        C   52 0.992
    86  H   1.063        C   52 1.012
    87  H   1.059        C   53 0.997
    88  H   1.048        C   53 0.995
    89  H   1.040        C   54 0.999
    90  H   1.043        C   54 1.000
    91  H   1.038        C   55 1.014
    92  H   1.046        C   55 1.002
    93  H   0.981        C   55 0.981
    94  H   0.930        C   56 0.801
    95  H   0.923        C   56 0.851
    96  H   0.946        C   56 0.823

 dipole moment from electron density (au)
     X       Y       Z   
 -14.6381  -5.8926  -1.1547  total (Debye):   40.215


           -------------------------------------------------
          | TOTAL ENERGY             -199.462662318717 Eh   |
          | GRADIENT NORM               0.289722258699 Eh/α |
          | HOMO-LUMO GAP               0.190406771081 eV   |
           -------------------------------------------------

------------------------------------------------------------------------
 * finished run on 2021/12/02 at 16:37:20.083     
------------------------------------------------------------------------
 total:
 * wall-time:     0 d,  0 h,  0 min,  5.313 sec
 *  cpu-time:     0 d,  0 h,  0 min,  5.290 sec
 * ratio c/w:     0.996 speedup
 SCF:
 * wall-time:     0 d,  0 h,  0 min,  4.522 sec
 *  cpu-time:     0 d,  0 h,  0 min,  4.510 sec
 * ratio c/w:     0.997 speedup

