      -----------------------------------------------------------      
     |                   =====================                   |     
     |                           x T B                           |     
     |                   =====================                   |     
     |                         S. Grimme                         |     
     |          Mulliken Center for Theoretical Chemistry        |     
     |                    University of Bonn                     |     
     |                Version 6.2 RC2 (SAW190805)                |     
      -----------------------------------------------------------      

   This program is distributed in the hope that it will be useful,
   but WITHOUT ANY WARRANTY; without even the implied warranty of
   MERCHANTABILITY or FITNESS FOR A PARTICULAR PURPOSE.
   
   FOR NON-COMMERCIAL, ACADEMIA USE ONLY.
   
   Cite this work as:
   * S. Grimme, C. Bannwarth, P. Shushkov, J. Chem. Theory Comput., 2017,
     13, 1989-2009. DOI: 10.1021/acs.jctc.7b00118
   * C. Bannwarth, S. Ehlert and S. Grimme., J. Chem. Theory Comput., 2019,
     15, 1652-1671. DOI: 10.1021/acs.jctc.8b01176
   * P. Pracht, E. Caldeweyher, S. Ehlert, S. Grimme, ChemRxiv, 2019, preprint.
     DOI: 10.26434/chemrxiv.8326202.v1
   
   for DFT-D4:
   * E. Caldeweyher, C. Bannwarth and S. Grimme, J. Chem. Phys., 2017,
     147, 034112. DOI: 10.1063/1.4993215
   * E. Caldeweyher, S. Ehlert, A. Hansen, H. Neugebauer, S. Spicher,
     C. Bannwarth and S. Grimme, J. Chem. Phys., 2019, 150, 154122.
     DOI: 10.1063/1.5090222
   
   for sTDA-xTB:
   * S. Grimme and C. Bannwarth, J. Chem. Phys., 2016, 145, 054103.
     DOI: 10.1063/1.4959605
   
   in the mass-spec context:
   * V. Asgeirsson, C. Bauer and S. Grimme, Chem. Sci., 2017, 8, 4879.
     DOI: 10.1039/c7sc00601b
   
   for metadynamics refer to:
   * S. Grimme, J. Chem. Theory Comput., 2019, 155, 2847-2862
     DOI: 10.1021/acs.jctc.9b00143
   
   with help from (in alphabetical order)
   C. Bannwarth, F. Bohle, G. Brandenburg, E. Caldeweyher, M. Checinski,
   S. Dohm, S. Ehlert, S. Ehrlich, F. März, H. Neugebauer, J. Pisarek,
   P. Pracht, P. Shushkov, and S. Spicher.
   
 * started run on 2021/12/02 at 16:39:33.183     

           -------------------------------------------------
          |                Calculation Setup                |
           -------------------------------------------------

          program call               : /ihome/ghutchison/geoffh/xtb/xtb IDIC-4Cl.xyz --vipea
          hostname                   : smp-n128
          coordinate file            : IDIC-4Cl.xyz
          omp threads                :                     1
          number of atoms            :                    92
          number of electrons        :                   302
          charge                     :                     0
          spin                       :                   0.0
          first test random number   :      0.53487391651807


########################################################################
# WARNING! Please study the warnings concerning your input carefully
#  - XTBPATH is not set, using XTBHOME instead
########################################################################

           ------------------------------------------------- 
          |                 I P E A - x T B                 |
          |  Ionisation Potentials and Electron Affinities  |
           ------------------------------------------------- 
             KAB for M(3d)-M(3d) :                1.1000
             KAB for M(4d)-M(4d) :                1.2000
             KAB for M(5d)-M(5d) :                1.2000
             k(s)                :                2.1500
             k(p)                :                2.3000
             k(d)                :                2.0000
             k(f)                :                0.0000
             kEN (H0ij)          :                0.7000
             D3 a1               :                0.6300
             D3 a2               :                5.0000
             D3 s6               :                1.0000
             D3 s8               :                2.4000
             D3 s9               :                0.0000
             alphaj              :                1.0000
             XBdamp              :                0.4400
             XBrad               :                1.3000
             kcnsh               :      1.0000   -0.3000   -0.5000    0.5000

  Z AO/shell   Hii/eV     exponent
  1     Thu Sep 22 23:34:11 CEST 2016   EN: 2.200 GAM: 0.405  GM3: 0.1500
     1s    -10.521941    1.306199
     2s     -3.560151    0.398421
  6     Thu Sep 22 23:34:11 CEST 2016   EN: 2.550 GAM: 0.640  GM3: 0.1500
     2s    -15.968100    1.979793
     2p     -9.777107    1.850537
     3S     -3.366990    0.633095
  7     Thu Sep 22 23:34:11 CEST 2016   EN: 3.040 GAM: 0.493  GM3:-0.1000
     2s    -24.040776    2.126160
     2p    -14.426520    2.068425
     3S     -5.882278    0.671040
  8     Thu Sep 22 23:34:11 CEST 2016   EN: 3.440 GAM: 0.717  GM3:-0.2000
     2s    -26.695120    2.575264
     2p    -16.014457    2.159448
     3S     -6.622058    0.958679
 16     Tue Jan 17 20:57:36 CET 2017    EN: 2.580 GAM: 0.455  GM3: 0.1020
     3s    -24.488821    2.492075
     3p    -12.136640    1.997904
     3d     -1.796070    1.747541
 17     Tue Jan 17 19:45:33 CET 2017    EN: 3.160 GAM: 0.559  GM3: 0.2396
     3s    -24.452163    2.559226
     3p    -13.465451    2.054846
     3d     -1.836065    1.762522

           ------------------------------------------------- 
          |        Self-Consistent Charge Iterations        |
           ------------------------------------------------- 

          ...................................................
          :                      SETUP                      :
          :.................................................:
          :  # basis functions                 400          :
          :  # atomic orbitals                 394          :
          :  # shells                          246          :
          :  # electrons                       302          :
          :  # halogen bonds                    16          :
          :  max. iterations                   250          :
          :  Hamiltonian                  GFN1-xTB          :
          :  restarted?                      false          :
          :  GBSA solvation                  false          :
          :  PC potential                    false          :
          :  electronic temp.          300.0000000     K    :
          :  accuracy                    1.0000000          :
          :  -> integral cutoff          0.2500000E+02      :
          :  -> integral neglect         0.1000000E-07      :
          :  -> SCF convergence          0.1000000E-05 Eh   :
          :  -> wf. convergence          0.2000000E-04 e    :
          :  Broyden damping             0.4000000          :
          ...................................................

 iter      E             dE          RMSdq      gap      omega  full diag
   1   -182.5723579 -0.182572E+03  0.101E+01    0.37       0.0  T
   2   -183.6094562 -0.103710E+01  0.672E+00    0.45       1.0  T
   3   -179.8307680  0.377869E+01  0.544E+00    0.14       1.0  T
   4   -186.1998035 -0.636904E+01  0.212E+00    0.17       1.0  T
   5   -187.3932554 -0.119345E+01  0.470E-01    1.32       1.0  T
   6   -187.4233907 -0.301353E-01  0.257E-01    1.31       1.0  T
   7   -187.4259136 -0.252285E-02  0.184E-01    1.38       1.0  T
   8   -187.4281218 -0.220821E-02  0.840E-02    1.37       1.0  T
   9   -187.4291397 -0.101795E-02  0.344E-02    1.36       1.0  T
  10   -187.4293872 -0.247488E-03  0.104E-02    1.37       1.0  T
  11   -187.4294048 -0.176303E-04  0.593E-03    1.37       1.8  T
  12   -187.4294102 -0.531371E-05  0.242E-03    1.36       4.3  T
  13   -187.4294110 -0.862401E-06  0.124E-03    1.36       8.4  T
  14   -187.4294113 -0.280699E-06  0.496E-04    1.36      21.0  T
  15   -187.4294113 -0.362444E-07  0.202E-04    1.36      51.7  T
  16   -187.4294113 -0.490689E-08  0.935E-05    1.36     111.5  T
  17   -187.4294113 -0.108449E-08  0.388E-05    1.36     268.4  T

   *** convergence criteria satisfied after 17 iterations ***

         #    Occupation            Energy/Eh            Energy/eV
      -------------------------------------------------------------
         1        2.0000           -1.0244480             -27.8767
       ...           ...                  ...                  ...
       145        2.0000           -0.4303190             -11.7096
       146        2.0000           -0.4243593             -11.5474
       147        2.0000           -0.4225234             -11.4974
       148        2.0000           -0.4195766             -11.4173
       149        2.0000           -0.4079391             -11.1006
       150        2.0000           -0.4030080             -10.9664
       151        2.0000           -0.3808445             -10.3633 (HOMO)
       152                         -0.3306984              -8.9988 (LUMO)
       153                         -0.3176927              -8.6449
       154                         -0.3118224              -8.4851
       155                         -0.3022680              -8.2251
       156                         -0.2622240              -7.1355
       ...                                ...                  ...
       394                        547.4107145           14895.8037
      -------------------------------------------------------------
                  HL-Gap            0.0501461 Eh            1.3645 eV
             Fermi-level           -0.3557714 Eh           -9.6810 eV

 SCC (total)                   0 d,  0 h,  0 min,  1.302 sec
 SCC setup                      ...        0 min,  0.003 sec (  0.259%)
 Dispersion                     ...        0 min,  0.000 sec (  0.021%)
 integral evaluation            ...        0 min,  0.681 sec ( 52.272%)
 zeroth order Hamiltonian       ...        0 min,  0.003 sec (  0.217%)
 iterations                     ...        0 min,  0.397 sec ( 30.497%)
 molecular gradient             ...        0 min,  0.215 sec ( 16.474%)
 printout                       ...        0 min,  0.003 sec (  0.254%)

         :::::::::::::::::::::::::::::::::::::::::::::::::::::
         ::                     SUMMARY                     ::
         :::::::::::::::::::::::::::::::::::::::::::::::::::::
         :: total energy            -184.059141635245 Eh    ::
         :: gradient norm              0.254151064638 Eh/a0 ::
         :: HOMO-LUMO gap              1.364544831777 eV    ::
         ::.................................................::
         :: SCC energy              -187.429411340703 Eh    ::
         :: -> electrostatic           0.288524282824 Eh    ::
         :: repulsion energy           3.454346983730 Eh    ::
         :: dispersion energy         -0.084077278272 Eh    ::
         :: halogen bond corr.         0.000000000000 Eh    ::
         :: add. restraining           0.000000000000 Eh    ::
         :::::::::::::::::::::::::::::::::::::::::::::::::::::

           ------------------------------------------------- 
          |        vertical delta SCC IP calculation        |
           ------------------------------------------------- 

          ...................................................
          :                      SETUP                      :
          :.................................................:
          :  # basis functions                 400          :
          :  # atomic orbitals                 394          :
          :  # shells                          246          :
          :  # electrons                       301          :
          :  # halogen bonds                    16          :
          :  max. iterations                   250          :
          :  Hamiltonian                  GFN1-xTB          :
          :  restarted?                       true          :
          :  GBSA solvation                  false          :
          :  PC potential                    false          :
          :  electronic temp.          300.0000000     K    :
          :  accuracy                    1.0000000          :
          :  -> integral cutoff          0.2500000E+02      :
          :  -> integral neglect         0.1000000E-07      :
          :  -> SCF convergence          0.1000000E-05 Eh   :
          :  -> wf. convergence          0.2000000E-04 e    :
          :  Broyden damping             0.4000000          :
          ...................................................

 iter      E             dE          RMSdq      gap      omega  full diag
   1   -186.9886914 -0.186989E+03  0.243E-01    1.36       0.0  T
   2   -186.9976560 -0.896463E-02  0.220E-01    1.62       1.0  T
   3   -187.0058484 -0.819240E-02  0.108E-01    1.51       1.0  T
   4   -187.0061613 -0.312931E-03  0.676E-02    1.53       1.0  T
   5   -187.0061516  0.971925E-05  0.527E-02    1.52       1.0  T
   6   -187.0065131 -0.361510E-03  0.295E-02    1.52       1.0  T
   7   -187.0066604 -0.147312E-03  0.103E-02    1.52       1.0  T
   8   -187.0066836 -0.231675E-04  0.339E-03    1.53       3.1  T
   9   -187.0066855 -0.187767E-05  0.176E-03    1.53       5.9  T
  10   -187.0066862 -0.677512E-06  0.648E-04    1.53      16.1  T
  11   -187.0066862 -0.271141E-07  0.312E-04    1.53      33.4  T
  12   -187.0066862 -0.113266E-07  0.163E-04    1.53      64.0  T
  13   -187.0066862 -0.310243E-08  0.767E-05    1.53     135.8  T

   *** convergence criteria satisfied after 13 iterations ***

         #    Occupation            Energy/Eh            Energy/eV
      -------------------------------------------------------------
         1        2.0000           -1.0997399             -29.9254
       ...           ...                  ...                  ...
       145        2.0000           -0.4953172             -13.4783
       146        2.0000           -0.4926647             -13.4061
       147        2.0000           -0.4861143             -13.2278
       148        2.0000           -0.4859507             -13.2234
       149        2.0000           -0.4826671             -13.1340
       150        1.9993           -0.4780035             -13.0071
       151        1.0007           -0.4641172             -12.6293 (HOMO)
       152                         -0.4080529             -11.1037 (LUMO)
       153                         -0.3919359             -10.6651
       154                         -0.3827456             -10.4150
       155                         -0.3769702             -10.2579
       156                         -0.3406281              -9.2690
       ...                                ...                  ...
       394                        547.3283050           14893.5613
      -------------------------------------------------------------
                  HL-Gap            0.0560642 Eh            1.5256 eV
             Fermi-level           -0.4535708 Eh          -12.3423 eV

 SCC (total)                   0 d,  0 h,  0 min,  1.207 sec
 SCC setup                      ...        0 min,  0.003 sec (  0.275%)
 Dispersion                     ...        0 min,  0.000 sec (  0.014%)
 integral evaluation            ...        0 min,  0.680 sec ( 56.358%)
 zeroth order Hamiltonian       ...        0 min,  0.003 sec (  0.210%)
 iterations                     ...        0 min,  0.303 sec ( 25.073%)
 molecular gradient             ...        0 min,  0.214 sec ( 17.736%)
 printout                       ...        0 min,  0.004 sec (  0.329%)

         :::::::::::::::::::::::::::::::::::::::::::::::::::::
         ::                     SUMMARY                     ::
         :::::::::::::::::::::::::::::::::::::::::::::::::::::
         :: total energy            -183.636416503325 Eh    ::
         :: gradient norm              0.249734824729 Eh/a0 ::
         :: HOMO-LUMO gap              1.525585660295 eV    ::
         ::.................................................::
         :: SCC energy              -187.006686208783 Eh    ::
         :: -> electrostatic           0.339464369498 Eh    ::
         :: repulsion energy           3.454346983730 Eh    ::
         :: dispersion energy         -0.084077278272 Eh    ::
         :: halogen bond corr.         0.000000000000 Eh    ::
         :: add. restraining           0.000000000000 Eh    ::
         :::::::::::::::::::::::::::::::::::::::::::::::::::::

------------------------------------------------------------------------
empirical IP shift (eV):    4.8455
delta SCC IP (eV):    6.6574
------------------------------------------------------------------------
           ------------------------------------------------- 
          |        vertical delta SCC EA calculation        |
           ------------------------------------------------- 

          ...................................................
          :                      SETUP                      :
          :.................................................:
          :  # basis functions                 400          :
          :  # atomic orbitals                 394          :
          :  # shells                          246          :
          :  # electrons                       303          :
          :  # halogen bonds                    16          :
          :  max. iterations                   250          :
          :  Hamiltonian                  GFN1-xTB          :
          :  restarted?                       true          :
          :  GBSA solvation                  false          :
          :  PC potential                    false          :
          :  electronic temp.          300.0000000     K    :
          :  accuracy                    1.0000000          :
          :  -> integral cutoff          0.2500000E+02      :
          :  -> integral neglect         0.1000000E-07      :
          :  -> SCF convergence          0.1000000E-05 Eh   :
          :  -> wf. convergence          0.2000000E-04 e    :
          :  Broyden damping             0.4000000          :
          ...................................................

 iter      E             dE          RMSdq      gap      omega  full diag
   1   -187.6708043 -0.187671E+03  0.389E-01    0.44       0.0  T
   2   -187.6712948 -0.490493E-03  0.413E-01    0.23       1.0  T
   3   -187.6938664 -0.225716E-01  0.288E-01    0.34       1.0  T
   4   -187.7120522 -0.181859E-01  0.183E-01    0.26       1.0  T
   5   -187.7183497 -0.629748E-02  0.104E-01    0.22       1.0  T
   6   -187.7193425 -0.992802E-03  0.553E-02    0.22       1.0  T
   7   -187.7199708 -0.628290E-03  0.262E-02    0.22       1.0  T
   8   -187.7200558 -0.850056E-04  0.113E-02    0.23       1.0  T
   9   -187.7201000 -0.441591E-04  0.386E-03    0.22       2.7  T
  10   -187.7201031 -0.312931E-05  0.215E-03    0.22       4.8  T
  11   -187.7201042 -0.107840E-05  0.737E-04    0.22      14.1  T
  12   -187.7201043 -0.798366E-07  0.435E-04    0.22      24.0  T
  13   -187.7201043 -0.355039E-07  0.257E-04    0.22      40.6  T
  14   -187.7201043 -0.222456E-07  0.909E-05    0.22     114.7  T
  15   -187.7201043 -0.135421E-08  0.330E-05    0.22     315.6  T

   *** convergence criteria satisfied after 15 iterations ***

         #    Occupation            Energy/Eh            Energy/eV
      -------------------------------------------------------------
         1        2.0000           -0.9462160             -25.7478
       ...           ...                  ...                  ...
       146        2.0000           -0.3547375              -9.6529
       147        2.0000           -0.3503660              -9.5339
       148        2.0000           -0.3466727              -9.4334
       149        2.0000           -0.3328908              -9.0584
       150        2.0000           -0.3295113              -8.9665
       151        2.0000           -0.3041126              -8.2753
       152        0.9868           -0.2515674              -6.8455 (HOMO)
       153        0.0132           -0.2433660              -6.6223 (LUMO)
       154        0.0000           -0.2378810              -6.4731
       155                         -0.2290313              -6.2323
       156                         -0.1865914              -5.0774
       157                         -0.1774272              -4.8280
       ...                                ...                  ...
       394                        547.4812912           14897.7242
      -------------------------------------------------------------
                  HL-Gap            0.0082014 Eh            0.2232 eV
             Fermi-level           -0.2626541 Eh           -7.1472 eV

 SCC (total)                   0 d,  0 h,  0 min,  1.251 sec
 SCC setup                      ...        0 min,  0.003 sec (  0.267%)
 Dispersion                     ...        0 min,  0.000 sec (  0.020%)
 integral evaluation            ...        0 min,  0.680 sec ( 54.382%)
 zeroth order Hamiltonian       ...        0 min,  0.003 sec (  0.223%)
 iterations                     ...        0 min,  0.347 sec ( 27.722%)
 molecular gradient             ...        0 min,  0.214 sec ( 17.119%)
 printout                       ...        0 min,  0.003 sec (  0.264%)

         :::::::::::::::::::::::::::::::::::::::::::::::::::::
         ::                     SUMMARY                     ::
         :::::::::::::::::::::::::::::::::::::::::::::::::::::
         :: total energy            -184.349834616687 Eh    ::
         :: gradient norm              0.270381966206 Eh/a0 ::
         :: HOMO-LUMO gap              0.223172134166 eV    ::
         ::.................................................::
         :: SCC energy              -187.720104322145 Eh    ::
         :: -> electrostatic           0.315796971939 Eh    ::
         :: repulsion energy           3.454346983730 Eh    ::
         :: dispersion energy         -0.084077278272 Eh    ::
         :: halogen bond corr.         0.000000000000 Eh    ::
         :: add. restraining           0.000000000000 Eh    ::
         :::::::::::::::::::::::::::::::::::::::::::::::::::::

------------------------------------------------------------------------
empirical EA shift (eV):    4.8455
delta SCC EA (eV):    3.0647
------------------------------------------------------------------------
           -------------------------------------------------
          |                Property Printout                |
           -------------------------------------------------

    * Orbital Energies and Occupations

         #    Occupation            Energy/Eh            Energy/eV
      -------------------------------------------------------------
         1        2.0000           -0.9462160             -25.7478
       ...           ...                  ...                  ...
       140        2.0000           -0.3709874             -10.0951
       141        2.0000           -0.3706711             -10.0865
       142        2.0000           -0.3695659             -10.0564
       143        2.0000           -0.3689381             -10.0393
       144        2.0000           -0.3657792              -9.9534
       145        2.0000           -0.3595224              -9.7831
       146        2.0000           -0.3547375              -9.6529
       147        2.0000           -0.3503660              -9.5339
       148        2.0000           -0.3466727              -9.4334
       149        2.0000           -0.3328908              -9.0584
       150        2.0000           -0.3295113              -8.9665
       151        2.0000           -0.3041126              -8.2753
       152        0.9868           -0.2515674              -6.8455 (HOMO)
       153        0.0132           -0.2433660              -6.6223 (LUMO)
       154        0.0000           -0.2378810              -6.4731
       155                         -0.2290313              -6.2323
       156                         -0.1865914              -5.0774
       157                         -0.1774272              -4.8280
       158                         -0.1739721              -4.7340
       159                         -0.1607813              -4.3751
       160                         -0.1527729              -4.1572
       161                         -0.1500085              -4.0819
       162                         -0.1478191              -4.0224
       163                         -0.1472656              -4.0073
       ...                                ...                  ...
       394                        547.4812912           14897.7242
      -------------------------------------------------------------
                  HL-Gap            0.0082014 Eh            0.2232 eV
             Fermi-level           -0.2626541 Eh           -7.1472 eV

  Mulliken/CM5 charges        n(s)   n(p)   n(d)
     1 C  -0.41019 -0.41372   1.016  2.573  0.000
     2 C  -0.39536 -0.40242   1.117  2.487  0.000
     3 C   0.17778  0.12676   0.988  3.190  0.000
     4 C   0.03276  0.02906   1.054  2.979  0.000
     5 C   0.02740  0.02028   1.045  2.982  0.000
     6 C   0.16310  0.11196   1.005  3.158  0.000
     7 C  -0.00978  0.00335   1.142  2.849  0.000
     8 C   0.01249  0.00676   1.070  2.943  0.000
     9 C  -0.01969 -0.03714   1.082  2.899  0.000
    10 C   0.11368  0.12697   1.094  3.020  0.000
    11 C   0.03563  0.03015   1.058  2.978  0.000
    12 C   0.08730  0.06992   1.025  3.062  0.000
    13 S   0.08998  0.05394   1.879  4.140  0.071
    14 C   0.00493  0.01009   1.163  2.842  0.000
    15 C   0.02808 -0.02096   1.065  2.963  0.000
    16 S   0.07734  0.04654   1.882  4.062  0.133
    17 C  -0.00703 -0.00133   1.143  2.850  0.000
    18 C   0.03299 -0.01785   1.054  2.979  0.000
    19 C   0.02592 -0.08169   1.066  2.960  0.000
    20 C   0.02835 -0.07865   1.078  2.950  0.000
    21 C   0.05992 -0.09292   1.062  2.997  0.000
    22 C   0.06071 -0.09060   1.067  2.993  0.000
    23 C   0.03466 -0.07244   1.062  2.973  0.000
    24 C   0.03319 -0.07402   1.062  2.971  0.000
    25 C   0.06088 -0.09212   1.058  3.003  0.000
    26 C   0.05796 -0.09485   1.057  3.001  0.000
    27 C   0.02217 -0.02557   1.073  2.949  0.000
    28 C   0.13708  0.09002   1.042  3.095  0.000
    29 C   0.04313  0.04065   1.068  2.975  0.000
    30 C   0.02987  0.02805   1.058  2.972  0.000
    31 C  -0.13896 -0.10347   1.179  2.682  0.000
    32 C   0.02620  0.02439   1.098  2.929  0.000
    33 C   0.01261  0.00936   1.087  2.926  0.000
    34 C  -0.00470 -0.00534   1.100  2.895  0.000
    35 C  -0.13678 -0.10203   1.173  2.690  0.000
    36 C   0.02820  0.02643   1.104  2.924  0.000
    37 C   0.01231  0.00906   1.081  2.932  0.000
    38 C  -0.00168 -0.00248   1.113  2.886  0.000
    39 C   0.12285  0.07401   1.076  3.047  0.000
    40 C  -0.04005 -0.04387   1.168  2.792  0.000
    41 C  -0.04317 -0.04716   1.178  2.778  0.000
    42 C   0.13925  0.09034   1.063  3.076  0.000
    43 C   0.13309  0.08428   1.070  3.063  0.000
    44 C  -0.03976 -0.04357   1.173  2.788  0.000
    45 C  -0.04381 -0.04780   1.174  2.782  0.000
    46 C   0.12547  0.07656   1.079  3.047  0.000
    47 O   0.32615  0.28022   1.652  4.674  0.000
    48 O   0.34482  0.28915   1.641  4.704  0.000
    49 C   0.01374  0.01977   1.033  2.981  0.000
    50 C   0.00807  0.01427   1.033  2.975  0.000
    51 C  -0.10605  0.01159   1.206  2.688  0.000
    52 C  -0.09682  0.02227   1.216  2.687  0.000
    53 C  -0.09541  0.02200   1.217  2.688  0.000
    54 C  -0.09904  0.02004   1.211  2.690  0.000
    55 N   0.29588  0.16534   1.524  3.772  0.000
    56 N   0.30808  0.17785   1.528  3.780  0.000
    57 N   0.30401  0.17363   1.525  3.779  0.000
    58 N   0.30374  0.17349   1.527  3.777  0.000
    59 Cl  0.16689  0.16587   1.856  5.292  0.019
    60 Cl  0.17298  0.17211   1.858  5.293  0.022
    61 Cl  0.17265  0.17178   1.858  5.293  0.021
    62 Cl  0.16600  0.16499   1.856  5.291  0.019
    63 H  -0.00778  0.05129   0.992  0.000  0.000
    64 H  -0.01290  0.04627   0.987  0.000  0.000
    65 H  -0.03549  0.03558   0.965  0.000  0.000
    66 H  -0.02667  0.03173   0.973  0.000  0.000
    67 H  -0.01787  0.03955   0.982  0.000  0.000
    68 H  -0.02159  0.03517   0.978  0.000  0.000
    69 H  -0.00914  0.04815   0.991  0.000  0.000
    70 H  -0.01712  0.03994   0.983  0.000  0.000
    71 H  -0.00897  0.04487   0.991  0.000  0.000
    72 H  -0.01402  0.03778   0.986  0.000  0.000
    73 H  -0.01441  0.03863   0.986  0.000  0.000
    74 H  -0.00344  0.05066   0.997  0.000  0.000
    75 H  -0.01062  0.04118   0.989  0.000  0.000
    76 H  -0.01051  0.04359   0.989  0.000  0.000
    77 H  -0.00735  0.04992   0.993  0.000  0.000
    78 H  -0.02006  0.03760   0.980  0.000  0.000
    79 H  -0.00920  0.04798   0.991  0.000  0.000
    80 H  -0.01648  0.04111   0.984  0.000  0.000
    81 H  -0.00981  0.04390   0.990  0.000  0.000
    82 H  -0.01629  0.03549   0.984  0.000  0.000
    83 H  -0.01764  0.03564   0.982  0.000  0.000
    84 H  -0.01551  0.03775   0.984  0.000  0.000
    85 H  -0.01349  0.04033   0.987  0.000  0.000
    86 H  -0.01384  0.03794   0.986  0.000  0.000
    87 H  -0.05394  0.01434   0.946  0.000  0.000
    88 H  -0.33380 -0.26385   0.666  0.000  0.000
    89 H  -0.29812 -0.23847   0.702  0.000  0.000
    90 H  -0.32294 -0.25763   0.677  0.000  0.000
    91 H  -0.31935 -0.25956   0.681  0.000  0.000
    92 H  -0.29364 -0.22817   0.706  0.000  0.000
(R)spin-density population

 Mulliken population n(s)   n(p)   n(d)
     1 C   0.0060   0.000  0.006  0.000
     2 C   0.0035   0.000  0.003  0.000
     3 C   0.0211   0.000  0.021  0.000
     4 C   0.0128   0.000  0.013  0.000
     5 C   0.0045   0.000  0.004  0.000
     6 C   0.0097   0.000  0.010  0.000
     7 C   0.0372   0.000  0.037  0.000
     8 C   0.0052   0.000  0.005  0.000
     9 C   0.0001   0.000  0.000  0.000
    10 C   0.0575   0.000  0.058  0.000
    11 C   0.0023   0.000  0.002  0.000
    12 C   0.0001   0.000  0.000  0.000
    13 S   0.0320   0.000  0.028  0.004
    14 C   0.0132   0.000  0.013  0.000
    15 C   0.0330  -0.000  0.033  0.000
    16 S   0.0459   0.000  0.040  0.006
    17 C   0.0112   0.000  0.011  0.000
    18 C   0.0482   0.000  0.048  0.000
    19 C   0.0006   0.000  0.000  0.000
    20 C   0.0007   0.000  0.000  0.000
    21 C   0.0001   0.000  0.000  0.000
    22 C   0.0002   0.000  0.000  0.000
    23 C   0.0005   0.000  0.000  0.000
    24 C   0.0005   0.000  0.000  0.000
    25 C   0.0002   0.000  0.000  0.000
    26 C   0.0002   0.000  0.000  0.000
    27 C   0.0852   0.000  0.085  0.000
    28 C   0.0598   0.000  0.060  0.000
    29 C   0.0149   0.000  0.015  0.000
    30 C   0.0289   0.000  0.029  0.000
    31 C   0.0020   0.000  0.002  0.000
    32 C   0.0137  -0.000  0.014  0.000
    33 C   0.0006   0.000  0.001  0.000
    34 C   0.0674  -0.000  0.067  0.000
    35 C   0.0013   0.000  0.001  0.000
    36 C   0.0118   0.000  0.012  0.000
    37 C   0.0011   0.000  0.001  0.000
    38 C   0.0550   0.000  0.055  0.000
    39 C   0.0027  -0.000  0.003  0.000
    40 C   0.0178  -0.000  0.018  0.000
    41 C   0.0002   0.000  0.000  0.000
    42 C   0.0175  -0.000  0.017  0.000
    43 C   0.0020   0.000  0.002  0.000
    44 C   0.0146   0.000  0.015  0.000
    45 C   0.0002  -0.000  0.000  0.000
    46 C   0.0138  -0.000  0.014  0.000
    47 O   0.0033   0.000  0.003  0.000
    48 O   0.0013   0.000  0.001  0.000
    49 C   0.0402   0.000  0.040  0.000
    50 C   0.0583  -0.000  0.058  0.000
    51 C   0.0081   0.000  0.008  0.000
    52 C   0.0087  -0.000  0.009  0.000
    53 C   0.0067   0.000  0.007  0.000
    54 C   0.0066   0.000  0.007  0.000
    55 N   0.0293   0.000  0.029  0.000
    56 N   0.0291   0.000  0.029  0.000
    57 N   0.0209   0.000  0.021  0.000
    58 N   0.0216  -0.000  0.022  0.000
    59 Cl  0.0001  -0.000  0.000  0.000
    60 Cl  0.0042  -0.000  0.002  0.002
    61 Cl  0.0035  -0.000  0.002  0.002
    62 Cl  0.0001   0.000  0.000  0.000
    63 H   0.0000   0.000  0.000  0.000
    64 H   0.0000   0.000  0.000  0.000
    65 H  -0.0000  -0.000  0.000  0.000
    66 H   0.0000   0.000  0.000  0.000
    67 H   0.0000   0.000  0.000  0.000
    68 H   0.0000   0.000  0.000  0.000
    69 H   0.0001   0.000  0.000  0.000
    70 H   0.0000   0.000  0.000  0.000
    71 H   0.0000   0.000  0.000  0.000
    72 H   0.0000   0.000  0.000  0.000
    73 H   0.0000   0.000  0.000  0.000
    74 H   0.0001   0.000  0.000  0.000
    75 H   0.0001   0.000  0.000  0.000
    76 H   0.0001   0.000  0.000  0.000
    77 H   0.0001   0.000  0.000  0.000
    78 H   0.0001   0.000  0.000  0.000
    79 H   0.0001   0.000  0.000  0.000
    80 H   0.0001   0.000  0.000  0.000
    81 H   0.0001   0.000  0.000  0.000
    82 H   0.0001   0.000  0.000  0.000
    83 H   0.0000   0.000  0.000  0.000
    84 H   0.0000   0.000  0.000  0.000
    85 H   0.0000   0.000  0.000  0.000
    86 H   0.0001   0.000  0.000  0.000
    87 H   0.0000   0.000  0.000  0.000
    88 H   0.0000   0.000  0.000  0.000
    89 H   0.0000   0.000  0.000  0.000
    90 H   0.0000   0.000  0.000  0.000
    91 H   0.0000   0.000  0.000  0.000
    92 H   0.0000   0.000  0.000  0.000

Wiberg/Mayer (AO) data.
largest (>0.10) Wiberg bond orders for each atom
          total WBO             WBO to atom ...
     1  C   4.040        C    2 1.381    C    6 1.308    C   10 1.154
     2  C   3.973        C    3 1.446    C    1 1.381    C   12 0.952
     3  C   3.656        C    2 1.446    C    4 1.268    H   63 1.000
     4  C   3.797        C    5 1.317    C    3 1.268    C    7 1.196
     5  C   3.737        C    6 1.442    C    4 1.317    C    9 1.004
     6  C   3.665        C    5 1.442    C    1 1.308    H   64 1.001
     7  C   3.828        C    8 1.386    S   13 1.251    C    4 1.196
     8  C   3.802        C   15 1.430    C    7 1.386    C    9 1.005
     9  C   3.868        C    8 1.005    C    5 1.004    C   19 0.978    C   20 0.967
    10  C   3.699        C   11 1.324    S   16 1.207    C    1 1.154
    11  C   3.779        C   18 1.460    C   10 1.324    C   12 0.981
    12  C   3.748        C   11 0.981    C   23 0.967    C   24 0.965    C    2 0.952
    13  S   2.493        C    7 1.251    C   14 1.116
    14  C   3.929        C   15 1.388    C   28 1.337    S   13 1.116
    15  C   3.743        C    8 1.430    C   14 1.388    H   65 0.991
    16  S   2.628        C   10 1.207    C   17 1.159    O   47 0.126
    17  C   3.896        C   27 1.362    C   18 1.342    S   16 1.159
    18  C   3.731        C   11 1.460    C   17 1.342    H   66 0.998
    19  C   3.849        H   67 1.002    H   68 0.999    C   22 0.995    C    9 0.978
    20  C   3.866        H   69 1.005    H   70 1.001    C   21 0.994    C    9 0.967
    21  C   3.889        H   71 1.006    H   73 1.006    C   20 0.994    H   72 0.993
    22  C   3.902        H   74 1.007    H   76 1.006    C   19 0.995    H   75 0.993
    23  C   3.842        H   78 1.002    H   77 0.997    C   25 0.988    C   12 0.967
    24  C   3.841        H   80 1.000    H   79 0.997    C   26 0.989    C   12 0.965
    25  C   3.878        H   83 1.007    H   81 1.004    H   82 0.993    C   23 0.988
    26  C   3.878        H   84 1.006    H   85 1.005    H   86 0.993    C   24 0.989
    27  C   3.733        C   30 1.439    C   17 1.362    H   87 0.966
    28  C   3.567        C   29 1.466    C   14 1.337    H   88 0.775
    29  C   3.826        C   28 1.466    C   38 1.184    C   35 1.096
    30  C   3.804        C   27 1.439    C   34 1.196    C   31 1.118
    31  C   3.997        O   47 1.763    C   30 1.118    C   32 1.048
    32  C   3.892        C   39 1.457    C   33 1.315    C   31 1.048
    33  C   3.890        C   42 1.433    C   32 1.315    C   34 1.102
    34  C   3.826        C   50 1.432    C   30 1.196    C   33 1.102
    35  C   3.974        O   48 1.797    C   29 1.096    C   36 1.043
    36  C   3.905        C   43 1.458    C   37 1.319    C   35 1.043
    37  C   3.879        C   46 1.429    C   36 1.319    C   38 1.105
    38  C   3.847        C   49 1.438    C   29 1.184    C   37 1.105
    39  C   3.772        C   32 1.457    C   40 1.398    H   89 0.872
    40  C   3.934        C   39 1.398    C   41 1.385    Cl  60 1.066
    41  C   3.977        C   42 1.414    C   40 1.385    Cl  59 1.066
    42  C   3.681        C   33 1.433    C   41 1.414    H   90 0.825
    43  C   3.748        C   36 1.458    C   44 1.403    H   91 0.847
    44  C   3.945        C   43 1.403    C   45 1.384    Cl  61 1.065
    45  C   3.970        C   46 1.416    C   44 1.384    Cl  62 1.068
    46  C   3.711        C   37 1.429    C   45 1.416    H   92 0.862
    47  O   2.045        C   31 1.763    S   16 0.126
    48  O   1.967        C   35 1.797
    49  C   3.766        C   38 1.438    C   54 1.158    C   53 1.156
    50  C   3.753        C   34 1.432    C   52 1.161    C   51 1.159
    51  C   4.094        N   55 2.885    C   50 1.159
    52  C   4.104        N   56 2.876    C   50 1.161
    53  C   4.113        N   58 2.855    C   49 1.156
    54  C   4.098        N   57 2.885    C   49 1.158
    55  N   2.888        C   51 2.885
    56  N   2.899        C   52 2.876
    57  N   2.900        C   54 2.885
    58  N   2.900        C   53 2.855
    59  Cl  1.177        C   41 1.066
    60  Cl  1.173        C   40 1.066
    61  Cl  1.173        C   44 1.065
    62  Cl  1.177        C   45 1.068
    63  H   1.024        C    3 1.000
    64  H   1.032        C    6 1.001
    65  H   1.047        C   15 0.991
    66  H   1.046        C   18 0.998
    67  H   1.041        C   19 1.002
    68  H   1.032        C   19 0.999
    69  H   1.053        C   20 1.005
    70  H   1.039        C   20 1.001
    71  H   1.042        C   21 1.006
    72  H   1.043        C   21 0.993
    73  H   1.040        C   21 1.006
    74  H   1.053        C   22 1.007
    75  H   1.044        C   22 0.993
    76  H   1.046        C   22 1.006
    77  H   1.055        C   23 0.997
    78  H   1.044        C   23 1.002
    79  H   1.054        C   24 0.997
    80  H   1.043        C   24 1.000
    81  H   1.046        C   25 1.004
    82  H   1.050        C   25 0.993
    83  H   1.040        C   25 1.007
    84  H   1.042        C   26 1.006
    85  H   1.054        C   26 1.005
    86  H   1.049        C   26 0.993
    87  H   0.990        C   27 0.966
    88  H   0.911        C   28 0.775
    89  H   0.924        C   39 0.872
    90  H   0.942        C   42 0.825
    91  H   0.921        C   43 0.847
    92  H   0.945        C   46 0.862

 dipole moment from electron density (au)
     X       Y       Z   
  -3.7948  -2.6295  -0.2398  total (Debye):   11.751


           -------------------------------------------------
          | TOTAL ENERGY             -184.349834616687 Eh   |
          | GRADIENT NORM               0.270381966206 Eh/α |
          | HOMO-LUMO GAP               0.223172134166 eV   |
           -------------------------------------------------

------------------------------------------------------------------------
 * finished run on 2021/12/02 at 16:39:37.654     
------------------------------------------------------------------------
 total:
 * wall-time:     0 d,  0 h,  0 min,  4.471 sec
 *  cpu-time:     0 d,  0 h,  0 min,  4.452 sec
 * ratio c/w:     0.996 speedup
 SCF:
 * wall-time:     0 d,  0 h,  0 min,  3.762 sec
 *  cpu-time:     0 d,  0 h,  0 min,  3.753 sec
 * ratio c/w:     0.998 speedup

