      -----------------------------------------------------------      
     |                   =====================                   |     
     |                           x T B                           |     
     |                   =====================                   |     
     |                         S. Grimme                         |     
     |          Mulliken Center for Theoretical Chemistry        |     
     |                    University of Bonn                     |     
     |                Version 6.2 RC2 (SAW190805)                |     
      -----------------------------------------------------------      

   This program is distributed in the hope that it will be useful,
   but WITHOUT ANY WARRANTY; without even the implied warranty of
   MERCHANTABILITY or FITNESS FOR A PARTICULAR PURPOSE.
   
   FOR NON-COMMERCIAL, ACADEMIA USE ONLY.
   
   Cite this work as:
   * S. Grimme, C. Bannwarth, P. Shushkov, J. Chem. Theory Comput., 2017,
     13, 1989-2009. DOI: 10.1021/acs.jctc.7b00118
   * C. Bannwarth, S. Ehlert and S. Grimme., J. Chem. Theory Comput., 2019,
     15, 1652-1671. DOI: 10.1021/acs.jctc.8b01176
   * P. Pracht, E. Caldeweyher, S. Ehlert, S. Grimme, ChemRxiv, 2019, preprint.
     DOI: 10.26434/chemrxiv.8326202.v1
   
   for DFT-D4:
   * E. Caldeweyher, C. Bannwarth and S. Grimme, J. Chem. Phys., 2017,
     147, 034112. DOI: 10.1063/1.4993215
   * E. Caldeweyher, S. Ehlert, A. Hansen, H. Neugebauer, S. Spicher,
     C. Bannwarth and S. Grimme, J. Chem. Phys., 2019, 150, 154122.
     DOI: 10.1063/1.5090222
   
   for sTDA-xTB:
   * S. Grimme and C. Bannwarth, J. Chem. Phys., 2016, 145, 054103.
     DOI: 10.1063/1.4959605
   
   in the mass-spec context:
   * V. Asgeirsson, C. Bauer and S. Grimme, Chem. Sci., 2017, 8, 4879.
     DOI: 10.1039/c7sc00601b
   
   for metadynamics refer to:
   * S. Grimme, J. Chem. Theory Comput., 2019, 155, 2847-2862
     DOI: 10.1021/acs.jctc.9b00143
   
   with help from (in alphabetical order)
   C. Bannwarth, F. Bohle, G. Brandenburg, E. Caldeweyher, M. Checinski,
   S. Dohm, S. Ehlert, S. Ehrlich, F. März, H. Neugebauer, J. Pisarek,
   P. Pracht, P. Shushkov, and S. Spicher.
   
 * started run on 2021/12/02 at 16:45:44.202     

           -------------------------------------------------
          |                Calculation Setup                |
           -------------------------------------------------

          program call               : /ihome/ghutchison/geoffh/xtb/xtb PhITBD.xyz --vipea
          hostname                   : smp-n128
          coordinate file            : PhITBD.xyz
          omp threads                :                     1
          number of atoms            :                    93
          number of electrons        :                   298
          charge                     :                     0
          spin                       :                   0.0
          first test random number   :      0.58612638237921


########################################################################
# WARNING! Please study the warnings concerning your input carefully
#  - XTBPATH is not set, using XTBHOME instead
########################################################################

           ------------------------------------------------- 
          |                 I P E A - x T B                 |
          |  Ionisation Potentials and Electron Affinities  |
           ------------------------------------------------- 
             KAB for M(3d)-M(3d) :                1.1000
             KAB for M(4d)-M(4d) :                1.2000
             KAB for M(5d)-M(5d) :                1.2000
             k(s)                :                2.1500
             k(p)                :                2.3000
             k(d)                :                2.0000
             k(f)                :                0.0000
             kEN (H0ij)          :                0.7000
             D3 a1               :                0.6300
             D3 a2               :                5.0000
             D3 s6               :                1.0000
             D3 s8               :                2.4000
             D3 s9               :                0.0000
             alphaj              :                1.0000
             XBdamp              :                0.4400
             XBrad               :                1.3000
             kcnsh               :      1.0000   -0.3000   -0.5000    0.5000

  Z AO/shell   Hii/eV     exponent
  1     Thu Sep 22 23:34:11 CEST 2016   EN: 2.200 GAM: 0.405  GM3: 0.1500
     1s    -10.521941    1.306199
     2s     -3.560151    0.398421
  6     Thu Sep 22 23:34:11 CEST 2016   EN: 2.550 GAM: 0.640  GM3: 0.1500
     2s    -15.968100    1.979793
     2p     -9.777107    1.850537
     3S     -3.366990    0.633095
  7     Thu Sep 22 23:34:11 CEST 2016   EN: 3.040 GAM: 0.493  GM3:-0.1000
     2s    -24.040776    2.126160
     2p    -14.426520    2.068425
     3S     -5.882278    0.671040
 16     Tue Jan 17 20:57:36 CET 2017    EN: 2.580 GAM: 0.455  GM3: 0.1020
     3s    -24.488821    2.492075
     3p    -12.136640    1.997904
     3d     -1.796070    1.747541

           ------------------------------------------------- 
          |        Self-Consistent Charge Iterations        |
           ------------------------------------------------- 

          ...................................................
          :                      SETUP                      :
          :.................................................:
          :  # basis functions                 395          :
          :  # atomic orbitals                 391          :
          :  # shells                          249          :
          :  # electrons                       298          :
          :  # halogen bonds                     0          :
          :  max. iterations                   250          :
          :  Hamiltonian                  GFN1-xTB          :
          :  restarted?                      false          :
          :  GBSA solvation                  false          :
          :  PC potential                    false          :
          :  electronic temp.          300.0000000     K    :
          :  accuracy                    1.0000000          :
          :  -> integral cutoff          0.2500000E+02      :
          :  -> integral neglect         0.1000000E-07      :
          :  -> SCF convergence          0.1000000E-05 Eh   :
          :  -> wf. convergence          0.2000000E-04 e    :
          :  Broyden damping             0.4000000          :
          ...................................................

 iter      E             dE          RMSdq      gap      omega  full diag
   1   -189.3234534 -0.189323E+03  0.104E+01    0.90       0.0  T
   2   -187.2639826  0.205947E+01  0.680E+00    0.50       1.0  T
   3   -183.8126685  0.345131E+01  0.611E+00    0.02       1.0  T
   4   -187.4325936 -0.361993E+01  0.292E+00    0.61       1.0  T
   5   -190.3941765 -0.296158E+01  0.133E+00    1.18       1.0  T
   6   -190.4670187 -0.728422E-01  0.940E-01    1.26       1.0  T
   7   -190.4732064 -0.618774E-02  0.774E-01    0.18       1.0  T
   8   -189.5918200  0.881386E+00  0.164E+00    0.57       1.0  T
   9   -189.5567126  0.351074E-01  0.169E+00    0.49       1.0  T
  10   -189.5887175 -0.320049E-01  0.164E+00    0.57       1.0  T
  11   -190.4551917 -0.866474E+00  0.659E-01    0.93       1.0  T
  12   -190.4590329 -0.384122E-02  0.620E-01    0.41       1.0  T
  13   -190.4812247 -0.221918E-01  0.504E-01    0.17       1.0  T
  14   -190.0400412  0.441183E+00  0.113E+00    0.16       1.0  T
  15   -189.9815292  0.585120E-01  0.120E+00    0.30       1.0  T
  16   -190.4464289 -0.464900E+00  0.563E-01    0.02       1.0  T
  17   -190.5105627 -0.641337E-01  0.276E-01    0.09       1.0  T
  18   -190.5014853  0.907742E-02  0.256E-01    0.20       1.0  T
  19   -190.5143967 -0.129114E-01  0.163E-01    0.11       1.0  T
  20   -190.5094783  0.491834E-02  0.195E-01    0.14       1.0  T
  21   -190.5066484  0.282991E-02  0.182E-01    0.05       1.0  T
  22   -190.5142314 -0.758292E-02  0.132E-01    0.06       1.0  T
  23   -190.5188104 -0.457904E-02  0.107E-01    0.06       1.0  T
  24   -190.5096592  0.915121E-02  0.179E-01    0.04       1.0  T
  25   -190.4852174  0.244418E-01  0.296E-01    0.01       1.0  T
  26   -190.5216086 -0.363912E-01  0.345E-02    0.08       1.0  T
  27   -190.4716346  0.499740E-01  0.408E-01    0.03       1.0  T
  28   -190.5214650 -0.498304E-01  0.348E-02    0.08       1.0  T
  29   -190.5217578 -0.292849E-03  0.253E-02    0.07       1.0  T
  30   -190.5218059 -0.480991E-04  0.222E-02    0.07       1.0  T
  31   -190.5218346 -0.286841E-04  0.195E-02    0.07       1.0  T
  32   -190.5218359 -0.125712E-05  0.194E-02    0.07       1.0  T
  33   -190.5219024 -0.665088E-04  0.112E-02    0.07       1.0  T
  34   -190.5219304 -0.280753E-04  0.441E-03    0.07       2.4  T
  35   -190.5219356 -0.510365E-05  0.801E-04    0.07      12.9  T
  36   -190.5219358 -0.220484E-06  0.102E-04    0.07     101.4  T
  37   -190.5219358 -0.498204E-08  0.415E-05    0.07     249.8  T

   *** convergence criteria satisfied after 37 iterations ***

         #    Occupation            Energy/Eh            Energy/eV
      -------------------------------------------------------------
         1        2.0000           -1.4189957             -38.6128
       ...           ...                  ...                  ...
       143        2.0000           -0.3966040             -10.7921
       144        2.0000           -0.3791599             -10.3175
       145        2.0000           -0.3715806             -10.1112
       146        2.0000           -0.3576420              -9.7319
       147        2.0000           -0.3501692              -9.5286
       148        1.9465           -0.3270014              -8.8982
       149        1.6302           -0.3249969              -8.8436 (HOMO)
       150        0.4212           -0.3223321              -8.7711 (LUMO)
       151        0.0021           -0.3170709              -8.6279
       152                         -0.2811067              -7.6493
       153                         -0.2755050              -7.4969
       154                         -0.2726717              -7.4198
       ...                                ...                  ...
       391                        605.1326330           16466.4971
      -------------------------------------------------------------
                  HL-Gap            0.0026648 Eh            0.0725 eV
             Fermi-level           -0.3235874 Eh           -8.8053 eV

 SCC (total)                   0 d,  0 h,  0 min,  1.777 sec
 SCC setup                      ...        0 min,  0.003 sec (  0.195%)
 Dispersion                     ...        0 min,  0.000 sec (  0.016%)
 integral evaluation            ...        0 min,  0.682 sec ( 38.364%)
 zeroth order Hamiltonian       ...        0 min,  0.003 sec (  0.166%)
 iterations                     ...        0 min,  0.870 sec ( 48.943%)
 molecular gradient             ...        0 min,  0.215 sec ( 12.119%)
 printout                       ...        0 min,  0.003 sec (  0.195%)

         :::::::::::::::::::::::::::::::::::::::::::::::::::::
         ::                     SUMMARY                     ::
         :::::::::::::::::::::::::::::::::::::::::::::::::::::
         :: total energy            -186.865163102215 Eh    ::
         :: gradient norm              0.273445276494 Eh/a0 ::
         :: HOMO-LUMO gap              0.072514082692 eV    ::
         ::.................................................::
         :: SCC energy              -190.521935778112 Eh    ::
         :: -> electrostatic           0.329595856497 Eh    ::
         :: repulsion energy           3.739860795083 Eh    ::
         :: dispersion energy         -0.083088119186 Eh    ::
         :: halogen bond corr.         0.000000000000 Eh    ::
         :: add. restraining           0.000000000000 Eh    ::
         :::::::::::::::::::::::::::::::::::::::::::::::::::::

           ------------------------------------------------- 
          |        vertical delta SCC IP calculation        |
           ------------------------------------------------- 

          ...................................................
          :                      SETUP                      :
          :.................................................:
          :  # basis functions                 395          :
          :  # atomic orbitals                 391          :
          :  # shells                          249          :
          :  # electrons                       297          :
          :  # halogen bonds                     0          :
          :  max. iterations                   250          :
          :  Hamiltonian                  GFN1-xTB          :
          :  restarted?                       true          :
          :  GBSA solvation                  false          :
          :  PC potential                    false          :
          :  electronic temp.          300.0000000     K    :
          :  accuracy                    1.0000000          :
          :  -> integral cutoff          0.2500000E+02      :
          :  -> integral neglect         0.1000000E-07      :
          :  -> SCF convergence          0.1000000E-05 Eh   :
          :  -> wf. convergence          0.2000000E-04 e    :
          :  Broyden damping             0.4000000          :
          ...................................................

 iter      E             dE          RMSdq      gap      omega  full diag
   1   -190.1271147 -0.190127E+03  0.345E-01    0.07       0.0  T
   2   -190.0128487  0.114266E+00  0.700E-01    0.77       1.0  T
   3   -190.1280334 -0.115185E+00  0.333E-01    0.92       1.0  T
   4   -190.1413470 -0.133136E-01  0.227E-01    0.93       1.0  T
   5   -190.1317578  0.958922E-02  0.286E-01    0.82       1.0  T
   6   -190.1482313 -0.164735E-01  0.159E-01    0.87       1.0  T
   7   -190.1333434  0.148879E-01  0.267E-01    0.90       1.0  T
   8   -190.1463343 -0.129909E-01  0.178E-01    0.88       1.0  T
   9   -190.1559413 -0.960705E-02  0.351E-02    0.91       1.0  T
  10   -190.1563097 -0.368368E-03  0.815E-03    0.91       1.3  T
  11   -190.1563219 -0.121756E-04  0.505E-03    0.91       2.1  T
  12   -190.1563277 -0.588813E-05  0.246E-03    0.91       4.2  T
  13   -190.1563295 -0.175716E-05  0.594E-04    0.91      17.5  T
  14   -190.1563295  0.249841E-07  0.652E-04    0.91      15.9  T
  15   -190.1563296 -0.135048E-06  0.691E-05    0.91     150.1  T
  16   -190.1563296 -0.847734E-09  0.450E-05    0.91     230.3  T

   *** convergence criteria satisfied after 16 iterations ***

         #    Occupation            Energy/Eh            Energy/eV
      -------------------------------------------------------------
         1        2.0000           -1.4759941             -40.1638
       ...           ...                  ...                  ...
       143        2.0000           -0.4699490             -12.7880
       144        2.0000           -0.4494668             -12.2306
       145        2.0000           -0.4434287             -12.0663
       146        2.0000           -0.4408257             -11.9955
       147        1.9999           -0.4296187             -11.6905
       148        1.6858           -0.4211922             -11.4612
       149        1.3143           -0.4197097             -11.4209 (HOMO)
       150                         -0.3863351             -10.5127 (LUMO)
       151                         -0.3759910             -10.2312
       152                         -0.3449867              -9.3876
       153                         -0.3346847              -9.1072
       154                         -0.3300686              -8.9816
       ...                                ...                  ...
       391                        605.0628156           16464.5973
      -------------------------------------------------------------
                  HL-Gap            0.0333746 Eh            0.9082 eV
             Fermi-level           -0.4116913 Eh          -11.2027 eV

 SCC (total)                   0 d,  0 h,  0 min,  1.275 sec
 SCC setup                      ...        0 min,  0.004 sec (  0.276%)
 Dispersion                     ...        0 min,  0.000 sec (  0.013%)
 integral evaluation            ...        0 min,  0.680 sec ( 53.331%)
 zeroth order Hamiltonian       ...        0 min,  0.003 sec (  0.223%)
 iterations                     ...        0 min,  0.370 sec ( 28.991%)
 molecular gradient             ...        0 min,  0.215 sec ( 16.874%)
 printout                       ...        0 min,  0.004 sec (  0.289%)

         :::::::::::::::::::::::::::::::::::::::::::::::::::::
         ::                     SUMMARY                     ::
         :::::::::::::::::::::::::::::::::::::::::::::::::::::
         :: total energy            -186.499556936638 Eh    ::
         :: gradient norm              0.259726908817 Eh/a0 ::
         :: HOMO-LUMO gap              0.908167884649 eV    ::
         ::.................................................::
         :: SCC energy              -190.156329612535 Eh    ::
         :: -> electrostatic           0.363385365401 Eh    ::
         :: repulsion energy           3.739860795083 Eh    ::
         :: dispersion energy         -0.083088119186 Eh    ::
         :: halogen bond corr.         0.000000000000 Eh    ::
         :: add. restraining           0.000000000000 Eh    ::
         :::::::::::::::::::::::::::::::::::::::::::::::::::::

------------------------------------------------------------------------
empirical IP shift (eV):    4.8455
delta SCC IP (eV):    5.1031
------------------------------------------------------------------------
           ------------------------------------------------- 
          |        vertical delta SCC EA calculation        |
           ------------------------------------------------- 

          ...................................................
          :                      SETUP                      :
          :.................................................:
          :  # basis functions                 395          :
          :  # atomic orbitals                 391          :
          :  # shells                          249          :
          :  # electrons                       299          :
          :  # halogen bonds                     0          :
          :  max. iterations                   250          :
          :  Hamiltonian                  GFN1-xTB          :
          :  restarted?                       true          :
          :  GBSA solvation                  false          :
          :  PC potential                    false          :
          :  electronic temp.          300.0000000     K    :
          :  accuracy                    1.0000000          :
          :  -> integral cutoff          0.2500000E+02      :
          :  -> integral neglect         0.1000000E-07      :
          :  -> SCF convergence          0.1000000E-05 Eh   :
          :  -> wf. convergence          0.2000000E-04 e    :
          :  Broyden damping             0.4000000          :
          ...................................................

 iter      E             dE          RMSdq      gap      omega  full diag
   1   -190.7515734 -0.190752E+03  0.502E-01    0.28       0.0  T
   2   -190.5416950  0.209878E+00  0.726E-01    0.24       1.0  T
   3   -190.7752373 -0.233542E+00  0.320E-01    0.27       1.0  T
   4   -190.7973094 -0.220721E-01  0.203E-01    0.16       1.0  T
   5   -190.7550645  0.422449E-01  0.298E-01    0.29       1.0  T
   6   -190.8020084 -0.469440E-01  0.134E-01    0.16       1.0  T
   7   -190.7623797  0.396287E-01  0.324E-01    0.11       1.0  T
   8   -190.8031442 -0.407645E-01  0.944E-02    0.16       1.0  T
   9   -190.8083011 -0.515682E-02  0.222E-02    0.15       1.0  T
  10   -190.8082825  0.185919E-04  0.209E-02    0.15       1.0  T
  11   -190.8084643 -0.181874E-03  0.594E-03    0.15       1.7  T
  12   -190.8084623  0.202563E-05  0.518E-03    0.15       2.0  T
  13   -190.8084700 -0.766706E-05  0.434E-03    0.15       2.4  T
  14   -190.8084773 -0.734815E-05  0.120E-03    0.15       8.7  T
  15   -190.8084779 -0.583594E-06  0.404E-04    0.15      25.7  T
  16   -190.8084780 -0.579872E-07  0.285E-04    0.15      36.4  T
  17   -190.8084780 -0.346806E-07  0.484E-05    0.15     214.2  T
  18   -190.8084780  0.291180E-09  0.475E-05    0.15     218.4  T

   *** convergence criteria satisfied after 18 iterations ***

         #    Occupation            Energy/Eh            Energy/eV
      -------------------------------------------------------------
         1        2.0000           -1.3453004             -36.6075
       ...           ...                  ...                  ...
       144        2.0000           -0.3090182              -8.4088
       145        2.0000           -0.3017491              -8.2110
       146        2.0000           -0.3004101              -8.1746
       147        2.0000           -0.2795970              -7.6082
       148        2.0000           -0.2694951              -7.3333
       149        1.7914           -0.2534589              -6.8970
       150        1.1563           -0.2508829              -6.8269 (HOMO)
       151        0.0523           -0.2452843              -6.6745 (LUMO)
       152                         -0.2101409              -5.7182
       153                         -0.2048932              -5.5754
       154                         -0.2037986              -5.5456
       155                         -0.1783193              -4.8523
       ...                                ...                  ...
       391                        605.1979980           16468.2758
      -------------------------------------------------------------
                  HL-Gap            0.0055986 Eh            0.1523 eV
             Fermi-level           -0.2501115 Eh           -6.8059 eV

 SCC (total)                   0 d,  0 h,  0 min,  1.323 sec
 SCC setup                      ...        0 min,  0.003 sec (  0.257%)
 Dispersion                     ...        0 min,  0.000 sec (  0.020%)
 integral evaluation            ...        0 min,  0.679 sec ( 51.319%)
 zeroth order Hamiltonian       ...        0 min,  0.003 sec (  0.214%)
 iterations                     ...        0 min,  0.418 sec ( 31.621%)
 molecular gradient             ...        0 min,  0.215 sec ( 16.258%)
 printout                       ...        0 min,  0.004 sec (  0.308%)

         :::::::::::::::::::::::::::::::::::::::::::::::::::::
         ::                     SUMMARY                     ::
         :::::::::::::::::::::::::::::::::::::::::::::::::::::
         :: total energy            -187.151705332006 Eh    ::
         :: gradient norm              0.294483059173 Eh/a0 ::
         :: HOMO-LUMO gap              0.152344819161 eV    ::
         ::.................................................::
         :: SCC energy              -190.808478007903 Eh    ::
         :: -> electrostatic           0.370067046434 Eh    ::
         :: repulsion energy           3.739860795083 Eh    ::
         :: dispersion energy         -0.083088119186 Eh    ::
         :: halogen bond corr.         0.000000000000 Eh    ::
         :: add. restraining           0.000000000000 Eh    ::
         :::::::::::::::::::::::::::::::::::::::::::::::::::::

------------------------------------------------------------------------
empirical EA shift (eV):    4.8455
delta SCC EA (eV):    2.9517
------------------------------------------------------------------------
           -------------------------------------------------
          |                Property Printout                |
           -------------------------------------------------

    * Orbital Energies and Occupations

         #    Occupation            Energy/Eh            Energy/eV
      -------------------------------------------------------------
         1        2.0000           -1.3453004             -36.6075
       ...           ...                  ...                  ...
       138        2.0000           -0.3594635              -9.7815
       139        2.0000           -0.3574380              -9.7264
       140        2.0000           -0.3541264              -9.6363
       141        2.0000           -0.3419735              -9.3056
       142        2.0000           -0.3377747              -9.1913
       143        2.0000           -0.3290484              -8.9539
       144        2.0000           -0.3090182              -8.4088
       145        2.0000           -0.3017491              -8.2110
       146        2.0000           -0.3004101              -8.1746
       147        2.0000           -0.2795970              -7.6082
       148        2.0000           -0.2694951              -7.3333
       149        1.7914           -0.2534589              -6.8970
       150        1.1563           -0.2508829              -6.8269 (HOMO)
       151        0.0523           -0.2452843              -6.6745 (LUMO)
       152                         -0.2101409              -5.7182
       153                         -0.2048932              -5.5754
       154                         -0.2037986              -5.5456
       155                         -0.1783193              -4.8523
       156                         -0.1654614              -4.5024
       157                         -0.1568633              -4.2685
       158                         -0.1553904              -4.2284
       159                         -0.1506943              -4.1006
       160                         -0.1474825              -4.0132
       161                         -0.1459399              -3.9712
       ...                                ...                  ...
       391                        605.1979980           16468.2758
      -------------------------------------------------------------
                  HL-Gap            0.0055986 Eh            0.1523 eV
             Fermi-level           -0.2501115 Eh           -6.8059 eV

  Mulliken/CM5 charges        n(s)   n(p)   n(d)
     1 C  -0.12387 -0.12241   0.610  3.266  0.000
     2 C  -0.16768 -0.21952   0.713  3.120  0.000
     3 C  -0.11151 -0.16386   0.612  3.276  0.000
     4 C   0.09808  0.09580   1.037  3.061  0.000
     5 C  -0.06061  0.02419   1.172  2.767  0.000
     6 C   0.00788  0.09292   1.142  2.866  0.000
     7 N   0.26350  0.09530   1.460  3.804  0.000
     8 S  -0.13048  0.00836   1.855  3.685  0.330
     9 N   0.25142  0.07944   1.465  3.787  0.000
    10 C  -0.00386 -0.05077   1.114  2.882  0.000
    11 C   0.00559  0.00832   1.039  2.967  0.000
    12 C  -0.10499  0.01506   1.208  2.687  0.000
    13 C  -0.10808  0.01037   1.203  2.689  0.000
    14 N   0.30257  0.17666   1.539  3.763  0.000
    15 N   0.29584  0.16650   1.524  3.771  0.000
    16 C   0.00042  0.00185   1.079  2.921  0.000
    17 C   0.03628 -0.01553   1.069  2.968  0.000
    18 C   0.03077 -0.02241   1.074  2.957  0.000
    19 C   0.00905  0.00696   1.067  2.942  0.000
    20 C  -0.07544  0.01095   1.142  2.783  0.000
    21 C  -0.07303  0.01195   1.144  2.783  0.000
    22 N   0.23916  0.07086   1.454  3.785  0.000
    23 S  -0.16087 -0.02113   1.851  3.661  0.327
    24 N   0.24736  0.07471   1.451  3.796  0.000
    25 C  -0.00073 -0.04820   1.104  2.895  0.000
    26 C  -0.00947 -0.00498   1.058  2.933  0.000
    27 C  -0.10949  0.01065   1.206  2.685  0.000
    28 C  -0.11087  0.01353   1.222  2.667  0.000
    29 N   0.29408  0.16821   1.536  3.758  0.000
    30 N   0.29267  0.16680   1.544  3.749  0.000
    31 C   0.00402  0.01402   1.137  2.867  0.000
    32 C   0.02720 -0.02260   1.094  2.933  0.000
    33 C   0.03803 -0.01381   1.068  2.970  0.000
    34 C  -0.01297 -0.00477   1.139  2.848  0.000
    35 S   0.07708  0.03723   1.875  4.127  0.075
    36 C   0.00382 -0.00290   1.075  2.929  0.000
    37 C   0.03074 -0.02142   1.085  2.946  0.000
    38 C   0.03294 -0.01971   1.082  2.951  0.000
    39 C   0.00073 -0.00273   1.074  2.927  0.000
    40 C  -0.00237 -0.00801   1.086  2.912  0.000
    41 C   0.02312 -0.02791   1.056  2.967  0.000
    42 C  -0.00557  0.00766   1.137  2.857  0.000
    43 C   0.00678  0.00354   1.082  2.925  0.000
    44 C  -0.02322 -0.02748   1.090  2.887  0.000
    45 S   0.07308  0.03639   1.877  4.126  0.070
    46 C  -0.01457 -0.00493   1.154  2.832  0.000
    47 C   0.03027 -0.01722   1.068  2.962  0.000
    48 C  -0.00269 -0.01170   1.072  2.925  0.000
    49 C   0.00044 -0.00842   1.070  2.930  0.000
    50 C   0.03049 -0.02277   1.070  2.961  0.000
    51 C   0.03717 -0.01715   1.079  2.958  0.000
    52 C   0.01039 -0.00604   1.104  2.906  0.000
    53 C   0.03408 -0.02033   1.073  2.961  0.000
    54 C   0.02574 -0.02809   1.067  2.959  0.000
    55 C   0.03084 -0.02226   1.071  2.960  0.000
    56 C   0.04719 -0.00716   1.080  2.967  0.000
    57 C   0.03596  0.01952   1.124  2.912  0.000
    58 C   0.04903 -0.00534   1.078  2.971  0.000
    59 C   0.03038 -0.02352   1.064  2.966  0.000
    60 C   0.06571 -0.04121   1.094  2.971  0.000
    61 C   0.61072  0.45934   0.908  3.703  0.000
    62 C   0.36494  0.25803   0.987  3.378  0.000
    63 C   0.58789  0.43648   0.944  3.643  0.000
    64 H   0.14936  0.20995   1.149  0.000  0.000
    65 H   0.00823  0.07273   1.008  0.000  0.000
    66 H  -0.02353  0.04154   0.976  0.000  0.000
    67 H  -0.02461  0.03596   0.975  0.000  0.000
    68 H  -0.02894  0.02874   0.971  0.000  0.000
    69 H  -0.03806  0.02116   0.962  0.000  0.000
    70 H  -0.02396  0.04265   0.976  0.000  0.000
    71 H  -0.02540  0.03254   0.975  0.000  0.000
    72 H  -0.02467  0.03567   0.975  0.000  0.000
    73 H  -0.02665  0.03073   0.973  0.000  0.000
    74 H  -0.01463  0.04591   0.985  0.000  0.000
    75 H  -0.02065  0.04783   0.979  0.000  0.000
    76 H  -0.00655  0.05356   0.993  0.000  0.000
    77 H   0.00229  0.05975   1.002  0.000  0.000
    78 H  -0.00004  0.05749   1.000  0.000  0.000
    79 H  -0.00389  0.05582   0.996  0.000  0.000
    80 H  -0.00945  0.05068   0.991  0.000  0.000
    81 H   0.01494  0.07246   1.015  0.000  0.000
    82 H   0.01964  0.07711   1.020  0.000  0.000
    83 H  -0.00122  0.05860   0.999  0.000  0.000
    84 H   0.02996  0.08577   1.030  0.000  0.000
    85 H   0.00642  0.06227   1.006  0.000  0.000
    86 H  -0.28199 -0.22932   0.718  0.000  0.000
    87 H  -0.26478 -0.21318   0.735  0.000  0.000
    88 H  -0.29509 -0.24249   0.705  0.000  0.000
    89 H  -0.30292 -0.24710   0.697  0.000  0.000
    90 H  -0.28713 -0.23130   0.713  0.000  0.000
    91 H  -0.24832 -0.19570   0.752  0.000  0.000
    92 H  -0.28900 -0.23739   0.711  0.000  0.000
    93 H  -0.26042 -0.20775   0.740  0.000  0.000
(R)spin-density population

 Mulliken population n(s)   n(p)   n(d)
     1 C   0.0228   0.001  0.022  0.000
     2 C   0.0267   0.009  0.018  0.000
     3 C   0.0067  -0.000  0.007  0.000
     4 C   0.0309   0.002  0.029  0.000
     5 C   0.0008   0.000  0.001  0.000
     6 C   0.0081   0.003  0.005  0.000
     7 N   0.0242   0.000  0.024  0.000
     8 S   0.0595  -0.000  0.047  0.013
     9 N   0.0315   0.001  0.031  0.000
    10 C   0.0179   0.001  0.017  0.000
    11 C   0.0210   0.001  0.020  0.000
    12 C   0.0020   0.000  0.002  0.000
    13 C   0.0032   0.001  0.002  0.000
    14 N   0.0083  -0.000  0.008  0.000
    15 N   0.0117   0.001  0.011  0.000
    16 C   0.0371  -0.000  0.037  0.000
    17 C   0.0190  -0.000  0.019  0.000
    18 C   0.0286   0.000  0.029  0.000
    19 C   0.0280   0.000  0.028  0.000
    20 C   0.0006   0.000  0.001  0.000
    21 C   0.0017   0.000  0.002  0.000
    22 N   0.0324   0.000  0.032  0.000
    23 S   0.0666   0.000  0.052  0.014
    24 N   0.0358   0.000  0.036  0.000
    25 C   0.0195   0.000  0.019  0.000
    26 C   0.0272   0.000  0.027  0.000
    27 C   0.0031   0.000  0.003  0.000
    28 C   0.0023   0.000  0.002  0.000
    29 N   0.0118  -0.000  0.012  0.000
    30 N   0.0096   0.000  0.010  0.000
    31 C   0.0098   0.001  0.009  0.000
    32 C   0.0214   0.001  0.021  0.000
    33 C   0.0038   0.000  0.004  0.000
    34 C   0.0222   0.000  0.022  0.000
    35 S   0.0191   0.000  0.016  0.003
    36 C   0.0090   0.000  0.009  0.000
    37 C   0.0053   0.000  0.005  0.000
    38 C   0.0056  -0.000  0.006  0.000
    39 C   0.0084  -0.000  0.008  0.000
    40 C   0.0048  -0.000  0.005  0.000
    41 C   0.0062   0.000  0.006  0.000
    42 C   0.0177   0.000  0.018  0.000
    43 C   0.0029   0.000  0.003  0.000
    44 C   0.0001  -0.000  0.000  0.000
    45 S   0.0139  -0.000  0.012  0.002
    46 C   0.0049   0.000  0.005  0.000
    47 C   0.0178   0.000  0.018  0.000
    48 C   0.0004   0.000  0.000  0.000
    49 C   0.0004   0.000  0.000  0.000
    50 C   0.0001   0.000  0.000  0.000
    51 C   0.0000   0.000  0.000  0.000
    52 C   0.0000   0.000  0.000  0.000
    53 C   0.0000   0.000  0.000  0.000
    54 C   0.0000   0.000  0.000  0.000
    55 C   0.0008   0.000  0.001  0.000
    56 C   0.0020   0.000  0.002  0.000
    57 C   0.0008   0.000  0.001  0.000
    58 C   0.0020   0.001  0.001  0.000
    59 C   0.0004  -0.000  0.000  0.000
    60 C  -0.0000  -0.000  0.000  0.000
    61 C   0.0000   0.000  0.000  0.000
    62 C   0.0726  -0.000  0.073  0.000
    63 C   0.0660  -0.000  0.066  0.000
    64 H   0.0124   0.012  0.000  0.000
    65 H   0.0110   0.011  0.000  0.000
    66 H   0.0010   0.001  0.000  0.000
    67 H   0.0000   0.000  0.000  0.000
    68 H   0.0000   0.000  0.000  0.000
    69 H   0.0004   0.000  0.000  0.000
    70 H   0.0001   0.000  0.000  0.000
    71 H   0.0002   0.000  0.000  0.000
    72 H  -0.0000  -0.000  0.000  0.000
    73 H   0.0000   0.000  0.000  0.000
    74 H   0.0000   0.000  0.000  0.000
    75 H   0.0000   0.000  0.000  0.000
    76 H   0.0000   0.000  0.000  0.000
    77 H   0.0000   0.000  0.000  0.000
    78 H   0.0000   0.000  0.000  0.000
    79 H   0.0000   0.000  0.000  0.000
    80 H   0.0002   0.000  0.000  0.000
    81 H   0.0000   0.000  0.000  0.000
    82 H   0.0001   0.000  0.000  0.000
    83 H   0.0001   0.000  0.000  0.000
    84 H   0.0000   0.000  0.000  0.000
    85 H   0.0000   0.000  0.000  0.000
    86 H   0.0000   0.000  0.000  0.000
    87 H   0.0000   0.000  0.000  0.000
    88 H   0.0000   0.000  0.000  0.000
    89 H   0.0145   0.015  0.000  0.000
    90 H   0.0101   0.010  0.000  0.000
    91 H   0.0130   0.013  0.000  0.000
    92 H   0.0005   0.001  0.000  0.000
    93 H   0.0191   0.019  0.000  0.000

Wiberg/Mayer (AO) data.
largest (>0.10) Wiberg bond orders for each atom
          total WBO             WBO to atom ...
     1  C   2.303        C    6 0.934    C   31 0.777    C    2 0.317    C    3 0.208
     2  C   2.162        H   64 0.806    C    3 0.338    C    1 0.317    H   65 0.254    C   31 0.243
     3  C   2.304        C    4 1.016    H   65 0.645    C    2 0.338    C    1 0.208
     4  C   3.677        C   10 1.250    C    5 1.205    C    3 1.016
     5  C   4.027        N    7 1.492    C    4 1.205    C    6 1.196
     6  C   3.885        N    9 1.509    C    5 1.196    C    1 0.934    S    8 0.123
     7  N   2.923        C    5 1.492    S    8 1.414
     8  S   3.102        N    7 1.414    N    9 1.402    C    6 0.123
     9  N   2.905        C    6 1.509    S    8 1.402
    10  C   3.867        C   11 1.497    C    4 1.250    H   66 0.997
    11  C   3.809        C   10 1.497    C   13 1.154    C   12 1.135
    12  C   4.111        N   14 2.913    C   11 1.135
    13  C   4.092        N   15 2.885    C   11 1.154
    14  N   2.959        C   12 2.913
    15  N   2.925        C   13 2.885
    16  C   3.821        C   17 1.374    C   21 1.226    C   46 1.213
    17  C   3.834        C   18 1.442    C   16 1.374    H   67 0.983
    18  C   3.812        C   17 1.442    C   19 1.366    H   68 0.986
    19  C   3.833        C   18 1.366    C   20 1.228    C   25 1.207
    20  C   4.002        N   22 1.497    C   19 1.228    C   21 1.201
    21  C   4.005        N   24 1.495    C   16 1.226    C   20 1.201
    22  N   2.916        C   20 1.497    S   23 1.418
    23  S   3.104        N   22 1.418    N   24 1.416
    24  N   2.900        C   21 1.495    S   23 1.416
    25  C   3.870        C   26 1.559    C   19 1.207    H   69 0.989
    26  C   3.845        C   25 1.559    C   28 1.144    C   27 1.133
    27  C   4.101        N   29 2.918    C   26 1.133
    28  C   4.131        N   30 2.922    C   26 1.144
    29  N   2.950        C   27 2.918
    30  N   2.964        C   28 2.922
    31  C   3.853        C   32 1.471    S   35 1.158    C    1 0.777    C    2 0.243
    32  C   3.841        C   31 1.471    C   33 1.353    H   70 0.991
    33  C   3.838        C   34 1.488    C   32 1.353    H   71 0.986
    34  C   3.847        C   33 1.488    S   35 1.206    C   36 1.156
    35  S   2.537        C   34 1.206    C   31 1.158
    36  C   3.859        C   37 1.359    C   41 1.338    C   34 1.156
    37  C   3.876        C   38 1.496    C   36 1.359    H   72 0.987
    38  C   3.878        C   37 1.496    C   39 1.367    H   73 0.989
    39  C   3.843        C   38 1.367    C   40 1.310    C   42 1.178
    40  C   3.840        C   41 1.530    C   39 1.310    C   44 0.994
    41  C   3.794        C   40 1.530    C   36 1.338    H   74 1.004
    42  C   3.845        C   43 1.432    S   45 1.226    C   39 1.178
    43  C   3.829        C   42 1.432    C   47 1.379    C   44 0.998
    44  C   3.899        C   43 0.998    C   40 0.994    C   48 0.985    C   49 0.983
    45  S   2.505        C   42 1.226    C   46 1.169
    46  C   3.901        C   47 1.467    C   16 1.213    S   45 1.169
    47  C   3.774        C   46 1.467    C   43 1.379    H   75 0.999
    48  C   3.848        C   50 1.446    C   54 1.430    C   44 0.985
    49  C   3.844        C   55 1.439    C   59 1.433    C   44 0.983
    50  C   3.854        C   48 1.446    C   51 1.445    H   76 0.994
    51  C   3.889        C   50 1.445    C   52 1.431    H   77 0.990
    52  C   3.913        C   51 1.431    C   53 1.420    C   60 1.012
    53  C   3.875        C   54 1.461    C   52 1.420    H   78 0.990
    54  C   3.844        C   53 1.461    C   48 1.430    H   79 0.996
    55  C   3.857        C   56 1.453    C   49 1.439    H   80 0.994
    56  C   3.887        C   55 1.453    C   57 1.413    H   81 0.990
    57  C   3.913        C   56 1.413    C   58 1.410    C   62 1.028
    58  C   3.880        C   59 1.457    C   57 1.410    H   82 0.992
    59  C   3.839        C   58 1.457    C   49 1.433    H   83 0.995
    60  C   3.913        C   52 1.012    H   84 0.999    H   85 0.991    C   61 0.914
    61  C   3.444        C   60 0.914    H   87 0.873    H   86 0.845    H   88 0.824
    62  C   3.484        C   57 1.028    C   63 0.869    H   90 0.828    H   89 0.803
    63  C   3.412        H   91 0.871    C   62 0.869    H   93 0.840    H   92 0.835
    64  H   0.984        C    2 0.806
    65  H   1.041        C    3 0.645    C    2 0.254
    66  H   1.067        C   10 0.997
    67  H   1.030        C   17 0.983
    68  H   1.021        C   18 0.986
    69  H   1.031        C   25 0.989
    70  H   1.070        C   32 0.991
    71  H   1.034        C   33 0.986
    72  H   1.035        C   37 0.987
    73  H   1.022        C   38 0.989
    74  H   1.050        C   41 1.004
    75  H   1.067        C   47 0.999
    76  H   1.062        C   50 0.994
    77  H   1.071        C   51 0.990
    78  H   1.069        C   53 0.990
    79  H   1.070        C   54 0.996
    80  H   1.053        C   55 0.994
    81  H   1.079        C   56 0.990
    82  H   1.082        C   58 0.992
    83  H   1.065        C   59 0.995
    84  H   1.052        C   60 0.999
    85  H   1.004        C   60 0.991
    86  H   0.944        C   61 0.845
    87  H   0.939        C   61 0.873
    88  H   0.932        C   61 0.824
    89  H   0.924        C   62 0.803
    90  H   0.934        C   62 0.828
    91  H   0.928        C   63 0.871
    92  H   0.941        C   63 0.835
    93  H   0.905        C   63 0.840

 dipole moment from electron density (au)
     X       Y       Z   
   1.7084  17.0065   0.9502  total (Debye):   43.511


           -------------------------------------------------
          | TOTAL ENERGY             -187.151705332006 Eh   |
          | GRADIENT NORM               0.294483059173 Eh/α |
          | HOMO-LUMO GAP               0.152344819161 eV   |
           -------------------------------------------------

------------------------------------------------------------------------
 * finished run on 2021/12/02 at 16:45:49.287     
------------------------------------------------------------------------
 total:
 * wall-time:     0 d,  0 h,  0 min,  5.085 sec
 *  cpu-time:     0 d,  0 h,  0 min,  5.064 sec
 * ratio c/w:     0.996 speedup
 SCF:
 * wall-time:     0 d,  0 h,  0 min,  4.378 sec
 *  cpu-time:     0 d,  0 h,  0 min,  4.367 sec
 * ratio c/w:     0.997 speedup

