      -----------------------------------------------------------      
     |                   =====================                   |     
     |                           x T B                           |     
     |                   =====================                   |     
     |                         S. Grimme                         |     
     |          Mulliken Center for Theoretical Chemistry        |     
     |                    University of Bonn                     |     
     |                Version 6.2 RC2 (SAW190805)                |     
      -----------------------------------------------------------      

   This program is distributed in the hope that it will be useful,
   but WITHOUT ANY WARRANTY; without even the implied warranty of
   MERCHANTABILITY or FITNESS FOR A PARTICULAR PURPOSE.
   
   FOR NON-COMMERCIAL, ACADEMIA USE ONLY.
   
   Cite this work as:
   * S. Grimme, C. Bannwarth, P. Shushkov, J. Chem. Theory Comput., 2017,
     13, 1989-2009. DOI: 10.1021/acs.jctc.7b00118
   * C. Bannwarth, S. Ehlert and S. Grimme., J. Chem. Theory Comput., 2019,
     15, 1652-1671. DOI: 10.1021/acs.jctc.8b01176
   * P. Pracht, E. Caldeweyher, S. Ehlert, S. Grimme, ChemRxiv, 2019, preprint.
     DOI: 10.26434/chemrxiv.8326202.v1
   
   for DFT-D4:
   * E. Caldeweyher, C. Bannwarth and S. Grimme, J. Chem. Phys., 2017,
     147, 034112. DOI: 10.1063/1.4993215
   * E. Caldeweyher, S. Ehlert, A. Hansen, H. Neugebauer, S. Spicher,
     C. Bannwarth and S. Grimme, J. Chem. Phys., 2019, 150, 154122.
     DOI: 10.1063/1.5090222
   
   for sTDA-xTB:
   * S. Grimme and C. Bannwarth, J. Chem. Phys., 2016, 145, 054103.
     DOI: 10.1063/1.4959605
   
   in the mass-spec context:
   * V. Asgeirsson, C. Bauer and S. Grimme, Chem. Sci., 2017, 8, 4879.
     DOI: 10.1039/c7sc00601b
   
   for metadynamics refer to:
   * S. Grimme, J. Chem. Theory Comput., 2019, 155, 2847-2862
     DOI: 10.1021/acs.jctc.9b00143
   
   with help from (in alphabetical order)
   C. Bannwarth, F. Bohle, G. Brandenburg, E. Caldeweyher, M. Checinski,
   S. Dohm, S. Ehlert, S. Ehrlich, F. März, H. Neugebauer, J. Pisarek,
   P. Pracht, P. Shushkov, and S. Spicher.
   
 * started run on 2021/12/02 at 16:44:46.841     

           -------------------------------------------------
          |                Calculation Setup                |
           -------------------------------------------------

          program call               : /ihome/ghutchison/geoffh/xtb/xtb PT2IC-4Cl.xyz --vipea
          hostname                   : smp-n128
          coordinate file            : PT2IC-4Cl.xyz
          omp threads                :                     1
          number of atoms            :                   101
          number of electrons        :                   358
          charge                     :                     0
          spin                       :                   0.0
          first test random number   :      0.81730078974299


########################################################################
# WARNING! Please study the warnings concerning your input carefully
#  - XTBPATH is not set, using XTBHOME instead
########################################################################

           ------------------------------------------------- 
          |                 I P E A - x T B                 |
          |  Ionisation Potentials and Electron Affinities  |
           ------------------------------------------------- 
             KAB for M(3d)-M(3d) :                1.1000
             KAB for M(4d)-M(4d) :                1.2000
             KAB for M(5d)-M(5d) :                1.2000
             k(s)                :                2.1500
             k(p)                :                2.3000
             k(d)                :                2.0000
             k(f)                :                0.0000
             kEN (H0ij)          :                0.7000
             D3 a1               :                0.6300
             D3 a2               :                5.0000
             D3 s6               :                1.0000
             D3 s8               :                2.4000
             D3 s9               :                0.0000
             alphaj              :                1.0000
             XBdamp              :                0.4400
             XBrad               :                1.3000
             kcnsh               :      1.0000   -0.3000   -0.5000    0.5000

  Z AO/shell   Hii/eV     exponent
  1     Thu Sep 22 23:34:11 CEST 2016   EN: 2.200 GAM: 0.405  GM3: 0.1500
     1s    -10.521941    1.306199
     2s     -3.560151    0.398421
  6     Thu Sep 22 23:34:11 CEST 2016   EN: 2.550 GAM: 0.640  GM3: 0.1500
     2s    -15.968100    1.979793
     2p     -9.777107    1.850537
     3S     -3.366990    0.633095
  7     Thu Sep 22 23:34:11 CEST 2016   EN: 3.040 GAM: 0.493  GM3:-0.1000
     2s    -24.040776    2.126160
     2p    -14.426520    2.068425
     3S     -5.882278    0.671040
  8     Thu Sep 22 23:34:11 CEST 2016   EN: 3.440 GAM: 0.717  GM3:-0.2000
     2s    -26.695120    2.575264
     2p    -16.014457    2.159448
     3S     -6.622058    0.958679
 16     Tue Jan 17 20:57:36 CET 2017    EN: 2.580 GAM: 0.455  GM3: 0.1020
     3s    -24.488821    2.492075
     3p    -12.136640    1.997904
     3d     -1.796070    1.747541
 17     Tue Jan 17 19:45:33 CET 2017    EN: 3.160 GAM: 0.559  GM3: 0.2396
     3s    -24.452163    2.559226
     3p    -13.465451    2.054846
     3d     -1.836065    1.762522

           ------------------------------------------------- 
          |        Self-Consistent Charge Iterations        |
           ------------------------------------------------- 

          ...................................................
          :                      SETUP                      :
          :.................................................:
          :  # basis functions                 469          :
          :  # atomic orbitals                 460          :
          :  # shells                          276          :
          :  # electrons                       358          :
          :  # halogen bonds                    17          :
          :  max. iterations                   250          :
          :  Hamiltonian                  GFN1-xTB          :
          :  restarted?                      false          :
          :  GBSA solvation                  false          :
          :  PC potential                    false          :
          :  electronic temp.          300.0000000     K    :
          :  accuracy                    1.0000000          :
          :  -> integral cutoff          0.2500000E+02      :
          :  -> integral neglect         0.1000000E-07      :
          :  -> SCF convergence          0.1000000E-05 Eh   :
          :  -> wf. convergence          0.2000000E-04 e    :
          :  Broyden damping             0.4000000          :
          ...................................................

 iter      E             dE          RMSdq      gap      omega  full diag
   1   -226.9323255 -0.226932E+03  0.965E+00    0.85       0.0  T
   2   -227.1598398 -0.227514E+00  0.608E+00    0.31       1.0  T
   3   -223.6616350  0.349820E+01  0.526E+00    0.09       1.0  T
   4   -227.2989396 -0.363730E+01  0.194E+00    0.67       1.0  T
   5   -228.1513847 -0.852445E+00  0.408E-01    0.43       1.0  T
   6   -228.1870764 -0.356917E-01  0.214E-01    0.48       1.0  T
   7   -228.1960951 -0.901875E-02  0.660E-02    0.42       1.0  T
   8   -228.1959470  0.148088E-03  0.678E-02    0.40       1.0  T
   9   -228.1965011 -0.554037E-03  0.357E-02    0.40       1.0  T
  10   -228.1966902 -0.189148E-03  0.142E-02    0.39       1.0  T
  11   -228.1967159 -0.256718E-04  0.529E-03    0.40       1.9  T
  12   -228.1967202 -0.434667E-05  0.199E-03    0.40       5.0  T
  13   -228.1967209 -0.683631E-06  0.844E-04    0.40      11.8  T
  14   -228.1967211 -0.140520E-06  0.242E-04    0.40      41.2  T
  15   -228.1967211 -0.919877E-08  0.864E-05    0.40     115.1  T
  16   -228.1967211 -0.801691E-09  0.562E-05    0.40     177.2  T

   *** convergence criteria satisfied after 16 iterations ***

         #    Occupation            Energy/Eh            Energy/eV
      -------------------------------------------------------------
         1        2.0000           -1.0736805             -29.2163
       ...           ...                  ...                  ...
       173        2.0000           -0.4022072             -10.9446
       174        2.0000           -0.3987276             -10.8499
       175        2.0000           -0.3885838             -10.5739
       176        2.0000           -0.3804576             -10.3528
       177        2.0000           -0.3730160             -10.1503
       178        2.0000           -0.3653484              -9.9416
       179        1.9991           -0.3400637              -9.2536 (HOMO)
       180        0.0009           -0.3254285              -8.8554 (LUMO)
       181        0.0001           -0.3227185              -8.7816
       182                         -0.3141591              -8.5487
       183                         -0.3104630              -8.4481
       184                         -0.3046627              -8.2903
       ...                                ...                  ...
       460                        522.1178496           14207.5498
      -------------------------------------------------------------
                  HL-Gap            0.0146352 Eh            0.3982 eV
             Fermi-level           -0.3327727 Eh           -9.0552 eV

 SCC (total)                   0 d,  0 h,  0 min,  1.733 sec
 SCC setup                      ...        0 min,  0.004 sec (  0.247%)
 Dispersion                     ...        0 min,  0.000 sec (  0.019%)
 integral evaluation            ...        0 min,  0.923 sec ( 53.267%)
 zeroth order Hamiltonian       ...        0 min,  0.004 sec (  0.203%)
 iterations                     ...        0 min,  0.535 sec ( 30.870%)
 molecular gradient             ...        0 min,  0.262 sec ( 15.123%)
 printout                       ...        0 min,  0.005 sec (  0.267%)

         :::::::::::::::::::::::::::::::::::::::::::::::::::::
         ::                     SUMMARY                     ::
         :::::::::::::::::::::::::::::::::::::::::::::::::::::
         :: total energy            -224.462943217832 Eh    ::
         :: gradient norm              0.449545928548 Eh/a0 ::
         :: HOMO-LUMO gap              0.398244846258 eV    ::
         ::.................................................::
         :: SCC energy              -228.196721071602 Eh    ::
         :: -> electrostatic           0.318791692888 Eh    ::
         :: repulsion energy           3.831845601456 Eh    ::
         :: dispersion energy         -0.098067747686 Eh    ::
         :: halogen bond corr.         0.000000000000 Eh    ::
         :: add. restraining           0.000000000000 Eh    ::
         :::::::::::::::::::::::::::::::::::::::::::::::::::::

           ------------------------------------------------- 
          |        vertical delta SCC IP calculation        |
           ------------------------------------------------- 

          ...................................................
          :                      SETUP                      :
          :.................................................:
          :  # basis functions                 469          :
          :  # atomic orbitals                 460          :
          :  # shells                          276          :
          :  # electrons                       357          :
          :  # halogen bonds                    17          :
          :  max. iterations                   250          :
          :  Hamiltonian                  GFN1-xTB          :
          :  restarted?                       true          :
          :  GBSA solvation                  false          :
          :  PC potential                    false          :
          :  electronic temp.          300.0000000     K    :
          :  accuracy                    1.0000000          :
          :  -> integral cutoff          0.2500000E+02      :
          :  -> integral neglect         0.1000000E-07      :
          :  -> SCF convergence          0.1000000E-05 Eh   :
          :  -> wf. convergence          0.2000000E-04 e    :
          :  Broyden damping             0.4000000          :
          ...................................................

 iter      E             dE          RMSdq      gap      omega  full diag
   1   -227.7667176 -0.227767E+03  0.397E-01    0.40       0.0  T
   2   -227.6914349  0.752826E-01  0.513E-01    1.02       1.0  T
   3   -227.7888673 -0.974324E-01  0.251E-01    0.86       1.0  T
   4   -227.7988595 -0.999221E-02  0.158E-01    0.91       1.0  T
   5   -227.8019383 -0.307873E-02  0.108E-01    1.01       1.0  T
   6   -227.8052654 -0.332715E-02  0.790E-02    1.00       1.0  T
   7   -227.8067491 -0.148371E-02  0.301E-02    1.00       1.0  T
   8   -227.8070556 -0.306466E-03  0.893E-03    0.99       1.1  T
   9   -227.8070479  0.767445E-05  0.780E-03    0.99       1.3  T
  10   -227.8070703 -0.223861E-04  0.237E-03    0.99       4.2  T
  11   -227.8070706 -0.253689E-06  0.213E-03    0.99       4.7  T
  12   -227.8070718 -0.127076E-05  0.919E-04    0.99      10.8  T
  13   -227.8070721 -0.229753E-06  0.373E-04    0.99      26.7  T
  14   -227.8070721 -0.445599E-07  0.103E-04    0.99      96.2  T
  15   -227.8070721 -0.183144E-08  0.556E-05    0.99     178.9  T

   *** convergence criteria satisfied after 15 iterations ***

         #    Occupation            Energy/Eh            Energy/eV
      -------------------------------------------------------------
         1        2.0000           -1.1717406             -31.8847
       ...           ...                  ...                  ...
       173        2.0000           -0.4726148             -12.8605
       174        2.0000           -0.4647924             -12.6476
       175        2.0000           -0.4628152             -12.5938
       176        2.0000           -0.4586801             -12.4813
       177        2.0000           -0.4563912             -12.4190
       178        1.8651           -0.4377853             -11.9127
       179        1.1349           -0.4342537             -11.8166 (HOMO)
       180                         -0.3977272             -10.8227 (LUMO)
       181                         -0.3971215             -10.8062
       182                         -0.3857134             -10.4958
       183                         -0.3786283             -10.3030
       184                         -0.3695425             -10.0558
       ...                                ...                  ...
       460                        522.0446137           14205.5570
      -------------------------------------------------------------
                  HL-Gap            0.0365264 Eh            0.9939 eV
             Fermi-level           -0.4261000 Eh          -11.5948 eV

 SCC (total)                   0 d,  0 h,  0 min,  1.696 sec
 SCC setup                      ...        0 min,  0.003 sec (  0.206%)
 Dispersion                     ...        0 min,  0.000 sec (  0.011%)
 integral evaluation            ...        0 min,  0.925 sec ( 54.511%)
 zeroth order Hamiltonian       ...        0 min,  0.003 sec (  0.205%)
 iterations                     ...        0 min,  0.497 sec ( 29.318%)
 molecular gradient             ...        0 min,  0.262 sec ( 15.471%)
 printout                       ...        0 min,  0.005 sec (  0.274%)

         :::::::::::::::::::::::::::::::::::::::::::::::::::::
         ::                     SUMMARY                     ::
         :::::::::::::::::::::::::::::::::::::::::::::::::::::
         :: total energy            -224.073294249836 Eh    ::
         :: gradient norm              0.413331385469 Eh/a0 ::
         :: HOMO-LUMO gap              0.993934516895 eV    ::
         ::.................................................::
         :: SCC energy              -227.807072103606 Eh    ::
         :: -> electrostatic           0.359332598133 Eh    ::
         :: repulsion energy           3.831845601456 Eh    ::
         :: dispersion energy         -0.098067747686 Eh    ::
         :: halogen bond corr.         0.000000000000 Eh    ::
         :: add. restraining           0.000000000000 Eh    ::
         :::::::::::::::::::::::::::::::::::::::::::::::::::::

------------------------------------------------------------------------
empirical IP shift (eV):    4.8455
delta SCC IP (eV):    5.7574
------------------------------------------------------------------------
           ------------------------------------------------- 
          |        vertical delta SCC EA calculation        |
           ------------------------------------------------- 

          ...................................................
          :                      SETUP                      :
          :.................................................:
          :  # basis functions                 469          :
          :  # atomic orbitals                 460          :
          :  # shells                          276          :
          :  # electrons                       359          :
          :  # halogen bonds                    17          :
          :  max. iterations                   250          :
          :  Hamiltonian                  GFN1-xTB          :
          :  restarted?                       true          :
          :  GBSA solvation                  false          :
          :  PC potential                    false          :
          :  electronic temp.          300.0000000     K    :
          :  accuracy                    1.0000000          :
          :  -> integral cutoff          0.2500000E+02      :
          :  -> integral neglect         0.1000000E-07      :
          :  -> SCF convergence          0.1000000E-05 Eh   :
          :  -> wf. convergence          0.2000000E-04 e    :
          :  Broyden damping             0.4000000          :
          ...................................................

 iter      E             dE          RMSdq      gap      omega  full diag
   1   -228.4077666 -0.228408E+03  0.421E-01    0.02       0.0  T
   2   -227.6365672  0.771199E+00  0.110E+00    0.10       1.0  T
   3   -228.4299351 -0.793368E+00  0.389E-01    0.19       1.0  T
   4   -228.4480187 -0.180837E-01  0.293E-01    0.03       1.0  T
   5   -228.4441574  0.386135E-02  0.287E-01    0.21       1.0  T
   6   -228.4595269 -0.153695E-01  0.246E-01    0.18       1.0  T
   7   -228.4852598 -0.257329E-01  0.918E-02    0.09       1.0  T
   8   -228.4871592 -0.189940E-02  0.493E-02    0.07       1.0  T
   9   -228.4872772 -0.117920E-03  0.271E-02    0.08       1.0  T
  10   -228.4874525 -0.175320E-03  0.219E-02    0.08       1.0  T
  11   -228.4876078 -0.155289E-03  0.143E-02    0.08       1.0  T
  12   -228.4877593 -0.151581E-03  0.492E-03    0.08       2.0  T
  13   -228.4877702 -0.109000E-04  0.176E-03    0.08       5.7  T
  14   -228.4877666  0.360153E-05  0.290E-03    0.08       3.4  T
  15   -228.4877706 -0.397683E-05  0.125E-03    0.08       7.9  T
  16   -228.4877709 -0.316305E-06  0.863E-04    0.08      11.5  T
  17   -228.4877711 -0.201892E-06  0.467E-04    0.08      21.3  T
  18   -228.4877711 -0.576503E-08  0.362E-04    0.08      27.5  T
  19   -228.4877712 -0.563722E-07  0.124E-04    0.08      79.9  T
  20   -228.4877712 -0.580553E-08  0.539E-05    0.08     184.7  T

   *** convergence criteria satisfied after 20 iterations ***

         #    Occupation            Energy/Eh            Energy/eV
      -------------------------------------------------------------
         1        2.0000           -1.0097332             -27.4762
       ...           ...                  ...                  ...
       174        2.0000           -0.3353343              -9.1249
       175        2.0000           -0.3226277              -8.7791
       176        2.0000           -0.3183584              -8.6630
       177        2.0000           -0.3114922              -8.4761
       178        2.0000           -0.3015174              -8.2047
       179        2.0000           -0.2771522              -7.5417
       180        0.8159           -0.2561694              -6.9707 (HOMO)
       181        0.1815           -0.2533246              -6.8933 (LUMO)
       182        0.0016           -0.2486284              -6.7655
       183        0.0010           -0.2482183              -6.7544
       184        0.0000           -0.2404480              -6.5429
       185                         -0.2367432              -6.4421
       ...                                ...                  ...
       460                        522.1800267           14209.2418
      -------------------------------------------------------------
                  HL-Gap            0.0028448 Eh            0.0774 eV
             Fermi-level           -0.2607198 Eh           -7.0945 eV

 SCC (total)                   0 d,  0 h,  0 min,  1.864 sec
 SCC setup                      ...        0 min,  0.004 sec (  0.239%)
 Dispersion                     ...        0 min,  0.000 sec (  0.016%)
 integral evaluation            ...        0 min,  0.925 sec ( 49.630%)
 zeroth order Hamiltonian       ...        0 min,  0.003 sec (  0.185%)
 iterations                     ...        0 min,  0.663 sec ( 35.580%)
 molecular gradient             ...        0 min,  0.262 sec ( 14.067%)
 printout                       ...        0 min,  0.005 sec (  0.279%)

         :::::::::::::::::::::::::::::::::::::::::::::::::::::
         ::                     SUMMARY                     ::
         :::::::::::::::::::::::::::::::::::::::::::::::::::::
         :: total energy            -224.753993348174 Eh    ::
         :: gradient norm              0.453781519094 Eh/a0 ::
         :: HOMO-LUMO gap              0.077411671185 eV    ::
         ::.................................................::
         :: SCC energy              -228.487771201944 Eh    ::
         :: -> electrostatic           0.347361073945 Eh    ::
         :: repulsion energy           3.831845601456 Eh    ::
         :: dispersion energy         -0.098067747686 Eh    ::
         :: halogen bond corr.         0.000000000000 Eh    ::
         :: add. restraining           0.000000000000 Eh    ::
         :::::::::::::::::::::::::::::::::::::::::::::::::::::

------------------------------------------------------------------------
empirical EA shift (eV):    4.8455
delta SCC EA (eV):    3.0744
------------------------------------------------------------------------
           -------------------------------------------------
          |                Property Printout                |
           -------------------------------------------------

    * Orbital Energies and Occupations

         #    Occupation            Energy/Eh            Energy/eV
      -------------------------------------------------------------
         1        2.0000           -1.0097332             -27.4762
       ...           ...                  ...                  ...
       168        2.0000           -0.3623375              -9.8597
       169        2.0000           -0.3595507              -9.7839
       170        2.0000           -0.3580868              -9.7440
       171        2.0000           -0.3533846              -9.6161
       172        2.0000           -0.3454105              -9.3991
       173        2.0000           -0.3422340              -9.3127
       174        2.0000           -0.3353343              -9.1249
       175        2.0000           -0.3226277              -8.7791
       176        2.0000           -0.3183584              -8.6630
       177        2.0000           -0.3114922              -8.4761
       178        2.0000           -0.3015174              -8.2047
       179        2.0000           -0.2771522              -7.5417
       180        0.8159           -0.2561694              -6.9707 (HOMO)
       181        0.1815           -0.2533246              -6.8933 (LUMO)
       182        0.0016           -0.2486284              -6.7655
       183        0.0010           -0.2482183              -6.7544
       184        0.0000           -0.2404480              -6.5429
       185                         -0.2367432              -6.4421
       186                         -0.1977889              -5.3821
       187                         -0.1857891              -5.0556
       188                         -0.1802031              -4.9036
       189                         -0.1783592              -4.8534
       190                         -0.1729211              -4.7054
       191                         -0.1619773              -4.4076
       ...                                ...                  ...
       460                        522.1800267           14209.2418
      -------------------------------------------------------------
                  HL-Gap            0.0028448 Eh            0.0774 eV
             Fermi-level           -0.2607198 Eh           -7.0945 eV

  Mulliken/CM5 charges        n(s)   n(p)   n(d)
     1 C  -0.36137 -0.34350   1.875  1.763  0.000
     2 C   0.04357  0.05695   1.755  2.288  0.000
     3 S   0.26743  0.23428   1.851  4.355  0.061
     4 C  -0.00571  0.01649   1.145  2.849  0.000
     5 C   0.07433  0.14335   1.062  3.013  0.000
     6 N   0.13322 -0.12465   1.299  3.834  0.000
     7 C  -0.03101 -0.07957   1.107  2.862  0.000
     8 C  -0.05567  0.01312   1.072  2.872  0.000
     9 C   0.01542  0.02829   1.075  2.941  0.000
    10 C  -0.06982  0.01818   1.156  2.775  0.000
    11 N   0.25137  0.08967   1.474  3.777  0.000
    12 S  -0.15336 -0.01780   1.862  3.677  0.308
    13 N   0.24625  0.08420   1.473  3.773  0.000
    14 C  -0.06952  0.01840   1.151  2.779  0.000
    15 C   0.00961  0.02186   1.076  2.934  0.000
    16 C  -0.05174  0.01200   1.080  2.869  0.000
    17 N   0.14714 -0.09640   1.262  3.885  0.000
    18 C  -0.03577 -0.08795   1.103  2.861  0.000
    19 C   0.05349 -0.09592   1.057  2.997  0.000
    20 C  -0.04120  0.02450   1.069  2.890  0.000
    21 C  -0.00797  0.01358   1.146  2.846  0.000
    22 S   0.05691  0.02600   1.871  4.111  0.074
    23 C   0.00290  0.02439   1.137  2.866  0.000
    24 C  -0.05190  0.01992   1.065  2.884  0.000
    25 C   0.05617 -0.09220   1.066  2.990  0.000
    26 C   0.01058 -0.03654   1.075  2.936  0.000
    27 C   0.02384  0.02136   1.057  2.967  0.000
    28 C  -0.01275 -0.01354   1.090  2.897  0.000
    29 C  -0.00448  0.00158   1.033  2.963  0.000
    30 C  -0.10880  0.01022   1.204  2.687  0.000
    31 N   0.28827  0.15801   1.525  3.763  0.000
    32 C  -0.10933  0.00827   1.205  2.686  0.000
    33 N   0.28721  0.15727   1.528  3.759  0.000
    34 C  -0.00931 -0.01256   1.076  2.914  0.000
    35 C   0.01379 -0.03511   1.076  2.938  0.000
    36 C  -0.06202 -0.06600   1.167  2.771  0.000
    37 Cl  0.12506  0.12405   1.853  5.258  0.015
    38 C  -0.05656 -0.06038   1.159  2.784  0.000
    39 C   0.01122 -0.03760   1.083  2.928  0.000
    40 C   0.00524  0.00347   1.092  2.913  0.000
    41 C  -0.14864 -0.11417   1.162  2.690  0.000
    42 O   0.33282  0.27647   1.639  4.694  0.000
    43 N   0.11466 -0.14505   1.256  3.858  0.000
    44 C  -0.04997  0.01596   1.073  2.877  0.000
    45 C  -0.00787  0.01415   1.133  2.859  0.000
    46 C  -0.03662 -0.08440   1.094  2.870  0.000
    47 C   0.05595 -0.09133   1.067  2.989  0.000
    48 C   0.03071 -0.01434   1.060  2.970  0.000
    49 C  -0.01146 -0.00627   1.147  2.841  0.000
    50 S   0.06632  0.03225   1.878  4.126  0.063
    51 Cl  0.13497  0.13410   1.854  5.262  0.018
    52 C  -0.14315 -0.10779   1.162  2.695  0.000
    53 O   0.32322  0.27670   1.675  4.648  0.000
    54 C   0.00836  0.00656   1.090  2.918  0.000
    55 C   0.01088 -0.03797   1.084  2.927  0.000
    56 C  -0.05472 -0.05854   1.158  2.787  0.000
    57 C  -0.05951 -0.06349   1.166  2.775  0.000
    58 Cl  0.13121  0.13019   1.853  5.263  0.016
    59 C   0.01572 -0.03319   1.076  2.940  0.000
    60 C  -0.00362 -0.00688   1.073  2.924  0.000
    61 C  -0.00546 -0.00615   1.087  2.908  0.000
    62 C   0.01070  0.01683   1.026  2.984  0.000
    63 C  -0.10304  0.01406   1.210  2.687  0.000
    64 N   0.31500  0.18190   1.498  3.817  0.000
    65 C  -0.10331  0.01572   1.204  2.692  0.000
    66 N   0.29650  0.16632   1.525  3.772  0.000
    67 C   0.02929  0.02739   1.053  2.976  0.000
    68 C   0.01349 -0.03464   1.076  2.937  0.000
    69 Cl  0.13835  0.13748   1.854  5.265  0.019
    70 C   0.00227 -0.00564   1.182  2.820  0.000
    71 C   0.00619  0.01388   1.104  2.902  0.000
    72 S   0.30301  0.26910   1.845  4.340  0.118
    73 C   0.23118  0.12517   1.074  3.157  0.000
    74 C   0.55866  0.40719   0.925  3.634  0.000
    75 H  -0.02382  0.05070   0.976  0.000  0.000
    76 H  -0.02290  0.04247   0.977  0.000  0.000
    77 H  -0.02654  0.03901   0.973  0.000  0.000
    78 H  -0.02943  0.04120   0.971  0.000  0.000
    79 H  -0.01918  0.04122   0.981  0.000  0.000
    80 H  -0.02081  0.03158   0.979  0.000  0.000
    81 H  -0.02359  0.03210   0.976  0.000  0.000
    82 H  -0.01888  0.03721   0.981  0.000  0.000
    83 H  -0.02208  0.03036   0.978  0.000  0.000
    84 H  -0.01741  0.04180   0.983  0.000  0.000
    85 H  -0.03521  0.03411   0.965  0.000  0.000
    86 H  -0.04289  0.02252   0.957  0.000  0.000
    87 H  -0.05124  0.00856   0.949  0.000  0.000
    88 H  -0.04022  0.02567   0.960  0.000  0.000
    89 H  -0.03705  0.03097   0.963  0.000  0.000
    90 H  -0.02240  0.03222   0.978  0.000  0.000
    91 H  -0.02714  0.02819   0.973  0.000  0.000
    92 H  -0.02765  0.02460   0.972  0.000  0.000
    93 H  -0.04778  0.02514   0.952  0.000  0.000
    94 H  -0.05261  0.00706   0.947  0.000  0.000
    95 H  -0.03899  0.02632   0.961  0.000  0.000
    96 H  -0.00063  0.06999   0.999  0.000  0.000
    97 H  -0.33639 -0.27872   0.664  0.000  0.000
    98 H  -0.32014 -0.26210   0.680  0.000  0.000
    99 H  -0.32503 -0.27211   0.675  0.000  0.000
   100 H  -0.28393 -0.23186   0.716  0.000  0.000
   101 H  -0.31292 -0.25950   0.687  0.000  0.000
(R)spin-density population

 Mulliken population n(s)   n(p)   n(d)
     1 C   0.0080   0.000  0.008  0.000
     2 C   0.0035   0.000  0.003  0.000
     3 S   0.0027   0.000  0.002  0.001
     4 C   0.0015  -0.000  0.002  0.000
     5 C   0.0078   0.000  0.008  0.000
     6 N   0.0102   0.000  0.010  0.000
     7 C   0.0003   0.000  0.000  0.000
     8 C   0.0042  -0.000  0.004  0.000
     9 C   0.0056   0.000  0.006  0.000
    10 C   0.0011  -0.000  0.001  0.000
    11 N   0.0077   0.000  0.008  0.000
    12 S   0.0117   0.000  0.009  0.003
    13 N   0.0068  -0.000  0.007  0.000
    14 C   0.0007   0.000  0.001  0.000
    15 C   0.0044   0.000  0.004  0.000
    16 C   0.0204   0.000  0.020  0.000
    17 N   0.0060   0.000  0.006  0.000
    18 C   0.0020   0.001  0.001  0.000
    19 C   0.0002   0.000  0.000  0.000
    20 C   0.0028   0.000  0.003  0.000
    21 C   0.0109   0.000  0.011  0.000
    22 S   0.0045  -0.000  0.004  0.001
    23 C   0.0005   0.000  0.001  0.000
    24 C   0.0172   0.000  0.017  0.000
    25 C   0.0003   0.000  0.000  0.000
    26 C   0.0667   0.000  0.067  0.000
    27 C   0.0132   0.000  0.013  0.000
    28 C   0.0638   0.000  0.064  0.000
    29 C   0.0572  -0.000  0.057  0.000
    30 C   0.0078  -0.000  0.008  0.000
    31 N   0.0278  -0.000  0.028  0.000
    32 C   0.0075   0.000  0.007  0.000
    33 N   0.0283   0.000  0.028  0.000
    34 C   0.0058   0.000  0.006  0.000
    35 C   0.0193   0.000  0.019  0.000
    36 C   0.0007  -0.000  0.001  0.000
    37 Cl  0.0002   0.000  0.000  0.000
    38 C   0.0220   0.000  0.022  0.000
    39 C   0.0038   0.000  0.004  0.000
    40 C   0.0143   0.000  0.014  0.000
    41 C   0.0019   0.000  0.002  0.000
    42 O   0.0019   0.000  0.002  0.000
    43 N   0.0063  -0.000  0.006  0.000
    44 C   0.0002   0.000  0.000  0.000
    45 C   0.0224   0.000  0.022  0.000
    46 C   0.0000   0.000  0.000  0.000
    47 C   0.0003   0.000  0.000  0.000
    48 C   0.0458   0.000  0.046  0.000
    49 C   0.0024   0.000  0.002  0.000
    50 S   0.0150   0.000  0.013  0.002
    51 Cl  0.0054   0.000  0.003  0.003
    52 C   0.0101   0.000  0.010  0.000
    53 O   0.0102   0.000  0.010  0.000
    54 C   0.0282   0.000  0.028  0.000
    55 C   0.0002   0.000  0.000  0.000
    56 C   0.0308   0.000  0.031  0.000
    57 C   0.0059  -0.000  0.006  0.000
    58 Cl  0.0016   0.000  0.001  0.001
    59 C   0.0185   0.000  0.018  0.000
    60 C   0.0179   0.000  0.018  0.000
    61 C   0.0828  -0.000  0.083  0.000
    62 C   0.0565  -0.000  0.056  0.000
    63 C   0.0125  -0.000  0.013  0.000
    64 N   0.0327   0.000  0.033  0.000
    65 C   0.0086  -0.000  0.009  0.000
    66 N   0.0286  -0.000  0.029  0.000
    67 C   0.0019  -0.000  0.002  0.000
    68 C   0.0308  -0.000  0.031  0.000
    69 Cl  0.0076   0.000  0.004  0.004
    70 C   0.0207   0.000  0.021  0.000
    71 C   0.0010   0.000  0.001  0.000
    72 S   0.0059   0.000  0.004  0.001
    73 C   0.0010   0.000  0.001  0.000
    74 C   0.0021   0.001  0.002  0.000
    75 H   0.0000   0.000  0.000  0.000
    76 H   0.0005   0.001  0.000  0.000
    77 H   0.0004   0.000  0.000  0.000
    78 H   0.0001   0.000  0.000  0.000
    79 H   0.0001   0.000  0.000  0.000
    80 H   0.0002   0.000  0.000  0.000
    81 H   0.0000   0.000  0.000  0.000
    82 H   0.0000   0.000  0.000  0.000
    83 H   0.0000   0.000  0.000  0.000
    84 H   0.0000   0.000  0.000  0.000
    85 H   0.0000   0.000  0.000  0.000
    86 H   0.0000   0.000  0.000  0.000
    87 H   0.0000   0.000  0.000  0.000
    88 H   0.0002   0.000  0.000  0.000
    89 H   0.0000   0.000  0.000  0.000
    90 H   0.0000   0.000  0.000  0.000
    91 H  -0.0000  -0.000  0.000  0.000
    92 H   0.0000   0.000  0.000  0.000
    93 H   0.0000   0.000  0.000  0.000
    94 H  -0.0000  -0.000  0.000  0.000
    95 H   0.0000   0.000  0.000  0.000
    96 H   0.0000   0.000  0.000  0.000
    97 H   0.0004   0.000  0.000  0.000
    98 H   0.0004   0.000  0.000  0.000
    99 H   0.0001   0.000  0.000  0.000
   100 H   0.0003   0.000  0.000  0.000
   101 H   0.0001   0.000  0.000  0.000

Wiberg/Mayer (AO) data.
largest (>0.10) Wiberg bond orders for each atom
          total WBO             WBO to atom ...
     1  C   2.523        C    5 0.890    S   72 0.813    C    2 0.609
     2  C   2.449        C   70 0.898    S    3 0.680    C    1 0.609
     3  S   2.372        C    4 1.133    C    2 0.680    C   70 0.123
     4  C   3.915        C    5 1.341    C    9 1.297    S    3 1.133
     5  C   3.546        C    4 1.341    N    6 1.139    C    1 0.890
     6  N   3.202        C    8 1.195    C    5 1.139    C    7 0.959
     7  C   3.915        H   75 1.008    C   25 0.991    H   76 0.988    N    6 0.959
     8  C   3.849        C   16 1.297    C    9 1.284    N    6 1.195
     9  C   3.863        C    4 1.297    C    8 1.284    C   10 1.216
    10  C   4.037        N   11 1.543    C    9 1.216    C   14 1.182    S   12 0.101
    11  N   2.999        C   10 1.543    S   12 1.391
    12  S   3.110        N   13 1.395    N   11 1.391    C   14 0.106    C   10 0.101
    13  N   2.996        C   14 1.546    S   12 1.395
    14  C   4.031        N   13 1.546    C   15 1.213    C   10 1.182    S   12 0.106
    15  C   3.869        C   16 1.354    C   21 1.252    C   14 1.213
    16  C   3.830        C   15 1.354    C    8 1.297    N   17 1.110
    17  N   2.877        C   16 1.110    C   20 1.102    C   18 0.953
    18  C   3.891        H   78 1.006    C   19 1.000    H   77 0.994    N   17 0.953
    19  C   3.869        H   79 1.013    H   81 1.009    C   18 1.000    H   80 0.989
    20  C   3.861        C   21 1.395    C   24 1.302    N   17 1.102
    21  C   3.875        C   20 1.395    C   15 1.252    S   22 1.199
    22  S   2.492        C   21 1.199    C   23 1.160
    23  C   3.897        C   45 1.355    C   24 1.296    S   22 1.160
    24  C   3.830        C   20 1.302    C   23 1.296    N   43 1.175
    25  C   3.889        H   82 1.008    H   83 0.994    H   84 0.993    C    7 0.991
    26  C   3.735        C   27 1.454    C   49 1.332    H   85 0.989
    27  C   3.801        C   26 1.454    C   28 1.177    C   41 1.107
    28  C   3.809        C   29 1.440    C   27 1.177    C   34 1.108
    29  C   3.742        C   28 1.440    C   32 1.155    C   30 1.154
    30  C   4.090        N   31 2.896    C   29 1.154
    31  N   2.903        C   30 2.896
    32  C   4.097        N   33 2.894    C   29 1.155
    33  N   2.907        C   32 2.894
    34  C   3.870        C   35 1.417    C   40 1.312    C   28 1.108
    35  C   3.835        C   34 1.417    C   36 1.410    H   86 0.993
    36  C   3.973        C   35 1.410    C   38 1.377    Cl  37 1.091
    37  Cl  1.199        C   36 1.091
    38  C   3.931        C   39 1.393    C   36 1.377    Cl  51 1.088
    39  C   3.883        C   40 1.453    C   38 1.393    H   87 0.983
    40  C   3.885        C   39 1.453    C   34 1.312    C   41 1.044
    41  C   3.967        O   42 1.792    C   27 1.107    C   40 1.044
    42  O   1.967        C   41 1.792
    43  N   3.155        C   24 1.175    C   44 1.154    C   46 0.969
    44  C   3.878        C   48 1.371    C   45 1.268    N   43 1.154
    45  C   3.872        C   23 1.355    C   44 1.268    S   50 1.209
    46  C   3.897        H   89 1.002    C   47 0.992    H   88 0.991    N   43 0.969
    47  C   3.892        H   90 1.001    H   91 1.001    H   92 0.992    C   46 0.992
    48  C   3.727        C   49 1.409    C   44 1.371    H   93 0.988
    49  C   3.913        C   48 1.409    C   26 1.332    S   50 1.116
    50  S   2.458        C   45 1.209    C   49 1.116
    51  Cl  1.192        C   38 1.088
    52  C   3.970        O   53 1.778    C   67 1.110    C   54 1.049
    53  O   2.053        C   52 1.778    S   72 0.114
    54  C   3.858        C   55 1.451    C   60 1.296    C   52 1.049
    55  C   3.890        C   54 1.451    C   56 1.398    H   94 0.984
    56  C   3.916        C   55 1.398    C   57 1.367    Cl  69 1.087
    57  C   3.960        C   59 1.418    C   56 1.367    Cl  58 1.088
    58  Cl  1.194        C   57 1.088
    59  C   3.836        C   57 1.418    C   60 1.409    H   95 0.994
    60  C   3.848        C   59 1.409    C   54 1.296    C   61 1.120
    61  C   3.770        C   62 1.397    C   67 1.189    C   60 1.120
    62  C   3.720        C   61 1.397    C   63 1.175    C   65 1.159
    63  C   4.083        N   64 2.844    C   62 1.175
    64  N   2.810        C   63 2.844
    65  C   4.088        N   66 2.890    C   62 1.159
    66  N   2.900        C   65 2.890
    67  C   3.820        C   68 1.443    C   61 1.189    C   52 1.110
    68  C   3.783        C   67 1.443    C   71 1.356    H   96 0.991
    69  Cl  1.188        C   56 1.087
    70  C   3.838        C   71 1.312    C   73 1.102    C    2 0.898    S    3 0.123    S   72 0.113    C   74 0.101
    71  C   3.855        C   68 1.356    C   70 1.312    S   72 1.063
    72  S   2.476        C   71 1.063    C    1 0.813    O   53 0.114    C   70 0.113
    73  C   3.745        C   70 1.102    C   74 0.945    H   98 0.749    H   97 0.736
    74  C   3.504        C   73 0.945    H  100 0.851    H  101 0.786    H   99 0.753    C   70 0.101
    75  H   1.057        C    7 1.008
    76  H   1.048        C    7 0.988
    77  H   1.039        C   18 0.994
    78  H   1.043        C   18 1.006
    79  H   1.048        C   19 1.013
    80  H   1.047        C   19 0.989
    81  H   1.033        C   19 1.009
    82  H   1.032        C   25 1.008
    83  H   1.032        C   25 0.994
    84  H   1.065        C   25 0.993
    85  H   1.051        C   26 0.989
    86  H   1.056        C   35 0.993
    87  H   1.022        C   39 0.983
    88  H   1.031        C   46 0.991
    89  H   1.043        C   46 1.002
    90  H   1.035        C   47 1.001
    91  H   1.038        C   47 1.001
    92  H   1.033        C   47 0.992
    93  H   1.030        C   48 0.988
    94  H   1.023        C   55 0.984
    95  H   1.057        C   59 0.994
    96  H   1.090        C   68 0.991
    97  H   0.930        C   73 0.736
    98  H   0.892        C   73 0.749
    99  H   0.910        C   74 0.753
   100  H   0.918        C   74 0.851
   101  H   0.944        C   74 0.786

 dipole moment from electron density (au)
     X       Y       Z   
   5.7048  21.6348   4.5531  total (Debye):   58.035


           -------------------------------------------------
          | TOTAL ENERGY             -224.753993348174 Eh   |
          | GRADIENT NORM               0.453781519094 Eh/α |
          | HOMO-LUMO GAP               0.077411671185 eV   |
           -------------------------------------------------

------------------------------------------------------------------------
 * finished run on 2021/12/02 at 16:44:53.075     
------------------------------------------------------------------------
 total:
 * wall-time:     0 d,  0 h,  0 min,  6.234 sec
 *  cpu-time:     0 d,  0 h,  0 min,  6.212 sec
 * ratio c/w:     0.996 speedup
 SCF:
 * wall-time:     0 d,  0 h,  0 min,  5.296 sec
 *  cpu-time:     0 d,  0 h,  0 min,  5.283 sec
 * ratio c/w:     0.998 speedup

