      -----------------------------------------------------------      
     |                   =====================                   |     
     |                           x T B                           |     
     |                   =====================                   |     
     |                         S. Grimme                         |     
     |          Mulliken Center for Theoretical Chemistry        |     
     |                    University of Bonn                     |     
     |                Version 6.2 RC2 (SAW190805)                |     
      -----------------------------------------------------------      

   This program is distributed in the hope that it will be useful,
   but WITHOUT ANY WARRANTY; without even the implied warranty of
   MERCHANTABILITY or FITNESS FOR A PARTICULAR PURPOSE.
   
   FOR NON-COMMERCIAL, ACADEMIA USE ONLY.
   
   Cite this work as:
   * S. Grimme, C. Bannwarth, P. Shushkov, J. Chem. Theory Comput., 2017,
     13, 1989-2009. DOI: 10.1021/acs.jctc.7b00118
   * C. Bannwarth, S. Ehlert and S. Grimme., J. Chem. Theory Comput., 2019,
     15, 1652-1671. DOI: 10.1021/acs.jctc.8b01176
   * P. Pracht, E. Caldeweyher, S. Ehlert, S. Grimme, ChemRxiv, 2019, preprint.
     DOI: 10.26434/chemrxiv.8326202.v1
   
   for DFT-D4:
   * E. Caldeweyher, C. Bannwarth and S. Grimme, J. Chem. Phys., 2017,
     147, 034112. DOI: 10.1063/1.4993215
   * E. Caldeweyher, S. Ehlert, A. Hansen, H. Neugebauer, S. Spicher,
     C. Bannwarth and S. Grimme, J. Chem. Phys., 2019, 150, 154122.
     DOI: 10.1063/1.5090222
   
   for sTDA-xTB:
   * S. Grimme and C. Bannwarth, J. Chem. Phys., 2016, 145, 054103.
     DOI: 10.1063/1.4959605
   
   in the mass-spec context:
   * V. Asgeirsson, C. Bauer and S. Grimme, Chem. Sci., 2017, 8, 4879.
     DOI: 10.1039/c7sc00601b
   
   for metadynamics refer to:
   * S. Grimme, J. Chem. Theory Comput., 2019, 155, 2847-2862
     DOI: 10.1021/acs.jctc.9b00143
   
   with help from (in alphabetical order)
   C. Bannwarth, F. Bohle, G. Brandenburg, E. Caldeweyher, M. Checinski,
   S. Dohm, S. Ehlert, S. Ehrlich, F. März, H. Neugebauer, J. Pisarek,
   P. Pracht, P. Shushkov, and S. Spicher.
   
 * started run on 2021/12/02 at 16:47:31.095     

           -------------------------------------------------
          |                Calculation Setup                |
           -------------------------------------------------

          program call               : /ihome/ghutchison/geoffh/xtb/xtb S-WSeSe-Cl.xyz --vipea
          hostname                   : smp-n128
          coordinate file            : S-WSeSe-Cl.xyz
          omp threads                :                     1
          number of atoms            :                    97
          number of electrons        :                   344
          charge                     :                     0
          spin                       :                   0.0
          first test random number   :      0.17661275854897


########################################################################
# WARNING! Please study the warnings concerning your input carefully
#  - XTBPATH is not set, using XTBHOME instead
########################################################################

           ------------------------------------------------- 
          |                 I P E A - x T B                 |
          |  Ionisation Potentials and Electron Affinities  |
           ------------------------------------------------- 
             KAB for M(3d)-M(3d) :                1.1000
             KAB for M(4d)-M(4d) :                1.2000
             KAB for M(5d)-M(5d) :                1.2000
             k(s)                :                2.1500
             k(p)                :                2.3000
             k(d)                :                2.0000
             k(f)                :                0.0000
             kEN (H0ij)          :                0.7000
             D3 a1               :                0.6300
             D3 a2               :                5.0000
             D3 s6               :                1.0000
             D3 s8               :                2.4000
             D3 s9               :                0.0000
             alphaj              :                1.0000
             XBdamp              :                0.4400
             XBrad               :                1.3000
             kcnsh               :      1.0000   -0.3000   -0.5000    0.5000

  Z AO/shell   Hii/eV     exponent
  1     Thu Sep 22 23:34:11 CEST 2016   EN: 2.200 GAM: 0.405  GM3: 0.1500
     1s    -10.521941    1.306199
     2s     -3.560151    0.398421
  6     Thu Sep 22 23:34:11 CEST 2016   EN: 2.550 GAM: 0.640  GM3: 0.1500
     2s    -15.968100    1.979793
     2p     -9.777107    1.850537
     3S     -3.366990    0.633095
  7     Thu Sep 22 23:34:11 CEST 2016   EN: 3.040 GAM: 0.493  GM3:-0.1000
     2s    -24.040776    2.126160
     2p    -14.426520    2.068425
     3S     -5.882278    0.671040
  8     Thu Sep 22 23:34:11 CEST 2016   EN: 3.440 GAM: 0.717  GM3:-0.2000
     2s    -26.695120    2.575264
     2p    -16.014457    2.159448
     3S     -6.622058    0.958679
 16     Tue Jan 17 20:57:36 CET 2017    EN: 2.580 GAM: 0.455  GM3: 0.1020
     3s    -24.488821    2.492075
     3p    -12.136640    1.997904
     3d     -1.796070    1.747541
 17     Tue Jan 17 19:45:33 CET 2017    EN: 3.160 GAM: 0.559  GM3: 0.2396
     3s    -24.452163    2.559226
     3p    -13.465451    2.054846
     3d     -1.836065    1.762522
 34     Mon Jan 23 10:29:23 CET 2017    EN: 2.550 GAM: 0.546  GM3: 0.1799
     4s    -23.000000    2.998140
     4p    -11.353754    2.073392
     4d     -0.978922    1.745074

           ------------------------------------------------- 
          |        Self-Consistent Charge Iterations        |
           ------------------------------------------------- 

          ...................................................
          :                      SETUP                      :
          :.................................................:
          :  # basis functions                 452          :
          :  # atomic orbitals                 443          :
          :  # shells                          265          :
          :  # electrons                       344          :
          :  # halogen bonds                    14          :
          :  max. iterations                   250          :
          :  Hamiltonian                  GFN1-xTB          :
          :  restarted?                      false          :
          :  GBSA solvation                  false          :
          :  PC potential                    false          :
          :  electronic temp.          300.0000000     K    :
          :  accuracy                    1.0000000          :
          :  -> integral cutoff          0.2500000E+02      :
          :  -> integral neglect         0.1000000E-07      :
          :  -> SCF convergence          0.1000000E-05 Eh   :
          :  -> wf. convergence          0.2000000E-04 e    :
          :  Broyden damping             0.4000000          :
          ...................................................

 iter      E             dE          RMSdq      gap      omega  full diag
   1   -217.4104663 -0.217410E+03  0.968E+00    0.99       0.0  T
   2   -217.3407228  0.697435E-01  0.618E+00    0.44       1.0  T
   3   -214.0870988  0.325362E+01  0.547E+00    0.76       1.0  T
   4   -217.5749380 -0.348784E+01  0.202E+00    0.98       1.0  T
   5   -218.5265393 -0.951601E+00  0.416E-01    0.92       1.0  T
   6   -218.5700792 -0.435399E-01  0.184E-01    0.81       1.0  T
   7   -218.5763092 -0.623009E-02  0.674E-02    0.85       1.0  T
   8   -218.5757179  0.591394E-03  0.792E-02    0.86       1.0  T
   9   -218.5762901 -0.572225E-03  0.437E-02    0.86       1.0  T
  10   -218.5766079 -0.317789E-03  0.115E-02    0.86       1.0  T
  11   -218.5766302 -0.222887E-04  0.589E-03    0.87       1.7  T
  12   -218.5766362 -0.604821E-05  0.235E-03    0.86       4.3  T
  13   -218.5766372 -0.103056E-05  0.109E-03    0.86       9.3  T
  14   -218.5766374 -0.182844E-06  0.510E-04    0.86      19.9  T
  15   -218.5766375 -0.436847E-07  0.188E-04    0.86      54.1  T
  16   -218.5766375 -0.275472E-08  0.119E-04    0.86      85.6  T

   *** convergence criteria satisfied after 16 iterations ***

         #    Occupation            Energy/Eh            Energy/eV
      -------------------------------------------------------------
         1        2.0000           -1.3151641             -35.7874
       ...           ...                  ...                  ...
       166        2.0000           -0.4196297             -11.4187
       167        2.0000           -0.4173025             -11.3554
       168        2.0000           -0.4145626             -11.2808
       169        2.0000           -0.3998282             -10.8799
       170        2.0000           -0.3987680             -10.8510
       171        2.0000           -0.3773107             -10.2671
       172        2.0000           -0.3736418             -10.1673 (HOMO)
       173        0.0000           -0.3418973              -9.3035 (LUMO)
       174                         -0.3326287              -9.0513
       175                         -0.3284064              -8.9364
       176                         -0.3253480              -8.8532
       177                         -0.3088523              -8.4043
       ...                                ...                  ...
       443                        542.6562698           14766.4287
      -------------------------------------------------------------
                  HL-Gap            0.0317446 Eh            0.8638 eV
             Fermi-level           -0.3577597 Eh           -9.7351 eV

 SCC (total)                   0 d,  0 h,  0 min,  1.636 sec
 SCC setup                      ...        0 min,  0.004 sec (  0.241%)
 Dispersion                     ...        0 min,  0.000 sec (  0.018%)
 integral evaluation            ...        0 min,  0.852 sec ( 52.076%)
 zeroth order Hamiltonian       ...        0 min,  0.003 sec (  0.210%)
 iterations                     ...        0 min,  0.513 sec ( 31.340%)
 molecular gradient             ...        0 min,  0.259 sec ( 15.836%)
 printout                       ...        0 min,  0.004 sec (  0.274%)

         :::::::::::::::::::::::::::::::::::::::::::::::::::::
         ::                     SUMMARY                     ::
         :::::::::::::::::::::::::::::::::::::::::::::::::::::
         :: total energy            -215.073034595179 Eh    ::
         :: gradient norm              0.314369004015 Eh/a0 ::
         :: HOMO-LUMO gap              0.863814181444 eV    ::
         ::.................................................::
         :: SCC energy              -218.576637464707 Eh    ::
         :: -> electrostatic           0.200656734540 Eh    ::
         :: repulsion energy           3.602960456505 Eh    ::
         :: dispersion energy         -0.099357586977 Eh    ::
         :: halogen bond corr.         0.000000000000 Eh    ::
         :: add. restraining           0.000000000000 Eh    ::
         :::::::::::::::::::::::::::::::::::::::::::::::::::::

           ------------------------------------------------- 
          |        vertical delta SCC IP calculation        |
           ------------------------------------------------- 

          ...................................................
          :                      SETUP                      :
          :.................................................:
          :  # basis functions                 452          :
          :  # atomic orbitals                 443          :
          :  # shells                          265          :
          :  # electrons                       343          :
          :  # halogen bonds                    14          :
          :  max. iterations                   250          :
          :  Hamiltonian                  GFN1-xTB          :
          :  restarted?                       true          :
          :  GBSA solvation                  false          :
          :  PC potential                    false          :
          :  electronic temp.          300.0000000     K    :
          :  accuracy                    1.0000000          :
          :  -> integral cutoff          0.2500000E+02      :
          :  -> integral neglect         0.1000000E-07      :
          :  -> SCF convergence          0.1000000E-05 Eh   :
          :  -> wf. convergence          0.2000000E-04 e    :
          :  Broyden damping             0.4000000          :
          ...................................................

 iter      E             dE          RMSdq      gap      omega  full diag
   1   -218.1280132 -0.218128E+03  0.267E-01    0.86       0.0  T
   2   -218.0607021  0.673111E-01  0.463E-01    1.14       1.0  T
   3   -218.1481326 -0.874306E-01  0.188E-01    1.25       1.0  T
   4   -218.1502189 -0.208630E-02  0.161E-01    1.28       1.0  T
   5   -218.1468290  0.338987E-02  0.182E-01    1.24       1.0  T
   6   -218.1515933 -0.476423E-02  0.101E-01    1.26       1.0  T
   7   -218.1568073 -0.521401E-02  0.516E-02    1.29       1.0  T
   8   -218.1578539 -0.104658E-02  0.185E-02    1.28       1.0  T
   9   -218.1579233 -0.693914E-04  0.885E-03    1.28       1.1  T
  10   -218.1579497 -0.264199E-04  0.384E-03    1.29       2.6  T
  11   -218.1579516 -0.189126E-05  0.247E-03    1.28       4.1  T
  12   -218.1579538 -0.218493E-05  0.100E-03    1.28      10.1  T
  13   -218.1579538 -0.739578E-07  0.689E-04    1.28      14.7  T
  14   -218.1579540 -0.141466E-06  0.189E-04    1.28      53.7  T
  15   -218.1579540 -0.678941E-08  0.657E-05    1.28     154.5  T

   *** convergence criteria satisfied after 15 iterations ***

         #    Occupation            Energy/Eh            Energy/eV
      -------------------------------------------------------------
         1        2.0000           -1.3699091             -37.2771
       ...           ...                  ...                  ...
       166        2.0000           -0.4867651             -13.2456
       167        2.0000           -0.4857004             -13.2166
       168        2.0000           -0.4802242             -13.0676
       169        2.0000           -0.4722014             -12.8493
       170        1.9964           -0.4671966             -12.7131
       171        1.9175           -0.4641540             -12.6303
       172        1.0861           -0.4596215             -12.5069 (HOMO)
       173                         -0.4124299             -11.2228 (LUMO)
       174                         -0.4064261             -11.0594
       175                         -0.3986276             -10.8472
       176                         -0.3890098             -10.5855
       177                         -0.3846738             -10.4675
       ...                                ...                  ...
       443                        542.5801907           14764.3585
      -------------------------------------------------------------
                  HL-Gap            0.0471916 Eh            1.2841 eV
             Fermi-level           -0.4489438 Eh          -12.2164 eV

 SCC (total)                   0 d,  0 h,  0 min,  1.591 sec
 SCC setup                      ...        0 min,  0.003 sec (  0.212%)
 Dispersion                     ...        0 min,  0.000 sec (  0.013%)
 integral evaluation            ...        0 min,  0.851 sec ( 53.454%)
 zeroth order Hamiltonian       ...        0 min,  0.003 sec (  0.212%)
 iterations                     ...        0 min,  0.472 sec ( 29.632%)
 molecular gradient             ...        0 min,  0.258 sec ( 16.187%)
 printout                       ...        0 min,  0.005 sec (  0.287%)

         :::::::::::::::::::::::::::::::::::::::::::::::::::::
         ::                     SUMMARY                     ::
         :::::::::::::::::::::::::::::::::::::::::::::::::::::
         :: total energy            -214.654351105815 Eh    ::
         :: gradient norm              0.323685778278 Eh/a0 ::
         :: HOMO-LUMO gap              1.284149519219 eV    ::
         ::.................................................::
         :: SCC energy              -218.157953975343 Eh    ::
         :: -> electrostatic           0.243961742683 Eh    ::
         :: repulsion energy           3.602960456505 Eh    ::
         :: dispersion energy         -0.099357586977 Eh    ::
         :: halogen bond corr.         0.000000000000 Eh    ::
         :: add. restraining           0.000000000000 Eh    ::
         :::::::::::::::::::::::::::::::::::::::::::::::::::::

------------------------------------------------------------------------
empirical IP shift (eV):    4.8455
delta SCC IP (eV):    6.5475
------------------------------------------------------------------------
           ------------------------------------------------- 
          |        vertical delta SCC EA calculation        |
           ------------------------------------------------- 

          ...................................................
          :                      SETUP                      :
          :.................................................:
          :  # basis functions                 452          :
          :  # atomic orbitals                 443          :
          :  # shells                          265          :
          :  # electrons                       345          :
          :  # halogen bonds                    14          :
          :  max. iterations                   250          :
          :  Hamiltonian                  GFN1-xTB          :
          :  restarted?                       true          :
          :  GBSA solvation                  false          :
          :  PC potential                    false          :
          :  electronic temp.          300.0000000     K    :
          :  accuracy                    1.0000000          :
          :  -> integral cutoff          0.2500000E+02      :
          :  -> integral neglect         0.1000000E-07      :
          :  -> SCF convergence          0.1000000E-05 Eh   :
          :  -> wf. convergence          0.2000000E-04 e    :
          :  Broyden damping             0.4000000          :
          ...................................................

 iter      E             dE          RMSdq      gap      omega  full diag
   1   -218.8092783 -0.218809E+03  0.375E-01    0.16       0.0  T
   2   -218.7791867  0.300916E-01  0.511E-01    0.15       1.0  T
   3   -218.8629499 -0.837632E-01  0.252E-01    0.03       1.0  T
   4   -218.8529245  0.100254E-01  0.264E-01    0.25       1.0  T
   5   -218.8732839 -0.203594E-01  0.153E-01    0.18       1.0  T
   6   -218.8669627  0.632124E-02  0.144E-01    0.04       1.0  T
   7   -218.8738298 -0.686711E-02  0.103E-01    0.18       1.0  T
   8   -218.8787895 -0.495970E-02  0.447E-02    0.10       1.0  T
   9   -218.8797159 -0.926365E-03  0.121E-02    0.07       1.0  T
  10   -218.8797092  0.673146E-05  0.840E-03    0.08       1.2  T
  11   -218.8797312 -0.219979E-04  0.537E-03    0.07       1.9  T
  12   -218.8797439 -0.127746E-04  0.338E-03    0.08       3.0  T
  13   -218.8797485 -0.456137E-05  0.173E-03    0.08       5.9  T
  14   -218.8797502 -0.169000E-05  0.497E-04    0.07      20.4  T
  15   -218.8797502  0.776708E-09  0.302E-04    0.07      33.6  T
  16   -218.8797502 -0.488537E-07  0.811E-05    0.07     125.2  T
  17   -218.8797502 -0.110418E-08  0.392E-05    0.07     259.3  T

   *** convergence criteria satisfied after 17 iterations ***

         #    Occupation            Energy/Eh            Energy/eV
      -------------------------------------------------------------
         1        2.0000           -1.2421751             -33.8013
       ...           ...                  ...                  ...
       167        2.0000           -0.3489781              -9.4962
       168        2.0000           -0.3424990              -9.3199
       169        2.0000           -0.3329590              -9.0603
       170        2.0000           -0.3249183              -8.8415
       171        2.0000           -0.3109196              -8.4606
       172        2.0000           -0.3077428              -8.3741
       173        0.8077           -0.2665829              -7.2541 (HOMO)
       174        0.1921           -0.2638549              -7.1799 (LUMO)
       175        0.0002           -0.2571393              -6.9971
       176        0.0000           -0.2554822              -6.9520
       177                         -0.2389153              -6.5012
       178                         -0.2152725              -5.8579
       ...                                ...                  ...
       443                        542.7284870           14768.3938
      -------------------------------------------------------------
                  HL-Gap            0.0027280 Eh            0.0742 eV
             Fermi-level           -0.2761961 Eh           -7.5157 eV

 SCC (total)                   0 d,  0 h,  0 min,  1.652 sec
 SCC setup                      ...        0 min,  0.003 sec (  0.202%)
 Dispersion                     ...        0 min,  0.000 sec (  0.017%)
 integral evaluation            ...        0 min,  0.848 sec ( 51.321%)
 zeroth order Hamiltonian       ...        0 min,  0.003 sec (  0.203%)
 iterations                     ...        0 min,  0.534 sec ( 32.351%)
 molecular gradient             ...        0 min,  0.258 sec ( 15.601%)
 printout                       ...        0 min,  0.005 sec (  0.301%)

         :::::::::::::::::::::::::::::::::::::::::::::::::::::
         ::                     SUMMARY                     ::
         :::::::::::::::::::::::::::::::::::::::::::::::::::::
         :: total energy            -215.376147355976 Eh    ::
         :: gradient norm              0.314610782424 Eh/a0 ::
         :: HOMO-LUMO gap              0.074232439676 eV    ::
         ::.................................................::
         :: SCC energy              -218.879750225504 Eh    ::
         :: -> electrostatic           0.224301996305 Eh    ::
         :: repulsion energy           3.602960456505 Eh    ::
         :: dispersion energy         -0.099357586977 Eh    ::
         :: halogen bond corr.         0.000000000000 Eh    ::
         :: add. restraining           0.000000000000 Eh    ::
         :::::::::::::::::::::::::::::::::::::::::::::::::::::

------------------------------------------------------------------------
empirical EA shift (eV):    4.8455
delta SCC EA (eV):    3.4026
------------------------------------------------------------------------
           -------------------------------------------------
          |                Property Printout                |
           -------------------------------------------------

    * Orbital Energies and Occupations

         #    Occupation            Energy/Eh            Energy/eV
      -------------------------------------------------------------
         1        2.0000           -1.2421751             -33.8013
       ...           ...                  ...                  ...
       161        2.0000           -0.3681019             -10.0166
       162        2.0000           -0.3678801             -10.0105
       163        2.0000           -0.3656914              -9.9510
       164        2.0000           -0.3648046              -9.9268
       165        2.0000           -0.3575207              -9.7286
       166        2.0000           -0.3528679              -9.6020
       167        2.0000           -0.3489781              -9.4962
       168        2.0000           -0.3424990              -9.3199
       169        2.0000           -0.3329590              -9.0603
       170        2.0000           -0.3249183              -8.8415
       171        2.0000           -0.3109196              -8.4606
       172        2.0000           -0.3077428              -8.3741
       173        0.8077           -0.2665829              -7.2541 (HOMO)
       174        0.1921           -0.2638549              -7.1799 (LUMO)
       175        0.0002           -0.2571393              -6.9971
       176        0.0000           -0.2554822              -6.9520
       177                         -0.2389153              -6.5012
       178                         -0.2152725              -5.8579
       179                         -0.1954708              -5.3190
       180                         -0.1840209              -5.0075
       181                         -0.1804232              -4.9096
       182                         -0.1764748              -4.8021
       183                         -0.1744914              -4.7482
       184                         -0.1701392              -4.6297
       ...                                ...                  ...
       443                        542.7284870           14768.3938
      -------------------------------------------------------------
                  HL-Gap            0.0027280 Eh            0.0742 eV
             Fermi-level           -0.2761961 Eh           -7.5157 eV

  Mulliken/CM5 charges        n(s)   n(p)   n(d)
     1 C  -0.07128 -0.03704   0.730  3.198  0.000
     2 O   0.14685  0.09677   1.600  4.547  0.000
     3 C   0.07277  0.07094   1.087  2.986  0.000
     4 C   0.02609 -0.02277   1.093  2.933  0.000
     5 C  -0.05755 -0.06136   1.166  2.776  0.000
     6 C  -0.05696 -0.06094   1.163  2.780  0.000
     7 C   0.01535 -0.03355   1.075  2.941  0.000
     8 C  -0.00187 -0.00513   1.076  2.922  0.000
     9 C  -0.02400 -0.02469   1.105  2.871  0.000
    10 C  -0.00191  0.00424   1.025  2.973  0.000
    11 C  -0.11402  0.00328   1.200  2.686  0.000
    12 N   0.27278  0.13914   1.497  3.776  0.000
    13 C  -0.11041  0.00873   1.203  2.687  0.000
    14 N   0.28396  0.15377   1.527  3.757  0.000
    15 C  -0.03453 -0.03678   1.133  2.832  0.000
    16 C   0.01376 -0.03568   1.076  2.937  0.000
    17 C   0.00734 -0.00261   1.128  2.880  0.000
    18 Se -0.03025 -0.01199   1.905  3.932  0.132
    19 C   0.01916  0.01737   1.125  2.894  0.000
    20 C  -0.00505  0.00572   1.144  2.851  0.000
    21 C   0.00271 -0.00723   1.077  2.925  0.000
    22 C   0.02667 -0.07943   1.071  2.955  0.000
    23 C   0.05676 -0.09468   1.072  2.984  0.000
    24 S   0.06100  0.02723   1.876  4.117  0.068
    25 C  -0.00830  0.01389   1.145  2.847  0.000
    26 C  -0.04698  0.02157   1.067  2.886  0.000
    27 N   0.11016 -0.14744   1.255  3.855  0.000
    28 C  -0.03519 -0.08342   1.094  2.871  0.000
    29 C   0.05786 -0.08981   1.067  2.991  0.000
    30 C  -0.05533  0.01419   1.064  2.881  0.000
    31 C   0.01035  0.02334   1.077  2.934  0.000
    32 C  -0.07089  0.01696   1.150  2.779  0.000
    33 N   0.24546  0.08377   1.475  3.771  0.000
    34 S  -0.16698 -0.03077   1.861  3.660  0.312
    35 N   0.24514  0.08221   1.459  3.786  0.000
    36 C  -0.06911  0.01818   1.146  2.785  0.000
    37 C   0.01567  0.02816   1.075  2.940  0.000
    38 C  -0.06381  0.00243   1.078  2.858  0.000
    39 N   0.10151 -0.15585   1.274  3.828  0.000
    40 C  -0.03535 -0.08502   1.097  2.868  0.000
    41 C   0.05781 -0.08897   1.072  2.986  0.000
    42 C  -0.07785 -0.00574   1.159  2.763  0.000
    43 C  -0.04460 -0.02946   1.246  2.710  0.000
    44 S   0.15066  0.12257   1.913  4.190  0.047
    45 C  -0.02104 -0.01102   1.250  2.729  0.000
    46 C   0.11693  0.11832   1.090  3.027  0.000
    47 Se  0.09679  0.10787   1.931  4.153  0.013
    48 C   0.01908  0.01105   1.156  2.863  0.000
    49 C  -0.09682 -0.08429   1.182  2.721  0.000
    50 C   0.04396 -0.05976   1.104  2.940  0.000
    51 C   0.20392  0.05348   1.036  3.168  0.000
    52 C   0.13870  0.08949   1.059  3.080  0.000
    53 C   0.04353  0.04179   1.047  2.996  0.000
    54 C  -0.00886 -0.00911   1.111  2.881  0.000
    55 C   0.00143  0.00811   1.040  2.961  0.000
    56 C  -0.10318  0.01619   1.208  2.688  0.000
    57 N   0.29325  0.16380   1.527  3.767  0.000
    58 C  -0.10441  0.01521   1.211  2.685  0.000
    59 N   0.28930  0.16016   1.525  3.764  0.000
    60 C   0.01909  0.01574   1.074  2.945  0.000
    61 C   0.12469  0.07578   1.080  3.045  0.000
    62 C  -0.04018 -0.04411   1.170  2.790  0.000
    63 C  -0.03996 -0.04379   1.174  2.786  0.000
    64 C   0.13661  0.08763   1.056  3.081  0.000
    65 C   0.01964  0.01753   1.092  2.928  0.000
    66 C  -0.10315 -0.07676   1.136  2.761  0.000
    67 O   0.20303  0.13568   1.641  4.562  0.000
    68 Cl  0.16821  0.16730   1.859  5.290  0.020
    69 Cl  0.14439  0.14352   1.855  5.271  0.019
    70 Cl  0.13744  0.13642   1.852  5.269  0.016
    71 Cl  0.16581  0.16481   1.856  5.289  0.021
    72 H  -0.03050  0.02912   0.969  0.000  0.000
    73 H  -0.03840  0.02680   0.962  0.000  0.000
    74 H  -0.05645  0.01402   0.944  0.000  0.000
    75 H  -0.02103  0.03687   0.979  0.000  0.000
    76 H  -0.02416  0.03408   0.976  0.000  0.000
    77 H  -0.01341  0.04049   0.987  0.000  0.000
    78 H  -0.01602  0.03625   0.984  0.000  0.000
    79 H  -0.01923  0.03373   0.981  0.000  0.000
    80 H  -0.03659  0.03338   0.963  0.000  0.000
    81 H  -0.03710  0.02978   0.963  0.000  0.000
    82 H  -0.02501  0.02979   0.975  0.000  0.000
    83 H  -0.02903  0.02345   0.971  0.000  0.000
    84 H  -0.01839  0.03859   0.982  0.000  0.000
    85 H  -0.02877  0.03605   0.971  0.000  0.000
    86 H  -0.03715  0.03478   0.963  0.000  0.000
    87 H  -0.00893  0.04789   0.991  0.000  0.000
    88 H  -0.02184  0.03052   0.978  0.000  0.000
    89 H  -0.01905  0.03614   0.981  0.000  0.000
    90 H   0.00403  0.06284   1.004  0.000  0.000
    91 H   0.00921  0.06829   1.009  0.000  0.000
    92 H   0.03595  0.09195   1.036  0.000  0.000
    93 H  -0.00602  0.04596   0.994  0.000  0.000
    94 H  -0.29885 -0.24421   0.701  0.000  0.000
    95 H  -0.30652 -0.24289   0.693  0.000  0.000
    96 H  -0.29838 -0.23420   0.702  0.000  0.000
    97 H  -0.32411 -0.26456   0.676  0.000  0.000
(R)spin-density population

 Mulliken population n(s)   n(p)   n(d)
     1 C   0.0003  -0.000  0.000  0.000
     2 O   0.0187   0.000  0.018  0.000
     3 C   0.0105   0.000  0.010  0.000
     4 C   0.0038  -0.000  0.004  0.000
     5 C   0.0136   0.000  0.014  0.000
     6 C   0.0009  -0.000  0.001  0.000
     7 C   0.0147  -0.000  0.015  0.000
     8 C   0.0002   0.000  0.000  0.000
     9 C   0.0531   0.000  0.053  0.000
    10 C   0.0487   0.000  0.049  0.000
    11 C   0.0073   0.000  0.007  0.000
    12 N   0.0249   0.000  0.025  0.000
    13 C   0.0058   0.000  0.006  0.000
    14 N   0.0230  -0.000  0.023  0.000
    15 C   0.0241   0.001  0.023  0.000
    16 C   0.0873   0.000  0.087  0.000
    17 C   0.0025  -0.000  0.003  0.000
    18 Se  0.0255   0.000  0.023  0.003
    19 C   0.0481  -0.000  0.048  0.000
    20 C   0.0003  -0.000  0.000  0.000
    21 C   0.0593   0.000  0.059  0.000
    22 C   0.0005   0.000  0.000  0.000
    23 C   0.0037   0.001  0.003  0.000
    24 S   0.0074   0.000  0.006  0.001
    25 C   0.0161   0.000  0.016  0.000
    26 C   0.0018   0.000  0.002  0.000
    27 N   0.0130   0.000  0.013  0.000
    28 C   0.0003   0.000  0.000  0.000
    29 C   0.0008   0.000  0.000  0.000
    30 C   0.0202   0.000  0.020  0.000
    31 C   0.0038   0.000  0.004  0.000
    32 C   0.0002   0.000  0.000  0.000
    33 N   0.0104   0.000  0.010  0.000
    34 S   0.0357  -0.000  0.028  0.008
    35 N   0.0296   0.000  0.030  0.000
    36 C   0.0041  -0.000  0.004  0.000
    37 C   0.0380   0.000  0.038  0.000
    38 C   0.0145   0.000  0.015  0.000
    39 N   0.0005   0.000  0.000  0.000
    40 C   0.0001   0.000  0.000  0.000
    41 C   0.0001   0.000  0.000  0.000
    42 C   0.0133   0.000  0.013  0.000
    43 C   0.0023   0.000  0.002  0.000
    44 S   0.0146   0.000  0.013  0.002
    45 C   0.0129   0.001  0.012  0.000
    46 C   0.0088   0.001  0.008  0.000
    47 Se  0.0249   0.000  0.023  0.001
    48 C   0.0010   0.000  0.001  0.000
    49 C   0.0005   0.000  0.000  0.000
    50 C   0.0012   0.000  0.001  0.000
    51 C   0.0001   0.000  0.000  0.000
    52 C   0.0085   0.000  0.008  0.000
    53 C   0.0010   0.000  0.001  0.000
    54 C   0.0330  -0.000  0.033  0.000
    55 C   0.0269  -0.000  0.027  0.000
    56 C   0.0042   0.000  0.004  0.000
    57 N   0.0134   0.000  0.013  0.000
    58 C   0.0041  -0.000  0.004  0.000
    59 N   0.0131  -0.000  0.013  0.000
    60 C   0.0157  -0.000  0.016  0.000
    61 C   0.0049  -0.000  0.005  0.000
    62 C   0.0145  -0.000  0.015  0.000
    63 C   0.0103  -0.000  0.010  0.000
    64 C   0.0085   0.000  0.008  0.000
    65 C   0.0120   0.000  0.012  0.000
    66 C   0.0458   0.000  0.046  0.000
    67 O   0.0180   0.000  0.018  0.000
    68 Cl  0.0026   0.000  0.001  0.001
    69 Cl  0.0034   0.000  0.002  0.001
    70 Cl  0.0002   0.000  0.000  0.000
    71 Cl  0.0036  -0.000  0.002  0.002
    72 H   0.0000   0.000  0.000  0.000
    73 H  -0.0000  -0.000  0.000  0.000
    74 H   0.0004   0.000  0.000  0.000
    75 H   0.0008   0.001  0.000  0.000
    76 H   0.0004   0.000  0.000  0.000
    77 H   0.0000   0.000  0.000  0.000
    78 H   0.0003   0.000  0.000  0.000
    79 H   0.0000   0.000  0.000  0.000
    80 H   0.0000   0.000  0.000  0.000
    81 H   0.0005   0.000  0.000  0.000
    82 H   0.0001   0.000  0.000  0.000
    83 H   0.0001   0.000  0.000  0.000
    84 H   0.0001   0.000  0.000  0.000
    85 H   0.0000   0.000  0.000  0.000
    86 H   0.0000   0.000  0.000  0.000
    87 H   0.0001   0.000  0.000  0.000
    88 H   0.0000   0.000  0.000  0.000
    89 H  -0.0000  -0.000  0.000  0.000
    90 H   0.0000   0.000  0.000  0.000
    91 H   0.0001   0.000  0.000  0.000
    92 H   0.0000   0.000  0.000  0.000
    93 H   0.0001   0.000  0.000  0.000
    94 H   0.0000   0.000  0.000  0.000
    95 H   0.0001   0.000  0.000  0.000
    96 H   0.0000   0.000  0.000  0.000
    97 H   0.0000   0.000  0.000  0.000

Wiberg/Mayer (AO) data.
largest (>0.10) Wiberg bond orders for each atom
          total WBO             WBO to atom ...
     1  C   2.450        O    2 1.073    C    3 0.809    C   15 0.515
     2  O   2.169        C    1 1.073    C   15 0.428    Se  18 0.271    C    3 0.105
     3  C   3.736        C    4 1.449    C    8 1.307    C    1 0.809    O    2 0.105
     4  C   3.913        C    3 1.449    C    5 1.395    H   72 0.984
     5  C   3.940        C    4 1.395    C    6 1.384    Cl  69 1.084
     6  C   3.975        C    7 1.411    C    5 1.384    Cl  70 1.083
     7  C   3.838        C    8 1.417    C    6 1.411    H   73 0.993
     8  C   3.896        C    7 1.417    C    3 1.307    C    9 1.092
     9  C   3.864        C   10 1.421    C   15 1.199    C    8 1.092
    10  C   3.740        C    9 1.421    C   11 1.161    C   13 1.153
    11  C   4.084        N   12 2.873    C   10 1.161
    12  N   2.840        C   11 2.873
    13  C   4.092        N   14 2.904    C   10 1.153
    14  N   2.919        C   13 2.904
    15  C   3.738        C   16 1.461    C    9 1.199    C    1 0.515    O    2 0.428
    16  C   3.720        C   15 1.461    C   17 1.355    H   74 0.947
    17  C   3.846        C   21 1.368    C   16 1.355    Se  18 1.083
    18  Se  2.605        C   19 1.111    C   17 1.083    O    2 0.271
    19  C   3.772        C   20 1.352    C   26 1.302    Se  18 1.111
    20  C   3.882        C   21 1.385    C   19 1.352    S   24 1.144
    21  C   3.763        C   20 1.385    C   17 1.368    C   22 1.013
    22  C   3.891        C   21 1.013    H   75 0.994    H   76 0.989    C   23 0.975
    23  C   3.911        H   77 1.004    H   79 0.996    H   78 0.994    C   22 0.975
    24  S   2.475        C   25 1.196    C   20 1.144
    25  C   3.892        C   26 1.331    C   31 1.309    S   24 1.196
    26  C   3.855        C   25 1.331    C   19 1.302    N   27 1.162
    27  N   3.112        C   30 1.172    C   26 1.162    C   28 0.973
    28  C   3.888        H   80 1.004    C   29 0.996    H   81 0.989    N   27 0.973
    29  C   3.886        H   82 1.001    H   84 0.998    C   28 0.996    H   83 0.993
    30  C   3.826        C   31 1.292    C   38 1.283    N   27 1.172
    31  C   3.878        C   25 1.309    C   30 1.292    C   32 1.217
    32  C   4.031        N   33 1.549    C   31 1.217    C   36 1.180    S   34 0.103
    33  N   3.001        C   32 1.549    S   34 1.396
    34  S   3.108        N   35 1.405    N   33 1.396    C   32 0.103
    35  N   2.936        C   36 1.499    S   34 1.405
    36  C   4.024        N   35 1.499    C   37 1.262    C   32 1.180
    37  C   3.834        C   38 1.385    C   36 1.262    C   43 1.112
    38  C   3.853        C   37 1.385    C   30 1.283    N   39 1.112
    39  N   3.198        C   42 1.266    C   38 1.112    C   40 0.961
    40  C   3.886        H   86 1.008    H   85 0.996    C   41 0.990    N   39 0.961
    41  C   3.903        H   87 1.005    H   89 1.000    C   40 0.990    H   88 0.989
    42  C   3.955        C   46 1.497    N   39 1.266    C   43 1.049
    43  C   3.933        C   37 1.112    C   42 1.049    S   44 1.017    Se  47 0.800
    44  S   2.172        C   43 1.017    C   45 0.967
    45  C   3.951        C   46 1.765    C   49 1.042    S   44 0.967
    46  C   3.367        C   45 1.765    C   42 1.497
    47  Se  2.080        C   48 1.083    C   43 0.800
    48  C   3.853        C   52 1.740    Se  47 1.083    C   49 0.965
    49  C   3.983        C   45 1.042    C   50 0.971    C   48 0.965    O   67 0.946
    50  C   3.913        H   91 0.998    H   90 0.998    C   51 0.992    C   49 0.971
    51  C   3.715        H   92 1.027    C   50 0.992    H   93 0.958    H   94 0.854
    52  C   3.681        C   48 1.740    C   53 1.171    H   95 0.830
    53  C   3.821        C   66 1.410    C   54 1.198    C   52 1.171
    54  C   3.864        C   55 1.454    C   53 1.198    C   60 1.088
    55  C   3.790        C   54 1.454    C   56 1.158    C   58 1.156
    56  C   4.099        N   57 2.896    C   55 1.158
    57  N   2.909        C   56 2.896
    58  C   4.106        N   59 2.894    C   55 1.156
    59  N   2.917        C   58 2.894
    60  C   3.846        C   61 1.472    C   65 1.278    C   54 1.088
    61  C   3.716        C   60 1.472    C   62 1.379    H   96 0.858
    62  C   3.939        C   63 1.398    C   61 1.379    Cl  71 1.068
    63  C   3.954        C   62 1.398    C   64 1.392    Cl  68 1.064
    64  C   3.725        C   65 1.450    C   63 1.392    H   97 0.835
    65  C   3.892        C   64 1.450    C   60 1.278    C   66 1.107
    66  C   3.871        C   53 1.410    O   67 1.245    C   65 1.107
    67  O   2.301        C   66 1.245    C   49 0.946
    68  Cl  1.175        C   63 1.064
    69  Cl  1.189        C    5 1.084
    70  Cl  1.192        C    6 1.083
    71  Cl  1.177        C   62 1.068
    72  H   1.044        C    4 0.984
    73  H   1.057        C    7 0.993
    74  H   1.069        C   16 0.947
    75  H   1.052        C   22 0.994
    76  H   1.041        C   22 0.989
    77  H   1.049        C   23 1.004
    78  H   1.050        C   23 0.994
    79  H   1.032        C   23 0.996
    80  H   1.048        C   28 1.004
    81  H   1.038        C   28 0.989
    82  H   1.033        C   29 1.001
    83  H   1.031        C   29 0.993
    84  H   1.053        C   29 0.998
    85  H   1.046        C   40 0.996
    86  H   1.040        C   40 1.008
    87  H   1.074        C   41 1.005
    88  H   1.036        C   41 0.989
    89  H   1.040        C   41 1.000
    90  H   1.058        C   50 0.998
    91  H   1.082        C   50 0.998
    92  H   1.063        C   51 1.027
    93  H   0.950        C   51 0.958
    94  H   0.943        C   51 0.854
    95  H   0.944        C   52 0.830
    96  H   0.945        C   61 0.858
    97  H   0.921        C   64 0.835

 dipole moment from electron density (au)
     X       Y       Z   
   1.3273   4.1242  -6.2036  total (Debye):   19.233


           -------------------------------------------------
          | TOTAL ENERGY             -215.376147355976 Eh   |
          | GRADIENT NORM               0.314610782424 Eh/α |
          | HOMO-LUMO GAP               0.074232439676 eV   |
           -------------------------------------------------

------------------------------------------------------------------------
 * finished run on 2021/12/02 at 16:47:36.850     
------------------------------------------------------------------------
 total:
 * wall-time:     0 d,  0 h,  0 min,  5.755 sec
 *  cpu-time:     0 d,  0 h,  0 min,  5.734 sec
 * ratio c/w:     0.996 speedup
 SCF:
 * wall-time:     0 d,  0 h,  0 min,  4.881 sec
 *  cpu-time:     0 d,  0 h,  0 min,  4.868 sec
 * ratio c/w:     0.997 speedup

