      -----------------------------------------------------------      
     |                   =====================                   |     
     |                           x T B                           |     
     |                   =====================                   |     
     |                         S. Grimme                         |     
     |          Mulliken Center for Theoretical Chemistry        |     
     |                    University of Bonn                     |     
     |                Version 6.2 RC2 (SAW190805)                |     
      -----------------------------------------------------------      

   This program is distributed in the hope that it will be useful,
   but WITHOUT ANY WARRANTY; without even the implied warranty of
   MERCHANTABILITY or FITNESS FOR A PARTICULAR PURPOSE.
   
   FOR NON-COMMERCIAL, ACADEMIA USE ONLY.
   
   Cite this work as:
   * S. Grimme, C. Bannwarth, P. Shushkov, J. Chem. Theory Comput., 2017,
     13, 1989-2009. DOI: 10.1021/acs.jctc.7b00118
   * C. Bannwarth, S. Ehlert and S. Grimme., J. Chem. Theory Comput., 2019,
     15, 1652-1671. DOI: 10.1021/acs.jctc.8b01176
   * P. Pracht, E. Caldeweyher, S. Ehlert, S. Grimme, ChemRxiv, 2019, preprint.
     DOI: 10.26434/chemrxiv.8326202.v1
   
   for DFT-D4:
   * E. Caldeweyher, C. Bannwarth and S. Grimme, J. Chem. Phys., 2017,
     147, 034112. DOI: 10.1063/1.4993215
   * E. Caldeweyher, S. Ehlert, A. Hansen, H. Neugebauer, S. Spicher,
     C. Bannwarth and S. Grimme, J. Chem. Phys., 2019, 150, 154122.
     DOI: 10.1063/1.5090222
   
   for sTDA-xTB:
   * S. Grimme and C. Bannwarth, J. Chem. Phys., 2016, 145, 054103.
     DOI: 10.1063/1.4959605
   
   in the mass-spec context:
   * V. Asgeirsson, C. Bauer and S. Grimme, Chem. Sci., 2017, 8, 4879.
     DOI: 10.1039/c7sc00601b
   
   for metadynamics refer to:
   * S. Grimme, J. Chem. Theory Comput., 2019, 155, 2847-2862
     DOI: 10.1021/acs.jctc.9b00143
   
   with help from (in alphabetical order)
   C. Bannwarth, F. Bohle, G. Brandenburg, E. Caldeweyher, M. Checinski,
   S. Dohm, S. Ehlert, S. Ehrlich, F. März, H. Neugebauer, J. Pisarek,
   P. Pracht, P. Shushkov, and S. Spicher.
   
 * started run on 2021/12/02 at 16:47:47.242     

           -------------------------------------------------
          |                Calculation Setup                |
           -------------------------------------------------

          program call               : /ihome/ghutchison/geoffh/xtb/xtb SNBDT1-F.xyz --vipea
          hostname                   : smp-n128
          coordinate file            : SNBDT1-F.xyz
          omp threads                :                     1
          number of atoms            :                    98
          number of electrons        :                   330
          charge                     :                     0
          spin                       :                   0.0
          first test random number   :      0.44753700729489


########################################################################
# WARNING! Please study the warnings concerning your input carefully
#  - XTBPATH is not set, using XTBHOME instead
########################################################################

           ------------------------------------------------- 
          |                 I P E A - x T B                 |
          |  Ionisation Potentials and Electron Affinities  |
           ------------------------------------------------- 
             KAB for M(3d)-M(3d) :                1.1000
             KAB for M(4d)-M(4d) :                1.2000
             KAB for M(5d)-M(5d) :                1.2000
             k(s)                :                2.1500
             k(p)                :                2.3000
             k(d)                :                2.0000
             k(f)                :                0.0000
             kEN (H0ij)          :                0.7000
             D3 a1               :                0.6300
             D3 a2               :                5.0000
             D3 s6               :                1.0000
             D3 s8               :                2.4000
             D3 s9               :                0.0000
             alphaj              :                1.0000
             XBdamp              :                0.4400
             XBrad               :                1.3000
             kcnsh               :      1.0000   -0.3000   -0.5000    0.5000

  Z AO/shell   Hii/eV     exponent
  1     Thu Sep 22 23:34:11 CEST 2016   EN: 2.200 GAM: 0.405  GM3: 0.1500
     1s    -10.521941    1.306199
     2s     -3.560151    0.398421
  6     Thu Sep 22 23:34:11 CEST 2016   EN: 2.550 GAM: 0.640  GM3: 0.1500
     2s    -15.968100    1.979793
     2p     -9.777107    1.850537
     3S     -3.366990    0.633095
  7     Thu Sep 22 23:34:11 CEST 2016   EN: 3.040 GAM: 0.493  GM3:-0.1000
     2s    -24.040776    2.126160
     2p    -14.426520    2.068425
     3S     -5.882278    0.671040
  8     Thu Sep 22 23:34:11 CEST 2016   EN: 3.440 GAM: 0.717  GM3:-0.2000
     2s    -26.695120    2.575264
     2p    -16.014457    2.159448
     3S     -6.622058    0.958679
  9     Tue Jan 17 20:22:52 CET 2017    EN: 3.980 GAM: 0.574  GM3: 0.2000
     2s    -27.565998    2.304073
     2p    -17.439238    2.314354
     3S     -6.120500    0.570243
 16     Tue Jan 17 20:57:36 CET 2017    EN: 2.580 GAM: 0.455  GM3: 0.1020
     3s    -24.488821    2.492075
     3p    -12.136640    1.997904
     3d     -1.796070    1.747541

           ------------------------------------------------- 
          |        Self-Consistent Charge Iterations        |
           ------------------------------------------------- 

          ...................................................
          :                      SETUP                      :
          :.................................................:
          :  # basis functions                 420          :
          :  # atomic orbitals                 416          :
          :  # shells                          264          :
          :  # electrons                       330          :
          :  # halogen bonds                     0          :
          :  max. iterations                   250          :
          :  Hamiltonian                  GFN1-xTB          :
          :  restarted?                      false          :
          :  GBSA solvation                  false          :
          :  PC potential                    false          :
          :  electronic temp.          300.0000000     K    :
          :  accuracy                    1.0000000          :
          :  -> integral cutoff          0.2500000E+02      :
          :  -> integral neglect         0.1000000E-07      :
          :  -> SCF convergence          0.1000000E-05 Eh   :
          :  -> wf. convergence          0.2000000E-04 e    :
          :  Broyden damping             0.4000000          :
          ...................................................

 iter      E             dE          RMSdq      gap      omega  full diag
   1   -204.1968877 -0.204197E+03  0.103E+01    0.16       0.0  T
   2   -199.1915233  0.500536E+01  0.687E+00    0.18       1.0  T
   3   -126.3390941  0.728524E+02  0.927E+00    0.13       1.0  T
   4    -82.1768436  0.441623E+02  0.108E+01    0.07       1.0  T
   5   -201.5829576 -0.119406E+03  0.382E+00    0.22       1.0  T
   6   -207.7117034 -0.612875E+01  0.161E+00    0.10       1.0  T
   7   -208.2871805 -0.575477E+00  0.120E+00    1.53       1.0  T
   8   -208.3141303 -0.269498E-01  0.103E+00    1.61       1.0  T
   9   -208.3262363 -0.121060E-01  0.843E-01    1.61       1.0  T
  10   -208.3458587 -0.196224E-01  0.563E-01    1.59       1.0  T
  11   -208.3742220 -0.283632E-01  0.305E-01    1.41       1.0  T
  12   -208.3853705 -0.111485E-01  0.198E-01    1.30       1.0  T
  13   -208.3911400 -0.576951E-02  0.137E-01    1.15       1.0  T
  14   -208.3951902 -0.405018E-02  0.756E-02    0.96       1.0  T
  15   -208.3966459 -0.145575E-02  0.365E-02    0.85       1.0  T
  16   -208.3969402 -0.294305E-03  0.214E-02    0.80       1.0  T
  17   -208.3969947 -0.545203E-04  0.117E-02    0.80       1.0  T
  18   -208.3970029 -0.817753E-05  0.857E-03    0.81       1.2  T
  19   -208.3970098 -0.685127E-05  0.710E-03    0.81       1.4  T
  20   -208.3970228 -0.129914E-04  0.547E-03    0.81       1.8  T
  21   -208.3970288 -0.599246E-05  0.439E-03    0.81       2.3  T
  22   -208.3970346 -0.586441E-05  0.286E-03    0.81       3.5  T
  23   -208.3970374 -0.278753E-05  0.171E-03    0.81       5.9  T
  24   -208.3970386 -0.121038E-05  0.871E-04    0.81      11.6  T
  25   -208.3970390 -0.372743E-06  0.244E-04    0.81      41.4  T
  26   -208.3970390 -0.227929E-07  0.716E-05    0.81     141.1  T
  27   -208.3970390 -0.324036E-09  0.464E-05    0.81     217.6  T

   *** convergence criteria satisfied after 27 iterations ***

         #    Occupation            Energy/Eh            Energy/eV
      -------------------------------------------------------------
         1        2.0000           -1.0572521             -28.7693
       ...           ...                  ...                  ...
       159        2.0000           -0.3863310             -10.5126
       160        2.0000           -0.3777262             -10.2785
       161        2.0000           -0.3772642             -10.2659
       162        2.0000           -0.3746805             -10.1956
       163        2.0000           -0.3696824             -10.0596
       164        2.0000           -0.3506052              -9.5405
       165        2.0000           -0.3300463              -8.9810 (HOMO)
       166        0.0000           -0.3003341              -8.1725 (LUMO)
       167                         -0.2929826              -7.9725
       168                         -0.2820495              -7.6750
       169                         -0.2745583              -7.4711
       170                         -0.2362593              -6.4289
       ...                                ...                  ...
       416                        975.2408979           26537.6556
      -------------------------------------------------------------
                  HL-Gap            0.0297122 Eh            0.8085 eV
             Fermi-level           -0.3151904 Eh           -8.5768 eV

 SCC (total)                   0 d,  0 h,  0 min,  1.728 sec
 SCC setup                      ...        0 min,  0.004 sec (  0.220%)
 Dispersion                     ...        0 min,  0.000 sec (  0.018%)
 integral evaluation            ...        0 min,  0.747 sec ( 43.260%)
 zeroth order Hamiltonian       ...        0 min,  0.003 sec (  0.179%)
 iterations                     ...        0 min,  0.737 sec ( 42.662%)
 molecular gradient             ...        0 min,  0.232 sec ( 13.444%)
 printout                       ...        0 min,  0.004 sec (  0.214%)

         :::::::::::::::::::::::::::::::::::::::::::::::::::::
         ::                     SUMMARY                     ::
         :::::::::::::::::::::::::::::::::::::::::::::::::::::
         :: total energy            -204.804473513982 Eh    ::
         :: gradient norm              0.268312155007 Eh/a0 ::
         :: HOMO-LUMO gap              0.808509300321 eV    ::
         ::.................................................::
         :: SCC energy              -208.397039016451 Eh    ::
         :: -> electrostatic           0.443137543827 Eh    ::
         :: repulsion energy           3.680094961237 Eh    ::
         :: dispersion energy         -0.087529458769 Eh    ::
         :: halogen bond corr.         0.000000000000 Eh    ::
         :: add. restraining           0.000000000000 Eh    ::
         :::::::::::::::::::::::::::::::::::::::::::::::::::::

           ------------------------------------------------- 
          |        vertical delta SCC IP calculation        |
           ------------------------------------------------- 

          ...................................................
          :                      SETUP                      :
          :.................................................:
          :  # basis functions                 420          :
          :  # atomic orbitals                 416          :
          :  # shells                          264          :
          :  # electrons                       329          :
          :  # halogen bonds                     0          :
          :  max. iterations                   250          :
          :  Hamiltonian                  GFN1-xTB          :
          :  restarted?                       true          :
          :  GBSA solvation                  false          :
          :  PC potential                    false          :
          :  electronic temp.          300.0000000     K    :
          :  accuracy                    1.0000000          :
          :  -> integral cutoff          0.2500000E+02      :
          :  -> integral neglect         0.1000000E-07      :
          :  -> SCF convergence          0.1000000E-05 Eh   :
          :  -> wf. convergence          0.2000000E-04 e    :
          :  Broyden damping             0.4000000          :
          ...................................................

 iter      E             dE          RMSdq      gap      omega  full diag
   1   -207.9844375 -0.207984E+03  0.286E-01    0.81       0.0  T
   2   -207.9390289  0.454087E-01  0.385E-01    1.63       1.0  T
   3   -208.0089330 -0.699041E-01  0.186E-01    1.30       1.0  T
   4   -208.0142632 -0.533024E-02  0.107E-01    1.36       1.0  T
   5   -208.0173183 -0.305502E-02  0.428E-02    1.52       1.0  T
   6   -208.0176249 -0.306616E-03  0.337E-02    1.52       1.0  T
   7   -208.0179164 -0.291535E-03  0.144E-02    1.50       1.0  T
   8   -208.0179480 -0.315604E-04  0.756E-03    1.51       1.3  T
   9   -208.0179627 -0.147377E-04  0.281E-03    1.51       3.6  T
  10   -208.0179645 -0.177667E-05  0.175E-03    1.51       5.8  T
  11   -208.0179650 -0.523923E-06  0.835E-04    1.51      12.1  T
  12   -208.0179652 -0.160879E-06  0.299E-04    1.51      33.8  T
  13   -208.0179652 -0.116590E-07  0.176E-04    1.51      57.5  T
  14   -208.0179652 -0.487054E-08  0.596E-05    1.51     169.5  T

   *** convergence criteria satisfied after 14 iterations ***

         #    Occupation            Energy/Eh            Energy/eV
      -------------------------------------------------------------
         1        2.0000           -1.1532224             -31.3808
       ...           ...                  ...                  ...
       159        2.0000           -0.4506735             -12.2634
       160        2.0000           -0.4497515             -12.2384
       161        2.0000           -0.4479826             -12.1902
       162        1.9999           -0.4363326             -11.8732
       163        1.9828           -0.4317259             -11.7479
       164        1.9100           -0.4300832             -11.7032
       165        1.1074           -0.4258732             -11.5886 (HOMO)
       166                         -0.3703354             -10.0773 (LUMO)
       167                         -0.3572331              -9.7208
       168                         -0.3440504              -9.3621
       169                         -0.3379607              -9.1964
       170                         -0.3140886              -8.5468
       ...                                ...                  ...
       416                        975.1361597           26534.8055
      -------------------------------------------------------------
                  HL-Gap            0.0555378 Eh            1.5113 eV
             Fermi-level           -0.4129947 Eh          -11.2382 eV

 SCC (total)                   0 d,  0 h,  0 min,  1.369 sec
 SCC setup                      ...        0 min,  0.004 sec (  0.286%)
 Dispersion                     ...        0 min,  0.000 sec (  0.014%)
 integral evaluation            ...        0 min,  0.748 sec ( 54.639%)
 zeroth order Hamiltonian       ...        0 min,  0.003 sec (  0.221%)
 iterations                     ...        0 min,  0.377 sec ( 27.547%)
 molecular gradient             ...        0 min,  0.233 sec ( 17.000%)
 printout                       ...        0 min,  0.004 sec (  0.289%)

         :::::::::::::::::::::::::::::::::::::::::::::::::::::
         ::                     SUMMARY                     ::
         :::::::::::::::::::::::::::::::::::::::::::::::::::::
         :: total energy            -204.425399693235 Eh    ::
         :: gradient norm              0.281152778096 Eh/a0 ::
         :: HOMO-LUMO gap              1.511260220208 eV    ::
         ::.................................................::
         :: SCC energy              -208.017965195703 Eh    ::
         :: -> electrostatic           0.489855008770 Eh    ::
         :: repulsion energy           3.680094961237 Eh    ::
         :: dispersion energy         -0.087529458769 Eh    ::
         :: halogen bond corr.         0.000000000000 Eh    ::
         :: add. restraining           0.000000000000 Eh    ::
         :::::::::::::::::::::::::::::::::::::::::::::::::::::

------------------------------------------------------------------------
empirical IP shift (eV):    4.8455
delta SCC IP (eV):    5.4696
------------------------------------------------------------------------
           ------------------------------------------------- 
          |        vertical delta SCC EA calculation        |
           ------------------------------------------------- 

          ...................................................
          :                      SETUP                      :
          :.................................................:
          :  # basis functions                 420          :
          :  # atomic orbitals                 416          :
          :  # shells                          264          :
          :  # electrons                       331          :
          :  # halogen bonds                     0          :
          :  max. iterations                   250          :
          :  Hamiltonian                  GFN1-xTB          :
          :  restarted?                       true          :
          :  GBSA solvation                  false          :
          :  PC potential                    false          :
          :  electronic temp.          300.0000000     K    :
          :  accuracy                    1.0000000          :
          :  -> integral cutoff          0.2500000E+02      :
          :  -> integral neglect         0.1000000E-07      :
          :  -> SCF convergence          0.1000000E-05 Eh   :
          :  -> wf. convergence          0.2000000E-04 e    :
          :  Broyden damping             0.4000000          :
          ...................................................

 iter      E             dE          RMSdq      gap      omega  full diag
   1   -208.6016460 -0.208602E+03  0.383E-01    0.36       0.0  T
   2   -208.5653568  0.362892E-01  0.508E-01    0.51       1.0  T
   3   -208.6408898 -0.755330E-01  0.263E-01    0.19       1.0  T
   4   -208.6188427  0.220470E-01  0.286E-01    0.26       1.0  T
   5   -208.6384322 -0.195894E-01  0.193E-01    0.26       1.0  T
   6   -208.6583403 -0.199081E-01  0.576E-02    0.14       1.0  T
   7   -208.6580956  0.244733E-03  0.468E-02    0.13       1.0  T
   8   -208.6580327  0.628968E-04  0.453E-02    0.14       1.0  T
   9   -208.6594403 -0.140767E-02  0.130E-02    0.13       1.0  T
  10   -208.6595456 -0.105230E-03  0.248E-03    0.13       4.1  T
  11   -208.6595466 -0.102053E-05  0.133E-03    0.13       7.6  T
  12   -208.6595464  0.199760E-06  0.988E-04    0.13      10.2  T
  13   -208.6595464 -0.510427E-07  0.855E-04    0.13      11.8  T
  14   -208.6595469 -0.472064E-06  0.149E-04    0.13      68.0  T
  15   -208.6595469  0.358796E-09  0.889E-05    0.13     113.6  T

   *** convergence criteria satisfied after 15 iterations ***

         #    Occupation            Energy/Eh            Energy/eV
      -------------------------------------------------------------
         1        2.0000           -0.9893192             -26.9207
       ...           ...                  ...                  ...
       160        2.0000           -0.3101903              -8.4407
       161        2.0000           -0.3062789              -8.3343
       162        2.0000           -0.3040958              -8.2749
       163        2.0000           -0.3018132              -8.2128
       164        2.0000           -0.2822313              -7.6799
       165        2.0000           -0.2628733              -7.1531
       166        0.9245           -0.2253973              -6.1334 (HOMO)
       167        0.0755           -0.2206386              -6.0039 (LUMO)
       168        0.0000           -0.2095995              -5.7035
       169                         -0.2056433              -5.5958
       170                         -0.1810195              -4.9258
       171                         -0.1620183              -4.4087
       ...                                ...                  ...
       416                        975.3086392           26539.4989
      -------------------------------------------------------------
                  HL-Gap            0.0047587 Eh            0.1295 eV
             Fermi-level           -0.2335782 Eh           -6.3560 eV

 SCC (total)                   0 d,  0 h,  0 min,  1.398 sec
 SCC setup                      ...        0 min,  0.004 sec (  0.270%)
 Dispersion                     ...        0 min,  0.000 sec (  0.020%)
 integral evaluation            ...        0 min,  0.746 sec ( 53.347%)
 zeroth order Hamiltonian       ...        0 min,  0.003 sec (  0.217%)
 iterations                     ...        0 min,  0.408 sec ( 29.161%)
 molecular gradient             ...        0 min,  0.233 sec ( 16.665%)
 printout                       ...        0 min,  0.004 sec (  0.315%)

         :::::::::::::::::::::::::::::::::::::::::::::::::::::
         ::                     SUMMARY                     ::
         :::::::::::::::::::::::::::::::::::::::::::::::::::::
         :: total energy            -205.066981397700 Eh    ::
         :: gradient norm              0.283691724813 Eh/a0 ::
         :: HOMO-LUMO gap              0.129490117175 eV    ::
         ::.................................................::
         :: SCC energy              -208.659546900169 Eh    ::
         :: -> electrostatic           0.485934038753 Eh    ::
         :: repulsion energy           3.680094961237 Eh    ::
         :: dispersion energy         -0.087529458769 Eh    ::
         :: halogen bond corr.         0.000000000000 Eh    ::
         :: add. restraining           0.000000000000 Eh    ::
         :::::::::::::::::::::::::::::::::::::::::::::::::::::

------------------------------------------------------------------------
empirical EA shift (eV):    4.8455
delta SCC EA (eV):    2.2977
------------------------------------------------------------------------
           -------------------------------------------------
          |                Property Printout                |
           -------------------------------------------------

    * Orbital Energies and Occupations

         #    Occupation            Energy/Eh            Energy/eV
      -------------------------------------------------------------
         1        2.0000           -0.9893192             -26.9207
       ...           ...                  ...                  ...
       154        2.0000           -0.3355011              -9.1294
       155        2.0000           -0.3338864              -9.0855
       156        2.0000           -0.3317501              -9.0274
       157        2.0000           -0.3277078              -8.9174
       158        2.0000           -0.3264092              -8.8820
       159        2.0000           -0.3180118              -8.6535
       160        2.0000           -0.3101903              -8.4407
       161        2.0000           -0.3062789              -8.3343
       162        2.0000           -0.3040958              -8.2749
       163        2.0000           -0.3018132              -8.2128
       164        2.0000           -0.2822313              -7.6799
       165        2.0000           -0.2628733              -7.1531
       166        0.9245           -0.2253973              -6.1334 (HOMO)
       167        0.0755           -0.2206386              -6.0039 (LUMO)
       168        0.0000           -0.2095995              -5.7035
       169                         -0.2056433              -5.5958
       170                         -0.1810195              -4.9258
       171                         -0.1620183              -4.4087
       172                         -0.1556293              -4.2349
       173                         -0.1440544              -3.9199
       174                         -0.1364165              -3.7121
       175                         -0.1350410              -3.6747
       176                         -0.1309406              -3.5631
       177                         -0.1301618              -3.5419
       ...                                ...                  ...
       416                        975.3086392           26539.4989
      -------------------------------------------------------------
                  HL-Gap            0.0047587 Eh            0.1295 eV
             Fermi-level           -0.2335782 Eh           -6.3560 eV

  Mulliken/CM5 charges        n(s)   n(p)   n(d)
     1 C  -0.35627 -0.35016   0.935  2.709  0.000
     2 C  -0.33730 -0.31295   0.969  2.694  0.000
     3 C  -0.33677 -0.32325   1.022  2.641  0.000
     4 C  -0.00880 -0.00273   0.566  3.425  0.000
     5 C  -0.02322  0.00099   1.071  2.906  0.000
     6 C   0.11571  0.12921   1.125  2.990  0.000
     7 S   0.39033  0.35267   1.793  4.459  0.138
     8 C   0.01611  0.03840   1.116  2.900  0.000
     9 C  -0.00768  0.06189   1.058  2.934  0.000
    10 C   0.00961  0.03143   1.132  2.877  0.000
    11 C  -0.03702  0.02865   1.071  2.892  0.000
    12 N   0.13108 -0.12781   1.275  3.856  0.000
    13 S   0.09254  0.06383   1.889  4.069  0.134
    14 C   0.00737  0.01308   1.159  2.849  0.000
    15 C   0.05191  0.00522   1.072  2.980  0.000
    16 S   0.14095  0.10370   1.873  4.184  0.084
    17 C   0.01641  0.03867   1.125  2.891  0.000
    18 C   0.05892  0.12884   1.016  3.043  0.000
    19 C   0.00385  0.02590   1.125  2.878  0.000
    20 C  -0.04237  0.02365   1.067  2.891  0.000
    21 N   0.13240 -0.12699   1.250  3.882  0.000
    22 S   0.11408  0.08008   1.878  4.167  0.068
    23 C   0.00638  0.01158   1.159  2.847  0.000
    24 C   0.04235 -0.00291   1.057  2.986  0.000
    25 O   0.25582  0.16140   1.612  4.644  0.000
    26 O   0.35329  0.25875   1.624  4.729  0.000
    27 C  -0.03936 -0.12284   1.113  2.847  0.000
    28 C   0.06133 -0.08835   1.058  3.004  0.000
    29 C  -0.05646 -0.13994   1.119  2.825  0.000
    30 C   0.05801 -0.09163   1.066  2.992  0.000
    31 C  -0.03246 -0.08025   1.093  2.874  0.000
    32 C   0.05419 -0.09279   1.062  2.992  0.000
    33 C  -0.01107 -0.05862   1.112  2.877  0.000
    34 C   0.34998  0.20319   0.982  3.368  0.000
    35 C   0.13799  0.09024   1.041  3.097  0.000
    36 C   0.04409  0.04226   1.063  2.981  0.000
    37 C  -0.13264 -0.09706   1.183  2.685  0.000
    38 C   0.04035  0.03866   1.104  2.936  0.000
    39 C   0.02680  0.02337   1.072  2.955  0.000
    40 C   0.00447  0.00382   1.107  2.897  0.000
    41 C   0.15582  0.10834   1.076  3.080  0.000
    42 C  -0.06061 -0.04921   1.169  2.771  0.000
    43 C   0.17633  0.12500   1.083  3.093  0.000
    44 C   0.16310  0.11076   1.089  3.074  0.000
    45 C   0.11950  0.07243   1.078  3.042  0.000
    46 C   0.04454  0.04206   1.065  2.979  0.000
    47 C  -0.13204 -0.09746   1.181  2.687  0.000
    48 C   0.04115  0.03948   1.102  2.939  0.000
    49 C   0.02755  0.02411   1.077  2.951  0.000
    50 C   0.00372  0.00292   1.111  2.893  0.000
    51 C   0.15645  0.10900   1.074  3.083  0.000
    52 C  -0.06050 -0.04912   1.167  2.773  0.000
    53 C   0.17418  0.12284   1.092  3.083  0.000
    54 C   0.17783  0.12549   1.061  3.117  0.000
    55 O   0.35719  0.30120   1.640  4.717  0.000
    56 F   0.22872  0.20470   1.709  5.520  0.000
    57 C   0.02194  0.02800   1.030  2.992  0.000
    58 C  -0.09323  0.02579   1.219  2.688  0.000
    59 C  -0.09123  0.02646   1.215  2.694  0.000
    60 N   0.32431  0.19418   1.528  3.797  0.000
    61 N   0.31753  0.18771   1.530  3.788  0.000
    62 O   0.33159  0.28558   1.653  4.679  0.000
    63 F   0.22911  0.20507   1.710  5.519  0.000
    64 C   0.02363  0.02981   1.028  2.996  0.000
    65 C  -0.09269  0.02627   1.214  2.693  0.000
    66 C  -0.09155  0.02596   1.216  2.693  0.000
    67 N   0.31991  0.18942   1.522  3.798  0.000
    68 N   0.32421  0.19411   1.527  3.797  0.000
    69 H  -0.00192  0.05728   0.998  0.000  0.000
    70 H  -0.03383  0.03876   0.966  0.000  0.000
    71 H  -0.04088  0.02408   0.959  0.000  0.000
    72 H  -0.04467  0.02179   0.955  0.000  0.000
    73 H  -0.02547  0.02903   0.975  0.000  0.000
    74 H  -0.03256  0.01986   0.967  0.000  0.000
    75 H  -0.02108  0.03529   0.979  0.000  0.000
    76 H  -0.03048  0.03443   0.970  0.000  0.000
    77 H  -0.03053  0.03585   0.969  0.000  0.000
    78 H  -0.02170  0.03448   0.978  0.000  0.000
    79 H  -0.02629  0.02611   0.974  0.000  0.000
    80 H  -0.02048  0.03398   0.980  0.000  0.000
    81 H  -0.03934  0.02750   0.961  0.000  0.000
    82 H  -0.04071  0.03752   0.959  0.000  0.000
    83 H  -0.02383  0.03157   0.976  0.000  0.000
    84 H  -0.02069  0.03184   0.979  0.000  0.000
    85 H  -0.01865  0.03767   0.981  0.000  0.000
    86 H  -0.01454  0.06330   0.985  0.000  0.000
    87 H   0.00056  0.06742   1.001  0.000  0.000
    88 H   0.05520  0.11174   1.055  0.000  0.000
    89 H  -0.29862 -0.24613   0.701  0.000  0.000
    90 H  -0.27532 -0.22022   0.725  0.000  0.000
    91 H  -0.33163 -0.26323   0.668  0.000  0.000
    92 H  -0.31665 -0.25723   0.683  0.000  0.000
    93 H  -0.29060 -0.23276   0.709  0.000  0.000
    94 H  -0.27349 -0.20939   0.727  0.000  0.000
    95 H  -0.28089 -0.21187   0.719  0.000  0.000
    96 H  -0.30894 -0.24939   0.691  0.000  0.000
    97 H  -0.28054 -0.22270   0.719  0.000  0.000
    98 H  -0.30276 -0.23869   0.697  0.000  0.000
(R)spin-density population

 Mulliken population n(s)   n(p)   n(d)
     1 C   0.0055   0.000  0.005  0.000
     2 C   0.0078   0.000  0.008  0.000
     3 C   0.0129   0.001  0.012  0.000
     4 C   0.0060   0.000  0.006  0.000
     5 C   0.0032  -0.000  0.003  0.000
     6 C   0.0036   0.000  0.003  0.000
     7 S   0.0127   0.000  0.010  0.002
     8 C   0.0019   0.000  0.002  0.000
     9 C   0.0127  -0.000  0.013  0.000
    10 C   0.0206   0.000  0.020  0.000
    11 C   0.0003  -0.000  0.000  0.000
    12 N   0.0056   0.000  0.006  0.000
    13 S   0.0153  -0.000  0.013  0.002
    14 C   0.0046  -0.000  0.005  0.000
    15 C   0.0402   0.000  0.040  0.000
    16 S   0.0029   0.000  0.002  0.001
    17 C   0.0023   0.000  0.002  0.000
    18 C   0.0305   0.000  0.030  0.000
    19 C   0.0279   0.000  0.028  0.000
    20 C   0.0007   0.000  0.001  0.000
    21 N   0.0129   0.000  0.013  0.000
    22 S   0.0227   0.000  0.019  0.003
    23 C   0.0115   0.000  0.011  0.000
    24 C   0.0654   0.000  0.065  0.000
    25 O   0.0005  -0.000  0.001  0.000
    26 O   0.0044   0.000  0.004  0.000
    27 C   0.0002   0.000  0.000  0.000
    28 C   0.0004   0.000  0.000  0.000
    29 C   0.0001   0.000  0.000  0.000
    30 C   0.0000  -0.000  0.000  0.000
    31 C   0.0000   0.000  0.000  0.000
    32 C   0.0006  -0.000  0.001  0.000
    33 C   0.0001   0.000  0.000  0.000
    34 C   0.0003  -0.000  0.000  0.000
    35 C   0.0575  -0.000  0.057  0.000
    36 C   0.0096  -0.000  0.010  0.000
    37 C   0.0012   0.000  0.001  0.000
    38 C   0.0168  -0.000  0.017  0.000
    39 C   0.0012  -0.000  0.001  0.000
    40 C   0.0767  -0.000  0.077  0.000
    41 C   0.0001   0.000  0.000  0.000
    42 C   0.0175  -0.000  0.017  0.000
    43 C   0.0003   0.000  0.000  0.000
    44 C   0.0177   0.000  0.018  0.000
    45 C   0.0873   0.000  0.087  0.000
    46 C   0.0218  -0.000  0.022  0.000
    47 C   0.0022   0.000  0.002  0.000
    48 C   0.0147   0.000  0.015  0.000
    49 C   0.0002   0.000  0.000  0.000
    50 C   0.0723  -0.000  0.072  0.000
    51 C   0.0011   0.000  0.001  0.000
    52 C   0.0162   0.000  0.016  0.000
    53 C   0.0005   0.000  0.000  0.000
    54 C   0.0172  -0.000  0.017  0.000
    55 O   0.0023   0.000  0.002  0.000
    56 F   0.0019  -0.000  0.002  0.000
    57 C   0.0439  -0.000  0.044  0.000
    58 C   0.0092   0.000  0.009  0.000
    59 C   0.0084   0.000  0.008  0.000
    60 N   0.0250   0.000  0.025  0.000
    61 N   0.0249   0.000  0.025  0.000
    62 O   0.0008  -0.000  0.001  0.000
    63 F   0.0020   0.000  0.002  0.000
    64 C   0.0415  -0.000  0.041  0.000
    65 C   0.0091   0.000  0.009  0.000
    66 C   0.0098  -0.000  0.010  0.000
    67 N   0.0255  -0.000  0.025  0.000
    68 N   0.0241   0.000  0.024  0.000
    69 H   0.0000   0.000  0.000  0.000
    70 H   0.0000   0.000  0.000  0.000
    71 H   0.0001   0.000  0.000  0.000
    72 H   0.0003   0.000  0.000  0.000
    73 H   0.0002   0.000  0.000  0.000
    74 H   0.0004   0.000  0.000  0.000
    75 H   0.0003   0.000  0.000  0.000
    76 H   0.0001   0.000  0.000  0.000
    77 H   0.0001   0.000  0.000  0.000
    78 H   0.0000   0.000  0.000  0.000
    79 H   0.0001   0.000  0.000  0.000
    80 H   0.0000   0.000  0.000  0.000
    81 H   0.0004   0.000  0.000  0.000
    82 H   0.0001   0.000  0.000  0.000
    83 H   0.0001   0.000  0.000  0.000
    84 H   0.0001   0.000  0.000  0.000
    85 H   0.0001   0.000  0.000  0.000
    86 H   0.0001   0.000  0.000  0.000
    87 H   0.0001   0.000  0.000  0.000
    88 H   0.0000   0.000  0.000  0.000
    89 H   0.0001   0.000  0.000  0.000
    90 H   0.0000   0.000  0.000  0.000
    91 H   0.0000   0.000  0.000  0.000
    92 H   0.0000   0.000  0.000  0.000
    93 H   0.0000   0.000  0.000  0.000
    94 H   0.0000   0.000  0.000  0.000
    95 H   0.0000   0.000  0.000  0.000
    96 H   0.0000   0.000  0.000  0.000
    97 H   0.0000   0.000  0.000  0.000
    98 H   0.0000   0.000  0.000  0.000

Wiberg/Mayer (AO) data.
largest (>0.10) Wiberg bond orders for each atom
          total WBO             WBO to atom ...
     1  C   4.037        C    2 1.241    C    6 1.200    C   18 1.065    C    3 0.176
     2  C   4.019        C    3 1.406    C    1 1.241    O   26 1.021    S    7 0.112
     3  C   4.007        C    2 1.406    C    4 1.181    S    7 0.927    C    1 0.176
     4  C   3.641        C    3 1.181    C    5 1.152    C    9 1.074
     5  C   3.780        C    6 1.421    C    4 1.152    O   25 1.087
     6  C   3.772        C    5 1.421    C    1 1.200    S   16 1.068
     7  S   2.452        C    8 1.129    C    3 0.927    C    2 0.112
     8  C   3.853        C    9 1.334    C   10 1.325    S    7 1.129
     9  C   3.733        C    8 1.334    N   12 1.199    C    4 1.074
    10  C   3.872        C    8 1.325    C   11 1.273    S   13 1.192
    11  C   3.874        C   15 1.375    C   10 1.273    N   12 1.160
    12  N   3.195        C    9 1.199    C   11 1.160    C   33 0.954
    13  S   2.615        C   10 1.192    C   14 1.127    O   62 0.128
    14  C   3.928        C   15 1.388    C   35 1.344    S   13 1.127
    15  C   3.783        C   14 1.388    C   11 1.375    H   69 1.000
    16  S   2.417        C   17 1.141    C    6 1.068
    17  C   3.870        C   19 1.341    C   18 1.290    S   16 1.141
    18  C   3.588        C   17 1.290    N   21 1.148    C    1 1.065
    19  C   3.849        C   17 1.341    C   20 1.286    S   22 1.194
    20  C   3.853        C   24 1.349    C   19 1.286    N   21 1.155
    21  N   3.119        C   20 1.155    C   18 1.148    C   31 0.962
    22  S   2.433        C   19 1.194    C   23 1.103
    23  C   3.919        C   24 1.425    C   45 1.331    S   22 1.103
    24  C   3.702        C   23 1.425    C   20 1.349    H   70 0.990
    25  O   2.124        C    5 1.087    C   29 0.964
    26  O   2.110        C    2 1.021    C   27 0.947
    27  C   3.914        H   71 0.993    C   28 0.989    H   72 0.976    O   26 0.947
    28  C   3.893        H   73 0.994    C   27 0.989    H   75 0.988    H   74 0.983
    29  C   3.907        C   30 0.998    H   76 0.994    H   77 0.986    O   25 0.964
    30  C   3.908        H   78 0.998    C   29 0.998    H   80 0.998    H   79 0.984
    31  C   3.900        H   82 0.995    C   32 0.995    H   81 0.990    N   21 0.962
    32  C   3.886        H   85 1.006    H   83 0.999    C   31 0.995    H   84 0.993
    33  C   3.913        H   87 0.997    H   86 0.995    C   34 0.976    N   12 0.954
    34  C   3.619        H   88 1.027    C   33 0.976    H   90 0.874    H   89 0.846
    35  C   3.582        C   36 1.464    C   14 1.344    H   91 0.774
    36  C   3.826        C   35 1.464    C   40 1.191    C   37 1.107
    37  C   3.996        O   62 1.763    C   36 1.107    C   38 1.054
    38  C   3.902        C   41 1.460    C   39 1.311    C   37 1.054
    39  C   3.852        C   44 1.431    C   38 1.311    C   40 1.110
    40  C   3.803        C   64 1.408    C   36 1.191    C   39 1.110
    41  C   3.753        C   38 1.460    C   42 1.414    H   92 0.851
    42  C   3.959        C   43 1.443    C   41 1.414    F   63 0.983
    43  C   3.801        C   42 1.443    C   44 1.437    H   93 0.880
    44  C   3.739        C   43 1.437    C   39 1.431    H   94 0.879
    45  C   3.610        C   46 1.473    C   23 1.331    H   95 0.869
    46  C   3.804        C   45 1.473    C   50 1.190    C   47 1.097
    47  C   3.987        O   55 1.785    C   46 1.097    C   48 1.050
    48  C   3.900        C   51 1.460    C   49 1.316    C   47 1.050
    49  C   3.866        C   54 1.436    C   48 1.316    C   50 1.104
    50  C   3.824        C   57 1.422    C   46 1.190    C   49 1.104
    51  C   3.753        C   48 1.460    C   52 1.412    H   96 0.855
    52  C   3.954        C   53 1.444    C   51 1.412    F   56 0.982
    53  C   3.824        C   52 1.444    C   54 1.432    H   97 0.889
    54  C   3.711        C   49 1.436    C   53 1.432    H   98 0.838
    55  O   1.963        C   47 1.785
    56  F   0.941        C   52 0.982
    57  C   3.756        C   50 1.422    C   58 1.166    C   59 1.163
    58  C   4.102        N   60 2.856    C   57 1.166
    59  C   4.102        N   61 2.875    C   57 1.163
    60  N   2.893        C   58 2.856
    61  N   2.895        C   59 2.875
    62  O   2.059        C   37 1.763    S   13 0.128
    63  F   0.946        C   42 0.983
    64  C   3.752        C   40 1.408    C   65 1.168    C   66 1.167
    65  C   4.096        N   68 2.871    C   64 1.168
    66  C   4.100        N   67 2.838    C   64 1.167
    67  N   2.875        C   66 2.838
    68  N   2.892        C   65 2.871
    69  H   1.059        C   15 1.000
    70  H   1.040        C   24 0.990
    71  H   1.026        C   27 0.993
    72  H   1.024        C   27 0.976
    73  H   1.031        C   28 0.994
    74  H   1.040        C   28 0.983
    75  H   1.046        C   28 0.988
    76  H   1.043        C   29 0.994
    77  H   1.040        C   29 0.986
    78  H   1.034        C   30 0.998
    79  H   1.032        C   30 0.984
    80  H   1.042        C   30 0.998
    81  H   1.038        C   31 0.990
    82  H   1.028        C   31 0.995
    83  H   1.048        C   32 0.999
    84  H   1.041        C   32 0.993
    85  H   1.035        C   32 1.006
    86  H   1.048        C   33 0.995
    87  H   1.061        C   33 0.997
    88  H   1.059        C   34 1.027
    89  H   0.924        C   34 0.846
    90  H   0.947        C   34 0.874
    91  H   0.913        C   35 0.774
    92  H   0.934        C   41 0.851
    93  H   0.943        C   43 0.880
    94  H   0.964        C   44 0.879
    95  H   0.914        C   45 0.869
    96  H   0.940        C   51 0.855
    97  H   0.944        C   53 0.889
    98  H   0.946        C   54 0.838

 dipole moment from electron density (au)
     X       Y       Z   
   6.7060  -0.6120  -0.0893  total (Debye):   17.117


           -------------------------------------------------
          | TOTAL ENERGY             -205.066981397700 Eh   |
          | GRADIENT NORM               0.283691724813 Eh/α |
          | HOMO-LUMO GAP               0.129490117175 eV   |
           -------------------------------------------------

------------------------------------------------------------------------
 * finished run on 2021/12/02 at 16:47:52.517     
------------------------------------------------------------------------
 total:
 * wall-time:     0 d,  0 h,  0 min,  5.275 sec
 *  cpu-time:     0 d,  0 h,  0 min,  5.253 sec
 * ratio c/w:     0.996 speedup
 SCF:
 * wall-time:     0 d,  0 h,  0 min,  4.498 sec
 *  cpu-time:     0 d,  0 h,  0 min,  4.486 sec
 * ratio c/w:     0.998 speedup

