      -----------------------------------------------------------      
     |                   =====================                   |     
     |                           x T B                           |     
     |                   =====================                   |     
     |                         S. Grimme                         |     
     |          Mulliken Center for Theoretical Chemistry        |     
     |                    University of Bonn                     |     
     |                Version 6.2 RC2 (SAW190805)                |     
      -----------------------------------------------------------      

   This program is distributed in the hope that it will be useful,
   but WITHOUT ANY WARRANTY; without even the implied warranty of
   MERCHANTABILITY or FITNESS FOR A PARTICULAR PURPOSE.
   
   FOR NON-COMMERCIAL, ACADEMIA USE ONLY.
   
   Cite this work as:
   * S. Grimme, C. Bannwarth, P. Shushkov, J. Chem. Theory Comput., 2017,
     13, 1989-2009. DOI: 10.1021/acs.jctc.7b00118
   * C. Bannwarth, S. Ehlert and S. Grimme., J. Chem. Theory Comput., 2019,
     15, 1652-1671. DOI: 10.1021/acs.jctc.8b01176
   * P. Pracht, E. Caldeweyher, S. Ehlert, S. Grimme, ChemRxiv, 2019, preprint.
     DOI: 10.26434/chemrxiv.8326202.v1
   
   for DFT-D4:
   * E. Caldeweyher, C. Bannwarth and S. Grimme, J. Chem. Phys., 2017,
     147, 034112. DOI: 10.1063/1.4993215
   * E. Caldeweyher, S. Ehlert, A. Hansen, H. Neugebauer, S. Spicher,
     C. Bannwarth and S. Grimme, J. Chem. Phys., 2019, 150, 154122.
     DOI: 10.1063/1.5090222
   
   for sTDA-xTB:
   * S. Grimme and C. Bannwarth, J. Chem. Phys., 2016, 145, 054103.
     DOI: 10.1063/1.4959605
   
   in the mass-spec context:
   * V. Asgeirsson, C. Bauer and S. Grimme, Chem. Sci., 2017, 8, 4879.
     DOI: 10.1039/c7sc00601b
   
   for metadynamics refer to:
   * S. Grimme, J. Chem. Theory Comput., 2019, 155, 2847-2862
     DOI: 10.1021/acs.jctc.9b00143
   
   with help from (in alphabetical order)
   C. Bannwarth, F. Bohle, G. Brandenburg, E. Caldeweyher, M. Checinski,
   S. Dohm, S. Ehlert, S. Ehrlich, F. März, H. Neugebauer, J. Pisarek,
   P. Pracht, P. Shushkov, and S. Spicher.
   
 * started run on 2021/12/02 at 16:47:56.090     

           -------------------------------------------------
          |                Calculation Setup                |
           -------------------------------------------------

          program call               : /ihome/ghutchison/geoffh/xtb/xtb TB-4Cl.xyz --vipea
          hostname                   : smp-n128
          coordinate file            : TB-4Cl.xyz
          omp threads                :                     1
          number of atoms            :                    94
          number of electrons        :                   330
          charge                     :                     0
          spin                       :                   0.0
          first test random number   :      0.49617496140994


########################################################################
# WARNING! Please study the warnings concerning your input carefully
#  - XTBPATH is not set, using XTBHOME instead
########################################################################

           ------------------------------------------------- 
          |                 I P E A - x T B                 |
          |  Ionisation Potentials and Electron Affinities  |
           ------------------------------------------------- 
             KAB for M(3d)-M(3d) :                1.1000
             KAB for M(4d)-M(4d) :                1.2000
             KAB for M(5d)-M(5d) :                1.2000
             k(s)                :                2.1500
             k(p)                :                2.3000
             k(d)                :                2.0000
             k(f)                :                0.0000
             kEN (H0ij)          :                0.7000
             D3 a1               :                0.6300
             D3 a2               :                5.0000
             D3 s6               :                1.0000
             D3 s8               :                2.4000
             D3 s9               :                0.0000
             alphaj              :                1.0000
             XBdamp              :                0.4400
             XBrad               :                1.3000
             kcnsh               :      1.0000   -0.3000   -0.5000    0.5000

  Z AO/shell   Hii/eV     exponent
  1     Thu Sep 22 23:34:11 CEST 2016   EN: 2.200 GAM: 0.405  GM3: 0.1500
     1s    -10.521941    1.306199
     2s     -3.560151    0.398421
  6     Thu Sep 22 23:34:11 CEST 2016   EN: 2.550 GAM: 0.640  GM3: 0.1500
     2s    -15.968100    1.979793
     2p     -9.777107    1.850537
     3S     -3.366990    0.633095
  7     Thu Sep 22 23:34:11 CEST 2016   EN: 3.040 GAM: 0.493  GM3:-0.1000
     2s    -24.040776    2.126160
     2p    -14.426520    2.068425
     3S     -5.882278    0.671040
  8     Thu Sep 22 23:34:11 CEST 2016   EN: 3.440 GAM: 0.717  GM3:-0.2000
     2s    -26.695120    2.575264
     2p    -16.014457    2.159448
     3S     -6.622058    0.958679
 16     Tue Jan 17 20:57:36 CET 2017    EN: 2.580 GAM: 0.455  GM3: 0.1020
     3s    -24.488821    2.492075
     3p    -12.136640    1.997904
     3d     -1.796070    1.747541
 17     Tue Jan 17 19:45:33 CET 2017    EN: 3.160 GAM: 0.559  GM3: 0.2396
     3s    -24.452163    2.559226
     3p    -13.465451    2.054846
     3d     -1.836065    1.762522

           ------------------------------------------------- 
          |        Self-Consistent Charge Iterations        |
           ------------------------------------------------- 

          ...................................................
          :                      SETUP                      :
          :.................................................:
          :  # basis functions                 432          :
          :  # atomic orbitals                 424          :
          :  # shells                          256          :
          :  # electrons                       330          :
          :  # halogen bonds                    17          :
          :  max. iterations                   250          :
          :  Hamiltonian                  GFN1-xTB          :
          :  restarted?                      false          :
          :  GBSA solvation                  false          :
          :  PC potential                    false          :
          :  electronic temp.          300.0000000     K    :
          :  accuracy                    1.0000000          :
          :  -> integral cutoff          0.2500000E+02      :
          :  -> integral neglect         0.1000000E-07      :
          :  -> SCF convergence          0.1000000E-05 Eh   :
          :  -> wf. convergence          0.2000000E-04 e    :
          :  Broyden damping             0.4000000          :
          ...................................................

 iter      E             dE          RMSdq      gap      omega  full diag
   1   -214.0238159 -0.214024E+03  0.992E+00    0.28       0.0  T
   2   -213.6390417  0.384774E+00  0.622E+00    0.22       1.0  T
   3   -209.8974990  0.374154E+01  0.573E+00    0.34       1.0  T
   4   -211.8539978 -0.195650E+01  0.274E+00    0.54       1.0  T
   5   -213.0667934 -0.121280E+01  0.191E+00    0.03       1.0  T
   6   -215.1557080 -0.208891E+01  0.914E-01    1.11       1.0  T
   7   -215.2138131 -0.581050E-01  0.687E-01    0.98       1.0  T
   8   -215.2287675 -0.149544E-01  0.531E-01    0.92       1.0  T
   9   -215.2468804 -0.181128E-01  0.255E-01    0.87       1.0  T
  10   -215.2532920 -0.641164E-02  0.100E-01    0.51       1.0  T
  11   -215.2547593 -0.146732E-02  0.513E-02    0.53       1.0  T
  12   -215.2553880 -0.628692E-03  0.432E-02    0.56       1.0  T
  13   -215.2555607 -0.172644E-03  0.299E-02    0.61       1.0  T
  14   -215.2557180 -0.157349E-03  0.252E-02    0.63       1.0  T
  15   -215.2558387 -0.120714E-03  0.159E-02    0.66       1.0  T
  16   -215.2558940 -0.552744E-04  0.897E-03    0.68       1.1  T
  17   -215.2559098 -0.157774E-04  0.366E-03    0.69       2.8  T
  18   -215.2559123 -0.248750E-05  0.976E-04    0.69      10.6  T
  19   -215.2559123 -0.850375E-07  0.523E-04    0.69      19.7  T
  20   -215.2559124 -0.456076E-07  0.265E-04    0.69      38.9  T
  21   -215.2559124 -0.136752E-07  0.128E-04    0.69      80.7  T
  22   -215.2559124 -0.405970E-08  0.377E-05    0.69     273.4  T

   *** convergence criteria satisfied after 22 iterations ***

         #    Occupation            Energy/Eh            Energy/eV
      -------------------------------------------------------------
         1        2.0000           -3.9678032            -107.9694
       ...           ...                  ...                  ...
       159        2.0000           -0.4117258             -11.2036
       160        2.0000           -0.3982605             -10.8372
       161        2.0000           -0.3901662             -10.6170
       162        2.0000           -0.3732390             -10.1564
       163        2.0000           -0.3711428             -10.0993
       164        2.0000           -0.3519914              -9.5782
       165        2.0000           -0.3517414              -9.5714 (HOMO)
       166        0.0000           -0.3263099              -8.8793 (LUMO)
       167                         -0.3208718              -8.7314
       168                         -0.3197293              -8.7003
       169                         -0.3089277              -8.4064
       170                         -0.2972400              -8.0883
       ...                                ...                  ...
       424                        612.9489379           16679.1896
      -------------------------------------------------------------
                  HL-Gap            0.0254314 Eh            0.6920 eV
             Fermi-level           -0.3387568 Eh           -9.2180 eV

 SCC (total)                   0 d,  0 h,  0 min,  1.661 sec
 SCC setup                      ...        0 min,  0.004 sec (  0.221%)
 Dispersion                     ...        0 min,  0.000 sec (  0.017%)
 integral evaluation            ...        0 min,  0.784 sec ( 47.183%)
 zeroth order Hamiltonian       ...        0 min,  0.003 sec (  0.192%)
 iterations                     ...        0 min,  0.629 sec ( 37.864%)
 molecular gradient             ...        0 min,  0.237 sec ( 14.289%)
 printout                       ...        0 min,  0.004 sec (  0.231%)

         :::::::::::::::::::::::::::::::::::::::::::::::::::::
         ::                     SUMMARY                     ::
         :::::::::::::::::::::::::::::::::::::::::::::::::::::
         :: total energy            -211.783444931278 Eh    ::
         :: gradient norm              1.647599857758 Eh/a0 ::
         :: HOMO-LUMO gap              0.692024099204 eV    ::
         ::.................................................::
         :: SCC energy              -215.255912402715 Eh    ::
         :: -> electrostatic           0.261932120391 Eh    ::
         :: repulsion energy           3.563974828523 Eh    ::
         :: dispersion energy         -0.091507357086 Eh    ::
         :: halogen bond corr.         0.000000000000 Eh    ::
         :: add. restraining           0.000000000000 Eh    ::
         :::::::::::::::::::::::::::::::::::::::::::::::::::::

           ------------------------------------------------- 
          |        vertical delta SCC IP calculation        |
           ------------------------------------------------- 

          ...................................................
          :                      SETUP                      :
          :.................................................:
          :  # basis functions                 432          :
          :  # atomic orbitals                 424          :
          :  # shells                          256          :
          :  # electrons                       329          :
          :  # halogen bonds                    17          :
          :  max. iterations                   250          :
          :  Hamiltonian                  GFN1-xTB          :
          :  restarted?                       true          :
          :  GBSA solvation                  false          :
          :  PC potential                    false          :
          :  electronic temp.          300.0000000     K    :
          :  accuracy                    1.0000000          :
          :  -> integral cutoff          0.2500000E+02      :
          :  -> integral neglect         0.1000000E-07      :
          :  -> SCF convergence          0.1000000E-05 Eh   :
          :  -> wf. convergence          0.2000000E-04 e    :
          :  Broyden damping             0.4000000          :
          ...................................................

 iter      E             dE          RMSdq      gap      omega  full diag
   1   -214.8251099 -0.214825E+03  0.403E-01    0.69       0.0  T
   2   -214.8202728  0.483706E-02  0.421E-01    1.07       1.0  T
   3   -214.8577416 -0.374688E-01  0.124E-01    0.95       1.0  T
   4   -214.8111221  0.466195E-01  0.372E-01    0.87       1.0  T
   5   -214.8539275 -0.428054E-01  0.139E-01    0.93       1.0  T
   6   -214.8553986 -0.147116E-02  0.121E-01    0.92       1.0  T
   7   -214.8589050 -0.350637E-02  0.739E-02    0.93       1.0  T
   8   -214.8605935 -0.168852E-02  0.190E-02    0.93       1.0  T
   9   -214.8606337 -0.402012E-04  0.160E-02    0.93       1.0  T
  10   -214.8607213 -0.875599E-04  0.345E-03    0.93       3.0  T
  11   -214.8607228 -0.149952E-05  0.193E-03    0.93       5.4  T
  12   -214.8607239 -0.110566E-05  0.101E-03    0.93      10.2  T
  13   -214.8607242 -0.297314E-06  0.254E-04    0.93      40.6  T
  14   -214.8607241  0.723723E-07  0.496E-04    0.93      20.8  T
  15   -214.8607242 -0.904609E-07  0.583E-05    0.93     176.9  T
  16   -214.8607242 -0.652250E-09  0.166E-05    0.93     622.5  T

   *** convergence criteria satisfied after 16 iterations ***

         #    Occupation            Energy/Eh            Energy/eV
      -------------------------------------------------------------
         1        2.0000           -4.0537334            -110.3077
       ...           ...                  ...                  ...
       159        2.0000           -0.4780040             -13.0071
       160        2.0000           -0.4669296             -12.7058
       161        2.0000           -0.4640459             -12.6273
       162        2.0000           -0.4592994             -12.4982
       163        2.0000           -0.4490208             -12.2185
       164        1.7769           -0.4401704             -11.9776
       165        1.2231           -0.4377996             -11.9131 (HOMO)
       166                         -0.4036687             -10.9844 (LUMO)
       167                         -0.4008925             -10.9088
       168                         -0.3844879             -10.4624
       169                         -0.3733260             -10.1587
       170                         -0.3616240              -9.8403
       ...                                ...                  ...
       424                        612.8817362           16677.3609
      -------------------------------------------------------------
                  HL-Gap            0.0341309 Eh            0.9287 eV
             Fermi-level           -0.4298532 Eh          -11.6969 eV

 SCC (total)                   0 d,  0 h,  0 min,  1.478 sec
 SCC setup                      ...        0 min,  0.004 sec (  0.261%)
 Dispersion                     ...        0 min,  0.000 sec (  0.011%)
 integral evaluation            ...        0 min,  0.789 sec ( 53.358%)
 zeroth order Hamiltonian       ...        0 min,  0.003 sec (  0.210%)
 iterations                     ...        0 min,  0.442 sec ( 29.877%)
 molecular gradient             ...        0 min,  0.236 sec ( 15.999%)
 printout                       ...        0 min,  0.004 sec (  0.280%)

         :::::::::::::::::::::::::::::::::::::::::::::::::::::
         ::                     SUMMARY                     ::
         :::::::::::::::::::::::::::::::::::::::::::::::::::::
         :: total energy            -211.388256728727 Eh    ::
         :: gradient norm              1.593432860513 Eh/a0 ::
         :: HOMO-LUMO gap              0.928749610872 eV    ::
         ::.................................................::
         :: SCC energy              -214.860724200164 Eh    ::
         :: -> electrostatic           0.308296716416 Eh    ::
         :: repulsion energy           3.563974828523 Eh    ::
         :: dispersion energy         -0.091507357086 Eh    ::
         :: halogen bond corr.         0.000000000000 Eh    ::
         :: add. restraining           0.000000000000 Eh    ::
         :::::::::::::::::::::::::::::::::::::::::::::::::::::

------------------------------------------------------------------------
empirical IP shift (eV):    4.8455
delta SCC IP (eV):    5.9081
------------------------------------------------------------------------
           ------------------------------------------------- 
          |        vertical delta SCC EA calculation        |
           ------------------------------------------------- 

          ...................................................
          :                      SETUP                      :
          :.................................................:
          :  # basis functions                 432          :
          :  # atomic orbitals                 424          :
          :  # shells                          256          :
          :  # electrons                       331          :
          :  # halogen bonds                    17          :
          :  max. iterations                   250          :
          :  Hamiltonian                  GFN1-xTB          :
          :  restarted?                       true          :
          :  GBSA solvation                  false          :
          :  PC potential                    false          :
          :  electronic temp.          300.0000000     K    :
          :  accuracy                    1.0000000          :
          :  -> integral cutoff          0.2500000E+02      :
          :  -> integral neglect         0.1000000E-07      :
          :  -> SCF convergence          0.1000000E-05 Eh   :
          :  -> wf. convergence          0.2000000E-04 e    :
          :  Broyden damping             0.4000000          :
          ...................................................

 iter      E             dE          RMSdq      gap      omega  full diag
   1   -215.3964239 -0.215396E+03  0.622E-01    0.08       0.0  T
   2   -214.2436675  0.115276E+01  0.140E+00    0.35       1.0  T
   3   -215.4325314 -0.118886E+01  0.587E-01    0.66       1.0  T
   4   -215.5292238 -0.966924E-01  0.300E-01    0.23       1.0  T
   5   -215.5376770 -0.845319E-02  0.215E-01    0.15       1.0  T
   6   -215.5254565  0.122205E-01  0.187E-01    0.16       1.0  T
   7   -215.5340976 -0.864105E-02  0.175E-01    0.20       1.0  T
   8   -215.5445757 -0.104781E-01  0.695E-02    0.14       1.0  T
   9   -215.5432484  0.132730E-02  0.839E-02    0.14       1.0  T
  10   -215.5457246 -0.247624E-02  0.355E-02    0.14       1.0  T
  11   -215.5459780 -0.253424E-03  0.144E-02    0.13       1.0  T
  12   -215.5461035 -0.125467E-03  0.104E-02    0.13       1.0  T
  13   -215.5461129 -0.940647E-05  0.653E-03    0.13       1.6  T
  14   -215.5461223 -0.942953E-05  0.292E-03    0.14       3.5  T
  15   -215.5461269 -0.453059E-05  0.592E-04    0.13      17.4  T
  16   -215.5461268  0.116632E-06  0.625E-04    0.13      16.5  T
  17   -215.5461269 -0.165398E-06  0.255E-04    0.13      40.4  T
  18   -215.5461269 -0.231539E-07  0.733E-05    0.13     140.7  T
  19   -215.5461269 -0.105362E-08  0.246E-05    0.13     419.4  T

   *** convergence criteria satisfied after 19 iterations ***

         #    Occupation            Energy/Eh            Energy/eV
      -------------------------------------------------------------
         1        2.0000           -3.8927384            -105.9268
       ...           ...                  ...                  ...
       160        2.0000           -0.3298731              -8.9763
       161        2.0000           -0.3190500              -8.6818
       162        2.0000           -0.3078636              -8.3774
       163        2.0000           -0.3007764              -8.1845
       164        2.0000           -0.2870482              -7.8110
       165        2.0000           -0.2797905              -7.6135
       166        0.9135           -0.2539646              -6.9107 (HOMO)
       167        0.0545           -0.2490141              -6.7760 (LUMO)
       168        0.0319           -0.2484836              -6.7616
       169        0.0000           -0.2393979              -6.5143
       170                         -0.2286202              -6.2211
       171                         -0.1972166              -5.3665
       ...                                ...                  ...
       424                        613.0125555           16680.9207
      -------------------------------------------------------------
                  HL-Gap            0.0049506 Eh            0.1347 eV
             Fermi-level           -0.2593030 Eh           -7.0560 eV

 SCC (total)                   0 d,  0 h,  0 min,  1.558 sec
 SCC setup                      ...        0 min,  0.004 sec (  0.233%)
 Dispersion                     ...        0 min,  0.000 sec (  0.017%)
 integral evaluation            ...        0 min,  0.788 sec ( 50.565%)
 zeroth order Hamiltonian       ...        0 min,  0.003 sec (  0.201%)
 iterations                     ...        0 min,  0.521 sec ( 33.460%)
 molecular gradient             ...        0 min,  0.237 sec ( 15.228%)
 printout                       ...        0 min,  0.005 sec (  0.293%)

         :::::::::::::::::::::::::::::::::::::::::::::::::::::
         ::                     SUMMARY                     ::
         :::::::::::::::::::::::::::::::::::::::::::::::::::::
         :: total energy            -212.073659469518 Eh    ::
         :: gradient norm              1.651060910968 Eh/a0 ::
         :: HOMO-LUMO gap              0.134711350144 eV    ::
         ::.................................................::
         :: SCC energy              -215.546126940955 Eh    ::
         :: -> electrostatic           0.290862073528 Eh    ::
         :: repulsion energy           3.563974828523 Eh    ::
         :: dispersion energy         -0.091507357086 Eh    ::
         :: halogen bond corr.         0.000000000000 Eh    ::
         :: add. restraining           0.000000000000 Eh    ::
         :::::::::::::::::::::::::::::::::::::::::::::::::::::

------------------------------------------------------------------------
empirical EA shift (eV):    4.8455
delta SCC EA (eV):    3.0516
------------------------------------------------------------------------
           -------------------------------------------------
          |                Property Printout                |
           -------------------------------------------------

    * Orbital Energies and Occupations

         #    Occupation            Energy/Eh            Energy/eV
      -------------------------------------------------------------
         1        2.0000           -3.8927384            -105.9268
       ...           ...                  ...                  ...
       154        2.0000           -0.3648666              -9.9285
       155        2.0000           -0.3630926              -9.8803
       156        2.0000           -0.3575177              -9.7286
       157        2.0000           -0.3457527              -9.4084
       158        2.0000           -0.3437300              -9.3534
       159        2.0000           -0.3428898              -9.3305
       160        2.0000           -0.3298731              -8.9763
       161        2.0000           -0.3190500              -8.6818
       162        2.0000           -0.3078636              -8.3774
       163        2.0000           -0.3007764              -8.1845
       164        2.0000           -0.2870482              -7.8110
       165        2.0000           -0.2797905              -7.6135
       166        0.9135           -0.2539646              -6.9107 (HOMO)
       167        0.0545           -0.2490141              -6.7760 (LUMO)
       168        0.0319           -0.2484836              -6.7616
       169        0.0000           -0.2393979              -6.5143
       170                         -0.2286202              -6.2211
       171                         -0.1972166              -5.3665
       172                         -0.1849010              -5.0314
       173                         -0.1782414              -4.8502
       174                         -0.1737107              -4.7269
       175                         -0.1680553              -4.5730
       176                         -0.1633118              -4.4439
       177                         -0.1584876              -4.3127
       ...                                ...                  ...
       424                        613.0125555           16680.9207
      -------------------------------------------------------------
                  HL-Gap            0.0049506 Eh            0.1347 eV
             Fermi-level           -0.2593030 Eh           -7.0560 eV

  Mulliken/CM5 charges        n(s)   n(p)   n(d)
     1 C  -0.28190 -0.24652   1.529  2.189  0.000
     2 O  -0.31639 -0.36256   2.608  3.076  0.000
     3 C   0.10189  0.10010   1.112  2.990  0.000
     4 C   0.05193  0.00308   1.084  2.968  0.000
     5 C  -0.04990 -0.05372   1.161  2.789  0.000
     6 Cl  0.15458  0.15370   1.855  5.279  0.021
     7 C  -0.04637 -0.05036   1.155  2.799  0.000
     8 Cl  0.15189  0.15088   1.853  5.280  0.019
     9 C   0.01982 -0.02909   1.081  2.939  0.000
    10 C   0.02135  0.01809   1.071  2.950  0.000
    11 C   0.00151  0.00083   1.100  2.901  0.000
    12 C   0.00759  0.01373   1.033  2.974  0.000
    13 C  -0.10714  0.01002   1.204  2.689  0.000
    14 N   0.29007  0.15683   1.501  3.789  0.000
    15 C  -0.10220  0.01684   1.206  2.692  0.000
    16 N   0.29998  0.16979   1.526  3.774  0.000
    17 C   0.12755  0.12565   1.065  3.062  0.000
    18 C   0.04656 -0.00158   1.044  3.002  0.000
    19 C  -0.00428  0.00335   1.121  2.874  0.000
    20 S   0.12121  0.08941   1.879  4.075  0.167
    21 C   0.00441  0.02205   1.109  2.896  0.000
    22 C  -0.00543  0.00774   1.139  2.856  0.000
    23 C   0.00871  0.00073   1.067  2.942  0.000
    24 C   0.02596 -0.08008   1.072  2.954  0.000
    25 C   0.05711 -0.09436   1.073  2.984  0.000
    26 S   0.06295  0.03030   1.876  4.118  0.069
    27 C  -0.00400  0.01805   1.140  2.856  0.000
    28 C  -0.04501  0.02403   1.065  2.890  0.000
    29 N   0.11826 -0.13731   1.251  3.868  0.000
    30 C  -0.03429 -0.08453   1.089  2.877  0.000
    31 C  -0.04957  0.01852   1.057  2.894  0.000
    32 C   0.01398  0.02699   1.076  2.938  0.000
    33 C  -0.06835  0.01972   1.149  2.783  0.000
    34 N   0.24903  0.08739   1.474  3.775  0.000
    35 S  -0.15780 -0.02282   1.863  3.675  0.304
    36 N   0.24316  0.08100   1.470  3.773  0.000
    37 C  -0.07038  0.01782   1.149  2.780  0.000
    38 C   0.01892  0.03219   1.071  2.948  0.000
    39 C  -0.05378  0.01534   1.068  2.878  0.000
    40 N   0.11559 -0.14110   1.249  3.867  0.000
    41 C  -0.03521 -0.08429   1.090  2.875  0.000
    42 C   0.05393 -0.09520   1.057  2.997  0.000
    43 C  -0.04071  0.02540   1.061  2.898  0.000
    44 C  -0.00437  0.01868   1.152  2.844  0.000
    45 S   0.06423  0.03526   1.886  4.051  0.127
    46 C   0.00824  0.01588   1.148  2.860  0.000
    47 C   0.01384  0.00787   1.086  2.928  0.000
    48 C   0.04294  0.04085   1.062  2.981  0.000
    49 C  -0.00200 -0.00279   1.095  2.903  0.000
    50 C   0.01241  0.01845   1.031  2.981  0.000
    51 C  -0.10446  0.01452   1.205  2.691  0.000
    52 N   0.29540  0.16527   1.525  3.771  0.000
    53 C  -0.09523  0.02143   1.216  2.689  0.000
    54 N   0.30581  0.17141   1.506  3.800  0.000
    55 C  -0.00565 -0.00890   1.075  2.919  0.000
    56 C   0.01507 -0.03384   1.075  2.940  0.000
    57 C  -0.06053 -0.06452   1.165  2.774  0.000
    58 Cl  0.13043  0.12942   1.853  5.262  0.016
    59 C  -0.05584 -0.05965   1.158  2.787  0.000
    60 Cl  0.13754  0.13667   1.854  5.264  0.019
    61 C   0.01054 -0.03829   1.084  2.927  0.000
    62 C   0.00630  0.00450   1.093  2.914  0.000
    63 C  -0.14489 -0.10922   1.168  2.687  0.000
    64 O   0.31207  0.26614   1.652  4.661  0.000
    65 C   0.05674 -0.09018   1.065  2.992  0.000
    66 C   0.06284 -0.04500   1.082  2.981  0.000
    67 C   0.58796  0.43606   0.909  3.679  0.000
    68 C   0.11457  0.06597   1.068  3.047  0.000
    69 H  -0.01318  0.04649   0.987  0.000  0.000
    70 H  -0.03527  0.03003   0.965  0.000  0.000
    71 H  -0.02448  0.04611   0.976  0.000  0.000
    72 H  -0.02364  0.03400   0.976  0.000  0.000
    73 H  -0.01987  0.03793   0.980  0.000  0.000
    74 H  -0.01601  0.03683   0.984  0.000  0.000
    75 H  -0.01616  0.03599   0.984  0.000  0.000
    76 H  -0.01057  0.04311   0.989  0.000  0.000
    77 H  -0.03523  0.03393   0.965  0.000  0.000
    78 H  -0.03373  0.03698   0.966  0.000  0.000
    79 H  -0.02055  0.04709   0.979  0.000  0.000
    80 H  -0.02632  0.04291   0.974  0.000  0.000
    81 H  -0.02021  0.03488   0.980  0.000  0.000
    82 H  -0.01992  0.03230   0.980  0.000  0.000
    83 H  -0.02109  0.03514   0.979  0.000  0.000
    84 H  -0.04002  0.02531   0.960  0.000  0.000
    85 H  -0.05181  0.00786   0.948  0.000  0.000
    86 H  -0.02063  0.03492   0.979  0.000  0.000
    87 H  -0.02139  0.03381   0.979  0.000  0.000
    88 H  -0.01888  0.03349   0.981  0.000  0.000
    89 H   0.02934  0.08847   1.029  0.000  0.000
    90 H  -0.01086  0.04841   0.989  0.000  0.000
    91 H  -0.25968 -0.20692   0.740  0.000  0.000
    92 H  -0.28669 -0.23446   0.713  0.000  0.000
    93 H  -0.29194 -0.23801   0.708  0.000  0.000
    94 H  -0.29035 -0.21864   0.710  0.000  0.000
(R)spin-density population

 Mulliken population n(s)   n(p)   n(d)
     1 C   0.0017  -0.000  0.002  0.000
     2 O   0.0214   0.019  0.003  0.000
     3 C   0.0173   0.002  0.015  0.000
     4 C   0.0019   0.002  0.000  0.000
     5 C   0.0184  -0.000  0.019  0.000
     6 Cl  0.0046   0.000  0.002  0.002
     7 C   0.0014  -0.000  0.002  0.000
     8 Cl  0.0005   0.000  0.000  0.000
     9 C   0.0139  -0.000  0.014  0.000
    10 C   0.0071  -0.000  0.007  0.000
    11 C   0.0592   0.000  0.059  0.000
    12 C   0.0655  -0.000  0.066  0.000
    13 C   0.0084   0.000  0.008  0.000
    14 N   0.0313  -0.000  0.031  0.000
    15 C   0.0072   0.000  0.007  0.000
    16 N   0.0299   0.000  0.030  0.000
    17 C   0.0243   0.000  0.024  0.000
    18 C   0.0343   0.000  0.034  0.000
    19 C   0.0086  -0.000  0.009  0.000
    20 S   0.0193   0.000  0.016  0.003
    21 C   0.0249  -0.000  0.025  0.000
    22 C   0.0039  -0.000  0.004  0.000
    23 C   0.0267  -0.000  0.027  0.000
    24 C   0.0002  -0.000  0.000  0.000
    25 C   0.0017   0.000  0.001  0.000
    26 S   0.0050   0.000  0.004  0.001
    27 C   0.0051   0.000  0.005  0.000
    28 C   0.0050  -0.000  0.005  0.000
    29 N   0.0142  -0.000  0.014  0.000
    30 C   0.0005   0.000  0.000  0.000
    31 C   0.0187  -0.000  0.019  0.000
    32 C   0.0088   0.000  0.009  0.000
    33 C   0.0012   0.000  0.001  0.000
    34 N   0.0120  -0.000  0.012  0.000
    35 S   0.0192   0.000  0.015  0.005
    36 N   0.0108   0.000  0.011  0.000
    37 C   0.0007  -0.000  0.001  0.000
    38 C   0.0070   0.000  0.007  0.000
    39 C   0.0195  -0.000  0.019  0.000
    40 N   0.0133  -0.000  0.013  0.000
    41 C   0.0001   0.000  0.000  0.000
    42 C   0.0008   0.000  0.001  0.000
    43 C   0.0022  -0.000  0.002  0.000
    44 C   0.0080   0.000  0.008  0.000
    45 S   0.0078   0.000  0.007  0.001
    46 C   0.0031  -0.000  0.003  0.000
    47 C   0.0337  -0.000  0.034  0.000
    48 C   0.0060  -0.000  0.006  0.000
    49 C   0.0728  -0.000  0.073  0.000
    50 C   0.0554  -0.000  0.055  0.000
    51 C   0.0080  -0.000  0.008  0.000
    52 N   0.0275  -0.000  0.028  0.000
    53 C   0.0103   0.000  0.010  0.000
    54 N   0.0304   0.000  0.030  0.000
    55 C   0.0117  -0.000  0.012  0.000
    56 C   0.0182  -0.000  0.018  0.000
    57 C   0.0029   0.000  0.003  0.000
    58 Cl  0.0008   0.000  0.000  0.000
    59 C   0.0262   0.000  0.026  0.000
    60 Cl  0.0064   0.000  0.003  0.003
    61 C   0.0012   0.000  0.001  0.000
    62 C   0.0213   0.000  0.021  0.000
    63 C   0.0043   0.000  0.004  0.000
    64 O   0.0039   0.000  0.004  0.000
    65 C   0.0010   0.000  0.001  0.000
    66 C   0.0011   0.000  0.001  0.000
    67 C   0.0052   0.000  0.005  0.000
    68 C   0.0441  -0.000  0.044  0.000
    69 H   0.0033   0.003  0.000  0.000
    70 H  -0.0001  -0.000  0.000  0.000
    71 H   0.0002   0.000  0.000  0.000
    72 H   0.0002   0.000  0.000  0.000
    73 H   0.0005   0.000  0.000  0.000
    74 H   0.0001   0.000  0.000  0.000
    75 H   0.0001   0.000  0.000  0.000
    76 H   0.0000   0.000  0.000  0.000
    77 H   0.0006   0.001  0.000  0.000
    78 H   0.0013   0.001  0.000  0.000
    79 H   0.0003   0.000  0.000  0.000
    80 H   0.0002   0.000  0.000  0.000
    81 H   0.0001   0.000  0.000  0.000
    82 H   0.0003   0.000  0.000  0.000
    83 H   0.0001   0.000  0.000  0.000
    84 H   0.0000   0.000  0.000  0.000
    85 H   0.0000   0.000  0.000  0.000
    86 H   0.0004   0.000  0.000  0.000
    87 H   0.0001   0.000  0.000  0.000
    88 H   0.0009   0.001  0.000  0.000
    89 H   0.0002   0.000  0.000  0.000
    90 H   0.0004   0.000  0.000  0.000
    91 H   0.0001   0.000  0.000  0.000
    92 H   0.0013   0.001  0.000  0.000
    93 H   0.0001   0.000  0.000  0.000
    94 H   0.0000   0.000  0.000  0.000

Wiberg/Mayer (AO) data.
largest (>0.10) Wiberg bond orders for each atom
          total WBO             WBO to atom ...
     1  C   2.561        C    3 1.001    C   17 0.801    O    2 0.635
     2  O   1.219        C    1 0.635    S   20 0.218    C   17 0.134
     3  C   3.774        C    4 1.386    C   10 1.277    C    1 1.001
     4  C   3.904        C    5 1.416    C    3 1.386    H   69 0.977
     5  C   3.929        C    4 1.416    C    7 1.359    Cl   6 1.079
     6  Cl  1.181        C    5 1.079
     7  C   3.957        C    9 1.425    C    5 1.359    Cl   8 1.075
     8  Cl  1.181        C    7 1.075
     9  C   3.851        C    7 1.425    C   10 1.400    H   70 0.996
    10  C   3.860        C    9 1.400    C    3 1.277    C   11 1.124
    11  C   3.819        C   12 1.391    C   17 1.146    C   10 1.124
    12  C   3.704        C   11 1.391    C   13 1.169    C   15 1.162
    13  C   4.084        N   14 2.857    C   12 1.169
    14  N   2.839        C   13 2.857
    15  C   4.089        N   16 2.884    C   12 1.162
    16  N   2.892        C   15 2.884
    17  C   3.662        C   18 1.433    C   11 1.146    C    1 0.801    O    2 0.134
    18  C   3.716        C   17 1.433    C   19 1.333    H   71 0.958
    19  C   3.826        C   23 1.360    C   18 1.333    S   20 1.111
    20  S   2.684        C   21 1.136    C   19 1.111    O    2 0.218
    21  C   3.787        C   22 1.335    C   28 1.290    S   20 1.136
    22  C   3.876        C   23 1.376    C   21 1.335    S   26 1.149
    23  C   3.777        C   22 1.376    C   19 1.360    C   24 1.011
    24  C   3.894        C   23 1.011    H   73 0.995    H   72 0.990    C   25 0.976
    25  C   3.915        H   76 1.004    H   74 0.997    H   75 0.994    C   24 0.976
    26  S   2.453        C   27 1.187    C   22 1.149
    27  C   3.885        C   28 1.343    C   32 1.308    S   26 1.187
    28  C   3.855        C   27 1.343    C   21 1.290    N   29 1.153
    29  N   3.062        C   28 1.153    C   31 1.151    C   30 0.966
    30  C   3.878        H   77 1.000    H   78 0.995    C   65 0.993    N   29 0.966
    31  C   3.791        C   32 1.295    C   39 1.285    N   29 1.151
    32  C   3.866        C   27 1.308    C   31 1.295    C   33 1.208
    33  C   4.032        N   34 1.548    C   32 1.208    C   37 1.191    S   35 0.105
    34  N   2.989        C   33 1.548    S   35 1.388
    35  S   3.098        N   36 1.390    N   34 1.388    C   33 0.105    C   37 0.101
    36  N   2.990        C   37 1.543    S   35 1.390
    37  C   4.029        N   36 1.543    C   38 1.211    C   33 1.191    S   35 0.101
    38  C   3.868        C   44 1.308    C   39 1.291    C   37 1.211
    39  C   3.813        C   38 1.291    C   31 1.285    N   40 1.172
    40  N   3.083        C   39 1.172    C   43 1.139    C   41 0.980
    41  C   3.886        H   80 1.001    H   79 0.999    C   42 0.993    N   40 0.980
    42  C   3.860        H   83 1.007    H   81 1.000    H   82 0.994    C   41 0.993
    43  C   3.838        C   47 1.358    C   44 1.300    N   40 1.139
    44  C   3.921        C   38 1.308    C   43 1.300    S   45 1.236
    45  S   2.639        C   44 1.236    C   46 1.125    O   64 0.119
    46  C   3.890        C   68 1.377    C   47 1.352    S   45 1.125
    47  C   3.776        C   43 1.358    C   46 1.352    C   66 1.024
    48  C   3.828        C   68 1.448    C   49 1.193    C   63 1.115
    49  C   3.796        C   50 1.413    C   48 1.193    C   55 1.113
    50  C   3.740        C   49 1.413    C   53 1.168    C   51 1.160
    51  C   4.087        N   52 2.891    C   50 1.160
    52  N   2.901        C   51 2.891
    53  C   4.102        N   54 2.846    C   50 1.168
    54  N   2.815        C   53 2.846
    55  C   3.858        C   56 1.414    C   62 1.305    C   49 1.113
    56  C   3.835        C   55 1.414    C   57 1.413    H   84 0.993
    57  C   3.964        C   56 1.413    C   59 1.373    Cl  58 1.088
    58  Cl  1.195        C   57 1.088
    59  C   3.922        C   61 1.394    C   57 1.373    Cl  60 1.088
    60  Cl  1.189        C   59 1.088
    61  C   3.888        C   62 1.454    C   59 1.394    H   85 0.984
    62  C   3.876        C   61 1.454    C   55 1.305    C   63 1.045
    63  C   3.978        O   64 1.776    C   48 1.115    C   62 1.045
    64  O   2.055        C   63 1.776    S   45 0.119
    65  C   3.890        H   87 1.002    H   86 1.000    C   30 0.993    H   88 0.992
    66  C   3.862        C   47 1.024    H   89 1.007    H   90 0.978    C   67 0.925
    67  C   3.405        C   66 0.925    H   91 0.866    H   93 0.836    H   92 0.819
    68  C   3.637        C   48 1.448    C   46 1.377    H   94 0.844
    69  H   1.040        C    4 0.977
    70  H   1.061        C    9 0.996
    71  H   1.067        C   18 0.958
    72  H   1.038        C   24 0.990
    73  H   1.054        C   24 0.995
    74  H   1.033        C   25 0.997
    75  H   1.050        C   25 0.994
    76  H   1.052        C   25 1.004
    77  H   1.035        C   30 1.000
    78  H   1.029        C   30 0.995
    79  H   1.068        C   41 0.999
    80  H   1.057        C   41 1.001
    81  H   1.059        C   42 1.000
    82  H   1.040        C   42 0.994
    83  H   1.033        C   42 1.007
    84  H   1.057        C   56 0.993
    85  H   1.026        C   61 0.984
    86  H   1.039        C   65 1.000
    87  H   1.048        C   65 1.002
    88  H   1.039        C   65 0.992
    89  H   1.064        C   66 1.007
    90  H   0.988        C   66 0.978
    91  H   0.957        C   67 0.866
    92  H   0.926        C   67 0.819
    93  H   0.963        C   67 0.836
    94  H   0.915        C   68 0.844

 dipole moment from electron density (au)
     X       Y       Z   
   0.7244 -31.9479  32.4338  total (Debye):  115.730


           -------------------------------------------------
          | TOTAL ENERGY             -212.073659469518 Eh   |
          | GRADIENT NORM               1.651060910968 Eh/α |
          | HOMO-LUMO GAP               0.134711350144 eV   |
           -------------------------------------------------

------------------------------------------------------------------------
 * finished run on 2021/12/02 at 16:48:01.600     
------------------------------------------------------------------------
 total:
 * wall-time:     0 d,  0 h,  0 min,  5.510 sec
 *  cpu-time:     0 d,  0 h,  0 min,  5.474 sec
 * ratio c/w:     0.993 speedup
 SCF:
 * wall-time:     0 d,  0 h,  0 min,  4.700 sec
 *  cpu-time:     0 d,  0 h,  0 min,  4.673 sec
 * ratio c/w:     0.994 speedup

