      -----------------------------------------------------------      
     |                   =====================                   |     
     |                           x T B                           |     
     |                   =====================                   |     
     |                         S. Grimme                         |     
     |          Mulliken Center for Theoretical Chemistry        |     
     |                    University of Bonn                     |     
     |                Version 6.2 RC2 (SAW190805)                |     
      -----------------------------------------------------------      

   This program is distributed in the hope that it will be useful,
   but WITHOUT ANY WARRANTY; without even the implied warranty of
   MERCHANTABILITY or FITNESS FOR A PARTICULAR PURPOSE.
   
   FOR NON-COMMERCIAL, ACADEMIA USE ONLY.
   
   Cite this work as:
   * S. Grimme, C. Bannwarth, P. Shushkov, J. Chem. Theory Comput., 2017,
     13, 1989-2009. DOI: 10.1021/acs.jctc.7b00118
   * C. Bannwarth, S. Ehlert and S. Grimme., J. Chem. Theory Comput., 2019,
     15, 1652-1671. DOI: 10.1021/acs.jctc.8b01176
   * P. Pracht, E. Caldeweyher, S. Ehlert, S. Grimme, ChemRxiv, 2019, preprint.
     DOI: 10.26434/chemrxiv.8326202.v1
   
   for DFT-D4:
   * E. Caldeweyher, C. Bannwarth and S. Grimme, J. Chem. Phys., 2017,
     147, 034112. DOI: 10.1063/1.4993215
   * E. Caldeweyher, S. Ehlert, A. Hansen, H. Neugebauer, S. Spicher,
     C. Bannwarth and S. Grimme, J. Chem. Phys., 2019, 150, 154122.
     DOI: 10.1063/1.5090222
   
   for sTDA-xTB:
   * S. Grimme and C. Bannwarth, J. Chem. Phys., 2016, 145, 054103.
     DOI: 10.1063/1.4959605
   
   in the mass-spec context:
   * V. Asgeirsson, C. Bauer and S. Grimme, Chem. Sci., 2017, 8, 4879.
     DOI: 10.1039/c7sc00601b
   
   for metadynamics refer to:
   * S. Grimme, J. Chem. Theory Comput., 2019, 155, 2847-2862
     DOI: 10.1021/acs.jctc.9b00143
   
   with help from (in alphabetical order)
   C. Bannwarth, F. Bohle, G. Brandenburg, E. Caldeweyher, M. Checinski,
   S. Dohm, S. Ehlert, S. Ehrlich, F. März, H. Neugebauer, J. Pisarek,
   P. Pracht, P. Shushkov, and S. Spicher.
   
 * started run on 2021/12/02 at 16:48:01.613     

           -------------------------------------------------
          |                Calculation Setup                |
           -------------------------------------------------

          program call               : /ihome/ghutchison/geoffh/xtb/xtb TBTT-BORH.xyz --vipea
          hostname                   : smp-n128
          coordinate file            : TBTT-BORH.xyz
          omp threads                :                     1
          number of atoms            :                    57
          number of electrons        :                   196
          charge                     :                     0
          spin                       :                   0.0
          first test random number   :      0.16196378309602


########################################################################
# WARNING! Please study the warnings concerning your input carefully
#  - XTBPATH is not set, using XTBHOME instead
########################################################################

           ------------------------------------------------- 
          |                 I P E A - x T B                 |
          |  Ionisation Potentials and Electron Affinities  |
           ------------------------------------------------- 
             KAB for M(3d)-M(3d) :                1.1000
             KAB for M(4d)-M(4d) :                1.2000
             KAB for M(5d)-M(5d) :                1.2000
             k(s)                :                2.1500
             k(p)                :                2.3000
             k(d)                :                2.0000
             k(f)                :                0.0000
             kEN (H0ij)          :                0.7000
             D3 a1               :                0.6300
             D3 a2               :                5.0000
             D3 s6               :                1.0000
             D3 s8               :                2.4000
             D3 s9               :                0.0000
             alphaj              :                1.0000
             XBdamp              :                0.4400
             XBrad               :                1.3000
             kcnsh               :      1.0000   -0.3000   -0.5000    0.5000

  Z AO/shell   Hii/eV     exponent
  1     Thu Sep 22 23:34:11 CEST 2016   EN: 2.200 GAM: 0.405  GM3: 0.1500
     1s    -10.521941    1.306199
     2s     -3.560151    0.398421
  6     Thu Sep 22 23:34:11 CEST 2016   EN: 2.550 GAM: 0.640  GM3: 0.1500
     2s    -15.968100    1.979793
     2p     -9.777107    1.850537
     3S     -3.366990    0.633095
  7     Thu Sep 22 23:34:11 CEST 2016   EN: 3.040 GAM: 0.493  GM3:-0.1000
     2s    -24.040776    2.126160
     2p    -14.426520    2.068425
     3S     -5.882278    0.671040
  8     Thu Sep 22 23:34:11 CEST 2016   EN: 3.440 GAM: 0.717  GM3:-0.2000
     2s    -26.695120    2.575264
     2p    -16.014457    2.159448
     3S     -6.622058    0.958679
 16     Tue Jan 17 20:57:36 CET 2017    EN: 2.580 GAM: 0.455  GM3: 0.1020
     3s    -24.488821    2.492075
     3p    -12.136640    1.997904
     3d     -1.796070    1.747541

           ------------------------------------------------- 
          |        Self-Consistent Charge Iterations        |
           ------------------------------------------------- 

          ...................................................
          :                      SETUP                      :
          :.................................................:
          :  # basis functions                 266          :
          :  # atomic orbitals                 259          :
          :  # shells                          153          :
          :  # electrons                       196          :
          :  # halogen bonds                     0          :
          :  max. iterations                   250          :
          :  Hamiltonian                  GFN1-xTB          :
          :  restarted?                      false          :
          :  GBSA solvation                  false          :
          :  PC potential                    false          :
          :  electronic temp.          300.0000000     K    :
          :  accuracy                    1.0000000          :
          :  -> integral cutoff          0.2500000E+02      :
          :  -> integral neglect         0.1000000E-07      :
          :  -> SCF convergence          0.1000000E-05 Eh   :
          :  -> wf. convergence          0.2000000E-04 e    :
          :  Broyden damping             0.4000000          :
          ...................................................

 iter      E             dE          RMSdq      gap      omega  full diag
   1   -125.0400957 -0.125040E+03  0.874E+00    1.25       0.0  T
   2   -125.3209364 -0.280841E+00  0.580E+00    1.08       1.0  T
   3   -124.7555982  0.565338E+00  0.344E+00    1.25       1.0  T
   4   -125.5773995 -0.821801E+00  0.840E-01    1.08       1.0  T
   5   -125.6829587 -0.105559E+00  0.283E-01    1.16       1.0  T
   6   -125.6928043 -0.984568E-02  0.695E-02    1.15       1.0  T
   7   -125.6931315 -0.327168E-03  0.387E-02    1.16       1.0  T
   8   -125.6932417 -0.110192E-03  0.216E-02    1.16       1.0  T
   9   -125.6932736 -0.319113E-04  0.909E-03    1.16       1.5  T
  10   -125.6932807 -0.711359E-05  0.320E-03    1.16       4.1  T
  11   -125.6932816 -0.835335E-06  0.114E-03    1.16      11.6  T
  12   -125.6932817 -0.151636E-06  0.301E-04    1.16      44.0  T
  13   -125.6932817 -0.818754E-08  0.161E-04    1.16      82.4  T
  14   -125.6932817 -0.166848E-08  0.802E-05    1.16     165.2  T

   *** convergence criteria satisfied after 14 iterations ***

         #    Occupation            Energy/Eh            Energy/eV
      -------------------------------------------------------------
         1        2.0000           -1.0739573             -29.2239
       ...           ...                  ...                  ...
        92        2.0000           -0.4394999             -11.9594
        93        2.0000           -0.4271932             -11.6245
        94        2.0000           -0.4170941             -11.3497
        95        2.0000           -0.4002160             -10.8904
        96        2.0000           -0.3890680             -10.5871
        97        2.0000           -0.3890565             -10.5868
        98        2.0000           -0.3830271             -10.4227 (HOMO)
        99                         -0.3402508              -9.2587 (LUMO)
       100                         -0.3123104              -8.4984
       101                         -0.3111592              -8.4671
       102                         -0.2726914              -7.4203
       103                         -0.2651647              -7.2155
       ...                                ...                  ...
       259                        546.1494680           14861.4835
      -------------------------------------------------------------
                  HL-Gap            0.0427763 Eh            1.1640 eV
             Fermi-level           -0.3616374 Eh           -9.8407 eV

 SCC (total)                   0 d,  0 h,  0 min,  0.534 sec
 SCC setup                      ...        0 min,  0.001 sec (  0.280%)
 Dispersion                     ...        0 min,  0.000 sec (  0.020%)
 integral evaluation            ...        0 min,  0.296 sec ( 55.315%)
 zeroth order Hamiltonian       ...        0 min,  0.001 sec (  0.242%)
 iterations                     ...        0 min,  0.132 sec ( 24.616%)
 molecular gradient             ...        0 min,  0.103 sec ( 19.251%)
 printout                       ...        0 min,  0.001 sec (  0.266%)

         :::::::::::::::::::::::::::::::::::::::::::::::::::::
         ::                     SUMMARY                     ::
         :::::::::::::::::::::::::::::::::::::::::::::::::::::
         :: total energy            -123.877765262334 Eh    ::
         :: gradient norm              0.087048326589 Eh/a0 ::
         :: HOMO-LUMO gap              1.164001480564 eV    ::
         ::.................................................::
         :: SCC energy              -125.693281721913 Eh    ::
         :: -> electrostatic           0.107747828458 Eh    ::
         :: repulsion energy           1.863103444231 Eh    ::
         :: dispersion energy         -0.047586984652 Eh    ::
         :: halogen bond corr.         0.000000000000 Eh    ::
         :: add. restraining           0.000000000000 Eh    ::
         :::::::::::::::::::::::::::::::::::::::::::::::::::::

           ------------------------------------------------- 
          |        vertical delta SCC IP calculation        |
           ------------------------------------------------- 

          ...................................................
          :                      SETUP                      :
          :.................................................:
          :  # basis functions                 266          :
          :  # atomic orbitals                 259          :
          :  # shells                          153          :
          :  # electrons                       195          :
          :  # halogen bonds                     0          :
          :  max. iterations                   250          :
          :  Hamiltonian                  GFN1-xTB          :
          :  restarted?                       true          :
          :  GBSA solvation                  false          :
          :  PC potential                    false          :
          :  electronic temp.          300.0000000     K    :
          :  accuracy                    1.0000000          :
          :  -> integral cutoff          0.2500000E+02      :
          :  -> integral neglect         0.1000000E-07      :
          :  -> SCF convergence          0.1000000E-05 Eh   :
          :  -> wf. convergence          0.2000000E-04 e    :
          :  Broyden damping             0.4000000          :
          ...................................................

 iter      E             dE          RMSdq      gap      omega  full diag
   1   -125.2589366 -0.125259E+03  0.297E-01    1.16       0.0  T
   2   -125.2040637  0.548728E-01  0.861E-01    1.14       1.0  T
   3   -125.2062542 -0.219051E-02  0.846E-01    1.15       1.0  T
   4   -125.2200578 -0.138035E-01  0.752E-01    1.24       1.0  T
   5   -125.2535268 -0.334690E-01  0.363E-01    1.27       1.0  T
   6   -125.2591225 -0.559576E-02  0.289E-01    1.26       1.0  T
   7   -125.2665767 -0.745417E-02  0.101E-01    1.23       1.0  T
   8   -125.2630262  0.355055E-02  0.209E-01    1.22       1.0  T
   9   -125.2661117 -0.308558E-02  0.125E-01    1.23       1.0  T
  10   -125.2671962 -0.108442E-02  0.484E-02    1.23       1.0  T
  11   -125.2673411 -0.144908E-03  0.237E-02    1.23       1.0  T
  12   -125.2673557 -0.146152E-04  0.197E-02    1.23       1.0  T
  13   -125.2673859 -0.302005E-04  0.678E-03    1.23       2.0  T
  14   -125.2673899 -0.400687E-05  0.174E-03    1.23       7.6  T
  15   -125.2673901 -0.221437E-06  0.694E-04    1.23      19.1  T
  16   -125.2673901 -0.433500E-07  0.149E-04    1.23      89.0  T
  17   -125.2673901 -0.276543E-10  0.162E-04    1.23      81.9  T

   *** convergence criteria satisfied after 17 iterations ***

         #    Occupation            Energy/Eh            Energy/eV
      -------------------------------------------------------------
         1        2.0000           -1.1515173             -31.3344
       ...           ...                  ...                  ...
        92        2.0000           -0.5212299             -14.1834
        93        2.0000           -0.5092379             -13.8571
        94        2.0000           -0.5004508             -13.6180
        95        2.0000           -0.4851339             -13.2012
        96        1.9221           -0.4730754             -12.8730
        97        1.9196           -0.4730434             -12.8722
        98        1.1584           -0.4691412             -12.7660 (HOMO)
        99                         -0.4239997             -11.5376 (LUMO)
       100                         -0.3950975             -10.7511
       101                         -0.3949005             -10.7458
       102                         -0.3567306              -9.7071
       103                         -0.3495632              -9.5121
       ...                                ...                  ...
       259                        546.0625677           14859.1188
      -------------------------------------------------------------
                  HL-Gap            0.0451415 Eh            1.2284 eV
             Fermi-level           -0.4586418 Eh          -12.4803 eV

 SCC (total)                   0 d,  0 h,  0 min,  0.554 sec
 SCC setup                      ...        0 min,  0.001 sec (  0.211%)
 Dispersion                     ...        0 min,  0.000 sec (  0.013%)
 integral evaluation            ...        0 min,  0.294 sec ( 53.125%)
 zeroth order Hamiltonian       ...        0 min,  0.001 sec (  0.213%)
 iterations                     ...        0 min,  0.153 sec ( 27.634%)
 molecular gradient             ...        0 min,  0.103 sec ( 18.543%)
 printout                       ...        0 min,  0.001 sec (  0.251%)

         :::::::::::::::::::::::::::::::::::::::::::::::::::::
         ::                     SUMMARY                     ::
         :::::::::::::::::::::::::::::::::::::::::::::::::::::
         :: total energy            -123.451873688565 Eh    ::
         :: gradient norm              0.098049254293 Eh/a0 ::
         :: HOMO-LUMO gap              1.228362379475 eV    ::
         ::.................................................::
         :: SCC energy              -125.267390148144 Eh    ::
         :: -> electrostatic           0.146233934299 Eh    ::
         :: repulsion energy           1.863103444231 Eh    ::
         :: dispersion energy         -0.047586984652 Eh    ::
         :: halogen bond corr.         0.000000000000 Eh    ::
         :: add. restraining           0.000000000000 Eh    ::
         :::::::::::::::::::::::::::::::::::::::::::::::::::::

------------------------------------------------------------------------
empirical IP shift (eV):    4.8455
delta SCC IP (eV):    6.7436
------------------------------------------------------------------------
           ------------------------------------------------- 
          |        vertical delta SCC EA calculation        |
           ------------------------------------------------- 

          ...................................................
          :                      SETUP                      :
          :.................................................:
          :  # basis functions                 266          :
          :  # atomic orbitals                 259          :
          :  # shells                          153          :
          :  # electrons                       197          :
          :  # halogen bonds                     0          :
          :  max. iterations                   250          :
          :  Hamiltonian                  GFN1-xTB          :
          :  restarted?                       true          :
          :  GBSA solvation                  false          :
          :  PC potential                    false          :
          :  electronic temp.          300.0000000     K    :
          :  accuracy                    1.0000000          :
          :  -> integral cutoff          0.2500000E+02      :
          :  -> integral neglect         0.1000000E-07      :
          :  -> SCF convergence          0.1000000E-05 Eh   :
          :  -> wf. convergence          0.2000000E-04 e    :
          :  Broyden damping             0.4000000          :
          ...................................................

 iter      E             dE          RMSdq      gap      omega  full diag
   1   -125.9580552 -0.125958E+03  0.544E-01    0.79       0.0  T
   2   -125.9732948 -0.152396E-01  0.458E-01    0.46       1.0  T
   3   -125.9842655 -0.109707E-01  0.288E-01    0.61       1.0  T
   4   -125.9839655  0.299942E-03  0.149E-01    0.52       1.0  T
   5   -125.9866267 -0.266112E-02  0.698E-02    0.56       1.0  T
   6   -125.9868309 -0.204242E-03  0.329E-02    0.55       1.0  T
   7   -125.9869773 -0.146371E-03  0.748E-03    0.55       1.8  T
   8   -125.9869781 -0.884831E-06  0.561E-03    0.55       2.4  T
   9   -125.9869806 -0.249387E-05  0.221E-03    0.55       6.0  T
  10   -125.9869812 -0.521035E-06  0.960E-04    0.55      13.8  T
  11   -125.9869812 -0.552811E-07  0.459E-04    0.55      28.9  T
  12   -125.9869812 -0.186546E-07  0.162E-04    0.55      81.8  T
  13   -125.9869812 -0.130751E-08  0.870E-05    0.55     152.2  T

   *** convergence criteria satisfied after 13 iterations ***

         #    Occupation            Energy/Eh            Energy/eV
      -------------------------------------------------------------
         1        2.0000           -0.9990081             -27.1844
       ...           ...                  ...                  ...
        93        2.0000           -0.3488553              -9.4928
        94        2.0000           -0.3373126              -9.1787
        95        2.0000           -0.3183395              -8.6625
        96        2.0000           -0.3158518              -8.5948
        97        2.0000           -0.3157833              -8.5929
        98        2.0000           -0.2962479              -8.0613
        99        1.0000           -0.2491256              -6.7791 (HOMO)
       100        0.0000           -0.2287657              -6.2250 (LUMO)
       101                         -0.2229405              -6.0665
       102                         -0.1902601              -5.1772
       103                         -0.1852664              -5.0414
       104                         -0.1605842              -4.3697
       ...                                ...                  ...
       259                        546.2455776           14864.0987
      -------------------------------------------------------------
                  HL-Gap            0.0203600 Eh            0.5540 eV
             Fermi-level           -0.2558167 Eh           -6.9611 eV

 SCC (total)                   0 d,  0 h,  0 min,  0.516 sec
 SCC setup                      ...        0 min,  0.001 sec (  0.216%)
 Dispersion                     ...        0 min,  0.000 sec (  0.014%)
 integral evaluation            ...        0 min,  0.293 sec ( 56.834%)
 zeroth order Hamiltonian       ...        0 min,  0.001 sec (  0.228%)
 iterations                     ...        0 min,  0.117 sec ( 22.583%)
 molecular gradient             ...        0 min,  0.102 sec ( 19.848%)
 printout                       ...        0 min,  0.001 sec (  0.266%)

         :::::::::::::::::::::::::::::::::::::::::::::::::::::
         ::                     SUMMARY                     ::
         :::::::::::::::::::::::::::::::::::::::::::::::::::::
         :: total energy            -124.171464780076 Eh    ::
         :: gradient norm              0.122329578680 Eh/a0 ::
         :: HOMO-LUMO gap              0.554022601651 eV    ::
         ::.................................................::
         :: SCC energy              -125.986981239655 Eh    ::
         :: -> electrostatic           0.148900070392 Eh    ::
         :: repulsion energy           1.863103444231 Eh    ::
         :: dispersion energy         -0.047586984652 Eh    ::
         :: halogen bond corr.         0.000000000000 Eh    ::
         :: add. restraining           0.000000000000 Eh    ::
         :::::::::::::::::::::::::::::::::::::::::::::::::::::

------------------------------------------------------------------------
empirical EA shift (eV):    4.8455
delta SCC EA (eV):    3.1465
------------------------------------------------------------------------
           -------------------------------------------------
          |                Property Printout                |
           -------------------------------------------------

    * Orbital Energies and Occupations

         #    Occupation            Energy/Eh            Energy/eV
      -------------------------------------------------------------
         1        2.0000           -0.9990081             -27.1844
       ...           ...                  ...                  ...
        87        2.0000           -0.3723997             -10.1335
        88        2.0000           -0.3717732             -10.1165
        89        2.0000           -0.3599764              -9.7955
        90        2.0000           -0.3592763              -9.7764
        91        2.0000           -0.3570425              -9.7156
        92        2.0000           -0.3569077              -9.7120
        93        2.0000           -0.3488553              -9.4928
        94        2.0000           -0.3373126              -9.1787
        95        2.0000           -0.3183395              -8.6625
        96        2.0000           -0.3158518              -8.5948
        97        2.0000           -0.3157833              -8.5929
        98        2.0000           -0.2962479              -8.0613
        99        1.0000           -0.2491256              -6.7791 (HOMO)
       100        0.0000           -0.2287657              -6.2250 (LUMO)
       101                         -0.2229405              -6.0665
       102                         -0.1902601              -5.1772
       103                         -0.1852664              -5.0414
       104                         -0.1605842              -4.3697
       105                         -0.1600059              -4.3540
       106                         -0.1563683              -4.2550
       107                         -0.1552586              -4.2248
       108                         -0.1540989              -4.1932
       109                         -0.1532087              -4.1690
       110                         -0.1393486              -3.7919
       ...                                ...                  ...
       259                        546.2455776           14864.0987
      -------------------------------------------------------------
                  HL-Gap            0.0203600 Eh            0.5540 eV
             Fermi-level           -0.2558167 Eh           -6.9611 eV

  Mulliken/CM5 charges        n(s)   n(p)   n(d)
     1 C   0.03348 -0.01830   1.072  2.962  0.000
     2 C   0.03347 -0.01831   1.072  2.962  0.000
     3 C   0.00601  0.00758   1.071  2.935  0.000
     4 C  -0.07258  0.01261   1.145  2.783  0.000
     5 C  -0.07259  0.01258   1.144  2.783  0.000
     6 C   0.00599  0.00754   1.071  2.935  0.000
     7 N   0.25401  0.08154   1.457  3.797  0.000
     8 S  -0.14282 -0.00386   1.854  3.675  0.328
     9 N   0.25399  0.08143   1.457  3.797  0.000
    10 C  -0.02115 -0.01096   1.148  2.831  0.000
    11 C  -0.02113 -0.01095   1.148  2.831  0.000
    12 S   0.06814  0.03127   1.877  4.127  0.064
    13 C  -0.00985 -0.00329   1.125  2.866  0.000
    14 C   0.03643 -0.01539   1.081  2.955  0.000
    15 C   0.03975 -0.01000   1.085  2.955  0.000
    16 C   0.03974 -0.01003   1.085  2.955  0.000
    17 C   0.03646 -0.01536   1.081  2.955  0.000
    18 C  -0.00984 -0.00326   1.125  2.866  0.000
    19 S   0.06799  0.03107   1.877  4.126  0.064
    20 C   0.01686 -0.02946   1.077  2.940  0.000
    21 C  -0.00462  0.01312   1.127  2.868  0.000
    22 S   0.04688  0.02448   1.880  4.097  0.069
    23 C  -0.13738 -0.03665   1.225  2.637  0.000
    24 N   0.10255 -0.15365   1.284  3.818  0.000
    25 C  -0.19618 -0.09436   1.151  2.653  0.000
    26 O   0.36083  0.31505   1.616  4.745  0.000
    27 C  -0.03857 -0.08574   1.103  2.858  0.000
    28 C   0.05668 -0.08949   1.073  2.983  0.000
    29 S   0.36009  0.34363   1.883  4.470  0.007
    30 C   0.01685 -0.02949   1.077  2.940  0.000
    31 C  -0.00461  0.01312   1.127  2.868  0.000
    32 C  -0.19625 -0.09442   1.151  2.653  0.000
    33 N   0.10257 -0.15353   1.284  3.818  0.000
    34 C  -0.13737 -0.03668   1.225  2.637  0.000
    35 S   0.04704  0.02465   1.881  4.098  0.069
    36 S   0.35990  0.34343   1.883  4.470  0.007
    37 C  -0.03857 -0.08565   1.103  2.858  0.000
    38 C   0.05671 -0.08943   1.073  2.983  0.000
    39 O   0.36064  0.31474   1.616  4.745  0.000
    40 H  -0.03210  0.02852   0.968  0.000  0.000
    41 H  -0.03214  0.02851   0.968  0.000  0.000
    42 H  -0.03339  0.02389   0.967  0.000  0.000
    43 H  -0.02449  0.04239   0.976  0.000  0.000
    44 H  -0.02444  0.04233   0.976  0.000  0.000
    45 H  -0.03338  0.02392   0.967  0.000  0.000
    46 H  -0.04359  0.01843   0.956  0.000  0.000
    47 H  -0.05811  0.00986   0.942  0.000  0.000
    48 H  -0.04521  0.02643   0.955  0.000  0.000
    49 H  -0.03934  0.01641   0.961  0.000  0.000
    50 H  -0.02492  0.02752   0.975  0.000  0.000
    51 H  -0.02868  0.02674   0.971  0.000  0.000
    52 H  -0.04357  0.01855   0.956  0.000  0.000
    53 H  -0.04522  0.02648   0.955  0.000  0.000
    54 H  -0.05806  0.00980   0.942  0.000  0.000
    55 H  -0.02870  0.02663   0.971  0.000  0.000
    56 H  -0.02487  0.02755   0.975  0.000  0.000
    57 H  -0.03932  0.01642   0.961  0.000  0.000
(R)spin-density population

 Mulliken population n(s)   n(p)   n(d)
     1 C   0.0412   0.000  0.041  0.000
     2 C   0.0411   0.000  0.041  0.000
     3 C   0.0519   0.000  0.052  0.000
     4 C   0.0013   0.000  0.001  0.000
     5 C   0.0013   0.000  0.001  0.000
     6 C   0.0519   0.000  0.052  0.000
     7 N   0.0528   0.000  0.053  0.000
     8 S   0.1036   0.000  0.081  0.022
     9 N   0.0527   0.000  0.053  0.000
    10 C   0.0206   0.000  0.021  0.000
    11 C   0.0206   0.000  0.021  0.000
    12 S   0.0318   0.000  0.028  0.003
    13 C   0.0269   0.000  0.027  0.000
    14 C   0.0163  -0.000  0.016  0.000
    15 C   0.0211   0.000  0.021  0.000
    16 C   0.0211   0.000  0.021  0.000
    17 C   0.0163   0.000  0.016  0.000
    18 C   0.0268   0.000  0.027  0.000
    19 S   0.0318   0.000  0.028  0.003
    20 C   0.0330   0.000  0.033  0.000
    21 C   0.0366  -0.000  0.037  0.000
    22 S   0.0070   0.000  0.002  0.005
    23 C   0.0207   0.000  0.021  0.000
    24 N   0.0001   0.000  0.000  0.000
    25 C   0.0241   0.000  0.024  0.000
    26 O   0.0282   0.000  0.028  0.000
    27 C   0.0000   0.000  0.000  0.000
    28 C   0.0000   0.000  0.000  0.000
    29 S   0.0350   0.000  0.033  0.002
    30 C   0.0329   0.000  0.033  0.000
    31 C   0.0366  -0.000  0.037  0.000
    32 C   0.0241   0.000  0.024  0.000
    33 N   0.0001   0.000  0.000  0.000
    34 C   0.0207   0.000  0.021  0.000
    35 S   0.0070   0.000  0.002  0.005
    36 S   0.0349  -0.000  0.033  0.002
    37 C   0.0000   0.000  0.000  0.000
    38 C   0.0000   0.000  0.000  0.000
    39 O   0.0281   0.000  0.028  0.000
    40 H   0.0000   0.000  0.000  0.000
    41 H   0.0000   0.000  0.000  0.000
    42 H   0.0000   0.000  0.000  0.000
    43 H   0.0000   0.000  0.000  0.000
    44 H   0.0000   0.000  0.000  0.000
    45 H   0.0000   0.000  0.000  0.000
    46 H   0.0000   0.000  0.000  0.000
    47 H   0.0000   0.000  0.000  0.000
    48 H   0.0000   0.000  0.000  0.000
    49 H   0.0000   0.000  0.000  0.000
    50 H   0.0000   0.000  0.000  0.000
    51 H  -0.0000  -0.000  0.000  0.000
    52 H   0.0000   0.000  0.000  0.000
    53 H   0.0000   0.000  0.000  0.000
    54 H   0.0000   0.000  0.000  0.000
    55 H  -0.0000  -0.000  0.000  0.000
    56 H   0.0000   0.000  0.000  0.000
    57 H   0.0000   0.000  0.000  0.000

Wiberg/Mayer (AO) data.
largest (>0.10) Wiberg bond orders for each atom
          total WBO             WBO to atom ...
     1  C   3.822        C    2 1.448    C    6 1.365    H   40 0.983
     2  C   3.822        C    1 1.448    C    3 1.364    H   41 0.983
     3  C   3.824        C    2 1.364    C    4 1.224    C   10 1.214
     4  C   4.004        N    7 1.501    C    3 1.224    C    5 1.195
     5  C   4.004        N    9 1.501    C    6 1.224    C    4 1.195
     6  C   3.822        C    1 1.365    C    5 1.224    C   11 1.214
     7  N   2.913        C    4 1.501    S    8 1.408
     8  S   3.085        N    7 1.408    N    9 1.408
     9  N   2.913        C    5 1.501    S    8 1.408
    10  C   3.879        C   16 1.438    C    3 1.214    S   19 1.179
    11  C   3.879        C   15 1.438    C    6 1.214    S   12 1.179
    12  S   2.484        C   11 1.179    C   13 1.161
    13  C   3.876        C   14 1.402    C   30 1.280    S   12 1.161
    14  C   3.852        C   15 1.410    C   13 1.402    H   42 0.986
    15  C   3.848        C   11 1.438    C   14 1.410    H   43 0.992
    16  C   3.848        C   10 1.438    C   17 1.409    H   44 0.992
    17  C   3.852        C   16 1.409    C   18 1.402    H   45 0.987
    18  C   3.876        C   17 1.402    C   20 1.280    S   19 1.161
    19  S   2.485        C   10 1.179    C   18 1.161
    20  C   3.817        C   21 1.537    C   18 1.280    H   46 0.981
    21  C   3.850        C   20 1.537    S   22 1.131    C   25 1.114
    22  S   2.506        C   23 1.137    C   21 1.131    S   29 0.134
    23  C   3.981        S   29 1.604    N   24 1.221    S   22 1.137
    24  N   3.297        C   23 1.221    C   25 1.128    C   27 0.951
    25  C   4.025        O   26 1.723    N   24 1.128    C   21 1.114
    26  O   1.873        C   25 1.723
    27  C   3.925        H   48 0.993    C   28 0.989    H   47 0.986    N   24 0.951
    28  C   3.928        H   49 0.999    H   51 0.997    H   50 0.991    C   27 0.989
    29  S   1.842        C   23 1.604    S   22 0.134
    30  C   3.817        C   31 1.537    C   13 1.280    H   52 0.981
    31  C   3.850        C   30 1.537    S   35 1.132    C   32 1.114
    32  C   4.025        O   39 1.724    N   33 1.127    C   31 1.114
    33  N   3.296        C   34 1.221    C   32 1.127    C   37 0.951
    34  C   3.981        S   36 1.605    N   33 1.221    S   35 1.137
    35  S   2.505        C   34 1.137    C   31 1.132    S   36 0.134
    36  S   1.843        C   34 1.605    S   35 0.134
    37  C   3.925        H   53 0.993    C   38 0.989    H   54 0.986    N   33 0.951
    38  C   3.928        H   57 0.999    H   55 0.997    H   56 0.991    C   37 0.989
    39  O   1.874        C   32 1.724
    40  H   1.021        C    1 0.983
    41  H   1.021        C    2 0.983
    42  H   1.020        C   14 0.986
    43  H   1.060        C   15 0.992
    44  H   1.058        C   16 0.992
    45  H   1.020        C   17 0.987
    46  H   1.032        C   20 0.981
    47  H   1.006        C   27 0.986
    48  H   1.039        C   27 0.993
    49  H   1.009        C   28 0.999
    50  H   1.029        C   28 0.991
    51  H   1.031        C   28 0.997
    52  H   1.032        C   30 0.981
    53  H   1.039        C   37 0.993
    54  H   1.006        C   37 0.986
    55  H   1.031        C   38 0.997
    56  H   1.029        C   38 0.991
    57  H   1.009        C   38 0.999

 dipole moment from electron density (au)
     X       Y       Z   
   5.8331   0.2251   0.6503  total (Debye):   14.929


           -------------------------------------------------
          | TOTAL ENERGY             -124.171464780076 Eh   |
          | GRADIENT NORM               0.122329578680 Eh/α |
          | HOMO-LUMO GAP               0.554022601651 eV   |
           -------------------------------------------------

------------------------------------------------------------------------
 * finished run on 2021/12/02 at 16:48:03.527     
------------------------------------------------------------------------
 total:
 * wall-time:     0 d,  0 h,  0 min,  1.914 sec
 *  cpu-time:     0 d,  0 h,  0 min,  1.902 sec
 * ratio c/w:     0.994 speedup
 SCF:
 * wall-time:     0 d,  0 h,  0 min,  1.605 sec
 *  cpu-time:     0 d,  0 h,  0 min,  1.601 sec
 * ratio c/w:     0.997 speedup

