      -----------------------------------------------------------      
     |                   =====================                   |     
     |                           x T B                           |     
     |                   =====================                   |     
     |                         S. Grimme                         |     
     |          Mulliken Center for Theoretical Chemistry        |     
     |                    University of Bonn                     |     
     |                Version 6.2 RC2 (SAW190805)                |     
      -----------------------------------------------------------      

   This program is distributed in the hope that it will be useful,
   but WITHOUT ANY WARRANTY; without even the implied warranty of
   MERCHANTABILITY or FITNESS FOR A PARTICULAR PURPOSE.
   
   FOR NON-COMMERCIAL, ACADEMIA USE ONLY.
   
   Cite this work as:
   * S. Grimme, C. Bannwarth, P. Shushkov, J. Chem. Theory Comput., 2017,
     13, 1989-2009. DOI: 10.1021/acs.jctc.7b00118
   * C. Bannwarth, S. Ehlert and S. Grimme., J. Chem. Theory Comput., 2019,
     15, 1652-1671. DOI: 10.1021/acs.jctc.8b01176
   * P. Pracht, E. Caldeweyher, S. Ehlert, S. Grimme, ChemRxiv, 2019, preprint.
     DOI: 10.26434/chemrxiv.8326202.v1
   
   for DFT-D4:
   * E. Caldeweyher, C. Bannwarth and S. Grimme, J. Chem. Phys., 2017,
     147, 034112. DOI: 10.1063/1.4993215
   * E. Caldeweyher, S. Ehlert, A. Hansen, H. Neugebauer, S. Spicher,
     C. Bannwarth and S. Grimme, J. Chem. Phys., 2019, 150, 154122.
     DOI: 10.1063/1.5090222
   
   for sTDA-xTB:
   * S. Grimme and C. Bannwarth, J. Chem. Phys., 2016, 145, 054103.
     DOI: 10.1063/1.4959605
   
   in the mass-spec context:
   * V. Asgeirsson, C. Bauer and S. Grimme, Chem. Sci., 2017, 8, 4879.
     DOI: 10.1039/c7sc00601b
   
   for metadynamics refer to:
   * S. Grimme, J. Chem. Theory Comput., 2019, 155, 2847-2862
     DOI: 10.1021/acs.jctc.9b00143
   
   with help from (in alphabetical order)
   C. Bannwarth, F. Bohle, G. Brandenburg, E. Caldeweyher, M. Checinski,
   S. Dohm, S. Ehlert, S. Ehrlich, F. März, H. Neugebauer, J. Pisarek,
   P. Pracht, P. Shushkov, and S. Spicher.
   
 * started run on 2021/12/02 at 16:49:12.191     

           -------------------------------------------------
          |                Calculation Setup                |
           -------------------------------------------------

          program call               : /ihome/ghutchison/geoffh/xtb/xtb Y19.xyz --vipea
          hostname                   : smp-n128
          coordinate file            : Y19.xyz
          omp threads                :                     1
          number of atoms            :                   104
          number of electrons        :                   356
          charge                     :                     0
          spin                       :                   0.0
          first test random number   :      0.07933685031889


########################################################################
# WARNING! Please study the warnings concerning your input carefully
#  - XTBPATH is not set, using XTBHOME instead
########################################################################

           ------------------------------------------------- 
          |                 I P E A - x T B                 |
          |  Ionisation Potentials and Electron Affinities  |
           ------------------------------------------------- 
             KAB for M(3d)-M(3d) :                1.1000
             KAB for M(4d)-M(4d) :                1.2000
             KAB for M(5d)-M(5d) :                1.2000
             k(s)                :                2.1500
             k(p)                :                2.3000
             k(d)                :                2.0000
             k(f)                :                0.0000
             kEN (H0ij)          :                0.7000
             D3 a1               :                0.6300
             D3 a2               :                5.0000
             D3 s6               :                1.0000
             D3 s8               :                2.4000
             D3 s9               :                0.0000
             alphaj              :                1.0000
             XBdamp              :                0.4400
             XBrad               :                1.3000
             kcnsh               :      1.0000   -0.3000   -0.5000    0.5000

  Z AO/shell   Hii/eV     exponent
  1     Thu Sep 22 23:34:11 CEST 2016   EN: 2.200 GAM: 0.405  GM3: 0.1500
     1s    -10.521941    1.306199
     2s     -3.560151    0.398421
  6     Thu Sep 22 23:34:11 CEST 2016   EN: 2.550 GAM: 0.640  GM3: 0.1500
     2s    -15.968100    1.979793
     2p     -9.777107    1.850537
     3S     -3.366990    0.633095
  7     Thu Sep 22 23:34:11 CEST 2016   EN: 3.040 GAM: 0.493  GM3:-0.1000
     2s    -24.040776    2.126160
     2p    -14.426520    2.068425
     3S     -5.882278    0.671040
  8     Thu Sep 22 23:34:11 CEST 2016   EN: 3.440 GAM: 0.717  GM3:-0.2000
     2s    -26.695120    2.575264
     2p    -16.014457    2.159448
     3S     -6.622058    0.958679
 16     Tue Jan 17 20:57:36 CET 2017    EN: 2.580 GAM: 0.455  GM3: 0.1020
     3s    -24.488821    2.492075
     3p    -12.136640    1.997904
     3d     -1.796070    1.747541
 17     Tue Jan 17 19:45:33 CET 2017    EN: 3.160 GAM: 0.559  GM3: 0.2396
     3s    -24.452163    2.559226
     3p    -13.465451    2.054846
     3d     -1.836065    1.762522

           ------------------------------------------------- 
          |        Self-Consistent Charge Iterations        |
           ------------------------------------------------- 

          ...................................................
          :                      SETUP                      :
          :.................................................:
          :  # basis functions                 467          :
          :  # atomic orbitals                 459          :
          :  # shells                          281          :
          :  # electrons                       356          :
          :  # halogen bonds                    18          :
          :  max. iterations                   250          :
          :  Hamiltonian                  GFN1-xTB          :
          :  restarted?                      false          :
          :  GBSA solvation                  false          :
          :  PC potential                    false          :
          :  electronic temp.          300.0000000     K    :
          :  accuracy                    1.0000000          :
          :  -> integral cutoff          0.2500000E+02      :
          :  -> integral neglect         0.1000000E-07      :
          :  -> SCF convergence          0.1000000E-05 Eh   :
          :  -> wf. convergence          0.2000000E-04 e    :
          :  Broyden damping             0.4000000          :
          ...................................................

 iter      E             dE          RMSdq      gap      omega  full diag
   1   -221.2951024 -0.221295E+03  0.103E+01    0.47       0.0  T
   2   -216.4520637  0.484304E+01  0.657E+00    0.15       1.0  T
   3    -86.4511938  0.130001E+03  0.102E+01    0.02       1.0  T
   4    -76.8411629  0.961003E+01  0.111E+01    0.04       1.0  T
   5   -220.9369021 -0.144096E+03  0.283E+00    0.15       1.0  T
   6   -223.0214927 -0.208459E+01  0.174E+00    0.27       1.0  T
   7   -223.3431860 -0.321693E+00  0.106E+00    0.86       1.0  T
   8   -223.4306868 -0.875009E-01  0.839E-01    0.40       1.0  T
   9   -222.8531844  0.577502E+00  0.122E+00    0.11       1.0  T
  10   -223.4400813 -0.586897E+00  0.660E-01    0.17       1.0  T
  11   -223.1547138  0.285367E+00  0.858E-01    0.10       1.0  T
  12   -223.4891339 -0.334420E+00  0.380E-01    0.05       1.0  T
  13   -223.4967308 -0.759694E-02  0.270E-01    0.07       1.0  T
  14   -223.4733853  0.233455E-01  0.281E-01    0.02       1.0  T
  15   -223.5041353 -0.307499E-01  0.167E-01    0.08       1.0  T
  16   -223.4990808  0.505445E-02  0.244E-01    0.01       1.0  T
  17   -223.4394621  0.596187E-01  0.375E-01    0.02       1.0  T
  18   -223.5091545 -0.696924E-01  0.162E-01    0.04       1.0  T
  19   -223.5119433 -0.278877E-02  0.141E-01    0.04       1.0  T
  20   -223.5166902 -0.474695E-02  0.859E-02    0.04       1.0  T
  21   -223.5194398 -0.274963E-02  0.293E-02    0.05       1.0  T
  22   -223.5182642  0.117567E-02  0.534E-02    0.05       1.0  T
  23   -223.5191817 -0.917559E-03  0.322E-02    0.05       1.0  T
  24   -223.5195221 -0.340339E-03  0.163E-02    0.05       1.0  T
  25   -223.5195921 -0.700081E-04  0.104E-02    0.05       1.0  T
  26   -223.5196394 -0.472967E-04  0.291E-03    0.05       3.4  T
  27   -223.5196451 -0.569817E-05  0.659E-04    0.05      14.9  T
  28   -223.5196448  0.305051E-06  0.941E-04    0.05      10.4  T
  29   -223.5196449 -0.105954E-06  0.801E-04    0.05      12.2  T
  30   -223.5196451 -0.264076E-06  0.377E-04    0.05      26.0  T
  31   -223.5196452 -0.574455E-07  0.170E-04    0.05      57.5  T
  32   -223.5196452 -0.111731E-07  0.754E-05    0.05     130.0  T

   *** convergence criteria satisfied after 32 iterations ***

         #    Occupation            Energy/Eh            Energy/eV
      -------------------------------------------------------------
         1        2.0000           -1.1057260             -30.0883
       ...           ...                  ...                  ...
       172        2.0000           -0.3993599             -10.8671
       173        2.0000           -0.3968266             -10.7982
       174        2.0000           -0.3845761             -10.4648
       175        2.0000           -0.3786975             -10.3049
       176        2.0000           -0.3716743             -10.1138
       177        1.7330           -0.3228895              -8.7863
       178        1.4404           -0.3220109              -8.7624 (HOMO)
       179        0.5266           -0.3201351              -8.7113 (LUMO)
       180        0.3000           -0.3194645              -8.6931
       181                         -0.2780571              -7.5663
       182                         -0.2694423              -7.3319
       183                         -0.2603326              -7.0840
       ...                                ...                  ...
       459                        546.8686017           14881.0521
      -------------------------------------------------------------
                  HL-Gap            0.0018757 Eh            0.0510 eV
             Fermi-level           -0.3211126 Eh           -8.7379 eV

 SCC (total)                   0 d,  0 h,  0 min,  2.344 sec
 SCC setup                      ...        0 min,  0.004 sec (  0.186%)
 Dispersion                     ...        0 min,  0.000 sec (  0.015%)
 integral evaluation            ...        0 min,  0.935 sec ( 39.891%)
 zeroth order Hamiltonian       ...        0 min,  0.004 sec (  0.161%)
 iterations                     ...        0 min,  1.116 sec ( 47.586%)
 molecular gradient             ...        0 min,  0.280 sec ( 11.945%)
 printout                       ...        0 min,  0.005 sec (  0.213%)

         :::::::::::::::::::::::::::::::::::::::::::::::::::::
         ::                     SUMMARY                     ::
         :::::::::::::::::::::::::::::::::::::::::::::::::::::
         :: total energy            -219.778999727292 Eh    ::
         :: gradient norm              0.437976916235 Eh/a0 ::
         :: HOMO-LUMO gap              0.051041178608 eV    ::
         ::.................................................::
         :: SCC energy              -223.519645205670 Eh    ::
         :: -> electrostatic           0.348067981109 Eh    ::
         :: repulsion energy           3.842897199905 Eh    ::
         :: dispersion energy         -0.102251721528 Eh    ::
         :: halogen bond corr.         0.000000000000 Eh    ::
         :: add. restraining           0.000000000000 Eh    ::
         :::::::::::::::::::::::::::::::::::::::::::::::::::::

           ------------------------------------------------- 
          |        vertical delta SCC IP calculation        |
           ------------------------------------------------- 

          ...................................................
          :                      SETUP                      :
          :.................................................:
          :  # basis functions                 467          :
          :  # atomic orbitals                 459          :
          :  # shells                          281          :
          :  # electrons                       355          :
          :  # halogen bonds                    18          :
          :  max. iterations                   250          :
          :  Hamiltonian                  GFN1-xTB          :
          :  restarted?                       true          :
          :  GBSA solvation                  false          :
          :  PC potential                    false          :
          :  electronic temp.          300.0000000     K    :
          :  accuracy                    1.0000000          :
          :  -> integral cutoff          0.2500000E+02      :
          :  -> integral neglect         0.1000000E-07      :
          :  -> SCF convergence          0.1000000E-05 Eh   :
          :  -> wf. convergence          0.2000000E-04 e    :
          :  Broyden damping             0.4000000          :
          ...................................................

 iter      E             dE          RMSdq      gap      omega  full diag
   1   -223.1460872 -0.223146E+03  0.229E-01    0.05       0.0  T
   2   -223.1450452  0.104193E-02  0.241E-01    0.29       1.0  T
   3   -222.7483429  0.396702E+00  0.875E-01    0.13       1.0  T
   4   -223.1409357 -0.392593E+00  0.224E-01    0.08       1.0  T
   5   -223.1576830 -0.167473E-01  0.123E-01    0.17       1.0  T
   6   -223.1584077 -0.724666E-03  0.982E-02    0.11       1.0  T
   7   -223.1472711  0.111366E-01  0.167E-01    0.07       1.0  T
   8   -223.1596991 -0.124280E-01  0.798E-02    0.07       1.0  T
   9   -223.1607995 -0.110046E-02  0.452E-02    0.10       1.0  T
  10   -223.1617138 -0.914291E-03  0.225E-02    0.10       1.0  T
  11   -223.1618566 -0.142833E-03  0.736E-03    0.10       1.3  T
  12   -223.1618659 -0.926448E-05  0.355E-03    0.10       2.8  T
  13   -223.1618686 -0.266578E-05  0.125E-03    0.09       7.8  T
  14   -223.1618686 -0.623638E-07  0.839E-04    0.09      11.7  T
  15   -223.1618687 -0.708729E-07  0.863E-04    0.09      11.4  T
  16   -223.1618689 -0.238195E-06  0.958E-05    0.09     102.3  T
  17   -223.1618689  0.526722E-08  0.127E-04    0.09      77.1  T

   *** convergence criteria satisfied after 17 iterations ***

         #    Occupation            Energy/Eh            Energy/eV
      -------------------------------------------------------------
         1        2.0000           -1.1733708             -31.9290
       ...           ...                  ...                  ...
       172        2.0000           -0.4647292             -12.6459
       173        2.0000           -0.4599725             -12.5165
       174        2.0000           -0.4513956             -12.2831
       175        2.0000           -0.4428845             -12.0515
       176        2.0000           -0.4405510             -11.9880
       177        1.5582           -0.3969612             -10.8019
       178        1.2587           -0.3960660             -10.7775 (HOMO)
       179        0.1829           -0.3926258             -10.6839 (LUMO)
       180        0.0001           -0.3856174             -10.4932
       181                         -0.3479293              -9.4676
       182                         -0.3322092              -9.0399
       183                         -0.3278479              -8.9212
       ...                                ...                  ...
       459                        546.8030589           14879.2686
      -------------------------------------------------------------
                  HL-Gap            0.0034402 Eh            0.0936 eV
             Fermi-level           -0.3953490 Eh          -10.7580 eV

 SCC (total)                   0 d,  0 h,  0 min,  1.812 sec
 SCC setup                      ...        0 min,  0.004 sec (  0.200%)
 Dispersion                     ...        0 min,  0.000 sec (  0.011%)
 integral evaluation            ...        0 min,  0.932 sec ( 51.434%)
 zeroth order Hamiltonian       ...        0 min,  0.003 sec (  0.188%)
 iterations                     ...        0 min,  0.586 sec ( 32.327%)
 molecular gradient             ...        0 min,  0.280 sec ( 15.439%)
 printout                       ...        0 min,  0.007 sec (  0.398%)

         :::::::::::::::::::::::::::::::::::::::::::::::::::::
         ::                     SUMMARY                     ::
         :::::::::::::::::::::::::::::::::::::::::::::::::::::
         :: total energy            -219.421223460473 Eh    ::
         :: gradient norm              0.435849174451 Eh/a0 ::
         :: HOMO-LUMO gap              0.093612906908 eV    ::
         ::.................................................::
         :: SCC energy              -223.161868938850 Eh    ::
         :: -> electrostatic           0.394698652427 Eh    ::
         :: repulsion energy           3.842897199905 Eh    ::
         :: dispersion energy         -0.102251721528 Eh    ::
         :: halogen bond corr.         0.000000000000 Eh    ::
         :: add. restraining           0.000000000000 Eh    ::
         :::::::::::::::::::::::::::::::::::::::::::::::::::::

------------------------------------------------------------------------
empirical IP shift (eV):    4.8455
delta SCC IP (eV):    4.8901
------------------------------------------------------------------------
           ------------------------------------------------- 
          |        vertical delta SCC EA calculation        |
           ------------------------------------------------- 

          ...................................................
          :                      SETUP                      :
          :.................................................:
          :  # basis functions                 467          :
          :  # atomic orbitals                 459          :
          :  # shells                          281          :
          :  # electrons                       357          :
          :  # halogen bonds                    18          :
          :  max. iterations                   250          :
          :  Hamiltonian                  GFN1-xTB          :
          :  restarted?                       true          :
          :  GBSA solvation                  false          :
          :  PC potential                    false          :
          :  electronic temp.          300.0000000     K    :
          :  accuracy                    1.0000000          :
          :  -> integral cutoff          0.2500000E+02      :
          :  -> integral neglect         0.1000000E-07      :
          :  -> SCF convergence          0.1000000E-05 Eh   :
          :  -> wf. convergence          0.2000000E-04 e    :
          :  Broyden damping             0.4000000          :
          ...................................................

 iter      E             dE          RMSdq      gap      omega  full diag
   1   -223.7223413 -0.223722E+03  0.432E-01    0.19       0.0  T
   2   -223.1410611  0.581280E+00  0.988E-01    0.03       1.0  T
   3   -223.3132345 -0.172173E+00  0.101E+00    0.10       1.0  T
   4   -223.7808848 -0.467650E+00  0.300E-01    0.03       1.0  T
   5   -223.7611247  0.197601E-01  0.396E-01    0.05       1.0  T
   6   -223.5872085  0.173916E+00  0.521E-01    0.12       1.0  T
   7   -223.7502019 -0.162993E+00  0.295E-01    0.24       1.0  T
   8   -223.7529778 -0.277582E-02  0.269E-01    0.20       1.0  T
   9   -223.7897172 -0.367395E-01  0.172E-01    0.05       1.0  T
  10   -223.7300423  0.596749E-01  0.295E-01    0.06       1.0  T
  11   -223.8024711 -0.724288E-01  0.699E-02    0.02       1.0  T
  12   -223.8024101  0.610273E-04  0.616E-02    0.00       1.0  T
  13   -223.8043102 -0.190010E-02  0.246E-02    0.01       1.0  T
  14   -223.8044937 -0.183448E-03  0.242E-02    0.01       1.0  T
  15   -223.8045448 -0.511752E-04  0.179E-02    0.02       1.0  T
  16   -223.8046780 -0.133151E-03  0.123E-02    0.02       1.0  T
  17   -223.8047791 -0.101107E-03  0.387E-03    0.02       2.5  T
  18   -223.8047804 -0.131327E-05  0.241E-03    0.02       4.1  T
  19   -223.8047842 -0.380942E-05  0.128E-03    0.02       7.6  T
  20   -223.8047855 -0.131914E-05  0.189E-04    0.02      51.8  T
  21   -223.8047855  0.282294E-07  0.259E-04    0.02      37.9  T
  22   -223.8047856 -0.567184E-07  0.473E-05    0.02     207.5  T
  23   -223.8047856 -0.857739E-09  0.367E-05    0.02     267.2  T

   *** convergence criteria satisfied after 23 iterations ***

         #    Occupation            Energy/Eh            Energy/eV
      -------------------------------------------------------------
         1        2.0000           -1.0401928             -28.3051
       ...           ...                  ...                  ...
       173        2.0000           -0.3317840              -9.0283
       174        2.0000           -0.3183650              -8.6632
       175        2.0000           -0.3115381              -8.4774
       176        2.0000           -0.3033439              -8.2544
       177        1.8699           -0.2527261              -6.8770
       178        1.5740           -0.2513655              -6.8400
       179        0.9040           -0.2497492              -6.7960 (HOMO)
       180        0.6521           -0.2491690              -6.7802 (LUMO)
       181                         -0.2107027              -5.7335
       182                         -0.2039612              -5.5501
       183                         -0.1948142              -5.3012
       184                         -0.1875370              -5.1031
       ...                                ...                  ...
       459                        546.9329797           14882.8039
      -------------------------------------------------------------
                  HL-Gap            0.0005801 Eh            0.0158 eV
             Fermi-level           -0.2499609 Eh           -6.8018 eV

 SCC (total)                   0 d,  0 h,  0 min,  2.022 sec
 SCC setup                      ...        0 min,  0.004 sec (  0.215%)
 Dispersion                     ...        0 min,  0.000 sec (  0.016%)
 integral evaluation            ...        0 min,  0.933 sec ( 46.174%)
 zeroth order Hamiltonian       ...        0 min,  0.004 sec (  0.183%)
 iterations                     ...        0 min,  0.795 sec ( 39.341%)
 molecular gradient             ...        0 min,  0.280 sec ( 13.831%)
 printout                       ...        0 min,  0.005 sec (  0.237%)

         :::::::::::::::::::::::::::::::::::::::::::::::::::::
         ::                     SUMMARY                     ::
         :::::::::::::::::::::::::::::::::::::::::::::::::::::
         :: total energy            -220.064140085323 Eh    ::
         :: gradient norm              0.448724709555 Eh/a0 ::
         :: HOMO-LUMO gap              0.015785788493 eV    ::
         ::.................................................::
         :: SCC energy              -223.804785563700 Eh    ::
         :: -> electrostatic           0.370541895479 Eh    ::
         :: repulsion energy           3.842897199905 Eh    ::
         :: dispersion energy         -0.102251721528 Eh    ::
         :: halogen bond corr.         0.000000000000 Eh    ::
         :: add. restraining           0.000000000000 Eh    ::
         :::::::::::::::::::::::::::::::::::::::::::::::::::::

------------------------------------------------------------------------
empirical EA shift (eV):    4.8455
delta SCC EA (eV):    2.9136
------------------------------------------------------------------------
           -------------------------------------------------
          |                Property Printout                |
           -------------------------------------------------

    * Orbital Energies and Occupations

         #    Occupation            Energy/Eh            Energy/eV
      -------------------------------------------------------------
         1        2.0000           -1.0401928             -28.3051
       ...           ...                  ...                  ...
       167        2.0000           -0.3560063              -9.6874
       168        2.0000           -0.3535053              -9.6194
       169        2.0000           -0.3489627              -9.4958
       170        2.0000           -0.3442202              -9.3667
       171        2.0000           -0.3360808              -9.1452
       172        2.0000           -0.3337956              -9.0830
       173        2.0000           -0.3317840              -9.0283
       174        2.0000           -0.3183650              -8.6632
       175        2.0000           -0.3115381              -8.4774
       176        2.0000           -0.3033439              -8.2544
       177        1.8699           -0.2527261              -6.8770
       178        1.5740           -0.2513655              -6.8400
       179        0.9040           -0.2497492              -6.7960 (HOMO)
       180        0.6521           -0.2491690              -6.7802 (LUMO)
       181                         -0.2107027              -5.7335
       182                         -0.2039612              -5.5501
       183                         -0.1948142              -5.3012
       184                         -0.1875370              -5.1031
       185                         -0.1821085              -4.9554
       186                         -0.1794281              -4.8825
       187                         -0.1687124              -4.5909
       188                         -0.1628716              -4.4320
       189                         -0.1547725              -4.2116
       190                         -0.1525777              -4.1519
       ...                                ...                  ...
       459                        546.9329797           14882.8039
      -------------------------------------------------------------
                  HL-Gap            0.0005801 Eh            0.0158 eV
             Fermi-level           -0.2499609 Eh           -6.8018 eV

  Mulliken/CM5 charges        n(s)   n(p)   n(d)
     1 C  -0.33874 -0.30333   1.000  2.661  0.000
     2 O  -0.51128 -0.55730   1.650  3.839  0.000
     3 C   0.12208  0.12028   1.088  3.034  0.000
     4 C   0.04949  0.00065   1.082  2.968  0.000
     5 C  -0.04685 -0.05067   1.150  2.803  0.000
     6 Cl  0.15483  0.15395   1.854  5.276  0.024
     7 C  -0.05235 -0.05633   1.160  2.788  0.000
     8 Cl  0.13842  0.13740   1.853  5.268  0.017
     9 C   0.01882 -0.03008   1.070  2.948  0.000
    10 C   0.01601  0.01275   1.061  2.955  0.000
    11 C   0.01741  0.01671   1.068  2.949  0.000
    12 C   0.01990  0.02603   1.016  3.004  0.000
    13 C  -0.09969  0.01744   1.203  2.697  0.000
    14 N   0.30153  0.16826   1.503  3.798  0.000
    15 C  -0.09557  0.02346   1.206  2.699  0.000
    16 N   0.31114  0.18097   1.528  3.783  0.000
    17 C   0.12075  0.11884   0.995  3.125  0.000
    18 C   0.05370  0.00553   1.026  3.028  0.000
    19 C   0.00921  0.01678   1.100  2.909  0.000
    20 S   0.20869  0.17784   1.879  4.082  0.247
    21 C   0.00939  0.02732   1.103  2.906  0.000
    22 C  -0.00372  0.00950   1.137  2.860  0.000
    23 C   0.01192  0.00393   1.062  2.950  0.000
    24 C   0.02725 -0.07879   1.073  2.954  0.000
    25 C   0.05779 -0.09370   1.074  2.984  0.000
    26 S   0.08936  0.05651   1.877  4.140  0.072
    27 C   0.00547  0.02719   1.140  2.865  0.000
    28 C  -0.04512  0.02466   1.060  2.895  0.000
    29 N   0.11786 -0.14078   1.247  3.871  0.000
    30 C  -0.03276 -0.08106   1.099  2.868  0.000
    31 C  -0.05066  0.01973   1.062  2.888  0.000
    32 C   0.01710  0.02973   1.073  2.944  0.000
    33 C  -0.04576  0.05048   1.119  2.836  0.000
    34 N   0.22035  0.11751   1.380  3.840  0.000
    35 N  -0.01518 -0.13864   1.477  3.508  0.000
    36 N   0.20814  0.10483   1.359  3.849  0.000
    37 C  -0.04995  0.04616   1.112  2.838  0.000
    38 C   0.01035  0.02354   1.070  2.941  0.000
    39 C  -0.05871  0.00702   1.068  2.873  0.000
    40 N   0.15748 -0.09163   1.248  3.910  0.000
    41 C  -0.03285 -0.08309   1.104  2.863  0.000
    42 C   0.05785 -0.08887   1.061  2.997  0.000
    43 C  -0.10732 -0.03590   1.174  2.718  0.000
    44 C  -0.06260 -0.03521   1.229  2.708  0.000
    45 S   0.18085  0.15949   1.922  4.248  0.011
    46 C   0.02213  0.02252   1.099  2.924  0.000
    47 C   0.02864  0.03164   1.068  2.961  0.000
    48 S   0.13101  0.09845   1.892  4.177  0.062
    49 C  -0.01610 -0.00759   1.137  2.847  0.000
    50 C  -0.11828 -0.10574   1.168  2.714  0.000
    51 C   0.02948 -0.07358   1.102  2.927  0.000
    52 C   0.05976 -0.09142   1.066  2.994  0.000
    53 C   0.00677 -0.04004   1.079  2.928  0.000
    54 C   0.02909  0.02802   1.037  2.992  0.000
    55 C  -0.00609 -0.00628   1.083  2.911  0.000
    56 C  -0.00011  0.00656   1.035  2.965  0.000
    57 C  -0.10504  0.01440   1.204  2.691  0.000
    58 N   0.29636  0.16683   1.527  3.769  0.000
    59 C  -0.10688  0.01279   1.205  2.688  0.000
    60 N   0.29371  0.16418   1.525  3.769  0.000
    61 C   0.00633  0.00301   1.066  2.941  0.000
    62 C   0.01532 -0.03358   1.079  2.936  0.000
    63 C  -0.04995 -0.05388   1.158  2.792  0.000
    64 Cl  0.14765  0.14666   1.853  5.275  0.020
    65 C  -0.05039 -0.05423   1.157  2.792  0.000
    66 Cl  0.15264  0.15172   1.855  5.278  0.020
    67 C   0.02174 -0.02722   1.077  2.944  0.000
    68 C   0.00907  0.00713   1.074  2.935  0.000
    69 C  -0.09141 -0.06428   1.105  2.804  0.000
    70 O   0.21362  0.14608   1.633  4.580  0.000
    71 C   0.06579 -0.08070   1.080  2.985  0.000
    72 C   0.27288  0.23773   1.048  3.225  0.000
    73 C   0.52162  0.37702   1.007  3.515  0.000
    74 H   0.01666  0.07631   1.017  0.000  0.000
    75 H  -0.03849  0.02681   0.962  0.000  0.000
    76 H  -0.03791  0.03281   0.962  0.000  0.000
    77 H  -0.01821  0.03943   0.982  0.000  0.000
    78 H  -0.01558  0.04253   0.984  0.000  0.000
    79 H  -0.01358  0.03925   0.986  0.000  0.000
    80 H  -0.01284  0.03924   0.987  0.000  0.000
    81 H  -0.00919  0.04429   0.991  0.000  0.000
    82 H  -0.03312  0.03959   0.967  0.000  0.000
    83 H  -0.01130  0.05513   0.989  0.000  0.000
    84 H  -0.02623  0.04283   0.974  0.000  0.000
    85 H  -0.02304  0.04365   0.977  0.000  0.000
    86 H  -0.01648  0.03910   0.984  0.000  0.000
    87 H  -0.01676  0.03552   0.983  0.000  0.000
    88 H  -0.01713  0.03973   0.983  0.000  0.000
    89 H  -0.02633  0.03470   0.974  0.000  0.000
    90 H  -0.02738  0.03046   0.973  0.000  0.000
    91 H  -0.01457  0.03925   0.985  0.000  0.000
    92 H  -0.02053  0.03141   0.979  0.000  0.000
    93 H  -0.01793  0.03759   0.982  0.000  0.000
    94 H  -0.03733  0.02801   0.963  0.000  0.000
    95 H  -0.03743  0.02676   0.963  0.000  0.000
    96 H  -0.04049  0.01907   0.960  0.000  0.000
    97 H  -0.01238  0.04264   0.988  0.000  0.000
    98 H   0.00209  0.05448   1.002  0.000  0.000
    99 H  -0.03837  0.01845   0.962  0.000  0.000
   100 H  -0.29944 -0.22892   0.701  0.000  0.000
   101 H  -0.26836 -0.19819   0.732  0.000  0.000
   102 H  -0.27316 -0.21724   0.727  0.000  0.000
   103 H  -0.20500 -0.15260   0.795  0.000  0.000
   104 H  -0.25359 -0.19741   0.746  0.000  0.000
(R)spin-density population

 Mulliken population n(s)   n(p)   n(d)
     1 C   0.0134   0.007  0.006  0.000
     2 O   0.0823   0.010  0.072  0.000
     3 C   0.0301   0.009  0.021  0.000
     4 C   0.0057   0.003  0.003  0.000
     5 C   0.0179  -0.000  0.018  0.000
     6 Cl  0.0052  -0.000  0.003  0.003
     7 C   0.0011  -0.001  0.002  0.000
     8 Cl  0.0006   0.000  0.000  0.000
     9 C   0.0124  -0.001  0.013  0.000
    10 C   0.0084   0.000  0.008  0.000
    11 C   0.0491   0.001  0.048  0.000
    12 C   0.0511   0.000  0.051  0.000
    13 C   0.0063   0.000  0.006  0.000
    14 N   0.0248   0.000  0.025  0.000
    15 C   0.0059   0.000  0.006  0.000
    16 N   0.0230   0.000  0.023  0.000
    17 C   0.0568   0.003  0.054  0.000
    18 C   0.0446  -0.000  0.045  0.000
    19 C   0.0033  -0.000  0.004  0.000
    20 S   0.0307   0.000  0.010  0.021
    21 C   0.0286   0.001  0.028  0.000
    22 C  -0.0002  -0.000  0.000  0.000
    23 C   0.0317   0.000  0.032  0.000
    24 C   0.0004  -0.000  0.000  0.000
    25 C   0.0021   0.001  0.001  0.000
    26 S   0.0054   0.000  0.004  0.001
    27 C   0.0135   0.000  0.013  0.000
    28 C  -0.0001  -0.000  0.000  0.000
    29 N   0.0021  -0.000  0.002  0.000
    30 C   0.0009   0.001  0.000  0.000
    31 C   0.0066  -0.000  0.007  0.000
    32 C   0.0000  -0.000  0.000  0.000
    33 C   0.0017   0.000  0.002  0.000
    34 N   0.0006   0.000  0.000  0.000
    35 N   0.0011   0.000  0.001  0.000
    36 N   0.0020   0.000  0.002  0.000
    37 C   0.0001   0.000  0.000  0.000
    38 C   0.0064  -0.000  0.006  0.000
    39 C   0.0004  -0.000  0.001  0.000
    40 N   0.0003  -0.000  0.000  0.000
    41 C  -0.0001  -0.000  0.000  0.000
    42 C  -0.0000  -0.000  0.000  0.000
    43 C   0.0003  -0.000  0.000  0.000
    44 C   0.0005   0.000  0.000  0.000
    45 S   0.0018   0.000  0.002  0.000
    46 C   0.0007   0.000  0.001  0.000
    47 C   0.0006  -0.000  0.001  0.000
    48 S   0.0005   0.000  0.000  0.000
    49 C   0.0034   0.000  0.003  0.000
    50 C   0.0001   0.000  0.000  0.000
    51 C   0.0002   0.000  0.000  0.000
    52 C   0.0000   0.000  0.000  0.000
    53 C   0.0010   0.000  0.001  0.000
    54 C   0.0044   0.000  0.004  0.000
    55 C   0.0419  -0.000  0.042  0.000
    56 C   0.0492  -0.000  0.049  0.000
    57 C   0.0056  -0.000  0.006  0.000
    58 N   0.0221  -0.000  0.022  0.000
    59 C   0.0056   0.000  0.006  0.000
    60 N   0.0218   0.000  0.022  0.000
    61 C   0.0234  -0.000  0.023  0.000
    62 C   0.0050  -0.000  0.005  0.000
    63 C   0.0176  -0.000  0.018  0.000
    64 Cl  0.0044  -0.000  0.002  0.002
    65 C   0.0141  -0.000  0.014  0.000
    66 Cl  0.0035   0.000  0.002  0.002
    67 C   0.0072  -0.000  0.007  0.000
    68 C   0.0211   0.000  0.021  0.000
    69 C   0.0479   0.000  0.048  0.000
    70 O   0.0166   0.000  0.017  0.000
    71 C   0.0007   0.001  0.000  0.000
    72 C   0.0256   0.000  0.026  0.000
    73 C   0.0347   0.000  0.035  0.000
    74 H   0.0076   0.008  0.000  0.000
    75 H  -0.0003  -0.000  0.000  0.000
    76 H   0.0027   0.003  0.000  0.000
    77 H   0.0003   0.000  0.000  0.000
    78 H   0.0006   0.001  0.000  0.000
    79 H   0.0002   0.000  0.000  0.000
    80 H   0.0003   0.000  0.000  0.000
    81 H   0.0002   0.000  0.000  0.000
    82 H   0.0007   0.001  0.000  0.000
    83 H   0.0035   0.003  0.000  0.000
    84 H   0.0003   0.000  0.000  0.000
    85 H   0.0001   0.000  0.000  0.000
    86 H   0.0000   0.000  0.000  0.000
    87 H   0.0001   0.000  0.000  0.000
    88 H   0.0000   0.000  0.000  0.000
    89 H   0.0000   0.000  0.000  0.000
    90 H   0.0000   0.000  0.000  0.000
    91 H   0.0000   0.000  0.000  0.000
    92 H   0.0000   0.000  0.000  0.000
    93 H   0.0000   0.000  0.000  0.000
    94 H   0.0000   0.000  0.000  0.000
    95 H   0.0000   0.000  0.000  0.000
    96 H   0.0000   0.000  0.000  0.000
    97 H   0.0003   0.000  0.000  0.000
    98 H   0.0023   0.002  0.000  0.000
    99 H   0.0004   0.000  0.000  0.000
   100 H   0.0044   0.004  0.000  0.000
   101 H   0.0045   0.005  0.000  0.000
   102 H   0.0062   0.006  0.000  0.000
   103 H   0.0000   0.000  0.000  0.000
   104 H   0.0073   0.007  0.000  0.000

Wiberg/Mayer (AO) data.
largest (>0.10) Wiberg bond orders for each atom
          total WBO             WBO to atom ...
     1  C   4.187        O    2 2.280    C    3 0.964    C   17 0.815
     2  O   2.792        C    1 2.280    S   20 0.246
     3  C   3.813        C    4 1.415    C   10 1.278    C    1 0.964
     4  C   3.889        C    3 1.415    C    5 1.398    H   74 0.975
     5  C   3.892        C    4 1.398    C    7 1.359    Cl   6 1.079
     6  Cl  1.177        C    5 1.079
     7  C   3.969        C    9 1.428    C    5 1.359    Cl   8 1.084
     8  Cl  1.188        C    7 1.084
     9  C   3.821        C    7 1.428    C   10 1.392    H   75 0.994
    10  C   3.829        C    9 1.392    C    3 1.278    C   11 1.130
    11  C   3.730        C   12 1.341    C   17 1.178    C   10 1.130
    12  C   3.645        C   11 1.341    C   13 1.176    C   15 1.169
    13  C   4.081        N   14 2.847    C   12 1.176
    14  N   2.827        C   13 2.847
    15  C   4.086        N   16 2.873    C   12 1.169
    16  N   2.888        C   15 2.873
    17  C   3.524        C   18 1.423    C   11 1.178    C    1 0.815
    18  C   3.643        C   17 1.423    C   19 1.328    H   76 0.978
    19  C   3.795        C   23 1.359    C   18 1.328    S   20 1.101
    20  S   2.743        C   21 1.156    C   19 1.101    O    2 0.246
    21  C   3.751        C   22 1.345    C   28 1.284    S   20 1.156
    22  C   3.881        C   23 1.369    C   21 1.345    S   26 1.150
    23  C   3.746        C   22 1.369    C   19 1.359    C   24 1.012
    24  C   3.895        C   23 1.012    H   78 0.996    H   77 0.991    C   25 0.976
    25  C   3.915        H   81 1.002    H   79 0.998    H   80 0.993    C   24 0.976
    26  S   2.446        C   27 1.179    C   22 1.150
    27  C   3.861        C   28 1.350    C   32 1.290    S   26 1.179
    28  C   3.859        C   27 1.350    C   21 1.284    N   29 1.159
    29  N   3.083        C   31 1.161    C   28 1.159    C   30 0.965
    30  C   3.895        H   82 1.007    H   83 0.998    C   71 0.992    N   29 0.965
    31  C   3.827        C   39 1.308    C   32 1.305    N   29 1.161
    32  C   3.877        C   31 1.305    C   27 1.290    C   33 1.243
    33  C   3.988        N   34 1.433    C   37 1.254    C   32 1.243
    34  N   2.788        C   33 1.433    N   35 1.361
    35  N   3.879        N   36 1.369    N   34 1.361    C   72 0.958
    36  N   2.724        C   37 1.412    N   35 1.369
    37  C   3.989        N   36 1.412    C   38 1.267    C   33 1.254
    38  C   3.836        C   39 1.419    C   37 1.267    C   44 1.096
    39  C   3.849        C   38 1.419    C   31 1.308    N   40 1.094
    40  N   2.870        C   39 1.094    C   43 1.052    C   41 0.960
    41  C   3.906        H   84 1.006    H   85 1.001    C   42 0.993    N   40 0.960
    42  C   3.883        H   88 1.008    H   86 1.002    C   41 0.993    H   87 0.990
    43  C   4.040        C   47 1.112    N   40 1.052    C   44 0.954    S   45 0.883
    44  C   3.955        C   38 1.096    S   48 1.034    C   43 0.954    S   45 0.898
    45  S   1.992        C   44 0.898    C   43 0.883
    46  C   3.791        C   47 2.671    C   50 1.044
    47  C   3.762        C   46 2.671    C   43 1.112
    48  S   2.236        C   49 1.084    C   44 1.034
    49  C   3.848        C   53 1.722    S   48 1.084    C   50 0.971
    50  C   3.977        C   46 1.044    C   51 0.976    C   49 0.971    O   70 0.953
    51  C   3.923        H   90 0.995    H   89 0.994    C   52 0.988    C   50 0.976
    52  C   3.892        H   91 1.005    H   93 1.002    H   92 0.994    C   51 0.988
    53  C   3.846        C   49 1.722    C   54 1.175    H   94 0.995
    54  C   3.802        C   69 1.406    C   55 1.185    C   53 1.175
    55  C   3.778        C   56 1.411    C   54 1.185    C   61 1.121
    56  C   3.700        C   55 1.411    C   57 1.162    C   59 1.161
    57  C   4.089        N   58 2.891    C   56 1.162
    58  N   2.894        C   57 2.891
    59  C   4.088        N   60 2.893    C   56 1.161
    60  N   2.896        C   59 2.893
    61  C   3.805        C   62 1.440    C   68 1.241    C   55 1.121
    62  C   3.854        C   61 1.440    C   63 1.398    H   95 0.995
    63  C   3.914        C   62 1.398    C   65 1.361    Cl  64 1.081
    64  Cl  1.181        C   63 1.081
    65  C   3.921        C   67 1.412    C   63 1.361    Cl  66 1.080
    66  Cl  1.179        C   65 1.080
    67  C   3.868        C   65 1.412    C   68 1.410    H   96 0.985
    68  C   3.834        C   67 1.410    C   61 1.241    C   69 1.146
    69  C   3.787        C   54 1.406    O   70 1.189    C   68 1.146
    70  O   2.247        C   69 1.189    C   50 0.953
    71  C   3.905        H   97 1.012    H   98 1.001    C   30 0.992    H   99 0.977
    72  C   3.591        N   35 0.958    C   73 0.892    H  101 0.878    H  100 0.840
    73  C   3.530        H  103 0.928    C   72 0.892    H  104 0.881    H  102 0.864
    74  H   1.095        C    4 0.975
    75  H   1.063        C    9 0.994
    76  H   1.036        C   18 0.978
    77  H   1.039        C   24 0.991
    78  H   1.056        C   24 0.996
    79  H   1.033        C   25 0.998
    80  H   1.049        C   25 0.993
    81  H   1.053        C   25 1.002
    82  H   1.043        C   30 1.007
    83  H   1.044        C   30 0.998
    84  H   1.043        C   41 1.006
    85  H   1.055        C   41 1.001
    86  H   1.043        C   42 1.002
    87  H   1.043        C   42 0.990
    88  H   1.042        C   42 1.008
    89  H   1.033        C   51 0.994
    90  H   1.028        C   51 0.995
    91  H   1.041        C   52 1.005
    92  H   1.030        C   52 0.994
    93  H   1.045        C   52 1.002
    94  H   1.047        C   53 0.995
    95  H   1.058        C   62 0.995
    96  H   1.025        C   67 0.985
    97  H   1.046        C   71 1.012
    98  H   1.056        C   71 1.001
    99  H   0.973        C   71 0.977
   100  H   0.922        C   72 0.840
   101  H   0.916        C   72 0.878
   102  H   0.923        C   73 0.864
   103  H   0.930        C   73 0.928
   104  H   0.915        C   73 0.881

 dipole moment from electron density (au)
     X       Y       Z   
   6.2449  -1.4806   6.3997  total (Debye):   23.037


           -------------------------------------------------
          | TOTAL ENERGY             -220.064140085323 Eh   |
          | GRADIENT NORM               0.448724709555 Eh/α |
          | HOMO-LUMO GAP               0.015785788493 eV   |
           -------------------------------------------------

------------------------------------------------------------------------
 * finished run on 2021/12/02 at 16:49:19.331     
------------------------------------------------------------------------
 total:
 * wall-time:     0 d,  0 h,  0 min,  7.139 sec
 *  cpu-time:     0 d,  0 h,  0 min,  7.114 sec
 * ratio c/w:     0.996 speedup
 SCF:
 * wall-time:     0 d,  0 h,  0 min,  6.181 sec
 *  cpu-time:     0 d,  0 h,  0 min,  6.165 sec
 * ratio c/w:     0.998 speedup

