      -----------------------------------------------------------      
     |                   =====================                   |     
     |                           x T B                           |     
     |                   =====================                   |     
     |                         S. Grimme                         |     
     |          Mulliken Center for Theoretical Chemistry        |     
     |                    University of Bonn                     |     
     |                Version 6.2 RC2 (SAW190805)                |     
      -----------------------------------------------------------      

   This program is distributed in the hope that it will be useful,
   but WITHOUT ANY WARRANTY; without even the implied warranty of
   MERCHANTABILITY or FITNESS FOR A PARTICULAR PURPOSE.
   
   FOR NON-COMMERCIAL, ACADEMIA USE ONLY.
   
   Cite this work as:
   * S. Grimme, C. Bannwarth, P. Shushkov, J. Chem. Theory Comput., 2017,
     13, 1989-2009. DOI: 10.1021/acs.jctc.7b00118
   * C. Bannwarth, S. Ehlert and S. Grimme., J. Chem. Theory Comput., 2019,
     15, 1652-1671. DOI: 10.1021/acs.jctc.8b01176
   * P. Pracht, E. Caldeweyher, S. Ehlert, S. Grimme, ChemRxiv, 2019, preprint.
     DOI: 10.26434/chemrxiv.8326202.v1
   
   for DFT-D4:
   * E. Caldeweyher, C. Bannwarth and S. Grimme, J. Chem. Phys., 2017,
     147, 034112. DOI: 10.1063/1.4993215
   * E. Caldeweyher, S. Ehlert, A. Hansen, H. Neugebauer, S. Spicher,
     C. Bannwarth and S. Grimme, J. Chem. Phys., 2019, 150, 154122.
     DOI: 10.1063/1.5090222
   
   for sTDA-xTB:
   * S. Grimme and C. Bannwarth, J. Chem. Phys., 2016, 145, 054103.
     DOI: 10.1063/1.4959605
   
   in the mass-spec context:
   * V. Asgeirsson, C. Bauer and S. Grimme, Chem. Sci., 2017, 8, 4879.
     DOI: 10.1039/c7sc00601b
   
   for metadynamics refer to:
   * S. Grimme, J. Chem. Theory Comput., 2019, 155, 2847-2862
     DOI: 10.1021/acs.jctc.9b00143
   
   with help from (in alphabetical order)
   C. Bannwarth, F. Bohle, G. Brandenburg, E. Caldeweyher, M. Checinski,
   S. Dohm, S. Ehlert, S. Ehrlich, F. März, H. Neugebauer, J. Pisarek,
   P. Pracht, P. Shushkov, and S. Spicher.
   
 * started run on 2021/12/02 at 16:24:09.498     

           -------------------------------------------------
          |                Calculation Setup                |
           -------------------------------------------------

          program call               : /ihome/ghutchison/geoffh/xtb/xtb P1_yang.xyz --vipea
          hostname                   : smp-n73
          coordinate file            : P1_yang.xyz
          omp threads                :                     1
          number of atoms            :                    88
          number of electrons        :                   264
          charge                     :                     0
          spin                       :                   0.0
          first test random number   :      0.40616038792004


########################################################################
# WARNING! Please study the warnings concerning your input carefully
#  - XTBPATH is not set, using XTBHOME instead
########################################################################

           ------------------------------------------------- 
          |                 I P E A - x T B                 |
          |  Ionisation Potentials and Electron Affinities  |
           ------------------------------------------------- 
             KAB for M(3d)-M(3d) :                1.1000
             KAB for M(4d)-M(4d) :                1.2000
             KAB for M(5d)-M(5d) :                1.2000
             k(s)                :                2.1500
             k(p)                :                2.3000
             k(d)                :                2.0000
             k(f)                :                0.0000
             kEN (H0ij)          :                0.7000
             D3 a1               :                0.6300
             D3 a2               :                5.0000
             D3 s6               :                1.0000
             D3 s8               :                2.4000
             D3 s9               :                0.0000
             alphaj              :                1.0000
             XBdamp              :                0.4400
             XBrad               :                1.3000
             kcnsh               :      1.0000   -0.3000   -0.5000    0.5000

  Z AO/shell   Hii/eV     exponent
  1     Thu Sep 22 23:34:11 CEST 2016   EN: 2.200 GAM: 0.405  GM3: 0.1500
     1s    -10.521941    1.306199
     2s     -3.560151    0.398421
  6     Thu Sep 22 23:34:11 CEST 2016   EN: 2.550 GAM: 0.640  GM3: 0.1500
     2s    -15.968100    1.979793
     2p     -9.777107    1.850537
     3S     -3.366990    0.633095
  7     Thu Sep 22 23:34:11 CEST 2016   EN: 3.040 GAM: 0.493  GM3:-0.1000
     2s    -24.040776    2.126160
     2p    -14.426520    2.068425
     3S     -5.882278    0.671040
  8     Thu Sep 22 23:34:11 CEST 2016   EN: 3.440 GAM: 0.717  GM3:-0.2000
     2s    -26.695120    2.575264
     2p    -16.014457    2.159448
     3S     -6.622058    0.958679
  9     Tue Jan 17 20:22:52 CET 2017    EN: 3.980 GAM: 0.574  GM3: 0.2000
     2s    -27.565998    2.304073
     2p    -17.439238    2.314354
     3S     -6.120500    0.570243
 16     Tue Jan 17 20:57:36 CET 2017    EN: 2.580 GAM: 0.455  GM3: 0.1020
     3s    -24.488821    2.492075
     3p    -12.136640    1.997904
     3d     -1.796070    1.747541

           ------------------------------------------------- 
          |        Self-Consistent Charge Iterations        |
           ------------------------------------------------- 

          ...................................................
          :                      SETUP                      :
          :.................................................:
          :  # basis functions                 342          :
          :  # atomic orbitals                 340          :
          :  # shells                          228          :
          :  # electrons                       264          :
          :  # halogen bonds                     0          :
          :  max. iterations                   250          :
          :  Hamiltonian                  GFN1-xTB          :
          :  restarted?                      false          :
          :  GBSA solvation                  false          :
          :  PC potential                    false          :
          :  electronic temp.          300.0000000     K    :
          :  accuracy                    1.0000000          :
          :  -> integral cutoff          0.2500000E+02      :
          :  -> integral neglect         0.1000000E-07      :
          :  -> SCF convergence          0.1000000E-05 Eh   :
          :  -> wf. convergence          0.2000000E-04 e    :
          :  Broyden damping             0.4000000          :
          ...................................................

 iter      E             dE          RMSdq      gap      omega  full diag
   1   -161.6886219 -0.161689E+03  0.956E+00    0.68       0.0  T
   2   -159.9421353  0.174649E+01  0.669E+00    0.79       1.0  T
   3   -149.8790263  0.100631E+02  0.605E+00    0.02       1.0  T
   4   -149.1093342  0.769692E+00  0.482E+00    0.02       1.0  T
   5   -165.4956350 -0.163863E+02  0.132E+00    1.16       1.0  T
   6   -165.7571041 -0.261469E+00  0.859E-01    1.72       1.0  T
   7   -165.7664801 -0.937603E-02  0.714E-01    1.85       1.0  T
   8   -165.8037946 -0.373145E-01  0.318E-01    1.50       1.0  T
   9   -165.8087934 -0.499879E-02  0.119E-01    1.03       1.0  T
  10   -165.8102147 -0.142134E-02  0.709E-02    0.94       1.0  T
  11   -165.8111538 -0.939025E-03  0.375E-02    1.00       1.0  T
  12   -165.8114700 -0.316195E-03  0.230E-02    1.05       1.0  T
  13   -165.8115883 -0.118299E-03  0.931E-03    1.09       1.1  T
  14   -165.8116128 -0.245770E-04  0.511E-03    1.11       2.1  T
  15   -165.8116187 -0.592139E-05  0.293E-03    1.11       3.6  T
  16   -165.8116202 -0.147489E-05  0.207E-03    1.12       5.2  T
  17   -165.8116213 -0.110796E-05  0.108E-03    1.12       9.9  T
  18   -165.8116216 -0.304714E-06  0.409E-04    1.13      26.1  T
  19   -165.8116217 -0.459047E-07  0.129E-04    1.13      82.3  T
  20   -165.8116217 -0.347524E-08  0.471E-05    1.13     226.2  T

   *** convergence criteria satisfied after 20 iterations ***

         #    Occupation            Energy/Eh            Energy/eV
      -------------------------------------------------------------
         1        2.0000           -1.0925947             -29.7310
       ...           ...                  ...                  ...
       126        2.0000           -0.3771675             -10.2632
       127        2.0000           -0.3703406             -10.0775
       128        2.0000           -0.3634263              -9.8893
       129        2.0000           -0.3609706              -9.8225
       130        2.0000           -0.3460260              -9.4158
       131        2.0000           -0.3291035              -8.9554
       132        2.0000           -0.3189083              -8.6779 (HOMO)
       133                         -0.2774879              -7.5508 (LUMO)
       134                         -0.2426415              -6.6026
       135                         -0.2348092              -6.3895
       136                         -0.2268436              -6.1727
       137                         -0.2231127              -6.0712
       ...                                ...                  ...
       340                        558.9965285           15211.0698
      -------------------------------------------------------------
                  HL-Gap            0.0414203 Eh            1.1271 eV
             Fermi-level           -0.2981981 Eh           -8.1144 eV

 SCC (total)                   0 d,  0 h,  0 min,  1.028 sec
 SCC setup                      ...        0 min,  0.003 sec (  0.281%)
 Dispersion                     ...        0 min,  0.000 sec (  0.024%)
 integral evaluation            ...        0 min,  0.510 sec ( 49.609%)
 zeroth order Hamiltonian       ...        0 min,  0.002 sec (  0.241%)
 iterations                     ...        0 min,  0.323 sec ( 31.434%)
 molecular gradient             ...        0 min,  0.187 sec ( 18.167%)
 printout                       ...        0 min,  0.002 sec (  0.238%)

         :::::::::::::::::::::::::::::::::::::::::::::::::::::
         ::                     SUMMARY                     ::
         :::::::::::::::::::::::::::::::::::::::::::::::::::::
         :: total energy            -163.063314976130 Eh    ::
         :: gradient norm              0.271436031567 Eh/a0 ::
         :: HOMO-LUMO gap              1.127104715883 eV    ::
         ::.................................................::
         :: SCC energy              -165.811621685988 Eh    ::
         :: -> electrostatic           0.328458472934 Eh    ::
         :: repulsion energy           2.819263817223 Eh    ::
         :: dispersion energy         -0.070957107366 Eh    ::
         :: halogen bond corr.         0.000000000000 Eh    ::
         :: add. restraining           0.000000000000 Eh    ::
         :::::::::::::::::::::::::::::::::::::::::::::::::::::

           ------------------------------------------------- 
          |        vertical delta SCC IP calculation        |
           ------------------------------------------------- 

          ...................................................
          :                      SETUP                      :
          :.................................................:
          :  # basis functions                 342          :
          :  # atomic orbitals                 340          :
          :  # shells                          228          :
          :  # electrons                       263          :
          :  # halogen bonds                     0          :
          :  max. iterations                   250          :
          :  Hamiltonian                  GFN1-xTB          :
          :  restarted?                       true          :
          :  GBSA solvation                  false          :
          :  PC potential                    false          :
          :  electronic temp.          300.0000000     K    :
          :  accuracy                    1.0000000          :
          :  -> integral cutoff          0.2500000E+02      :
          :  -> integral neglect         0.1000000E-07      :
          :  -> SCF convergence          0.1000000E-05 Eh   :
          :  -> wf. convergence          0.2000000E-04 e    :
          :  Broyden damping             0.4000000          :
          ...................................................

 iter      E             dE          RMSdq      gap      omega  full diag
   1   -165.4108707 -0.165411E+03  0.327E-01    1.13       0.0  T
   2   -165.3828877  0.279830E-01  0.441E-01    1.79       1.0  T
   3   -165.4354070 -0.525193E-01  0.155E-01    1.59       1.0  T
   4   -165.4386727 -0.326564E-02  0.893E-02    1.67       1.0  T
   5   -165.4395413 -0.868616E-03  0.482E-02    1.69       1.0  T
   6   -165.4398052 -0.263944E-03  0.247E-02    1.69       1.0  T
   7   -165.4398707 -0.654323E-04  0.975E-03    1.70       1.1  T
   8   -165.4398839 -0.132920E-04  0.507E-03    1.69       2.1  T
   9   -165.4398877 -0.378480E-05  0.195E-03    1.69       5.5  T
  10   -165.4398882 -0.515110E-06  0.104E-03    1.69      10.2  T
  11   -165.4398885 -0.228919E-06  0.282E-04    1.69      37.8  T
  12   -165.4398885 -0.633514E-08  0.170E-04    1.69      62.5  T
  13   -165.4398885 -0.608804E-08  0.517E-05    1.69     206.3  T

   *** convergence criteria satisfied after 13 iterations ***

         #    Occupation            Energy/Eh            Energy/eV
      -------------------------------------------------------------
         1        2.0000           -1.1711573             -31.8688
       ...           ...                  ...                  ...
       126        2.0000           -0.4636119             -12.6155
       127        2.0000           -0.4603269             -12.5261
       128        2.0000           -0.4474160             -12.1748
       129        2.0000           -0.4383392             -11.9278
       130        2.0000           -0.4381736             -11.9233
       131        1.9948           -0.4315820             -11.7439
       132        1.0052           -0.4216075             -11.4725 (HOMO)
       133                         -0.3594292              -9.7806 (LUMO)
       134                         -0.3242022              -8.8220
       135                         -0.3146393              -8.5618
       136                         -0.2984921              -8.1224
       137                         -0.2920754              -7.9478
       ...                                ...                  ...
       340                        558.9234688           15209.0817
      -------------------------------------------------------------
                  HL-Gap            0.0621784 Eh            1.6920 eV
             Fermi-level           -0.4085561 Eh          -11.1174 eV

 SCC (total)                   0 d,  0 h,  0 min,  0.910 sec
 SCC setup                      ...        0 min,  0.003 sec (  0.284%)
 Dispersion                     ...        0 min,  0.000 sec (  0.017%)
 integral evaluation            ...        0 min,  0.509 sec ( 55.974%)
 zeroth order Hamiltonian       ...        0 min,  0.002 sec (  0.250%)
 iterations                     ...        0 min,  0.207 sec ( 22.694%)
 molecular gradient             ...        0 min,  0.187 sec ( 20.512%)
 printout                       ...        0 min,  0.002 sec (  0.263%)

         :::::::::::::::::::::::::::::::::::::::::::::::::::::
         ::                     SUMMARY                     ::
         :::::::::::::::::::::::::::::::::::::::::::::::::::::
         :: total energy            -162.691581776902 Eh    ::
         :: gradient norm              0.277370829853 Eh/a0 ::
         :: HOMO-LUMO gap              1.691960054638 eV    ::
         ::.................................................::
         :: SCC energy              -165.439888486759 Eh    ::
         :: -> electrostatic           0.364650244202 Eh    ::
         :: repulsion energy           2.819263817223 Eh    ::
         :: dispersion energy         -0.070957107366 Eh    ::
         :: halogen bond corr.         0.000000000000 Eh    ::
         :: add. restraining           0.000000000000 Eh    ::
         :::::::::::::::::::::::::::::::::::::::::::::::::::::

------------------------------------------------------------------------
empirical IP shift (eV):    4.8455
delta SCC IP (eV):    5.2699
------------------------------------------------------------------------
           ------------------------------------------------- 
          |        vertical delta SCC EA calculation        |
           ------------------------------------------------- 

          ...................................................
          :                      SETUP                      :
          :.................................................:
          :  # basis functions                 342          :
          :  # atomic orbitals                 340          :
          :  # shells                          228          :
          :  # electrons                       265          :
          :  # halogen bonds                     0          :
          :  max. iterations                   250          :
          :  Hamiltonian                  GFN1-xTB          :
          :  restarted?                       true          :
          :  GBSA solvation                  false          :
          :  PC potential                    false          :
          :  electronic temp.          300.0000000     K    :
          :  accuracy                    1.0000000          :
          :  -> integral cutoff          0.2500000E+02      :
          :  -> integral neglect         0.1000000E-07      :
          :  -> SCF convergence          0.1000000E-05 Eh   :
          :  -> wf. convergence          0.2000000E-04 e    :
          :  Broyden damping             0.4000000          :
          ...................................................

 iter      E             dE          RMSdq      gap      omega  full diag
   1   -165.9828356 -0.165983E+03  0.443E-01    0.96       0.0  T
   2   -166.0233510 -0.405154E-01  0.293E-01    0.31       1.0  T
   3   -166.0321168 -0.876575E-02  0.176E-01    0.16       1.0  T
   4   -165.9784698  0.536469E-01  0.365E-01    0.10       1.0  T
   5   -166.0315436 -0.530737E-01  0.129E-01    0.27       1.0  T
   6   -166.0261006  0.544292E-02  0.149E-01    0.01       1.0  T
   7   -166.0347984 -0.869776E-02  0.290E-02    0.11       1.0  T
   8   -166.0350472 -0.248849E-03  0.107E-02    0.10       1.0  T
   9   -166.0350512 -0.391339E-05  0.840E-03    0.10       1.3  T
  10   -166.0350634 -0.122642E-04  0.589E-03    0.09       1.8  T
  11   -166.0350725 -0.910978E-05  0.326E-03    0.09       3.3  T
  12   -166.0350743 -0.180090E-05  0.218E-03    0.09       4.9  T
  13   -166.0350763 -0.194786E-05  0.303E-04    0.09      35.1  T
  14   -166.0350763 -0.202508E-07  0.110E-04    0.09      96.7  T
  15   -166.0350763 -0.343567E-08  0.594E-05    0.09     179.5  T

   *** convergence criteria satisfied after 15 iterations ***

         #    Occupation            Energy/Eh            Energy/eV
      -------------------------------------------------------------
         1        2.0000           -1.0058443             -27.3704
       ...           ...                  ...                  ...
       127        2.0000           -0.2911854              -7.9236
       128        2.0000           -0.2887249              -7.8566
       129        2.0000           -0.2747990              -7.4777
       130        2.0000           -0.2624647              -7.1420
       131        2.0000           -0.2588900              -7.0448
       132        2.0000           -0.2420410              -6.5863
       133        0.8504           -0.1756143              -4.7787 (HOMO)
       134        0.1496           -0.1723131              -4.6889 (LUMO)
       135        0.0000           -0.1596800              -4.3451
       136                         -0.1500161              -4.0821
       137                         -0.1410814              -3.8390
       138                         -0.1403518              -3.8192
       ...                                ...                  ...
       340                        559.0892191           15213.5920
      -------------------------------------------------------------
                  HL-Gap            0.0033012 Eh            0.0898 eV
             Fermi-level           -0.1913957 Eh           -5.2081 eV

 SCC (total)                   0 d,  0 h,  0 min,  0.946 sec
 SCC setup                      ...        0 min,  0.003 sec (  0.275%)
 Dispersion                     ...        0 min,  0.000 sec (  0.017%)
 integral evaluation            ...        0 min,  0.510 sec ( 53.913%)
 zeroth order Hamiltonian       ...        0 min,  0.002 sec (  0.260%)
 iterations                     ...        0 min,  0.241 sec ( 25.498%)
 molecular gradient             ...        0 min,  0.187 sec ( 19.764%)
 printout                       ...        0 min,  0.003 sec (  0.266%)

         :::::::::::::::::::::::::::::::::::::::::::::::::::::
         ::                     SUMMARY                     ::
         :::::::::::::::::::::::::::::::::::::::::::::::::::::
         :: total energy            -163.286769587069 Eh    ::
         :: gradient norm              0.277825877603 Eh/a0 ::
         :: HOMO-LUMO gap              0.089831020167 eV    ::
         ::.................................................::
         :: SCC energy              -166.035076296927 Eh    ::
         :: -> electrostatic           0.374140820264 Eh    ::
         :: repulsion energy           2.819263817223 Eh    ::
         :: dispersion energy         -0.070957107366 Eh    ::
         :: halogen bond corr.         0.000000000000 Eh    ::
         :: add. restraining           0.000000000000 Eh    ::
         :::::::::::::::::::::::::::::::::::::::::::::::::::::

------------------------------------------------------------------------
empirical EA shift (eV):    4.8455
delta SCC EA (eV):    1.2350
------------------------------------------------------------------------
           -------------------------------------------------
          |                Property Printout                |
           -------------------------------------------------

    * Orbital Energies and Occupations

         #    Occupation            Energy/Eh            Energy/eV
      -------------------------------------------------------------
         1        2.0000           -1.0058443             -27.3704
       ...           ...                  ...                  ...
       121        2.0000           -0.3206135              -8.7243
       122        2.0000           -0.3081955              -8.3864
       123        2.0000           -0.3045938              -8.2884
       124        2.0000           -0.3037077              -8.2643
       125        2.0000           -0.2953161              -8.0360
       126        2.0000           -0.2949217              -8.0252
       127        2.0000           -0.2911854              -7.9236
       128        2.0000           -0.2887249              -7.8566
       129        2.0000           -0.2747990              -7.4777
       130        2.0000           -0.2624647              -7.1420
       131        2.0000           -0.2588900              -7.0448
       132        2.0000           -0.2420410              -6.5863
       133        0.8504           -0.1756143              -4.7787 (HOMO)
       134        0.1496           -0.1723131              -4.6889 (LUMO)
       135        0.0000           -0.1596800              -4.3451
       136                         -0.1500161              -4.0821
       137                         -0.1410814              -3.8390
       138                         -0.1403518              -3.8192
       139                         -0.1364406              -3.7127
       140                         -0.1206604              -3.2833
       141                         -0.1176981              -3.2027
       142                         -0.1168482              -3.1796
       143                         -0.1105016              -3.0069
       144                         -0.0973063              -2.6478
       ...                                ...                  ...
       340                        559.0892191           15213.5920
      -------------------------------------------------------------
                  HL-Gap            0.0033012 Eh            0.0898 eV
             Fermi-level           -0.1913957 Eh           -5.2081 eV

  Mulliken/CM5 charges        n(s)   n(p)   n(d)
     1 C  -0.37386 -0.41568   0.998  2.628  0.000
     2 C  -0.44202 -0.42517   0.998  2.560  0.000
     3 C  -0.22517 -0.20549   0.839  2.936  0.000
     4 C   0.12608  0.13379   1.068  3.058  0.000
     5 C  -0.02210  0.05858   1.103  2.875  0.000
     6 C   0.07300  0.14941   1.109  2.964  0.000
     7 N   0.25627  0.06421   1.273  3.984  0.000
     8 C  -0.05846  0.02430   1.098  2.844  0.000
     9 C  -0.06002  0.02358   1.110  2.830  0.000
    10 N   0.30396  0.11548   1.303  4.001  0.000
    11 F   0.32282  0.30004   1.671  5.652  0.000
    12 F   0.31510  0.29029   1.624  5.691  0.000
    13 C   0.05541  0.00469   1.067  2.989  0.000
    14 C   0.06281  0.01100   1.071  2.992  0.000
    15 C   0.01659  0.02444   1.144  2.873  0.000
    16 S   0.12532  0.09086   1.886  4.138  0.101
    17 C  -0.00162  0.01076   1.135  2.864  0.000
    18 C   0.00519  0.00269   1.082  2.924  0.000
    19 C   0.02931 -0.01863   1.049  2.980  0.000
    20 C  -0.08549 -0.06603   1.078  2.837  0.000
    21 C  -0.08138 -0.05975   1.101  2.818  0.000
    22 C   0.04120 -0.00932   1.079  2.962  0.000
    23 C   0.03420 -0.01881   1.063  2.971  0.000
    24 C   0.00595  0.00377   1.090  2.916  0.000
    25 C   0.03730 -0.01417   1.076  2.961  0.000
    26 C   0.04345 -0.00896   1.055  2.988  0.000
    27 C  -0.07857 -0.05890   1.076  2.846  0.000
    28 C  -0.08525 -0.06387   1.106  2.809  0.000
    29 C   0.03370 -0.01351   1.070  2.963  0.000
    30 O   0.24044  0.14786   1.591  4.650  0.000
    31 C  -0.05843 -0.14194   1.120  2.821  0.000
    32 C   0.05924 -0.09020   1.089  2.970  0.000
    33 O   0.23878  0.15339   1.598  4.641  0.000
    34 C  -0.05792 -0.13992   1.126  2.817  0.000
    35 C   0.05951 -0.08974   1.090  2.969  0.000
    36 O   0.24183  0.15628   1.597  4.644  0.000
    37 C  -0.05784 -0.13988   1.126  2.816  0.000
    38 C   0.06097 -0.08824   1.092  2.969  0.000
    39 O   0.24884  0.15604   1.595  4.654  0.000
    40 C  -0.05915 -0.14351   1.117  2.824  0.000
    41 C   0.05599 -0.09397   1.059  2.997  0.000
    42 C   0.04068  0.03274   1.068  2.973  0.000
    43 C   0.18494  0.13099   1.055  3.130  0.000
    44 C   0.18355  0.13101   1.088  3.095  0.000
    45 C   0.05471  0.04767   1.090  2.965  0.000
    46 C   0.20064  0.14647   1.036  3.165  0.000
    47 C   0.16659  0.11271   1.061  3.105  0.000
    48 C   0.03427  0.04208   1.159  2.875  0.000
    49 S   0.23043  0.18966   1.877  4.263  0.091
    50 C   0.18220  0.14286   1.162  3.020  0.000
    51 C   0.22551  0.17142   1.090  3.136  0.000
    52 C   0.20738  0.15538   1.086  3.121  0.000
    53 H   0.18116  0.24233   1.181  0.000  0.000
    54 H   0.00234  0.06251   1.002  0.000  0.000
    55 H   0.02220  0.07994   1.022  0.000  0.000
    56 H  -0.01380  0.05476   0.986  0.000  0.000
    57 H  -0.01431  0.04692   0.986  0.000  0.000
    58 H  -0.00615  0.05483   0.994  0.000  0.000
    59 H  -0.00238  0.05954   0.998  0.000  0.000
    60 H  -0.01459  0.04619   0.985  0.000  0.000
    61 H  -0.01406  0.05081   0.986  0.000  0.000
    62 H  -0.02340  0.03921   0.977  0.000  0.000
    63 H  -0.02452  0.03802   0.975  0.000  0.000
    64 H  -0.01328  0.04125   0.987  0.000  0.000
    65 H  -0.01237  0.03987   0.988  0.000  0.000
    66 H  -0.01376  0.04077   0.986  0.000  0.000
    67 H  -0.02467  0.04189   0.975  0.000  0.000
    68 H  -0.02520  0.04222   0.975  0.000  0.000
    69 H  -0.01502  0.03946   0.985  0.000  0.000
    70 H  -0.01094  0.04129   0.989  0.000  0.000
    71 H  -0.01558  0.03907   0.984  0.000  0.000
    72 H  -0.02918  0.03737   0.971  0.000  0.000
    73 H  -0.02920  0.03837   0.971  0.000  0.000
    74 H  -0.01498  0.03956   0.985  0.000  0.000
    75 H  -0.01630  0.03595   0.984  0.000  0.000
    76 H  -0.01457  0.03995   0.985  0.000  0.000
    77 H  -0.00470  0.05998   0.995  0.000  0.000
    78 H  -0.01139  0.05337   0.989  0.000  0.000
    79 H  -0.00586  0.04995   0.994  0.000  0.000
    80 H  -0.00730  0.04745   0.993  0.000  0.000
    81 H  -0.02820  0.02603   0.972  0.000  0.000
    82 H  -0.27120 -0.21287   0.729  0.000  0.000
    83 H  -0.25174 -0.19127   0.748  0.000  0.000
    84 H  -0.27531 -0.21678   0.725  0.000  0.000
    85 H  -0.24882 -0.18907   0.751  0.000  0.000
    86 H  -0.28394 -0.22612   0.716  0.000  0.000
    87 H  -0.26889 -0.21233   0.731  0.000  0.000
    88 H  -0.25696 -0.19914   0.743  0.000  0.000
(R)spin-density population

 Mulliken population n(s)   n(p)   n(d)
     1 C   0.0522   0.000  0.052  0.000
     2 C   0.0016   0.000  0.001  0.000
     3 C   0.0486   0.000  0.048  0.000
     4 C   0.0667   0.000  0.066  0.000
     5 C   0.0144   0.000  0.014  0.000
     6 C   0.0107   0.000  0.011  0.000
     7 N   0.1294  -0.000  0.129  0.000
     8 C   0.0626   0.000  0.063  0.000
     9 C   0.0645   0.000  0.064  0.000
    10 N   0.1355   0.000  0.135  0.000
    11 F   0.0010   0.001  0.001  0.000
    12 F   0.0080   0.000  0.008  0.000
    13 C   0.0348  -0.000  0.035  0.000
    14 C   0.0007  -0.000  0.001  0.000
    15 C   0.0366   0.000  0.037  0.000
    16 S   0.0254   0.000  0.018  0.007
    17 C   0.0083  -0.000  0.008  0.000
    18 C   0.0058  -0.000  0.006  0.000
    19 C   0.0137   0.000  0.014  0.000
    20 C  -0.0011  -0.001  0.000  0.000
    21 C   0.0133  -0.002  0.015  0.000
    22 C  -0.0003  -0.001  0.001  0.000
    23 C   0.0107  -0.000  0.011  0.000
    24 C   0.0079  -0.000  0.008  0.000
    25 C   0.0127  -0.000  0.013  0.000
    26 C  -0.0015  -0.002  0.001  0.000
    27 C   0.0117  -0.005  0.016  0.000
    28 C  -0.0028  -0.004  0.001  0.000
    29 C   0.0120  -0.001  0.013  0.000
    30 O   0.0005  -0.003  0.004  0.000
    31 C   0.0013   0.001  0.000  0.000
    32 C   0.0056   0.005  0.000  0.000
    33 O  -0.0009  -0.001  0.000  0.000
    34 C  -0.0020  -0.002  0.000  0.000
    35 C   0.0026   0.003  0.000  0.000
    36 O   0.0023  -0.001  0.004  0.000
    37 C  -0.0001  -0.000  0.000  0.000
    38 C   0.0023   0.002  0.000  0.000
    39 O  -0.0007  -0.001  0.000  0.000
    40 C  -0.0005  -0.001  0.000  0.000
    41 C  -0.0001  -0.000  0.000  0.000
    42 C   0.0011  -0.000  0.001  0.000
    43 C   0.0076  -0.000  0.008  0.000
    44 C   0.0003  -0.000  0.001  0.000
    45 C   0.0090  -0.000  0.009  0.000
    46 C   0.0002  -0.000  0.000  0.000
    47 C   0.0077  -0.000  0.008  0.000
    48 C  -0.0002  -0.000  0.000  0.000
    49 S   0.0018  -0.000  0.001  0.000
    50 C   0.0043  -0.000  0.004  0.000
    51 C   0.0000  -0.000  0.000  0.000
    52 C   0.0049  -0.000  0.005  0.000
    53 H   0.0012   0.001  0.000  0.000
    54 H   0.0002   0.000  0.000  0.000
    55 H   0.0003   0.000  0.000  0.000
    56 H   0.0008   0.001  0.000  0.000
    57 H   0.0027   0.003  0.000  0.000
    58 H   0.0017   0.002  0.000  0.000
    59 H   0.0022   0.002  0.000  0.000
    60 H   0.0032   0.003  0.000  0.000
    61 H   0.0008   0.001  0.000  0.000
    62 H   0.0078   0.008  0.000  0.000
    63 H   0.0080   0.008  0.000  0.000
    64 H   0.0142   0.014  0.000  0.000
    65 H   0.0171   0.017  0.000  0.000
    66 H   0.0145   0.015  0.000  0.000
    67 H   0.0049   0.005  0.000  0.000
    68 H   0.0060   0.006  0.000  0.000
    69 H   0.0095   0.009  0.000  0.000
    70 H   0.0158   0.016  0.000  0.000
    71 H   0.0114   0.011  0.000  0.000
    72 H   0.0036   0.004  0.000  0.000
    73 H   0.0054   0.005  0.000  0.000
    74 H   0.0070   0.007  0.000  0.000
    75 H   0.0099   0.010  0.000  0.000
    76 H   0.0095   0.009  0.000  0.000
    77 H   0.0010   0.001  0.000  0.000
    78 H   0.0018   0.002  0.000  0.000
    79 H   0.0008   0.001  0.000  0.000
    80 H   0.0009   0.001  0.000  0.000
    81 H   0.0015   0.002  0.000  0.000
    82 H   0.0003   0.000  0.000  0.000
    83 H   0.0005   0.001  0.000  0.000
    84 H   0.0013   0.001  0.000  0.000
    85 H   0.0003   0.000  0.000  0.000
    86 H   0.0011   0.001  0.000  0.000
    87 H   0.0010   0.001  0.000  0.000
    88 H   0.0017   0.002  0.000  0.000

Wiberg/Mayer (AO) data.
largest (>0.10) Wiberg bond orders for each atom
          total WBO             WBO to atom ...
     1  C   3.907        C    2 1.439    C    6 1.382    H   53 0.938
     2  C   3.786        C    1 1.439    C    3 1.251    F   11 0.884
     3  C   3.561        C    2 1.251    C    4 1.167    F   12 0.870
     4  C   3.708        C    5 1.286    C   17 1.173    C    3 1.167
     5  C   3.940        N    7 1.327    C    4 1.286    C    6 1.200
     6  C   3.992        C    1 1.382    N   10 1.270    C    5 1.200
     7  N   2.494        C    8 1.448    C    5 1.327
     8  C   3.871        N    7 1.448    C    9 1.266    C   18 1.102
     9  C   3.886        N   10 1.492    C    8 1.266    C   24 1.095
    10  N   2.541        C    9 1.492    C    6 1.270
    11  F   0.885        C    2 0.884
    12  F   0.691        C    3 0.870
    13  C   3.802        C   17 1.485    C   14 1.332    H   54 0.996
    14  C   3.867        C   15 1.516    C   13 1.332    H   55 0.995
    15  C   3.862        C   14 1.516    S   16 1.184    C   42 1.126
    16  S   2.556        C   15 1.184    C   17 1.171
    17  C   3.865        C   13 1.485    C    4 1.173    S   16 1.171
    18  C   3.895        C   19 1.387    C   23 1.381    C    8 1.102
    19  C   3.775        C   20 1.433    C   18 1.387    H   56 1.001
    20  C   3.857        C   19 1.433    C   21 1.347    O   39 1.079
    21  C   3.903        C   22 1.383    C   20 1.347    O   36 1.098
    22  C   3.906        C   23 1.464    C   21 1.383    H   57 0.988
    23  C   3.832        C   22 1.464    C   18 1.381    H   58 0.995
    24  C   3.911        C   25 1.394    C   29 1.388    C    9 1.095
    25  C   3.859        C   26 1.449    C   24 1.394    H   59 0.999
    26  C   3.849        C   25 1.449    C   27 1.405    H   60 0.993
    27  C   3.836        C   26 1.405    C   28 1.338    O   30 1.075
    28  C   3.945        C   29 1.424    C   27 1.338    O   33 1.097
    29  C   3.839        C   28 1.424    C   24 1.388    H   61 0.999
    30  O   2.088        C   27 1.075    C   31 0.981
    31  C   3.911        H   62 0.998    H   63 0.997    C   32 0.993    O   30 0.981
    32  C   3.946        H   64 1.000    H   66 1.000    C   31 0.993    H   65 0.985
    33  O   2.144        C   28 1.097    C   34 0.979
    34  C   3.930        H   67 1.002    H   68 0.999    C   35 0.988    O   33 0.979
    35  C   3.956        H   69 1.001    H   71 0.999    C   34 0.988    H   70 0.987
    36  O   2.139        C   21 1.098    C   37 0.981
    37  C   3.927        H   73 1.001    H   72 1.001    C   38 0.987    O   36 0.981
    38  C   3.957        H   74 1.002    H   76 1.001    H   75 0.988    C   37 0.987
    39  O   2.089        C   20 1.079    C   40 0.966
    40  C   3.893        H   77 1.002    C   41 0.999    H   78 0.997    O   39 0.966
    41  C   3.888        H   79 1.007    C   40 0.999    H   80 0.997    H   81 0.983
    42  C   3.835        C   43 1.377    C   47 1.375    C   15 1.126
    43  C   3.727        C   44 1.497    C   42 1.377    H   82 0.872
    44  C   3.783        C   43 1.497    C   45 1.380    H   83 0.886
    45  C   3.878        C   44 1.380    C   46 1.378    C   48 1.129
    46  C   3.709        C   47 1.495    C   45 1.378    H   84 0.844
    47  C   3.749        C   46 1.495    C   42 1.375    H   85 0.894
    48  C   3.923        C   52 1.585    S   49 1.159    C   45 1.129
    49  S   2.533        C   50 1.181    C   48 1.159
    50  C   3.807        C   51 1.648    S   49 1.181    H   86 0.887
    51  C   3.847        C   50 1.648    C   52 1.280    H   87 0.884
    52  C   3.759        C   48 1.585    C   51 1.280    H   88 0.863
    53  H   1.024        C    1 0.938
    54  H   1.057        C   13 0.996
    55  H   1.076        C   14 0.995
    56  H   1.064        C   19 1.001
    57  H   1.037        C   22 0.988
    58  H   1.050        C   23 0.995
    59  H   1.064        C   25 0.999
    60  H   1.031        C   26 0.993
    61  H   1.053        C   29 0.999
    62  H   1.026        C   31 0.998
    63  H   1.025        C   31 0.997
    64  H   1.023        C   32 1.000
    65  H   1.024        C   32 0.985
    66  H   1.025        C   32 1.000
    67  H   1.026        C   34 1.002
    68  H   1.026        C   34 0.999
    69  H   1.025        C   35 1.001
    70  H   1.022        C   35 0.987
    71  H   1.022        C   35 0.999
    72  H   1.024        C   37 1.001
    73  H   1.023        C   37 1.001
    74  H   1.026        C   38 1.002
    75  H   1.021        C   38 0.988
    76  H   1.024        C   38 1.001
    77  H   1.075        C   40 1.002
    78  H   1.070        C   40 0.997
    79  H   1.064        C   41 1.007
    80  H   1.074        C   41 0.997
    81  H   0.999        C   41 0.983
    82  H   0.961        C   43 0.872
    83  H   0.973        C   44 0.886
    84  H   0.965        C   46 0.844
    85  H   0.955        C   47 0.894
    86  H   0.937        C   50 0.887
    87  H   0.950        C   51 0.884
    88  H   0.986        C   52 0.863

 dipole moment from electron density (au)
     X       Y       Z   
   4.0591   1.9503  -0.8260  total (Debye):   11.637


           -------------------------------------------------
          | TOTAL ENERGY             -163.286769587069 Eh   |
          | GRADIENT NORM               0.277825877603 Eh/α |
          | HOMO-LUMO GAP               0.089831020167 eV   |
           -------------------------------------------------

------------------------------------------------------------------------
 * finished run on 2021/12/02 at 16:24:12.908     
------------------------------------------------------------------------
 total:
 * wall-time:     0 d,  0 h,  0 min,  3.410 sec
 *  cpu-time:     0 d,  0 h,  0 min,  3.410 sec
 * ratio c/w:     1.000 speedup
 SCF:
 * wall-time:     0 d,  0 h,  0 min,  2.885 sec
 *  cpu-time:     0 d,  0 h,  0 min,  2.885 sec
 * ratio c/w:     1.000 speedup

