      -----------------------------------------------------------      
     |                   =====================                   |     
     |                           x T B                           |     
     |                   =====================                   |     
     |                         S. Grimme                         |     
     |          Mulliken Center for Theoretical Chemistry        |     
     |                    University of Bonn                     |     
     |                Version 6.2 RC2 (SAW190805)                |     
      -----------------------------------------------------------      

   This program is distributed in the hope that it will be useful,
   but WITHOUT ANY WARRANTY; without even the implied warranty of
   MERCHANTABILITY or FITNESS FOR A PARTICULAR PURPOSE.
   
   FOR NON-COMMERCIAL, ACADEMIA USE ONLY.
   
   Cite this work as:
   * S. Grimme, C. Bannwarth, P. Shushkov, J. Chem. Theory Comput., 2017,
     13, 1989-2009. DOI: 10.1021/acs.jctc.7b00118
   * C. Bannwarth, S. Ehlert and S. Grimme., J. Chem. Theory Comput., 2019,
     15, 1652-1671. DOI: 10.1021/acs.jctc.8b01176
   * P. Pracht, E. Caldeweyher, S. Ehlert, S. Grimme, ChemRxiv, 2019, preprint.
     DOI: 10.26434/chemrxiv.8326202.v1
   
   for DFT-D4:
   * E. Caldeweyher, C. Bannwarth and S. Grimme, J. Chem. Phys., 2017,
     147, 034112. DOI: 10.1063/1.4993215
   * E. Caldeweyher, S. Ehlert, A. Hansen, H. Neugebauer, S. Spicher,
     C. Bannwarth and S. Grimme, J. Chem. Phys., 2019, 150, 154122.
     DOI: 10.1063/1.5090222
   
   for sTDA-xTB:
   * S. Grimme and C. Bannwarth, J. Chem. Phys., 2016, 145, 054103.
     DOI: 10.1063/1.4959605
   
   in the mass-spec context:
   * V. Asgeirsson, C. Bauer and S. Grimme, Chem. Sci., 2017, 8, 4879.
     DOI: 10.1039/c7sc00601b
   
   for metadynamics refer to:
   * S. Grimme, J. Chem. Theory Comput., 2019, 155, 2847-2862
     DOI: 10.1021/acs.jctc.9b00143
   
   with help from (in alphabetical order)
   C. Bannwarth, F. Bohle, G. Brandenburg, E. Caldeweyher, M. Checinski,
   S. Dohm, S. Ehlert, S. Ehrlich, F. März, H. Neugebauer, J. Pisarek,
   P. Pracht, P. Shushkov, and S. Spicher.
   
 * started run on 2021/12/02 at 16:24:12.922     

           -------------------------------------------------
          |                Calculation Setup                |
           -------------------------------------------------

          program call               : /ihome/ghutchison/geoffh/xtb/xtb P2_yang.xyz --vipea
          hostname                   : smp-n73
          coordinate file            : P2_yang.xyz
          omp threads                :                     1
          number of atoms            :                    88
          number of electrons        :                   270
          charge                     :                     0
          spin                       :                   0.0
          first test random number   :      0.52540983523234


########################################################################
# WARNING! Please study the warnings concerning your input carefully
#  - XTBPATH is not set, using XTBHOME instead
########################################################################

           ------------------------------------------------- 
          |                 I P E A - x T B                 |
          |  Ionisation Potentials and Electron Affinities  |
           ------------------------------------------------- 
             KAB for M(3d)-M(3d) :                1.1000
             KAB for M(4d)-M(4d) :                1.2000
             KAB for M(5d)-M(5d) :                1.2000
             k(s)                :                2.1500
             k(p)                :                2.3000
             k(d)                :                2.0000
             k(f)                :                0.0000
             kEN (H0ij)          :                0.7000
             D3 a1               :                0.6300
             D3 a2               :                5.0000
             D3 s6               :                1.0000
             D3 s8               :                2.4000
             D3 s9               :                0.0000
             alphaj              :                1.0000
             XBdamp              :                0.4400
             XBrad               :                1.3000
             kcnsh               :      1.0000   -0.3000   -0.5000    0.5000

  Z AO/shell   Hii/eV     exponent
  1     Thu Sep 22 23:34:11 CEST 2016   EN: 2.200 GAM: 0.405  GM3: 0.1500
     1s    -10.521941    1.306199
     2s     -3.560151    0.398421
  6     Thu Sep 22 23:34:11 CEST 2016   EN: 2.550 GAM: 0.640  GM3: 0.1500
     2s    -15.968100    1.979793
     2p     -9.777107    1.850537
     3S     -3.366990    0.633095
  7     Thu Sep 22 23:34:11 CEST 2016   EN: 3.040 GAM: 0.493  GM3:-0.1000
     2s    -24.040776    2.126160
     2p    -14.426520    2.068425
     3S     -5.882278    0.671040
  8     Thu Sep 22 23:34:11 CEST 2016   EN: 3.440 GAM: 0.717  GM3:-0.2000
     2s    -26.695120    2.575264
     2p    -16.014457    2.159448
     3S     -6.622058    0.958679
  9     Tue Jan 17 20:22:52 CET 2017    EN: 3.980 GAM: 0.574  GM3: 0.2000
     2s    -27.565998    2.304073
     2p    -17.439238    2.314354
     3S     -6.120500    0.570243
 16     Tue Jan 17 20:57:36 CET 2017    EN: 2.580 GAM: 0.455  GM3: 0.1020
     3s    -24.488821    2.492075
     3p    -12.136640    1.997904
     3d     -1.796070    1.747541

           ------------------------------------------------- 
          |        Self-Consistent Charge Iterations        |
           ------------------------------------------------- 

          ...................................................
          :                      SETUP                      :
          :.................................................:
          :  # basis functions                 345          :
          :  # atomic orbitals                 343          :
          :  # shells                          229          :
          :  # electrons                       270          :
          :  # halogen bonds                     0          :
          :  max. iterations                   250          :
          :  Hamiltonian                  GFN1-xTB          :
          :  restarted?                      false          :
          :  GBSA solvation                  false          :
          :  PC potential                    false          :
          :  electronic temp.          300.0000000     K    :
          :  accuracy                    1.0000000          :
          :  -> integral cutoff          0.2500000E+02      :
          :  -> integral neglect         0.1000000E-07      :
          :  -> SCF convergence          0.1000000E-05 Eh   :
          :  -> wf. convergence          0.2000000E-04 e    :
          :  Broyden damping             0.4000000          :
          ...................................................

 iter      E             dE          RMSdq      gap      omega  full diag
   1   -175.3320191 -0.175332E+03  0.965E+00    0.14       0.0  T
   2   -175.8605445 -0.528525E+00  0.591E+00    0.18       1.0  T
   3   -173.8797996  0.198074E+01  0.349E+00    0.60       1.0  T
   4   -175.6302655 -0.175047E+01  0.128E+00    0.46       1.0  T
   5   -176.1059553 -0.475690E+00  0.636E-01    0.55       1.0  T
   6   -176.1925876 -0.866323E-01  0.264E-01    0.31       1.0  T
   7   -176.1965081 -0.392048E-02  0.201E-01    0.28       1.0  T
   8   -176.2006454 -0.413733E-02  0.101E-01    0.25       1.0  T
   9   -176.2020644 -0.141896E-02  0.280E-02    0.22       1.0  T
  10   -176.2021917 -0.127378E-03  0.171E-02    0.22       1.0  T
  11   -176.2022187 -0.269425E-04  0.903E-03    0.22       1.2  T
  12   -176.2022410 -0.223079E-04  0.344E-03    0.22       3.1  T
  13   -176.2022426 -0.159631E-05  0.165E-03    0.22       6.4  T
  14   -176.2022430 -0.450476E-06  0.812E-04    0.22      13.1  T
  15   -176.2022431 -0.758660E-07  0.340E-04    0.22      31.3  T
  16   -176.2022431 -0.252684E-07  0.139E-04    0.22      76.6  T
  17   -176.2022431 -0.249079E-08  0.486E-05    0.22     219.3  T

   *** convergence criteria satisfied after 17 iterations ***

         #    Occupation            Energy/Eh            Energy/eV
      -------------------------------------------------------------
         1        2.0000           -1.3968363             -38.0099
       ...           ...                  ...                  ...
       129        2.0000           -0.3884334             -10.5698
       130        2.0000           -0.3850295             -10.4772
       131        2.0000           -0.3801146             -10.3434
       132        2.0000           -0.3759811             -10.2310
       133        2.0000           -0.3682551             -10.0207
       134        2.0000           -0.3517785              -9.5724
       135        1.9729           -0.3325161              -9.0482 (HOMO)
       136        0.0271           -0.3243682              -8.8265 (LUMO)
       137                         -0.2804504              -7.6314
       138                         -0.2469069              -6.7187
       139                         -0.2415413              -6.5727
       140                         -0.2315320              -6.3003
       ...                                ...                  ...
       343                        545.5907903           14846.2811
      -------------------------------------------------------------
                  HL-Gap            0.0081479 Eh            0.2217 eV
             Fermi-level           -0.3284421 Eh           -8.9374 eV

 SCC (total)                   0 d,  0 h,  0 min,  1.015 sec
 SCC setup                      ...        0 min,  0.003 sec (  0.291%)
 Dispersion                     ...        0 min,  0.000 sec (  0.025%)
 integral evaluation            ...        0 min,  0.521 sec ( 51.305%)
 zeroth order Hamiltonian       ...        0 min,  0.003 sec (  0.247%)
 iterations                     ...        0 min,  0.294 sec ( 29.000%)
 molecular gradient             ...        0 min,  0.192 sec ( 18.871%)
 printout                       ...        0 min,  0.003 sec (  0.254%)

         :::::::::::::::::::::::::::::::::::::::::::::::::::::
         ::                     SUMMARY                     ::
         :::::::::::::::::::::::::::::::::::::::::::::::::::::
         :: total energy            -173.470818593229 Eh    ::
         :: gradient norm              0.313443497438 Eh/a0 ::
         :: HOMO-LUMO gap              0.221714740149 eV    ::
         ::.................................................::
         :: SCC energy              -176.202243129745 Eh    ::
         :: -> electrostatic           0.279997997199 Eh    ::
         :: repulsion energy           2.802462464446 Eh    ::
         :: dispersion energy         -0.071037927930 Eh    ::
         :: halogen bond corr.         0.000000000000 Eh    ::
         :: add. restraining           0.000000000000 Eh    ::
         :::::::::::::::::::::::::::::::::::::::::::::::::::::

           ------------------------------------------------- 
          |        vertical delta SCC IP calculation        |
           ------------------------------------------------- 

          ...................................................
          :                      SETUP                      :
          :.................................................:
          :  # basis functions                 345          :
          :  # atomic orbitals                 343          :
          :  # shells                          229          :
          :  # electrons                       269          :
          :  # halogen bonds                     0          :
          :  max. iterations                   250          :
          :  Hamiltonian                  GFN1-xTB          :
          :  restarted?                       true          :
          :  GBSA solvation                  false          :
          :  PC potential                    false          :
          :  electronic temp.          300.0000000     K    :
          :  accuracy                    1.0000000          :
          :  -> integral cutoff          0.2500000E+02      :
          :  -> integral neglect         0.1000000E-07      :
          :  -> SCF convergence          0.1000000E-05 Eh   :
          :  -> wf. convergence          0.2000000E-04 e    :
          :  Broyden damping             0.4000000          :
          ...................................................

 iter      E             dE          RMSdq      gap      omega  full diag
   1   -175.7705655 -0.175771E+03  0.314E-01    0.22       0.0  T
   2   -175.3538131  0.416752E+00  0.955E-01    0.66       1.0  T
   3   -175.8102689 -0.456456E+00  0.199E-01    0.41       1.0  T
   4   -175.8173782 -0.710931E-02  0.997E-02    0.35       1.0  T
   5   -175.8172792  0.990088E-04  0.682E-02    0.40       1.0  T
   6   -175.8173732 -0.940008E-04  0.481E-02    0.38       1.0  T
   7   -175.8181549 -0.781688E-03  0.175E-02    0.38       1.0  T
   8   -175.8181932 -0.383046E-04  0.873E-03    0.37       1.2  T
   9   -175.8182001 -0.692676E-05  0.574E-03    0.37       1.9  T
  10   -175.8182101 -0.996950E-05  0.176E-03    0.37       6.1  T
  11   -175.8182105 -0.479793E-06  0.851E-04    0.37      12.5  T
  12   -175.8182107 -0.150685E-06  0.289E-04    0.37      36.8  T
  13   -175.8182107  0.136876E-08  0.206E-04    0.37      51.7  T
  14   -175.8182107 -0.161384E-07  0.582E-05    0.37     183.2  T
  15   -175.8182107 -0.470180E-09  0.319E-05    0.37     333.9  T

   *** convergence criteria satisfied after 15 iterations ***

         #    Occupation            Energy/Eh            Energy/eV
      -------------------------------------------------------------
         1        2.0000           -1.4963227             -40.7170
       ...           ...                  ...                  ...
       129        2.0000           -0.4662622             -12.6876
       130        2.0000           -0.4642367             -12.6325
       131        2.0000           -0.4610298             -12.5453
       132        2.0000           -0.4555309             -12.3956
       133        2.0000           -0.4514398             -12.2843
       134        1.9673           -0.4412001             -12.0057
       135        1.0319           -0.4347613             -11.8305 (HOMO)
       136        0.0007           -0.4210232             -11.4566 (LUMO)
       137                         -0.3755480             -10.2192
       138                         -0.3364880              -9.1563
       139                         -0.3324084              -9.0453
       140                         -0.3133235              -8.5260
       ...                                ...                  ...
       343                        545.5079134           14844.0259
      -------------------------------------------------------------
                  HL-Gap            0.0137381 Eh            0.3738 eV
             Fermi-level           -0.4329362 Eh          -11.7808 eV

 SCC (total)                   0 d,  0 h,  0 min,  0.976 sec
 SCC setup                      ...        0 min,  0.003 sec (  0.278%)
 Dispersion                     ...        0 min,  0.000 sec (  0.015%)
 integral evaluation            ...        0 min,  0.519 sec ( 53.184%)
 zeroth order Hamiltonian       ...        0 min,  0.002 sec (  0.235%)
 iterations                     ...        0 min,  0.258 sec ( 26.409%)
 molecular gradient             ...        0 min,  0.191 sec ( 19.606%)
 printout                       ...        0 min,  0.003 sec (  0.265%)

         :::::::::::::::::::::::::::::::::::::::::::::::::::::
         ::                     SUMMARY                     ::
         :::::::::::::::::::::::::::::::::::::::::::::::::::::
         :: total energy            -173.086786160317 Eh    ::
         :: gradient norm              0.309422207680 Eh/a0 ::
         :: HOMO-LUMO gap              0.373833494349 eV    ::
         ::.................................................::
         :: SCC energy              -175.818210696833 Eh    ::
         :: -> electrostatic           0.307584382529 Eh    ::
         :: repulsion energy           2.802462464446 Eh    ::
         :: dispersion energy         -0.071037927930 Eh    ::
         :: halogen bond corr.         0.000000000000 Eh    ::
         :: add. restraining           0.000000000000 Eh    ::
         :::::::::::::::::::::::::::::::::::::::::::::::::::::

------------------------------------------------------------------------
empirical IP shift (eV):    4.8455
delta SCC IP (eV):    5.6046
------------------------------------------------------------------------
           ------------------------------------------------- 
          |        vertical delta SCC EA calculation        |
           ------------------------------------------------- 

          ...................................................
          :                      SETUP                      :
          :.................................................:
          :  # basis functions                 345          :
          :  # atomic orbitals                 343          :
          :  # shells                          229          :
          :  # electrons                       271          :
          :  # halogen bonds                     0          :
          :  max. iterations                   250          :
          :  Hamiltonian                  GFN1-xTB          :
          :  restarted?                       true          :
          :  GBSA solvation                  false          :
          :  PC potential                    false          :
          :  electronic temp.          300.0000000     K    :
          :  accuracy                    1.0000000          :
          :  -> integral cutoff          0.2500000E+02      :
          :  -> integral neglect         0.1000000E-07      :
          :  -> SCF convergence          0.1000000E-05 Eh   :
          :  -> wf. convergence          0.2000000E-04 e    :
          :  Broyden damping             0.4000000          :
          ...................................................

 iter      E             dE          RMSdq      gap      omega  full diag
   1   -176.3789201 -0.176379E+03  0.489E-01    1.24       0.0  T
   2   -176.3913593 -0.124392E-01  0.525E-01    0.82       1.0  T
   3   -176.4624794 -0.711201E-01  0.297E-01    1.05       1.0  T
   4   -176.4726038 -0.101244E-01  0.155E-01    1.09       1.0  T
   5   -176.4735458 -0.942033E-03  0.885E-02    0.90       1.0  T
   6   -176.4741484 -0.602572E-03  0.394E-02    0.79       1.0  T
   7   -176.4744204 -0.272000E-03  0.192E-02    0.78       1.0  T
   8   -176.4744826 -0.621515E-04  0.635E-03    0.79       1.7  T
   9   -176.4744867 -0.415444E-05  0.374E-03    0.81       2.9  T
  10   -176.4744888 -0.208471E-05  0.152E-03    0.81       7.0  T
  11   -176.4744891 -0.274096E-06  0.612E-04    0.82      17.4  T
  12   -176.4744891 -0.667189E-07  0.252E-04    0.82      42.2  T
  13   -176.4744892 -0.100199E-07  0.114E-04    0.82      93.7  T
  14   -176.4744892 -0.145556E-08  0.502E-05    0.82     212.5  T

   *** convergence criteria satisfied after 14 iterations ***

         #    Occupation            Energy/Eh            Energy/eV
      -------------------------------------------------------------
         1        2.0000           -1.2900629             -35.1044
       ...           ...                  ...                  ...
       130        2.0000           -0.2982309              -8.1153
       131        2.0000           -0.2937768              -7.9941
       132        2.0000           -0.2856925              -7.7741
       133        2.0000           -0.2779746              -7.5641
       134        2.0000           -0.2602968              -7.0830
       135        1.9815           -0.2262404              -6.1563
       136        1.0185           -0.2186928              -5.9509 (HOMO)
       137        0.0000           -0.1887113              -5.1351 (LUMO)
       138                         -0.1808366              -4.9208
       139                         -0.1750714              -4.7639
       140                         -0.1578247              -4.2946
       141                         -0.1557006              -4.2368
       ...                                ...                  ...
       343                        545.6770665           14848.6288
      -------------------------------------------------------------
                  HL-Gap            0.0299814 Eh            0.8158 eV
             Fermi-level           -0.2130843 Eh           -5.7983 eV

 SCC (total)                   0 d,  0 h,  0 min,  0.954 sec
 SCC setup                      ...        0 min,  0.002 sec (  0.236%)
 Dispersion                     ...        0 min,  0.000 sec (  0.017%)
 integral evaluation            ...        0 min,  0.517 sec ( 54.139%)
 zeroth order Hamiltonian       ...        0 min,  0.002 sec (  0.240%)
 iterations                     ...        0 min,  0.239 sec ( 25.055%)
 molecular gradient             ...        0 min,  0.191 sec ( 20.036%)
 printout                       ...        0 min,  0.003 sec (  0.271%)

         :::::::::::::::::::::::::::::::::::::::::::::::::::::
         ::                     SUMMARY                     ::
         :::::::::::::::::::::::::::::::::::::::::::::::::::::
         :: total energy            -173.743064622218 Eh    ::
         :: gradient norm              0.307630914804 Eh/a0 ::
         :: HOMO-LUMO gap              0.815836504944 eV    ::
         ::.................................................::
         :: SCC energy              -176.474489158734 Eh    ::
         :: -> electrostatic           0.335504482616 Eh    ::
         :: repulsion energy           2.802462464446 Eh    ::
         :: dispersion energy         -0.071037927930 Eh    ::
         :: halogen bond corr.         0.000000000000 Eh    ::
         :: add. restraining           0.000000000000 Eh    ::
         :::::::::::::::::::::::::::::::::::::::::::::::::::::

------------------------------------------------------------------------
empirical EA shift (eV):    4.8455
delta SCC EA (eV):    2.5627
------------------------------------------------------------------------
           -------------------------------------------------
          |                Property Printout                |
           -------------------------------------------------

    * Orbital Energies and Occupations

         #    Occupation            Energy/Eh            Energy/eV
      -------------------------------------------------------------
         1        2.0000           -1.2900629             -35.1044
       ...           ...                  ...                  ...
       124        2.0000           -0.3200908              -8.7101
       125        2.0000           -0.3178996              -8.6505
       126        2.0000           -0.3132643              -8.5244
       127        2.0000           -0.3052527              -8.3063
       128        2.0000           -0.3041119              -8.2753
       129        2.0000           -0.3007284              -8.1832
       130        2.0000           -0.2982309              -8.1153
       131        2.0000           -0.2937768              -7.9941
       132        2.0000           -0.2856925              -7.7741
       133        2.0000           -0.2779746              -7.5641
       134        2.0000           -0.2602968              -7.0830
       135        1.9815           -0.2262404              -6.1563
       136        1.0185           -0.2186928              -5.9509 (HOMO)
       137        0.0000           -0.1887113              -5.1351 (LUMO)
       138                         -0.1808366              -4.9208
       139                         -0.1750714              -4.7639
       140                         -0.1578247              -4.2946
       141                         -0.1557006              -4.2368
       142                         -0.1448835              -3.9425
       143                         -0.1357008              -3.6926
       144                         -0.1323856              -3.6024
       145                         -0.1234351              -3.3588
       146                         -0.1180662              -3.2127
       147                         -0.1158136              -3.1514
       ...                                ...                  ...
       343                        545.6770665           14848.6288
      -------------------------------------------------------------
                  HL-Gap            0.0299814 Eh            0.8158 eV
             Fermi-level           -0.2130843 Eh           -5.7983 eV

  Mulliken/CM5 charges        n(s)   n(p)   n(d)
     1 C  -0.05600 -0.09790   0.790  3.154  0.000
     2 C  -0.22507 -0.20819   0.763  3.012  0.000
     3 C   0.24443  0.26418   0.409  3.835  0.000
     4 C   0.00743  0.01541   1.122  2.886  0.000
     5 C  -0.06768  0.01351   1.138  2.795  0.000
     6 C   0.03743  0.11350   1.120  2.917  0.000
     7 N   0.19853  0.00178   1.308  3.890  0.000
     8 C  -0.07161  0.01160   1.101  2.827  0.000
     9 C  -0.07224  0.01117   1.111  2.816  0.000
    10 N   0.24429  0.05771   1.324  3.921  0.000
    11 F   0.30881  0.28596   1.710  5.598  0.000
    12 F   0.37390  0.34895   1.638  5.736  0.000
    13 C   0.02920 -0.02156   1.114  2.916  0.000
    14 C   0.04303 -0.00784   1.083  2.960  0.000
    15 C   0.00416  0.01311   1.139  2.865  0.000
    16 S   0.12600  0.09429   1.889  4.107  0.130
    17 C  -0.02651 -0.01391   1.171  2.802  0.000
    18 C   0.00128 -0.00105   1.080  2.921  0.000
    19 C   0.02653 -0.02141   1.049  2.977  0.000
    20 C  -0.08407 -0.06450   1.087  2.829  0.000
    21 C  -0.07932 -0.05778   1.105  2.816  0.000
    22 C   0.04188 -0.00859   1.078  2.964  0.000
    23 C   0.03421 -0.01871   1.061  2.973  0.000
    24 C   0.00291  0.00112   1.090  2.913  0.000
    25 C   0.03454 -0.01692   1.076  2.958  0.000
    26 C   0.04290 -0.00949   1.057  2.986  0.000
    27 C  -0.07967 -0.05995   1.082  2.839  0.000
    28 C  -0.08532 -0.06396   1.109  2.806  0.000
    29 C   0.03140 -0.01573   1.071  2.960  0.000
    30 O   0.24031  0.14780   1.594  4.646  0.000
    31 C  -0.05743 -0.14095   1.120  2.822  0.000
    32 C   0.05982 -0.08960   1.086  2.974  0.000
    33 O   0.23825  0.15293   1.599  4.639  0.000
    34 C  -0.05621 -0.13824   1.128  2.816  0.000
    35 C   0.06031 -0.08891   1.089  2.971  0.000
    36 O   0.24378  0.15829   1.599  4.645  0.000
    37 C  -0.05681 -0.13879   1.127  2.816  0.000
    38 C   0.06135 -0.08786   1.088  2.973  0.000
    39 O   0.26399  0.17115   1.612  4.652  0.000
    40 C  -0.03440 -0.11829   1.131  2.835  0.000
    41 C   0.33740  0.18705   0.974  3.363  0.000
    42 C   0.02139  0.01884   1.076  2.946  0.000
    43 C   0.17453  0.12123   1.049  3.126  0.000
    44 C   0.18337  0.12933   1.068  3.115  0.000
    45 C   0.05196  0.04534   1.096  2.956  0.000
    46 C   0.17274  0.12554   1.073  3.100  0.000
    47 C  -0.06843 -0.05465   1.154  2.778  0.000
    48 C   0.03081  0.03873   1.157  2.874  0.000
    49 S   0.20182  0.16119   1.876  4.235  0.090
    50 C   0.17064  0.13134   1.156  3.015  0.000
    51 C   0.21035  0.15627   1.109  3.102  0.000
    52 C   0.18008  0.12810   1.093  3.087  0.000
    53 F   0.19366  0.16788   1.670  5.523  0.000
    54 H  -0.19145 -0.13033   0.809  0.000  0.000
    55 H   0.00237  0.06271   1.002  0.000  0.000
    56 H   0.00490  0.06473   1.005  0.000  0.000
    57 H  -0.02332  0.04381   0.977  0.000  0.000
    58 H  -0.01783  0.04340   0.982  0.000  0.000
    59 H  -0.01073  0.04916   0.989  0.000  0.000
    60 H  -0.01715  0.04430   0.983  0.000  0.000
    61 H  -0.02155  0.03921   0.978  0.000  0.000
    62 H  -0.02038  0.04475   0.980  0.000  0.000
    63 H  -0.03331  0.02929   0.967  0.000  0.000
    64 H  -0.03363  0.02893   0.966  0.000  0.000
    65 H  -0.02794  0.02659   0.972  0.000  0.000
    66 H  -0.03005  0.02219   0.970  0.000  0.000
    67 H  -0.02800  0.02652   0.972  0.000  0.000
    68 H  -0.03113  0.03526   0.969  0.000  0.000
    69 H  -0.03026  0.03724   0.970  0.000  0.000
    70 H  -0.02711  0.02736   0.973  0.000  0.000
    71 H  -0.02584  0.02639   0.974  0.000  0.000
    72 H  -0.02680  0.02782   0.973  0.000  0.000
    73 H  -0.01915  0.04845   0.981  0.000  0.000
    74 H  -0.03425  0.03212   0.966  0.000  0.000
    75 H  -0.02089  0.03367   0.979  0.000  0.000
    76 H  -0.02568  0.02656   0.974  0.000  0.000
    77 H  -0.02476  0.02975   0.975  0.000  0.000
    78 H  -0.00852  0.05500   0.991  0.000  0.000
    79 H   0.00392  0.06793   1.004  0.000  0.000
    80 H   0.05289  0.11044   1.053  0.000  0.000
    81 H  -0.29833 -0.24604   0.702  0.000  0.000
    82 H  -0.26426 -0.20900   0.736  0.000  0.000
    83 H  -0.28348 -0.22221   0.717  0.000  0.000
    84 H  -0.24758 -0.18893   0.752  0.000  0.000
    85 H  -0.28795 -0.22633   0.712  0.000  0.000
    86 H  -0.27773 -0.21991   0.722  0.000  0.000
    87 H  -0.25168 -0.19513   0.748  0.000  0.000
    88 H  -0.23203 -0.17422   0.768  0.000  0.000
(R)spin-density population

 Mulliken population n(s)   n(p)   n(d)
     1 C   0.1207   0.002  0.119  0.000
     2 C   0.0578   0.015  0.042  0.000
     3 C   0.0036   0.003  0.001  0.000
     4 C   0.1331   0.006  0.127  0.000
     5 C   0.0884   0.002  0.086  0.000
     6 C   0.1489   0.017  0.132  0.000
     7 N   0.0203  -0.000  0.020  0.000
     8 C   0.0486  -0.000  0.049  0.000
     9 C   0.0228   0.002  0.021  0.000
    10 N   0.0388   0.003  0.036  0.000
    11 F   0.0415   0.005  0.036  0.000
    12 F   0.0021  -0.001  0.003  0.000
    13 C   0.0606   0.000  0.060  0.000
    14 C   0.0046  -0.000  0.005  0.000
    15 C   0.0615   0.000  0.061  0.000
    16 S   0.0161   0.000  0.012  0.004
    17 C   0.0153   0.001  0.015  0.000
    18 C   0.0027   0.001  0.002  0.000
    19 C   0.0061   0.000  0.006  0.000
    20 C   0.0003   0.000  0.000  0.000
    21 C   0.0057  -0.000  0.006  0.000
    22 C   0.0000  -0.000  0.000  0.000
    23 C   0.0058   0.000  0.006  0.000
    24 C   0.0004   0.000  0.000  0.000
    25 C   0.0007   0.000  0.001  0.000
    26 C   0.0000  -0.000  0.000  0.000
    27 C   0.0006  -0.000  0.001  0.000
    28 C  -0.0000  -0.000  0.000  0.000
    29 C   0.0012   0.000  0.001  0.000
    30 O   0.0001   0.000  0.000  0.000
    31 C  -0.0000  -0.000  0.000  0.000
    32 C  -0.0000  -0.000  0.000  0.000
    33 O   0.0000   0.000  0.000  0.000
    34 C   0.0000  -0.000  0.000  0.000
    35 C   0.0000   0.000  0.000  0.000
    36 O   0.0016   0.000  0.002  0.000
    37 C   0.0000   0.000  0.000  0.000
    38 C   0.0000   0.000  0.000  0.000
    39 O   0.0002   0.000  0.000  0.000
    40 C   0.0000   0.000  0.000  0.000
    41 C   0.0001   0.000  0.000  0.000
    42 C   0.0006   0.000  0.001  0.000
    43 C   0.0136   0.000  0.014  0.000
    44 C   0.0001  -0.000  0.000  0.000
    45 C   0.0153  -0.000  0.015  0.000
    46 C   0.0002  -0.000  0.000  0.000
    47 C   0.0121   0.000  0.012  0.000
    48 C   0.0002  -0.000  0.000  0.000
    49 S   0.0019   0.000  0.001  0.000
    50 C   0.0063  -0.000  0.006  0.000
    51 C   0.0002  -0.000  0.000  0.000
    52 C   0.0072  -0.000  0.007  0.000
    53 F   0.0015   0.000  0.001  0.000
    54 H   0.0287   0.029  0.000  0.000
    55 H  -0.0000  -0.000  0.000  0.000
    56 H   0.0000   0.000  0.000  0.000
    57 H  -0.0000  -0.000  0.000  0.000
    58 H   0.0000   0.000  0.000  0.000
    59 H   0.0001   0.000  0.000  0.000
    60 H   0.0012   0.001  0.000  0.000
    61 H   0.0001   0.000  0.000  0.000
    62 H  -0.0000  -0.000  0.000  0.000
    63 H   0.0000   0.000  0.000  0.000
    64 H   0.0000   0.000  0.000  0.000
    65 H   0.0000   0.000  0.000  0.000
    66 H   0.0000   0.000  0.000  0.000
    67 H   0.0000   0.000  0.000  0.000
    68 H  -0.0000  -0.000  0.000  0.000
    69 H   0.0000   0.000  0.000  0.000
    70 H   0.0000   0.000  0.000  0.000
    71 H   0.0000   0.000  0.000  0.000
    72 H   0.0000   0.000  0.000  0.000
    73 H   0.0001   0.000  0.000  0.000
    74 H   0.0001   0.000  0.000  0.000
    75 H   0.0000   0.000  0.000  0.000
    76 H   0.0000   0.000  0.000  0.000
    77 H   0.0000   0.000  0.000  0.000
    78 H   0.0000   0.000  0.000  0.000
    79 H   0.0000   0.000  0.000  0.000
    80 H   0.0000   0.000  0.000  0.000
    81 H   0.0000   0.000  0.000  0.000
    82 H   0.0000   0.000  0.000  0.000
    83 H   0.0001   0.000  0.000  0.000
    84 H   0.0001   0.000  0.000  0.000
    85 H   0.0000   0.000  0.000  0.000
    86 H   0.0000   0.000  0.000  0.000
    87 H   0.0000   0.000  0.000  0.000
    88 H   0.0000   0.000  0.000  0.000

Wiberg/Mayer (AO) data.
largest (>0.10) Wiberg bond orders for each atom
          total WBO             WBO to atom ...
     1  C   2.126        C    6 0.964    C    2 0.561    H   54 0.425
     2  C   2.322        F   11 0.834    C    1 0.561    C    3 0.337    H   54 0.316    C    6 0.144
     3  C   2.008        C    4 0.850    F   12 0.672    C    2 0.337
     4  C   3.648        C   17 1.270    C    5 1.235    C    3 0.850    H   54 0.126
     5  C   3.922        N    7 1.394    C    4 1.235    C    6 1.155
     6  C   3.724        N   10 1.294    C    5 1.155    C    1 0.964    C    2 0.144
     7  N   2.768        C    8 1.508    C    5 1.394
     8  C   3.883        N    7 1.508    C    9 1.231    C   18 1.076
     9  C   3.928        N   10 1.565    C    8 1.231    C   24 1.080
    10  N   2.725        C    9 1.565    C    6 1.294
    11  F   0.978        C    2 0.834
    12  F   0.549        C    3 0.672
    13  C   3.861        C   17 1.466    C   14 1.360    H   55 1.004
    14  C   3.875        C   15 1.496    C   13 1.360    H   56 1.003
    15  C   3.841        C   14 1.496    S   16 1.170    C   42 1.148
    16  S   2.615        C   15 1.170    C   17 1.147
    17  C   3.936        C   13 1.466    C    4 1.270    S   16 1.147
    18  C   3.895        C   19 1.399    C   23 1.399    C    8 1.076
    19  C   3.784        C   20 1.424    C   18 1.399    H   57 1.004
    20  C   3.881        C   19 1.424    C   21 1.342    O   39 1.099
    21  C   3.914        C   22 1.394    C   20 1.342    O   36 1.095
    22  C   3.902        C   23 1.451    C   21 1.394    H   58 0.987
    23  C   3.836        C   22 1.451    C   18 1.399    H   59 0.994
    24  C   3.918        C   25 1.405    C   29 1.400    C    9 1.080
    25  C   3.872        C   26 1.444    C   24 1.405    H   60 0.997
    26  C   3.850        C   25 1.444    C   27 1.409    H   61 0.992
    27  C   3.852        C   26 1.409    C   28 1.342    O   30 1.078
    28  C   3.945        C   29 1.419    C   27 1.342    O   33 1.097
    29  C   3.847        C   28 1.419    C   24 1.400    H   62 0.999
    30  O   2.098        C   27 1.078    C   31 0.983
    31  C   3.912        H   63 0.998    H   64 0.997    C   32 0.993    O   30 0.983
    32  C   3.947        H   65 1.001    H   67 1.001    C   31 0.993    H   66 0.986
    33  O   2.145        C   28 1.097    C   34 0.980
    34  C   3.930        H   68 1.002    H   69 1.000    C   35 0.988    O   33 0.980
    35  C   3.956        H   70 1.001    H   72 1.000    C   34 0.988    H   71 0.987
    36  O   2.139        C   21 1.095    C   37 0.983
    37  C   3.928        H   74 1.001    H   73 1.000    C   38 0.987    O   36 0.983
    38  C   3.957        H   75 1.002    H   77 1.002    H   76 0.989    C   37 0.987
    39  O   2.140        C   20 1.099    C   40 0.950
    40  C   3.893        H   79 0.999    H   78 0.996    C   41 0.984    O   39 0.950
    41  C   3.600        H   80 1.027    C   40 0.984    H   82 0.869    H   81 0.824
    42  C   3.861        C   43 1.361    C   47 1.352    C   15 1.148
    43  C   3.705        C   44 1.510    C   42 1.361    H   83 0.841
    44  C   3.772        C   43 1.510    C   45 1.369    H   84 0.895
    45  C   3.890        C   46 1.381    C   44 1.369    C   48 1.133
    46  C   3.766        C   47 1.492    C   45 1.381    H   85 0.847
    47  C   3.932        C   46 1.492    C   42 1.352    F   53 0.981
    48  C   3.924        C   52 1.582    S   49 1.163    C   45 1.133
    49  S   2.546        C   50 1.190    C   48 1.163
    50  C   3.813        C   51 1.642    S   49 1.190    H   86 0.901
    51  C   3.855        C   50 1.642    C   52 1.285    H   87 0.905
    52  C   3.785        C   48 1.582    C   51 1.285    H   88 0.907
    53  F   0.831        C   47 0.981
    54  H   0.970        C    1 0.425    C    2 0.316    C    4 0.126
    55  H   1.095        C   13 1.004
    56  H   1.066        C   14 1.003
    57  H   1.061        C   19 1.004
    58  H   1.033        C   22 0.987
    59  H   1.046        C   23 0.994
    60  H   1.048        C   25 0.997
    61  H   1.029        C   26 0.992
    62  H   1.049        C   29 0.999
    63  H   1.025        C   31 0.998
    64  H   1.025        C   31 0.997
    65  H   1.023        C   32 1.001
    66  H   1.024        C   32 0.986
    67  H   1.025        C   32 1.001
    68  H   1.024        C   34 1.002
    69  H   1.026        C   34 1.000
    70  H   1.023        C   35 1.001
    71  H   1.022        C   35 0.987
    72  H   1.022        C   35 1.000
    73  H   1.053        C   37 1.000
    74  H   1.019        C   37 1.001
    75  H   1.027        C   38 1.002
    76  H   1.022        C   38 0.989
    77  H   1.025        C   38 1.002
    78  H   1.034        C   40 0.996
    79  H   1.061        C   40 0.999
    80  H   1.082        C   41 1.027
    81  H   0.925        C   41 0.824
    82  H   0.972        C   41 0.869
    83  H   0.961        C   43 0.841
    84  H   0.964        C   44 0.895
    85  H   0.961        C   46 0.847
    86  H   0.934        C   50 0.901
    87  H   0.949        C   51 0.905
    88  H   0.949        C   52 0.907

 dipole moment from electron density (au)
     X       Y       Z   
  -5.0105   2.0936   0.2826  total (Debye):   13.821


           -------------------------------------------------
          | TOTAL ENERGY             -173.743064622218 Eh   |
          | GRADIENT NORM               0.307630914804 Eh/α |
          | HOMO-LUMO GAP               0.815836504944 eV   |
           -------------------------------------------------

------------------------------------------------------------------------
 * finished run on 2021/12/02 at 16:24:16.409     
------------------------------------------------------------------------
 total:
 * wall-time:     0 d,  0 h,  0 min,  3.487 sec
 *  cpu-time:     0 d,  0 h,  0 min,  3.486 sec
 * ratio c/w:     1.000 speedup
 SCF:
 * wall-time:     0 d,  0 h,  0 min,  2.947 sec
 *  cpu-time:     0 d,  0 h,  0 min,  2.947 sec
 * ratio c/w:     1.000 speedup

