      -----------------------------------------------------------      
     |                   =====================                   |     
     |                           x T B                           |     
     |                   =====================                   |     
     |                         S. Grimme                         |     
     |          Mulliken Center for Theoretical Chemistry        |     
     |                    University of Bonn                     |     
     |                Version 6.2 RC2 (SAW190805)                |     
      -----------------------------------------------------------      

   This program is distributed in the hope that it will be useful,
   but WITHOUT ANY WARRANTY; without even the implied warranty of
   MERCHANTABILITY or FITNESS FOR A PARTICULAR PURPOSE.
   
   FOR NON-COMMERCIAL, ACADEMIA USE ONLY.
   
   Cite this work as:
   * S. Grimme, C. Bannwarth, P. Shushkov, J. Chem. Theory Comput., 2017,
     13, 1989-2009. DOI: 10.1021/acs.jctc.7b00118
   * C. Bannwarth, S. Ehlert and S. Grimme., J. Chem. Theory Comput., 2019,
     15, 1652-1671. DOI: 10.1021/acs.jctc.8b01176
   * P. Pracht, E. Caldeweyher, S. Ehlert, S. Grimme, ChemRxiv, 2019, preprint.
     DOI: 10.26434/chemrxiv.8326202.v1
   
   for DFT-D4:
   * E. Caldeweyher, C. Bannwarth and S. Grimme, J. Chem. Phys., 2017,
     147, 034112. DOI: 10.1063/1.4993215
   * E. Caldeweyher, S. Ehlert, A. Hansen, H. Neugebauer, S. Spicher,
     C. Bannwarth and S. Grimme, J. Chem. Phys., 2019, 150, 154122.
     DOI: 10.1063/1.5090222
   
   for sTDA-xTB:
   * S. Grimme and C. Bannwarth, J. Chem. Phys., 2016, 145, 054103.
     DOI: 10.1063/1.4959605
   
   in the mass-spec context:
   * V. Asgeirsson, C. Bauer and S. Grimme, Chem. Sci., 2017, 8, 4879.
     DOI: 10.1039/c7sc00601b
   
   for metadynamics refer to:
   * S. Grimme, J. Chem. Theory Comput., 2019, 155, 2847-2862
     DOI: 10.1021/acs.jctc.9b00143
   
   with help from (in alphabetical order)
   C. Bannwarth, F. Bohle, G. Brandenburg, E. Caldeweyher, M. Checinski,
   S. Dohm, S. Ehlert, S. Ehrlich, F. März, H. Neugebauer, J. Pisarek,
   P. Pracht, P. Shushkov, and S. Spicher.
   
 * started run on 2021/12/02 at 16:24:16.423     

           -------------------------------------------------
          |                Calculation Setup                |
           -------------------------------------------------

          program call               : /ihome/ghutchison/geoffh/xtb/xtb P3_yang.xyz --vipea
          hostname                   : smp-n73
          coordinate file            : P3_yang.xyz
          omp threads                :                     1
          number of atoms            :                    88
          number of electrons        :                   276
          charge                     :                     0
          spin                       :                   0.0
          first test random number   :      0.34130975697717


########################################################################
# WARNING! Please study the warnings concerning your input carefully
#  - XTBPATH is not set, using XTBHOME instead
########################################################################

           ------------------------------------------------- 
          |                 I P E A - x T B                 |
          |  Ionisation Potentials and Electron Affinities  |
           ------------------------------------------------- 
             KAB for M(3d)-M(3d) :                1.1000
             KAB for M(4d)-M(4d) :                1.2000
             KAB for M(5d)-M(5d) :                1.2000
             k(s)                :                2.1500
             k(p)                :                2.3000
             k(d)                :                2.0000
             k(f)                :                0.0000
             kEN (H0ij)          :                0.7000
             D3 a1               :                0.6300
             D3 a2               :                5.0000
             D3 s6               :                1.0000
             D3 s8               :                2.4000
             D3 s9               :                0.0000
             alphaj              :                1.0000
             XBdamp              :                0.4400
             XBrad               :                1.3000
             kcnsh               :      1.0000   -0.3000   -0.5000    0.5000

  Z AO/shell   Hii/eV     exponent
  1     Thu Sep 22 23:34:11 CEST 2016   EN: 2.200 GAM: 0.405  GM3: 0.1500
     1s    -10.521941    1.306199
     2s     -3.560151    0.398421
  6     Thu Sep 22 23:34:11 CEST 2016   EN: 2.550 GAM: 0.640  GM3: 0.1500
     2s    -15.968100    1.979793
     2p     -9.777107    1.850537
     3S     -3.366990    0.633095
  7     Thu Sep 22 23:34:11 CEST 2016   EN: 3.040 GAM: 0.493  GM3:-0.1000
     2s    -24.040776    2.126160
     2p    -14.426520    2.068425
     3S     -5.882278    0.671040
  8     Thu Sep 22 23:34:11 CEST 2016   EN: 3.440 GAM: 0.717  GM3:-0.2000
     2s    -26.695120    2.575264
     2p    -16.014457    2.159448
     3S     -6.622058    0.958679
  9     Tue Jan 17 20:22:52 CET 2017    EN: 3.980 GAM: 0.574  GM3: 0.2000
     2s    -27.565998    2.304073
     2p    -17.439238    2.314354
     3S     -6.120500    0.570243
 16     Tue Jan 17 20:57:36 CET 2017    EN: 2.580 GAM: 0.455  GM3: 0.1020
     3s    -24.488821    2.492075
     3p    -12.136640    1.997904
     3d     -1.796070    1.747541

           ------------------------------------------------- 
          |        Self-Consistent Charge Iterations        |
           ------------------------------------------------- 

          ...................................................
          :                      SETUP                      :
          :.................................................:
          :  # basis functions                 348          :
          :  # atomic orbitals                 346          :
          :  # shells                          230          :
          :  # electrons                       276          :
          :  # halogen bonds                     0          :
          :  max. iterations                   250          :
          :  Hamiltonian                  GFN1-xTB          :
          :  restarted?                      false          :
          :  GBSA solvation                  false          :
          :  PC potential                    false          :
          :  electronic temp.          300.0000000     K    :
          :  accuracy                    1.0000000          :
          :  -> integral cutoff          0.2500000E+02      :
          :  -> integral neglect         0.1000000E-07      :
          :  -> SCF convergence          0.1000000E-05 Eh   :
          :  -> wf. convergence          0.2000000E-04 e    :
          :  Broyden damping             0.4000000          :
          ...................................................

 iter      E             dE          RMSdq      gap      omega  full diag
   1   -167.8630838 -0.167863E+03  0.997E+00    0.33       0.0  T
   2   -163.5162611  0.434682E+01  0.777E+00    0.19       1.0  T
   3   -165.8891084 -0.237285E+01  0.574E+00    0.25       1.0  T
   4   -172.9236255 -0.703452E+01  0.241E+00    1.12       1.0  T
   5   -174.1299308 -0.120631E+01  0.124E+00    1.45       1.0  T
   6   -174.2173727 -0.874418E-01  0.969E-01    1.85       1.0  T
   7   -174.2628143 -0.454417E-01  0.689E-01    1.57       1.0  T
   8   -174.2965179 -0.337036E-01  0.285E-01    0.81       1.0  T
   9   -174.3076029 -0.110850E-01  0.136E-01    0.91       1.0  T
  10   -174.3136786 -0.607572E-02  0.627E-02    0.63       1.0  T
  11   -174.3141491 -0.470544E-03  0.421E-02    0.60       1.0  T
  12   -174.3141709 -0.217725E-04  0.387E-02    0.51       1.0  T
  13   -174.3143825 -0.211589E-03  0.134E-02    0.47       1.0  T
  14   -174.3144287 -0.461849E-04  0.696E-03    0.50       1.5  T
  15   -174.3144422 -0.134967E-04  0.262E-03    0.51       4.1  T
  16   -174.3144438 -0.162274E-05  0.125E-03    0.52       8.5  T
  17   -174.3144440 -0.230142E-06  0.422E-04    0.52      25.3  T
  18   -174.3144441 -0.405846E-07  0.184E-04    0.52      58.0  T
  19   -174.3144441 -0.736176E-08  0.663E-05    0.52     160.7  T

   *** convergence criteria satisfied after 19 iterations ***

         #    Occupation            Energy/Eh            Energy/eV
      -------------------------------------------------------------
         1        2.0000           -1.0651737             -28.9849
       ...           ...                  ...                  ...
       132        2.0000           -0.3627449              -9.8708
       133        2.0000           -0.3565328              -9.7018
       134        2.0000           -0.3546278              -9.6499
       135        2.0000           -0.3482073              -9.4752
       136        2.0000           -0.3473048              -9.4506
       137        2.0000           -0.3377407              -9.1904
       138        1.9999           -0.3233695              -8.7993 (HOMO)
       139        0.0001           -0.3042670              -8.2795 (LUMO)
       140                         -0.2678542              -7.2887
       141                         -0.2397207              -6.5231
       142                         -0.2339037              -6.3648
       143                         -0.2231116              -6.0712
       ...                                ...                  ...
       346                        551.4687973           15006.2298
      -------------------------------------------------------------
                  HL-Gap            0.0191025 Eh            0.5198 eV
             Fermi-level           -0.3138183 Eh           -8.5394 eV

 SCC (total)                   0 d,  0 h,  0 min,  1.072 sec
 SCC setup                      ...        0 min,  0.003 sec (  0.275%)
 Dispersion                     ...        0 min,  0.000 sec (  0.023%)
 integral evaluation            ...        0 min,  0.535 sec ( 49.934%)
 zeroth order Hamiltonian       ...        0 min,  0.003 sec (  0.242%)
 iterations                     ...        0 min,  0.332 sec ( 31.018%)
 molecular gradient             ...        0 min,  0.196 sec ( 18.263%)
 printout                       ...        0 min,  0.003 sec (  0.240%)

         :::::::::::::::::::::::::::::::::::::::::::::::::::::
         ::                     SUMMARY                     ::
         :::::::::::::::::::::::::::::::::::::::::::::::::::::
         :: total energy            -171.600274551826 Eh    ::
         :: gradient norm              0.257079590806 Eh/a0 ::
         :: HOMO-LUMO gap              0.519806536835 eV    ::
         ::.................................................::
         :: SCC energy              -174.314444079718 Eh    ::
         :: -> electrostatic           0.413142493580 Eh    ::
         :: repulsion energy           2.785872741668 Eh    ::
         :: dispersion energy         -0.071703213777 Eh    ::
         :: halogen bond corr.         0.000000000000 Eh    ::
         :: add. restraining           0.000000000000 Eh    ::
         :::::::::::::::::::::::::::::::::::::::::::::::::::::

           ------------------------------------------------- 
          |        vertical delta SCC IP calculation        |
           ------------------------------------------------- 

          ...................................................
          :                      SETUP                      :
          :.................................................:
          :  # basis functions                 348          :
          :  # atomic orbitals                 346          :
          :  # shells                          230          :
          :  # electrons                       275          :
          :  # halogen bonds                     0          :
          :  max. iterations                   250          :
          :  Hamiltonian                  GFN1-xTB          :
          :  restarted?                       true          :
          :  GBSA solvation                  false          :
          :  PC potential                    false          :
          :  electronic temp.          300.0000000     K    :
          :  accuracy                    1.0000000          :
          :  -> integral cutoff          0.2500000E+02      :
          :  -> integral neglect         0.1000000E-07      :
          :  -> SCF convergence          0.1000000E-05 Eh   :
          :  -> wf. convergence          0.2000000E-04 e    :
          :  Broyden damping             0.4000000          :
          ...................................................

 iter      E             dE          RMSdq      gap      omega  full diag
   1   -173.9160348 -0.173916E+03  0.301E-01    0.52       0.0  T
   2   -173.7764913  0.139544E+00  0.814E-01    0.88       1.0  T
   3   -173.9226651 -0.146174E+00  0.261E-01    1.11       1.0  T
   4   -173.9375007 -0.148356E-01  0.134E-01    0.96       1.0  T
   5   -173.9395242 -0.202357E-02  0.862E-02    1.02       1.0  T
   6   -173.9404197 -0.895490E-03  0.395E-02    1.03       1.0  T
   7   -173.9406244 -0.204647E-03  0.182E-02    1.03       1.0  T
   8   -173.9406590 -0.346295E-04  0.105E-02    1.02       1.0  T
   9   -173.9406840 -0.250565E-04  0.452E-03    1.03       2.4  T
  10   -173.9406879 -0.387904E-05  0.308E-03    1.02       3.5  T
  11   -173.9406903 -0.240413E-05  0.127E-03    1.02       8.4  T
  12   -173.9406908 -0.437245E-06  0.400E-04    1.02      26.6  T
  13   -173.9406908 -0.398245E-07  0.181E-04    1.02      58.9  T
  14   -173.9406908 -0.443461E-08  0.813E-05    1.02     131.2  T

   *** convergence criteria satisfied after 14 iterations ***

         #    Occupation            Energy/Eh            Energy/eV
      -------------------------------------------------------------
         1        2.0000           -1.1439495             -31.1285
       ...           ...                  ...                  ...
       132        2.0000           -0.4451019             -12.1118
       133        2.0000           -0.4380830             -11.9208
       134        2.0000           -0.4365732             -11.8798
       135        2.0000           -0.4363711             -11.8743
       136        1.9995           -0.4308515             -11.7241
       137        1.8762           -0.4254028             -11.5758
       138        1.1243           -0.4216884             -11.4747 (HOMO)
       139                         -0.3840631             -10.4509 (LUMO)
       140                         -0.3486953              -9.4885
       141                         -0.3276606              -8.9161
       142                         -0.3072464              -8.3606
       143                         -0.2903281              -7.9002
       ...                                ...                  ...
       346                        551.3951837           15004.2267
      -------------------------------------------------------------
                  HL-Gap            0.0376253 Eh            1.0238 eV
             Fermi-level           -0.4132049 Eh          -11.2439 eV

 SCC (total)                   0 d,  0 h,  0 min,  0.976 sec
 SCC setup                      ...        0 min,  0.003 sec (  0.284%)
 Dispersion                     ...        0 min,  0.000 sec (  0.016%)
 integral evaluation            ...        0 min,  0.534 sec ( 54.758%)
 zeroth order Hamiltonian       ...        0 min,  0.002 sec (  0.242%)
 iterations                     ...        0 min,  0.238 sec ( 24.421%)
 molecular gradient             ...        0 min,  0.195 sec ( 20.012%)
 printout                       ...        0 min,  0.003 sec (  0.261%)

         :::::::::::::::::::::::::::::::::::::::::::::::::::::
         ::                     SUMMARY                     ::
         :::::::::::::::::::::::::::::::::::::::::::::::::::::
         :: total energy            -171.226521282237 Eh    ::
         :: gradient norm              0.246424014967 Eh/a0 ::
         :: HOMO-LUMO gap              1.023836838445 eV    ::
         ::.................................................::
         :: SCC energy              -173.940690810128 Eh    ::
         :: -> electrostatic           0.445094482080 Eh    ::
         :: repulsion energy           2.785872741668 Eh    ::
         :: dispersion energy         -0.071703213777 Eh    ::
         :: halogen bond corr.         0.000000000000 Eh    ::
         :: add. restraining           0.000000000000 Eh    ::
         :::::::::::::::::::::::::::::::::::::::::::::::::::::

------------------------------------------------------------------------
empirical IP shift (eV):    4.8455
delta SCC IP (eV):    5.3248
------------------------------------------------------------------------
           ------------------------------------------------- 
          |        vertical delta SCC EA calculation        |
           ------------------------------------------------- 

          ...................................................
          :                      SETUP                      :
          :.................................................:
          :  # basis functions                 348          :
          :  # atomic orbitals                 346          :
          :  # shells                          230          :
          :  # electrons                       277          :
          :  # halogen bonds                     0          :
          :  max. iterations                   250          :
          :  Hamiltonian                  GFN1-xTB          :
          :  restarted?                       true          :
          :  GBSA solvation                  false          :
          :  PC potential                    false          :
          :  electronic temp.          300.0000000     K    :
          :  accuracy                    1.0000000          :
          :  -> integral cutoff          0.2500000E+02      :
          :  -> integral neglect         0.1000000E-07      :
          :  -> SCF convergence          0.1000000E-05 Eh   :
          :  -> wf. convergence          0.2000000E-04 e    :
          :  Broyden damping             0.4000000          :
          ...................................................

 iter      E             dE          RMSdq      gap      omega  full diag
   1   -174.3825805 -0.174383E+03  0.777E-01    0.96       0.0  T
   2   -173.9910866  0.391494E+00  0.102E+00    0.24       1.0  T
   3   -174.4904565 -0.499370E+00  0.451E-01    0.19       1.0  T
   4   -174.4326462  0.578102E-01  0.521E-01    0.24       1.0  T
   5   -174.5238728 -0.912266E-01  0.220E-01    0.04       1.0  T
   6   -174.5219609  0.191188E-02  0.249E-01    0.03       1.0  T
   7   -174.5344531 -0.124921E-01  0.175E-01    0.08       1.0  T
   8   -174.5344514  0.164997E-05  0.151E-01    0.02       1.0  T
   9   -174.5392810 -0.482956E-02  0.699E-02    0.04       1.0  T
  10   -174.5390888  0.192223E-03  0.781E-02    0.04       1.0  T
  11   -174.5413430 -0.225420E-02  0.110E-02    0.04       1.0  T
  12   -174.5413878 -0.448126E-04  0.510E-03    0.04       2.1  T
  13   -174.5413896 -0.181474E-05  0.549E-03    0.04       1.9  T
  14   -174.5413974 -0.784450E-05  0.983E-04    0.04      10.8  T
  15   -174.5413973  0.159606E-06  0.109E-03    0.04       9.7  T
  16   -174.5413977 -0.462888E-06  0.340E-04    0.04      31.3  T
  17   -174.5413978 -0.412202E-07  0.925E-05    0.04     115.2  T
  18   -174.5413978 -0.968413E-09  0.698E-05    0.04     152.7  T

   *** convergence criteria satisfied after 18 iterations ***

         #    Occupation            Energy/Eh            Energy/eV
      -------------------------------------------------------------
         1        2.0000           -0.9821884             -26.7267
       ...           ...                  ...                  ...
       133        2.0000           -0.2815542              -7.6615
       134        2.0000           -0.2772862              -7.5453
       135        2.0000           -0.2717332              -7.3942
       136        2.0000           -0.2664111              -7.2494
       137        2.0000           -0.2482224              -6.7545
       138        2.0000           -0.2444061              -6.6506
       139        0.6017           -0.1736382              -4.7249 (HOMO)
       140        0.2462           -0.1721829              -4.6853 (LUMO)
       141        0.1521           -0.1716139              -4.6699
       142        0.0000           -0.1602421              -4.3604
       143        0.0000           -0.1594530              -4.3389
       144                         -0.1473460              -4.0095
       ...                                ...                  ...
       346                        551.5509733           15008.4659
      -------------------------------------------------------------
                  HL-Gap            0.0014553 Eh            0.0396 eV
             Fermi-level           -0.1911342 Eh           -5.2010 eV

 SCC (total)                   0 d,  0 h,  0 min,  1.042 sec
 SCC setup                      ...        0 min,  0.002 sec (  0.218%)
 Dispersion                     ...        0 min,  0.000 sec (  0.016%)
 integral evaluation            ...        0 min,  0.532 sec ( 51.043%)
 zeroth order Hamiltonian       ...        0 min,  0.002 sec (  0.226%)
 iterations                     ...        0 min,  0.304 sec ( 29.205%)
 molecular gradient             ...        0 min,  0.196 sec ( 18.842%)
 printout                       ...        0 min,  0.005 sec (  0.445%)

         :::::::::::::::::::::::::::::::::::::::::::::::::::::
         ::                     SUMMARY                     ::
         :::::::::::::::::::::::::::::::::::::::::::::::::::::
         :: total energy            -171.827228252854 Eh    ::
         :: gradient norm              0.269624713935 Eh/a0 ::
         :: HOMO-LUMO gap              0.039600708609 eV    ::
         ::.................................................::
         :: SCC energy              -174.541397780745 Eh    ::
         :: -> electrostatic           0.456327356027 Eh    ::
         :: repulsion energy           2.785872741668 Eh    ::
         :: dispersion energy         -0.071703213777 Eh    ::
         :: halogen bond corr.         0.000000000000 Eh    ::
         :: add. restraining           0.000000000000 Eh    ::
         :::::::::::::::::::::::::::::::::::::::::::::::::::::

------------------------------------------------------------------------
empirical EA shift (eV):    4.8455
delta SCC EA (eV):    1.3302
------------------------------------------------------------------------
           -------------------------------------------------
          |                Property Printout                |
           -------------------------------------------------

    * Orbital Energies and Occupations

         #    Occupation            Energy/Eh            Energy/eV
      -------------------------------------------------------------
         1        2.0000           -0.9821884             -26.7267
       ...           ...                  ...                  ...
       127        2.0000           -0.3158673              -8.5952
       128        2.0000           -0.3097055              -8.4275
       129        2.0000           -0.3083524              -8.3907
       130        2.0000           -0.3046092              -8.2888
       131        2.0000           -0.2956213              -8.0443
       132        2.0000           -0.2885488              -7.8518
       133        2.0000           -0.2815542              -7.6615
       134        2.0000           -0.2772862              -7.5453
       135        2.0000           -0.2717332              -7.3942
       136        2.0000           -0.2664111              -7.2494
       137        2.0000           -0.2482224              -6.7545
       138        2.0000           -0.2444061              -6.6506
       139        0.6017           -0.1736382              -4.7249 (HOMO)
       140        0.2462           -0.1721829              -4.6853 (LUMO)
       141        0.1521           -0.1716139              -4.6699
       142        0.0000           -0.1602421              -4.3604
       143        0.0000           -0.1594530              -4.3389
       144                         -0.1473460              -4.0095
       145                         -0.1438358              -3.9140
       146                         -0.1268000              -3.4504
       147                         -0.1190796              -3.2403
       148                         -0.1093666              -2.9760
       149                         -0.1045433              -2.8448
       150                         -0.1016616              -2.7664
       ...                                ...                  ...
       346                        551.5509733           15008.4659
      -------------------------------------------------------------
                  HL-Gap            0.0014553 Eh            0.0396 eV
             Fermi-level           -0.1911342 Eh           -5.2010 eV

  Mulliken/CM5 charges        n(s)   n(p)   n(d)
     1 C  -0.38495 -0.42686   1.033  2.582  0.000
     2 C  -0.40520 -0.38832   1.078  2.517  0.000
     3 C  -0.45130 -0.43151   1.325  2.223  0.000
     4 C   0.17139  0.17939   1.002  3.169  0.000
     5 C  -0.02716  0.05418   1.088  2.885  0.000
     6 C   0.07042  0.14650   1.088  2.983  0.000
     7 N   0.22614  0.02827   1.281  3.945  0.000
     8 C  -0.06573  0.01705   1.096  2.838  0.000
     9 C  -0.06325  0.02020   1.107  2.830  0.000
    10 N   0.28354  0.09688   1.319  3.965  0.000
    11 F   0.42138  0.39852   1.778  5.643  0.000
    12 F   0.37336  0.34847   1.771  5.602  0.000
    13 C   0.05711  0.00638   1.060  2.997  0.000
    14 C   0.04841 -0.00244   1.071  2.978  0.000
    15 C   0.01771  0.02693   1.126  2.891  0.000
    16 S   0.12516  0.09381   1.889  4.092  0.144
    17 C  -0.00887  0.00383   1.137  2.855  0.000
    18 C   0.00756  0.00541   1.075  2.933  0.000
    19 C   0.03659 -0.01122   1.049  2.987  0.000
    20 C  -0.08154 -0.06196   1.090  2.828  0.000
    21 C  -0.08053 -0.05879   1.107  2.813  0.000
    22 C   0.04193 -0.00857   1.076  2.966  0.000
    23 C   0.03665 -0.01635   1.058  2.979  0.000
    24 C   0.00427  0.00236   1.089  2.915  0.000
    25 C   0.03511 -0.01638   1.076  2.959  0.000
    26 C   0.04115 -0.01125   1.055  2.986  0.000
    27 C  -0.08291 -0.06320   1.077  2.840  0.000
    28 C  -0.08772 -0.06629   1.105  2.807  0.000
    29 C   0.03174 -0.01548   1.070  2.962  0.000
    30 O   0.23750  0.14492   1.590  4.647  0.000
    31 C  -0.05879 -0.14232   1.120  2.821  0.000
    32 C   0.05868 -0.09076   1.089  2.970  0.000
    33 O   0.23703  0.15152   1.597  4.640  0.000
    34 C  -0.05857 -0.14059   1.124  2.817  0.000
    35 C   0.05901 -0.09023   1.090  2.969  0.000
    36 O   0.24315  0.15774   1.597  4.646  0.000
    37 C  -0.05824 -0.14058   1.128  2.814  0.000
    38 C   0.05884 -0.09037   1.086  2.973  0.000
    39 O   0.26839  0.17489   1.623  4.645  0.000
    40 C  -0.02610 -0.11008   1.127  2.847  0.000
    41 C   0.56447  0.41446   0.915  3.649  0.000
    42 C   0.01916  0.01729   1.079  2.940  0.000
    43 C   0.14837  0.10065   1.054  3.094  0.000
    44 C  -0.06874 -0.05515   1.144  2.787  0.000
    45 C   0.02997  0.02827   1.091  2.939  0.000
    46 C   0.16341  0.11647   1.066  3.097  0.000
    47 C  -0.07162 -0.05760   1.146  2.783  0.000
    48 C   0.02563  0.03472   1.149  2.877  0.000
    49 S   0.22343  0.18263   1.873  4.258  0.092
    50 C   0.16465  0.12540   1.181  2.984  0.000
    51 C   0.23056  0.17650   1.080  3.151  0.000
    52 C   0.19330  0.14237   1.088  3.105  0.000
    53 F   0.19071  0.16500   1.669  5.522  0.000
    54 F   0.15751  0.12984   1.619  5.538  0.000
    55 H   0.20789  0.26898   1.208  0.000  0.000
    56 H   0.01595  0.07617   1.016  0.000  0.000
    57 H   0.00669  0.06629   1.007  0.000  0.000
    58 H   0.00627  0.07524   1.006  0.000  0.000
    59 H  -0.01045  0.05072   0.990  0.000  0.000
    60 H  -0.00293  0.05732   0.997  0.000  0.000
    61 H  -0.00425  0.05721   0.996  0.000  0.000
    62 H  -0.01565  0.04515   0.984  0.000  0.000
    63 H  -0.00887  0.05611   0.991  0.000  0.000
    64 H  -0.02118  0.04139   0.979  0.000  0.000
    65 H  -0.02275  0.03986   0.977  0.000  0.000
    66 H  -0.00950  0.04503   0.990  0.000  0.000
    67 H  -0.00828  0.04397   0.992  0.000  0.000
    68 H  -0.01028  0.04426   0.990  0.000  0.000
    69 H  -0.02321  0.04341   0.977  0.000  0.000
    70 H  -0.02477  0.04253   0.975  0.000  0.000
    71 H  -0.00874  0.04574   0.991  0.000  0.000
    72 H  -0.00647  0.04577   0.994  0.000  0.000
    73 H  -0.01069  0.04395   0.989  0.000  0.000
    74 H  -0.01178  0.05658   0.988  0.000  0.000
    75 H  -0.01321  0.05381   0.987  0.000  0.000
    76 H  -0.00668  0.04783   0.993  0.000  0.000
    77 H  -0.00277  0.04949   0.997  0.000  0.000
    78 H  -0.01187  0.04263   0.988  0.000  0.000
    79 H   0.02915  0.09394   1.029  0.000  0.000
    80 H  -0.00986  0.05529   0.990  0.000  0.000
    81 H  -0.25819 -0.20418   0.742  0.000  0.000
    82 H  -0.29267 -0.24049   0.707  0.000  0.000
    83 H  -0.27086 -0.21606   0.729  0.000  0.000
    84 H  -0.28414 -0.22113   0.716  0.000  0.000
    85 H  -0.29411 -0.23209   0.706  0.000  0.000
    86 H  -0.26060 -0.20277   0.739  0.000  0.000
    87 H  -0.29515 -0.23858   0.705  0.000  0.000
    88 H  -0.28823 -0.22790   0.712  0.000  0.000
(R)spin-density population

 Mulliken population n(s)   n(p)   n(d)
     1 C  -0.0032  -0.009  0.005  0.000
     2 C   0.0138  -0.004  0.018  0.000
     3 C   0.2938   0.275  0.019  0.000
     4 C  -0.0138  -0.017  0.003  0.000
     5 C   0.0027  -0.007  0.010  0.000
     6 C   0.0138  -0.012  0.026  0.000
     7 N   0.0370  -0.011  0.048  0.000
     8 C   0.0249  -0.003  0.028  0.000
     9 C   0.0077  -0.004  0.011  0.000
    10 N   0.0429  -0.011  0.053  0.000
    11 F   0.1130   0.110  0.003  0.000
    12 F   0.1580   0.149  0.008  0.000
    13 C  -0.0009  -0.003  0.002  0.000
    14 C  -0.0057  -0.007  0.002  0.000
    15 C  -0.0020  -0.005  0.003  0.000
    16 S   0.0041  -0.000  0.001  0.003
    17 C  -0.0006  -0.004  0.003  0.000
    18 C   0.0017  -0.001  0.003  0.000
    19 C   0.0045  -0.001  0.006  0.000
    20 C  -0.0016  -0.002  0.000  0.000
    21 C   0.0045  -0.002  0.007  0.000
    22 C  -0.0003  -0.001  0.000  0.000
    23 C   0.0050   0.000  0.005  0.000
    24 C   0.0010  -0.001  0.002  0.000
    25 C   0.0015  -0.001  0.002  0.000
    26 C  -0.0025  -0.003  0.000  0.000
    27 C  -0.0028  -0.006  0.003  0.000
    28 C  -0.0050  -0.005  0.000  0.000
    29 C   0.0003  -0.002  0.003  0.000
    30 O  -0.0036  -0.005  0.001  0.000
    31 C   0.0014   0.001  0.000  0.000
    32 C   0.0061   0.006  0.000  0.000
    33 O  -0.0020  -0.003  0.001  0.000
    34 C  -0.0031  -0.003  0.000  0.000
    35 C   0.0036   0.003  0.000  0.000
    36 O  -0.0001  -0.002  0.002  0.000
    37 C  -0.0013  -0.001  0.000  0.000
    38 C   0.0022   0.002  0.000  0.000
    39 O  -0.0006  -0.001  0.000  0.000
    40 C  -0.0012  -0.001  0.000  0.000
    41 C   0.0003  -0.001  0.001  0.000
    42 C  -0.0002  -0.001  0.001  0.000
    43 C   0.0002  -0.001  0.001  0.000
    44 C  -0.0001  -0.000  0.000  0.000
    45 C   0.0011  -0.000  0.002  0.000
    46 C   0.0002   0.000  0.000  0.000
    47 C   0.0007  -0.000  0.001  0.000
    48 C  -0.0006  -0.001  0.000  0.000
    49 S   0.0006  -0.000  0.000  0.000
    50 C   0.0008  -0.000  0.001  0.000
    51 C   0.0000  -0.000  0.000  0.000
    52 C   0.0004  -0.001  0.001  0.000
    53 F  -0.0021  -0.002  0.000  0.000
    54 F  -0.0019  -0.002  0.000  0.000
    55 H   0.0154   0.015  0.000  0.000
    56 H   0.0250   0.025  0.000  0.000
    57 H   0.0018   0.002  0.000  0.000
    58 H   0.0011   0.001  0.000  0.000
    59 H   0.0081   0.008  0.000  0.000
    60 H   0.0054   0.005  0.000  0.000
    61 H   0.0046   0.005  0.000  0.000
    62 H   0.0064   0.006  0.000  0.000
    63 H   0.0029   0.003  0.000  0.000
    64 H   0.0114   0.011  0.000  0.000
    65 H   0.0119   0.012  0.000  0.000
    66 H   0.0190   0.019  0.000  0.000
    67 H   0.0230   0.023  0.000  0.000
    68 H   0.0194   0.019  0.000  0.000
    69 H   0.0078   0.008  0.000  0.000
    70 H   0.0091   0.009  0.000  0.000
    71 H   0.0155   0.015  0.000  0.000
    72 H   0.0229   0.023  0.000  0.000
    73 H   0.0175   0.018  0.000  0.000
    74 H   0.0027   0.003  0.000  0.000
    75 H   0.0064   0.006  0.000  0.000
    76 H   0.0099   0.010  0.000  0.000
    77 H   0.0122   0.012  0.000  0.000
    78 H   0.0130   0.013  0.000  0.000
    79 H   0.0021   0.002  0.000  0.000
    80 H   0.0010   0.001  0.000  0.000
    81 H   0.0051   0.005  0.000  0.000
    82 H   0.0048   0.005  0.000  0.000
    83 H   0.0033   0.003  0.000  0.000
    84 H   0.0058   0.006  0.000  0.000
    85 H   0.0014   0.001  0.000  0.000
    86 H   0.0016   0.002  0.000  0.000
    87 H   0.0043   0.004  0.000  0.000
    88 H   0.0052   0.005  0.000  0.000

Wiberg/Mayer (AO) data.
largest (>0.10) Wiberg bond orders for each atom
          total WBO             WBO to atom ...
     1  C   3.872        C    2 1.470    C    6 1.294    H   55 0.856    C    3 0.130
     2  C   3.761        C    1 1.470    C    3 1.248    F   11 0.825
     3  C   3.975        C    2 1.248    C    4 1.243    F   12 0.941    C    1 0.130    F   11 0.101
     4  C   3.678        C    3 1.243    C    5 1.238    C   17 1.129
     5  C   3.932        N    7 1.349    C    4 1.238    C    6 1.181
     6  C   3.912        N   10 1.316    C    1 1.294    C    5 1.181
     7  N   2.652        C    8 1.460    C    5 1.349    S   16 0.120
     8  C   3.882        N    7 1.460    C    9 1.272    C   18 1.087
     9  C   3.935        N   10 1.526    C    8 1.272    C   24 1.080
    10  N   2.664        C    9 1.526    C    6 1.316
    11  F   0.912        C    2 0.825    C    3 0.101
    12  F   0.847        C    3 0.941
    13  C   3.840        C   17 1.501    C   14 1.325    H   56 0.985
    14  C   3.852        C   15 1.529    C   13 1.325    H   57 1.004
    15  C   3.888        C   14 1.529    S   16 1.165    C   42 1.138
    16  S   2.661        C   17 1.182    C   15 1.165    N    7 0.120
    17  C   3.872        C   13 1.501    S   16 1.182    C    4 1.129
    18  C   3.888        C   23 1.395    C   19 1.389    C    8 1.087
    19  C   3.784        C   20 1.425    C   18 1.389    H   58 1.006
    20  C   3.891        C   19 1.425    C   21 1.332    O   39 1.114
    21  C   3.921        C   22 1.396    C   20 1.332    O   36 1.103
    22  C   3.897        C   23 1.449    C   21 1.396    H   59 0.987
    23  C   3.827        C   22 1.449    C   18 1.395    H   60 0.994
    24  C   3.918        C   25 1.406    C   29 1.401    C    9 1.080
    25  C   3.871        C   26 1.444    C   24 1.406    H   61 0.997
    26  C   3.852        C   25 1.444    C   27 1.409    H   62 0.992
    27  C   3.856        C   26 1.409    C   28 1.340    O   30 1.081
    28  C   3.948        C   29 1.418    C   27 1.340    O   33 1.101
    29  C   3.849        C   28 1.418    C   24 1.401    H   63 0.999
    30  O   2.097        C   27 1.081    C   31 0.979
    31  C   3.909        H   64 0.997    H   65 0.996    C   32 0.993    O   30 0.979
    32  C   3.945        H   66 1.000    H   68 0.999    C   31 0.993    H   67 0.984
    33  O   2.149        C   28 1.101    C   34 0.977
    34  C   3.926        H   69 1.002    H   70 0.999    C   35 0.988    O   33 0.977
    35  C   3.955        H   71 1.001    H   73 0.999    C   34 0.988    H   72 0.986
    36  O   2.143        C   21 1.103    C   37 0.976
    37  C   3.925        H   74 1.010    H   75 1.001    C   38 0.988    O   36 0.976
    38  C   3.953        H   76 1.003    H   78 1.001    H   77 0.988    C   37 0.988
    39  O   2.177        C   20 1.114    C   40 0.938
    40  C   3.871        H   79 1.005    H   80 0.985    C   41 0.964    O   39 0.938
    41  C   3.474        C   40 0.964    H   81 0.879    H   83 0.853    H   82 0.801
    42  C   3.866        C   43 1.370    C   47 1.349    C   15 1.138
    43  C   3.706        C   44 1.487    C   42 1.370    H   84 0.823
    44  C   3.928        C   43 1.487    C   45 1.350    F   54 0.959
    45  C   3.884        C   46 1.377    C   44 1.350    C   48 1.136
    46  C   3.768        C   47 1.488    C   45 1.377    H   85 0.844
    47  C   3.933        C   46 1.488    C   42 1.349    F   53 0.985
    48  C   3.905        C   52 1.585    S   49 1.153    C   45 1.136
    49  S   2.546        C   50 1.178    C   48 1.153
    50  C   3.817        C   51 1.646    S   49 1.178    H   86 0.902
    51  C   3.835        C   50 1.646    C   52 1.290    H   87 0.853
    52  C   3.747        C   48 1.585    C   51 1.290    H   88 0.842
    53  F   0.852        C   47 0.985
    54  F   0.681        C   44 0.959
    55  H   0.983        C    1 0.856
    56  H   1.069        C   13 0.985
    57  H   1.073        C   14 1.004
    58  H   1.090        C   19 1.006
    59  H   1.034        C   22 0.987
    60  H   1.044        C   23 0.994
    61  H   1.058        C   25 0.997
    62  H   1.030        C   26 0.992
    63  H   1.058        C   29 0.999
    64  H   1.025        C   31 0.997
    65  H   1.023        C   31 0.996
    66  H   1.024        C   32 1.000
    67  H   1.024        C   32 0.984
    68  H   1.024        C   32 0.999
    69  H   1.027        C   34 1.002
    70  H   1.027        C   34 0.999
    71  H   1.024        C   35 1.001
    72  H   1.021        C   35 0.986
    73  H   1.021        C   35 0.999
    74  H   1.063        C   37 1.010
    75  H   1.046        C   37 1.001
    76  H   1.034        C   38 1.003
    77  H   1.035        C   38 0.988
    78  H   1.021        C   38 1.001
    79  H   1.090        C   40 1.005
    80  H   0.996        C   40 0.985
    81  H   0.942        C   41 0.879
    82  H   0.919        C   41 0.801
    83  H   0.940        C   41 0.853
    84  H   0.971        C   43 0.823
    85  H   0.943        C   46 0.844
    86  H   0.947        C   50 0.902
    87  H   0.929        C   51 0.853
    88  H   0.967        C   52 0.842

 dipole moment from electron density (au)
     X       Y       Z   
   2.2949   2.2099  -0.4991  total (Debye):    8.197


           -------------------------------------------------
          | TOTAL ENERGY             -171.827228252854 Eh   |
          | GRADIENT NORM               0.269624713935 Eh/α |
          | HOMO-LUMO GAP               0.039600708609 eV   |
           -------------------------------------------------

------------------------------------------------------------------------
 * finished run on 2021/12/02 at 16:24:20.063     
------------------------------------------------------------------------
 total:
 * wall-time:     0 d,  0 h,  0 min,  3.639 sec
 *  cpu-time:     0 d,  0 h,  0 min,  3.638 sec
 * ratio c/w:     1.000 speedup
 SCF:
 * wall-time:     0 d,  0 h,  0 min,  3.091 sec
 *  cpu-time:     0 d,  0 h,  0 min,  3.091 sec
 * ratio c/w:     1.000 speedup

