      -----------------------------------------------------------      
     |                   =====================                   |     
     |                           x T B                           |     
     |                   =====================                   |     
     |                         S. Grimme                         |     
     |          Mulliken Center for Theoretical Chemistry        |     
     |                    University of Bonn                     |     
     |                Version 6.2 RC2 (SAW190805)                |     
      -----------------------------------------------------------      

   This program is distributed in the hope that it will be useful,
   but WITHOUT ANY WARRANTY; without even the implied warranty of
   MERCHANTABILITY or FITNESS FOR A PARTICULAR PURPOSE.
   
   FOR NON-COMMERCIAL, ACADEMIA USE ONLY.
   
   Cite this work as:
   * S. Grimme, C. Bannwarth, P. Shushkov, J. Chem. Theory Comput., 2017,
     13, 1989-2009. DOI: 10.1021/acs.jctc.7b00118
   * C. Bannwarth, S. Ehlert and S. Grimme., J. Chem. Theory Comput., 2019,
     15, 1652-1671. DOI: 10.1021/acs.jctc.8b01176
   * P. Pracht, E. Caldeweyher, S. Ehlert, S. Grimme, ChemRxiv, 2019, preprint.
     DOI: 10.26434/chemrxiv.8326202.v1
   
   for DFT-D4:
   * E. Caldeweyher, C. Bannwarth and S. Grimme, J. Chem. Phys., 2017,
     147, 034112. DOI: 10.1063/1.4993215
   * E. Caldeweyher, S. Ehlert, A. Hansen, H. Neugebauer, S. Spicher,
     C. Bannwarth and S. Grimme, J. Chem. Phys., 2019, 150, 154122.
     DOI: 10.1063/1.5090222
   
   for sTDA-xTB:
   * S. Grimme and C. Bannwarth, J. Chem. Phys., 2016, 145, 054103.
     DOI: 10.1063/1.4959605
   
   in the mass-spec context:
   * V. Asgeirsson, C. Bauer and S. Grimme, Chem. Sci., 2017, 8, 4879.
     DOI: 10.1039/c7sc00601b
   
   for metadynamics refer to:
   * S. Grimme, J. Chem. Theory Comput., 2019, 155, 2847-2862
     DOI: 10.1021/acs.jctc.9b00143
   
   with help from (in alphabetical order)
   C. Bannwarth, F. Bohle, G. Brandenburg, E. Caldeweyher, M. Checinski,
   S. Dohm, S. Ehlert, S. Ehrlich, F. März, H. Neugebauer, J. Pisarek,
   P. Pracht, P. Shushkov, and S. Spicher.
   
 * started run on 2021/12/02 at 16:24:20.078     

           -------------------------------------------------
          |                Calculation Setup                |
           -------------------------------------------------

          program call               : /ihome/ghutchison/geoffh/xtb/xtb P4_yang.xyz --vipea
          hostname                   : smp-n73
          coordinate file            : P4_yang.xyz
          omp threads                :                     1
          number of atoms            :                    88
          number of electrons        :                   288
          charge                     :                     0
          spin                       :                   0.0
          first test random number   :      0.53429802433370


########################################################################
# WARNING! Please study the warnings concerning your input carefully
#  - XTBPATH is not set, using XTBHOME instead
########################################################################

           ------------------------------------------------- 
          |                 I P E A - x T B                 |
          |  Ionisation Potentials and Electron Affinities  |
           ------------------------------------------------- 
             KAB for M(3d)-M(3d) :                1.1000
             KAB for M(4d)-M(4d) :                1.2000
             KAB for M(5d)-M(5d) :                1.2000
             k(s)                :                2.1500
             k(p)                :                2.3000
             k(d)                :                2.0000
             k(f)                :                0.0000
             kEN (H0ij)          :                0.7000
             D3 a1               :                0.6300
             D3 a2               :                5.0000
             D3 s6               :                1.0000
             D3 s8               :                2.4000
             D3 s9               :                0.0000
             alphaj              :                1.0000
             XBdamp              :                0.4400
             XBrad               :                1.3000
             kcnsh               :      1.0000   -0.3000   -0.5000    0.5000

  Z AO/shell   Hii/eV     exponent
  1     Thu Sep 22 23:34:11 CEST 2016   EN: 2.200 GAM: 0.405  GM3: 0.1500
     1s    -10.521941    1.306199
     2s     -3.560151    0.398421
  6     Thu Sep 22 23:34:11 CEST 2016   EN: 2.550 GAM: 0.640  GM3: 0.1500
     2s    -15.968100    1.979793
     2p     -9.777107    1.850537
     3S     -3.366990    0.633095
  7     Thu Sep 22 23:34:11 CEST 2016   EN: 3.040 GAM: 0.493  GM3:-0.1000
     2s    -24.040776    2.126160
     2p    -14.426520    2.068425
     3S     -5.882278    0.671040
  8     Thu Sep 22 23:34:11 CEST 2016   EN: 3.440 GAM: 0.717  GM3:-0.2000
     2s    -26.695120    2.575264
     2p    -16.014457    2.159448
     3S     -6.622058    0.958679
  9     Tue Jan 17 20:22:52 CET 2017    EN: 3.980 GAM: 0.574  GM3: 0.2000
     2s    -27.565998    2.304073
     2p    -17.439238    2.314354
     3S     -6.120500    0.570243
 16     Tue Jan 17 20:57:36 CET 2017    EN: 2.580 GAM: 0.455  GM3: 0.1020
     3s    -24.488821    2.492075
     3p    -12.136640    1.997904
     3d     -1.796070    1.747541

           ------------------------------------------------- 
          |        Self-Consistent Charge Iterations        |
           ------------------------------------------------- 

          ...................................................
          :                      SETUP                      :
          :.................................................:
          :  # basis functions                 354          :
          :  # atomic orbitals                 352          :
          :  # shells                          232          :
          :  # electrons                       288          :
          :  # halogen bonds                     0          :
          :  max. iterations                   250          :
          :  Hamiltonian                  GFN1-xTB          :
          :  restarted?                      false          :
          :  GBSA solvation                  false          :
          :  PC potential                    false          :
          :  electronic temp.          300.0000000     K    :
          :  accuracy                    1.0000000          :
          :  -> integral cutoff          0.2500000E+02      :
          :  -> integral neglect         0.1000000E-07      :
          :  -> SCF convergence          0.1000000E-05 Eh   :
          :  -> wf. convergence          0.2000000E-04 e    :
          :  Broyden damping             0.4000000          :
          ...................................................

 iter      E             dE          RMSdq      gap      omega  full diag
   1   -177.7111274 -0.177711E+03  0.995E+00    0.59       0.0  T
   2   -177.0088874  0.702240E+00  0.679E+00    0.12       1.0  T
   3   -175.8728997  0.113599E+01  0.525E+00    0.73       1.0  T
   4   -183.3156477 -0.744275E+01  0.171E+00    0.02       1.0  T
   5   -183.8615376 -0.545890E+00  0.113E+00    1.44       1.0  T
   6   -183.9250377 -0.635001E-01  0.858E-01    0.86       1.0  T
   7   -183.4603845  0.464653E+00  0.107E+00    0.09       1.0  T
   8   -183.9065631 -0.446179E+00  0.497E-01    1.11       1.0  T
   9   -183.9314439 -0.248809E-01  0.222E-01    0.82       1.0  T
  10   -183.9334708 -0.202690E-02  0.165E-01    0.77       1.0  T
  11   -183.9357108 -0.223991E-02  0.117E-01    0.62       1.0  T
  12   -183.9365192 -0.808434E-03  0.995E-02    0.54       1.0  T
  13   -183.9370079 -0.488762E-03  0.872E-02    0.47       1.0  T
  14   -183.9380246 -0.101662E-02  0.563E-02    0.33       1.0  T
  15   -183.9372154  0.809135E-03  0.697E-02    0.15       1.0  T
  16   -183.9381490 -0.933549E-03  0.511E-02    0.31       1.0  T
  17   -183.9386136 -0.464617E-03  0.294E-02    0.25       1.0  T
  18   -183.9388730 -0.259392E-03  0.105E-03    0.20      10.1  T
  19   -183.9388697  0.325695E-05  0.334E-03    0.21       3.2  T
  20   -183.9388706 -0.885095E-06  0.284E-03    0.20       3.8  T
  21   -183.9388731 -0.246464E-05  0.615E-04    0.20      17.3  T
  22   -183.9388732 -0.803582E-07  0.336E-04    0.20      31.7  T
  23   -183.9388732 -0.367221E-07  0.232E-05    0.20     458.5  T
  24   -183.9388732  0.365873E-08  0.110E-04    0.20      96.9  T

   *** convergence criteria satisfied after 24 iterations ***

         #    Occupation            Energy/Eh            Energy/eV
      -------------------------------------------------------------
         1        2.0000           -1.0878570             -29.6021
       ...           ...                  ...                  ...
       138        2.0000           -0.3759466             -10.2300
       139        2.0000           -0.3696914             -10.0598
       140        2.0000           -0.3617234              -9.8430
       141        2.0000           -0.3417652              -9.2999
       142        2.0000           -0.3374814              -9.1833
       143        2.0000           -0.3250754              -8.8458
       144        1.9612           -0.2686484              -7.3103 (HOMO)
       145        0.0388           -0.2611958              -7.1075 (LUMO)
       146                         -0.2470697              -6.7231
       147                         -0.2313960              -6.2966
       148                         -0.2251881              -6.1277
       149                         -0.2246359              -6.1127
       ...                                ...                  ...
       352                        553.9741759           15074.4046
      -------------------------------------------------------------
                  HL-Gap            0.0074526 Eh            0.2028 eV
             Fermi-level           -0.2649221 Eh           -7.2089 eV

 SCC (total)                   0 d,  0 h,  0 min,  1.201 sec
 SCC setup                      ...        0 min,  0.003 sec (  0.250%)
 Dispersion                     ...        0 min,  0.000 sec (  0.021%)
 integral evaluation            ...        0 min,  0.551 sec ( 45.902%)
 zeroth order Hamiltonian       ...        0 min,  0.003 sec (  0.219%)
 iterations                     ...        0 min,  0.439 sec ( 36.507%)
 molecular gradient             ...        0 min,  0.203 sec ( 16.884%)
 printout                       ...        0 min,  0.003 sec (  0.212%)

         :::::::::::::::::::::::::::::::::::::::::::::::::::::
         ::                     SUMMARY                     ::
         :::::::::::::::::::::::::::::::::::::::::::::::::::::
         :: total energy            -181.261591720871 Eh    ::
         :: gradient norm              0.316862658610 Eh/a0 ::
         :: HOMO-LUMO gap              0.202795397585 eV    ::
         ::.................................................::
         :: SCC energy              -183.938873198887 Eh    ::
         :: -> electrostatic           0.432099748566 Eh    ::
         :: repulsion energy           2.750203683318 Eh    ::
         :: dispersion energy         -0.072922205301 Eh    ::
         :: halogen bond corr.         0.000000000000 Eh    ::
         :: add. restraining           0.000000000000 Eh    ::
         :::::::::::::::::::::::::::::::::::::::::::::::::::::

           ------------------------------------------------- 
          |        vertical delta SCC IP calculation        |
           ------------------------------------------------- 

          ...................................................
          :                      SETUP                      :
          :.................................................:
          :  # basis functions                 354          :
          :  # atomic orbitals                 352          :
          :  # shells                          232          :
          :  # electrons                       287          :
          :  # halogen bonds                     0          :
          :  max. iterations                   250          :
          :  Hamiltonian                  GFN1-xTB          :
          :  restarted?                       true          :
          :  GBSA solvation                  false          :
          :  PC potential                    false          :
          :  electronic temp.          300.0000000     K    :
          :  accuracy                    1.0000000          :
          :  -> integral cutoff          0.2500000E+02      :
          :  -> integral neglect         0.1000000E-07      :
          :  -> SCF convergence          0.1000000E-05 Eh   :
          :  -> wf. convergence          0.2000000E-04 e    :
          :  Broyden damping             0.4000000          :
          ...................................................

 iter      E             dE          RMSdq      gap      omega  full diag
   1   -183.5380278 -0.183538E+03  0.530E-01    0.20       0.0  T
   2   -183.5409796 -0.295185E-02  0.411E-01    2.16       1.0  T
   3   -183.5755759 -0.345963E-01  0.301E-01    1.40       1.0  T
   4   -183.5834280 -0.785203E-02  0.211E-01    1.70       1.0  T
   5   -183.5622738  0.211542E-01  0.287E-01    2.18       1.0  T
   6   -183.5860828 -0.238090E-01  0.146E-01    1.96       1.0  T
   7   -183.5880297 -0.194688E-02  0.111E-01    2.03       1.0  T
   8   -183.5913197 -0.328995E-02  0.272E-02    2.10       1.0  T
   9   -183.5914736 -0.153965E-03  0.110E-02    2.11       1.0  T
  10   -183.5914998 -0.261988E-04  0.194E-03    2.11       5.5  T
  11   -183.5914981  0.171575E-05  0.310E-03    2.11       3.4  T
  12   -183.5915006 -0.248435E-05  0.770E-04    2.11      13.8  T
  13   -183.5915006 -0.525302E-07  0.759E-04    2.11      14.0  T
  14   -183.5915008 -0.143112E-06  0.289E-04    2.11      36.9  T
  15   -183.5915008 -0.246275E-07  0.538E-05    2.11     198.1  T
  16   -183.5915008 -0.842704E-09  0.164E-05    2.11     649.5  T

   *** convergence criteria satisfied after 16 iterations ***

         #    Occupation            Energy/Eh            Energy/eV
      -------------------------------------------------------------
         1        2.0000           -1.1568807             -31.4803
       ...           ...                  ...                  ...
       138        2.0000           -0.4612553             -12.5514
       139        2.0000           -0.4545664             -12.3694
       140        2.0000           -0.4437650             -12.0755
       141        2.0000           -0.4377793             -11.9126
       142        2.0000           -0.4347956             -11.8314
       143        1.8696           -0.4228400             -11.5061
       144        1.1304           -0.4192339             -11.4079 (HOMO)
       145                         -0.3417187              -9.2986 (LUMO)
       146                         -0.3294459              -8.9647
       147                         -0.3031708              -8.2497
       148                         -0.2985604              -8.1242
       149                         -0.2920800              -7.9479
       ...                                ...                  ...
       352                        553.8881362           15072.0633
      -------------------------------------------------------------
                  HL-Gap            0.0775152 Eh            2.1093 eV
             Fermi-level           -0.4007566 Eh          -10.9051 eV

 SCC (total)                   0 d,  0 h,  0 min,  1.052 sec
 SCC setup                      ...        0 min,  0.003 sec (  0.272%)
 Dispersion                     ...        0 min,  0.000 sec (  0.015%)
 integral evaluation            ...        0 min,  0.550 sec ( 52.301%)
 zeroth order Hamiltonian       ...        0 min,  0.002 sec (  0.229%)
 iterations                     ...        0 min,  0.291 sec ( 27.629%)
 molecular gradient             ...        0 min,  0.203 sec ( 19.254%)
 printout                       ...        0 min,  0.003 sec (  0.294%)

         :::::::::::::::::::::::::::::::::::::::::::::::::::::
         ::                     SUMMARY                     ::
         :::::::::::::::::::::::::::::::::::::::::::::::::::::
         :: total energy            -180.914219340198 Eh    ::
         :: gradient norm              0.285392649520 Eh/a0 ::
         :: HOMO-LUMO gap              2.109296286708 eV    ::
         ::.................................................::
         :: SCC energy              -183.591500818214 Eh    ::
         :: -> electrostatic           0.472097113721 Eh    ::
         :: repulsion energy           2.750203683318 Eh    ::
         :: dispersion energy         -0.072922205301 Eh    ::
         :: halogen bond corr.         0.000000000000 Eh    ::
         :: add. restraining           0.000000000000 Eh    ::
         :::::::::::::::::::::::::::::::::::::::::::::::::::::

------------------------------------------------------------------------
empirical IP shift (eV):    4.8455
delta SCC IP (eV):    4.6070
------------------------------------------------------------------------
           ------------------------------------------------- 
          |        vertical delta SCC EA calculation        |
           ------------------------------------------------- 

          ...................................................
          :                      SETUP                      :
          :.................................................:
          :  # basis functions                 354          :
          :  # atomic orbitals                 352          :
          :  # shells                          232          :
          :  # electrons                       289          :
          :  # halogen bonds                     0          :
          :  max. iterations                   250          :
          :  Hamiltonian                  GFN1-xTB          :
          :  restarted?                       true          :
          :  GBSA solvation                  false          :
          :  PC potential                    false          :
          :  electronic temp.          300.0000000     K    :
          :  accuracy                    1.0000000          :
          :  -> integral cutoff          0.2500000E+02      :
          :  -> integral neglect         0.1000000E-07      :
          :  -> SCF convergence          0.1000000E-05 Eh   :
          :  -> wf. convergence          0.2000000E-04 e    :
          :  Broyden damping             0.4000000          :
          ...................................................

 iter      E             dE          RMSdq      gap      omega  full diag
   1   -184.0857984 -0.184086E+03  0.551E-01    0.33       0.0  T
   2   -184.0868321 -0.103369E-02  0.447E-01    0.33       1.0  T
   3   -184.1100420 -0.232099E-01  0.374E-01    0.27       1.0  T
   4   -184.0839721  0.260699E-01  0.422E-01    0.17       1.0  T
   5   -184.1473536 -0.633815E-01  0.143E-01    0.19       1.0  T
   6   -184.1128026  0.345510E-01  0.308E-01    0.07       1.0  T
   7   -184.1514975 -0.386948E-01  0.356E-02    0.09       1.0  T
   8   -184.1515068 -0.933172E-05  0.282E-02    0.10       1.0  T
   9   -184.1517386 -0.231842E-03  0.126E-02    0.09       1.0  T
  10   -184.1517915 -0.529081E-04  0.437E-03    0.08       2.4  T
  11   -184.1517947 -0.314680E-05  0.170E-03    0.08       6.3  T
  12   -184.1517950 -0.344579E-06  0.797E-04    0.08      13.4  T
  13   -184.1517951 -0.102052E-06  0.467E-04    0.08      22.8  T
  14   -184.1517951  0.256404E-07  0.485E-04    0.08      22.0  T
  15   -184.1517952 -0.528020E-07  0.291E-04    0.08      36.7  T
  16   -184.1517952 -0.329121E-07  0.775E-05    0.08     137.5  T
  17   -184.1517952 -0.173020E-08  0.354E-05    0.08     301.5  T

   *** convergence criteria satisfied after 17 iterations ***

         #    Occupation            Energy/Eh            Energy/eV
      -------------------------------------------------------------
         1        2.0000           -1.0084352             -27.4409
       ...           ...                  ...                  ...
       139        2.0000           -0.2864385              -7.7944
       140        2.0000           -0.2836857              -7.7195
       141        2.0000           -0.2603083              -7.0833
       142        2.0000           -0.2566908              -6.9849
       143        2.0000           -0.2459481              -6.6926
       144        2.0000           -0.1892968              -5.1510
       145        0.8248           -0.1700158              -4.6264 (HOMO)
       146        0.1739           -0.1670640              -4.5460 (LUMO)
       147        0.0014           -0.1622882              -4.4161
       148                         -0.1507762              -4.1028
       149                         -0.1491215              -4.0578
       150                         -0.1416588              -3.8547
       ...                                ...                  ...
       352                        554.0583403           15076.6948
      -------------------------------------------------------------
                  HL-Gap            0.0029517 Eh            0.0803 eV
             Fermi-level           -0.1741108 Eh           -4.7378 eV

 SCC (total)                   0 d,  0 h,  0 min,  1.068 sec
 SCC setup                      ...        0 min,  0.003 sec (  0.278%)
 Dispersion                     ...        0 min,  0.000 sec (  0.022%)
 integral evaluation            ...        0 min,  0.551 sec ( 51.637%)
 zeroth order Hamiltonian       ...        0 min,  0.003 sec (  0.247%)
 iterations                     ...        0 min,  0.306 sec ( 28.620%)
 molecular gradient             ...        0 min,  0.202 sec ( 18.950%)
 printout                       ...        0 min,  0.003 sec (  0.242%)

         :::::::::::::::::::::::::::::::::::::::::::::::::::::
         ::                     SUMMARY                     ::
         :::::::::::::::::::::::::::::::::::::::::::::::::::::
         :: total energy            -181.474513719941 Eh    ::
         :: gradient norm              0.343399649157 Eh/a0 ::
         :: HOMO-LUMO gap              0.080320997114 eV    ::
         ::.................................................::
         :: SCC energy              -184.151795197958 Eh    ::
         :: -> electrostatic           0.473326123123 Eh    ::
         :: repulsion energy           2.750203683318 Eh    ::
         :: dispersion energy         -0.072922205301 Eh    ::
         :: halogen bond corr.         0.000000000000 Eh    ::
         :: add. restraining           0.000000000000 Eh    ::
         :::::::::::::::::::::::::::::::::::::::::::::::::::::

------------------------------------------------------------------------
empirical EA shift (eV):    4.8455
delta SCC EA (eV):    0.9484
------------------------------------------------------------------------
           -------------------------------------------------
          |                Property Printout                |
           -------------------------------------------------

    * Orbital Energies and Occupations

         #    Occupation            Energy/Eh            Energy/eV
      -------------------------------------------------------------
         1        2.0000           -1.0084352             -27.4409
       ...           ...                  ...                  ...
       133        2.0000           -0.3155673              -8.5870
       134        2.0000           -0.3131023              -8.5199
       135        2.0000           -0.3095759              -8.4240
       136        2.0000           -0.3088569              -8.4044
       137        2.0000           -0.3036332              -8.2623
       138        2.0000           -0.2887930              -7.8585
       139        2.0000           -0.2864385              -7.7944
       140        2.0000           -0.2836857              -7.7195
       141        2.0000           -0.2603083              -7.0833
       142        2.0000           -0.2566908              -6.9849
       143        2.0000           -0.2459481              -6.6926
       144        2.0000           -0.1892968              -5.1510
       145        0.8248           -0.1700158              -4.6264 (HOMO)
       146        0.1739           -0.1670640              -4.5460 (LUMO)
       147        0.0014           -0.1622882              -4.4161
       148                         -0.1507762              -4.1028
       149                         -0.1491215              -4.0578
       150                         -0.1416588              -3.8547
       151                         -0.1294158              -3.5216
       152                         -0.1231156              -3.3501
       153                         -0.1215954              -3.3088
       154                         -0.1214639              -3.3052
       155                         -0.1185401              -3.2256
       156                         -0.0965156              -2.6263
       ...                                ...                  ...
       352                        554.0583403           15076.6948
      -------------------------------------------------------------
                  HL-Gap            0.0029517 Eh            0.0803 eV
             Fermi-level           -0.1741108 Eh           -4.7378 eV

  Mulliken/CM5 charges        n(s)   n(p)   n(d)
     1 C  -0.38171 -0.42365   0.954  2.665  0.000
     2 C  -0.37571 -0.35881   0.987  2.637  0.000
     3 C  -0.47684 -0.45701   1.032  2.491  0.000
     4 C   0.15302  0.16111   0.933  3.220  0.000
     5 C  -0.01964  0.06171   1.085  2.895  0.000
     6 C   0.08949  0.16552   1.045  3.044  0.000
     7 N   0.23805  0.03985   1.298  3.940  0.000
     8 C  -0.06316  0.01989   1.102  2.835  0.000
     9 C  -0.06488  0.01854   1.110  2.825  0.000
    10 N   0.30120  0.11469   1.305  3.996  0.000
    11 F   0.32241  0.29953   1.628  5.694  0.000
    12 F   0.27229  0.24739   1.612  5.660  0.000
    13 C   0.06999  0.01920   1.066  3.004  0.000
    14 C   0.05671  0.00588   1.072  2.984  0.000
    15 C   0.02262  0.03297   1.115  2.908  0.000
    16 S   0.10717  0.07959   1.892  4.051  0.164
    17 C   0.01294  0.02587   1.127  2.886  0.000
    18 C   0.01029  0.00816   1.077  2.934  0.000
    19 C   0.04105 -0.00660   1.053  2.988  0.000
    20 C  -0.07465 -0.05486   1.099  2.827  0.000
    21 C  -0.07662 -0.05500   1.108  2.816  0.000
    22 C   0.04495 -0.00557   1.075  2.970  0.000
    23 C   0.04131 -0.01163   1.058  2.984  0.000
    24 C   0.00423  0.00249   1.090  2.914  0.000
    25 C   0.03628 -0.01516   1.077  2.959  0.000
    26 C   0.04205 -0.01036   1.055  2.987  0.000
    27 C  -0.08237 -0.06264   1.077  2.841  0.000
    28 C  -0.08774 -0.06629   1.105  2.808  0.000
    29 C   0.03022 -0.01694   1.070  2.960  0.000
    30 O   0.23827  0.14570   1.590  4.648  0.000
    31 C  -0.05852 -0.14206   1.121  2.821  0.000
    32 C   0.05920 -0.09023   1.091  2.968  0.000
    33 O   0.23705  0.15152   1.597  4.640  0.000
    34 C  -0.05884 -0.14087   1.124  2.817  0.000
    35 C   0.05872 -0.09047   1.090  2.969  0.000
    36 O   0.25896  0.17387   1.607  4.652  0.000
    37 C  -0.04615 -0.12844   1.136  2.818  0.000
    38 C   0.20243  0.05317   1.030  3.173  0.000
    39 O   0.30111  0.20872   1.646  4.655  0.000
    40 C   0.24679  0.16307   1.035  3.211  0.000
    41 C   0.59568  0.44566   0.885  3.711  0.000
    42 C   0.01203  0.01481   1.071  2.941  0.000
    43 C  -0.08894 -0.06914   1.131  2.780  0.000
    44 C  -0.08768 -0.06709   1.145  2.768  0.000
    45 C   0.02017  0.02346   1.079  2.941  0.000
    46 C  -0.08302 -0.06372   1.148  2.769  0.000
    47 C  -0.08657 -0.06684   1.152  2.761  0.000
    48 C   0.01964  0.03029   1.135  2.885  0.000
    49 S   0.16943  0.13196   1.877  4.200  0.092
    50 C   0.16749  0.12844   1.161  3.007  0.000
    51 C   0.18959  0.13547   1.129  3.061  0.000
    52 C   0.17505  0.12416   1.073  3.103  0.000
    53 F   0.10899  0.08516   1.607  5.502  0.000
    54 F   0.17084  0.14809   1.679  5.492  0.000
    55 F   0.16085  0.13590   1.661  5.500  0.000
    56 F   0.14223  0.11588   1.633  5.509  0.000
    57 H   0.15996  0.22102   1.160  0.000  0.000
    58 H   0.00956  0.06981   1.010  0.000  0.000
    59 H   0.01110  0.07094   1.011  0.000  0.000
    60 H   0.02981  0.09703   1.030  0.000  0.000
    61 H  -0.00224  0.05874   0.998  0.000  0.000
    62 H   0.00660  0.06652   1.007  0.000  0.000
    63 H  -0.00269  0.05881   0.997  0.000  0.000
    64 H  -0.01426  0.04655   0.986  0.000  0.000
    65 H  -0.01160  0.05355   0.988  0.000  0.000
    66 H  -0.01846  0.04415   0.982  0.000  0.000
    67 H  -0.02153  0.04103   0.978  0.000  0.000
    68 H  -0.00564  0.04887   0.994  0.000  0.000
    69 H  -0.00380  0.04844   0.996  0.000  0.000
    70 H  -0.00703  0.04751   0.993  0.000  0.000
    71 H  -0.02132  0.04589   0.979  0.000  0.000
    72 H  -0.02672  0.03998   0.973  0.000  0.000
    73 H  -0.01006  0.04449   0.990  0.000  0.000
    74 H  -0.00642  0.04581   0.994  0.000  0.000
    75 H  -0.01528  0.03929   0.985  0.000  0.000
    76 H  -0.00245  0.06579   0.998  0.000  0.000
    77 H   0.01172  0.07876   1.012  0.000  0.000
    78 H   0.03548  0.08991   1.035  0.000  0.000
    79 H   0.03675  0.08901   1.037  0.000  0.000
    80 H  -0.31603 -0.26147   0.684  0.000  0.000
    81 H  -0.26418 -0.20072   0.736  0.000  0.000
    82 H  -0.23988 -0.17576   0.760  0.000  0.000
    83 H  -0.28202 -0.22347   0.718  0.000  0.000
    84 H  -0.24250 -0.19019   0.758  0.000  0.000
    85 H  -0.25825 -0.20289   0.742  0.000  0.000
    86 H  -0.26811 -0.21023   0.732  0.000  0.000
    87 H  -0.21296 -0.15634   0.787  0.000  0.000
    88 H  -0.26533 -0.20515   0.735  0.000  0.000
(R)spin-density population

 Mulliken population n(s)   n(p)   n(d)
     1 C   0.0171   0.000  0.017  0.000
     2 C   0.0159   0.000  0.016  0.000
     3 C   0.0391  -0.000  0.039  0.000
     4 C   0.0027  -0.000  0.003  0.000
     5 C   0.0050   0.000  0.005  0.000
     6 C   0.0519   0.000  0.052  0.000
     7 N   0.0798   0.000  0.080  0.000
     8 C   0.0715   0.000  0.071  0.000
     9 C   0.0219   0.000  0.022  0.000
    10 N   0.1153  -0.000  0.115  0.000
    11 F   0.0021  -0.000  0.002  0.000
    12 F   0.0053  -0.000  0.005  0.000
    13 C   0.0059  -0.000  0.006  0.000
    14 C   0.0331   0.000  0.033  0.000
    15 C   0.0222   0.000  0.022  0.000
    16 S   0.0308   0.000  0.020  0.010
    17 C   0.0432  -0.000  0.043  0.000
    18 C   0.0017  -0.000  0.002  0.000
    19 C   0.0087  -0.000  0.009  0.000
    20 C  -0.0004  -0.000  0.000  0.000
    21 C   0.0102  -0.001  0.011  0.000
    22 C  -0.0002  -0.000  0.000  0.000
    23 C   0.0102   0.000  0.010  0.000
    24 C   0.0030  -0.001  0.004  0.000
    25 C   0.0037  -0.001  0.005  0.000
    26 C  -0.0030  -0.003  0.000  0.000
    27 C  -0.0007  -0.007  0.006  0.000
    28 C  -0.0050  -0.006  0.001  0.000
    29 C   0.0029  -0.002  0.005  0.000
    30 O  -0.0029  -0.005  0.002  0.000
    31 C   0.0029   0.003  0.000  0.000
    32 C   0.0095   0.009  0.000  0.000
    33 O  -0.0013  -0.002  0.001  0.000
    34 C  -0.0026  -0.003  0.000  0.000
    35 C   0.0039   0.004  0.000  0.000
    36 O   0.0022  -0.000  0.003  0.000
    37 C  -0.0005  -0.001  0.000  0.000
    38 C   0.0006   0.000  0.001  0.000
    39 O   0.0001  -0.000  0.000  0.000
    40 C   0.0005  -0.000  0.001  0.000
    41 C   0.0006  -0.000  0.001  0.000
    42 C   0.0382  -0.000  0.038  0.000
    43 C   0.0162   0.000  0.016  0.000
    44 C   0.0088   0.000  0.009  0.000
    45 C   0.0428  -0.000  0.043  0.000
    46 C   0.0089   0.000  0.009  0.000
    47 C   0.0159   0.000  0.016  0.000
    48 C   0.0035  -0.000  0.004  0.000
    49 S   0.0121   0.000  0.009  0.003
    50 C   0.0228   0.000  0.023  0.000
    51 C   0.0003   0.000  0.000  0.000
    52 C   0.0254  -0.000  0.025  0.000
    53 F   0.0014  -0.000  0.001  0.000
    54 F   0.0010   0.000  0.001  0.000
    55 F   0.0019   0.000  0.002  0.000
    56 F   0.0005  -0.000  0.001  0.000
    57 H   0.0011   0.001  0.000  0.000
    58 H   0.0001   0.000  0.000  0.000
    59 H   0.0003   0.000  0.000  0.000
    60 H   0.0007   0.001  0.000  0.000
    61 H   0.0038   0.004  0.000  0.000
    62 H   0.0022   0.002  0.000  0.000
    63 H   0.0030   0.003  0.000  0.000
    64 H   0.0049   0.005  0.000  0.000
    65 H   0.0007   0.001  0.000  0.000
    66 H   0.0120   0.012  0.000  0.000
    67 H   0.0128   0.013  0.000  0.000
    68 H   0.0214   0.021  0.000  0.000
    69 H   0.0269   0.027  0.000  0.000
    70 H   0.0227   0.023  0.000  0.000
    71 H   0.0074   0.007  0.000  0.000
    72 H   0.0080   0.008  0.000  0.000
    73 H   0.0125   0.013  0.000  0.000
    74 H   0.0219   0.022  0.000  0.000
    75 H   0.0132   0.013  0.000  0.000
    76 H   0.0006   0.001  0.000  0.000
    77 H   0.0023   0.002  0.000  0.000
    78 H   0.0021   0.002  0.000  0.000
    79 H   0.0026   0.003  0.000  0.000
    80 H   0.0054   0.005  0.000  0.000
    81 H   0.0011   0.001  0.000  0.000
    82 H   0.0013   0.001  0.000  0.000
    83 H   0.0005   0.000  0.000  0.000
    84 H   0.0003   0.000  0.000  0.000
    85 H   0.0008   0.001  0.000  0.000
    86 H   0.0002   0.000  0.000  0.000
    87 H   0.0002   0.000  0.000  0.000
    88 H   0.0002   0.000  0.000  0.000

Wiberg/Mayer (AO) data.
largest (>0.10) Wiberg bond orders for each atom
          total WBO             WBO to atom ...
     1  C   3.983        C    2 1.548    C    6 1.263    H   57 0.985
     2  C   3.922        C    1 1.548    C    3 1.443    F   11 0.818
     3  C   3.930        C    2 1.443    C    4 1.365    F   12 0.932
     4  C   3.767        C    3 1.365    C    5 1.213    C   17 1.139
     5  C   3.911        N    7 1.347    C    6 1.234    C    4 1.213
     6  C   3.799        C    1 1.263    N   10 1.243    C    5 1.234
     7  N   2.665        C    8 1.436    C    5 1.347    S   16 0.156
     8  C   3.844        N    7 1.436    C    9 1.286    C   18 1.083
     9  C   3.919        N   10 1.518    C    8 1.286    C   24 1.081
    10  N   2.541        C    9 1.518    C    6 1.243
    11  F   0.766        C    2 0.818
    12  F   0.783        C    3 0.932
    13  C   3.837        C   17 1.489    C   14 1.346    H   58 0.997
    14  C   3.817        C   15 1.482    C   13 1.346    H   59 1.000
    15  C   3.839        C   14 1.482    C   42 1.165    S   16 1.158
    16  S   2.682        C   17 1.196    C   15 1.158    N    7 0.156
    17  C   3.823        C   13 1.489    S   16 1.196    C    4 1.139
    18  C   3.887        C   23 1.399    C   19 1.389    C    8 1.083
    19  C   3.795        C   20 1.411    C   18 1.389    H   60 1.007
    20  C   3.911        C   19 1.411    C   21 1.325    O   39 1.141
    21  C   3.922        C   22 1.405    C   20 1.325    O   36 1.101
    22  C   3.897        C   23 1.440    C   21 1.405    H   61 0.989
    23  C   3.828        C   22 1.440    C   18 1.399    H   62 0.995
    24  C   3.917        C   25 1.404    C   29 1.402    C    9 1.081
    25  C   3.873        C   26 1.444    C   24 1.404    H   63 0.998
    26  C   3.852        C   25 1.444    C   27 1.409    H   64 0.992
    27  C   3.854        C   26 1.409    C   28 1.340    O   30 1.081
    28  C   3.948        C   29 1.419    C   27 1.340    O   33 1.101
    29  C   3.848        C   28 1.419    C   24 1.402    H   65 0.999
    30  O   2.095        C   27 1.081    C   31 0.979
    31  C   3.909        H   66 0.998    H   67 0.996    C   32 0.992    O   30 0.979
    32  C   3.945        H   68 1.000    H   70 0.999    C   31 0.992    H   69 0.984
    33  O   2.149        C   28 1.101    C   34 0.977
    34  C   3.928        H   71 1.001    H   72 1.000    C   35 0.988    O   33 0.977
    35  C   3.955        H   73 1.001    H   75 0.998    C   34 0.988    H   74 0.986
    36  O   2.144        C   21 1.101    C   37 0.969
    37  C   3.933        H   76 1.008    H   77 1.005    C   38 0.982    O   36 0.969
    38  C   3.798        H   78 1.023    H   79 1.004    C   37 0.982    H   80 0.842
    39  O   2.199        C   20 1.141    C   40 0.915
    40  C   3.545        C   41 0.920    O   39 0.915    H   82 0.892    H   81 0.863
    41  C   3.394        C   40 0.920    H   84 0.844    H   85 0.839    H   83 0.792
    42  C   3.825        C   43 1.316    C   47 1.310    C   15 1.165
    43  C   3.928        C   44 1.451    C   42 1.316    F   55 1.033
    44  C   3.966        C   43 1.451    C   45 1.324    F   54 1.032
    45  C   3.836        C   46 1.325    C   44 1.324    C   48 1.147
    46  C   3.965        C   47 1.454    C   45 1.325    F   56 1.013
    47  C   3.970        C   46 1.454    C   42 1.310    F   53 1.014
    48  C   3.892        C   52 1.554    S   49 1.166    C   45 1.147
    49  S   2.550        C   50 1.214    C   48 1.166
    50  C   3.813        C   51 1.624    S   49 1.214    H   86 0.911
    51  C   3.889        C   50 1.624    C   52 1.297    H   87 0.927
    52  C   3.719        C   48 1.554    C   51 1.297    H   88 0.884
    53  F   0.690        C   47 1.014
    54  F   0.907        C   44 1.032
    55  F   0.842        C   43 1.033
    56  F   0.750        C   46 1.013
    57  H   0.988        C    1 0.985
    58  H   1.054        C   13 0.997
    59  H   1.072        C   14 1.000
    60  H   1.121        C   19 1.007
    61  H   1.045        C   22 0.989
    62  H   1.052        C   23 0.995
    63  H   1.060        C   25 0.998
    64  H   1.032        C   26 0.992
    65  H   1.061        C   29 0.999
    66  H   1.028        C   31 0.998
    67  H   1.023        C   31 0.996
    68  H   1.026        C   32 1.000
    69  H   1.024        C   32 0.984
    70  H   1.023        C   32 0.999
    71  H   1.031        C   34 1.001
    72  H   1.024        C   34 1.000
    73  H   1.025        C   35 1.001
    74  H   1.021        C   35 0.986
    75  H   1.023        C   35 0.998
    76  H   1.067        C   37 1.008
    77  H   1.069        C   37 1.005
    78  H   1.066        C   38 1.023
    79  H   1.063        C   38 1.004
    80  H   0.910        C   38 0.842
    81  H   0.966        C   40 0.863
    82  H   0.965        C   40 0.892
    83  H   0.957        C   41 0.792
    84  H   0.942        C   41 0.844
    85  H   0.983        C   41 0.839
    86  H   0.938        C   50 0.911
    87  H   0.945        C   51 0.927
    88  H   0.952        C   52 0.884

 dipole moment from electron density (au)
     X       Y       Z   
   4.8695   4.5113  -1.2548  total (Debye):   17.171


           -------------------------------------------------
          | TOTAL ENERGY             -181.474513719941 Eh   |
          | GRADIENT NORM               0.343399649157 Eh/α |
          | HOMO-LUMO GAP               0.080320997114 eV   |
           -------------------------------------------------

------------------------------------------------------------------------
 * finished run on 2021/12/02 at 16:24:23.974     
------------------------------------------------------------------------
 total:
 * wall-time:     0 d,  0 h,  0 min,  3.896 sec
 *  cpu-time:     0 d,  0 h,  0 min,  3.895 sec
 * ratio c/w:     1.000 speedup
 SCF:
 * wall-time:     0 d,  0 h,  0 min,  3.325 sec
 *  cpu-time:     0 d,  0 h,  0 min,  3.325 sec
 * ratio c/w:     1.000 speedup

